post_id,author,title,body,image,image description
gs6jkf,Woujo,method; improve; confidence,article; describe; plan; increase; confidence; plan; consists; three; technique; decreasing; order; preference; train; subconscious; mind; opportunity; success; previously; threat; feel; anxiety; learn; articulate; face; anxiety; learn; ignore; anxiety; technique; best; technique; work; move; technique; technique; work; move; technique; think; technique; need; done; order; ignore; anxiety; articulate; face; miss; valuable; information; important; thing; need; know; confidence; mostly; fake; fake; mean; based; rational; reason; confident; people; think; succeed; rational; reason; think; succeed; faith; obviously; help; faith; backed; rational; reason; sometimes; rational; reason; need; faith; confidence; anxiety; subconscious; mind; confidence; intellectual; element; emotional; element; word; confidence; feeling; belief; succeed; whatever; purpose; pursuing; whether; brushing; teeth; building; business; pursuing; woman; anything; else; opposite; confidence; anxiety; feeling; fail; pursuing; purpose; threat; obstacle; block; path; generating; intellectual; aspect; confidence; much; easier; generating; emotion; generate; intellectual; confidence; need; analyze; fact; possession; formulate; plan; fact; clearly; indicate; succeed; confidently; soldier; ahead; fact; clearly; indicate; fail; decide; something; else; certain; right; thing; fact; uncertain; like; situation; confidently; soldier; ahead; collect; additional; fact; tell; whether; keep; going; something; else; decide; confidently; risk; failure; fact; uncertain; think; failure; difficulty; generating; confidence; however; getting; subconscious; mind; generate; feeling; confidence; subconscious; mind; generates; emotion; based; complex; analysis; data; available; intellectual; analysis; often; relatively; unimportant; piece; data; subconscious; mind; subconscious; mind; feel; like; succeed; chosen; purpose; based; calculation; feel; energized; excited; focused; single; minded; determined; body; language; tone; voice; demeanor; become; confident; person; need; read; book; website; tell; confidently; naturally; feel; confidently; subconscious; mind; evolved; recognize; confidence; people; know; confident; suitcase; million; dollar; trashcan; across; street; knew; fact; obstacle; going; grabbing; suitcase; would; confidently; grab; would; vigor; excitement; would; timid; anxious; care; anybody; thought; think; much; distracted; worry; wrong; thing; would; hand; subconscious; mind; feel; like; threat; goal; pursuing; better; goal; could; pursue; feel; anxious; anxiety; freeze; force; reassess; path; seized; anxiety; feel; timid; energy; stressed; like; something; preventing; moving; mind; switch; rumination; mode; cycling; distraction; doubt; trying; figure; next; seized; anxiety; subconscious; mind; constantly; create; excuse; pursue; goal; certain; fail; worry; people; think; deep; think; right; natural; automatic; response; conscious; brain; know; intellectual; level; right; path; subconscious; brain; think; wrong; thing; cripple; although; like; think; rational; intellectual; being; reality; rational; mind; relatively; weak; appendage; sits; much; larger; stronger; sophisticated; subconscious; lizard; mind; evolved; million; year; rational; mind; process; piece; information; time; attention; thing; subconscious; mind; process; hundred; thousand; piece; information; vast; array; internal; external; input; subconscious; mind; much; sophisticated; conscious; mind; generally; stronger; usually; get; another; human; primarily; emotional; being; controlled; subconscious; mind; subconscious; like; different; person; living; inside; completely; separate; desire; thought; fear; perception; conscious; mind; rational; mind; guide; tutor; subconscious; mind; deeply; changing; subconscious; mind; long; difficult; process; change; make; example; completely; turn; desire; food; subconscious; mind; subtly; influence; rational; mind; thought; often; make; rational; justification; emotion; generated; subconscious; mind; mean; process; called; confabulation; example; confabulation; would; alcoholic; justifying; drink; hurt; better; example; subconscious; mind; making; excuse; approach; beautiful; intimidating; woman; though; think; thinking; clearly; thought; actually; warped; subconscious; mind; worse; many; thought; never; reach; conscious; mind; subconscious; mind; block; understanding; anxiety; neurological; perspective; anxiety; thing; rather; alarm; subconscious; mind; detects; threat; alarm; hierarchically; arranged; sophistication; bottom; hierarchy; oldest; part; brain; periaqueductal; grey; generates; panic; case; immediate; threat; least; sophisticated; anxiety; alarm; designed; give; quick; imprecise; resolution; signal; sophisticated; part; brain; trying; figure; going; periaqueductal; grey; medial; hypothalamus; governs; sophisticated; response; threat; like; devising; plan; escape; medial; hypothalamus; sits; amygdala; generates; sophisticated; emotional; representation; threat; hierarchy; sits; frontal; cortex; rational; conscious; part; brain; sophisticated; layer; hierarchy; inhibit; lower; layer; creates; efficient; system; sensing; potential; threat; lower; level; immediately; alarm; checked; sophisticated; part; brain; sophisticated; layer; determine; potential; threat; benign; shut; alarm; generated; lower; layer; example; alone; apartment; night; hear; loud; noise; feel; startled; periaqueductal; grey; getting; ready; fight; flight; turn; around; sound; caused; book; falling; floor; sophisticated; part; subconscious; mind; realize; sensed; threat; real; threat; therefore; shut; alarm; inhibit; fight; flight; response; turn; around; murdered; apartment; sophisticated; part; subconscious; mind; realize; periaqueductal; grey; right; need; running; fighting; anxiety; circuit; generates; alarm; faced; uncertainty; multiple; competing; goal; remember; purpose; anxiety; help; figure; correct; path; anxiety; necessary; protect; threat; becomes; problem; conscious; sophisticated; part; mind; shut; alarm; alarm; merit; constant; alarm; make; feel; like; shit; stressed; timid; weak; crippled; unable; make; progress; towards; goal; energy; enthusiasm; paradoxically; anxiety; stop; making; progress; towards; goal; failing; collect; information; anxiety; want; collect; worst; anxiety; circuit; constantly; registering; false; alarm; none; exist; subconscious; mind; constantly; eliminating; possible; path; consideration; reach; conscious; mind; making; ever; fearful; person; anxiety; system; haywire; variety; reason; much; chaos; uncertainty; life; many; threat; alarm; going; conscious; mind; time; energy; individually; respond; alarm; alarm; persistently; stay; alarm; going; long; hijacked; conscious; mind; think; threat; real; conscious; mind; much; bandwidth; threat; coming; faster; respond; accumulate; general; sense; dread; everything; respond; thing; setting; anxiety; alarm; within; instead; choose; avoid; cause; subconscious; mind; assume; thing; really; threat; anxiety; ultimately; becomes; vicious; cycle; keep; getting; worse; worse; take; conservative; approach; safety; nature; cause; human; animal; active; anxiety; system; apparently; evolution; determined; better; false; positive; rather; false; negative; false; alarm; jungle; anxiety; wrongly; register; something; threat; miss; tasty; treat; false; negative; anxiety; miss; actual; threat; eaten; lion; much; worse; conservative; approach; anxiety; alarm; good; evolutionary; strategy; primitive; animal; active; anxiety; system; creates; real; problem; human; live; complex; society; many; threat; abstract; complicated; occur; year; future; training; subconscious; mind; opportunity; three; primary; method; train; subconscious; mind; opportunity; success; previously; threat; exposure; therapy; self; improvement; autosuggestion; exposure; therapy; best; train; subconscious; mind; feel; confident; pursuing; goal; actually; succeed; subconscious; mind; see; succeed; something; much; likely; generate; confidence; next; time; thing; example; people; feel; confident; succeed; brushing; teeth; successfully; brushed; teeth; many; time; past; expert; carpenter; feel; confident; carpentry; successfully; done; many; time; past; subconscious; mind; base; confidence; analogous; data; example; novel; situation; subconscious; mind; think; never; faced; situation; exactly; like; successfully; faced; similar; situation; past; previous; situation; similar; enough; make; feel; confident; succeed; situation; subconscious; mind; might; think; generally; succeeded; novel; uncertain; task; past; feel; like; pretty; competent; intelligent; strong; person; though; quite; faced; exact; situation; past; confident; succeed; feel; confidence; subconscious; mind; need; clear; road; finish; line; requires; generate; plan; routine; life; minimizes; threat; uncertainty; provides; clear; consistent; stream; win; pursue; goal; subconscious; mind; think; plan; created; difficult; win; remote; feel; unmotivated; need; adjust; plan; definition; make; make; win; feel; attainable; example; particular; task; plan; intimidating; subconscious; mind; generate; confidence; breaking; smaller; le; intimidating; task; subconscious; mind; feel; like; example; intimidated; prospect; writing; paper; start; opening; word; processor; typing; word; subconscious; mind; doubt; write; paper; know; type; word; feel; motivated; take; first; step; type; word; subconscious; mind; see; succeed; typing; word; feel; enough; confidence; type; sentence; forth; similarly; anxious; approach; woman; start; smaller; task; saying; asking; time; found; success; continually; humbling; categorizing; win; small; thing; provide; incremental; progress; incremental; step; quickly; similarly; therapist; often; recommend; exposure; therapy; common; cure; anxiety; self; improvement; self; improvement; boost; confidence; giving; subconscious; data; calculate; chance; success; want; subconscious; mind; think; person; rejected; rejected; time; part; reason; woman; love; shopping; make; feel; confident; buying; clothes; reprogram; subconscious; mind; think; people; like; course; rational; level; clothes; usually; enough; make; people; change; opinion; rational; analysis; matter; subconscious; mind; feel; confident; data; different; improve; many; way; including; lifting; eating; better; dressing; better; using; better; hygiene; learn; thing; article; point; make; motivate; pursue; purpose; like; would; motivate; anything; break; smaller; attainable; win; create; plan; routine; give; steady; stream; win; autosuggestion; delusion; self; help; guru; philosopher; mystic; long; known; reprogram; subconscious; mind; feeding; positive; data; form; affirmation; mantra; prayer; meditation; form; reprogramming; called; autosuggestion; suggesting; competent; strong; able; succeed; previously; felt; autosuggestion; work; must; consistently; tell; affirmation; long; period; time; repetition; necessary; subconscious; mind; need; data; change; opinion; chance; success; affirmation; must; detailed; connected; emotion; remember; affirmation; subconscious; mind; operates; emotion; whenever; negative; thought; pop; head; must; defeat; positive; thought; tangible; real; data; likely; subconscious; convinced; example; guru; therapist; often; tell; repeat; affirmation; loud; write; suggest; writing; fake; apology; letter; people; harmed; though; conscious; mind; know; letter; fake; subconscious; mind; often; tricked; feeling; better; daydream; fantasizing; visualizing; succeeding; particular; task; subconscious; mind; feel; confident; actually; performing; task; obviously; autosuggestion; much; weaker; reprogram; subconscious; mind; actual; success; subconscious; mind; evolved; reject; fake; data; saying; something; much; weaker; seeing; actually; happen; nevertheless; mountain; data; scientific; historical; anecdotal; suggest; fake; data; trick; subconscious; mind; generate; mental; state; religion; cult; superstition; work; principle; religious; people; often; feel; closer; result; subconscious; mind; think; master; universe; favor; spoke; magic; word; think; stupid; ever; cried; movie; thing; happened; strangest; manifestation; autosuggestion; people; start; believing; lie; knew; lying; beginning; tell; enough; time; subconscious; mind; start; believe; scammer; cult; leader; sometimes; fall; trick; government; public; relation; learned; make; people; crazy; thing; simple; repetition; autosuggestion; work; conscious; mind; must; board; word; know; succeed; conscious; mind; think; lying; autosuggestion; fail; confidence; combination; feeling; intellect; necessarily; need; believe; affirmation; think; false; autosuggestion; work; best; embark; uncertain; path; anything; happen; convince; feel; like; something; good; happen; autosuggestion; fails; lying; know; lying; articulating; facing; anxiety; despite; step; described; improve; confidence; still; feel; anxiety; certain; situation; data; demonstrate; subconscious; mind; succeed; data; seems; indicate; fail; faced; genuine; uncertainty; feel; anxiety; must; articulate; anxiety; word; rationally; determine; threat; subconscious; mind; sensing; take; deep; breath; step; back; exactly; afraid; happen; answer; question; need; think; deeply; brainstorm; immediately; obvious; rational; mind; subconscious; mind; feeling; anxiety; mere; articulating; anxiety; reduce; anxiety; transforms; vague; hazy; undefined; fear; mind; specific; manageable; threat; articulate; plan; actually; articulate; word; thing; afraid; often; realize; threat; scary; originally; felt; articulate; threat; word; face; formulate; plan; defeat; plan; might; keep; going; worry; threat; keep; going; thing; neutralize; threat; threat; real; substantial; take; another; path; event; plan; lead; goal; deal; threat; feel; confident; anxiety; circuit; necessarily; concerned; threat; exist; care; whether; plan; defeat; threat; therefore; feel; much; le; anxiety; voluntarily; confront; threat; rather; unexpectedly; come; articulate; threat; formulate; plan; defeat; sound; like; obvious; advice; people; follow; step; anxiety; remains; mysterious; hazy; unarticulated; realm; emotion; people; feel; anxiety; give; decide; something; else; examine; caused; anxiety; overcome; cause; feel; something; easy; feel; good; like; drug; alcohol; video; game; people; blindly; follow; anxiety; stay; safe; actually; often; work; cause; miss; many; opportunity; actually; could; overcome; threat; articulating; anxiety; often; terrifying; force; people; confront; weakness; afraid; approach; woman; threat; blocking; path; goal; shape; dressed; horribly; stupid; uninteresting; articulating; admitting; problem; painful; facing; anxiety; would; require; problem; easy; people; ignore; problem; leave; ether; need; think; admit; exist; many; guy; convinced; amazing; woman; afraid; approach; probably; fail; approaching; must; face; fact; actually; great; woman; defeat; anxiety; must; believe; actually; possible; create; articulate; plan; overcome; threat; word; must; believe; world; govern; rational; rule; understand; rule; rule; succeed; anxiety; becomes; crippling; obstacle; immovable; undefeatable; uninteresting; friend; suck; woman; imagine; actual; step; take; improve; never; ignoring; anxiety; quest; vanquish; anxiety; hero; performed; variety; exercise; train; subconscious; mind; longer; feel; anxiety; training; hero; sometimes; still; feel; anxiety; deal; articulating; facing; anxiety; nevertheless; articulating; facing; anxiety; anxiety; remain; usually; hero; faced; genuinely; uncertain; novel; situation; data; demonstrate; succeed; data; threat; actually; anxiety; almost; almost; completely; composed; fear; unknown; point; hero; option; left; ignore; anxiety; blindly; jump; unknown; could; started; article; saying; ignore; anxiety; fact; book; article; genre; ignore; anxiety; ignore; negative; thought; plow; ahead; always; work; anxiety; valuable; evolutionary; tool; exists; reason; ignore; deep; trouble; miss; opportunity; correct; behavior; coincidence; drug; reduce; anxiety; like; alcohol; marijuana; often; cause; stupidly; natural; alarm; system; protects; threat; turned; ignore; anxiety; trained; articulated; faced; word; ignore; anxiety; confident; nothing; valuable; otherwise; matter; much; repress; ignore; anxiety; part; worry; anxiety; right; nagging; feeling; actually; warning; real; threat; found; sometimes; ignore; anxiety; becomes; louder; probably; something; brain; sens; ignoring; anxiety; obviously; spend; every; moment; life; articulating; thinking; anxiety; particular; threat; need; articulate; face; anxiety; associated; threat; confidence; going; forward; example; approaching; woman; need; time; really; think; scary; rejection; minimize; threat; complete; exercise; longer; need; think; negative; effect; rejection; every; time; consider; approaching; beautiful; woman; faith; managing; anxiety; faith; live; infinitely; complicated; constantly; changing; universe; littered; infinite; threat; know; possible; think; face; articulate; every; possible; threat; simply; enough; time; mental; energy; therefore; need; general; faith; everything; going; think; respond; important; threat; exceed; certain; threshold; seriousness; particular; moment; wide; variety; terrible; thing; happen; could; struck; lighting; could; cancer; plane; could; crash; company; could; fail; fired; danger; technically; threat; likely; enough; worry; therefore; must; ignore; thing; worry; never; happen; might; never; worried; personal; life; follow; following; rule; ignore; threat; unless; compelling; reason; focus; attention; particular; threat; threat; consider; threat; minimally; threatening; possibly; given; data; focus; threat; time; unless; absolutely; must; spread; attention; multiple; threat; word; minimize; seriousness; threat; data; overwhelmingly; clear; otherwise; respond; anxiety; alarm; loud; shut; alarm; quickly; possible; approach; sound; unsafe; overly; risky; make; logical; sense; first; practical; matter; mental; ability; focus; respond; threat; time; anyway; particular; moment; choice; ignore; threat; except; serious; pertinent; one; spend; responding; threat; need; long; stretch; time; ignore; threat; completely; second; unless; concrete; data; particular; threat; real; imminent; dangerous; rational; reason; worry; third; facing; uncertain; situation; sure; seriousness; threat; must; whatever; data; example; invest; money; pretty; conservatively; though; individual; investment; uncertain; outcome; collected; enough; data; life; generally; know; investment; fail; business; plan; shit; people; overly; optimistic; business; invest; money; clear; reason; believe; venture; make; money; approach; work; need; homework; collect; data; face; threat; squarely; detect; collect; data; investing; ignore; whatever; threat; lose; money; every; time; ignore; threat; live; life; like; blissful; retard; ignore; focus; one; actually; matter; aftermath; course; situation; remains; uncertain; forever; sometimes; blindly; jump; novel; situation; fake; confidence; fail; every; time; fail; data; existing; issue; retrain; subconscious; mind; feel; confident; imagine; approach; woman; reject; people; take; data; evidence; always; fail; approaching; woman; stop; approaching; rejected; rationally; analyze; approach; figure; wrong; course; sometimes; clear; rejected; thorough; analysis; data; figure; happened; worry; always; assume; mistake; small; possible; imagine; wild; thought; terrible; unless; compelling; evidence; contrary; assume; nothing; wrong; website; woujo,-1,
gs5ift,twominutewonder,death; still; take; sperm,,-1,
gs4qjh,StatusEagle6,another; reason; cold; approach; social; circle; game; work; highest; smv; group,thought; share; guy; generally; online; dating; cold; approach; using; mode; approach; look; alan; roger; currie; long; haul; game; fit; currently; staying; cottage; third; time; past; couple; month; friend; girl; different; girl; stay; admittedly; highest; smv; look; wise; asian; average; face; trip; noticed; something; girl; acknowledged; guy; would; basic; question; normal; conversation; example; would; drinking; around; bone; fire; everyone; talking; conversation; rolling; highest; smv; make; comment; joke; ramble; girl; like; interesting; thing; world; laugh; hysterically; joke; question; agree; lower; smv; try; join; conversation; get; ignored; conversation; go; back; focusing; highest; smv; would; chime; conversation; like; talking; wall; anything; get; quick; close; ended; response; literally; ignored; girl; happen; noticed; happening; guy; except; best; looking; one; first; cottage; trip; thought; hanging; bunch; social; inept; girl; right; starting; pattern; anyways; thought; share,-1,
gs4o8p,FearlessPizza6,cock; stare,,-1,
gs4nyp,FearlessPizza6,cock; stare; explained; redpillcoach,look; woman; gotten; back; blow; many; time; everything; inside; numb; watch; video; listening; explains; pill; coach; cock; stare; letussee; watch; cock; stare; vyltiku; html,-1,
gs1dzx,Sake99,look; sympathy; empathy; woman,earlier; post; tube; asking; girl; make; feel; tinder; dating; world; know; remind; everyone; following; woman; care; struggle; pick; finish; line; born; ugly; give; fuck; girl; period; give; shit; woman; bleed; month; hell; tinder; dating; apps; give; impression; wanted; look; hell; valued; power; status; frame; look; tinder; made; look; guy; rarely; beautiful; decent; know; guy; like; omer; borkan; bradd; pitt; rare; woman; hand; good; looking; majority; nature; maintaining; balance; woman; emotional; ruin; thing; made; affair; make; empire; scratch; youtube; asks; girl; truth; already; breaking; nobody; talk; fight; club; need; woman; affirm; truth; believe; reason; believe; creature; change; mind; throughout; damn; give; break; share; problem; crave; solution; emotional; junky; problem; away; made; someone; feel; felt; woman; leave; matter; decided; woman; power; money; status; struggle; reach; goal; woman; last; thing; radar; care; hole; different; face; fucking; special; trying; cope; inner; void; work; fill; avoid; read; book; take; therapy; needed; hate; woman; opportunistic; nature; looking; mother; longer; post; like; others; point; peace,-1,
gs10dq,jpnotmorgan7,truth; assertiveness,,-1,
gs0mzx,saeahf,page; delusional; loser; beta,,-1,
grzfhx,N1NJA_HaMSTERS,year; turned; open; relationship; gone,,-1,
