post_id,author,title,body,image,image description
ca1odo,Sac_fo_dayz,cocktail; stuff; trying; strike; balance; think; help; journey; alpha; rock; confident,evening; fella; hope; guy; self; improvement; going; great; wanted; touch; something; often; sentiment; like; like; factor; deciding; factor; making; alpha; sentiment; seen; echoed; across; post; gentleman; dismissed; certain; hobby; outright; blue; pill; beta; exception; life; fair; would; like; state; said; sentiment; fair; either; automatically; branded; beta; like; attitude; whether; rock; confidence; always; backbone; philosophy; making; better; mean; owning; like; part; building; frame; alpha; guy; know; addition; pastime; hobby; appeal; woman; like; thing; would; initially; make; scratch; head; given; appearance; acquaintance; mine; addition; boxer; anime; fanatic; wear; shirt; lift; part; owns; badass; hate; catch; right; hook; ripped; guy; play; world; warcraft; downtime; enjoy; following; boxing; couple; month; love; running; played; fiddle; year; rusty; hell; need; pick; back; learning; language; chinese; spanish; proficient; quite; fluent; marksmanship; year; experience; platform; passionate; following; theater; show; couple; year; loved; video; game; stripe; server; month; college; drinking; buddy; magic; gathering; granddaddy; neckbeard; hobby; admittedly; favorite; pastime; shooting; exercising; couple; year; account; huge; nerd; weird; cocktail; interest; hobby; people; meet; bar; look; clean; like; frat; banker; nerd; know; look; place; wiping; floor; magic; tournament; grooming; attire; work; wonder; folk; guy; gal; know; boxing; would; never; guess; like; shit; enjoy; told; closest; buddy; knew; collegiate; business; organization; tailgating; played; magic; theater; double; take; like; whaaaat; taught; play; like; hide; nerdy; interest; girl; dated; passionate; something; shit; concede; point; girl; given; initial; attention; athletic; gun; spoke; foreign; langauges; story; global; travel; still; need; cool; stuff; dude; ultimate; point; need; strike; balance; fellow; geek; every; nerdy; hobby; need; badass; hobby; counterbalance; lift; fight; something; involves; outside; find; sophisticated; hobby; never; ashamed; like; make; desirable; like; truly; multi; faceted; confident; like; hope; geek; believe; guy; throw; glove; come; find; round; magic; kick,-1,
ca1jwt,Dumbo321,epiphany; social; interaction,thing; recently; realized; social; interaction; person; ability; make; someone; feel; thing; look; back; time; bought; shirt; pant; haircut; anything; someone; probably; complemented; look; clothing; leaving; feeling; quite; good; guess; ability; frequently; practised; people; high; value; self; worth; applies; dating; every; relation; ability; make; someone; feel; happy; feel; valued; feel; feel; weirded; feel; sexy; feel; loved; people; interact; direct; consequence; make; feel; merely; canvas; people; paintbrush; stroke; different; colour; strive; paintbrush; painting; people; canvas; making; feel; certain; ultimately; separate; social; stallion; social; dweeb,-1,
ca0azh,ChatoChato,twitter; female; claim; paternity; fraud; blessing,,-1,
c9ypwt,BeanNCheeze,improve; themself,,-1,
c9y30d,ThePriorityBike,guy; branch; swinging; le; effort; shot,,-1,
c9xtcz,dev_corvus,deepnude; open; source,,-1,
c9wbdn,IncitingDramah,inner; game; inner,recent; post; spurred; make; post; said; talk; inner; game; love; hero; arent; hero; struggle; frame; want; simply; weak; thought; inner; dialogue; reality; mentality; animal; savage; principle; strength; value; action; action; dictated; emotion; desire; consciously; fortify; iron; adherence; heroic; existence; ruthless; self; control; masterly; controlled; action; creation; strength; necessary; competency; create; know; conquer; call; go; stand; send; look; step; front; lead; hold; bridge; take; hill; breach; line; charge; battle; like; running; without; impediment; carry; victory; work; enemy; ground; destroy; anything; infront; crush; enemy; annihilate; everything; stop; nothing; left; pursue; left; bury; relentless; wont; second; push; pace; push; tempo; acend; olympus; conquer; world; first; conquering; mentality; incitingdramah; value; garbage; must; prove; value; teach; wield; colossal; personal; power; caught; chasing; pussy; waste; goal; atlas; hold; world; shoulder; mentality; help; build; iron; solid; frame; help; develop; purpose; mental; point; origin; confidence; come; accomplishment; confidence; trash; would; anyone; else; confident; attack; fear; never; become; slave; self; mastery; change; everything; never; change; world; change; amount; despise; leading; astonishing; leader; embrace; responsibility; world; shoulder; emotional; mastery; stripe; ability; others; control; wield; power; conclusion; born; made; forged; battle; life; sculpted; ruthless; self; discipline; inflict; always; burden; performance; preform; anyone; realize; life; easy; soft; flabby; faggot; conquer; fucking; world; slay; dragon; iron; temple; ritually; lift; weight; prayer; zeus; step; tension; discomfort; fear; forage; inside; ever; taken; bride; eating; cheetos; playing; video; game; embrace; olympic; hero; within; watch; world; fall; place; excellence; success,-1,
c9vzxk,Prick1992,powerful; mind; game; girlfriend; play; thought; interesting; wondering; guy; thought,,-1,
c9vker,MoonTurtle,walk; hairdresser; salon; full; bored; girl,working; daily; make; cold; approach; attractive; woman; care; lead; anywhere; want; grow; comfortable; maintaining; frame; happens; naturally; basically; zero; expectation; walk; around; city; looking; woman; approach; find; someone; look; lost; pretty; approach; asking; want; empty; water; bottle; speak; native; language; switch; english; speak; english; either; stare; face; presenting; empty; water; bottle; raise; palm; towards; proceeding; abruptly; walk; away; smile; face; continue; stroll; salon; bored; woman; customer; walk; start; asking; help; tinder; profile; first; rejected; knowing; tinder; want; help; boyfriend; hottest; asked; preference; regarding; attractive; told; find; boyfriend; attractive; simply; stare; face; couple; second; really; trying; transition; everything; back; customer; hairdresser; instead; woman; various; method; swipe; tinder; together; small; talk; another; girl; try; attention; something; said; bored; tell; going; leave; find; girl; hook; tell; report; back; ignore; take; walk; around; block; back; look; store; simply; pas; ignoring; everyone; someone; call; name; enough; back; girl; uncomfortable; continue; talking; besides; hottest; desperate; like; hierarchy; follow; unconsciously; proceed; reminds; boyfriend; insist; allow; meet; people; friend; say; swear; contact; intense; interrupted; really; tried; break; frame; various; question; never; anything,-1,
c9vau4,Gr4nd45,hypergamy; real; apply; woman,,-1,
c9v1l5,Das_Teacher,lurker,,-1,
c9u0q1,Obio1,joined; quarantine; bullshit,,-1,
c9qgry,RPDream,joyce; meyer; hypergamy,,-1,
c9q7j4,olinvomibo123,actor; geoffrey; rush; win; metoo; defamation; case,,-1,
c9q146,otfGavin,,,-1,
c9pq1z,schmevepoobly,porn; ruin,,-1,
c9pkwa,whatspizza,young; woman; vapid; insecure; stop; intimidated,going; start; saying; early; oneitis; thought; found; love; life; honest; kind; terrible; perception; clouded; whatever; wanted; anyway; past; early; live; major; city; male; friend; much; younger; often; invited; mixer; party; oldest; love; tonight; invited; rooftop; pool; party; swanky; condo; building; definitely; oldest; person; preface; saying; tall; super; built; make; money; said; easy; talk; year; woman; make; think; knee; minute; talking; woman; ranged; realized; something; kind; boring; expected; propel; conversation; went; back; swiping; tinder; instagram; easier; average; looking; girl; overweight; laid; trust; many; internal; doubt; likely; stop; letting; intimidate; decently; full; life; dominated; netflix; happy; hour; farther; along; brother,-1,
c9oqxl,Brushyourteethm8,emotional; baggage; releasing; negative; emotion,emotional; baggage; weighs; heavy; always; considered; chilled; stressed; easily; tackle; situation; force; overcome; internal; resistance; would; flexible; strong; take; burdoning; pressure; stress; able; bottle; bury; panic; attack; year; back; sure; number; factor; main; issue; accumulation; stress; became; pressure; cooker; huge; paradigm; shift; recently; watching; thefearlessman; youtube; talk; grounding; releasing; basically; thought; head; emotion; felt; stored; body; tension; realised; negative; sometimes; painful; memory; still; holding; negative; emotion; unaware; explored; turn; bottled; carried; unhelpful; shit; throughout; life; part; buried; spending; mental; energy; interaction; suppress; working; releasing; negative; emotion; daily; basis; noticed; enormous; benefit; within; first; alone; example; last; weekend; still; felt; embarassed; handled; interaction; work; several; week; back; pandered; somebody; made; completely; lost; frame; felt; humiliated; since; carrying; essentially; hamster; whenever; come; mind; attempt; bury; shame; embarassment; would; play; mind; whenever; coworker; bos; time; would; fighting; instinct; compromise; behaviour; submissively; fear; would; feel; ashamed; angray; humiliated; interaction; became; frosty; would; almost; aggressively; assertive; defense; done; favour; releasing; simple; concept; basically; work; noticing; negative; feeling; come; catching; fighting; arguing; justifying; trying; distract; bury; instead; welcome; negative; feeling; body; really; feel; much; allow; simply; amplify; trigger; memory; accompanying; feeling; feeling; truly; present; within; without; fought; feeling; little; emotion; fickle; fleeting; meant; felt; allow; fully; happen; soon; disipate; amazed; amount; shame; guilt; anger; fear; able; stopping; constantly; fighting; subconsciously; simply; letting; exist; unopposed; body; second; seeing; release; method; painful; first; cringed; hard; point; physically; squirming; almost; tear; time; felt; immense; levity; releasing; last; apparently; time; tell; know; much; relaxed; around; bos; coworker; shared; laugh; last; week; review; event; question; objectively; without; negative; feeling; attached; hindsight; think; remember; incident; several; week; back; suddenly; withdrew; guarded; ever; since; processing; still; felt; better; week; year; reading; youtube; fearless; read; sedona; method,-1,
c9oooq,OneTrueQ,life; constituent; pill; case; study; take; look; pick; apart; discussion; fodder,,-1,
c9nwy7,Kratz177,pua; coach; scam; guy; guide; insider; bootcamps; immersion; waste; money; time; evidence; inside,guy; assistant; three; different; pua; coach; vega; impression; pua; coach; canada; europe; operate; similar; game; year; want; anything; want; share; learned; fence; investing; huge; amount; time; money; game; aware; worth; time; advice; become; hopeless; explain; actually; girl; free; anything; guide; pua; coach; operate; pua; coach; put; video; youtube; regurgitate; ready; made; advice; already; available; tweak; advice; feel; good; make; hyper; excited; product; next; step; next; build; following; realize; many; video; actually; camera; worked; fourth; pua; coach; told; video; mattered; mattered; build; following; making; video; fake; infield; footage; simply; heavily; edit; infield; instance; set; nobody; set; best; actually; pretty; easy; since; girl; give; number; matter; easiness; girl; tourist; older; woman; simply; give; number; hurry; breakdown; infield; footage; commenting; obvious; thing; people; highly; impressionable; assume; good; built; following; start; offering; bootcamps; student; phone; call; tell; bootcamps; sold; make; exception; give; last; spot; tell; never; problem; unless; follow; tell; coach; terrible; last; hope; stay; chance; happens; student; doubt; tell; student; crushing; girl; tell; traveling; world; uruguay; next; week; cancun; last; week; prague; tell; really; care; pick; bootcamp; missing; student; interested; paying; actually; getting; laid; mean; highly; discourage; tell; loser; real; alpha; cold; approach; pick; hang; strip; club; goal; must; always; lure; away; actually; getting; laid; personal; take; guy; free; want; want; learn; game; contradiction; hurt; pua; coach; since; getting; laid; disencouraged; pua; coach; happens; student; pay; attends; bootcamp; done; student; highly; impressionable; people; dare; pushover; meeting; pua; coach; question; anything; simply; follow; made; pua; coach; worked; would; student; tell; worst; actually; lower; self; esteem; make; take; lesson; student; result; result; mean; laid; actually; make; drunk; girl; copping; feel; would; going; waste; time; student; result; keep; coming; back; reason; self; esteem; seek; approval; pua; coach; falsely; believe; hopeless; therefore; pua; last; hope; regular; student; next; hire; model; appear; photo; video; pua; cheap; craiglist; telling; photographer; girl; shoot; free; portafolio; photographer; videographers; agree; pua; coach; hire; model; video; actually; seen; live; small; pua; hired; model; show; bootcamp; clearly; fake; student; extremely; naive; believed; unfortunately; american; puritan; culture; deny; money; get; girl; simple; offer; girl; buck; stay; whole; shooting; many; video; want; girl; apear; video; meager; amount; money; happens; student; immersion; training; paid; money; hire; escort; sleep; student; uncommon; hire; escort; student; seen; girl; magically; showed; group; five; student; took; girl; home; banged; clearly; professional; pua; escort; multiple; escort; website; like; eros; pua; coach; offer; girl; sleep; student; girl; meet; club; student; approach; willing; come; come; footage; student; girl; probably; escort; girl; tourist; milfs; easiest; girl; pua; tourist; milfs; come; place; offer; drug; alcohol; offer; girl; cocaine; come; view; afterwards; escalate; difficult; know; pua; like; woman; think; pua; like; money; money; woman; believe; cold; approach; work; believe; mostly; waste; time; money; cold; approach; scam; girl; america; ltiple; way; none; ever; taught; pua; since; commercial; sell; advice; since; sketchy; happens; society; kept; downlow; become; club; promoter; tell; girl; treat; differently; average; looking; becoming; promoter; laid; irish; female; friend; girl; pretend; friend; bring; girl; apps; tinder; cause; terrible; unicorn; girl; place; pretend; rich; sugar; dating; website; trick; sugar; baby; seen; pua; coach; stand; outside; club; offer; girl; cocaine; come; place; place; high; escalate; video; camera; make; sure; consensual; biggest; learning; experience; taken; pua; le; skill; tricking; girl; making; logically; agree; seems; counterintuitive; however; truth; biggest; advice; would; give; guy; pua; industry; first; realize; pua; industry; business; first; foremost; like; business; main; drive; result; rather; make; money; called; redpill; advice; might; offer; filter; commercial; thereby; appropriate; sell; online; hurt; business; biggest; advice; would; give; guy; pua; community; alot; guy; issue; mean; issue; social; people; female; friend; none; male; friend; trying; like; superhero; player; night; nerd; actually; happens; life; caught; every; night; still; nerd; club; biggest; mistake; guy; make; dealing; girl; assume; girl; intelligent; girl; actually; smart; girl; form; actually; quite; simple; figure; treat; like; child; flake; like; leaf; wind; treat; girl; like; child; next; strategy; unfortunately; sell; shot; believe; simply; could; forever; final; word; biggest; lie; pua; tell; need; good; woman; choose; girl; like; agree; girl; like; really; need; isolate; escalate; course; consensually; uber; drink; place; drunk; together; make; love,-1,
c9mqw3,reddituser496590,catfished; girlfriend,untrusting; person; paranoid; always; reserve; possibility; betrayal; although; didnt; display; redflags; mildly; curious; would; respond; private; decided; conduct; experiment; created; fake; instagram; messaged; first; conversation; joking; getting; know; eventually; started; insert; subtle; sexual; joke; objection; laughed; along; point; enough; evidence; break; show; intolerant; disrespect; redflags; slowly; started; make; sexually; explicit; conversation; straight; talking; date; implied; experiment; concluded; relationship; year; long; appears; conservative; reserved; compared; average; western; woman; relationship; appeared; healthy; compared; disaster; guy; shortage; heavily; respected; word; shared; paying; bill; desired; lot; attention; sure; people; comment; saying; must; major; flag; missed; wasnt; redpill; enough; perhaps; right; doubt; good; thing; gained; companionship; didnt; money; status; moment; dont; feel; anger; sadness; though; simply; surprised; despite; redflags; guess; numb; story; read; online; woman; acting; terribly; relationship; feel; disappointed; disappointed; woman; display; redflags; still; liable; cheat; right; opportunity; come; along; already; didnt; trust; woman; trust; le,-1,
c9makg,trueliberal1,awalt; arab; country,,-1,
c9l0an,Researcher707,feminist; know; woman,,-1,
c9jlds,sea_light_house,open; calling; name; reddit; leftist,,-1,
c9hdts,draculamuffins,buddhism; pill; craving; avoiding,,-1,
c9f7ea,TheRealMewt,insecurity; woman; still; know; fuck; want,currently; thread; sitting; front; page; askreddit; titled; girl; reddit; something; guy; feel; insecure; time; posting; accrued; score; serf; highlight; lost; sexual; identity; western; world; gotten; asking; opposite; experience; whatsoever; capacity; learned; meme; urself; fairy; tale; male; tell; golden; ticket; getting; girlfriend; like; going; style; reply; showing; listening; woman; want; idea; sitting; making; scrapbook; cry; balding; getting; chubby; growing; moobs; possibly; growing; beard; tiny; dick; solve; rubik; cube; save; life; lady; sound; like; kind; woman; want; sound; like; drowning; pussy; never; worry; catching; wife; bos; woman; saying; worry; kind; shit; ever; getting; false; idea; every; undesirable; trait; still; desirable; insecurity; natural; look; fellow; every; size; good; however; example; might; never; super; jacked; like; olympia; contestant; world; class; athlete; still; proper; diet; exercise; look; feel; like; million; buck; quirk; long; develop; dozen; awesome; character; trait; positive; whatever; woman; bubble; time; maybe; manlet; maybe; fuck; like; chocolate; dick; cum; money; fuck; tall; point; there; difference; merely; insecurity; handle; shit; could; insecure; woman; like; spin; wheel; wondering; woman; flocking; could; take; good; long; look; holding; back; honestly; shit; sidebar; great; place; start; getting; shape; proper; grooming; holding; frame; positive; environment; go; much; longer; woman; tell; okay; like; woman,-1,
c9esph,unkg,beware; bottomless; giving; fuck; extreme,used; emotional; beta; cuck; usually; reacted; thing; like; bitch; period; full; emotional; response; especially; came; woman; resulted; hurt; anger; disappointment; naturally; coping; mechanism; turned; complete; detachment; feeling; protect; discovered; discovered; thing; started; making; sense; giving; fuck; coping; mechanism; amplified; went; caring; much; becoming; robot; barely; make; care; want; always; detached; always; like; stranger; looking; inside; life; double; edged; sword; thing; helped; woman; thing; destroyed; inside; want; share; really; beware; bottomless; giving; fuck; extreme; careful; becoming; robot; complete; detachment; feeling; desirable; outcome; advertised; great; thing; know; personal; reaction; coping; mechanism; come; life; woman; someone; wished; longer; want; someone; read; frequently; post; time; learning; give; fuck; need; tread; carefully; walk; path; need; make; sure; kill; inside; process; know; many; people; comment; saying; result; giving; fuck; explanation; however; believe; truly; stop; giving; fuck; become; like; robot; people; often; give; fuck; give; fuck; certain; thing; truth; truly; would; desirable; made; become; like; completely; detach; feeling; protection; alive; instead; care; enough; lose; logic; knowledge; shit; hit,-1,
c9erlh,ThePigmanAgain,male; privilege; load; shit,,-1,
c9e4lw,renaultcliodriver,rant; care; much,care; much; potentially; cheating; boundary; like; enough; self; respect; walk; away; deserve; everything; doormat; supposed; walked; going; like; going; rain; rain; find; shelter; umbrella; stop; raining; cheat; life; look; back; going; care; wear; certain; thing; coming; home; fucking; good; issue; case; clothes; would; issue; anyway; go; beyond; woman; want; attention; people; like; cristiano; ronaldo; like; instagram; full; male; model; showing; look; nice; especially; compliment; attractive; woman; side; look; care; hang; friend; influence; male; male; friend; emotional; tampon; soaking; everything; otherwise; shut; time; get; around; simply; reassure; calm; manner; sorted; solution; based; approach; female; friend; influence; simply; tell; great; time; earlier; something; going; happen; going; happen; care; drama; emotional; outburst; entertain; like; bitch; soaking; gritty; lose; control; force; dramatic; emotional; flaw; design; nature; intended; bitch; flaw; instead; either; ignoring; giving; look; brushing; swiftly; show; moved; allow; suckered; blame; list; could; forever; care; honest; care; much; insecure; little; bitch; protecting; bullshit; want; acceptance; validation; real; born; kill; actually; time; real; flag; brainwashed; society; caring; much; shit; matter; keep; thing; flux; like; woman; brainwashed; give; future; child; career; paying; tax; others; kid; brainwashed; thinking; love; anything; marketing; buzzword; brainwashed; thinking; traditional; family; home; must; child; raising; ready; become; father; like; anyone; brainwashed; thinking; monogamy; brainwashed; eating; certain; food; natural; food; brainwashed; self; genocide; condom; pursuit; invented; bullshit; american; dream; pump; dump; thinking; winning; people; winning; stressful; city; mean; tax; material; shit; fucking; matter; take; grave; commit; self; genocide; evolutionary; lineage; dy; brainwashed; care; reality; living; nature; fucking; whoever; eating; natural; food; savage; killing; survive; suffering; hardship; trying; survive; brainwashed; thinking; better; civilised; animal; thanks; test; brainwashed; parent; telling; special; education; system; giving; letter; grade; title; think; form; important; looking; flag; woman; looking; flag; resolve; flag; flag; woman; simply; fucking; matter; anymore; simple; reality; pill; nothing; death; coming; term; naturally; actually; brainwashed; acting; drone; society; want; must; time; become,-1,
c99bjm,Kratz177,pua; self; improvement; coach; scammer; evidence; inside,guy; learning; pua; year; honest; assessment; want; anything; want; plug; product; want; fall; scam; waste; year; life; hope; spread; word; become; hopeless; conclude; impossible; laid; black; pill; another; circle; jerk; contrary; know; easy; easiest; laid; become; insider; easiest; insider; become; club; promoter; laid; america; become; insider; club; promoter; became; club; promoter; week; laid; think; anything; special; rather; knew; leverage; make; female; friend; introduce; friend; learn; pua; self; improvement; guru; pua; businessmen; interested; making; money; like; woman; pua; tell; worst; actually; pua; genuinely; people; pua; laid; pua; stage; footage; pua; result; pua; cult; leader; brainwash; tyler; worst; offender; make; student; weird; trial; feel; guilty; thing; might; pick; trick; help; succeed; woman; waste; time; pua; guy; self; improvement; industry; girl; pretend; girlfriend; appear; video; girl; seeing; told; offered; appear; video; pua; hooker; sleep; student; student; better; despite; year; training; getting; better; stop; pua; start; clever; deal; woman; adressing; anyone; write; bitter; since; result; getting; laid; regularly; following; pua; advice; thing,-1,
c97tlx,avengeance,person; online; coaching,,-1,
c954t3,Theorymeltfool1,work; hard; date; worth; find; someone; eventually; happy,past; year; dating; become; increasingly; worth; seen; significant; career; growth; whatever; reason; successful; woman; meet; either; believe; seem; upset; make; money; example; interested; woman; make; significantly; le; eventually; subsidizing; lifestyle; thing; enjoy; like; going; vacation; wind; costing; twice; much; afford; plate; spinning; take; much; time; rather; making; money; working; career; going; multiple; date; week; easier; college; could; dive; bar; house; party; guy; range; please; keep; people; range; woman; expect; date; event; take; time; money; want; laid; bumble; tinder; something; generally; speaking; want; last; long; odds; meeting; someone; successful; pretty; much; zero; become; burden; example; dentist; smart; attractive; girl; really; family; oriented; eventually; told; failed; undergrad; switched; major; make; several; date; kept; asking; believe; said; patriarchy; fuck; went; league; college; dental; school; student; loan; executive; great; girl; really; smart; younger; already; really; good; business; career; appalled; left; company; worked; currently; believe; higher; salary; like; whatever; young; matter; good; thing; high; earner; lot; together; think; wanted; date; someone; could; control; interested; influencer; putting; comparison; girl; instagram; model; influencer; always; talked; way; follower; basically; wanted; thing; looked; good; profile; knew; would; trainwreck; figured; might; guy; fantasize; type; relationship; seriously; delusional; idea; go; behind; scene; yeah; super; cautious; want; accidentally; girl; pregnant; stuck; gold; digger; worth; professional; industry; event; maybe; meet; good; woman; happy; successful; sink,-1,
