post_id,author,title,body,image,image description
ggu1t6,kollegah1337,woman; love; asshole; alternate; view; trpmilo,posted; trpmilo; theredarchive; author; trpmilo; february; mine; finished; reading; damn; satisfied; theory; thought; would; good; post; since; posted; year; redpiller; view; woman; love; asshole; ready; developing; theory; think; might; thinking; topic; sexually; attracted; trait; woman; fully; observable; first; meet; physical; beauty; woman; sexually; attracted; trait; partially; observable; first; meet; social; status; confidence; mean; dating; imagine; world; trait; find; attractive; woman; partially; unobservable; specifically; pretend; woman; walk; around; full; burqa; street; public; otherwise; like; western; woman; woman; overweight; otherwise; tell; date; though; underneath; woman; relatively; experienced; dated; shown; underneath; burqa; thus; woman; know; smv; market; value; approach; woman; street; look; decently; shape; think; might; attractive; receptive; approach; kind; sweet; seems; excited; date; think; shit; girl; probably; ugly; approach; another; girl; see; cold; standoffish; think; awesome; girl; probably; better; harder; world; woman; live; meet; really; tell; attractive; rely; behavior; tell; le; interested; option; think; attractive; think; must; treat; like; dirt; think; must; gift; woman; later; find; whether; really; quality; looking; burqa; coming; want; keep; girl; point; better; alpha; behavior; implies; point; behavior; credit; trpmilo,-1,
ggrwst,jessiebellanger,wonder; many; since; supposed; avoid,,64,metow; challangal; emake; post; hour; rust; usthey; talking; rain; sponsored; anti; feminist; community
ggrkhq,maskci,sati; legitimate; forget; pinv,,65,
ggq11j,russian_niggeeer,high; count; long; term; relationship; pill; truth; plate,plate; mine; confirmed; pill; truth; high; count; resulted; single; meaningful; long; term; relationship; wanted; always; read; posted; many; time; high; count; woman; rarely; lead; meaningful; bonding; long; term; relationship; time; heard; horse; mouth; plate; quick; story; girl; turned; plate; everyone; favorite; toilet; pastime; tinder; fucked; total; time; within; day; life; relative; whatever; anyway; right; smashed; second; time; backseat; heart; heart; getting; emotional; telling; past; experience; spinning; hamster; overdrive; tell; thing; past; went; slut; phase; meanwhile; tinder; profile; still; state; something; like; looking; many; guy; care; society; think; sexually; liberating; way; attachment; issue; shocker; hit; think; hold; asked; give; especially; since; already; smashed; say; really; like; attracted; feel; special; connection; fuck; proper; first; time; fella; afraid; would; stick; around; long; think; since; literally; sucked; minute; hard; rock; want; stop; hamster; burning; salvage; situation; think; agree; unique; connection; together; sexually; anyway; go; telling; never; really; meaningful; relationship; another; shocker; short; lived; sexual; nature; fling; would; disappear; month; would; attached; easily; especially; great; thought; become; self; aware; nope; point; said; profile; state; looking; time; replied; something; like; somehow; particular; relationship; different; feel; closer; replied; talking; serious; relationship; stage; premature; barely; know; time; tell; getting; closer; another; important; thing; told; definitely; great; since; infatuation; stage; normally; happens; people; first; hook; attached; feeling; look; thing; practical; standpoint; seemed; calm; spin; hamster; conclusion; good; business; obviously; want; pill; talk; banging; every; meet; healthy; build; sort; long; lasting; bonding; relationship; since; would; take; year; unpack; fully; never; want; talk; since; usually; backfire; plenty; post,-1,
ggpv19,gbalme,would; responded,,-1,
ggos8h,Not_Warren_Buffett,sure; fire; sign; wife; beautiful; refer; beautiful; wife,,-1,
ggo05i,Vermont_Pirate,disposable,,66,sexy; decoy; danaclovesyyou; imagine; arguing; want; treated; could; replace; somebody; treat; want; treated; disposable; retvcats; like
gglxnz,FrenCan316,build; life; bottom,started; writing; asktrp; post; became; overdeveloped; topic; hand; brief; question; following; think; best; money; idea; mind; year; solo; travel; whilst; working; abroad; working; holiday; visa; style; spent; invested; business; idea; dropshipping; spent; gaining; qualification; potential; future; career; personal; training; course; take; another; degree; answer; build; life; bottom; abstract; goal; fairly; generic; decision; making; question; people; waste; enormous; amount; time; trying; achieve; ideal; abstract; long; term; form; success; instagramable; form; success; thing; like; rich; famous; universally; validated; peer; thing; abstract; ideal; long; timeframe; make; decision; achieve; abstract; long; term; goal; trying; build; life; approach; basically; impossible; setting; failure; tree; life; think; imagine; decision; making; carefully; documented; family; tree; like; graph; every; decision; make; creates; branch; path; documented; universe; timeline; created; decision; making; tree; becomes; infinitely; complex; quickly; branch; decision; making; sequence; lead; final; form; success; mind; life; infinitely; complex; rarely; level; control; necessary; guide; precise; point; long; term; proof; statement; virtually; nobody; look; back; year; say; knew; back; would; today; everyone; think; work; like; direction; achieve; success; successful; people; build; life; career; bottom; unconcerned; unfettered; credentialism; overeducation; pointless; degree; pseudo; entrepreneurialism; garbage; business; shit; advertised; bottom; people; primarily; focus; imminent; problem; experience; using; solution; based; approach; long; term; method; yield; compounding; success; basic; business; formula; solve; major; problem; short; medium; term; long; term; likely; become; rich; bottom; approach; applies; much; life; business; career; first; dragged; wanted; look; like; arnold; year; abstract; long; term; goal; kept; going; addicted; endorphin; short; term; peer; started; noticing; commenting; result; medium; term; started; getting; pussy; short; medium; term; forgot; arnold; thing; month; endurance; training; watched; tour; france; thought; would; like; compete; year; abstract; long; term; goal; bought; road; bike; addicted; excitement; setting; endorphin; lost; right; time; beach; season; short; medium; term; realized; incapable; riding; tour; enjoying; fresh; made; friend; sport; short; medium; term; lean; physique; boosted; confidence; getting; action; lately; woman; every; successful; breakthrough; moment; obsessing; taking; woman; home; every; weekend; abstract; long; term; goal; focusing; immediate; problem; game; style; logistics; upcoming; encounter; short; term; eventually; compound; enough; success; woman; gaming; becomes; much; easier; medium; term; long; term; become; successful; woman; seeking; directly; answer; asktrp; make; decision; improve; life; short; medium; term; thing; capture; relatively; limited; attention; build; compounding; success; long; term; without; directly; targeting; forget; take; solution; based; approach; problem; challenge; build; life; bottom,-1,
ggjhao,skyrunner22,never; seen; redpill; filled; mainstream; article,,-1,
ggezsu,Scared_Dare22,nothing; safe; internet; prospective; player; loses; contract; instagram; group; chat,,-1,
ggc61r,NyashaToons,moment; reject,,-1,
ggbszd,zav25,beta; becoming; alpha; alpha; recovering; fucking; disease,today; fucking; epiphany; always; thought; deep; subconcious; beta; matter; trying; beta; thinking; made; money; still; beta; cause; somehow; fucked; girl; still; beta; cause; worked; dieted; turned; body; fucking; anciet; greek; sculpture; still; beta; mind; cause; matter; beta; matter; better; much; advanced; still; beta; remain; beta; whatever; great; achievement; might; brainwashed; simple; epiphany; brainwashed; society; think; lowly; government; want; manipulable; possible; instill; thought; ever; since; kid; naturally; alpha; thanks; biology; thanks; dick; ball; endocrine; system; thanks; anatomy; built; nature; conquer; least; relentlessly; conquer; best; possible; single; motherfucker; natural; born; beta; thing; think; start; alpha; nature; moment; born; anatomy; confirm; passing; society; friend; family; government; massmedia; social; medium; start; fucking; little; little; growing; instilling; certain; retarded; nature; thought; brain; benefit; benefit; forget; true; masculine; animalistic; conquering; nature; thus; become; little; puppet; always; feel; interior; conflict; usually; feel; anxiety; depression; know; deep; know; fuck; feel; like; saying; little; voice; instinct; head; feel; like; follow; turn; good; starting; follow; instinct; start; thinking; think; weirdo; cause; laught; joke; better; start; fake; laughing; think; good; trust; better; tell; retarded; sound; voice; fake; beta; instilled; taking; natural; alpha; instinct; retarded; ideology; rationality; biology; feminism; acceptance; veganism; acceptance; cheap; pleasure; pornography; junk; food; sugar; demand; pointless; entertainment; netflix; youtube; stupid; bandaids; anti; depressive; pill; pushing; sort; medicine; throat; getting; addicted; xanax; shit; mind; game; purposeful; lack; certain; education; purposeful; miseducation; area; slave; working; making; believe; champion; meanwhile; making; dude; rich; want; mindless; zombie; brag; humble; stop; judging; people; accept; want; personality; like; falling; leaf; floating; whatever; direction; wind; blow; feed; cheap; pleasure; junk; food; stupid; entertainment; crap; medicine; filling; brain; cheap; dopamine; keeping; docile; like; tranquiliezed; lion; cage; think; good; believe; work; monthly; salary; fuck; wife; raise; kid; term; free; break; mental; pattern; fuck; cage; forming; opinion; like; people; good; neither; fuck; shame; lose; weight; like; hobo; good; neither; fuck; work; like; loser; stand; something; stand; something; fucking; thing; empty; spot; inside; waiting; filled; filled; something; else; someone; else; unless; fill; beta; trying; become; alpha; alpha; recovering; fucking; disease,-1,
ggaks8,ChrisonymusBosch,freshly; pilled; thought; share; movie; helped; unfaithful,little; known; drama; star; richard; gere; diane; lane; good; past; prime; still; fuckable; husband; wife; living; york; year; played; youngest; malcolm; middle; basically; story; diane; lane; shopping; fall; scrape; knee; latin; stranger; come; brings; apartment; help; kind; flirt; leaf; come; back; second; time; fuck; keep; fucking; eventually; start; losing; affair; neglecting; duty; parent; picking; school; time; gone; late; night; eventually; richard; gere; find; confronts; fucking; kill; rage; long; story; short; wife; find; husband; killed; lover; argue; end; driving; police; station; family; implication; richard; gere; going; turn; main; takeaway; movie; inherent; desire; woman; trade; think; pretty; much; universal; sure; handful; exception; movie; diane; lane; everything; modern; western; woman; claim; love; loving; husband; great; career; excellent; partner; father; look; pursues; passion; sexy; latin; stranger; walk; drop; second; course; good; feminist; find; victim; scenario; turn; situation; around; head; affair; something; broaden; horizon; nobody; need; know; course; end; neglecting; duty; mother; husband; pick; slack; cheating; shown; fling; clearly; care; still; chooses; family; contrast; think; movie; highlight; strength; many; sacrifice; unnoticed; richard; gere; character; almost; everything; right; still; end; fucked; make; ultimate; sacrifice; flaw; movie; letting; emotion; like; bitch; taking; another; man; life; still; make; implication; movie; turning; surely; going; prison; life; ensure; family; keep; running; despite; wife; abandon; responsibility; get; ultimate; punishment; know; guy; thought; pretty; finally; seeing; world; love; discussing; theory; reading; bout; online; friend; still; mostly; lefty; pussy; solid; conservative; extremely; lame; choir; type; hard; interesting; conversation; real; life,-1,
gga5gd,whatsthisgarg,female; friend; easy; fuck; woman,requested; repost; anticipation; upcoming; post; covid; fuck; fest; maybe; many; woman; looking; railed; first; foremost; looking; boyfriend; right; away; least; nbsp; title; almost; certainly; misconstrued; outset; guy; able; fuck; female; friend; playing; fast; loose; pareto; principle; illustration; guy; guy; woman; want; fucked; friend; nbsp; woman; preference; partner; sexual; congress; remarkably; stable; friend; little; bearing; woman; depraved; shit; want; fuck; fucking; friend; least; nbsp; female; friend; fuck; perennial; topic; came; post; archive; today; made; mistake; wanting; fuck; woman; really; loudest; voice; saying; never; friend; woman; currently; comment; bottom; fuck; every; girl; friend; circle; keep; mind; talking; female; friend; help; female; friend; make; sure; fuck; sound; like; somewhat; joking; around; wholeheartedly; sincerely; agree; nbsp; bottom; invisible; woman; reason; female; friend; stairwell; stranger; parked; public; street; pile; driver; seatbacks; nbsp; starting; basic; moving; nbsp; advice; number; want; fuck; female; friend; climb; bottom; lifting; haircut; pull; head; shit; telling; nbsp; bolus; post; past; subject; sheer; utter; coincidence; almost; full; year; seed; planted; post; thing; woman; thing; woman; archive; feadj; nbsp; advice; number; want; fuck; female; friend; important; thing; thing; nbsp; thing; woman; hope; touch; boob; outright; contraindication; anything; woman; want; lose; chauffeur; sexing; providing; good; service; unsexy; nbsp; another; coincidence; post; subject; situation; girl; told; judge; told; getting; point; came; back; obvious; suggesting; could; sort; relationship; kinda; laughed; said; sleeping; friend; shot; would; wishful; thinking; consider; believe; young; tried; never; suggested; woman; pant; nbsp; maybe; forward; enough; suggesting; wonder; another; post; archive; comment; still; good; reading; try; forward; look; love; friendship; think; great; connection; real; easy; talk; bond; stuff; smell; turn; sometimes; catch; wanting; bend; friendship; primary; nothing; change; ever; bored; lonely; love; show; much; appreciate; body; lololol; wonder; advice; garbage; post; said; recovering; told; sounded; like; still; high; good; thing; offer; every; time; woman; pretend; want; body; literally; single; least; attractive; thing; could; possibly; woman; nice; guy; pretend; like; woujo; explains; better; past; post; stop; trying; prove; woman; good; archive; nwcw; nbsp; advice; number; want; fuck; female; friend; talking; make; much; le; likely; happen; nbsp; make; happen; essential; person; leader; woujo; explained; another; great; post; word; patrice; neal; archive; ipjcq; nbsp; another; essential; masculine; presence; keep; atmosphere; highly; sexualized; nbsp; advice; number; want; fuck; female; friend; need; overtly; masculine; foster; highly; sexualized; environment; nbsp; know; woman; ready; give; sign; talk; simply; physically; assertive; accepts; accept; advance; immediately; without; reserve; back; rapist; nbsp; another; post; claimed; almost; impossible; fuck; female; friend; archive; ciewp; news; need; finger; count; number; female; friend; fucked; remained; friend; actually; physically; maybe; give; look; something; want; come; want; thing; make; worked; ready; action; typical; time; repeated; several; different; woman; bunch; friend; meet; party; climb; around; building; downtown; hang; park; beach; basically; amok; woman; watching; like; stud; jackass; alone; night; watching; hijinks; night; ready; simple; remember; chick; giving; ride; home; last; invite; park; street; kind; blocking; driveway; asks; blocking; say; maybe; able; morning; high; realize; already; decided; spend; night; crazy; dangerous; shit; night; primed; last; liked; pile; drivered; seatbacks; stranger; parked; public; street; archive; phmap; somebody; mother; possibly; guy; nbsp; another; main; point; female; friend; fucking; bottom; line; nbsp; needy; slob; lot; obvious; beta; quality; everything; suck; including; female; friend; nbsp; stud; lot; alpha; quality; everything; great; including; female; friend,-1,
gg4i6p,ntwciajs,romantic; alpha,,-1,
gg4gr9,lilrobinz33,porn; turn; simp,,-1,
gg0yuq,lets_get_fruity,dick,,-1,
gfz7ny,Kushostratus,porn; killing; society,,-1,
gfynyc,rdwo97,becoming; sperm; donor,,-1,
gfy1uj,Hornyonion,love; dissipates,story; back; home; country; everyone; know; blue; pill; pussy; started; nice; happy; good; job; active; social; life; life; seemed; moving; towards; direction; seemed; thought; relationship; something; slowly; forged; something; better; concrete; goal; pursue; interest; accomodate; agenda; hand; clearly; focused; stuff; flag; say; joking; manner; front; people; mine; know; mine; refering; item; inanimate; object; brush; anything; trying; plan; vacation; people; including; remember; accommodate; need; literally; let; wait; last; moment; confirm; whether; coming; date; standard; excuse; busy; work; always; work; literally; problem; confides; separate; bank; account; speak; money; ever; spends; like; crazy; business; ofcourse; issue; every; person; free; mind; wife; need; know; finance; ready; follow; whole; follow; path; bullshit; go; couple; year; eventually; focus; work; meet; friend; front; show; sign; affection; like; respect; useful; need; change; year; visible; example; went; mall; went; shopping; grabbed; coffee; say; cause; carrying; come; back; full; heavy; bag; carried; like; donkey; could; point; become; complacent; step; thinking; thinking; every; wife; agenda; fall; somewhere; find; spot; thing; please; give; nice; feeling; accident; design; congrats; officially; drunken; captain; doormat; object; used; played; drained; resource; rewarded; pitty; wife; never; respect; unless; boundary,-1,
gfw9hy,alex-0208,meant; ironic; evryone; know; true,,67,peco
gfua1s,LastRevision,kill; party; kill; party,,-1,
gftt8t,traitvassal,awalt; action,,-1,
gftfzu,once_profane,like; pete,post; asktrp; yesterday; described; stumbling; upon; evidence; cheated; ruthlessly; couple; year; back; dropped; instantly; good; move; part; advocate; snooping; around; email; social; medium; possible; dirt; right; thing; confronting; kicking; curb; however; post; someone; dropped; comment; titled; like; pete; clicked; took; archived; post; relationship; woman; posted; dumped; suggesting; going; visit; another; country; read; post; archive; uuld; lesson; learned; abundance; mentality; pete; gave; fuck; knew; could; find; another; chick; care; spending; last; month; easy; drop; girl; behavior; abundance; mindset; confidence; knowing; easily; find; woman; beta; scarcity; mindset; would; convince; keep; woman; around; fear; alone; never; keep; woman; life; would; suggest; visiting; huge; flag; tried; spin; saying; abusive; thinking; want; friend; good; looking; woman; honestly; thought; platonic; moment; told; dumped; said; great; bang; paraphrasing; video; youtu; osgqlin; prefer; audio; narration; lesson,-1,
gfsjr1,empatheticapathetic,woman; unnecessarily; disrespect; husband; national,,-1,
gfnl2i,mimblezimble,pilled; reaction; muslim; family; daughter; behaviour,muslim; woman; living; west; increasingly; influenced; muslim; peer; sarah; muslim; woman; theglobeandmail; life; first; person; like; coming; divorcee; muslimculture; marriage; article; pakistani; origin; grew; canada; find; story; quite; familiar; term; pill; theory; truth; still; universally; acknowledged; muslim; culture; unmarried; woman; failed; life; obviously; standard; pill; opinion; matchmaker; built; national; reputation; said; divorc; likely; infertile; open; child; approach; wall; sarah; hard; time; accepting; year; smv; longer; used; backtrack; married; middle; semester; university; living; alone; abnormal; occurrence; people; would; doubt; chastity; pill; theory; college; considered; brothel; young; woman; start; riding; although; husband; kind; marriage; start; meant; social; isolation; university; others; partied; traveled; study; abroad; program; family; shushed; unhappiness; told; reason; leave; husband; letting; study; good; family; treated; mean; happy; peer; riding; stuck; boring; niceguy; husband; initiated; divorce; wanted; life; wanted; figure; goal; wanted; explore; world; find; joining; husband; baby; without; help; matchmaker; must; took; long; time; find; someone; accepted; lived; alone; divorced; first; husband; reason; still; managed; find; blue; pilled; beta; simp; failed; admits; however; able; deceive; experienced; matchmaker; undoubtedly; maritally; bomb; naive; idiot; refused; listen; family; idea; marry; give; year; completely; feel; urge; return; instead; shunning; divorc; humiliating; need; voice; truth; make; place; strength; bring; culture; survival; society; depends; shunning; humiliating; divorc; leave; husband; reason; jumping,-1,
gfm0l4,SmellyForehead32,think; steven; crowder; could; blake; lively,view; poll; reddit; poll,-1,
gfk6sy,kingmgtow66,porn; turn; simp,,-1,
gfbkrm,louielouie222,post,,-1,
gf8zaq,R9-295x2-x2,confidence; working; insecurity,,-1,
gf1x9x,mr_Tobbor,ferrari; paradox; challenge; abudence; contention,,-1,
gf0z39,amphix339,letter; appreciation; gratitude,anything; mind; boggling; write; point; understand; le; pill; life; feel; great; right; would; like; spread; brother; right; lockdown; pretty; much; girl; horny; ever; love; shit; took; granted; great; subtle; thing; life; best; thing; could; like; testosterone; fucking; rock; else; understand; world; work; much; like; life; shit; much; drought; dominant; girl; fucking; horny; loser; couple; year; accepting; male; ness; fucking; freeing; option; fucking; amazing; objective; perfect; couple; grand; saving; account; year; worked; body; decent; beard; prospectively; great; career; path; thing; truly; hold; dear; genuine; belief; anything; take; putting; work; purpose; great; country; get; back; normal; routine; would; like; thank; making; beautiful; blonde; licking; scrotum; every; week; truly; understand; mean; give; single; fuck,-1,
geyhup,surfacetocuckmissile,soyboy,,-1,
gcvzp1,nickdimitrov,unattractive; guide,believe; limitation; always; limitation; right; would; woman; find; unattractive; short; poor; ugly; sexless; friendless; unambitious; insecure; hesitant; think; correct; right; bitter; irony; however; right; missed; point; question; every; condition; listed; part; real; dealbreaker; individually; thing; repulse; woman; unattractive; simply; need; limited; circumstance; woman; give; damn; individual; quality; quality; communicates; limitation; every; limitation; drag; away; really; want; unstoppable; woman; already; live; life; limitation; nature; often; live; life; mediocrity; believing; possibility; someone; else; already; showed; woman; attracted; limited; hell; case; register; existence; woman; want; someone; either; physically; psychologically; socially; otherwise; superior; someone; thing; never; imagine; succeeding; making; excuse; believing; limitation; unattractive; boil; start; believing; ugly; short; buying; bullshit; limitation; self; fulfilling; prophecy; since; mindset; inherently; unattractive; mindset; million; closed; door; unattractive; short; belief; height; somehow; holding; back; infinity; believing; possibility; following; belief; people; want; woman; know; many; thing; want; someone; unstoppable; look; immediately; communicated; everything; power; change; disprove; people; disbelief; action; people; want; taste; infinity; believe; come; along; give; sample; stop; making; excuse; take; charge; control; naysayer; disbeliever; disbeliever; ever; unstoppable; listen; tell; deserve; thing; pursue; believe; everything; possible; action; impossible; belief; woman; nothing; valuable; resource; belief; possibility,-1,
gctdh6,SPaddocksBumpstock,banned; relationship; fembot; mod; giving; advise,,-1,
gctcl9,SPaddocksBumpstock,banned; relationship; comment; post; reddit; relationship; advice; comment; gbrzwn; update; making; girlfriend; source; share; medium; name; iossmf,,-1,
gcsawu,CUCKOLDERofModernBFs,seek; advice; cheating; school; make; wear; condom; sidecock; get; proceeds; absolutely; obliterated; comment; section; along; girlfriend; insanity,,-1,
gcrqiz,malonekt45,everyone; check; facebook; group; practical; stoic; large; discord; aesthetic; website; group; write; daily; real; stoic; philosophy; post; ton; stoic; meme,,-1,
gcr2ie,DoctorTagada,exiting; choice; going; november; orange; pedoperv; activist; simp; declared; today; regarding; woman; soccer; team; equal; else; president; elsewhere; world; funding,,-1,
gcq5yo,dashausvonryan,putting; open; discussion; side; thing; conversation; begin,,-1,
gcopms,Discourse_Monger,woman; manipulate,,-1,
gcnylc,mephju,gender; ratio; immigration,,-1,
gcnulr,Hornyonion,miss; sagalaza; fuming; phone; judge; contempt; ofcourse,,-1,
gcmq68,Semantics127,glad; found; place; aita,,-1,
gcizho,WrongVanilla,boy,headfucked,-1,
gcixmb,Phoonis,veteran; tip,,-1,
gchsh3,ChadMini,value,,-1,
gchmd0,Zoocuffs,weak,,-1,
gcfinn,silverback-gorilla12,body; count; tell; truth; ignore,,-1,
