post_id,author,title,body,image,image description
gnxiz7,Nofapislit,feminism; biggest; shit; test,leave; logic; door; nothing; woman; make; sense; first; deeper; realize; every; action; take; test; filter; alpha; beta; includes; feminism; shit; test; shit; test; best; understood; congruence; test; woman; testing; congruent; dominant; powerful; alpha; supplicant; needy; beta; behavior; congruent; powerful; dominant; alpha; code; go; almost; someone; programmed; javascript; python; coder; programming; language; program; would; look; something; like; alpha; behavior; fuck; beta; behavior; exploit; good; service; alpha; beta; behavior; continue; test; make; sense; logic; logic; fail; shit; test; seem; illogical; still; test; alpha; beta; behavior; example; last; weekend; go; like; make; contact; last; weekend; small; gathering; friend; house; hold; contact; look; away; proceed; talk; barely; responsive; continue; soon; friend; come; take; away; immediately; begin; socializing; others; hour; past; reengage; attracted; time; begin; shit; test; pas; past; white; knight; trying; cuck; block; sorry; offend; boyfriend; long; story; short; amateur; would; folded; friend; took; away; logically; make; sense; girl; want; fuck; stop; talking; right; actually; realize; everything; woman; test; alpha; beta; behavior; powerful; dominant; alpha; would; continue; prize; beta; would; fold; pressure; thats; every; damn; thing; woman; test; behavior; including; feminism; feminism; test; alpha; beta; behavior; imagine; woman; feel; everything; everything; feeling; overtime; realized; sometimes; feeling; wrong; trick; evil; disgusting; care; anything; feel; alpha; good; gene; feel; beta; happy; duty; take; care; biological; kid; sadly; accept; role; unless; course; boy; given; common; knowledge; kid; brain; plastic; adult; brain; relatively; young; plastic; brain; grows; competitive; environment; adapt; competitive; natural; instinct; reality; could; beta; learn; fake; awful; good; female; imperative; would; trick; feeling; thinking; beta; alpha; give; gene; child; mention; would; le; provider; woman; become; inventive; felt; knew; boy; rightful; place; alpha; beta; early; possible; child; based; hence; given; opportunity; feminism; began; flourish; feminism; ultimate; shit; test; attack; young; alpha; among; become; beta; porn; introduced; boy; reach; puberty; junk; food; video; game; social; medium; majority; fail; first; shit; test; congruence; test; make; choice; congruent; beta; indulge; behavior; boy; alpha; father; exceptional; talent; exceptional; look; regardless; whatever; reason; choose; competitive; high; energy; boy; since; like; birth; world; accepts; totally; congruence; alpha; though; continue; shit; test; never; failed; shit; test; immune; boy; grow; extremely; successful; seducing; woman; closing; feminism; creates; environment; alpha; amongst; boy; turn; alpha; woman; consciously; know; subconscious; need; subconscious; need; powerful; man; demand; young; beautiful; woman; demand; beauty; know; demand; supply; like; young; woman; genetics; would; died; learned; demand; subconsciously; task; easy; visible; woman; task; demanding; filtering; alpha; beta; little; complex; naturally; developed; mental; schema; called; shit; test; filter; like; power; demanded; beautiful; woman; used; logic; woman; power; demand; alpha; intuition; every; action; woman; take; come; point; view; best; survival; replication; reason; feminism; subconsciously; grand; scheme; woman; alpha; seems; illogical; right; woman; logic; intuition; shit; test; best; understood; congruence; test; woman; testing; alpha; beta; alpha; fuck; beta; exploit; good; every; damn; thing; woman; test; behavior; including; feminism; woman; logic; intuition; feeling; tricked; awful; survival; repercussion; feminism; creates; environment; alpha; amongst; boy; turn; alpha; hence; feeling; le; likely; tricked,-1,
gnr642,UniversalFapture,gentleman; keep; finance; separate; ensure; name; many; thing; possible; free; leave; suffer; consequence; exit; plan,,77,mommy; lhlodder; husband; called; sweet; year; grandma; tell; congratulated; talked; hung; later; called; open; secret; bank; account; never; tell; husband; grandma; fierce
gnq4ml,St31nway,different; changed; thanks,simp; beta; first; thank; everyone; subreddit; sharing; knowledge; experience; always; type; dude; never; really; talked; girl; waited; talked; froze; like; alaska; nothing; value; show; played; minecraft; halo; bud; school; everyday; whole; idea; obtaining; girl; nice; hopefully; would; offer; pussy; pristine; white; plate; scrumptiously; devour; first; girlfriend; grade; throughout; grade; eyed; chick; knew; wanted; stuck; around; remained; friend; watched; like; michael; hunter; really; cute; eventually; turned; started; dating; lasted; approximately; week; dumped; thought; like; much; effect; pussyitis; ability; consistently; freeze; like; damn; frozone; relationship; pretty; much; nonexistent; junior; year; high; school; boy; prom; every; date; except; told; going; without; date; proceed; find; date; week; prior; friend; tell; girl; need; date; immediately; prom; say; unbeknownst; boyfriend; biggest; entire; school; start; talking; little; hit; flirt; really; get; beta; hive; mind; going; apeshit; start; saying; shit; like; name; party; host; house; prom; shit; like; really; going; thinking; prime; opportunity; pipe; throughout; entire; flirtation; conversation; escapade; devoting; time; checking; phone; constantly; every; time; snap; surge; dopamine; filled; head; ball; sack; point; nothing; productive; free; time; practically; begging; chick; attention; hope; pipe; niceguy; think; greatest; pussy; slayer; known; guaranteed; fast; forward; prom; night; change; party; house; minute; later; get; picked; boyfriend; already; probably; imagine; never; talked; forward; kept; going; head; asking; wrong; could; said; done; secured; golden; goose; placed; high; pedestal; looked; small; insecure; look; redpill; post; nothing; le; pure; truth; wrong; rather; mentality; look; back; easily; used; treated; like; doormat; rightfully; presented; doormat; could; would; lost; girl; soon; found; boyfriend; found; someone; party; different; redpill; opened; eye; day; simping; drooling; thought; female; attention; thanks; opening; eye; look; forward; seeing; quality; opening; post; tldr; cuck; niceguy; changed; thanks; redpill,-1,
gno542,guynpdx,illustrates; beta; male; think; fucking; tool,,-1,
gno4fq,guynpdx,illustrates; beta; male; think; fucking; tool,,78,grimmadventures; entire; asshole; would; probably; better; cnznce; fucking; chic; like; didnt; enin; assho; ching; mean; icin; bath; asshole; asshole
gnnxcq,Smart_ass_bro,woman; principle; loyalty; okay,,-1,
gnmwwu,Nofapislit,thing; need; know; laid,fundamental; truth; powerful; thing; need; know; laid; getting; laid; recently; thanks; sentence; read; book; base; behavior; sentence; laid; keep; wife; cuckolding; better; live; better; life; fundamental; truth; like; wrote; post; recently; filled; sarcasm; explained; decline; change; human; nature; clearly; went; head; reader; sure; reader; taken; time; read; decline; summarize; masculine; losing; battle; feminist; real; possibility; life; extreme; minority; close; future; although; trigger; fight; flight; response; actually; good; thing; pragmatic; selfish; point; view; since; feminist; brain; washing; majority; young; think; opposite; minority; know; truth; mean; minority; attractive; okay; thing; need; know; laid; human; nature; woman; like; powerful; dominant; hardwired; woman; nothing; anyone; change; trying; laid; avoid; cheating; promoted; live; happier; life; need; following; thing; every; action; take; come; frame; powerful; dominant; behavior; since; implementing; gotten; barely; qualified; making; figure; attracted; plate; best; getting; crazy; gain; reader; okay; stop; reading; science; really; need; know; succeed; advice; interested; science; powerful; dominant; sexy; began; evolution; decided; separate; sex; instead; hermaphrodite; evolution; reason; decided; better; male; female; male; given; ability; spreading; sperm; female; given; ability; carry; egg; fertilized; child; fundamental; difference; matter; male; soon; realized; biological; urge; reproduce; best; many; child; spread; much; seed; could; male; figured; time; one; genetics; died; male; come; realization; obvious; problem; male; fertilized; egg; fertilize; egg; male; time; size; female; alittle; known; fact; though; dominate; male; baby; baby; really; important; fight; male; began; time; slightly; stronger; male; killed; weaker; male; genetics; fertilize; egg; time; stronger; male; began; take; food; making; stronger; stronger; generation; powerful; dominant; indeed; female; egg; never; really; fight; baby; someone; seemed; always; interested; fertilizing; egg; problem; never; grew; physically; stronger; never; fight; compete; dangerous; fight; compete; pregnant; could; stand; strong; dominant; male; seemed; live; fight; matter; beat; fight; trying; could; kill; baby; pregnant; solution; come; powerful; dominant; male; give; child; reward; protection; food; seems; option; wanted; survive; baby; hence; year; much; became; natural; closing; note; feminism; biggest; shit; test; know; woman; desire; powerful; dominant; fucking; demand; absolute; necessity; child; survival; know; sperm; cheap; egg; expensive; impregnate; woman; genetically; wired; demand; strongest; healthiest; valued; power; domination; make; environment; stressful; difficult; natural; powerful; dominant; could; come; throw; every; thing; make; weak; became; powerful; dominant; would; fine; male; could; fertilize; egg; hence; woman; push; feminism; raising; value; decrease; dating; pull; demand; excellence; male; hence; making; safer; child; safer; course; better; genetics; following; generation; human; nature; woman; like; powerful; dominant; every; action; take; come; frame; powerful; dominant; science; survival; reason; woman; attracted; powerful; dominant; feminism; biggest; shit; test; feminism; creates; environment; demand; excellence; become; powerful; dominant; male,-1,
gnlymj,AleshaSmilesAtDeath,today; learned,,-1,
gnknr4,Nofapislit,feminist; stay; home,feminist; stay; home; powerful; truth; homo; sapiens; existed; year; feminism; little; year; feminism; social; political; economic; equality; woman; support; find; noble; cause; presume; wave; succeeds; get; everything; want; would; great; change; damn; thing; human; nature; human; designed; harshness; environment; survival; competitive; endeavor; nothing; change; political; party; ideology; change; fact; life; hard; strongest; amongst; survive; making; life; easier; majority; make; competitive; minority; willing; compete; majority; become; average; wealthy; high; status; harem; beautiful; woman; unprecedented; history; difference; bourgeoisie; proletariat; always; surprisingly; life; much; resemble; ever; prior; feminist; woman; collect; check; government; talented; enough; seat; congress; dumb; free; money; many; choose; stay; home; take; care; kid; beta; duty; long; continues; invest; majority; state; federal; check; biological; kid; life; life; know; guy; found; redpill; hopefully; accepted; human; nature; learned; love; like; simple; machine; kept; specie; alive; thankful; like; math; law; physic; change; fact; equal; prefer; young; woman; woman; prefer; powerful; brain; wash; cause; le; rise; full; power; potential; le; woman; capitalize; youth; change; fact; best; rise; full; power; potential; best; woman; capitalize; youth; instagram; onlyfans; sugardaddys; oopsies; chad; pregnant; accept; support; thing; choose; want; capitalize; good; news; amount; gain; competing; ancestor; shit; always; hard; competitive; stop; pussy; lift; survival; competitive; endeavor; nothing; change; making; life; easier; majority; make; people; average; life; vastly; greater; compete; rich; poor; still; story; time; feminist; many; woman; choose; feminist; stay; home; mom; stop; pussy; lift,-1,
gnkfby,LastRevision,love; sympathy; manipulation; woman; exploit; sympathy; want,first; published; remember; woman; evolved; manipulation; primary; tool; survival; something; changed; rather; recently; another; tool; toolkit; habit; hard; love; love; idea; close; approximation; never; want; humanity; unsightly; weak; never; match; idea; love; value; provide; love; believe; leadership; rely; conviction; close; approximation; never; match; idea; idea; becomes; damaged; beyond; repair; leave; option; resent; true; pill; modern; must; swallow; feminism; modernity; promiscuity; woman; love; sympathetically; pill; modern; burden; like; understanding; reality; death; human; burden; pill; necessary; time; western; world; constructed; manner; allowed; male; naivety; naive; meant; happy; meant; productive; girl; killtoparty; kill; party; dated; year; mother; extraordinary; ugly; short; face; full; wart; little; crew; disgusting; annoying; level; feel; necessary; mention; girl; dated; adopted; horrifying; woman; bear; child; would; join; girl; mother; father; skipped; town; holiday; event; hosted; family; friend; woman; would; often; break; tear; table; would; need; consoled; happened; regularity; knew; coming; minute; started; like; crisp; precedes; rain; storm; breakdown; happened; interim; dinner; dessert; coffee; brewing; woman; drain; everyone; around; still; garnered; tremendous; attention; constant; favor; understood; place; ugly; woman; ugly; woman; able; play; sympathetic; tendency; people; around; exploit; gain; woman; beyond; hope; viewed; average; inherit; understanding; exploit; sympathy; around; conscious; methodology; like; child; learns; manipulate; parent; satanic; witch; anton; lavey; describes; dynamic; scenario; term; ugly; girl; game; truly; ugly; girl; others; disadvantage; rather; hurt; feeling; thing; guilt; homely; light; hearted; call; others; attention; think; swell; sport; talk; shame; behind; back; avoid; appearing; patronizing; presence; strange; looking; like; really; think; trying; look; much; like; others; possible; still; talk; behind; back; little; cruelly; presence; guilt; done; cause; extremely; patronizing; neither; pattern; really; gain; respect; sympathy; woman; need; avenue; manipulate; woman; desirable; attraction; spectrum; ooze; value; able; manipulate; woman; mere; existence; woman; middle; develop; manipulative; tactic; play; aesthetic; strength; ability; garner; sympathy; ugly; girl; sympathy; exploit; come; rely; attractive; woman; game; ultimately; inspire; sympathy; woman; first; cast; wide; appearance; ensnare; desirable; promise; sexuality; step; formerly; display; femininity; domesticity; inside; culture; promiscuity; woman; right; interested; female; game; shift; attempting; manipulate; sexually; attempting; manipulate; emotionally; cast; sympathetic; light; appear; fragile; girl; lost; scary; world; little; bundle; sweetness; lot; emotion; need; tough; rugged; take; care; fall; without; much; prodding; every; part; western; culture; constructed; fantasy; meant; understand; manipulation; would; functional; civilization; believed; woman; creature; deep; morality; honest; simplicity; western; civilization; built; believe; woman; genuine; woman; wonderful; woman; need; protect; harsh; reality; world; world; duplicitous; frightening; woman; meant; kept; protection; capable; would; today; true; complete; understanding; woman; kill; party; killtoparty,-1,
gnk1fj,[deleted],nothing; changed; year; pill,,-1,
gnc23o,callmedoe,really; like; pill,,79,peco
gn9ima,AdvancedTurk,woman; complete; existence,,-1,
gn87vn,AmericanGOPolitics,,,-1,
gn86nq,omawolfmusic,,,-1,
gn6tq4,LiveAFTSOV,fooled,girl; completely; shrekt; shit; nigga; youngster; much; plate; kinda; boot; call; sentimental; bloop; enjoy; companionship; time; bond; memory; might; part; aint; everything; fact; thing; miss; intimacy; everywhere; deep; connection; arent; anyways; doin; thang; facestagram; sharing; dank; meme; posting; selfies; getting; lot; like; comment; share; life; good; like; profile; picture; update; received; pretty; cute; girl; date; plate; stayed; story; girl; stayed; never; forget; think; fucking; hoe; bitch; tattooed; teardrop; brain; opener; something; looking; familiar; played; along; said; know; friend; eventually; straight; asked; hang; fuck; guess; whole; pill; smv; thing; must; actually; working; yeah; sure; make; sure; wear; pretty; underwear; texted; without; much; thought; played; would; quick; look; profile; posting; classic; shot; bathroom; showing; titty; bedroom; like; seen; responded; emoji; date; routine; first; date; take; regular; half; people; know; shout; tito; letting; without; carding; take; cream; walk; back; place; everything; went; perfectly; danced; kinoed; cream; made; fucked; living; room; busted; great; broke; condom; hysterical; floor; cry; bitch; talking; nonsense; hand; never; felt; calm; entire; life; okay; baby; come; contraceptive; fine; come; trust; okay; okay; aftsov; first; real; test; frame; month; later; would; still; bring; much; loved; moment; said; defined; attraction; soon; learn; fuck; could; trust; anything; bitch; month; relationship; consisted; fucking; walk; nature; brought; situation; first; time; told; actually; loved; decided; baby; let; make; thing; better; artsy; goth; girl; fantastic; artist; loved; drawing; picture; together; painted; portrait; together; among; drawing; painting; poem; love; letter; would; send; mail; little; surprise; fuck; think; really; loved; best; goddamn; year; living; random; passionate; blowjob; middle; night; waking; riding; fuck; time; anywhere; anyways; anal; roof; handcuff; public; blindfold; rope; anywhere; took; birth; control; could; inside; since; liked; year; half; shit; thinking; might; actually; found; start; family; bitch; supported; dream; everything; pursued; right; sideline; cheering; always; found; interest; hobby; always; wanting; learn; participate; fuck; partner; team; nothing; valuable; woman; browsing; snap; chat; story; black; text; cant; guy; take; answer; asked; happened; several; minute; prodding; finally; confessed; raped; furious; fucker; could; find; murk; tell; exactly; happened; figure; shit; talking; invited; house; wine; played; card; thing; another; ended; naked; inside; told; told; boyfriend; listen; fuck; hung; spam; phone; next; couple; minute; arrives; house; uber; still; know; point; damn; could; reply; exasperated; explanation; night; draw; nearer; fall; asleep; decide; reconnaissance; password; easy; guess; treasure; trove; heart; breaking; pill; young; dumb; cheated; know; many; time; course; entire; relationship; fuck; could; ever; seen; coming; everything; ever; read; told; sign; would; distance; lack; love; star; fish; shit; adding; fucking; around; andrew; blake; maury; peter; zack; william; david; bitchboy; david; beef; fucked; phone; wake; many; time; fuck; david; many; time; david; long; winded; blow; answer; time; writing; love; poetry; drawing; picture; together; framed; wall; fucking; bastard; fuck; house; night; time; dont; ride; point; parent; awake; barged; room; naked; seething; wrath; punched; hole; wall; parent; jumped; side; telling; calm; never; yell; lady; yeah; aftsov; love; cried; exploded; fuck; charged; throwing; yelled; cursed; house; outside; naked; cold; winter; night; broke; cheated; easily; explainable; acting; beta; way; involved; cared; much; relationship; boundary; girl; half; hearted; work; seen; coming; magnifying; glass; cried; long; time; sometimes; still; tear; infact; today; dream; cry; treated; like; king; still; betrayed; never; another; girl; supported; like; always; wind; comparing; prospect; today; fucking; girl; kept; repeating; name; head; aint; gayest; shit; ever; read; know; homies; dude; burned; still; smile; pain; shit; life; go; nigga,-1,
gn3c8n,TooYung4this,incel; high; tier; normie,,-1,
gn39j5,TooYung4this,incel; high; tier; normie,,-1,
gn2m1o,SirBallBag,medium; spin,,80,nursery; worker; jailed; year; baby; amarried; nursery; worker; year; gave; birth; child; jailed; month; first; assaulted; drunken; night; january; walked; room; pulled; pant; assed; least; five; occasion
gn2h97,SomeBlackpilledDudeY,think; east; asian; woman; solution; tell; experience; filipina,,-1,
gn220u,javiercer20,woman; loveable; leaveable,,-1,
gn20wg,javiercer20,woman; loveable; leaveable,,-1,
gn1jrn,KanyeHO,made; song; hating; woman; could; satirical; could; pill; like; belief; merging,,-1,
gn0aay,blackdowney,dating; onlyfans; model; year; wrong,,-1,
gmzb73,jakekesler1999,alpha; beta; behavior; bigger; valid,,-1,
gmz4x4,nexellasdf,relationship; like; job,,-1,
gmyzkq,VisiblePlan,acceleractionism; discontent,imagine; disabled; retard; easier; others; everyday; wake; shit; pant; look; pant; brown; slotch; disgusting; mark; incompetence; people; around; back; least; shit; floor; magic; tube; inject; nutrient; body; lift; spoon; mouth; people; care; deeply; despite; fact; really; anything; worthwhile; part; used; normal; high; school; quarterback; fucked; whole; cheer; leading; squad; degree; pussynomics; look; nurse; scrape; excrement; body; say; name; society; society; disabled; retard; shit; thing; like; enjoy; decline; always; retard; upset; usually; mgtowfags; dream; reclaiming; west; west; dead; corpse; calling; racist; twitter; last; bastion; west; call; woman; internet; boomer; breathing; pipe; smoked; cigarette; somehow; believe; society; saved; share; favorite; post; friend; naive; society; want; saved; want; plunge; face; fire; watch; skin; crackle; nihilism; unfortunately; opted; community; turned; nothing; matter; something; whiny; grunge; artist; would; croon; wrist; nihlism; unfortunately; correct; believe; magical; masturbation; habit; often; bos; unlikely; important; something; would; think; apply; theredpill; impact; pussy; getting; care; getting; pussy; probably; endorphin; seeing; woman; attracted; going; ball; deep; vagina; want; kill; getting; pussy; least; worthwhile; woke; twitter; nothing; matter; would; interaction; matter; easy; defeatist; decline; world; fact; never; mar; fact; peer; would; rather; whore; online; character; drawn; perverted; japanese; drink; fuck; fuck; watch; world; burn; enjoy; decline; fuck; woman; drink; wine; lift; weight; steak; make; money; watch; society; collapse; around; unhappy; woke; bullshit; entered; secret; club; people; join; point; trying; preacher; enjoy; decline; really; want; change; world; fine; drive; truck; violence; enact; social; change; start; beating; people; death; tread; sticker; people; revolt; name; calling; loss; education; nothing; society; refuse; change; replaced; philosophy; acceleration; closer; america; redemption; foot; blow; tower; throw; molotov; police; station; shit; hotel; blame; black; family; hand; hand; gun; immigrant; border; social; change; post; internet; nothing; meaningless; worst; post; probably; worst; post; subreddit; upvoted; highest; rated; nothing; meaning; anymore; live; discontent; look; many; ssri; average; femoid; consumes; anything; avoid; feeling; unhappy; miserable; creature; read; fight; club; narrator; spends; first; chapter; book; yearning; feel; something; akin; human; emotion; find; sincerity; close; death; death; strip; away; veneer; pathetic; pride; never; realize; hurtling; towards; destruction; scared; talking; girl; dying; dying; call; faggot; dump; drink; head; really; lose; anything; website; never; post; change; soon; visibleplan; wordpress; visibleplan; wordpress; plan; talk; female; dull; subject,-1,
gmyqux,[deleted],accelerationisim; discontent,,-1,
gmw4zi,throw_away70minus1,pill; post; asktrp; looking; guidance,,-1,
gmv4fh,NotARealNameLolLol,perfect; example; redpill; culture; potentially; dangerous,,-1,
gmsbk5,dontbanmetoday,barometer,,-1,
gms49s,HumptyDumptyFellHard,woman; urge; wall; family,background; quick; research; found; megan; brian; green; married; almost; year; couple; together; kid; together; seems; perfect; greene; dating; since; married; family; wife; considered; faithfully; unicorn; know; bullshit; megan; go; overseas; working; film; meet; machinegunkelly; know; going; overseas; working; half; month; beta; buck; greene; take; care; kid; greene; dream; come; back; distinct; know; feeling; thing; right; feeling; continues; think; happily; married; wrong; know; work; telling; shit; together; time; alone; might; assumption; think; know; bullshit; begin; become; distant; dummy; coming; next; greene; text; reassurance; marriage; alright; text; greene; put; sympathetic; feeling; eerily; foreboding; return; greene; give; time; back; snap; back; reality; marriage; kid; idea; already; settled; trill; continues; hangout; alpha; come; back; give; shit; social; distancing; husband; time; time; continues; hang; coworker; potentially; putting; family; risk; green; say; always; honest; blah; blah; blah; bullshit; third; time; divorce; incoming; take; aways; shit; together; brain; good; look; high; status; prone; cheating; woman; ditching; another; high; status; male; woman; get; bored; already; started; family; drop; hate; swing; another; brand; happened; always; keep; woman; toe; never; guard; comfortable; cause; woman; fuck; option; essential; matter; married; always; good; safety; everything; problem; dating; know; spine; plate; looking; potential; partner; ready; settle; woman; year; younger; first; began; date; green; time; unless; brain; cuck; chance; ride; carousel; carousel; surprising; taking; chance; right; wall; actually; hit; harder; thinking; settling; careful; woman; younger; chance; wall; still; near; hitting; therefore; still; tendency; urge; riding; carousel; carousel; throwing; idea; family; window; apply; everyone; else; younger; woman; urge; tendency; said; alpha; fuck; beta; buck,-1,
