post_id,author,title,body,image,image description
ckaf6s,Top_Brazzler,beginner; article; frame; beginner,,-1,
cka5pe,ThePriorityBike,student; debt; tuition; post; graduation; salary,,-1,
ck5tqj,subu300,progress; observation; break,,-1,
ck55pl,TheLegionnaire00,contract; company; collaborating; ended; fired; make; realize,working; collaboration; contract; meaning; company; collaborated; another; company; working; country; work; company; le; tax; employee; instead; highly; paid; country; live; easter; europe; payment; level; disadvantage; working; basically; fired; spot; without; day; notice; happened; morning; recently; moved; place; penthouse; center; city; bought; lexus; traditional; virgin; girl; unicorn; know; awalt; basically; living; good; life; toady; woke; email; said; company; longer; need; service; talked; bos; said; became; expensive; left; stunned; full; regret; look; post; history; longer; couple; month; received; offer; paying; turned; liked; work; work; environment; probably; wonder; happened; worker; fight; bos; regarding; salary; used; offer; force; hand; gave; gave; raise; month; began; hiring; people; student; payed; le; near; level; cheap; almost; panic; attack; news; email; know; calmed; replied; understand; decision; opened; linkedin; started; looking; job; life; basically; month; telling; made; everything; want; second; felt; like; could; lose; everything; true; know; work; hard; good; small; setback; learned; thing; better; offer; take; squeeze; bos; know; leave; find; small; window; time; need; fire; believe; time; fill; spot; better; offer; take; fuck; work; environment; fuck; company; loyalty; fuck; company; mission; yeah; working; cool; stuff; fuck; matter; paycheck; keep; moral; worry; thing; control; stoic; every; situation; always; thought; make; valuable; company; loyal; grow; respected; workplace; fuck; mercenary; money; speak; believe; bos; friend; wrong; attached; workplace; comfortable; fired; time; would; offer; waiting; always; going; interview; none; know; couple; hour; till; phone; ring; killing; emergency; fund; kind; day; save; kind; spent; money; like; crazy; last; couple; month; buying; expensive; thing; partying; every; weekend; nobody; care; told; anybody; fired; tell; switched; job; last; advice; fuck; fuck; told; happened; worker; working; became; really; good; friend; year; decided; look; job; since; believe; happen; fired; cheaper; programmer; leave; project; major; client; fucked; completely; bos; able; meet; deadline; guarantee; fuck; fuck; stay; strong; brother; always,-1,
ck4vbb,trueliberal1,pill; video,,-1,
ck3swh,22oregon22,great; powerful; rollo; tomassi,find; exceptionally; utilitarian; create; note; phone; reading; book; whether; nietzsche; marcus; aurelius; jordan; peterson; mi; jung; referring; back; brilliant; individual; order; fully; immerse; wisdom; found; note; taking; particularly; useful; reading; groundbreaking; synthesis; inter; gender; dynamic; rational; male; outlined; deem; prominent; aspect; rollo; work; truly; hope; find; useful; save; information; phone; added; context; excerpt; however; want; make; clear; rollo; dissertation; none; novel; idea; mine; innate; predisposition; revert; back; beta; beta; constantly; knocking; door; close; fucker; shut; work; truly; changed; life; sure; many; could; rollo; idea; purely; novel; synthesized; idea; many; could; convey; respect; work; greatly; read; rational; male; stop; read; continue; good; week; fella; behavior; reliable; evidence; motivation; intensely; reject; soul; mate; paradigm; relationship; person; power; need; least; feminization; nothing; le; socialized; effort; deliberate; behavioral; modification; natural; drive; predilection; better; feminine; imperative; woman; would; rather; share; hvm; value; saddled; faithful; loser; imagination; competition; anxiety; paired; implied; exclusivity; cornerstone; successful; plate; spinning; amount; proselytizing; social; conditioning; erase; evolution; hard; coded; collective; biopsychological; desire; behavior; woman; ever; complement; life; never; focus; start; living; woman; become; woman; identity; personality; never; static; malleable; influencing; variable; condition; focused; ambition; going; reflect; personality; condition; feel; deprived; certain; experience; life; creates; conflict; former; identity; altering; forming; meet; need; experience; never; mold; identity; woman; trying; fuck; different; continue; pursuing; ambition; regardless; protest; fact; least; attractive; thing; woman; willing; compromise; part; identity; placate; woman; naturally; attracted; masculine; independence; represents; strong; security; potential; provide; security; woman; want; everything; say; would; indicate; anything; insecurity; lack; confidence; woman; want; told; constantly; test; resolve; shit; testing; order; affirm; made; right; choice; marriage; sexual; impulse; knowing; full; powerful; hold; stick; self; interest; belief; ambition; covertly; communicates; woman; goal; determination; trump; real; power; sexuality; prize; great; catch; competed; woman; human; being; need; predictability; give; sense; control; others; alter; personality; altered; outside; force; threat; predictability; logical; counter; others; attempt; push; back; place; friend; push; back; mindset; embrace; burgeoning; alpha; inside; kill; beta; unlearn; behavior; showing; emotion; condition; one; unguarded; easily; expressed; emotion; evolved; feminine; trait; show; emotion; rare; occasion; deep; seeded; relationship; strong; masculinity; woman; lean; making; personal; sacrifice; necessary; honor; respect; love; commonplace; supposed; thing; sacrificed; ambition; potential; provide; better; life; supposed; resisted; temptation; fuck; secretary; supposed; responsibility; maintain; marriage; home; family; common; expected; appreciated; absence; lack; failing; totality; feminine; centric; reality; exist; facilitate; feminine; reality; familiarity; fact; breed; contempt; mediocrity; routine; banality; commonness; many; marriage; fail; unplug; damn; matrix; reject; based; narrative; reject; fucking; conditioning; beginning; manifest; proto; awareness; inherent; sexual; value; simultaneously; woman; becoming; painfully; aware; marked; inability; compete; sexual; competitor; indefinitely; point; comparative; smv; sex; situationally; level; valuation; conflict; beginning; realize; potential; woman; must; struggle; declination; nothing; threatening; simultaneously; attractive; woman; aware; value; woman; believe; perceives; accept; role; society; foists; command; attention; fucking; interesting; overwhelmingly; invest; beta; male; identity; nice; accommodating; duplicating; side; spectrum; majority; socially; conditioned; suppress; natural; masculine; impulse; favor; accommodating; identifying; woman; imperative; least; lead; understand; imperative; risk; intimate; rejection; exactly; mindset; beta; male; default; nice; spectrum; guy; subscribe; make; lean; jerk; spectrum; attractive; sigmund; freud; said; energy; sexual; meaning; subliminally; direct; motivation; ungratified; sexual; impulse; masturbation; endeavor; thus; highest; amount; libido; inducing; testosterone; must; look; outlet; transfer; motivation; woman; real; surprise; primarily; empire; builder; conqueror; creator; destroyer; better; worse; moved; humanity; significantly; curb; impulse; jerk; instead; create; thrive; lift; make; money; determine; genuine; motivation; intent; observe; behavior; individual; need; compare; behavior; result; correlate; intent; woman; communicate; vast; wealth; information; truth; willing; accept; behavior; exclusively; word; benchmark; relating; must; understand; truth; betrays; behavior; often; want; accept; frustrated; woman; communicate; differently; woman; communicate; covertly; think; vagina; show; aroused; communicate; overtly; think; erection; convey; information; woman; convey; feeling; relating; information; prioritize; content; woman; prioritize; context; cardinal; truth; universe; genuine; desire; negotiated; moment; tell; wife; girlfriend; exchange; behavior; attitude; belief; compromise; desire; fundamentally; change; organic; desire; obligation; want; hypergamy; want; confirmation; never; explicated; demonstrated; desire; dominant; telling; negates; genuineness; validity; becoming; woman; despise; need; told; dominant; told; confident; told; anything; list; prerequisite; intimacy; overtly; relating; entirely; defeat; credibility; genuinely; dominant; male; want; know; need; dominant; confirmation; hypergamy; communicate; behavior; never; overtly; tell; woman; anything; allow; come; conclusion; intend; imagination; best; tool; game; toolbox; sustains; aura; mystery; woman; much; desire; single; greatest; feeling; beta; male; vomit; everything; divulging; full; truth; woman; mistaken; belief; woman; desire; truth; basis; qualifying; intimacy; enduring; commitment; woman; never; want; full; disclosure; shut; fuck; grow; girl; world; want; believe; idealization; woman; actually; attainable; make; pill; hard; swallow; truly; want; fantasy; romanticism; love; whatever; master; make; slave; many; experience; pill; community; desire; back; previously; comfortable; ignorant; state; mind; reality; become; exposed; much; bear; spit; pill; back; want; plug; self; back; matrix; either; learns; live; understanding; feminine; hypergamy; learns; benefit; grow; remains; ignorant; nihilistic; bitter; want; told; unique; special; like; guy; plug; miserable; back; matrix; return; beta; destiny; fucking; pussy; disposable; head; saying; bitch; fair; rather; biology; determined; biopsychological; amalgamation; feed; feminine; hypergamy; evolution; selects; solipsistic; woman; blissfully; unaware; solipsism; woman; innate; self; preserving; solipsism; combine; hypergamy; readily; explains; female; quickly; break; example; becoming; aware; pluralistic; nature; hypergamy; greatest; threat; feminine; imperative; nothing; threatening; simultaneously; attractive; woman; aware; value; woman; woman; sexual; peak; across; ovulatory; cycle; tend; seek; high; testosterone; cued; alpha; pursue; short; term; breeding; strategy; phase; ovulation; menstruation; period; preference; switch; preferring; long; term; security; docile; secure; beta; provider; thus; filter; trait; pair; bonding; virtuous; woman; prove; validity; female; hypergamy; bright; intelligent; good; girl; selects; sexually; prepares; immediately; accessible; alpha-male; male; attractiveness; command; filtering; though; player; likely; provide; long; term; security; girl; fucking; head; hypergamy; biological; nothing; change; accept; hypergamy; woman; operative; state; time; hypergamy; care; relational; equity; woman; ability; control; hypergamy; regard; sexual; appetite; biological; imperative; surprised; leaf; whim; fuck; pablo; spring; break; complacent; phase; becoming; aware; true; long; term; value; woman; usually; around; almost; exactly; phase; wall; woman; hope; press; unaware; smv; long; term; provisioning; schema; careful; dating; woman; wall; woman; biopsychosocial; ideal; rich; good; looking; dressed; high; social; cache; high; prestige; preferably; involves; risk; physical; risk; monetary; risk; extroverted; dominant; leader; friend; group; able; command; social; situation; stand; term; lack; finesse; feminized; ideal; already; embedded; socialization; centrism; collective; social; consciousness; need; centralized; directorship; mindset; already; installed; perpetuated; society; large; normalized; taken; granted; self; perpetuating; shadow; conspiracy; illuminati; aware; unplugged; digested; pill; reminder; woman; inherent; solipism; everything; everything; confirms; assessment; default; root; grounded; woman; constant; born; psychological; quest; security; remember; advantage; bitch; goal; radical; feminist; leftist; beta; male; marginalize; ridicule; pill; individual; shame; curious; fear; underpinnings; centric; gynocentric; society; would; exposed; wild; panther; hypergamous; female; analogy; mistake; sometimes; fatal; ignore; know; surface; comforting; believe; special; connection; condition; right; preserve; relationship; based; mutual; trust; shared; affinity; flaw; believing; trust; kinship; unconditional; underlying; feral; motivator; subdued; point; inconsequential; special; bond; go; beyond; physical; relationship; still; founded; physical; rule; constantly; test; influence; individual; feel; fucking; good; suddenly; find; marginalizing; natural; impulse; feel; good; rationalization; beautiful; becomes; feral; go; kill; vital; frame; established; thing; woman; want; overall; frame; relationship; need; molded; reject; comfortable; embrace; uncomfortable; predictable; certainty; avoid; chaotic; uncertain; fueled; competition; anxiety; drive; avoid; flower; date; night; always; time; effort; better; spent; developing; relation; fresh; prospective; woman; ever; attempting; reconstruct; failed; relationship; integral; part; maintaining; feminine; imperative; social; imperative; involves; keeping; woman; primary; sexual; selector; mean; woman; sexual; strategy; necessitates; optimized; condition; capacity; allows; choose; best; male; available; satisfy; strategy; hypergamy; remember; woman; primary; sexual; selector; information; benefit; great; danger; high; fail; succeed; stop; fucking; settling; empower; already; overconfident; woman; doubt; powerful; tool; advantage; disregarding; woman; social; convention; league; casting; influence; feminine; imperative; nothing; kill; arousal; woman; pity; never; serf; best; interest; paint; pathetic; bumbling; mess; take; back; loser; bullshit; find; mythological; soulmate; time; tempt; fate; risk; life; quiet; desperation; contrivance; serf; interest; woman; imperative; enjoy; party; year; many; alpha; attract; later; stable; niceguy; petrified; live; life; loneliness; desperation; waiting; marry; ensure; long; term; security; comfortable; confident; true; independence; woman; want; associated; share; everything; experience; every; social; conditioning; receives; earliest; every; excepted; social; norm; every; expectation; qualify; definition; mature; adult; contemporary; society; defined; serve; female; imperative; exist; facilitate; feminine; reality; alimony; divorce; proceeding; career; choose; live; future; decision; disposable; woman; protected; established; feminine; reality; remember; move; deductive; analytical; mind; would; think; increase; false; eliminated; competition; anxiety; turn; imagination; familiarity; bread; comfort; lead; decreased; female; drive; woman; existential; imperative; happiness; contentment; protection; provisioning; empowerment; literally; anything; benefit; feminine; encouraged; socially; case; mandated; combine; woman; natural; innate; solipism; feminine; narrative; becomes; apparent; ever; term; lucky; referring; woman; feed; myth; feminine; mystique; propping; feminine; narrative; remember; sexuality; woman; first; best; agency; social; mechanism; contributes; value; always; encouraged; vice; versa; thing; challenge; woman; sexuality; denigrated; shamed; woman; beta; woman; want; want; woman; want; fuck; best; social; contrivance; inconspicuous; rarely; questioned; learned; without; formally; taught; feminine; imperative; woman; greatest; fear; become; selected; instead; selector; strive; return; traditional; masculinity; trait; independence; self; confidence; rugged; individualism; physical; strength; risk; taking; problem; solving; innovation; woman; break; rule; alpha; make; rule; beta; nothing; happen; accordance; nature,-1,
ck3nq0,OneLastTime1997,make; stuff; divorced; get; pissy; someone; year; younger,next; creative; writing; sub; divorced; victim; complex; obvious; everyone; calling; similar; link; archive; post; title; asshole; sending; family; angry; email; still; speak; husband; especially; light; present; relationship; girl; year; younger; archive; link; post; archive; ryiz; main; post; basic; background; kid; signed; divorce; paper; april; almost; year; drug; trying; fair; share; yeah; sure; detail; important; comment; affair; comment; aita; sending; family; angry; email; evfprdp; context; angry; embarrassed; lost; given; moment; feeling; like; replaced; year; surfing; instructor; everything; husband; kid; claim; friend; helping; learn; life; long; desire; surf; jesus; christ; give; break; cheated; want; husband; moan; husband; primary; custody; better; lawyer; able; manipulate; minor; misstep; part; court; seeing; huge; deal; yeah; right; sure; bridge; alaska; want; past; weekend; picked; kid; said; going; visit; parent; said; would; rather; thier; season; pass; world; since; spent; weekend; parent; aunt; stacey; uncle; brian; brother; sister; know; town; like; took; said; parent; invited; everyone; devastated; along; brother; sister; husband; know; coming; sink; without; tear; forming; sort; jested; guess; surf; instructor; daughter; said; actually; went; house; ocean; beach; gave; stacey; brian; lesson; included; devastated; took; kid; back; home; went; home; cried; hour; damn; aside; difference; spend; time; kid; daughter; help; twist; knife; done; sent; furious; email; entire; family; inappropriate; hanging; entire; weekend; little; chippy; massive; slap; face; fact; tell; town; alone; invite; make; feel; alone; imagine; respond; basically; said; rude; tell; stacey; brian; done; divorce; bradley; still; email; along; behavior; last; year; really; give; insight; might; want; family; event; ouch; spitting; cold; hard; fact; many; word; called; asshole; sending; email; edit; people; installing; narrative; post; read; wrote; decision; want; disregard; goldmine; comment; comment; victim; affair; year; according; manipulated; uneven; power; dynamic; comment; aita; sending; family; angry; email; context; sometimes; delusion; strong; mainstream; reddit; wake; smell; archive; link; profile; archive; spvsl,-1,
ck3n17,OneLastTime1997,make; stuff; divorced; get; pissy; someone; year; younger,,-1,
ck3l4w,OneLastTime1997,make; stuff; divorced; get; pissy; someone; year; younger,,-1,
ck37yg,OneLastTime1997,make; stuff; divorced; get; pissy; someone; year; younger,next; creative; writing; sub; divorced; victim; complex; obvious; everyone; calling; crossposted; mgtow; check; comment; history; link; post; title; asshole; sending; family; angry; email; still; speak; husband; especially; light; present; relationship; girl; year; younger; archive; link; archive; ryiz; main; post; basic; background; kid; signed; divorce; paper; april; almost; year; drug; trying; fair; share; yeah; sure; detail; important; comment; affair; angry; embarrassed; lost; given; moment; feeling; like; replaced; year; surfing; instructor; everything; husband; kid; claim; friend; helping; learn; life; long; desire; surf; jesus; christ; give; break; cheated; want; husband; moan; husband; primary; custody; better; lawyer; able; manipulate; minor; misstep; part; court; seeing; huge; deal; yeah; right; sure; bridge; alaska; want; past; weekend; picked; kid; said; going; visit; parent; said; would; rather; thier; season; pass; world; since; spent; weekend; parent; aunt; stacey; uncle; brian; brother; sister; know; town; like; took; said; parent; invited; everyone; devastated; along; brother; sister; husband; know; coming; sink; without; tear; forming; sort; jested; guess; surf; instructor; daughter; said; actually; went; house; ocean; beach; gave; stacey; brian; lesson; included; devastated; took; kid; back; home; went; home; cried; hour; damn; aside; difference; spend; time; kid; done; sent; furious; email; entire; family; inappropriate; hanging; entire; weekend; little; chippy; massive; slap; face; fact; tell; town; alone; invite; make; feel; alone; imagine; respond; basically; said; rude; tell; stacey; brian; done; divorce; bradley; still; email; along; behavior; last; year; really; give; insight; might; want; family; event; ouch; spitting; cold; hard; fact; many; word; called; asshole; sending; email; edit; people; installing; narrative; post; read; wrote; decision; want; disregard; goldmine; comment; comment; victim; affair; year; according; manipulated; uneven; power; dynamic; comment; aita; sending; family; angry; email; context; sometimes; delusion; strong; mainstream; reddit; wake; smell,-1,
ck37de,Andgelyo,contribute; something; refreshing; challenging; mind; contribute,getting; extremely; tired; reading; story; field; report; advice; common; circle; jerk; getting; laid; news; flash; pillers; getting; laid; slow; people; pill; getting; laid; seriously; every; post; dumb; fantasy; written; post; virgin; paid; hooker; somehow; girl; within; minute; meeting; seduction; subreddit; pill; freedom; self; betterment; control; one; life; could; give; fuck; fact; could; tinder; right; match; lv; value; whore; write; gave; head; within; minute; happened; anyone; experienced; pillers; agree; daily; reminder; post; something; substantial; information; thought; provoking; actually; useful; life; example; optimize; money; increasing; social; skill; climbing; corporate; ladder; avoid; divorce; rape; attract; quality; woman; tired; useless; bragging; banging; whore; give; shit; rant,-1,
ck1mjf,baiboosar,mgtow; boyfriend,,-1,
ck1d9r,Senator_Sanders,anyone; girl; watching; bachelor; degenerate; show,,-1,
cjzzbi,RadicalREDPILLERZ,advice,,-1,
cjztuy,RadicalREDPILLERZ,mgtow; boyfriend,,-1,
cjyxgq,titanayoux,young; seeking; advice,,-1,
cjx1d1,johncillo,thought; think; good; everyone,,-1,
cjvssz,Andrian-TQM,nietzsche; understood; human; nature; better; anyone; maxim; illustrate,,-1,
