post_id,author,title,body,image,image description
cilmio,majorfrankies,memento; mori; remember; world; forever; track; life,week; since; started; tracking; life; highlight; down; observing; enormous; success; using; excel; tracker; called; memento; mori; imgur; lchnbqc; imgur; lchnbqc; every; single; sunday; recap; week; think; stuff; done; take; note; excel; sheet; mark; week; done; know; week; happen; final; mark; done; something; really; good; write; green; done; something; highltights; down; look; back; improving; overtime; wasting; life; time; must; live; life; fully; like; last; pretty; good; reminder; forever; seriously; saying; massively; improved; life; past; month; something; every; week; order; fill; life; stay; home; bullshit; noticing; time; fly; scary; since; life; slowly; approaching; marcus; aurelius; said; death; fear; fear; never; beginning; live; there; nothing; scary; tracking; life; making; sure; time; approach; experienced; everything; life; offer; sample; link; download; excel; sheet; want; mega; mynwwkid; taqa; mclpr; zwnyirtijn; xltww; mega; mynwwkid; taqa; mclpr; zwnyirtijn; xltww; want; read; link; online; explained; better; scrawnytobrawny; scrawnytobrawny; anthonyjyeung; memento; mori; life; anthonyjyeung; memento; mori; life,-1,
ciijma,Dexmo93,spend; girl; according,,150,shady; illeh; according; kanye; good; girl; worth; thousand; bitch; according; wayne; bitch; come; dime; dozen; mean; good; girl; worth; good; girl; bitch; bitch; bitch; good; girl; bitch; bitch; goodgirl; retweets; like
cih8m3,oberlre02,seems; putting; woman; pedestal,,-1,
cig793,renaultcliodriver,form; commitment; especially; marriage; pill,gatekeeper; something; hand; card; table; pill; giving; marriage; worse; marriage; like; poker; table; giving; strongest; hand; possible; opponent; opponent; wait; prize; build; build; build; cash; using; strong; hand; gave; first; place; nothing; wrong; play; strongest; hand; exists; gave; ultimate; beta; move; commitment; general; beta; fuck; woman; know; fuck; alpha; refuse; settle; option; fake; commitment; main; chick; still; fuck; side; chick; really; care; investment; superficial; fake; want; sooner; later; get; older; realises; decides; plan; needed; go; find; beta; ready; fall; love; marries; hand; strongest; hand; possible; divorce; cash; cheating; entire; time; post; divorce; go; back; alpha; fucking; around; whilst; living; alimony; payment; apartment; beta; mostly; paid; commitment; strongest; hand; royal; flush; suit; card; representing; thing; want; attention; money; asset; status; feel; true; pill; bachelor; version; mgtow; understand; going; best; simply; still; fuck; around; whilst; refusing; commit; protect; strongest; hand; time; bluff; fake; commitment; make; move; best; probable; outcome; never; give; certainly; married; many; plate; commit; main; dish; side; dish; mean; need; actual; commitment,-1,
cidxyg,dalkride,stuck; landing; purpose,friend; house; party; night; people; decently; knew; people; went; intention; fact; walked; around; party; sole; intention; making; sure; everyone; name; cracked; joke; people; number; made; presence; known; worked; around; party; ended; settling; group; people; making; drink; kitchen; made; crushed; rocket; looking; drink; happily; took; went; around; mingle; talked; group; girl; asked; drink; spoon; different; girl; drink; finished; pretty; quick; noticed; girl; making; flutter; eye; laughing; harder; joke; iois; mixed; isolate; turn; came; party; together; straight; boyfriend; first; call; spoke; said; boyfriend; going; picking; night; fine; drop; conversation; move; attractive; friend; boyfriend; speaks; saying; boyfriend; giggled; took; invitation; advance; spent; time; dancing; kissed; cheek; returned; favor; started; grinding; escalated; physically; touching; hip; moving; start; pressing; dancing; kind; slows; grabbing; people; walk; kitchen; form; kind; circle; start; talking; whole; time; either; side; leaning; firm; grip; hand; pull; phone; start; showing; picture; boyfriend; grabbing; pushing; know; kind; laughed; eventually; broke; conversation; circle; move; sure; turn; took; notice; attention; getting; girl; approached; flirted; light; teasing; went; kiss; felt; right; ended; hooking; spare; bedroom; time; done; messing; around; party; kind; died; went; home; scoring; guess; question; could; done; land; instead; really; looking; advice; beta; scoring; stumbled; hooking; looking; advice; went; wrong; improve; future,-1,
cidi05,youcancallmedada,intimidated; bigger; roll; around,,-1,
ci9u4k,Gods_ssoldiers,look; indicator; health,,-1,
ci781o,PredatoryCat,redpill; career; thread,strong; blue; color; background; started; community; college; study; combine; love; building; academic; stable; wage; cuck; career; tell; guy; career; path,-1,
ci708l,BrooklynTerrier,successful; framing; last; night,last; night; plate; come; place; funny; thing; used; mess; around; younger; always; seemed; came; anything; sexual; would; freeze; indecisive; would; complete; opposite; thing; would; text; phone; week; randomly; snapchat; asking; number; weird; streak; week; maybe; true; girl; somehow; sense; change; sent; text; day; decided; yesterday; come; work; bedroom; rolling; drinking; liquor; stretch; time; tactic; accuse; going; straight; thing; start; saying; feel; real; house; rather; side; apartment; family; owns; hangout; music; group; come; saying; want; anything; sexual; cause; feel; thats; fine; quickly; started; retracting; attention; start; asking; question; life; answer; sincere; show; denial; effect; return; made; feel; comfortable; cause; every; girl; either; mine; group; mate; never; said; would; like; know; future; reference; answer; basically; excuse; thought; would; meeting; main; house; lament; made; trip; nothing; happening; said; could; suck; boob; atleast; something; came; visit; minute; tell; super; minute; missionary; keep; frame; guy; never; fall; denial; woman,-1,
ci6zp6,Greaterbird,video; game; woman,talk; woman; lose; interest; someone; long; history; playing; video; game; hobby; help; notice; parallel; game; poorly; designed; mess; seem; excellent; first; good; advertising; quickly; boring; lack; depth; variety; addictive; though; really; feeling; progression; keeping; thing; going; best; game; depth; variety; live; interesting; story; sometimes; find; break; rule; still; work; anyways; game; comfortable; place; like; revisit; might; release; content; pack; every; sometimes; finish; game; later; come; back; improved; sequel; like; worthless; slob; people; seem; technically; together; boring; guy; heavily; based; around; specific; niche; guy; advertise; flashy; clothes; nothing; else; going; think; base; another; angle; noticed; people; appreciate; thing; work; game; challenge; involved; cheat; turn; mode; everything; go; suddenly; feel; pointless; long; challenge; pull; away; give; little; elusiveness; control; progression; work; talk; thing; hard; give; make; easy; cheat; challenge; suggesting; becoming; fortnite; might; core; loop; daily; life; challenging; addictive; people; going; want; around; provide; feeling; progression; something; worked; towards; indicator; progress; help; secure; thing; long; rule; guide; thing; along,-1,
ci6qy9,drumperion,hater,look; around; pill; past; period; dude; telling; dude; woman; shit; treat; badly; manipulate; negativity; coming; reckon; morpheus; gave; pill; wake; become; real; self; objectify; trinity; treat; like; shit; bros; game; smv; come; better; person; life; prince; macchiaveli; fooling; macho; approach; maybe; year; still; hair; pussy; properly; friend; graduate; master; craft; indulge; hobby; good; excel; whatever; float; boat; treat; good; success; confidence; follow; advice; make; much; sense; proper; hold; able; utilize; much; broader; context; sitting; home; scheming; manipulate; bitch; fuck; tonight; keep; hatin; year; pas; never; young; shell; could; overall; decent; person; people; play; game; keep; think; critically; fair; honorable; negativity; keep; loop; alone; thought; spur; resentment; despair; stay; sharp,-1,
ci6ayt,Chaddeus_Rex,god; giveth; taketh; away,god; giveth; taketh; away; warning; long; field; report; turn; back; short; attention; span; like; reading; prelude; first; field; report; first; reason; wanted; share; report; brag; fellow; achievement; receive; critique; finally; provide; instruction; beginning; journey; game; seduction; subreddit; found; main; issue; theory; abstract; quite; implement; reality; opposite; problem; given; example; understand; related; theory; found; often; nuance; given; made; many; awkward; situation; experience; taught; otherwise; reason; save; noobies; pain; decided; rectify; situation; field; report; tinder; date; fate; whole; story; start; failed; tinder; date; failed; quite; correct; word; metric; success; mine; trying; achieve; matched; girl; tinder; slight; butter; face; skinny; picture; place; importance; anymore; facial; aesthetic; girl; posse; goal; increase; body; count; acquire; database; reference; experience; later; moreover; training; hone; technique; veteran; many; date; excited; date; anticipating; easy; girl; seemed; responsive; compliant; request; easy; measure; interest; text; quickly; responds; period; although; always; good; indicator; regardless; interest; favorite; way; build; compliance; test; interest; establish; frame; friend; pushover; text; come; looking; sexy; disagrees; though; surprised; many; girl; accept; frame; already; planted; seed; mind; potential; lover; text; game; interaction; interest; save; space; arriving; date; surprised; girl; weight; picture; indicated; decided; stick; bang; field; report; focus; happens; date; god; gift; simply; used; plausible; deniability; invite; house; wanted; rabbit; much; house; made; little; kicked; would; crack; regardless; various; busting; technique; used; simultaneously; frustrated; curious; know; prevented; letting; push; said; policy; experience; past; know; matter; policy; provided; change; mood; able; change; mood; mind; left; defeated; god; giveth; gift; decided; walk; back; train; station; enjoy; marvelous; night; take; train; back; home; live; town; usually; take; train; city; suburb; enjoy; carnal; pleasure; crossing; road; noticed; pretty; asian; girl; nice; thick; sexy; leg; dart; glance; want; home; thought; talk; felt; approach; anxiety; moment; walking; intention; approaching; think; interaction; would; gone; feel; approach; anxiety; dwell; fact; going; approach; think; approaching; fear; hit; could; think; indirect; opener; decided; direct; opener; cute; sexy; leg; passed; heartbeat; took; decide; ended; approaching; behind; scaring; apologized; scare; best; ease; noticed; accepted; opener; opened; easily; normally; mistake; approach; behind; scare; girl; make; afraid; case; fortuna; favored; since; fortune; fickle; would; make; approach; habit; suspect; opened; easily; given; interest; approached; relaxed; mood; fine; night; fact; working; improving; smv; fine; body; dressed; helped; open; approach; approaching; putting; ease; struck; normal; conversation; remember; exactly; went; memory; fade; fast; hurry; record; event; posterity; without; using; routine; asked; heading; said; heading; home; karaoke; friend; offered; walk; home; want; standing; long; walking; keep; nerve; away; generates; conversational; topic; idea; would; absent; stopped; place; opening; moreover; small; test; compliance; gave; option; reject; advance; every; time; accepts; move; little; towards; victory; ease; stranger; approach; night; told; want; walk; home; tell; leave; often; subreddit; hear; woman; like; overt; communication; entirely; accurate; overt; communication; good; tool; girl; ease; make; seem; friendly; agenda; never; state; sexual; intention; long; term; intention; towards; moment; walked; explained; lived; nearby; many; asian; people; like; going; area; abundance; cheap; food; said; pretty; hungry; night; took; hint; know; mind; reader; decided; assume; attraction; anyways; asked; wanted; food; since; eaten; anyway; need; know; came; date; another; girl; food; seduction; succeed; needed; part; whatever; claimed; asked; choose; place; brief; hesitation; suggested; shawarma; ordered; small; wrap; overly; hungry; needed; maintain; plausible; deniability; appearance; talked; talked; wanted; turn; mind; thinking; sexual; topic; broach; seeming; chill; thirsty; decided; best; course; action; come; direction; establishing; judgmental; could; bring; sexual; topic; without; breaking; plausible; deniability; friendly; dude; spontaneously; walking; home; train; station; told; seems; like; really; cool; judgmental; girl; judge; people; especially; sexually; explained; many; friend; judge; woman; sleeping; around; think; good; jumped; topic; told; exploit; lack; thereof; female; friend; described; friend; slept; year; acted; impressed; often; social; situation; quite; convincingly; convey; different; emotion; friend; exploit; called; bos; asked; girl; would; ever; something; wild; said; would; probably; meant; save; face; particularly; care; response; either; different; goal; mind; allowed; springboard; conversation; story; exploit; told; made; girl; asked; question; tell; many; story; bother; break; mystery; plausible; deniability; said; drunk; karaoke; friend; said; wanted; partner; hammered; protein; shake; bottle; front; said; start; forgot; topic; seems; natural; flow; conversation; soon; started; talking; strip; club; said; life; near; walk; every; never; inside; asked; check; surprised; agreed; point; began; hope; would; hook; hoping; early; put; expectation; body; language; muscle; since; began; hope; late; game; helped; relax; establish; cool; walked; strip; club; said; pretty; late; going; miss; home; okay; stay; roommate; hate; anyway; important; thing; note; hardly; matter; relationship; roommate; girl; tell; come; roommate; sometimes; girl; feeling; good; fully; belly; alcohol; tickling; brain; rationalizes; away; roommate; make; thing; happen; said; knew; would; hook; provided; fuck; anywhere; come; needy; wrong; passing; door; guard; settling; seat; ordered; shot; girl; rushed; assure; without; asking; would; next; round; investment; mean; want; disappoint; viewed; fair; kept; drinking; buying; shot; make; challenged; lemon; lime; come; without; flinching; taste; entire; time; club; saying; beautiful; woman; would; fuck; despite; liking; guy; eventually; made; suggested; leave; would; done; eventually; want; fast; wanted; turned; want; seen; thirsty; back; apartment; told; wait; outside; apartment; door; clean; room; wonder; cleaning; evidence; previous; encounter; hmmm; took; afraid; would; stand; last; minute; never; girl; assume; victory; inside; prepared; defeat; could; snatched; jaw; victory; unexpectedly; prepared; leave; opened; door; called; entered; turned; light; pounced; many; thing; pounded; choked; considering; pissing; mouth; gave; blowjob; afraid; would; suit; situation; seemed; enjoy; time; moaning; name; leaving; spot; sheet; god; taketh; away; never; know; morning; post; coitus; breath; smell; never; certain; keep; ruse; chill; accidentally; nipple; palm; wake; sleep; difficult; question; study; requires; time; reference; experience; perhaps; experienced; member; shed; light; mystery; woke; earlier; claimed; needed; wake; morning; want; round; night; furthermore; tired; previous; night; carousing; slid; palm; nipple; heard; small; moan; tried; escalate; regardless; would; would; progress; confused; eventually; gave; woke; dressed; snuck; together; wake; roommate; gave; number; half; heartedly; suspect; seeing; though; though; befuddled; sudden; change; attitude; previous; night; think; nothing; sexual; performance; seemed; quite; enjoying; previous; night; post; scriptum; problem; encountered; girl; told; lack; accent; many; youth; city; established; part; crowd; socially; relevant; crowd; acting; chill; agree; amplify; would; character; said; country; wonder; accent; hinder; future; conquest; girl; crowd; girl; enjoy; casual; acquire; accent; anytime; girl; want; question; issue; morning; story; told; possible; diagnose; condition; narrative; tried; highlight; success; error; perhaps; missed; something; would; like; someone; critiqued; could; improve; question; asking; final; word; want; mention; talked; girl; realized; progressively; redpill; truth; find; periodically; doubting; veracity; said; kind; encounter; especially; observant; serve; reinforce; truth; want; mention; people; claim; tinder; girl; trashy; girl; sleep; around; highly; mistaken; conclusion; report; proof; girl; elite; university; country; acquire; person; notch; count; hardly; matter; whether; pickup; girl; street; dating; moreover; never; girl; would; soaking; vagina; juice; total; stranger; pound; oblivion; within; hour; meeting; street; based; look; alone; dress; classy; study; friend; said; recommend; view; woman; slutty; word; synonym; one; lexicon; serf; purpose; labelling; girl; ruin; chance; make; mine; difficult; make; girl; enjoy; le; wanted; mention; reason; title; god; giveth; god; taketh; away; saying; adopted; pagan; christianity; saying; many; way; similar; memento; mori; mediation; vicissitude; fortune; gain; something; fast; quickly; lose; meant; instruction; hold; tightly; anything; moment; fortune; next; lose; fault; woman; next; moment; lose; chance; ephemeral; mood; although; suspect; lost; girl; feel; anything; small; pang; disappointment; disappeared; fast; came; however; sometimes; still; experience; attachment; woman; clutch; strongly; come; le; frequently; hope; field; report; educational; entertaining; certainly,-1,
ci4b89,Wakojako99,need; swallowed; need; regurgitated,,-1,
ci3kl8,lobstergenocide,,,-1,
ci2gpm,dopamiiine,example; blue; pill; behaviour; show; called; catfish,,-1,
ci14zf,Sisyphus_XIV,whole; year; slept; first; milf,,-1,
ci0p0n,Aethetico,became; beta; cuck,,-1,
chzxop,InoperableEuphoria,play; terrible; hand,objectively; terrible; hand; asian; male; ectomorph; underbite; skin; disease; moderate; acne; skin; oily; spend; much; time; outside; becomes; visibly; obvious; something; wrong; skin; treating; acne; make; skin; disease; worse; vice; versa; complicated; entire; face; used; another; time; almost; lost; eyesight; entire; face; covered; basically; highly; malicious; version; cold; sore; life; weird; struggling; treat; eczema; since; little; eczema; difficult; make; physically; uncomfortable; many; context; basically; like; rash; body; entire; life; treatment; sometimes; work; hardly; work; long; body; develops; tolerance; towards; battle; realization; underbite; short; really; hard; feel; secure; swing; fence; much; shit; deal; going; prestigious; college; month; kid; grew; white; wealthy; family; robust; social; circle; know; play; home; turf; speak; quite; hand; always; struggled; socially; adapt; eczema; despite; majority; asian; american; parent; poor; speak; english; mindset; basically; become; doctor; something; woman; flock; anyone; else; shit; hand; please; know; make; work; often; find; people; discus; fucked; face; extraordinarily; difficult; childhood; usually; discussing; spin; plate; effectively; something; usually; numerous; experience; girl; looking; score; gorgeous; girl; hookup; short; term; intimacy; whereas; really; struggling; develop; sort; impression; sexually; attractive; majority; woman,-1,
chzg3f,JackNapier368,polyamory; experience,,-1,
chzafx,cursedflame,first; nightgame; approach; ever,native; english; speaker; english; language; sorry; advance; make; typo; first; post; instead; asktrp; really; wanted; contribute; group; motivate; lurker; anyways; let; begin; buddy; decided; gent; located; belgium; practically; full; partying; night; plan; motivate; friend; pulling; took; lead; everything; regard; approaching; started; prepping; talking; random; stranger; throwing; obvious; flirting; towards; pretty; woman; mood; night; started; city; blooming; beautifull; people; awesome; music; heatwave; killing; friend; decided; grab; beer; started; dancing; quite; okay; dancer; eventually; gal; gravitated; towards; filled; approach; anxiety; getting; stuck; head; almost; accidently; touched; turned; around; locked; eye; started; dancing; teased; applied; kino; vibed; sexual; tension; time; friend; came; introduced; wouldnt; eventually; bath; room; asked; wait; spot; beta; shit; test; return; didnt; opened; another; friend; came; told; wanted; approach; set; wont; detail; many; set; approached; else; post; would; freaking; long; approached; arround; different; set; young; female; thing; dance; tease; kino; escalate; escalate; pull; rejected; time; felt; little; kept; going; come; kicker; friend; pretty; drunk; drunk; sober; either; kanye; west; song; dropped; middle; crowd; started; dancing; alot; people; joined; including; petite; friend; told; friend; girl; wouldnt; blocked; like; rejection; girl; cockblocking; white; knight; mate; guarding; took; hand; started; dancing; sexual; kissed; took; hand; looked; wing; okay; kiss; sensual; kept; giving; going; fuck; shit; eye; weird; like; know; sexual; thought; something; told; going; afterparty; back; hotel; seemed; cool; suddenly; told; friend; resulted; going; home; told; give; digit; said; left; okay; rejection; number; night; atleast; kissed; still; wanted; night; buddy; scouted; girl; started; dancing; towards; eventually; opened; white; knight; kept; intervering; pushing; away; smallest; friend; around; height; told; fuck; kept; cool; asked; girl; said; asked; liked; girl; didnt; reply; pushed; away; buddy; came; wanted; practice; defuse; situation; told; aint; make; move; girl; someone; else; told; going; dance; girl; kiss; dance; kiss; told; girl; goody; amsterdam; would; enjoy; dutch; obliged; wanted; come; point; wing; getting; tired; girl; came; back; tried; dance; eventually; girl; kept; nagging; wanted; home; went; pretty; done; getting; frustrated; going; honest; though; prize; mentallity; entire; night; lost; last; rejextion; happy; seem; past; kissing; stage; bring; home; lurker; scary; suck; make; stronger; approach; tonight; veteran; could; enlighten; actuallly; home; dont; past; kissing; groping; eachother; kissing; stage; tldr; scroll,-1,
chww47,spinster9999,body; language; improve; game,cross; post; seduction; guy; pick; last; year; toot; horn; think; fair; succesful; nontheless; happened; today; left; shocked; holiday; friend; pick; malta; following; problem; went; cold; approached; club; approchaes; however; experinced; problem; langue; barrier; turn; girl; dont; speak; english; french; italian; rendering; pickup; skill; useless; cant; really; approach; girl; dont; understand; saying; question; dear; redpill; adivice; next; week; mayne; body; language,-1,
chwakq,Dranklake123,never; girlfriend; missed; college; day; frustrated; want; change,,-1,
