post_id,author,title,body,image,image description
cbw2kn,azitah,foundation; natural; game,guide; natural; game; frequented; subreddit; year; left; shit; herp; derp; cover; literally; every; aspect; human; interaction; post; aspect; left; abundance; logistics; shit; test; vocal; tonality; look; side; know; term; mean; based; game; learned; ton; natural; could; explain; made; attractive; attempt; explain; actually; attractive; worked; woman; actually; regular; success; woman; care; opinion; keep; sitting; theory; land; hate; woman; anger; phase; long; time; woman; human; retard; larper; read; side; fuck; writing; worked; khhv; shit; became; president; party; fraternity; fucked; attractive; woman; turned; shit; around; know; social; know; larp; internet; fairy; tale; land; fuck; said; natural; game; type; good; player; natural; call; learned; natural; natural; guy; typically; decent; life; growing; supportive; parent; joined; sport; team; learned; early; failure; part; growing; friend; growing; similar; experience; attention; girl; early; first; sexual; experience; young; maybe; girlfriend; middle; school; continued; became; natural; learned; natural; attempt; emulate; behavior; using; variety; technique; difference; real; natural; learned; natural; learning; game; year; success; woman; slept; many; attractive; woman; past; girlfriend; attractive; sorority; type; would; consider; smoother; percent; male; population; escalate; proper; time; banter; basically; anyone; never; away; approaching; natural; make; look; like; joke; compared; actual; natural; look; like; stiff; automaton; attempting; human; escalate; like; water; like; made; natural; friend; college; football; basketball; player; fraternity; guy; still; blow; away; every; time; natural; function; modus; operandi; natural; series; mental; algorithm; pump; state; constantly; inexperienced; virgin; might; internal; belief; like; worth; love; unfunny; natural; life; cultivated; belief; like; following; shit; woman; love; attractive; human; earth; kanye; west; case; actual; learned; natural; cultivate; belief; mediation; reference; experience; example; beautiful; woman; much; people; young; beginner; might; take; rejection; poorly; exist; approach; girl; tell; fuck; something; rejection; pas; extremely; positive; delusional; internal; monologue; explain; like; fishbowl; film; brain; allow; negative; word; woman; penetrate; penetrate; psyche; natural; work; delusional; keep; state; wheras; someone; like; addition; incorporate; process; approaching; get; zone; course; night; week; month; fire; majority; lay; happen; take; friend; vraj; vraj; natural; short; indian; speak; english; asked; year; vraj; flirt; talk; woman; answer; indicative; natural; talk; say; broken; english; roughly; translates; azitah; need; state; number; delusional; mental; algorithm; keep; positive; state; short; indian; barely; speaks; english; deluded; ever; since; young; approached; woman; approach; anxiety; really; girl; talk; must; think; something; instance; seems; like; retarded; broken; english; come; across; another; hilarious; joke; know; take; thing; seriously; second; funny; indian; talking; major; next; tounging; talk; brother; type; attitude; guy; good; woman; type; thinking; least; limited; experience; natural; seems; universal; among; attempt; learn; game; naturally; mainstream; medium; told; pick; line; routine; game; learned; nothing; game; among; thing; essentially; becoming; cool; person; overcoming; baggage; relating; woman; woman; level; building; attraction; routine; canned; line; like; training; wheel; timing; discard; favor; becoming; natural; cornerstone; natural; game; owen; best; frame; control; humor; raising; emotion; getting; chase; validation; higher; status; girl; always; adding; energy; hyper; focused; engagement; high; value; mannerism; vocal; tonality; body; language; triggering; saying; something; retarded; frame; control; frame; short; lense; interaction; take; place; talk; bos; different; talk; friend; talk; girl; different; talk; bos; asks; come; office; asks; going; asking; going; need; aware; thing; trying; game; hottest; woman; engaged; battle; reality; whoever; strongest; reality; win; reality; queen; usually; always; supplicate; reality; woman; usually; cling; strongest; reality; find; world; call; alpha; natural; typically; strongest; reality; control; frame; supplicate; qualify; qualifying; feel; right; show; watch; biceps; stomach; feeling; like; something; wrong; know; deep; attempting; impress; mean; natural; alpha-male; male; beta; male; disguise; attract; woman; high; value; mimicking; feed; reality; laughing; sense; really; want; something; turn; head; away; second; hanging; every; word; really; high; point; though; like; twice; snap; head; attention; speaks; slowly; turn; head; towards; frame; prize; lucky; talking; frame; really; really; really; really; really; want; woman; tell; pedestal; playful; misinterpretation; negs; push; pull; thing; bring; reality; need; machine; maybe; twice; depending; woman; advanced; guy; look; humor; raising; emotion; humor; sign; intelligence; humor; fantastic; building; attraction; funny; mean; vibe; socially; banter; people; effectively; funny; threefold; need; understand; humor; watch; comedy; comedy; special; universal; timing; comedy; secondly; need; self; judgment; judging; everything; make; laugh; woman; need; hear; perfectly; timed; real; joke; laugh; something; simple; wanted; tell; make; laugh; said; right; energy; thirdly; need; able; free; associate; free; association; essentially; letting; energy; humor; flow; able; riff; forever; anything; traditionally; called; golden; mouthpiece; million; dollar; mouth; best; player; consider; frame; everything; value; simply; laugh; simply; want; getting; chase; validation; slept; woman; league; league; exist; people; want; fundamentally; validation; entirely; physical; estimate; anywhere; percent; reason; human; want; validation; want; validated; person; understood; good; enough; powerful; motivator; human; being; people; dedicated; entire; life; chasing; feeling; fulfillment; good; looking; woman; guy; le; good; looking; want; validation; going; back; earlier; example; would; snap; head; attention; say; something; validating; would; already; given; validation; need; contribute; conversation; need; feel; like; miss; something; engaging; traditional; game; would; negs; disqualifiers; purpose; work; consider; example; however; look; like; know; party; high; five; assume; familiarity; always; open; laugh; name; sound; like; valley; girl; like; little; valley; girl; grew; actual; valley; okay; like; neck; nooooo; laugh; dumb; valley; girl; degree; psychology; qualification; understand; accent; thick; push; pull; said; degree; psychology; investment; chasing; opinion; degree; pretty; standard; open; notice; hypothetical; immediately; congratulate; degree; continue; emotion; start; chasing; validation; dude; need; time; escalation; good; book; higher; status; girl; relationship; large; transactional; nature; need; think; get; something; hooking; social; butterfly; maybe; get; connection; case; similar; previous; section; validation; fundamentally; employ; thing; talking; come; across; high; status; gain; sleeping; validation; ever; unattractive; girl; flattering; second; really; mean; anything; girl; feel; like; gain; nothing; give; validation; constantly; lower; status; want; prize; outgoing; everyone; like; hilarious; attractive; high; status; loser; always; adding; energy; woman; make; decision; come; go; body; asks; feel; right; feel; good; go; feel; order; compliance; always; adding; energy; humor; push; pull; thing; talked; hell; canned; line; story; good; enough; improvised; stuff; always; congruent; high; point; laughing; eye; pull; move; foot; always; compliance; know; basic; pick; advice; important; view; need; energy; make; move; think; like; adding; energy; allows; energy; value; cool; adding; value; night; else; would; talk; like; would; approach; like; want; anything; want; give; good; vibe; energy; give; number; energy; value; added; energy; could; seen; better; guy; hundred; thousand; approach; luck; mind; imagine; really; mean; went; said; rapport; seeking; tone; hand; shrugging; thing; stared; said; okay; approach; retard; already; mind; primed; energy; success; every; time; terrible; mood; think; time; slog; another; night; beta; male; moment; need; positive; either; help; read; book; meditate; something; anything; keep; mind; typical; depressing; thought; pattern; approach; going; activity; like; frame; pulling; woman; world; rather; seeking; validation; moment; look; tell; validation; seeking; adding; energy; moment; look; usually; first; sticking; point; people; game; hyper; focused; engagement; woman; problem; hand; want; high; value; alpha; hand; exact; type; engage; bust; back; kick; sure; much; woman; prefer; engagement; incels; woman; want; highest; value; reality; woman; want; highest; value; engage; actually; give; fuck; need; strong; contact; decisive; movement; need; find; way; relate; saying; chase; engage; mind; body; hand; feel; like; need; self; sufficient; adult; male; hand; still; want; engagement; paradox; game; approaching; need; free; outcome; strike; balance; success; high; value; mannerism; vocal; tonality; body; language; taking; space; pointing; hugging; kissing; generally; physical; standing; leg; least; meter; apart; proper; posture; leaning; respecting; space; appearing; relaxed; speaking; quickly; eager; speak; using; seeking; rapport; tonality; asking; everything; form; question; speaking; weird; unnaturally; high; voice; verbose; brief; projecting; thinking; valuable; enough; heard; approaching; foot; planted; front; going; hand; using; high; five; finger; clasped; hold; pretend; dancing; thing; came; spot; gist; look; like; chode; triggering; saying; something; retarded; stand; anti; slut; defense; said; earlier; woman; want; highest; value; engage; actually; meant; woman; want; highest; value; engage; without; looking; like; slut; woman; constantly; judged; society; friend; family; sexual; desire; game; boil; building; initial; attraction; fucking; rest; interaction; build; attraction; high; point; move; around; little; compliance; pull; number; must; left; gist; need; simply; fuck; fuck; saying; incongruent; retarded; shit; sense; energy; second; guess; entire; interaction; natural; anything; right; make; feel; like; slut; give; judgmental; vibe; number; turn; back; friend; give; secret; tell; friend; second; second; isolate; high; point; escalation; respectful; tounge; front; friend; respect; right; private; intimate; slight; understanding; fundamental; game; need; kybalion; text; contains; hermetic; teaching; century; thing; say; given; knowledge; must; hoarding; knowledge; without; putting; destroy; must; game; week; hour; focus; thing; mentioned; make; mission; next; time; approach; many; people; intention; moving; foot; next; week; laughing; smiling; wide; eye; pick; something; funny; every; group; girl; approach; make; friend; isolate; saying; something; like; dangerous; extends; hand; dangerous; group; scare; take; hand; time; break; funny; shit; pull; side; entire; group; laughing; attractive; laugh; pull; game; iterative; take; seriously; practice; different; aspect; hard; incorporate; together; pretending; high; value; high; value; lastly; learn; game; reading; thread; learn; going; several; hour; week; actually; talking; people; stuff; like; jump; start; forgotten; something; literally; know; mean; approach; stop; whining; like; bitch; thanks; reading,-1,
cbttro,booyongdave,must; paedophile,,-1,
cbttp3,HarpreetASingh,female; paedophile; incited; engage; vile; act,,-1,
cbt087,sirtrixxxalot,tricking; simping,,-1,
cbsgkh,sorryforthelifestory,epidemic; woman; inflated; sense; fabulousness,,-1,
cbsdeu,sorryforthelifestory,epidemic; woman; inflated; sense; fabulousness,,-1,
cbs1v4,sniper1905,short; go; crazy; bagel; store,,-1,
cbqk10,PM_ME_UR_1ITIS_SNAP,cucked; capitalism,three; morning; three; month; underwear; dimly; room; aided; light; computer; screen; sleep; soon; four; hour; sleep; need; anyways; seven; tab; open; eight; brain; flooded; dopamine; picturing; harem; woman; longer; abstraction; notice; mirror; reacquainted; fuck; screen; fade; black; alone; staring; eachother; across; information; highway; distance; barely; recognize; eachother; disgusted; naked; throbbing; erection; everything; morning; thank; amazon; bought; anything; capitalism; operates; playing; insecurity; simultaneously; causing; solution; source; problem; spice; commercial; feature; hypermasculine; high; energy; male; implying; going; girlfriend; stop; spice; make; stand; running; commercial; couple; year; traffic; heard; singing; sweet; caroline; appears; occupy; little; world; woman; entitled; pull; next; light; start; singing; married; kid; white; collar; job; dy; month; surrounded; loving; kid; always; call; course; going; alone; pure; soul; fact; soul; many; example; could; used; demonstrate; point; underlying; theme; nearly; commercial; consume; consume; much; possible; become; best; version; dope; jacket; expression; individuality; crazy; popular; fashion; blog; telling; speaking; blog; piller; damnit; woman; nowhere; seen; might; something; fact; subjected; personality; test; primary; concern; would; aligns; alpha; ideal; consumer; identify; view; intersexual; dynamic; pretty; dude; said; telling; people; newfound; desire; wear; black; shirt; drug; time; living; tiny; house; smash; different; girl; every; everyone; secret; start; find; something; else; make; different; interesting; quiet; little; revolutionary,-1,
cbo69j,disabledtrp,anger; phase; practical; example,,-1,
cbnym2,disabledtrp,anger; phase; practical; example,,-1,
cbl0eo,UnjustNation,terminator; dark; fate; director; mackenzie; davis; scare; misogynist,,-1,
cbkga2,trueliberal1,banned; mgtow; saying; history; whitewashed,,-1,
cbk35q,UpperRedSide,care; le,newly; pill; internalized; beginning; apply; life; used; combination; mystery; method; hottest; girl; workplace; come; apartment; night; proud; literally; everyone; wanted; physical; admit; scared; escalate; girl; fucked; week; happened; stopped; texting; snapping; back; stopped; flirting; person; fell; sadness; understand; girl; showed; interest; since; moved; parent; house; felt; lifetime; chance; wrong; make; effort; small; effort; meet; people; going; ever; growing; social; circle; chock; full; attractive; girl; additionally; assuming; lifting; grooming; keeping; finance; order; mental; health; cared; attracted; quite; plate; little; ensemble; girl; talk; sudden; first; consequence; wrong; still; want; fuck; emotional; investment; situation; zero; option; truly; death; oneitis; feeling; strong; convinced; never; able; shake; move; enough; people; feeling; rolled; like; water; duck; back; beginner; like; maybe; never; gotten; around; cultivate; option; thing; hear; another; actually; first; thing; made; something; work; wonder; beginner; look; getting; started; allow; little; victory; take; care; everyone; plan; meet; tall; blond; last; night; bombed; question; talking; invaded; personal; space; asked; girlfriend; difficult,-1,
cbgxj1,Zackville,comedian; bobby; realises; girlfriend; golddigger; people; laid; bitch,,-1,
cbfk46,Dwarf90,society; without; marriage; bacward; tribe; hailed; icon; progressivism,,-1,
cbfdu5,ruboius99,youtube; channel; coachgregadams; full; easy; digest; knowledge,,-1,
cbev9i,mitzibishi,another; tinder; experiment,,-1,
cbeu8w,mitzibishi,easy; woman; dating; apps,,-1,
cbe0yh,Mind_ripper,yall; ready; laugh,,-1,
cbdrs3,benmandoss,finding; deeper; sexual; connection; empathy; good; using; emotion,,-1,
cbdfoi,benmandoss,finding; deeper; sexual; connection; empathy; good; using; emotion,,-1,
cgd5pa,LastRevision,dawn; dead; kill; party,,-1,
cgcbx7,mantools,eagle; dragon; chris; scientist; duffin; interview; tool; podcast,,-1,
cgbvix,NovaGD,,,-1,
cgb982,ComplexProjection,illustration; vaginabrain,repost; think; first; blocked; posted; quite; theoretical; article; brain; human; especially; woman; working; vaginabrain; want; illustrated; benefit; keep; short; highlight; specific; interesting; part; day; matched; girl; tinder; year; cute; would; average; chubby; dude; broad; shoulder; around; conversation; start; quite; point; part; liked; thanks; playing; fire; tease; proposed; meeting; chat; said; bold; agree; wanted; ramen; night; proposed; along; pick; thus; power; choose; venue; restaurant; discussion; flowing; quite; mundane; still; kino; reacts; touching; return; tried; seed; pull; explaining; liquor; amateur; come; tasting; session; answer; like; liquor; leave; restaurant; proposed; either; place; want; place; thus; pick; agreed; left; restaurant; went; back; want; kiss; refused; saying; breath; kiss; anyway; reciprocated; pushed; trunk; made; grinded; crotch; decided; pull; home; parked; street; explaining; close; need; take; sweater; place; cold; entered; appartement; closed; door; behind; directly; wanted; taste; liquor; said; started; drink; kissed; started; touching; heavily; moved; couch; stopped; said; going; soon; answered; going; minute; resume; kissing; could; feel; getting; horny; started; removing; clothes; stopped; saying; quick; agreed; started; kissing; body; everywhere; without; removing; clothes; armchair; made; laugh; said; came; grab; sweater; answered; right; take; going; move; resume; kissing; exposing; breast; sucking; point; getting; impatient; minute; kissing; long; stand; carry; tried; pant; said; naked; next; want; gave; handjob; came; said; take; shower; accepted; naked; shower; still; tried; resistance; soon; deep; inside; period; probably; opposed; much; resistance; since; really; care; still; always; agreeing; asking; still; wanted; pace; adapted; never; forced; circumvented; boundary; every; time; relaxed; receives; opposition; every; request; welcomed; agreement; pleased; get; want; physical; touch; able; oppose; anymore; happens; know; think; dedicated; favourite; incel; enemyasmodeus,-1,
cgb7r7,BoredOverlord,supplement; guide; modern,,-1,
cg9r0e,Mind_ripper,jordan; peterson; female; hypergamy; impact; human; evolution,,-1,
cg974b,zolft,virgin; journal,,-1,
cg946d,zolft,virgin; journal,,-1,
cg8djb,justlibertarian,need; frame,potential; plate; last; night; good; time; wild; beach; overall; enjoyable; experience; leave; apparently; forgot; goodbye; kissed; goodbye; entire; thing; proceeds; next; talking; much; hurt; made; feel; worthless; absolutely; idea; anything; wrong; apologize; kept; trying; start; shit; mean; rude; nothing; facetiming; say; think; proceed; relationship; simply; responded; ended; call; proceeded; unmatch; tinder; minute; later; facetimes; said; asked; expect; something; like; going; crazy; right; couple; moment; silence; pas; reply; pranked; working; told; tuesday; like; nothing; ever; happened; except; care; le; obvious; interaction; however; much; believed; saying; give; shit; told; want; thing; life; free; know; fact; time; began; grovel; forgiveness; attention; would; question; absolutely; blew; mind; really; showed; important; frame,-1,
cg8bn7,KatFarts69,counter; meme; sent; chick; girl; think; dude; cheat; ugly; skank; actually; cheat,,141,think; actually; cheat; cheat
cg7glx,disciplinedFreedom,last; chance,watch; netflix; season; episode; starting; minute; mark; hypergamy; female; nature; grand; display; pretty; amazing; stuff,-1,
cg5ekg,sorryforthelifestory,smoke; weed,weed; raise; estrogen; level; sciencedirect; science; article; sciencedirect; science; article; weed; decrease; testosterone; growth; hormone; tobacco; increase; raise; cortisol; catabolic; hormone; ukcia; research; endocrineeffects; ukcia; research; endocrineeffects; ncbi; pubmed; ncbi; pubmed; ncbi; article; ncbi; article; ncbi; pubmed; ncbi; pubmed; weed; reduces; volume; various; region; brain; negatively; effect; motivation; ncbi; article; ncbi; article; weed; cause; depression; anxiety; disorder; ncbi; pubmed; ncbi; pubmed; ncbi; pubmed; ncbi; pubmed; ncbi; article; ncbi; article; ncbi; article; ncbi; article; ncbi; pubmed; ncbi; pubmed; ncbi; pubmed; ncbi; pubmed; journal; plo; plosone; article; journal; pone; journal; plo; plosone; article; journal; pone; journal; plo; plosone; article; journal; pone; journal; plo; plosone; article; journal; pone; weed; worsens; symptom; social; anxiety; disorder; ncbi; article; ncbi; article; weed; cause; long; term; cognitive; damage; ncbi; article; ncbi; article; ncbi; pubmed; ncbi; pubmed; ncbi; article; ncbi; article; jamanetwork; journal; jamainternalmedicine; fullarticle; jamanetwork; journal; jamainternalmedicine; fullarticle; ncbi; article; ncbi; article; journal; plo; plosone; article; journal; pone; journal; plo; plosone; article; journal; pone; pnas; content; full; pnas; content; full; ncbi; article; ncbi; article; weed; cause; psychotic; disorder; ncbi; article; ncbi; article; ncbi; pubmed; ncbi; pubmed; ncbi; article; ncbi; article; ncbi; article; ncbi; article; child; father; smoke; weed; likely; suffer; sudden; infant; death; syndrome; ncbi; pubmed; ncbi; pubmed; weed; legalisation; result; frequent; sciencedirect; science; article; sciencedirect; science; article; journal; plo; plosone; article; journal; pone; journal; plo; plosone; article; journal; pone; weed; cause; lung; damage; ncbi; pubmed; ncbi; pubmed; ncbi; pubmed; ncbi; pubmed; ncbi; pubmed; ncbi; pubmed; nature; article; npjpcrm; nature; article; npjpcrm; ncbi; article; ncbi; article; monaldi; archive; index; macd; article; view; monaldi; archive; index; macd; article; view; secondhand; weed; smoke; impairs; psychomotor; function; working; memory; ncbi; article; ncbi; article; weed; addictive; ncbi; article; ncbi; article; weed; cause; deficit; dopamine; release; nature; journal; full; html; nature; journal; full; html,-1,
cg4oo5,afroninja02,brand; blue; pill,first; real; major; relationship; ended; like; guess; really; like; ready; commitment; know; wasnt; made; first; time; ever; enough; always; nice; tried; caring; treat; equal; starting; think; went; wrong; basicly; looking; rundown; basic; tactic; terminology; first; sexual; experience; dont; know; would; casual; looking; general; advice; word; knowledge; high; schooler; aspiring; redpiller; currently; working; great; friend; group; question; comment; answer,-1,
cg4o3o,backdoorinvestor,feminine; solipsism; example; public; space; public; space,,142,peco
cg4myb,h0tB0xing,dating; someone; generally,went; date; girl; today; spring; like; sure; going; find; someone; else; taking; care; someone; el; generally; guy; experience,-1,
cg1aoy,kazi6898,wrong; woman; sexual; desire; shyness,group; flawed; extremely; flawed; guy; getting; woman; wrong; easy; affffffffff; could; game; girl; sister; almost; everyone; passed; woman; barrier; frame; yall; bunch; insecure; woman; hurt; broo; take; advice; idfc; girl; getting; girl; hanging; fruit; confident; sexuality; quote; shia; islam; imam; follows; almighty; created; sexual; desire; part; gave; nine; part; woman; almighty; given; woman; equal; part; shyness; would; nine; woman; related; toss; post; loss,-1,
cg145e,viagraeater,book; recommendation; moral; animal; robert; wright,,-1,
