post_id,author,title,body,image
hkn812,jansolo76,human; mating; process; fault,developed; specie; human; unnessecary; complex; laborious; mating; process; society; fault; kind; many; people; usually; woman; overly; complex; find; partner; mostly; people; leave; house; often; problem; socialising; modern; technology; strongly; rely; internet; people; baited; pick; artist; offering; questionable; advice; money; dating; apps; real; chance; paying; money; going; meet; people; fashioned; tough; example; poor; social; skill; often; opportunies; limited; club; bar; good; place; often; loud; music; depending; culture; approaching; people; street; flirting; waitress; talking; people; train; good; idea; heard; skandinavia; youth; club; designed; meet; circumstance; problem; rather; mindset; dealing; finding; partner; everyone; experience; much; unnessecary; efford; moment; humanity; florishes; making; thing; easier; ourselfs; case; last; thing; would; benefit; mental; health; many; people; change; society; feel; free; discus; change; might; look; like; nessecary,-1
hkldro,After_Way8809,think; woman; really; want; equality; relationship,,-1
hkjqw5,jwdino,anybody; watch; naked; afraid,usually; watch; parent; house; busy; little; time; naked; afraid; baybay; best; male; female; psychology; experimentation; ever; seen; instance; people; hate; despise; opposite; gender; usually; come; immediately; fact; one; usually; fail; quickest; split; usually; people; kind; secret; gender; biased; belief; ego; general; typically; ego; first; hurdle; group; experience; either; start; passive; aggressiveness; get; held; within; week; explosion; occurs; people; start; arguing; dropping; competition; time; one; surviving; woman; work; stay; together; time; includes; humility; taking; positive; support; role; group; member; able; work; perform; certain; task; someone; get; hurt; person; know; perform; required; skill; person; remains; emotionally; supportive; go; long; belief; gender; stone; throwing; world; problem; technology; vanished; would; immediately; people; breaking; death; communication; addressing; matter; extremely; important; gender; blaming; lack; empathy; immature; said; love; internet; transportation; many; thing; technology; given; think; come; remembering; came; going; watch; recommend; otherwise; stay; outside; stuff,-1
hkj96v,Throughawayman80808,guy; think; naturally; biological; level; prone; loneliness,thinking; saying; woman; feel; lonely; feel; like; le; woman; lamenting; crushing; lonliness; lack; intimacy; compared; browsed; trufemcels; many; time; feel; like; romantically; failed; unattractive; woman; completely; consumed; hobby; work; often; outwardly; seem; apathetic; romance; seems; like; woman; either; better; distracting; lack; romantic; success; generally; le; bothered; willing; wager; woman; self; identity; aromantic; totally; sure; guy; think,-1
hkivmy,lolteejuan,think; hypergamy; rule; extremely; exaggerated,recently; come; across; statistic; curious; discovered; interesting; result; investigation; found; study; concluded; ratio; male; female; tinder; alone; percent; female; user; base; around; percent; account; female; side; tinder; generally; higher; count; network; trying; scam; lonely; evidence; hypergamy; rule; observed; based; around; online; dating; study; seems; throughout; site; apps; percentage; disparity; woman; high; bring; meaningful; data; thought,-1
hkivhj,ytfem20,woman; roast; beef; vagina; different; micropenis,,-1
hki3kc,idkdksosif,bisexual; theredpill; discouraged; dating; woman; long; term,,-1
hkez2k,TazeThemAll,woman; worth; effort; expected,constantly; reminded; area; life; must; improve; worthy; average; woman; woman; worth; effort; maybe; woman; entire; life; felt; attractive; grounded; intelligent; sweet; honest; enough; worth; effort; seduce; woman; want; lazy; pudgy; woman; want; stylish; slop; around; activewear; time; woman; want; confident; courage; want; woman; want; wealthy; broke; woman; want; funny; zero; sense; humour; woman; want; smart; incredibly; dull; boring; woman; worth; effort,-1
hkect4,Thanos25,understand; marriage,understand; guy; marriage; seen; benefit; divorce; court; completely; bias; lose; kid; asset; falsely; charged; domestic; abuse; cheat; fault; woman; cheat; fault; woman; claiming; enough; economically; attractive; good; claim; much; making; money; woman; need; make; money; woman; cheat; pregnant; would; still; child; support; divorce; still; take; care; child; tell; love; shit; go; away; honeymoon; phase; unrealistic; expectation; want; making; place; still; able; cook; clean; fuck; shit; damn; rather; play; survival; evolved; would; marriage; understand; fuck; right; mind; would; sign; document; allowing; someone; fuck; million; way,-1
hkc5ko,jcandres-,thing; every; least; everyone; aspiring; best; version,dress; know; probably; give; damn; style; idea; difference; make; look; feel; exercise; lift; weight; calisthenics; activity; physically; active; matter; respect; idea; game; work; start; respecting; putting; anyone; matter; hottest; girl; ever; seen; better; trying; super; nice; help; unless; personally; help; go; person; comfort; others; always; first; always; working; towards; goal; maybe; want; save; money; first; want; lose; weight; really; matter; hard; goal; make; sure; always; working; accomplish; give; sense; meaning; life; learn; game; learn; everything; learn; basic; find; way; implement; life; please; ob; pill; pill; blue; pill; purple; pill; pill; many; good; advice; deeper; need; find; acting; toxic; towards; opposite; people; believe; different; concept; still; know; trust; experience; first; hand,-1
hk86hs,momentumguy,young; woman; keep; denying; dating; easier,,-1
hk7dz2,Flypaste,awalt; portrayed; inevitability,feel; like; point; awalt; along; line; every; woman; capacity; cheat; referenced; like; every; woman; cheat; matter; clearly; false; adjacent; community; approach; black; white; manner; like; brag; ability; ass; reality; objectively,-1
hk6y9v,slattdeep,look; matter; make; woman; feel,,-1
hk6cz8,animeking8979,general; thought; dating; blue; pill,,-1
hk4y2l,Azihayya,male; predatory; stalking; behavior; inherently; male; trait,whenever; idea; rapist; rapist; brought; soft; hearted; quick; shoot; idea; generalize; like; small; percentage; rapist; rest; good; often; people; apart; awalt; crew; believe; female; hypergamy; baked; female; genetics; question; male; predatory; stalking; behavior; baked; male; genetics; predatory; stalking; behavior; natural; response; female; hypergamy; female; coveted; resource; compete; woman; powerful; generally; secure; woman; woman; choose; successfully; reproduce; must; lean; predatory; stalking; behavior; manipulation; order; secure; progeny; female; perspective; le; attractive; much; higher; security; threat; attractive; need; rely; predatory; stalking; behavior; order; find; mate; thus; exacerbating; effect; female; hypergamy; lot; people; sexual; revolution; unleashed; female; hypergamy; need; return; time; slut; shaming; order; quell; undesirable; behavior; imagine; punishment; social; stigma; law; today; deter; male; predatory; stalking; behavior; would; behavior; absence; social; stigma; become; apparent; overall; majority; love; believe; select; majority; instinct; really; privilege; tested; trait; think; common; stalk; woman; interested; prior; making; move; worker; whose; facebook; hundred; time; know; favorite; food; color; album; pretending; like; still; know; casually; like; coffee; sometime; turned; send; dozen; message; facebook; starting; politely; ending; calling; bitch; young; develop; deep; crush; girl; interested; relationship; ever; established; convenient; think; puppy; love; challenged; could; admit; pattern; behavior; actually; stalking; mating; strategy,-1
hk47hu,ComprehendDuel,paternity; test; mandatory; birth,reason; mandatory; paternity; test; newborn; usual; argument; hear; shouldnt; mandatory; paternity; test; sign; birth; certificate; usual; response; argument; help; married; woman; husband; assumed; father; name; go; birth; certificate; default; result; personal; paternity; test; turn; father; still; forced; invest; child; genetically; still; hook; child; support; year; marry; woman; trust; usual; response; argument; nobody; would; marry; person; trust; someone; cheated; trusting; person; tricked; deceitful; devious; person; good; honest; woman; nothing; lose; paternity; test; mandatory; good; honest; trusting; protected; mandatory; test; dishonest; deceitful; devious; woman; one; protected; paternity; test; mandatory; protect; deceitful; woman; commit; paternity; fraud; additionally; mandatory; paternity; test; would; stigma; associated; trusting; wife; paternity; test; mandatory; newborn; mean; everyone; take; woman; would; ever; feel; offended; feel; like; trust; case; optional; paternity; test,-1
hk40vb,ComprehendDuel,reason; mandatory; paternity; test; newborn,usual; argument; hear; shouldnt; mandatory; paternity; test; sign; birth; certificate; usual; response; argument; help; married; woman; husband; assumed; father; name; go; birth; certificate; default; result; personal; paternity; test; turn; father; still; forced; invest; child; genetically; still; hook; child; support; year; marry; woman; trust; usual; response; argument; nobody; would; marry; person; trust; someone; cheated; trusting; person; tricked; deceitful; devious; person; good; honest; woman; nothing; lose; paternity; test; mandatory; good; honest; trusting; protected; mandatory; test; dishonest; deceitful; devious; woman; one; protected; paternity; test; mandatory; protect; deceitful; woman; commit; paternity; fraud; additionally; mandatory; paternity; test; would; stigma; associated; trusting; wife; paternity; test; mandatory; newborn; mean; everyone; take; woman; would; ever; feel; offended; feel; like; trust; case; optional; paternity; test; everyone; thought; argument; mandatory; paternity; test,-1
hk1scf,Hackars,life; smv; treat; woman; respect; versus; asshole; result; social; romantic; rejection,,-1
hk0tve,cosmicalmess,surprised; look; matter,,-1
hjzyhj,KickKathleeenKennedy,relationship; important; partner; post,talking; couple; picture; maybe; post; acknowledges; partner; show; people; actually; relationship; woman; always; thought; flag; never; wanted; post; together; post; photo; make; comment; make; look; like; interested; woman; social; medium; make; known; actually; together; usually; thing; stuff; like; happens; thought; truly; like; would; feel; weird; show; social; medium,-1
hjysun,domesticgeeoh,funny; thing; mgtow; radical; feminist,,-1
hjxgzm,HilariousHeathen,many; truly; close; platonic; friend; opposite,many; claim; impossible; woman; strictly; platonic; friend; unless; related; deter; cousin; place; like; alabama; believe; woman; perpetuate; myth; think; foster; romantic; interest; friend; long; enough; main; issue; go; hand; hand; woman; string; along; keeping; orbiter; orbiter; thing; nearly; common; people; make; definitely; occurs; think; woman; seek; orbiter; pursue; dating; really; accept; come; think; woman; simply; polite; often; interpreted; wrong; inexperienced; problem; orbiter; almost; always; universally; onesided; friendship; shitty; experience; younger; subscribed; myth; long; time; time; acquaintance; class; eventually; became; best; friend; found; funny; people; discredit; advice; given; friend; opposite; gender; thing; dear; female; friend; mine; said; could; lifted; directly; playbook; piece; advice; isolated; incident; often; worded; delicately; sentiment; usually; opinion; wondering; orbiter; real; friendship; determined; friend; responds; asked; advice; dating; dismissive; badmouth; literally; everyone; date; show; interest; girl; trying; keep; orbiter; position; say; something; like; look; girl; dumb; keep; mentally; engaged; mean; still; probably; make; lack; personality; way; genuine; friend; although; response; worded; delicately; ambiguously; lady; know; male; friend; looking; something; casual; real; friend; giving; advice; counterintuitive; personal; goal; thing; go; guy; stuff; like; mind; many; genuine; friend; opposite; friendship; different; platonic; friendship,-1
hjxbyp,Dora_Bowl,anyone; problem; solved; getting; relationship,anyone; felt; depressed; anxious; unwanted; significant; amount; problem; fixed; entering; relationship; exchange; topic; post; reddit; purplepilldebate; comment; weekly; community; chat; megathread; june; fwkl; common; people; problem; fixed; going; relationship,-1
hjsyuy,StaySkepticN,much; online; dating; reflect; real; life; think; learn; people; online; behavior; simply; different,feel; like; people; dismiss; people; observation; made; online; dating; thing; happen; real; life; saying; person; inspired; make; thread; valid; reminded; topic; sure; time; valid; like; someone; act; like; equivalent; really; circumstance; different; picture; text; first; example; demographic; attracted; place; said; think; unnatural; circumstance; certain; type; human; being; still; allow; make; observation; nature; nurture; still; human; being; think; make; certain; observation; demographic; outside; primarily; inside; said; circumstance; example; first; think; online; dating; show; people; pickier; presented; option; actually; option; feeling; like; option; option; consider; worthy; context; eye; show; ideally; likelier; want; person; surface; level; chance; know; give; choice; meeting; exact; person; trait; would; moral; rational; thought; attachment; would; come; meeting; effect; choice; chance; know; thing; might; like; know; like; probably; version; either; popular; trait; trait; niche; could; kinda; like; entertainment; medium; sure; like; real; life; fact; people; behave; like; exact; opposite; reason; still; related; people; maybe; power; fantasy; common; certain; demographic; maybe; people; find; watching; kinda; thing; safe; environment; exciting; maybe; people; relate; problem; presented; whatever; kind; idea; way; think; online; dating; reflects; real; life; asin; think; people; dating; behavior; people; real; life; think; difference; online; dating; real; life; difference; circumstance; cause; difference; type; people; think; certain; dating; site; attract; differ; average; person; similar,-1
hjr2xe,knowledgeseeker999,degree; prefer; partner; take; lead; relationship,,-1
hjpc0m,brettharvee,woman; allowed; beautiful; shape; size,least; modern; time; held; higher; physical; standard; woman; woman; told; nauseam; matter; look; like; physically; majority; told; opposite; woman; least; wear; makeup; cover; physical; flaw; option; plastic; surgery; orthodontics; painful; expensive; time; consuming; guess; asking; afford; plastic; surgery; orthodontics; supposed; appearance; wear; mask; respect; rule; going; write; following; need; give; context; asking; question; disregard; want; victim; life; long; bullying; criticism; right; viciousness; opposite; regarding; physical; appearance; everything; nose; height; eye; cheek; hand; chest; everything; basically; walking; target; opposite; take; like; woman; opinion; confirmed; bachelor; since; currently; woman; gone; demean; make; feel; better; know; case; ten; hundred; million; worldwide; held; higher; physical; standard; woman; day; afford; plastic; surgery; orthodontics; supposed; physical; appearance,-1
hjnpf6,imnotfeelingsogood69,acceptable; woman; cautious; around; commit; crime; acceptable; black; cautious; around; black; people; commit; crime,,-1
hjmj0d,darknessandme,feel; pursuit; relationship; become; full; time; day,want; pursue; thing; human; nature; course; feel; like; overemphasised; modern; world; feel; unworthy; laid; woman; attention,-1
hjmamz,Swift-Carrots,know; pill,,-1
hjm93e,Beecher-Frank,think; would; happen; realistic; robotic; doll; companion; invented; near; future,year; create; robot; look; feel; much; like; human; interact; conversation; know; still; advanced; enough; actually; take; human; job; primarily; companion; sexual; partner; assume; affordable; average; person; maybe; price; think; would; affect; dating; market,-1
hjl69m,cowpateh,live; bartender; posted; seduction; sparked; debate; good; path,posted; first; hand; experience; living; attractive; bartender; sparked; debate; comment; truly; believe; people; doctrine; make; hard; understand; romance; psychology; humanity; theoretical; rule; read; internal; epiphany; psychological; debate; deep; dive; comment; thing; explained; discussed; realizing; questioning; thing; like; clearer; ground; people; understand; coming; good; path; reddit; seduction; comment; hifa; live; attractive; bartender; source; share; medium; name; iossmf,-1
hjk3yx,goneaway2thewind,boy; need; socialized; neutral; towards; woman; collectively,need; raised; neutral; towards; woman; collectively; rather; standard; model; seeing; lady; princess; speak; raised; walk; street; side; defend; assaulted; treat; righteously; default; princess; mentality; breed; contempt; realize; woman; hold; anything; like; moral; responsibility; raised; know; woman; infallible; deserve; treated; equally; need; pill; would; internalize; behavior; objectively; instead; default; idealistic; standard; woman; literally; grow; polar; antithesis; best; take; default; amoral; standard; average; unbalanced; cause; creation; pill; mgtow; learn; experience; equal; playing; field; would; le; contempt; individual; group; socialized; defender; woman; collectively; form; higher; treatment; towards; woman; instead; woman; good; raise; next; generation; know; capable; woman; capable; good,-1
hjidu3,anonextra,thought,,-1
hji10w,xFallacyx69,victim; blaming; personal; accountability,personally; avoid; people; victim; mentality; ever; said; girl; asshole; girl; say; good; guy; left; easy; fall; mindset; egg; point; feel; like; stop; feeling; tell; idiom; everyone; around; asshole; might; problem,-1
hjhpog,jwdino,edited; mod; want; discus; idea; hive; mind; influence; woman,obvious; thing; typically; typical; male; behavior; obvious; thing; woman; typically; typical; female; behavior; behavior; observable; early; month; baby; girl; giggling; cute; animal; baby; boy; loving; tossed; around; adult; observable; many; woman; thought; many; thought; woman; arguable; full; conscience; pattern; reveal; obvious; system; play; specific; question; satisfy; mod; feel; idea; hive; mind; think; mean; individual,-1
hjhbx3,jwdino,want; discus; idea; hive; mind; influence; woman,obvious; thing; typically; typical; male; behavior; obvious; thing; woman; typically; typical; female; behavior; behavior; observable; early; month; baby; girl; giggling; cute; animal; baby; boy; loving; tossed; around; adult; observable; many; woman; thought; many; thought; woman; arguable; full; conscience; pattern; reveal; obvious; system; play; discus; idea; hive; mind; hypothesis; work; mean; individual,-1
hjgkn1,barbodelli,believe; people; type; come; much; difference; really; find; attractive,,-1
hjf6zy,scmscmscum,truerateme; pointless; care; body; face,experience; average; sometimes; ugliest; girl; long; body; pornstar; little; teen; girl; pretty; face; lucky; boyfriend; girlfriend; know; woman; male; attention; lost; weight; symmetrical; face; ever; seen; butterfaces; get; completely; ignored; fact; matter; long; wrinkly; slim; question; evolution; prefer; skinny; chubbier; woman; desired; back; primitive; time; food; source; told,-1
hjehwk,reLincolnX,without; male; thirst; care; woman,,-1
hjeh4d,Gravel_Roads,many; dude; worried; raising; secret; cuck; baby,,-1
hjc2ra,DisgruntledReddit007,woman; wear; makeup; wear; lift,,-1
hjbtts,[deleted],woman; wear; makeup; wear; lift,,-1
hjamc0,akaean,pill; amoral,,-1
hjadfm,imadethisinoneminute,woman; smv; market; value; peak; similar,,-1
hjabiy,nkrsfjnmn,handsome; would; woman; still; believe; egalitarianism; feminism,,-1
hj5iyd,geyejoe7,good; looking; woman; deem; extremely; high; value; regardless; nothing; else; offer; look,actually; perfect; example; description; friend; friend; almost; objective; go; christian; highschool; plan; college; basically; bartender; interesting; stuck; religious; knew; doubt; hobby; go; party; point; highest; standard; forget; forget; place; forget; forget; like; expensive; thing; forget; take; restaurant; trip; forget; like; dress; like; single; forget; like; mostly; male; friend; either; slept; want; fuck; know; like; keep; around; forget; like; value; given; born; pretty; face; good; body; unrealistic; standard; whereas; beyond; prove; matter; look; small; flaw; could; disqualify; partner; literally; woman; could; deal; breaker,-1
hj4myb,geyejoe7,consider; engaged; married; attractive,talking; actually; stealing; away; asking; fact; engaged; married; make; attractive; person; woman; claim; managed; woman; marry; must; personally; improved; visibly; since; engaged; dress; better; walk; proudly; confidently; actually; never; luck; woman; fianc; first; aswell; ever; since; engaged; attention; woman; asked; twice; change; made; married; engaged; attractive,-1
hj4az4,kwalden2,prefer; hookup,accept; full; responsibility; choosing; enjoying; hookup; culture; acknowledge; maybe; extra; risk; maybe; prepared; build; stable; monogamous; relationship; alternatively; claim; hookup; preference; purely; adaptation; made; along; idea; female; nature; female; nature; make; better; live; question; coming; woman; never; engaged; type; casual; understand; appeal,-1
hj41x1,kwalden2,state; thing; extreme; main; point; could; helpful; excepted; way,read; recent; commenter; thing; like; common; advice; would; invest; relationship; make; sure; financially; emotionally; end; tomorrow; understand; completely; different; opinion; much; compliment; accepts; future; controversial; world; would; generalize; awalt; could; state; case; commonly; thing; would; cheering; real; hard; go; half; reason; certain; especially; female; reader; much,-1
hj3mr6,gzilla1954,question; regarding; relationship,open; corrected; misconception; many; thing; learned; stand; idea; woman; never; love; love; dude; definitely; woman; hard; time; believing; like; already; know; thinking; awalt; naive; blue; pilled; thinker; going; genuinely; curious; something; first; make; clear; cuck; would; theoretically; catch; girlfriend; wrong; disregard; praise; ground; walk; value; life; work; future; center; life; completely; around; anyone; anyways; time; meeting; current; girlfriend; year; best; ever; dated; late; high; school; clicked; perfectly; year; seen; best; worst; done; almost; pill; sin; cried; front; broken; frame; time; made; money; time; treated; best; friend; done; emotion; flow; freely; around; remained; faithful; despite; sin; speak; guy; choice; interfere; life; continues; treat; respect; literal; unconditional; love; pill; research; without; knowing; spoken; acknowledges; thing; woman; capable; wrong; relate; member; look; long; term; relationship; would; advice; break; awalt; lose; hope; love; love; pulled; completely; single; rest; life; want; long; term; relationship; found; girl; compliment; perfectly; accepts,-1
hj1hwo,Idolovecertainsins,join; discord; dire; need; human,,-1
hj0v6c,TheLotusLover,there; thing; hate; woman,hypocrite; fuck; banning; pinkpillfeminism; gender; critical; femaledatingstrategy; among; others; banning; done; nothing; disprove; ideology; anything; validated; much; cool; trolling; seeing; banned; make; fucking; sense; whatsoever; patting; back; perpetuating; reactionary; monkey; explode; first; instance; opposition; refugee; sub; think; retarded; warmly; welcome; purplepilldebate; let; keep; debate; alive; forever,-1
hizwep,bobless_jum,instead; lowering; physical; standard; perennial; pump; dumpees; transition; sugaring,,-1
hiz8kg,Admirable-Row7252,think; imbalance; popularity; trans; woman; porn; trans; porn; woman,,-1
hmm7j7,ChadThundagaCock,enough; drive; truck; enough; ride; fuck,excuse; shaming; interested; younger; girl; given; driving; vehicle; legal; tell; girl; handle; getting; behind; wheel; raptor; young; interested; tapping; younger; legal; drive; shane; dawson; saying; guilty; suspicion; watching; reviewtechusa; youtube; video; topic; believe; innocent; proven; guilty; legally; aloud; behind; wheel; though; come; treating; like; adult; thinking; wrong; find; beautiful; legally; able; everyone; life; risk; driving; like; maniac; dumb,-1
hmlb80,CounterSp4ce,find; count; woman; tell,,-1
hmja2h,OXOzymandias,would; make; better; world; woman; drive; made; match; drive; made; match; woman,think; dissonance; sex; stem; natural; difference; drive; tptb; decided; dissonance; making; woman; match; aphrodisiac; anaphrodisiacs; respectively; opinion; would,-1
hmfjhc,PhazeJGW,woman; approach; lv; value,know; like; would; like; approached; like; sober; discussion; whether; woman; actually; approach; something; wrong; smv; approach; mean; walk; interested; start; conversation; necessarily; asking; number; asking; date; sexually; aggressive; enough; approach; try; make; aware; interested; opposed; woman; merely; send; signal; afar; looking; smiling; kind; woman; dealing; instance; good; indicator; type; woman; avoid,-1
