post_id,author,title,body,image
8ivvqj,Pretty_Please_C_My_V,better; loved; lost; never; loved,love; come; risk; heart; break; worse; happiest; perfect; marriage; soul; mate; year; leaving; mourn; rest; miserable; life; ooooooorrrrrr; never; soul; mate; worse; happy; loving; fulfilling; year; relationship; find; partner; cheating; entire; time; spun; plate; year; never; experience; love; loved; worse; child; missing; never; found; never; child; hence; never; experience; loving; child; opinion; better; loved; lost; never; loved; better; peak; happy; miserable; rest; life; never; peak; happy,-1
8isg3d,TechSupport1990,nature; human; male; become; attracted; human; female; normal; pedophile; human; male; find; human; female; sexually; attractive; develop; quickly,nature; human; male; become; attracted; human; female; normal; pedophile; human; male; find; human; female; sexually; attractive; develop; quickly,-1
8is97a,LLL3peat,rule; divorce; updated,diverse; suck; point; blank; period; going; debate; however; think; marriage; would; change; completely; divorce; updated; changed; entitled; spouse; thing; money; investment; changed; money; limit; splitting; asset; year; salary; would; change; society; discus; please,-1
8indt1,chira-chira,celebrity; crush; thread; edition,spinning; leonardo; dicaprio; thread; celebrity; similar; find; attractive; bonus; question; attractiveness; compare; younger; aged; note; since; sounded; like; friday; thread; thanks; saltybastard; mentioned; another; thread; since; relates; discussion; another; thread; woman; attracted; free; make; similar; thread; want; join; crush; sharing; people; reddit; work; picture; either; thread; nsfw; must; marked; find; nsfw; picture; marked; please; report; mod; address; every; thread; circlejerking; outrage; must; automod,-1
8impej,TheKarmicWoosh,submissive; inherent; handicap,recently; found; mentally; trapped; contradiction; come; think; give; good; advice; find; specific; positive; actionable; problem; literally; natural; beta; male; sexually; submissive; woman; definitely; submissive; general; woman; since; earliest; memory; speculate; occurred; know; literally; turn; serving; woman; treated; slave; seriously; femdom; shit; although; believe; many; fetish; porn; definitely; tendency; since; least; grade; maybe; porn; play; role; past; girlfriend; dominated; gave; hardest; boner; could; ever; imagine; entire; antithesis; aspires; beta; buck; walking; talking; stereotype; used; woman; actually; like; fetish; started; young; bending; backwards; anything; cute; girl; asked; recently; morphed; providing; financially; started; getting; financial; domination; submissive; tendency; grew; first; heard; findom; thought; stupidest; shit; ever; heard; fuck; would; give; girl; money; nothing; especially; never; actual; fuck; thought; process; realized; broke; getting; paying; floodgate; opened; seriously; joking; guy; straight; give; hard; earned; money; woman; sexually; aroused; popped; boner; giving; princess; serve; uber; friend; came; giving; girl; worshipped; goddess; fuck; though; nice; fucking; love; shit; know; else; shit; fucked; woman; gladly; slave; likely; never; attracted; really; come; surprise; realm; dating; submissive; male; completely; fucked; demographic; really; help; honestly; opinion; vast; majority; woman; sexually; romantically; interested; slave; worship; reality; number; make; harder; truly; satisfied; reason; dommes; charge; hour; supply; demand; pretty; high; experience; trying; girlfriend; wife; domme; greeted; ambivalence; outright; disgust; woman; expressed; desire; control; especially; bedroom; make; decision; plan; generally; lead; actually; work; thought; worshipping; woman; get; dick; hard; like; diamond; really; make; panty; anything; shit; get; dryer; sahara; depending; kinky; never; girl; cleaning; apartment; definitely; stiffy; blicky; fetish; severely; handicap; selection; woman; first; place; overall; lead; lower; quality; pool; woman; want; tolerate; entertain; idea; surprise; submissive; nature; ultimately; dictate; navigate; picking; woman; show; sexual; interest; first; place; passive; generally; pretty; laid; back; assertive; sexual; encounter; relationship; started; initiating; anything; escalation; ultimately; frustrates; woman; would; potentially; woman; liked; never; made; move; waiting; initiate; unfortunately; mostly; oblivious; never; clue; missed; decent; amount; encounter; understand; fetish; necessitate; passiveness; initiating; escalating; affect; becomes; easy; taken; advantage; fucked; part; sexually; aroused; woman; intellectually; absolute; hate; idea; happens; hate; fact; like; boner; like; running; problem; regular; beta; male; option; likely; settled; passed; backburner; later; higher; standard; intimacy; expected; date; gladly; casual; definitely; becomes; le; frequent; behavior; self; limiting; running; toxic; behavior; woman; necessarily; know; kink; aware; behavior; projecting; willing; disrespect; woman; sometimes; arousing; anger; feel; experience; woman; know; bend; backwards; accommodate; easily; become; lesser; priority; girl; date; realize; literally; anything; uber; fuck; another; told; needed; uber; help; broke; person; servant; garner; zero; respect; people; respect; qualm; lying; manipulating; keep; mind; actually; like; shit; hate; like; half; brain; love; idea; whatever; woman; tell; half; know; fuck; every; time; usually; reality; want; ultimately; impossible; practical; standpoint; perfect; world; could; submissive; male; still; fairly; handsome; major; handicap; whats; warping; mind; dissonance; wanting; really; knowing; truly; achievable; slave; panty; dropper; sexual; need; point; form; another; occasion; woman; lost; potential; sexual; interest; learning; kink; time; eschewed; natural; desire; fulfill; dominant; role; definitely; brought; romantic; sexual; success; girl; happy; least; satisfaction; woman; know; game; ultimately; problem; serving; fully; committing; without; ever; relationship; situation; like; fucking; know; fucked; happen; anyway; since; satisfies; boner; enough; ironically; hardest; boner; basically; need; forget; need; forget; cumming; would; think; simplest; solution; would; invest; heavily; local; scene; fairly; young; attractive; dude; people; like; year; older; really; type; least; kink; scene; really; interesting; artificially; concentrate; dating; pool; dude; still; outnumber; dommes; like; essentially; upping; shot; want; woman; want; term; desire; inherent; contradiction; want; never; term; term; want; back; peak; athletic; physique; college; absolutely; problem; attracting; woman; routinely; swolested; lay; never; satisfactory; attractive; woman; wanted; opposite; submissive; slave; wanted; shit; would; never; flew; instead; mentally; create; elaborate; scenario; girl; queen; servant; stay; game; keep; going; soft; time; especially; graduated; became; exhausted; effort; really; hard; imagine; girl; master; calling; daddy; bent; four; absolutely; hate; called; daddy; could; snap; finger; totally; would; everything; else; life; great; maybe; come; term; dating; reality; living,-1
8img54,TechSupport1990,shortage; talented; skilled; dominant; come; bedroom; shortage; shortage; gotten; worse,shortage; talented; skilled; dominant; come; bedroom; assuming; exists; shortage; assuming; exists; shortage; gotten; worse; maybe; someone; give; analysis; shortage; fluctuated; term; present; year; year; back; sexual; revolution; like; sexual; revolution; thinking; topic; listening; ridiculous; commentator; youtu; yrxajpbg; talking; woman; getting; sexual; need,-1
8imcdr,MickDash,question; feminist; woman; always; obtain; enthusiastic; consent; something; sexual,,-1
8im7l1,efficientelf,redpill; fan; theory; agency; judgement,know; bible; response; individual; anyway; popular; father; abandon; child; woman; chose; wrong; marriage; fell; apart; woman; chose; wrong; father; alcoholic; woman; chose; wrong; look; like; redpill; want; treated; like; child; woman; parent; like; passive; leaf; wind; agree; theory; responsible; gender; woman; cognitive; dissonance; convenient,-1
8il18x,Eartherry,frustration; feel; towards; woman; influence; anymore,used; could; woman; never; find; looking; acting; like; woman; used; listen; wearing; clothing; makeup; specifically; attract; husband; day; tell; woman; anymore; society; frown; lost; mean; influencing; woman; every; possible; without; influence; lost; control; might; course; action; react; creates; tension; potential; threat; come; lack; control; frustration; manifest; passive; aggressive; reaction; situation; whenever; woman; capable; making; decision; longer; appropriate; influence; seem; though; table; turned; woman; impose; influence; reality; woman; acting; without; concern; acting; without; motive; either; somewhat; worse; desire; influence; exist; would; least; framework; succeed; instead; given; nothing; still; expected; keep; chaos; unfortunately; woman; upper; hand; drive; enough; pas; opportunity; rather; keep; refuse; undermined; stand; benefit; reduction; competition; without; influence; along; ride,-1
8ikhyo,ElectronicReport,think; okay; woman; hide; intention; order,familiar; pill; concept; spinning; plate; observed; mainly; advocate; carrying; multiple; casual; relationship; question; pillers; think; okay; woman; hide; intention; order; think; okay; tell; woman; whatever; think; want; hear; open; looking; relationship; order; think; okay; hide; intention; think; might; future; want; casual; please; explain; reasoning,-1
8ikcxe,Pooch231,think; something; dicaprio; think,seem; topic; think; relevant; rpers; often; refer; elite; smv; interesting; study; psychology; type; young; know; gisele; couple; knew; refaeli; ever; since; broke; seemed; though; get; model; year; tend; resemble; exception; kelly; rohrbach; dating; believe; initially; broke; hopping; young; blonde; next; figured; shallow; taking; advantage; wealth; fame; fuck; hottest; woman; time; went; though; behavior; seemed; increasingly; strange; look; pic; model; seems; totally; disinterested; weird; seem; almost; come; schedule; surprised; contract; relationship; supposed; boost; model; career; another; thing; young; like; newest; like; kind; weird; understand; want; bang; year; old; would; enter; public; relationship; seem; heard; rumor; believe; think; something; guy; theory,-1
8iir24,Pretty_Please_C_My_V,society; really; cared; child; destroy; marriage,society; many; thing; claim; whats; best; child; child; support; child; mother; custody; child; often; father; single; mother; collect; welfare; money; going; productive; people; poor; impulse; control; thats; cool; want; baby; starving; country; like; france; banning; getting; paternity; test; keep; family; together; child; stop; marriage; best; environment; child; grow; child; need; mother; father; bring; back; marriage; would; good; child; fault; divorce; wage; high; enough; parent; stay; home; kid; make; marriage; great; child,-1
8ii8ho,GinSmokeLies,point; become; morally; questionable; break,recent; conversation; morality; ethic; breakup; fascinating; personally; never; considered; breaking; question; morality; practicality; dating; audition; lifelong; commitment; breaking; realize; want; person; rest; life; simple; morality; factor; become; evident; everyone; see; trying; figure; exactly; distinction; people; think; breakup; ethical; question; line; ethical; unethical; breakup; matter; long; person; life; circumstance; affect; morality; decision; break; different; love; yous; said; move; together; curious; point; relationship; becomes; serious; commitment; morally; questionable; outright; moral; break,-1
8ih23a,quicklogaccount,would; already; happy; relationship; soulmate,wrote; post; john; mary; happy; couple; another; person; better; relationship; possible; likely; curious; partner; good; relationship; experienced; enough; acknowledge; experienced; enough; acknowledge; limitation; simply; exactly; perfect; match; work; partner; work; often; quite; happy; happy; know; sloppy; lazy; something; changed; without; great; harm; partner; sometimes; reckon; relationship; put; strain; put; partner; sometimes; whole; weekend; something; mildly; annoyed; partner; love; partner; simply; obnoxious; friend; partner; like; much; see; often; vice; versa; know; perfect; together; account; pretty; sure; unlikely; either; better; agreed; relationship; starter; right; lucky; know; someone; come; pursue; person; person; interested; single; factor; possibly; account; person; match; current; partner; sure; least; strain; perceive; exist; anymore; sure; person; aware; intelligent; enough; effort; relationship; develop; provided; time; talk; coworker; know; good; match; person; person; hardly; meet; someone; fitting; person; know; hence; person; daring; show; attraction; someone; committed; happier; person; happier; current; partner; possibly; happy; person; relationship; maybe; believe; soulmates; know; stress; current; partner; already; lucky; current; partner; probably; fare; current; partner; fare; leave; alone; fare; please; state; gender; would; exchange; would; encourage; neutral; discourage; impede; partner; making; exchange; happened; partner,-1
8ievjg,azngirl7689,woman,hate; woman; ride; carousel; carousel; hate; woman; calling; tradcons; lady; might; behave; awalt; help; lady; understand; genuinely; confused,-1
8idexg,1dondraper,pill; feminism; opposite; end; spectrum,arise; minority; population; feel; oppressed; devolving; extensive; categorization; generalization; vile; hatred; resentment; towards; opposite; spectrum; particularly; personal; resentment; bias; blind; lack; self; awareness; base; idea; motif; rhetoric; seemingly; rational; idea; appeal; subjectively; oriented; mind; necessarily; believe; true; merit; ideology; pick; choose; value; apply; personal; moral; goal; life; driven; unfortunate; insecurity; feeling; inferiority; environmental; biological; force; make; valid; argument; area; become; overblown; group; polarization; ultimately; become; twisted; irrational; biased; nonsense; cite; pseudo; science; evidence; particular; claim; addition; misrepresenting; misquoting; famous; psychologist; historian; philosopher; belief,-1
8icbyj,weirdobot,woman; friend,outside; older; demographic; already; married; possible; girl; friend; without; ever; wanting; relationship,-1
8icbid,hammerhaunts,virgin; past; flag,additionally; worse; flag; bunch; relationship; lasted; short; amount; time; takethatsnaily,-1
8ibf42,sabadr,fertility; rate; modern; country,people; woman; given; much; right; want; educated; instead; family; think; true; whats; causing; fertility; rate,-1
8ibdic,rharrington,article; motto; produced; time; full; subjective; bias,time; sexist; language; hurt; woman; opinion; piece; still; shocked; read; thought; full; assumption; time; affiliation; problem; agree; thing; author; say; say; absolutist; term; woman; pass; smallest; infraction; pass; worst; generalization; personally; agree; woman; refuse; accept; blame; work; something; woman; disagreed; date; front; friend; wife; drunk; neighborhood; party; experience; woman; sometimes; pass; like; calling; woman; bitch; sexist; author; claim; equivalent; term; dick,-1
8iaaf7,fgjkthrowawyyy,friend; mess,,-1
8i8nch,MickDash,question; feminist; woman; always; obtain; enthusiastic; consent; something; sexual,,-1
8i80xu,coolgirl2021,picky; laundry; list; standard; avoid; single,many; time; reddit; read; single; mom; blame; getting; properly; harshly; condemned; criticized; accepting; flakey; life; taught; picky; question; criticize; woman; picky; life; partner; going; blame; woman; something; go; wrong; standard; high; expect; good; treat; love; respect; love; share; religious; belief; save; marriage; avoid; alcohol; smoking; drug; responsible; share; equally; housework; work; full; time; major; mental; illness; share; religious; belief; told; manosphere; laundry; list; standard; essentially; going; condemn; lifetime; cat; loneliness; need; settle; lower; standard; case; condemn; single; mom; exactly; told; lowered; standard; appreciating; entitled; like; called,-1
8i77xk,hating-life,supposed; good; father; change; childbirth,many; article; woman; bearing; brunt; childrearing; husband; useless; demanding; feel; like; woman; slipped; woman; vetting; process; laziness; wanting; actually; raise; child; something; really; gauge; happens; like; could; good; single; slowly; woman; fall; housework; child; late; stuck; much; work; husband; like; another; child; take; care; woman; sign; good; father; family; oriented; saying; thing; actually; raise; child; another; thing,-1
8i74k7,TechSupport1990,exactly; vile; male; commenters; woman; body; online; deal,sorry; white; knight; bodybuilding; subreddit; pic; woman; body; posted; vile; comment; comment; section; always; cesspool; racism; hate; criticism; gravity; losing; shine; skin; glow; vulgarity; guess; standard; comment; would; smash; really; wonder; misogyny; hate; bizarre; hyper; criticism; supermodel; flaw; pounced; need; take; woman; weird; racism; woman; white; guaranteed; forum; make; vile; anti; black; anti; mexican; comment; make; wonder; whether; everyone; forum; deep; south; backwater; make; sense; guess; idea; bodybuilding; juiced; steroid; testosterone; super; high; explains; aggressive; hyper; masculine; comment; maybe; commenters; troll; female; friend; back; high; school; extremely; good; looking; post; sexy; snap; snapchat; get; vile; hatred; follow; exactly; vile; male; commenters; woman; body; online; deal; like; year; mental; issue,-1
8i6gho,InsertEyeRollEmoji,friendship; opposite,female; recently; exchanged; number; interested; dating; instead; saying; want; date; hook; anything; saying; thing; like; enjoying; life; hobby; friend; pup; talk; career; thing; like; working; snowboarding; never; anything; personal; like; dating; life; stuff; like; group; together; activity; like; running; racing; friend; want; make; sure; continuing; clear; without; asshat; feel; like; would; crappy; move; know; want; date; intention; mine; friend; someone; common; interest; would; seem; egotistical; assume; want; would; make; awkward; going; forward; want; point; might; think; sending; signal; friendzoned; thought; accomplish; thoughtfully,-1
8i6a67,efficientelf,male; contraceptive; pill; supposed; single; parenthood; cause; single; parenthood; responsible; enough; take,invention; reliable; semi; permanent; contraception; awesome; expecting; demographic; take; precaution; leaf; child; take; expect; someone; condom; sure; target; market; product,-1
8i5mu2,selective-autism,discussion; beat; hierarchy; morality,comment; reddit; purplepilldebate; comment; hzleb; precusor; female; sexual; selection; dynta; atlas; refers; phenomenon; call; beta; hierarchy; summarizing; jordan; peterson; thought; copied; together; unconsciously; hierarchy; posit; valued; goal; accept; goal; otherwise; cooperating; arrange; hierarchy; competent; guy; lead; want; promised; land; want; competent; leader; leading; competent; defined; established; common; value; happens; essentially; together; vote; good; good; chosen; woman; people; propagate; like; voting; reproduce; woman; going; along; vote; stringent; choice; according; atlas; difference; male; beta; hierarchy; female; ranking; woman; hierarchy; cad; proverbial; despoiler; beta; hierarchy; chaste; wife; daughter; realized; discrepancy; hierarchy; must; almost; entirely; account; rage; fuel; anger; phase; wonderful; rationalization; hear; alone; posse; trait; honor; loyalty; competence; necessarily; presuppose; moral; superiority; male; ranking; female; ranking; essentially; according; view; woman; tempt; away; divine; order; thing; lead; baser; state; obviously; simplistic; rosy; sketch; beta; male; hierarchy; actually; function; mention; explain; committal; alpha; cad; still; manage; rank; fairly; highly; beta; hierarchy; presumably; hierarchy; actually; overlap; status; among; woman; translates; status; among; merit; model; question; discussion; allegedly; meritocratic; moral; beta; hierarchy; actually; exist; often; implicit; male; claim; female; sexual; strategy; destructive; society; much; irrational; come; self; organization; believe; anger; phasers; right; female; perception; male; dominance; hierarchy; inaccurate; inherently; immoral; lead; sort; social; ill; dysgenic; reproduction; incentivizing; criminal; activity; societal; instability; right; woman; perception; differ; sharply; evopsych; theory; provide; legitimate; basis; existence,-1
8i5dqf,Crashlands,right; issue; enthusiastic; consent,,-1
8i4ljj,celincelin,saying; incels; dangerous; like; saying; muslim; dangerous,another; another; thread; dangerous; evil; incels; referring; post; rather; comment; mostly; get; worked; somebody; say; dangerous; evil; muslim; tiny; minority; muslim; terrorist; bigot; fair; enough; talk; incels; selective; blindness; kick; simple; fact; tiny; minority; incels; kill; anybody; suddenly; go; window; result; bunch; depressed; autists; saying; harsh; thing; internet; demonized; group; fuel; harsh; thing; internet,-1
8i3qs7,Eartherry,woman; never; completely; fault; single; mother,woman; given; benefit; doubt; evidence; support; anything; circumstance; expectation; woman; hyper; aware; intention; kind; sexual; activity; unrealistic; completely; ignores; possibilty; somewhere; walked; away; responsibility; somewhere; might; sole; cause; child; situation; regard; burden; created; entire; society; single; mother; least; commended; accepting; someone; else; responsibility; free; father; single; mother; thing; keeping; dollar; support; entire; fleet; orphan,-1
8i31l8,Jokengonzo,love,question; state; despite; body; positive; movement; guy; still; considered; untouchable; woman; body; positive; movement; seems; woman; taken; like; dog; experience; none; often; forced; hide; frustration; society; laugh; shame; weight; hand; telling; woman; overweight; perfect; issue; bother; former; society; harsh; woman; especially; comfortable; body; said; lose; laid; woman; pas,-1
8i24qd,SmeggingRight,male; contraceptive; pill; matter; money,lot; post; twaddle; twiddle; single; mother; twaddle; twiddle; waaaah; waaaah; male; pill; hormonal; could; quickly; matter; money; bitch; endlessly; single; mother; could; raising; funding; hormone; free; contraceptive; pill; could; market; within; next; five; year; researcher; saying; thing; holding; back; lack; funding; researcher; monash; institute; pharmaceutical; science; recently; received; grant; nonprofit; organisation; male; contraception; initiative; help; develop; pill; hormonal; le; severe; side; effect; female; contraceptive; pill; ventura; said; mojonews; male; contraceptive; pill; matter; money; woman; deal; good; girlfriend; past; trouble; birth; control; pregnancy; develop; tube; last; girlfriend; said; pill; left; drive; flat; male; birth; control; pill; hormonal; take; bitchfest; single; mother; ending; whole; single; mother; thing; within; year,-1
8i1tna,Cho_Assmilk,would; handle; pregnancy,wife; conversation; couple; time; always; come; damned; damned; fixed; birth; control; responsibility; child; made; decision; fixed; want; serious; responsibility; tested; right; year; later; year; hypothetically; wife; pregnant; would; obviously; abortion; fuckin; want; forth; child; problem; tell; child; mine; child; paternity; test; adoption; forth; child; know; could; never; give; could; abort; tested; seems; like; logical; solution; test; come; back; negative; infidelity; undeniable; would; ruin; family; kid; house; happening; solution; never; told; abortion; sperm; test; discreetly; come; back; negative; bang; hottie; want; carry; life; bare; mind; something; either; concerned; something; casually; discussed; time; patio; drinking; entirely; much; alcohol; child; sleeping; upstairs; much; shit; get; posted; regurgitated; nonsense; thought; would; something; light; hearted; thought,-1
8i1rur,poppy_blu,single; mom,hate; dating; woman; thread; single; mom; biggest; complaint; single; mom; provokes; strong; reaction; interested; moral; argument; single; motherhood; experience; dating; single; mother; universally,-1
8i1r73,DrySpellCel,woman; watch; minute; video; staged; woman; really; direct,youtube; watch; mlipiy; youtube; watch; mlipiy; walking; around; approached; woman; really; happen; really; approach; like; world; shattered; never; approached; ever; least; decent; looking; dress; like; like; dark; feature; like; happen; live; average; height; muscular; enough; video; bullshit; really; happen; please; tell; happen; approach; right; know; irony; video; parodying; video; average; looking; woman; thing; know; difference; want; harassed; woman; like; want; feminist; issue; woman; approached; issue; woman; approaching; interesting; dynamic,-1
8i19a5,DelicateDevelopment,pill; knighthood,reading; reddit; whereareallthegoodmen; comment; savage; love; letter; wondering; knighthood; applied; teach; younger; woman; mistake; think; pillers; letter; must; sound; appaling; however; read; answer; girl; chance; developing; maturing; advice; given; deadly; poisonous; girl; confused; clue; kind; association; creates; question; simplified; right; depressing; energy; finding; something; smarter; dear; pillers; instead; hard; nexting; girl; something; benevolent; teach; girl; patiently; mistake; mean; seriously; manosphere; sympathy; girl; like; realize; hurting; much; hurt; others; obvious; girl; raised; within; mindset; seen; advice; chance; beginning; except; entirely; wrong; expectation; womanosphere; help; rational; woman; gain; rational; thought,-1
