post_id,author,title,body,image
htohxr,GullibleClassic1,everyone; think; godfather; redpill; chateau; heartiste; rollo; tomassi; roosh,given; three; figure; one; spearhead; redpill; philosophy; weird; hear; much; anymore; last; checked; chateau; heartiste; roissy; banned; wordpress; basically; moved; away; blogging; pua; talk; politics; alt-right; right; bent; roosh; denounced; past; pua; work; turned; hardcore; christian; fundamentalist; think; back; basically; instituted; major; change; forum; prohibited; discussion; fornication; thus; shutting; travel; game; section; forum; rollo; tomassi; seems; largely; stuck; work; changed; politically; drama; remember; regarding; falling; leader; convention; invited; nytimes; journalist; event; basically; stuck; thing; youtube; channel; fairly; active; twitter; side; note; trailer; hilarious; cringe; inducing; thing; seen; youtube; watch; nakrok; rough; summary; three; godfather; redpill; today; curious; everybody; whether; redpilled; blue; pill; pill; think; today,-1
htntie,[deleted],someone; give; rundown; everything,,-1
htn49l,dalia-chan,guy; think; nonsexual; romantic; moment; like; cuddling; fully; clothed; holding; hand; starting; others; eye; wanted; something; like; never,,-1
htlyl4,Blackhate69,woman; rate; people; vastly; different; another; never; come; agreement,came; conclusion; speaking; woman; subreddit; reading; men; post; someone; fall; scale; term; look; debate; redditor; claiming; fell; category; term; physical; look; tried; reassure; extremely; uncommon; like; many; pointed; would; overweight; unfortunate; physical; deformity; prove; point; linked; picture; friend; sister; obese; case; mosaic; syndrome; someone; would; rank; scale; order; prove; point; much; forgiving; physical; look; think; came; defense; saying; fact; prettier; least; first; thought; trolling; woman; came; defense; claiming; rate; woman; harshly; fact; least; mention; brought; useless; arbitrary; form; measurement; like; skin; wrinkly; shes; young; despite; woman; debate; young; think; rate; woman; much; analytically; realistic; post; using; british; actor; daniel; radcliffe; someone; attractive; agree; weird; looking; average; term; height; physically; stack; guy; similar; group; arent; comparing; year; grandpa; doubt; would; every; consider; someone; average; lived; america; dont; anymore; anecdotal; already; seen; woman; real; life; hire; come; shes; painfully; average; overweight; shes; automatically; cute; girl; male; coworkers; shrug; shes; average; woman; either; rate; woman; really; high; sometimes; men; rating; woman; stack; group; woman; usually; ethnicity,-1
htl9n5,Thatshygurl,happens; son; born; hating; feminist,like; emphasize; hating; mean; specifically; feminist; think; selfish; pig; know; feminist; hate; wanted; highlight; point; anyways; curious; happens; kind; woman; son; ever; raised; woman; like; upbringing; like,-1
htkz4e,OldSimpsonsisbetter,really; gatekeeper; relationship,commonly; said; around; part; woman; gatekeeper; gatekeeper; relationship; woman; gatekeeper; gatekeep; relationship; look; like; woman; gatekeep; sexual; romantic; contact; relationship; idea; gatekeeper; relationship; come; think; true; sorry; gatekeep; much,-1
htknan,Robert_de_Saint_Loup,within; good; taste; order; date,indeed; order; meal; date; rate; make; suggestion; eager; introduce; elevate; guide; best; restaurant; waiter; look; instruction; know; good; serving; know; recommend; practice; asking; lady; modern; people; getting; furthermore; would; like; many; time; woman; good; taste; know; evaluate; correctly; know; ladylike; date; something; fewer; fewer; woman; today; know; know; talking; talking; constant; tinkering; cellphone; every; date; shameful; go; many; woman; good; taste; know; lively; intelligent; conversation; pronounces; food; wine; menu; correctly; know; gentleman; order; date; make; suggestion; gentleman; lastly; topic; taste; would; like; conversation; economy; news; distasteful; topic; date; love; make; little; cupid; every; time; talk; distasteful; subject; date; goal; date; mutual; appreciation; mutual; scorn,-1
htke0s,[deleted],people; underestimate; freaking; poor; young; people; today; compared; past; much; affect; dating; life,,-1
htk7cm,[deleted],idea; talk; girl,,-1
htjcjq,[deleted],idea; male; white; privilege; stuff; like; wage; flawed; toxic; everyone; whole,,-1
htid32,acenosk,woman; react; high,talking; weird; religious; girl; woman; general; general; idea; feel; disgusted; slut; pursuing; relationship; opposite; disgust; woman; maybe; actually; like; experienced; share; story,-1
htfg3o,MerryVegetableGarden,updated; excerpt; relating; promiscuity; specifically; infidelity; citation,paste; pastebin; approximately; half; woman; quintiles; sociosexuality; sexually; unfaithful; steady; partner; tenfold; increase; corresponding; rate; people; bottom; quintiles; bailey; kirk; dunne; martin; individual; difference; sociosexuality; represent; genetic; environmentally; contingent; strategy; evidence; australian; twin; registry; journal; personality; social; psychology; illustration; odds; ratio; lifetime; sexual; partner; obtained; face; face; mode; interview; indicates; probability; infidelity; increased; every; additional; lifetime; sexual; partner; screenshot; imgur; regarding; correlate; infidelity; result; indicated; basis; method; assessment; probability; sexual; infidelity; increased; higher; number; lifetime; sexual; partner; whisman; snyder; sexual; infidelity; national; survey; american; woman; difference; prevalence; correlate; function; method; assessment; journal; family; psychology; finding; demonstrate; infidelity; number; sexual; partner; moderate; genetic; influence; heritable; respectively; genetic; correlation; trait; strong; resulting; genetic; correlation; trait; nearly; half; gene; impacting; infidelity; affect; number; sexual; partner; correlation; unique; environment; variable; cherkas; oelsner; valdes; spector; genetic; influence; female; infidelity; number; sexual; partner; human; linkage; association; study; role; vasopressin; receptor; gene; avpr; twin; research; twin; truism; psychology; best; predictor; future; behavior; past; behavior; le; true; realm; sexual; behavior; indeed; strongest; predictor; marital; infidelity; number; prior; partner; bus; deception; past; sexual; promiscuity; would; inflicted; greater; cost; average; woman; haselton; bus; oubaid; angleitner; lie; strategic; interference; psychology; deception; sex; personality; social; psychology; bulletin; sexual; promiscuity; significantly; positively; correlated; emotional; promiscuity; sexual; infidelity; emotional; infidelity; indicating; sexually; promiscuous; participant; tend; emotionally; promiscuous; sexual; emotional; unfaithful; term; sexual; domain; result; showed; positive; correlation; sexual; promiscuity; sexual; infidelity; stating; individual; tend; sexually; promiscuous; tend; sexually; unfaithful; result; support; second; hypothesis; pinto; arantes; relationship; sexual; emotional; promiscuity; infidelity; proceeding; athens; atiner; conference; paper; series; athens; ajss; number; marital; partner; percent; cheated; married; norc; general; social; survey; october; female; infidelity; based; number; premarital; partner; statistic; brain; retrieved; july; statisticbrain; percent; female; infidelity; based; number; premarital; partner; archive; sdveu; contrary; myth; partner; many; partner; harder; easier; time; remaining; monogamous; significantly; risk; straying; little; prior; sexual; experience; staik; march; predictor; infidelity; gender; difference; partner; cheat; retrieved; july; blog; psychcentral; relationship; look; infidelity; partner; cheat; archive; bprpy; people; survey; reported; four; fewer; lifetime; sexual; partner; rate; infidelity; current; marriage; dropped; five; sexual; partner; number; nearly; double; break; people; five; lifetime; sexual; partner; four; fewer; total; partner; illustrates; lesson; study; breakpoint; validated; fact; asked; straight; sexual; partner; past; agreed; always; faithful; sexual; partner; whether; currently; married; single; compared; fewer; sexual; partner; said; nfidelity; often; fruit; lifelong; approach; mating; involves; seeking; practicing; short; term; mating; encounter; encourage; sexual; variety; stage; marriage; mcquivey; october; road; infidelity; pass; multiple; sexual; partner; retrieved; july; ifstudies; blog; road; infidelity; pass; multiple; sexual; partner,-1
htdqvd,thisisrevenge,woman; push; idea; marriage; think; marriage; deal; woman,,-1
htck7m,beigesun,unplugging; purple; pill,chick; super; damaged; talking; raped; virgin; passed; drunk; abortion; consensual; though; went; home; together; knowingly; rescinded; relationship; thinking; nothing; feeling; getting; involved; gather; courage; blue; pill; self; kinda; heartbroken; everything; happened; know; ultimately; fixed; prettiest; girl; hooked; face; wise; could; chick; better; body; face; gather; courage; break; move; like; plate; although; feel; impossible; given; granted; relationship; status; already; broken; took; back; covid; quarantine; asked; look; phone; given; prolly; evidence; find; something; would; anyways; password; face; shit; long; story; short; trust; help; fella; busting; ball; earth; advice,-1
htc90q,AchromaticFade,survey; personality; trait; term; self; evaluation; dating; preference,,-1
htc8tk,AdaTennyson,talk; gamma; alpha; beta,try; teach; guy; beta; alpha; seeing; reddit; least; guy; beta; gamma; think; huge; disservice; trying; teach; guy; gamma; alpha; going; happen; high; status; leap; yeah; beta; might; able; become; alpha; gamma; going; shut; teaching; gamma; beta; beta; better; gamma; unrealistic; aspiration; alpha; unrealistic; beta; gamma; forget; link; springer; referenceworkentry; link; springer; referenceworkentry,-1
htc8cl,AchromaticFade,survey; personality; trait,,-1
htc7w9,AchromaticFade,survey; personality; trait,,-1
htc5xj,ProgressAlarmed,promiscuous; woman; cheat; genetically; determined; sociosexual; orientation; study; woman; cite; promiscuous; woman; cheat; le; false,first; foremost; address; faulty; study; sciencedaily; release; woman; love; cite; claiming; promiscuous; woman; cheat; le; study; faulty; reason; study; filled; logical; fallacy; apart; logical; fallacy; promiscuous; woman; cheat; le; say; surprisingly; people; satisfied; relationship; likely; engage; infidelity; scholar; make; sense; similarly; scholar; promiscuous; woman; cheat; without; study; never; replicated; study; reliable; many; author; come; conclusion; first; study; history; come; conclusion; promiscuous; woman; cheat; le; study; past; come; conclusion; study; since; come; conclusion; either; hand; myriad; study; proving; promiscuous; woman; cheat; example; one; link; reddit; purplepilldebate; comment; gqifng; excerpt; relating; ncount; likelihood; infidelity; back; title; reason; promiscuous; woman; cheat; genetically; determined; sociosexual; orientation; determines; one; propensity; rack; high; number; partner; propensity; cheat; finding; demonstrate; infidelity; number; sexual; partner; moderate; genetic; influence; heritable; respectively; genetic; correlation; trait; strong; surprisingly; average; number; sexual; partner; significantly; higher; among; respondent; unfaithful; compared; remained; faithful; phenotypic; correlation; trait; resulting; genetic; correlation; trait; nearly; half; gene; impacting; infidelity; affect; number; sexual; partner; correlation; unique; environment; variable; cherkas; oelsner; valdes; spector; genetic; influence; female; infidelity; number; sexual; partner; human; linkage; association; study; role; vasopressin; receptor; gene; avpr; twin; research; human; genetics; chicago; source; cambridge; core; journal; twin; research; human; genetics; article; genetic; influence; female; infidelity; number; sexual; partner; human; linkage; association; study; role; vasopressin; receptor; gene; avpr,-1
ht8vk4,redthrowaway400,feel; woman; reject; lv; value,,-1
ht8bdd,TheBookOfSeil,look; something; people; offer; unless; actually; worked; considerable; effort; obtain,something; always; slightly; annoyed; anywhere; people; include; look; something; offer; others; context; dating; automatic; feature; value; though; worked; posse; commonly; youth; teen; gene; fully; blossom; extreme; everything; best; skin; best; hair; physically; attractive; physically; capable; rarely; hear; anyone; crediting; gene; take; pride; something; worked; long; time; posse; maintain; glamorizing; physical; appearance; selfies; validation; point; basically; social; medium; become; talking; disparity; woman; often; utilize; advantage; feel; work; overall; appearance; woman; think; really; fallacy; claim; woman; offering; look; youth; exchange; everything; else; likely; worked; obtain; hard; much; gene; contribute; personality; reasonable; experience; often; necessary; feature; important; contributor; someone; personality; gained; intentionally; gained; unintentionally; born; family; idiosyncrasy; large; small; much; closer; intimate; tightly; knit; others; family; never; really; close; large; family; regardless; fact; life; experience; outside; family; said; although; think; appearance; relevant; attraction; dating; think; really; correct; take; ownership; people; look; something; necessarily; giving; offering; someone; unless; actually; worked; obtain; think; people; consider; look; physical; appearance; part; something; offering; opposite; shallow; using; resume; speak; offering; much; else; someone; hard; work; make; attractive; going; getting; ripped; social; working; improve; dating; resume; young; virtue; gene; trait; offering; anyone; much; le; something; personally; take; credit; offer; look; bland; personality; someone; else; offering; look; plus; personality; plus; finance; really; batting; outside; league; someone; value; look; enough; really; willing; trade; everything; worked; life; someone; look; good; otherwise; plain; individual; perspective; selling; short; everyone; bringing; something; front; table; work; something; claim,-1
ht5fdd,l0T0T0l,personality; matter; regard; attractive; arousing; woman; casual,,-1
ht3zmi,Rowbloks,else; supposed; make; thing; fair; balanced,,-1
ht25q1,jigglypuff__0,watching; porn; habitual; cuck; behavior; fuel; love; hate; obsession; sexual; practice; woman,,-1
ht1jsq,HappilyMrs,purple; draw; middle; keep,apology; find; purple; flair; neither; totally; blue; totally; prefer; shade; purple; stance; either; side; pull; middle; repels; pole; generally; middle; person; view; politics; religion; science; thank,-1
ht00y2,thisisrevenge,would; describe; attachment; type,,-1
hszcf3,DXBrigade,promiscuous; woman; cheat; le,according; study; person; history; predictor; infidelity; reported; short; term; sexual; partner; prior; marriage; likely; affair; opposite; true; woman; deccanchronicle; lifestyle; relationship; le; attractive; woman; likely; cheat; html; researcher; found; higher; number; short; term; sexual; relationship; prior; marriage; le; likely; stay; faithful; whereas; woman; category; le; likely; cheat; independent; life; style; love; sexual; satisfaction; relationship; cheating; increase; infidelity; study; html,-1
hsy3nw,committeeless,fact; care; count; show; instinctively; repulsed; committing; mongamously; virgin; would; discussion; degree; past; sexual; activity; tolerable; would; past; past,whenever; count; come; talk; always; turn; many; acceptable; le; triple; digit; foot; spit; kind; number; course; number; aparent; anchor; basis; reality; could; clearly; number; offered; response; number; weighed; downward; something; quite; simply; something; fact; instinctively; desire; monogamously; commit; virgin; repulsed; committing; virgin,-1
hsxsaq,girlsgenerallyasian,woman; subjectively; physically; unattractive; lower; redeeming; quality; would; make; look,,-1
hsvww9,RimbaudsRevenge,strategy; young; average,think; biggest; reason; sm; marketplace; skewed; young; woman; desired; many; different; age; thus; spoiled; choice; later; switch; decent; shape; deteriorated; suddenly; find; available; woman; several; group; younger; older; time; limited; success; want; settle; someone; much; higher; count; probably; lead; resentment; line; likely; younger; woman; thus; discrepancy; reinforced; think; young; average; guy; realise; stiff; competition; alternative; compete; older; established; dude; resource; place; however; another; group; woman; young; actually; biggest; selling; point; place; median; year; wait; shamelessly; upon; older; woman; likely; alcoholic; crass; inappropriate; available; bang; want; relationship; proud; dream; relationship; perfect; girl; hell; thing; normally; fuck; awkward; mannered; mother; taught; niceguy; aphrodisiac; lady; break; next; step; finish; school; higher; education; know; want; take; shorter; course; learning; trade; make; money; fast; like; welding; driving; fork; lift; always; option; later; work; study; half; time; plan; point; become; year; life; home; still; shit; show; early; compete; younger; younger; woman; though; pristine; looking; maybe; find; searching; along; settled; come; single; actually; woman; like; carousel; little; jaded; dream; something; lasting; people; slept; around; much; commit; believe; matter; similarity; experience; life; trajectory; sometimes; make; compatibility; slut; move; together; young; little; closet; holy; shit; definately; rack; number; good; finding; elusive; mixed; threesome; orgy; time,-1
hsvgzn,ColCrin,learning; experience,girl; learning; mistake; inherently; better; desirable; woman; habitually; choose; thread; left; wondering; learning; experience; actually; happen; learning; experience; learn; preference; back; preference,-1
hsvg5u,ColCrin,learning; experience,girl; learning; mistake; inherently; better; desirable; woman; habitually; choose; thread; left; wondering; learning; experience; actually; happen; learning; experience; learn; preference; back; preference,-1
hstav4,differentchaser,redpill; still; fastest; safest; girl; girl,although; cringy; pill; phase; redpill; strategy; still; definitely; effective; fuck; girl; expierence; whenever; date; girl; using; blue; strategy; always; alone; whereas; direct; teasing; emotionally; unavailable; actually; work; damn; good; make; dick; comical; experience; pill,-1
hsstxv,bubblepoppa6,people; fail; realise; much; personality; change; someone; attraction; another; person,,-1
hssmps,Majorian420,actually; woman; terrible; taste; otherwise; standard,preface; young; enjoys; reading; different; philosophy; ideology; taken; reading; last; couple; week; agree; point; disagree; viewpoint; goal; post; apologize; advance; come; attacking; accusatory; recently; lady; posting; minimum; standard; housing; standard; experienced; guy; fucking; around; going; past; lady; alot; poster; come; realize; standard; literally; scrapping; bottom; barrel; surprised; trash; like; trash; give; great; advice; agree; seek; respectful; abusive; career; future; planned; maintain; standard; towards; dating; beyond; agree; helpful; important; standard; guy; measure; litmus; test; standard; barely; reaching; minimum; would; thought; obvious; stated; example; poster; talked; brilliant; deep; conversation; concerned; potential; career; path; might; police; officer; doctor; engineer; nope; drug; dealer; deep; insightful; conversation; high; another; poster; complained; year; living; mom; place; favorite; post; nest; gone; guy; place; past; furniture; literally; mattress; floor; cardboard; clothes; everywhere; honestly; give; post; prompt; embarrassed; bring; someone; especially; girl; wanted; smash; messy; house; according; standard; perfectly; normal; average; circle; friend; actually; average; college; educated; ranging; undergraduate; master; diverse; career; range; liberal; art; stem; major; military; engineering; nursing; living; arrangement; house; apartment; biggest; guess; furniture; friend; place; furniture; floor; clean; trash; taken; roommate; alone; dresser; desk; nightstands; bedroom; television; living; room; sits; stand; front; coffee; table; futon; lady; mattress; frame; sheet; hospital; corner; according; standard; would; explain; majority; circle; relationship; moment; standard; average; standard; opinion; reality; bottom; barrel; literally; participation; award; dating; standard,-1
hsqytp,Jonny-Marx,actual; solution; toxic; masculinity,,-1
hspf4u,Robert_de_Saint_Loup,juggling; woman; shameful; practice,anything; juggle; nowadays; know; juggle; personal; professional; life; would; audacity; juggle; dating; life; juggle; people; always; backup; rely; multiple; woman; social; medium; keep; tab; woman; likewise; thing; library; potential; library; potential; woman; shameful; one; juggling; people; popular; albeit; shameful; practice; people; world; engage; practice; sorting; dating; partner; intense; practice; dating; multiple; people; practice; dislike; partner; want; free; choose; nature; grandparent; hedonistic; frivolous; right; shameful; cellphone; juggle; intense; first; generation; modern; people; cellphone; first; generation; experience; dating; mobile; phone; carry; tendency; make; experience; self; gratifying; need; find; good; partner; guess; number; game; incredibly; pessimistic; mentality; conceal; truth; plead; fifth; much,-1
hslavl,Robert_de_Saint_Loup,gentleman,like; lady; question; many; making; complaint; today; mentality; many; lady; rolled; eye; silly; social; medium; bar; loud; ostentatious; fuckboy; baby; drink; honey; lady; hate; dislike; loose; going; baby; according; today; clumsy; lady; thing; like; today; gentleman; look; grandmother; lofty; time; courteous; knew; treat; woman; today; seen; pathetic; grandfather; wouldnt; existed; day; shameful; vulgar; fuckboy; either; soldier; medical; engineering; student; young; taking; family; trade; grandmother; around; nightclub; meeting; fuckboys; older; innocent; music; sophisticated; globalized; good; time; gentleman; gone,-1
hsjj6u,decoy88,attachment; theory; explains; woman; dating; choice; much; better,,-1
hsjh6o,cloudydays84,much; ideology; ideology; based; tribalism,mobile; nursing; hangover; come; clear; want; apology; advance; wondering; looking; post; comment; curious; thing; comment; usually; swarm; comment; attacking; defending; said; vehemently; essentially; thing; posted; gender; flipped; side; completely; change; noticed; response; comment; one; gender; neutral; much; opposition; either; side; one; clear; frame; gender; talked; outcry; thing; like; gender; like; okay; insert; reason; typical; amalt; awalt; good; deal; talk; double; standard; hypocrisy; sometimes; nuance; complexity; taken; account; fair; obviously; people; naturally; hypocritical; able; point; necessarily; mean; looking; past; natural; cognitive; dissonance; might; present; much; outright; malicious; doublespeak; mentality; people; might; overlook; something; else; thought,-1
hsj47i,Dunuk419,fall; confirmation; bias,,-1
hsiaaj,Dunuk419,many; study; online; instead; going; forum; asking; woman; like; like; research; unlike; people; reddit; scientist; worked; hundereds; thousand; people; conclusion; accurate,,-1
hsi7by,Mimoxs,girl; learning; mistake; inherently; better; desirable; woman; habitually; choose,,-1
hsfwhf,Zippo-Cat,would; rather; part; chad; harem; date; marry; loser; forever; alone,,-1
hsffjs,ProfessionalCoffee8,woman; high; count; slutty; past; marriage; material,,-1
hsfe1h,Tricksterspider,perspective; value,,-1
hseocp,l0T0T0l,woman; start; cheating; applied; advice; long; take,,-1
hscczv,Maybelowsmv,type; negging; work; best,realised; disconnect; terpers; discussed; appearance; woman; reality; thing; work; instance; insinuating; woman; turn; head; street; fact; almost; every; woman; perhaps; experience; heck; experienced; whilst; wearing; mask; turn; apparently; pua; aware; thats; advise; woman; woman; exposed; simp; behaviour; thus; would; want; seek; validation; logic; believe; could; work; case; hand; sure; woman; would; receptive; sure; count; usually; feel; naturally; negged; find; admirable; trait; whilst; acknowledging; mine; actively; negged; think; appreciative; especially; desired; overall; question; stated; type; negging; work; best,-1
hsblsl,Grand_Duty,marriage; statistic; japan; average; couple; continues; rise,peak; woman; marrying; first; time; remained; year; relative; proportion; woman; getting; married; early; twenty; fallen; revealing; trend; toward; getting; married; later; life; prefecture; miyazaki; youngest; average; year; okayama; youngest; woman; contrast; oldest; average; woman; tokyo; respectively; archive; iregl; selection,-1
hsawsd,eMotionaldYnamite,destruction; family; really,sure; belongs; anyway; feel; like; completely; negative; thing; family; life; good; resulted; would; maybe; coparenting; actually; provides; benefit; parent; focus; child; deal; partner; could; abusive; ruin; whole; family; dynamic; many; mental; illness; resulted; dysfunctional; family; make; seem; like; people; simply; incapable; leading; family; better; idea; raise; child; together; without; parent; married; everyone; get; bored; partner; usually; child; point; family; could; argue; child; grow; stability; family; particularly; stable; healthy; especially; created; failed; attempt; save; relationship; baby,-1
