post_id,author,title,body,image
8kdd5h,Mr_Smoogs,strong; single; independent; woman,article; making; round; slightly; basically; currency; mind; valued; ranked; high; smart; good; child; would; good; life; never; tell; gnawing; emptiness; alone; pushing; thirty; hyper; intellectualism; major; turn; every; get; close; never; explain; girl; child; important; phase; life; reproductive; phase; body; go; questing; mission; without; anxious; lost; hopeless; alone; failure; stunted; like; child; something; kick; profound; bodily; happen; away; quest; silly; intellectually; need; strong; smart; independent; alone; scared; need; miserable; without; eating; away; felt; fulfilment; loving; partner; life; swelling; sense; shared; future; building; something; together; greater; oneness; strange; kind; hormonal; harmony; without; emptiness; coupling; life; mission; cultivated; wrong; skill; assertive; masculine; personality; insist; splitting; bill; rational; ambitious; call; spade; spade; time; flattery; beating; bush; blunt; fault; woman; want; hate; thought; pregnant; want; mother; partner; role; want; play; want; fail; tell; going; like; tell; world; oyster; smart; educated; forward; life; expense; social; pretty; feminine; valorised; masculine; trait; pushed; away; every; great; known; unsettle; emasculate; script; violated; like; realistic; expect; change; realistic; expect; settle; someone; le; intelligent; nothing; going; life; defies; evolutionary; programming; girl; boy; equal; difference; matter; need; marketplace; value; exchanged; value; mind; much; face; skin; womb; traded; status; security; love; never; said; unhappy; would; baby; stupid; goddamned; deal; find; madonna; either; turned; cocksure; feminist; want; best; rest; trampled; like; garbage; truly; awful; want; many; send; sexless; scrap; heap; average; work; hard; woman; take; seriously; average; subject; scorn; awful; awful; trait; ingrained; overhaul; entire; programming; personality; become; proper; woman; place; world; nothing; stable; loneliness; crippling; feminist; wrong; lied; nobody; get; manosphere; gone; warped; woman; shallow; fuck; bitch; right; suck; side; young; rich; beautiful; winner; point; never; considered; find; frantically; rewriting; expectation; late; game; egg; smart; basket; smart; egg; rotting; going; pretend; care; happy; every; often; type; article; make; round; internet; always; talk; lied; said; woman; like,-1
8kd6tn,dankytank,thought; cheat; pregnant; partner,burn; much; time; banal; celebrity; gossip; thing; absorved; cultural; osmosis; whole; khloe; kardashian; debacle; super; buff; athlete; partner; cheating; pregnant; couple; child; wound; getting; post; social; medium; cheating; partner; pregnant; apparently; uncommon; google; like; wanted; opinion; especialy; guy; fear; hear; woman; getting; pregnant; another; raise; child; realize; scenario; different; still; huge; betrayal; trust; believe; situation; would; justify; behavior; ever; seen; play; ever; found; situation; felt; temted; able; step; partner; pregnant; would,-1
8kczod,LewisCross,flaw,inspired; rainisthelife; gush; wax; eloquent; beta; actually; woman; want; example; confident; assertive; take; good; care; willing; bend; backwards; happiness; show; everyday; much; love; thing; length; willing; boundary; never; harsh; thought; dreading; absolutely; disgust; woman; paint; ubermensch; superheroes; flaw; whatsoever; life; endless; bliss; neverending; course; rainbow; unicorn; fantastic; superman; flaw; whatsoever; every; perfect; calibration; alpha; beta; time; every; time; married; relationship; perfect; flawless; specimen; awesomely; awesome; awesomeness; marriage; absolutely; perfect; woman; describe; problem; rough; patch; issue; argument; true; want; hear; perfect; beta; flaw; thing; like; grind; gear; come; must; something; hear; comment; really; superhuman; demigod; matter; describe,-1
8kcnd2,palescope,blue; pill; explanation; woman; fixation; male; confidence,,-1
8kc83n,Liptusg,western; sexuality; socialization; become; convoluted; natural; human; reaction; foreign; culture; ostracized; paradoxically; pathologized,show; bob; vegana; bitch; lasagna; phrase; matter; progressive; fearful; ostracism; imply; otherwise; resonates; deep; core; pozzed; western; westernized; male; supposed; absurdity; microcosm; unfathomable; mess; westernized; psychology; become; half; humorous; introduction; address; subject; hand; seen; phenomenon; still; continues; occupy; spotlight; internet; globalization; becomes; prevalent; furor; mixed; feminine; rage; bemused; mockery; sparked; third; world; discovery; western; female; social; medium; subsequent; attempt; courtship; large; portion; category; indian; people; facebook; pakistani; flirting; dating; apps; bangladeshi; rural; turk; libyan; really; anyone; westernized; background; little; exposure; western; social; norm; trying; hand; neurotic; known; young; western; woman; often; eliciting; cry; creepiness; tact; le; ness; many; year; mostly; used; domain; autistic; lacking; social; skill; west; earning; still; large; degree; many; subreddits; probably; know; drill; usually; send; extremely; straightforward; compliment; receipient; feminine; shape; body; part; quick; profession; admiration; marriage; request; insistent; advance; proven; work; attractive; white; male; using; fake; profile; digress; topic; already; covered; sheer; horror; poor; liberated; womyn; however; revealed; concurrence; demographic; strangely; enough; unless; brainwashed; case; make; perfect; sense; immediately; advance; called; socially; inept; appear; half; time; practically; identical; advance; never; exposed; extremely; sparsely; western; westernized; social; behavior; point; self; aware; individual; might; briefly; entertain; passing; thought; stacy; could; crazy; youtube; watch; vxamejru; word; actually; acting; naturally; deviant; took; child; reared; isolating; teaching; neutral; language; basic; skill; without; much; entertainment; cultural; otherwise; input; reach; puberty; becomes; adult; introduced; pretty; woman; first; time; feel; attracted; think; going; happen; start; entire; ritualistic; quasi; insane; western; mating; habit; college; swag; casual; escalation; game; smug; sarcasm; innuendo; fucking; course; know; meaning; behind; done; eye; wander; bob; vegana; probably; pretty; tit; want; intercourse; might; bring; maybe; gift; expectation; exchange; precisely; like; pakistani; indian; creep; might; promise; send; jewel; whatever; mockery; would; precise; number; many; try; ought; give; know; basic; along; display; strength; possibly; ritual; many; tribal; society; operate; nothing; shameful; blunt; remark; woman; child; bearing; hip; male; spry; arm; profession; desire; marry; breed; specific; member; early; brain; know; instinctively; know; elaborate; western; flirting; scheme; instinctively; however; ever; communicating; remotely; trip; pakistani; indian; ghanan; syrian; average; girl; find; thinking; whenever; drawing; attention; romantically; many; total; creep; thinking; happens; western; know; better; wrong; loser; little; secret; insane; literally; nothing; wrong; anything; ever; bashed; place; like; indian; facebook; perfectly; natural; note; case; someone; somehow; missed; skipped; explicit; statement; granted; implication; speaking; various; western; nationality; context; sufficiently; exposed; western; culture; various; medium; association; inner; social; working; type; le; common; highly; westernized; locale; like; japan; brazil; upper; class; urban; center,-1
8ka536,Jokengonzo,think; woman; regret; delaying; choosing; kid,read; birth; rate; declining; woman; kid; instead; wanting; career; think; choice; many; woman; regret; later,-1
8ka2rb,beccaslays,gender; wage; thing; fight,title; say; girl; believe; feminist,-1
8k8pot,TechSupport1990,people; turned; illicit; naughty; taboo; nature; cheating; people; terrible; candidate; marriage; since; fantasy; cheat,literotica; sort; story; based; concept; illicit; naughty; taboo; including; infidelity; pretty; fucked; perhaps; sexism; imagine; woman; fantasy; forbidden; tryst; hotel; room; illicit; lover; although; think; fantasy; suppose; come; whether; circumstance; align; tempted; circumstance; right; chance; make; deepest; fantasy; reality; risk,-1
8k8210,Tedesche,prefer; shaved; trimmed; pubes,lot; guy; prefer; shaved; woman; curious; woman; prefer; shaved; majority; woman; prefer; shaved; woman; speak; preference,-1
8k7jce,BornSign,notion; prettier; woman; higher; standard; entirely; true,accept; pretty; woman; picky; necessarily; want; deemed; stereotypically; attractive; think; ugly; wife; common; wife; least; cultural; perspective,-1
8k73ch,JustTheTA,question; blue; pill; laid; regularly; mean,,-1
8k71i3,hostinacell,michael; avenatti; epitome; pill,,-1
8k56vt,Ricklogical,first; post; logic,pardon; ignorance; animal; natural; hierarchy; function; statement; posted; group; share; refinement; believe; regarding; rejection; attaining; level; beta; holding; concept; alpha; issue; entire; dogma; surround; assuming; female; immature; assuming; beta; fuck; submissive; tendency; dominant; tendency; beta; hardly; submissive; pack; pair; wolf; submit; everyone; else; pack; literally; bitch; people; hung; beta; true; beta; world; round; fuck; population; need; lower; tier; beta; position; hierarchy; blissful; power; like; right; hand; suppose; make; sense; consider; beta; wife; alpha; alpha-male; male; take; mate; becomes; alpha; female; beta; female; beta; pair; beta; alpha; pair; alpha; lesser; relationship; moron; settling; strong; using; weak; many; people; assume; leader; world; completely; overrun; follower; remain; follower; forever; genetic; line; mostly; follower; history; fine; treated; respect; subordinate; daily; role,-1
8k4vk3,Pretty_Please_C_My_V,view; point; represented,spending; time; realize; people; higher; socioeconomic; status; went; college; high; paying; job; married; marriageable; live; good; neighborhood; cheating; rare; divorce; rare; single; mom; rare; rider; rare; quick; weigh; anecdotal; experience; challenge; living; proof; nawalt; small; percentage; america; hence; view; experience; count; much; theory; correct; population; advice; work; woman,-1
8k4f8n,solorathain,acceptable; change; partner; physique; personality; habit; unacceptable; change; partner; physique; personality; habit,,-1
8k3fba,zenplus,woman,currently; single; male; early; grew; public; state; parent; prestigious; profession; right; running; scam; think; long; term; want; girl; mean; read; people; choose; serious; long; term; partner; someone; class; older; hell; would; willing; sizably; le; attractive; physicial; attractiveness; point; scale; generality; posted; find; true; least; single; mother; hometown; friend; good; marriage; partner; striving; good; everyone; cushy; somewhat; enjoyable; prestigious; read; people; treat; nice; tend; nice; lot; like; priveledged; life; think; friend; college; debt; everyone; trust; fund; kiddie; fund; larger; others; absolutely; guy; general; pretty; beta; imho; definitely; upper; hand; thing; could; issue; prestige; date; girl; starbucks; said; people; reach; station; life; prestige; social; status; could; much; true; conversation; different; meet; college; buddy; strong; state; university; versus; humble; bragging; going; back; reading; benefit; woman; right; drawback; start; dating; woman; easy; way; acquire; prestige; thought; getting; master; prestigious; school; state; school; went; nationally; ranked; mean; prestigious; course; employer,-1
8k2nev,washington_breadstix,constantly; comment; theredpill; stating; take; little; effort; stand; rest; day; really; true,guy; theredpill; repeat; notion; constantly; probably; least; twice; thread; usually; reference; lifting; refer; thing; like; masculine; behavior; holding; frame; social; skill; insist; take; much; effort; apart; skinny; jean; hipsterfags; maybe; experience; different; grew; midwest; went; college; midwest; currently; still; living; midwest; major; city; feel; like; walk; random; surrounded; dude; look; like; work; look; call; typical; night; dude; look; like; trying; hard; appear; small; minority; matter; venue; majority; cute; girl; plenty; masculine; looking; frame; holding; mate; guarding; behavior; along; agree; pill; principle; match; experience; idea; competition; soft; feel; like; dude; place; know; maybe; thought,-1
8k2mf9,planejane,good,sane; normal; people; would; agree; factor; make; relationship; unhealthy; thing; like; physical; violence; substance; abuse; addiction; infidelity; thing; learned; perhaps; le; obvious; thing; quite; qualify; relationship; really; qualify; good; either; young; used; think; violent; situation; cheated; relationship; really; good; eventually; learned; could; single; cheated; freedom; perk; better; worse; story; relationship; learned; quite; great; thought; never; really; crossed; awful,-1
8k27nv,Eartherry,happiness; freedom; anxiety; come; responsibility,,-1
8k1mdb,LeJacquelope,question; would; want; kind; woman,originally; assumed; guy; would; hell; kind; woman; year; hearing; traditionalist; babe; fanboy; crowd; yeah; dunno; anymore; seem; like; slam; dunk; anymore; go; scenario; suppose; kind; woman; genuinely; obsessed; socio; economic; status; height; muscle; look; go; dutch; date; cheap; date; reasonably; expect; want; cheap; birthstone; rather; expensive; wedding; ring; record; approaching; directly; expects; like; least; like; want; lover; activity; partner; respect; entrepreneurial; spirit; financial; independence; make; though; might; looking; stay; home; basically; maintenance; anti; hypergamic; feminist; type; would; consider; woman; like; prime; partner; material; depend; whether; good; looking,-1
8jzntl,Pooch231,common; think; botox; filler; think; impact,friend; recently; admitted; getting; botox; kind; surprised; obvious; thought; looked; better; huge; difference; wear; foundation; anyway; friend; aged; prematurely; never; wore; sunscreen; socal; asian; natural; advantage; already; sunspot; face; weird; consider; botox; filler; something; celebs; middle; aged; woman; think; become; common; think; affect; would; happen; year; woman; look; youthful; alexandra; daddario,-1
8jz6l6,Electra_Cute,pill; woman,perspective; look; like; pill; woman; subreddit; redpillwomen; redpillwives; seems; sort; traditional; conservativism; mixed; pill; pill; woman; look; like; bunch; individual; worshipping; masculinity; lifestyle; advice; mixed; fold; redpillwives; appears; lean; towards; lifestyle; advice; side; thing; impression; sort; split; exodus; redpillwomen; point; pill; woman; different; split; pill; woman; like; differ; today,-1
8jywbl,Pretty_Please_C_My_V,experience; lying,friend; experience; fuck; boy; saying; anything; leaving; bored; younger; naive; dealt; type; usually; meet; like; start; relationship; make; seem; like; long; affect; realized; using; find; difficult; trust; multiple,-1
8jy0id,Atlas_B_Shruggin,read; described; online; able; laid,automatically; imagine; chad; head; assume; girl; model; stacy; know; think; chad; able; laid; great; looking; woman; believe; happens; count,-1
8jwqql,quicklogaccount,much; would; lose; attractiveness; gain; chastity,wonder; measure; attractive; chastity; assume; four; different; woman; make; relationship; desirable; first; virgin; quite; chaste; proclaims; long; distance; boyfriend; consider; many; range; life; best; experience; judgment; possibly; high; count; cock; mileage; third; regular; girl; experienced; none; none; le; proclaims; boyfriend; consider; many; average; hooked; time; consider; average; last; reservation; fucked; woman; personality; fitting; background; loyal; must; attractiveness; look; whole; appeal; compared; others; picked; answer; leave; mine; comment; leave; guess; leave; example; answer; virgin; virgin; picked; attractive; minus; scale; compared; last; inexperienced; inexperienced; must; attractive; virgin; picked; picked; attractive; average; picked; scale; worst,-1
8jvffr,Jokengonzo,nsfw; girl,whole; khalid; going; wife; wonder; many; regard; going; downtown; everything,-1
8jvdwe,ifelsedowhile,sexual; attraction; always; instantaneous; grow; time; woman; turn; approach,last; topic; opened; told; number; woman; sexual; attraction; always; spring; right; away; certain; amount; case; develop; time; know; better; person; woman; turn; approach; unless; found; attractive; first; sight; give; chance; chat; long; rude; threatening; case; honestly; look; usually; give; time; unless; strikingly; handsome; blow; variety; excuse; like,-1
8juzu4,ConfidentConifer,would; rather; daughter; grow; chaste; beautiful,assume; want; best; daughter; term; personal; life; satisfaction; relationship; success; possibly; career; success; could; guarantee; daughter; grow; chaste; ugly; unchaste; beautiful; would; select; option; think; would; give; daughter; foundation; best; marriage; option; happy; successful; life; chaste; mean; count; unchaste; assume; decide; find; husband; settle; worry; either; chasing; catlady; permanent; partying; childfree; lifestyle,-1
8jux2b,Mr_Smoogs,hierarchy; disbelief,work; work; broken; people; work; people; broken; guy; manipulative; work; people; broken; manipulative; anyone; else; asshole; work; common; sense; missed; position; subscribe; please; make; succinct; addition; format; bonus; question; many; bloops; think; woman; group; quality; quality; side; mouth; suggest; quality; woman; whatever; quality; described; awalt; awalt; exist; change; time; woman; really; camp; quality; change; time; finally; chasing; quality; woman; dismissing; quality; woman; telling; wrong; exactly; considers; higher; quality; presumably; quality; lay; goal; clearly; guy; chasing; complete; opposite; quality; presumably; define; categorize; woman; broken; quality; woman; high; quality; woman; categorizing; woman; sleep; purposefully; willingly; become; plate; quality; merely; slut; shaming; another; name,-1
8juj19,solorathain,good; dating; resource; community; pill; think; blue; pill; dating,dating; romance; important; part; self; esteem; asexual; seek; romantic; relationship; reason; would; long; term; single; incel; woman; reason; single; incel; pill; another; resource; seen; pick; seminar; pill; leaning; struggling; desperate; single; incel; alternative; dating; resource; community; eventually; pill,-1
8ms229,TallSwaggOVO,successful; redpill; either; mgtow; purple; pill,main; difference; purple; pill; mgtow; purple; pill; still; play; game; mgtow; refuse; play; whether; think; play; game; argue; playing; game; stupid; going; black; pill; pill; mgtow; argue; successful; redpill; winning; game; totally; shelter; woman; like; seems; current; modern; mgtow; perceived; seen; unnecessarily; extreme; main; difference; would; awalt; apalt; nawalt; napalt; merit; successful; realm; mgtow; still; success; field; focus; heavy; self; improvement; without; pander; approval; woman; purple; pill; claim; validation; approval; woman; getting; woman; still; goal; purple; pill; successful; realm; understands; extremist; take; redpill; success; rate; woman; life; take; pill; move; would; le; likely; keep; deeply; divulged; already; successful; example; taking; redpill; rest; life; could; generally; success; pool; getting; woman; possibly; finding; great; mate; idea; someone; settling; dealing; woman; seen; blue; pill; mgtow; successful; happy; going; content; moving; deep; activity; mgtow; redpill; surfing; since; already; need; satisfactory; outcome; argue; purple; pill; adjacent; society; still; include; engaging; woman; difference; redpill; awareness; getting; burned; total; blue; pill; ignorance; nearly; much; possibility; mgtow; would; make; point; trying; stay; adjacent; negatively; feminized; society; pointless; avoid; reasonable; theory; disclaimer; reference; mgtow; post; basis; reddit; internet; technically; thing; would; mgtow; purple; pill; could; mgtow; sense; generally; talking; term; reddit; internet,-1
8mrn36,Jokengonzo,nsfw; orgasm; session,question; state; orgasm; made; possible,-1
8mrkz2,Marino4K,incel; mindset; necessarily; awful; good; temporary; state; mind,maybe; definition; incel; wrong; black; pilled; viewed; around; state; constant; chase; woman; life; horrible; going; stretch; working; redpill; idea; lifting; bettering; really; worrying; others; basically; temporarily; incel; course; people; total; mgtow; total; hermit; basement; think; wrong; assume; black; pill; temporary; state; lingo; puratory; work; decide; fair; assume; base,-1
8mq8vo,lemonfloss,redpill; turning; mgtow,looking; post; redpill; noticed; changed; throughout; year; recent; one; tend; include; whiny; understand; whine; much; realize; actually; dislike; hate; woman; redpill; much; male; imperative; anymore; hate; woman; dedicate; life; piss; redpillers; basically; becoming; mgtows; believe; harmful; younger; generation; despising; woman; prevent; forming; healthy; relationship,-1
8mohh5,Hdhdjjduufjndjidjdfj,would; actually; fuck; chad,much; talk; woman; secretly; want; fuck; hyper; attractive; chad; type; cheat; life; experience; doesnt; tally; woman; could; please; answer; following; pill; would; describe; feminist; married; could; chad; type; accountability; would; automatically; feel; attraction; chad; dating; history; sort; gone; thank,-1
8mo8qu,TomHicks,identical; twin; sister; interested; known; promiscuous; sister; chaste; choose; choose; promiscuous; bring; table; chaste; sister,seen; progressive; shame; male; wanting; promiscuous; partner; afraid; satisfy; implicit; concession; promiscuous; female; take; effort; satisfy; chaste; female; term; female; feel; inclusive; woman; given; expend; effort; promiscuous; female; promiscuous; female; give; chaste; sister; return; extra; effort,-1
8mmjdx,johvannyce,,wondering; take; forsed; move; parent; house; wile; condone; type; action; think; lack; motovating; society; pushing; woman; wile; failing; notice; boy; ishues,-1
8mm34j,paccount112,discussion; educated; woman; femenists; pissed; holmes,,-1
8mly30,hematomatoed,discussion; fallout; versus; fallout,post; redpill; bluepill; issue; lost; brief; timeline; october; fallout; released; october; fallout; vega; released; december; fallout; prioritized; development; bethesda; march; anita; sarkeesian; trope; woman; youtube; series; becomes; popular; august; gamergate; explodes; sarkeesian; becomes; deeply; controversial; november; fallout; released; fallout; fallout; vega; small; significant; theme; sexual; abuse; post; apocalyptic; world; commonly; discussed; raider; caesar; legion; take; settlement; kill; rape; woman; first; character; meet; nova; prostitute; held; sexual; slavery; pimp; vega; casino; keep; stable; prostitute; male; robotic; mostly; woman; quest; centered; around; rape; lesbian; soldier; camp; mccarran; raider; companion; jericho; known; attempted; rape; jenny; stahl; general; understood; rape; would; horror; post; apocalyptic; world; along; slavery; cannibalism; murder; everything; happens; might; make; right; nobody; fallout; rape; cait; make; single; ambiguous; reference; slaver; used; amusement; could; easily; interpreted; mean; kind; prizefighting; tommy; made; understood; raider; kill; people; steal; food; single; prostitute; game; mention; fully; enthusiastically; consensual; indeed; sexual; violence; world; sexual; orientation; apparently; gone; every; romanceable; companion; bisexual; timeline; coincidence; sarkeesian; spoke; bethesda; listened; question; feel; like; video; game; franchise; ruined; allowed; gritty; realism; game; anymore; like; game; enough; focus; shooting; guy; building; settlement; need; socially; irresponsible; message,-1
8mlqqk,Workaholico,whore; madonna; model; attribute; human; look; long; short; term; relationship,post; seen; separation; group; sex; nothing; show; people; want; short; long; term; relationship; precisely; female; alpha; phux; masculinity; dominance; good; appearance; female; beta; resource; passiveness; social; sensitivity; male; whore; lust; beauty; sexual; openess; male; madonna; motherly; behavior; companionship; serene; love; behavior; complete; model; elegant; precise; begging; criticize; criticize; could; attribute; list; would; help,-1
8mlm3i,Jammerly1,definitive; guideline; determining; slut,semi; serious; response; guy; repeatedly; make; girl; slut; friend; came; funny; offhand; list; determine; slut; although; gender; specific; slut; nbsp; equation; came; current; lost; virginity; sexual; partner; considered; little; slutty; little; partner; year; people; le; spell; however; violate; rule; automatic; slut; matter; number; partner; rule; include; dressing; overly; provocative; inappropriate; time; usually; family; function; like; wedding; funeral; graduation; knowingly; sleeping; woman; married; sleeping; close; friend; family; member; sleeping; extremely; class; lv; value; bottom; barrel; guy; girl; knowing; child; father; knowing; girl; pregnant; getting; multiple; woman; pregnant; giving; someone; anything; would; like,-1
