post_id,author,title,body,image
hoiepe,TheLotusLover,woman; surprised; better; company; conversation; woman,,-1
hohe3f,LittleDragonBao,hypergamy; settling,,-1
hoghb5,mizaludbasm,paradigm,,-1
hoer7m,nikolasmaduro,authority; position; doctor; teacher; likely; enter; inappropriate; relationship; patient; female,people; point; female; teacher; phenomenon; popularized; medium; reality; brought; attention; believe; woman; generally; likely; engage; sexually; student; patient; think; vast; majority; teacher; student; relationship; perpetrated; coming; across; article; online; doctor; nurse; sacked; inappropriate; behavior; almost; case; case; country; psychiatrist; struck; bipolar; patient; getting; root; question; idea; fuck; anything; move; hold; truth; head; evolutionary; argument; woman; selective; unlikely; jump; someone; based; look; alone; unless; person; attractive; perhaps; accomplished; help; aroused; female; patient; student; argument; heard; woman; engage; inappropriately; student; patient; much; cultural; expectation; victim; acknowledge; believe; true; male; patient; told; family; friend; female; doctor; flirted; inappropriately; likely; brush; meanwhile; female; patient; said; male; doctor; flirted; inappropriately; told; find; another; doctor; report; totally; different; reaction,-1
hobbdb,DXBrigade,single; contradiction,complain; single; mom; advocate; right; abandon; kid; financial; abortion; complain; single; mom; saying; problem; society; cost; welfare; money; kid; grow; without; father; around; dating; single; wrong; make; cuck; time; advocating; financial; abortion; though; best; tackle; single; mom; problem; would; force; raise; kid,-1
hoajvt,xemxiswed,woman,sure; discussed; topic; like; open; floor; renewed; debate; struck; dishonesty; woman; life; perhaps,-1
ho9gxy,tossa445,find; people; flirty; established; relationship,noticed; life; woman; tend; much; flirty; sexually; forward; relationship; never; thought; much; except; maybe; joking; world; wide; telepathic; female; communication; system; catch; cheating; joke; aside; thought; anyone; else; noticed; sort; trend; noticed; many; time; woman; forward; relationship; never; cheated; relationship; accidentally; assisted; cheating; sometimes; relationship; fading; woman; present; relationship; end; might; together; twice; seem; lose; interest; forbidden; aspect; gone; aswell; personally; would; much; prefer; party; single; make; thing; messy; complicated; besides; personal; moral; objection,-1
ho9e6k,LetsGetThisBread231,bare; minimum; partner,,-1
ho915i,c_dolly,married; want; marriage,flared; interested; male; point; view; general; particularly; interested; red; reconcile; marriage; female; point; view; always; sold; stability; absolutely; still; hold; place; highest; level; commitment; relationship; pretty; much; going; still; want; marriage; personally; valuable; marriage; opposed; long; term; committed; relationship; already; married; question; wife; wanting; marriage; part; decision; something; value; outside; partner; opinion; please; post; want; marriage,-1
ho8mjb,[deleted],avid; hatred; towards; woman; manosphere; result; obsession; power; control,,-1
ho82lj,identity1993,premarital; partner; count; effect; help,people; think; premature; partner; count; negative; effect; seen; evidence,-1
ho700q,tradwife_commie,confused; blackpill; philosophy; woman; perspective,,-1
ho6mng,fukurou_no_fukuro,would; sacrifice; right; convinced; would; save; society,turn; prevent; societal; collapse; give; political; right; essentially; live; class; citizen; would; benefit; humanity; whole; power; woman; vice; versa,-1
hnyz8i,Sepean,pill; become; synonymous; incels; mras; need; word; pill; player; alpha; mastered; sexual; strategy; enjoyed; decline,,-1
hnynfq,geyejoe7,surprised; woman; want; ride; settle; nearing,seriously; ponder; sexual; prime; woman; attractive; life; earth; sexually; explore; young; available; rather; settling; dude; still; virginity; spend; whole; life; knowing; could; like; slept; variety; dude; maybe; would; discovered; something; sexual; never; would; known; settled; young; life; come; dude; engaged; year; woman; virgin; prior; position; personally; regret; woman; available; nearing; population; feel; fianc; sexually; please; way; inch; likely; would; better; time; someone; else; wondering; fuss; would; gladly; sleep; around; till; settle; woman; argument; weather; personally; would; settled; woman; knowing; personal; insecurity; settle; virgin; asking; surprised,-1
hnuyvs,jonsnowpassedaway,whats; hurtful; revenge; could,,-1
hnuv9q,MerryVegetableGarden,adultery; predominantly; filled; woman; male; dominated; woman; cheating; spouse; le; likely; admit; survey,guilt; unfaithful; woman; post; revolve; around; hurt; feel; break; kind; chilling; understanding; wrong; reminds; question; first; occurred; year; began; wonder; many; friend; actually; faithful; husband; distance; seemed; happy; enough; least; content; like; family; thing; cute; kid; mortgage; busy; social; life; matching; set; dish; surface; husband; reasonable; marriage; modern; equitable; woman; friend; angry; unfulfilled; resentful; show; confided; overlapping; affair; course; five; year; almost; finished; processing; another; friend; told; percent; faithful; husband; except; town; work; month; long; another; told; never; another; many; emotional; affair; inappropriate; email; correspondence; year; separate; hard; drive; store; surprised; conversation; friend; cheating; many; nonchalant; described; extramarital; adventure; deception; little; secrecy; shame; thecut; woman; cheat; esther; perel; state; affair; html; thing; deal; adultery; cheat; basic; understanding; wrong; fact; adultery; majority; woman; male; dominated; woman; need; social; conformity; need; know; many; others; established; self; reflecting; questioning; whether; wrong; male; adulterer; engage; self; delusion; realize; lying; breaking; fundamental; expectation; exclusivity; bear; adulteress; come; myriad; preserving; self; justification; unlike; discounting; certain; encounter; including; reason; vast; majority; thinker; history; much; capable; challenging; herd; breaking; mold; woman; used; police; behavior; regarding; promiscuity; infidelity; status; infidelity; increasingly; becoming; status; look; justification; need; fellow; traveler; morality; based; sort; conclusion; personally; drawn; rather; whatever; rest; flock; belief,-1
hnt1yl,waxedmintfloss,respect; woman; bargaining; chip,golden; rule; psychology; advice; good; relationship; never; withhold; order; manipulate; negotiate; something; want; fall; love; brain; spends; longer; anticipating; sexual; release; associating; frustration; particular; person; wife; mistress; material; dichotomy; frigid; wife; spends; year; hung; trying; crack; code; respect; side; long; term; think; constantly; make; work; wonder; would; take; give; someone; else; cuckold; paranoia; might; start; creep,-1
hnr728,ThisIsMyAccount135,point; society; majority; follow; majority; woman; follow; would; happen,suspect; growing; actual; ideology; idea; certainly; woman; perceive; fucked; perceive; fucked; woman; would; society; return; traditional; state; strong; traditional; woman; vetting; staying; le; promiscuous; gender; stew; bitterness; people; segregate; either; side; alone,-1
hnnk31,Thanos25,like; woman; high; body; count; sexist; want; date; woman; high; body; count,,-1
hnmeh7,[deleted],personality; matter; little; nothing; hope; know,,-1
hnk0y1,Downtown_Film_6731,thing; woman; woman,,-1
hnk0gv,Smoogs2,believe; nature; matter,saying; belief; generalization; come; across; argument; every; read; like; slightly; le; retarded; cousin; blue; pill; blank; slate; argument; basically; go; nature; matter; alternatively; care; people; give; nature; time; argument; action; reddit; purplepilldebate; comment; awalt; portrayed; inevitability; seem; logical; people; avoid; escape; nature; regularly; mean; longer; matter; said; nurture; people; avoid; escape; past; trauma; time; mean; longer; matter; people; escape; traumatic; past; live; fulfilling; life; mean; past; influence; longer; matter; still; would; obviously; benefit; understand; spouse; grew; understand; thing; influencing; action; whether; good; seems; obvious; nature; nurture; matter; worthy; thought; concern; claim; nature; deserves; relevance; concern; seems; ridiculous; saying; nurture; matter; course; something; influence; drive; behavior; would; concern; relevance; influence; always; result; action; understand; disagree; belief; human; nature; valid; topic; another; discussion; entirely; argument; premise; nature; matter; begin; come; people; believe,-1
hni7d8,[deleted],life; figure; stand,,-1
hnhf3c,Little-Dog9336,incel; want; ascend; would; advice,,-1
hnhd98,GullibleClassic1,people; though; worker; option; discussing; opportunity,logic; post; assumption; woman; cheat; opportunity; apparently; barely; chance; cheat; think; logic; wrong; reason; ignoring; prostitution; mentioned; option; people; illegal; stop; making; estimated; billion; dollar; year; easy; caught; large; city; basically; moved; away; prosecuting; prostitution; openly; advertise; service; social; medium; like; twitter; without; problem; according; study; underestimate; sexual; encounter; worker; methodological; experiment; involving; audio; computer; assisted; self; interviewing; acasi; thought; promote; accurate; reporting; point; underreporting; contact; prostitute; national; probability; sample; male; aged; united; state; proportion; reporting; contact; prostitute; almost; four; time; higher; acasi; paper; saqs; used; nhsls; however; acasi; saqs; differ; appreciably; proportion; respondent; reporting; five; lifetime; sexual; partner; ncbi; article; least; married; cheat; paid; someone; another; gender; difference; among; reported; extramarital; past; year; much; likely; woman; paid; received; payment; percent; compared; percent; colorado; asmagazine; extramarital; partner; likely; close; friend; cheat; regardless; personally; feel; sexual; worker; clearly; option; want; string; attached; always; left; conversation; discussing; opportunity; despite; prevalent; strange; know; going; worker; option; agree; like; business; people; logic; woman; whine; finding; like; attractive; like; still; option,-1
hngtgo,bubblepoppa6,beta; male; repulsive; woman; unfortunately; lack; awareness; redpill; miss; success; woman,,-1
hnf6xx,Maybelowsmv,label; become; popularised,label; mean; couple; intentionally; stating; simply; friend; benefit; usually; plate; spinning; would; assume; space; plausible; deniability; idea; plate; break; easily; realises; signed; since; woman; generally; seek; commitment; fact; real; plausible; deniability; attached; fwbs; someone; become; popularised; accepted,-1
hncnzh,classirrelevantppd,saying; different; massive; cope,,-1
hnclip,queenalba-,seem; nearly; impossible; connect; someone; emotional; mental; level; nowadays,online; dating; would; make; sense; able; form; genuine; connection; people; seem; like; opposite; quarantine; downloaded; tinder; boredom; match; talked; people; talked; single; person; felt; strongly; conversation; pick; line; people; straight; asking; hook; boring; surface; level; conversation; people; actually; meet; something; wrong,-1
hncg6c,locomotivity,woman; age; cheat,statistically; look; however; age; cheat; implies; might; first; generation; role; flipped; term; cheating; guy; think; role; source; ifstudies; blog; cheat; demographic; cheating; america,-1
hnbltc,whytanker,really; sound; like; love; real; atleast; idea,grew; diet; disney; film; classic; idea; unbiased; love; people; vain; looked; abstract; person; loved; loved; solely; money; power; status; affirmation; femalehood; growing; seem; like; exists; girlfriend; would; loved; affirmed; defined; societal; idea; female; strong; protected; towered; damsel; point; thought; loved; loved; exclusive; woman; probably; dated; looked; pretty; good; feature; made; feel; like; idea; like; love; complex; trading; abstract; good; service; really; disgust; especially; people; describe; sound; sterile; emotionless; sound; like; science; thought; point; love; lacking; science; esoteric; magic; could; learn; never; truely; understand; true; love; disgusting; feel; good; love; fall; love; becomes; disgusting; want; want; love; someone; love; want; love; someone; reason; whatsoevwr; want; someone; feel; towards; time; felt; like; happening; think; ever; material; being; life; centered; around; sorting; movement; material; guess; disgust; wish; wrong; hope; wrong; hope; fucking; wrong; handle; truth,-1
hn7um9,TheBookOfSeil,think; people; right; person; purposely; ignoring; issue; related; rejection; helpful,greeting; bag; baguette; noticed; theme; conversation; surrounding; dating; rejection; always; said; context; comforting; someone; rejected; mentality; people; hold; rejected; right; worry; find; right; person; eventually; think; fair; degree; honesty; transparency; people; often; right; person; others; compatibility; issue; subreddits; forum; like; website; dedicated; helping; people; understand; basic; woman; think; sexually; romantically; attracted; masse; dating; advice; would; strict; case; case; basis; targeted; toward; right; person; apparently; exist; somewhere; case; point; think; people; deliberately; tell; others; someone; good; hurtful; obvious; reaction; someone; rejected; multiple; time; multiple; people; wrong; nobody; want; good; enough; something; people; might; project; misplaced; confidence; situation; worth; worth; want; good; think; time; egoic; defense; mechanism; prevent; people; thinking; acknowledging; might; indeed; problem; noticed; issue; people; someone; attractive; get; rejected; others; assume; something; personality; unattractive; person; get; rejected; others; assume; something; look; individual; difference; apply; present; idealism; people; basically; expected; perfect; order; successful; true; ignores; everything; else; people; lacking; including; thing; might; matter; much; however; people; trying; improve; telling; wrong; helpful; sweeping; presenting; comforting; blue; pilled; idea; true; love; someone; special; people; looking; would; glad; take; everyone; else; right; person,-1
hn7eob,Distinct_Beyond1519,true; think; following; quote,,-1
hn3jq2,Realization77,really; enjoying; middle; ground; refreshing,honestly; could; trade; noun; femaledatingstrategy; pill; sub; would; essentially; sound; extremity; lack; cross; gender; dialogue; really; constructive; serf; cause; division; sex; expect; find; something; like; internet; awesome,-1
hn2kb8,geyejoe7,difference; girlfriend; boyfriend; friend,title; bing; relationship; person; allows; know; person; much; intimately; would; best; friend; thing; necessarily; share; best; friend; would; share; partner; around; romantic; connotation; feeling; reliability; whole; different; level; kid; medical; reason; adopt; raise; child; romantic; partner; different; raising; best; friend; thing; really; best; friend; would; ever; level; thing; romantic; partner; personally; really; close; best; friend; partner; mine; still; different; differentiates,-1
hn2jx6,SofritoNachos,lot; child; would; take; deal,want; know; many; believe; could; happy; able; laid; easily; woman; could; never; child; basically; life; make; investment; whatsoever; life; reproductive; return; opinion; seen; would; believe; lv; value; could; laid; easily; price; snip; would,-1
hn22qe,bluehorserunning,masturbate,saying; woman; useless; anything; boring; marriage; trap; procreative; young; woman; winner; marries; virgin; woman; father; child; loser; gyow; masturbate; interesting; porn; flesh; light; whatever; potential; time; young; several; time; week; middle; aged; bother; woman; bother; woman; woman; boring; useless; horrible; settled; father; losing; woman; like; pretty; content; alone; pretty; content; masturbate; scratch; itch; horny; like; respect; woman; thing; rather; investing; effort; psychological; manipulation; lie,-1
hn0xp8,WhoAmIEven2,many; find; woman; boring,female; friend; life; girlfriend; none; boring; around; thing; friend; especially; best; friend; adventure; thing; time; small; excursion; stay; home; watching; movie; play; video; game; photograph; together; travel; together; drunk; together; karting; minigolfing; playing; pool; shuffleboard; next; absolutely; nothing; tired; anything; work; still; enjoy; company; idea; come; woman; boring; around; find; right; benefit; across; many; woman; want; talk; make; going; club; know; facebook; instagram,-1
hn0o96,loopyawesome,afbb; norm; vast; majority; would; alpha; gene,,-1
hmxlay,BorisJohnsoned,hello; left; wing; people; bought; hypergamy; thesis; retain; socialism,,-1
hmwiet,zensama,think; parenting; movement,,-1
hmvlgb,thisisrevenge,much; turn; virgin,,-1
hmtbb9,abaxeron,stuck; relationship; person; fault; woman,relationship; wise; flag; matter; public; record; flag; woman; medical; secrecy; need; second; person; internet; find; convicted; murderer; nothing; allow; find; relationship; phase; woman; abortion; hospitalization; extensive; treatment; last; year; woman; criminal; le; likely; convicted; believe; female; murderer; exception; statistically; easier; woman; abandon; relationship; counter; evidence; ever; brought; household; disposable; income; spousal; homicide; extensive; legal; measure; efficient; ever; human; history; mitigate; factor; plus; woman; earn; ever; spousal; homicide; lower; ever; least; year; averaged; spousal; homicide; amount; woman; killed; partner; ex; annually; country; australia; youtube; watch; fallen; amount; people; severely; injured; lightning; barrier; abandon; relationship; division; asset; custody; dispute; child; support; false; accusation; bullshit; restraining; order; annulment; professional; license; failure; time; legally; mitigated; legally; enforced; easier; preselect; eyeballing; woman; affected; mind; clouding; sexual; thirst; mental; disability; usually; much; visible; case; schizophrenia; earlier; onset; male; specific; addiction; smoking; drinking; much; visible; le; likely; conceal; stitch; scar; numerous; indicate; either; proneness; violence; risky; behavior; insanely; luck; time; people; room; temperature; saying; avoiding; leaving; relationship; easy; saying; easier; leave; specific; relationship; situation; person; woman; relationship; woman; often; easier; leave; easier; relationship; woman; bonus; ray; respect; everyone; decency; mention; supposedly; happened; year; supposedly; happens; country; reliable; data,-1
hmsysz,gkfyb,reason; amout; sexlessness; woman; feeling; sexy,,-1
hmrx0i,emeral132,valued; solely; look; woman; suck; attractive; harder; come; valued; society,younger; frizzy; curly; hair; sense; style; skin; pretty; older; learnt; straighten; hair; makeup; skin; completely; cleared; addition; figure; went; skinny; skinny; small; waist; shapely; figure; mean; pretty; much; experienced; life; ugly; girl; fairly; pretty; girl; describe; model; material; looking; good; shape; hate; hate; hate; fact; really; kind; caring; person; load; hobby; interest; talent; always; good; grade; school; good; career; eye; reduced; valued; look; occasion; dated; seemed; really; interested; better; looking; option; le; kind; interesting; intelligent; came; along; hair; mess; makeup; skin; flared; stunningly; beautiful; cousin; told; move; blocking; view; cousin; fair; laugh; ridiculous; show; rude; woman; look; certain; know; woman; superficial; think; criterion; least; based; thing; slightly; le; depressing; would; much; rather; value; based; earning; potential; look; social; skill; look,-1
hmrbn0,geyejoe7,many; dude; best; thing; relationship; aspect; secondary; boring,tell; highlight; relationship; greatest; relationship; sure; amaizing; change; whole; mood; thing; enjoy; aspect; le; likeable; really; question; person; right; heard; take; boring; least; night; partnered; someone; good; personally; love; aspect; relationship; amaizing; love; going; place; like; enjoying; food; hobby; movie; show; anime; nice; question; place; main; focus; like; relationship,-1
hmofmr,calistralia,society; perceive; tucking; shirt; pant; feminine,like; tuck; shirt; believe; look; aesthetically; pleasing; outfit; however; work; today; work; restaurant; female; manager; talk; staff; room; asked; polite; said; would; think; responded; dress; fashionably; forward; good; really; confused; wearing; pair; black; pant; white; sneaker; tucked; black; shirt; progressive; anything,-1
hmob7r,Paranatural,think; extreme; keep; apart,hetero; know; count; virgin; care; shit; never; given; damn; partner; either; generally; agree; male; poster; woman; seriously; zero; idea; easy; redpill; whiney; baby; zero; real; world; experience; basically; never; talked; another; actual; real; life; human; ever; guess; tired; reductive; many; people; woman; purposefully; blind; easy; everything; redpillers; goddamn; ignorant; easy; complete; shitbag; guess; rant; type; live; rteal; world; nearly; bluepilletrs; redpillers; make; ounce; basic; human; compassion; better; life,-1
hmnbci,Archibald_Andino,woman; feel; violated; disgusted; angry; catch; unattractive; older; checking; feel; flattered; exact; behavior; attractive,archive; make; short; going; year; currently; obviously; female; something; able; feel; like; object; disgusted; guy; make; uncomfortable; stare; behind; know; best; solution; wear; sweater; day; might; rush; might; forget; bring; day; hell; squat; deadlifts; anything; lean; dude; seen; real; girl; month; talking; regular; talking; type; dude; fuck; house; nothing; stare; people; like; point; feel; comfortable; enough; body; want; able; rock; booty; like; powerful; woman; lift; really; heavy; like; like; attention; self; esteem; come; random; people; staring; booty; feel; violated; anyone; advice; regarding; topic; serious; lifter; want; mind; game; ridiculous; want; lift; without; feeling; weird; thank,-1
hq9gjt,bubblepoppa6,magically; turned; woman; thing; deny; casual,reddit; born; woman; turned; theyd; newfound; power; sleep; many; people; possible; really; think; youd; female; female; biology; situation; wouldnt; around; hooking; every; dude; enjoying; sleeping; around; woman; consequence; attachment; risk; pregnancy; going; deep; rooted; biology; evolution; instilled; make; uncomfortable; doesnt; right; there; something; wrong; casual; woman; huge; difference; reward; reaped; woman,-1
hq9eyo,PpcUserNowI,monogamy; doomed; failure,watching; video; woman; tend; keep; lot; backup; pitcher; supplementary; option; exclusive; monogamy; fails; thinking; seems; really; accurate; mother; always; used; keep; backup; option; side; backup; option; female; friend; actively; tried; make; ditch; relationship; favor; male; friend; chance; bitch; noticed; girl; male; friend; essentially; function; role; backup; plan; varying; comparative; value; mean; look; objective; point; view; definitely; better; woman; backup; option; like; another; offer; place; case; current; decides; worth; anymore; case; monogamy; exist; bother; maintaining; illusion; monogamous; society; single; dad; mom; thing; extremely; pressurizing; stressful; maintain; monogamous; relationship; side; actively; repeatedly; look; friend; backup; plan; whether; sense; insecurity; whatever; reason; looking; kid; eventually; fathom; life; anyone; would; married; parent; spent; time; away; together; mother; abused; regularly; mine; might; slightly; severe; example; lot; friend; report; parent; sexless; marriage; different; degree; unhappiness; isolated; incident; since; monogamous; relationship; always; devolve; unhappy; sexless; condition; effective; lose; stress; partner; always; going; volatility; factor; raise; child; instead,-1
hq91pu,goldmedalflower,help; understand; psychology; woman; feel; violated; catch; checking; public,talking; obvious; leering; cross; line; think; natural; reaction; seeing; young; woman; yoga; pant; starbucks; search; reddit; actual; post; young; woman; feel; deeply; uncomfortable; male; sexuality; something; sexualizing; woman; public; rub; wrong; know; anyone; thread; askmen; today; triggered; hate; think; target; sexual; thought; yoga; pant; instance; best; give; fuck; creepy; staring; workout; make; short; going; year; currently; obviously; female; something; able; feel; like; object; disgusted; guy; make; uncomfortable; stare; behind; everywhere; matter; revealing; guy; stare; feel; violated; eye; especially; alone; cluster; guy; together; staring; smirking; eye; wrong; place; feel; threatened; literally; scared; anger; anything; technically; anything; either; offended; recently; went; educational; discussion; meeting; leering; body; horrible; thing; mind; instead; intellect; could; bring; help; impact; much; violation; simply; flattered,-1
hq5mbt,throughmylense,realize; woman; good; father; first; person; tell; stay; away; boy; waste; time,,-1
hq5dbp,rainbowsurge444,count; matter; woman,,-1
