post_id,author,title,body,image
8kl9xc,mach_like_a_flame,bachelor; edition; advice,assume; know; deal; black; year; muslim; lean; heavily; conservative; describe; extrovert; usually; beside; center; attention; type; basically; think; manny; scarface; except; black; virgin; waiting; marriage; looking; june; cleaver; type; woman; search; lined; prospect; interested; hearing; outside; observer; opinion; sound; like; best; describe; summary; stand; mind; girl; black; nonreligious; daughter; pastor; radical; intersectional; feminist; attends; girl; college; introverted; year; worked; afterschool; childcare; program; initially; insane; chemistry; muslim; female; support; practising; claimed; virgin; waiting; marriage; thing; went; south; course; month; different; wavelength; regarding; future; went; female; friend; soft; nexted; kept; contact; wanting; reconcile; expressed; intention; stay; headed; towards; marriage; relented; stay; touch; girl; black; muslim; convert; feminist; work; daycare; program; extroverted; instagram; model; type; year; muslim; marriage; matched; briefly; messaged; ghosted; distance; location; northern; georgia; south; florida; downloaded; month; messaged; warm; approaching; converted; islam; late; life; christian; mother; stated; intent; married; taking; backseat; pursuing; text; keeping; conversation; rolling; maybe; worried; ghost; girl; somali; muslim; year; work; teacher; girl; latest; prospect; quick; reply; text; conversation; sided; stated; looking; marry; within; year; however; confirm; traditional; somali; parent; would; approve; outsider; think,-1
8kl5q4,hating-life,meghan; markle; wall,woman; maintains; look; wall; though,-1
8m2mfy,Mr_Smoogs,wall; include; physical; aspect,twentynineandterrified; good; gone; woman; suggests; dating; struggle; part; time; aspect; brings; problem; number; dating; late; twenty; longer; vastly; different; young; naive; full; hope; open; possibility; cute; funny; real; cynical; patience; know; exactly; want; problem; number; meeting; bar; remember; wore; tight; skirt; four; inch; heel; every; night; impress; bunch; really; trying; sleep; long; gone; day; hair; meeting; intoxicated; confident; bachelor; lost; appeal; mention; still; crowd; year; girl; tight; skirt; perfect; contouring; bar; time; compete; work; full; time; probably; hate; le; problem; number; three; energy; younger; used; easy; four; social; event; weekend; work; sleeping; running; errand; struggling; make; grown; joke; much; done; time; want; spend; valuable; hour; sitting; restaurant; hoping; attractive; walk; door; sweep; foot; want; know; going; dang; last; sentence; stood; particular; woman; spends; hour; sitting; hoping; attractive; approach; male; counterpart; approaching; woman; find; attractive; woman; playing; losing; game; younger; woman; would; leisure; time; make; strategy; somewhat; statistically; successful; much; physical; aspect; contribute; dating; struggle; older; woman,-1
8m21kc,LewisCross,marriage; longer; protection; security; status; woman,couple; recent; thread; asserted; woman; still; want; marriage; protection; security; status; breadwinner; woman; expect; protection; security; status; marry; woman; outearn; husband; expect; protection; security; status; marriage; breadwinner; offer; protection; security; status; offer; money; woman; obviously; support; better; husband; woman; earn; husband; still; support; court; order; forcing; father; child; support; child; woman; need; security; today; woman; carry; gun; still; white; knight; everywhere; woman; instinctively; protect; woman; woman; related; live; safe; secure; society; woman; beaten; raped; killed; masse; marriage; provides; status; woman; provide; remnant; relic; tradcon; status; woman; made; clear; really; want; status; least; want; badly; enough; secure; early; woman; much; young; adult; life; without; status; instead; choosing; casual; relationship; varying; duration; seriousness; married; breadwinner; certainly; need; status; marriage; already; high; enough; status; virtue; job; income; potential; status; marrying; beneath; give; extent; woman; want; protection; security; status; relic; bygone; tradcon; marriage; demand; protection; security; status; expectation; woman; benefit; marriage; without; assuming; responsibility; obligation; marriage; good; none; benefit; none; burden; society; endorsed; woman; really; need; protection; security; status; still; want; woman; want; need; expect; demand; marriage; anymore; used; fill; need; anymore; woman; need; thing; certainly; want; thing; need; thing; marriage; changed; protection; security; status; thing; longer; need; provide; woman; longer; expect; challenge; view,-1
8lzlnj,TRPAndNofapGotMeLaid,size; doesnt; matter; another; woman; tell; percieved; shallow; slutty,friend; pretty; super; huge; pretty; average; especially; term; girth; single; woman; told; size; matter; compliment; size; alot; really; enjoy; extra; girth; alot; easy; keep; plate; dont; enough; especially; dont; size; size; matter; like; niceguy; respect; another; case; dont; listen; look,-1
8lzco2,aretheyaliens,worse; bully; woman,boy; tend; bully; physical; threat; violence; girl; tend; bully; excluding; insulting; people; bullied; gender; bullied; ruthless; heard; stats; bully; boy; sound; absurdly; high; guessing; referring; mostly; physical; bullying; sister; mostly; bullied; online; girl; stats; shown; girl; likely; cyberbully; boy; saying; girl; worse; though; necessarily; think; boy; worse; interested; hear; people; experience,-1
8lyukt,aretheyaliens,anyone; else; physically; attracted; emotionally,used; convinced; straight; whole; life; always; interested; fantasized; woman; exception; male; crush; lately; though; come; realize; physically; emotionally; attracted; vast; majority; woman; woman; find; make; different; straight; straight; woman; know; actually; enjoy; woman; like; woman; people; friend; come; realize; actually; find; male; personality; attractive; honestly; woman; ever; crush; part; want; know; true; personality; knew; disappointed; knew; built; idealized; mind; think; woman; generally; sensitive; turn; woman; come; romantic; partnership; tendency; towards; negative; emotion; fact; woman; practically; minded; seems; like; woman; miserable; often; okay; good; heart; care; others; find; attractive; woman; le; likely; special; interest; likely; casually; like; different; thing; good; sense; good; rounded; individual; find; woman; really; passionate; anything; aside; family; really; think; enjoy; though; kind; like; penis; mind; romantic; relationship; requirement; think; laid; back; happier; much; likely; share; interest; weird; might; sound; think; actually; romantic; come; choosing; partner; find; woman; concerned; practical; thing; like; partner; good; provider; hard; worker; financially; successful; sure; concerned; look; kind; like; idea; someone; loving; body; woman; love; body; think; appreciate; male; body; deeper; level; straight; woman; physically; think; find; woman; attractive; least; attractive; woman; versus; attractive; term; personality; find; hotter; anyone; else; feel; find; physically; hotter; woman; personality; hotter,-1
8lx8sg,chalkwork,female; dating; advantage; away; making; figure; worth; much; woman; anymore,,-1
8lw9ta,nailpolishremover2,woman; free; stuff; without; exchanging,like; comment; saying; woman; free; stuff; without; exchanging; cash,-1
8lvxtj,TheChemist158,science; attitude; towards; marriage; never; married; adult,stumbled; interesting; data; research; link; pewsocialtrends; chapter; public; view; marriage; collected; young; adult; marriage; stuff; thread; going; focus; chapter; attitude; towards; marriage; highlight; woman; thought; important; married; intend; spend; rest; life; together; half; never; married; woman; want; married; someday; significant; difference; woman; woman; previous; marriage; much; le; likely; open; remarriage; male; counterpart; woman; said; open; another; marriage; said; woman; much; likely; expect; potential; spouse; steady; woman; expected; whereas; expected; similar; thought; child; important; gender; come; picking; spouse; woman; said; important; spare; shared; thought; least; much; education; important; woman; said; important; potential; spouse; least; educated; plenty; stats; want; look; honestly; think; takeaway; nearly; much; clear; answer; like; woman; think; important; hypothetical; spouse; steady; nearly; half; think; important; hypothetical; wife; steady; quarter; expect; potential; wife; least; educated; really; fitting; idea; care; degree; fact; directly; contradicting; another; interesting; point; never; married; people; never; want; married; woman; likely; want; married; seems; like; still; interested; getting; based; turning; away; mass; like; manosphere; claim; flip; side; woman; turning; away; marriage; rate; many; woman; unsure; getting; married; half; distinctly; hoping; married; pill; take; half; never; married; woman; actually; determined; married,-1
8lvr0q,TechSupport1990,woman; shittest; test,,-1
8lvjak,Idunnowhy2,awalt; equivalent; amalt,pill; say; woman; like; regard; female; sexual; strategy; natural; inclination; hypergamy; awalt; basically; rejection; description; female; nature; believe; woman; think; description; exaggerated; male; equivalent; way; like; redpillers; think; equivalent; wrong; awalt,-1
8luvd1,ifelsedowhile,closeted; look; happier; straight; one,know; tend; look; happier; chattier; cheerful; straight; everyday; life; maybe; commit; suicide; sooner; later; parent; disapproval; priest; give; holy; communion; change; fact; compare; straight; guy; everyday; routine; latter; taciturn; serious; gloomy; comparison; possible; reason; brain; different; le; stressed; deal; woman; finding; easy; constantly; negotiate; attractivity; stable; relationship; woman; expectation; almost; like; free; burden; typically; straight; carry; time; know; situation; would; certainly; happier,-1
8luhy0,solorathain,woman; problem; tend; exaggerate; problem; woman; tend; exaggerate,,-1
8lu0fs,Pooch231,think; average; struggle; much; romantically; rpers; claim,inspired; make; thread; socialism; dude; think; average; regularly; go; year; without; romantic; option; think; average; option; casual; college; stem; major; hung; mainly; nerdy; social; circle; college; friend; super; league; legend; magic; gathering; almost; none; athletic; conventionally; handsome; groomed; almost; every; single; action; every; college; point; decent; looking; seen; unattractive; nerdy; dude; reject; scoff; girl; interested; example; uglyish; awkward; rejected; uglyish; slim; awkward; girl; freshman; year; sophomore; year; game; never; ever; played; senior; year; learned; lost; virginity; previous; summer; overweight; dude; fake; commitment; sleep; overweight; le; girl; mock; behind; back; think; least; half; dozen; example; lazy; main; reason; struggle; sympathize; incels; believe; real; problem; think; average; average; dude; option; think; guy; want; accept; league; want; socialize; actually; approach; woman,-1
8lt9js,Mr_Smoogs,nolittlegirl,woman; nolittlegirl; campaign; trying; help; woman; young; girl; hurt; prostitution; community; link; woman; twitter; coming; saying; campaign; stigmatizes; girl; know; little; girl; want; screw; money; grow; know; work; mental; health; including; worker; worked; profit; experience; industry; first; admit; always; outlier; willing; find; trauma; abuse; self; esteem; issue; woman; saying; wanted; prostitute; young; girl; could; denial; need; feel; control; great; always; find; interesting; tell; campaign; tradcons; radfems; anyway; digging; little; deeper; radfems; wrong; libfem; totally; fine; system; woman; feel; selling; body; choice; want; fight; system; woman; survive; think; need; able; survive; instead; wait; position; best; choice; first; place; interested; girl; personality; trait; girl; deliberately; accept; role; plate; side; chick; similarity; radfems; prostitution; bloops; often; woman; often; describes; user; said; trpers; describe; typical; woman; talk; experience; woman; always; describe; woman; insecure; attachment; style; regular; woman; usually; come; house; abusive; controlling; parent; desperate; love; affection; prostitute; obviously; different; slut; similar; rhetoric; comparing; woman; damaged; broken; come; abusive; home; desperate; love; affection; agree; radfem; campaign; little; mentally; healthy; girl; want; grow; prostitute; girl; deliberately; become; side; chick; broken,-1
8lszke,mach_like_a_flame,bachelor; part; advice,everyone; made; thread; recently; asking; opinion; pursuing; different; woman; discussion; went; actually; applied; advice; everything; fell; apart; somali; girl; introduced; told; blocked; nonreligious; radfem; soical; medium; pissed; muslim; convert; girl; instagram; still; going; life; reached; since; done; nothing; demonstrate; eager; pursue; marriage; moment; time; least; another; somalian; girl; matched; muslim; marriage; yadda; yadda; yadda; asked; parent; would; approve; say; might; looking; marry; sister; nice; somali; asked; parent; know; interested; replied; equivalent; getting; engaged; somali; culture; instead; asked; talk; know; yeah; leave; guess; going; would; story; another; girl; matched; year; blue; contact; earlier; week; white; muslim; convert; turned; reason; forget; prayer; apparently; investigated; homeland; security; yeah; tell; sending; packing; married; foreign; used; obtain; green; card; left; day; involved; another; giving; want; marriage; kid; guess; remembered; obviously; rebound; call; take; white; girl; desperate; married; religion; somali; girl; love; chemistry; thinking; marrying; white; girl; approach; happens; waiting; learn; somali; girl; parent; verdict; think,-1
8ls8eg,azngirl7689,cohabitation; reveal; anything; someone,full; disclosure; pretty; anti; cohabitation; currently; live; soon; propose; agreed; moved; mainly; done; compromise; allow; like; live; whatever; whole; nother; story; involves; resentment; part; away; know; belief; cohabitation; reveal; anything; person; dating; vetting; someone; wash; dish; pick; sock; matter; whole; need; live; thing; stall; free; milk; girlfriend; know; someone; maintaining; separate; residence,-1
8ls0oi,Gravel_Roads,thread; bullying,topic; discussed; forum; reference; bullying; shape; identify; gender; gender; people; around; curious; experienced; bullying; either; personally; observed; affected; view; interact; gender; affected; view; interact; opposite; gender; sympathetic; suffering; others; le; note; would; like; everyone; hard; focus; experience; affected; personally; interested; exploring; worse; person; challenged; thing; uniquely; challenged; male; female; bully; exist; male; female; target; bullying; please; respectful; people; experience,-1
8lr8c2,toolewdforyou,lack; physical; emotional; intimacy; asexual; person; literally; erodes; either; gender; sanity; time; causing; extreme; like; radfems; school; shooter; incels; appear,,-1
8lqrfs,Copronomicon,younger; impatient,,-1
8lpu7o,Eartherry,incel; ever; able; empathize; woman,incels; general; woman; start; girl; boy; life; genuine; motif; looking; best; interest; genuinely; interested; success; nice; thing; like; making; happy; engage; genuine; interest; individual; puberty; change; forever; boy; life; want; something; look; hope; reward; nice; thing; reward; engage; opportunity; winning; reward,-1
8lpphy,mybravenewworld,sexual; selection; socialism,went; college; total; population; people; woman; mimicking; human; ratio; college; world; class; inequality; issue; lived; sized; dorm; cafeteria; took; class; building; food; shelter; healthcare; taken; care; combination; parent; school; great; except; laid; social; atmosphere; sexual; freedom; long; consensual; permissible; happened; woman; converted; christianity; started; shaming; monogamous; cause; thought; convinced; monogamy; woman; would; left; without; would; shot; work; said; monogamy; marriage; female; oppression; damn; thought; idea; read; brave; world; book; people; sexually; free; everybody; everybody; rude; turn; someone; suggested; woman; rude; discriminatory; said; freedom; discriminate; sexually; right; owed; realized; would; missing; girlfriend; wife; kid; father; would; probably; alone; tried; figure; happening; sure; little; taller; little; smarter; little; stronger; little; funnier; tried; shoe; woman; imagined; deal; pregnancy; care; child; made; sense; would; want; best; child; mean; making; sure; child; good; stock; woman; world; need; taken; care; could; choose; purely; based; whichever; best; gene; would; want; anything; le; best; child; understood; woman; seemed; unfair; thing; like; became; resigned; fate; college; ended; lived; capitalist; country; entered; workforce; make; money; settled; life; school; something; interesting; started; happening; woman; made; cent; every; dollar; made; given; free; time; lack; expense; extra; relatively; speaking; community; started; tough; time; noticed; tension; three; people; overheard; conversation; woman; want; kid; raise; income; need; commit; want; continue; relationship; excited; upon; hearing; mean; shot; woman; turn; next; woman; started; flirting; like; finally; able; married; started; living; happily; ever; named; karllenin; sandersstalin; came; meet; much; income; inequality; town; said; woman; making; cent; dollar; unfair; agreed; explained; income; inequality; especially; woman; actually; helping; showed; study; done; le; capitalist; country; sciencenordic; quarter; norwegian; never; father; child; asked; service; production; shared; equitably; would; make; sense; service; reproduction; shared; equitably; suggested; promotion; long; term; monogamy; like; past; futuristic; model; everybody; belonging; everybody; shut; misogynist; said; woman; need; taken; care; redistribution; income; labor; maximum; choice; partner; sperm; choice; reproduction; completely; regulated; economic; marketplace; completely; deregulated; sm; marketplace; anything; misogyny; greed; give; stuff; give; woman; directly; took; fully; automatic; nuclear; rocket; launcher; pocket; shot; face; went; home; fucked; wife; thought,-1
8lpgb0,lemonfloss,equally; likely; branch; swing; woman,would; thing; woman; example; could; relationship; woman; find; something; like; better; leave; move; onto; next; girl,-1
8lp9a3,astrokidd,woman; want; want; woman; want; fuck,creates; biggest; inequality; society,-1
8lnl5v,SkookumTree,would; rather; ugly; heart; gold; utterly; ruthless; sadistic; sociopath,would; rather; relatively; unattractive; tall; rather; ugly; face; heart; gold; intelligent; determined; little; athletic; extremely; sweet; caring; though; take; stand; issue; belief; religious; awakening; decides; become; quaker; becomes; committed; nonviolence; pacifism; outgoing; friendly; though; slightly; frustrated; lack; success; woman; right; though; believing; greater; mission; world; quite; attractive; completely; amoral; sadistic; boot; caught; torturing; stray; year; tried; sociopathic; sadistic; streak; avail; quite; intelligent; straight; student; want; leader; power; inflict; suffering; weak; deems; unworthy; football; player; high; school; deeply; dedicated; everything; enjoys; getting; high; school; classmate; blackout; drunk; woman; rape; friend; asking; gotten; fight; freshman; year; high; school; suspended; realizes; need; play; long; game; order; become; powerful; considering; joining; military; legal; kill; people; working; wall; street; money; power; desperately; craves; would; prefer; ugly; kind; noble; sadistic; amoral; sociopath; attractive,-1
8lncfk,hating-life,career; focused; woman; good; obtain; high; quality; partner,personal; observation; grew; religious; middle; class; environment; foreign; people; basically; friend; acquaintance; poor; country; parent; poor; country; parent; america; want; kid; better; grade; focused; professional; schooling; lined; snobby; corporation; internship; focused; making; money; along; naturally; came; across; similar; make; money; status; think; natural; know; career; focused; woman; could; alone; unless; ugly; girl; feminine; slightly; conservative; trashy; career; care; money; higher; chance; meeting; brad; businessman; chad; work,-1
8lmy9j,squidracer,pushing; stay; home; woman,seems; common; belief; want; woman; quit; stay; home; pump; baby; never; anytime; hear; word; take; care; woman; almost; always; coming; mouth; woman; flip; side; know; wife; work; complain; working; time; exception; daycare; cost; much,-1
8lm2xo,Workaholico,always; male; involuntary; celibate; every; society,always; male; involuntary; celibate; defined; male; partner; past; year; woman; choose; best; male; available; sexual; encounter; relationship; percentage; population; always; competing; sexual; encounter; relationship; woman; always; choose; bracket; thus; every; single; male; alive; today; today; scale; general; value; woman; would; completely; ignore; range; proceed; child; relationship; guess; data; family; study; general; social; survey; correct; male; involuntary; celibate; today; source; ifstudies; admin; resource; celibacy; please; change; view; plus; pill; really; want; help; today; involuntary; celibate; woman; making; next; generation; involuntary; celibate; increase; score; pace,-1
8lk7cm,Atlas_B_Shruggin,would,move; explicitly; would; marry; owned; house; lived; would; deed; live; take; support; role; wife; kid; expense; career,-1
8ljcmz,Mr_Smoogs,feminism; shame; male; sexuality; masculinity,reddit; purplepilldebate; comment; inverse; female; sexuality; previous; thread; feminist; finding; inverse; female; sexuality; problematic; user; responded; feminist; approved; desire; become; patriarch; said; another; desire; lead; provide; protect; woman; congruent; feminism; think; counted; bloops; responded; freedom; choice; speech; patriarch; feminist; would; choose; woman; like; want; taken; care; strong; older; however; vast; majority; user; responded; obviously; feminist; problematic; know; feminism; identify; become; patriarch; congruent; feminism; thats; logical; impossibility; feminism; people; seem; beleive; feminism; care; whats; men; interest; outside; patriarchy; hurt; whether; feminist; really; treat; woman; equal; partner; relationship; problem; want; take; charge; woman; expressing; feminist; desire; idea; masculinity; male; sexuality; always; ability; desire; provide; protect; lead; youthful; fertile; woman; greasy; defined; aggression; male; male; taking; role; societal; individual; protector; providership; family; male; dominance; heirarchies; backstopped; violence; extreme; status; seeking; ambition; male; result; almost; exclusive; male; leadership; role; orientation; thing; object; compared; female; orientation; people; read; full; comment; reddit; purplepilldebate; comment; masculinity; socially; constructed; way; dzfncj; think; case; difference; rhetoric; libfem; radfem; split; given; definition; masculinity; provided; greasy; response; thread; believe; feminism; shame; male; sexuality; masculinity,-1
8lj7rp,Jokengonzo,woman; ever; empathize; incels,whole; incel; movement; going; many; saying; woman; understand; frustration; wonder; true; given; fact; woman; part; easy; dirt; floor; ever; empathize; guy; common; moon; rock; earth,-1
8liyc2,SendThotsAndPrayers,female; gender; social; construct,contrary; theory; science; evolutionary; biology; fact; difference; gender; gender; binary; fact; singular; observable; animal; kingdom; among; animal; human; being; indoctrinated; marxist; gender; study; course; frequent; intellectual; platform; known; tumblr; gender; exist; spectrum; thus; nothing; social; construct; reality; gender; fluid; asexual; romantic; choose; mate; theoretical; gender; fluid; fantasy; figure; people; wonder; could; evolution; possibly; favor; singular; gender; absolutely; difference; complimentary; strength; answer; question; simple; bigot; asking; please; keep; hate; speech; intellectual; platform; human; being; evolved; common; ancestor; chimpanzee; gorilla; thousand; year; typical; male; look; like; female; appears; necessary; genitalia; however; learned; special; snowflake; social; justice; warrior; social; medium; reddit; assuming; difference; gender; based; upon; seemingly; obvious; exterior; interior; behavioral; gender; characteristic; prejudicial; microaggression; typical; female; fact; identifies; binary; gender; known; male; lift; think; create; fight; everything; least; classical; social; construct; male; gender; social; construct; classical; social; construct; male; take; control; classical; social; construct; female; answer; question; simple; bloody; misogynist; woman; everything; evil; patriarchy; came; stole; thunder; gender; seemingly; truly; differ; male; term; strength; behavior; pattern; speed; mass; hormone; disagreeing; shamed; individual; alone; basement,-1
8livzk,Pretty_Please_C_My_V,state; involved; marriage,know; many; benefit; marriage; woman; show; committed; long; increase; social; status; among; friend; wedding; fancy; dress; shiny; ring; benefit; without; marriage; legally; binding; contract; afraid; marriage; state; involvement; personally; state; involved,-1
