post_id,author,title,body,image
8jtp3a,EJPQ,quarterback; football; team; slap; girl; butt; guy; reach; around; grab; girl; boob; prank; mistletoe; hung; doorway; told; girl; stood; kiss; time; playing; volleyball; beach,,-1
8jtia8,drrsek,would; serious; relationship; feminine,honest; answer; name; understanding; please,-1
8jrdl7,Scatre,shame; high; count,question; mainly; woman; seen; woman; call; skank; slut; common; woman; woman; insult; woman; offended; male; called; virgin; embarrassed; accepted; society; failure; everyone; know; laugh; called; virgin; laugh; absurdity; woman; get; called; slut; reason; embarrassed; everyone; know; laugh; reason; rude; word; implying; something; deeper; shame; slut; whore; shame; labelled; seems; like; somethings; missing; feel; free; correct,-1
8jqpiy,Jokengonzo,ideal; partner; look; like; physically,could; make; ideal; partner; would; look; like,-1
8jqbwk,Reven311,study; female; four; time; sensitive; male; economic; status; cue; rating; opposite; attractiveness; indicating; higher; economic; status; offset; lower; physical; attractiveness; much; easily; woman,abstract; parental; investment; hypothesis; regarding; mate; selection; suggest; human; male; seek; partner; featured; youth; high; fertility; however; female; sensitive; resource; invested; offspring; previous; study; indicate; economic; status; indeed; important; male; attractiveness; however; previous; study; quantified; compared; impact; equivalent; resource; male; female; attractiveness; annual; salary; direct; evaluate; economic; status; combined; image; male; female; body; shape; information; annual; salary; elucidate; influence; economic; status; attractiveness; rating; opposite; raters; american; chinese; european; population; found; rating; attractiveness; around; time; sensitive; salary; female; rating; male; compared; male; rating; female; result; indicate; higher; economic; status; offset; lower; physical; attractiveness; much; easily; woman; neither; raters; influenced; effect; female; rating; male; attractiveness; difference; explains; many; feature; human; mating; behavior; pose; barrier; male; engagement; consumption; lifestyle; afraid; opinion; without; forced; mod; leave; completely; open; judgmental; people; make; change; people; view; gender; dynamic; pillers; interpret; information; discus,-1
8jq8rr,lemonfloss,woman; sacrifice; relationship,everyone; always; talk; woman; want; commitment; believe; commitment; overrated; woman; really; want; protected; invest; sure; commitment; part; reality; enough; woman; remain; satisfied; relationship; woman; get; exclusive; relationship; stop; talking; still; trying; sleep; hand; usually; fare; better; regular; drink; woman; club; flake; maybe; logical; standpoint; relationship; better; woman; term; emotional; sexual; need; probably; sacrificing; getting; need; relationship,-1
8jpeu3,thromgtow,woman; inherit; hatred; disdain; anxiety,simple; statement; think; hold; true; primal; level; woman; despise; prone; anxiety; becomes; known; dealing; anxious; everything; power; browbeat; subjugate; ensure; stay; riddled; anxiety; help; ultimately; nature; deep; desire; someone; confident; anxiety; free; putting; facade; utilizing; fake; till; make; reasoning; moment; facade; upheld; longer; lose; attraction; develop; strong; sense; disgust; toward; second; ahead; challenge; view,-1
8jp64l,DerPhilosoph,ever; become; racism; someone; refuse; date; member; certain; race,think; becomes; racism; person; find; member; attracted; certain; race; attractive; reason; someone; want; date; someone; certain; race; explained; anyone; said; would; accept; dating; either; white; asian; woman; dating; someone; half; prob; said; would; never; accept; dated; black; latina; muslim; woman; another; comment; reddit; summed; best; everyone; free; picky; want; term; requirement; person; must; date; mainly; blame; finding; suitable; partner; people; probably; willing; compromise; blaming; choice,-1
8jox9m,IAmWhoIAmSoAreYou,effort; feminism; european; country; helped; encroaching; islamization,,-1
8jnltk,Workaholico,discussion; argument; pill; blue; pill,want; pill; person; answer; argument; blue; pill; person; answer; argument; blue; pill; view; source; possible; think; interesting; debate; keep; track; argument; edit,-1
8jmjxf,iseeyouxo,housewife,thought; pill; advocate; able; change; beta; male; idea; talk; girl; played; used; girl; alpha; spin; plate; better; emotionally; physically; find; incredibly; impossible; woman; accumalted; high; count; didnt; know; worth; took; time; better; improve; themseleves; become; loving; supporting; faithful; wife; spectrum; improving; extreme; side; within; gender; role; pill; us; woman; past; based; soley; number; though; showed; past; life; learned; better; saying; human; creature; habit; cant; said; used; always; beta; pretending; adopt; alpha; trait; beta; side; always; remain; unbelievable,-1
8jm6ps,BiggerDthanYou,think; theory; trpers; select; quality; woman,according; woman; simply; stupid; invent; anything; importance; selfish; lead; effectively; short; sighted; plan; usual; short; sighted; answer; trpers; simply; female; nature; hooked; handful; woman; like; therefore; impossible; type; woman; could; exist; according; simply; show; normal; woman; nice; guy; tactic; flag; stay; away; surprise; one; trpers; illogical; clueless; naive; childlike; one; wondering; trpers; think; selection; bias; influencing; trps; opinion; woman,-1
8jkq8k,Pretty_Please_C_My_V,attractive; people; personality; biggest; problem; dating; world,many; people; negative; experience; dating; like; getting; cheated; woman; getting; used; getting; used; gift; dinner; favor; resource; people; personality; small; minority; really; shit; people; possibility; commitment; woman; possibility; anything; small; minority; ugly; average; attractive; people; people; shallow; always; give; attractive; people; chance; therefore; attractive; people; personality; huge; number; victim; make; seem; people; dating; world; explaining; pill; obsession; awalt; attractive; woman; good; personality; relationship; equally; attractive; good; personality; leaving; shitty; attractive; woman; pillers,-1
8jjqt6,TechSupport1990,genuine; problem; super; attractive; woman,would; following; genuine; problem; unwanted; attention; ranging; annoying; creepy; mild; nuisance; serious; problem; validation; getting; maybe; optimal; amount; validation; maybe; brain; validation; circuit; burnt; million; million; compliment; although; validation; tolerance; must; vary; person; person; nobody; seeing; physical; feature; anxiety; need; constant; physical; upkeep; lose; people; around; constantly; declare; important; anxiety; inevitable; future; physical; decline; inevitably; lose; people; around; constantly; declare; important; absolutely; stunning; really; mean; supermodel; named; ubah; hassan; said; following; video; digital; short; ubah; fashion; model; orig; video; playlist; digital; short; film; special; page; short; film; life; grew; never; told; beautiful; never; told; ugly; physical; look; mean; nothing; think; good; raise; child; beautiful; dangerous; thing; aspire; wonderful; people; rather; beautiful; beauty; go; beauty; fade; wake; morning; waiting; people; praise; disappointed; something; looking; guy; think; bulleted; problem; problem; would; list,-1
8jid90,Logisticor,explain; older; unattractive; woman; successful; happy; love; life; riding,thesun; tvandshowbiz; morning; viewer; hysteric; woman; husband; fiance; boyfriend; source; fbpage; medium; social; campaign; sprnklrsunorganic; utmx; editorial; thesun; fblink; statement; showbizandtv; time; real; life; honestly; think; whole; concept; wall; major; cope; weekend; lounge; age; flocking; year; woman; buying; drink; getting; slightly; attention; younger; girl; opinion; slim; good; looking; older; woman; show; beauty; self; control; lie; beyond; youth; although; younger; woman; still; usually; slightly; attention; anyone; else; noticed; woman; seem; alone; woman; want; alone; anything; seems; like; riding; woman; chad; short; supply; rarely; settle; relationship; woman; teen; early; chad; alpha; settle; attractive; higher; beta; provider; late; honestly; think; pillers; hate; fact; retribution; deserved,-1
8jhvj8,VAOTOMARNOCU,male; student; female; student; drunk; later; accuses; sexual; assault; found; guilty; suspended,reason; blog; cincinnati; rape; title; apparently; girl; previously; accused; friend; claim; accusing; revenge; friend; maybe; right; case; show; idea; affirmative; consent; retarded; fuck; america; currently; cynical; people; literally; racing; claim; raped; thought,-1
8jgo9c,hating-life,pill; woman; ideology; actually; woman,rpw; caters; mold; would; want; everything; think; pill; woman; would; exploiting; orbiter; trying; find; rich; realizing; valuable; young; woman; like; preparing; stay; home; fool; read; reddit; captain; good,-1
8jg1mw,11668822,woman; reject; cold; approach,,-1
8jexzz,Pretty_Please_C_My_V,young; woman; using; tinder; free; dinner; example,reddit; purplepilldebate; comment; ghcgi; redpilled; thread; asked; woman; pilled; pilled; realized; extent; male; sexuality; started; feeling; like; object; tinder; ultimate; pill; young; woman; imagine; thousand; guy; hitting; might; want; fancy; date; might; want; adventure; woman; know; expect; female; friend; acquaintance; tinder; course; hottest; guy; find; average; guy; date; free; lunch; dinner; come; back; tell; boring; date; endure; laugh; guy; attempt; getting; back; place; call; second; date; friend; block; feel; chump; getting; scammed; broke; college; girl; glad; know; better; clear; example; example; manipulative; trying; food; favor; trip; manipulative; come; naturally; woman; result; disgusted; male; thirst; using; advantage,-1
8jelh1,TechSupport1990,vaginal; tightness; start; decline; woman; significant; factor; smv,people; talk; penis; size; regarding; male; smv; vaginal; tightness; female; equivalent; however; vaginal; tightness; much; le; obvious; determine; fact; sexist; myth; decline; count; idea; wonder; fact; decline,-1
8jei12,Mr_Smoogs,feminism; dating; odds,effort; fight; categorization; masculine; feminine; behavior; innate; served; blur; behavioral; dichotomy; gender; effort; take; good; believed; feminine; good; ascribe; masculine; foster; behavior; social; androgyny; inclusive; everyone; leave; someone; disadvantaged; gender; staple; modern; feminism; often; fall; short; come; dating; often; read; article; like; bust; feminism; feminism; dating; odds; html; realizing; great; deal; male; population; dating; site; make; effort; appear; normal; respectful; boundary; started; saving; screenshots; conversation; aside; everyday; life; online; dating; constant; reminder; suffocatingly; confining; gender; role; immobilizing; male; entitlement; render; dating; game; young; feminist; still; dating; find; crossroad; admit; time; time; fallen; playing; blushing; sexually; feminine; doll; feminist; long; time; decided; jump; infested; water; love; feel; shying; away; confronting; role; date; perform; stupid; shit; conform; disclaimer; might; vomit; reading; list; complacency; never; message; first; rarely; initiate; feel; confused; perceived; afterwards; male; gaze; influence; date; outfit; struggle; communicating; need; fear; coming; needy; desperate; crazy; girlfriend; material; hide; perverted; humor; rambunctious; laugh; strong; opinion; around; third; date; mark; instead; giggle; blush; wildly; day; straight; obsessively; look; flowchart; like; photo; link; submissive; away; taking; charge; inside; outside; bedroom; date; dropped; feminist; bomb; bug; although; consciously; playing; gender; role; feel; full; throttle; immobilizing; disempowering; make; feel; bring; stop; constantly; state; waiting; waiting; called; waiting; asked; date; waiting; kissed; waiting; make; decision; hope; read; mind; choose; thing; want; bullshit; frustrating; hell; think; pretty; stupid; every; aspect; life; feminist; except; matter; romantic; relation; okcupid; blog; released; data; woman; feel; pursuing; result; showed; fewer; straight; woman; whether; feminist; prefer; pursuing; fact; small; margin; straight; woman; responded; identifying; feminist; actually; le; likely; want; exclusively; pursuant; responded; extent; rigid; consider; male; female; gender; role; dating; feminism; dating; odds,-1
8jdtuo,SendThotsAndPrayers,believe; western; society; lack; neutral; ground,,-1
8jdmqe,theiamsamurai,often; girl; kiss; thigh; foreplay; kissing; thigh,inspired; topic; foreplay; think; generally; onus; make; woman; feel; desired; kissing; around; pussy; aroused; tease; deliberately; avoiding; pussy; building; tension; experience; experience; talked; woman; sort; thing; nearly; often; woman; claimed; want; hear; conflict; interest; hearing; account; like; woman; account; experience; body; part; thigh; could; stomach; nipple; think; thigh; outline; problem; better; guy; imput,-1
8jdcs0,morsthepalerider,incels; victim; self; victimizing; culture,taken; intellectualtakeout; article; respond; incel; movement; incels; still; victim; victim; first; feminine; sexual; cruelty; making; advance; woman; vulnerable; position; tell; poor; excuse; deeply; hurt; religious; moral; objection; outside; marriage; easier; live; woman; every; right; except; absolutely; refuse; take; answer; kindly; incels; victim; second; economy; squeezed; many; member; middle; class; affirmative; action; program; disfavor; young; white; assume; want; stable; relationship; woman; despite; many; year; feminism; woman; still; want; child; want; contribute; financially; upkeep; incels; victim; third; campaign; toxic; masculinity; become; toxic; sexual; predator; straight; many; day; especially; young; without; father; taught; healthy; form; masculinity; uncertain; sexual; identity; exposure; hating; feminism; sneer; sexually; successful; wound; deeply; respect; resemble; alt-right; right; whose; frustrated; desire; child; lead; fantasy; white; genocide; incels; example; victim; victim; based; identity; politics; pervades; culture; people; victim; severe; injustice; whose; ancestor; victim; need; take; responsibility; life; attempt; coerce; rest; affirming; damaged; identity; game; number; play; incels; last; long; train; victim; unwilling; deal; problem; perhaps; could; find; partner; among; lower; status; woman; rather; swallowing; black; pill; sexual; despair; thought,-1
8jcs9b,[deleted],incels; attention; seeker,,-1
8j8r1k,453465436654,casual; devalues; woman; make; slut; immoral; seeking,know; action; going; make; another; person; worse; right; believe; woman; sleep; around; hypocritical,-1
8j8mbk,SendThotsAndPrayers,content; dropped; quality; year,reading; best; post; written; make; believe; best; stuff; written; left; recycling; content; echo; chamber; confirms; awalt; circle; jerk; noticed; pioneer; ended; stopping; posting; moved; platform; longer; content; level; discussing; societal; problem; posting; another; intriguing; post; intersexual; dynamic; believe; everything; need; know; slowly; becoming; obsolete,-1
8j86lf,prostate-apostate,feminist; would; feel; ended; stepdad,,-1
8j5ujn,EmoryUpton,relationship; flaw,past; day; question; reddit; purplepilldebate; comment; offer; woman; woman; reddit; purplepilldebate; comment; iygtc; woman; besides; frequent; else; regarding; offer; respect; relationship; question; asks; opposite; drawback; relationship; answer; limited; trait; habit; would; affect; someone; romantic; relationship; right; woman; view; vast; majority; faint; disgust; example; long; love; respect; husband; disgust; would; therefore; relationship; flaw,-1
8j5pc2,AutoModerator,weekly; community; chat; megathread,weekly; thread; designed; place; funny; discussion; feel; free; post; topic; question; information; point; view; thread; post; everything; think; warrant; thread; socialising; comment; automatically; sorted; post; throughout; week; people; comment,-1
8j46jj,jkonrad,responsible; decline; trying; enjoy,seems; clear; rpers; beta; guy; cheated; branch; swung; kicked; hypergamous; awalt; never; orbit; reason; woman; masse; sick; weak; sauce; realized; could; better; fine; judging; think; intentional; anything; irony; make; worth; mentioning,-1
8j3wn1,justhanging92,true; regard; female; attraction,mobile; twitter; tatethetalisman; status; generally; true; woman; stop; feeling; sort; reaction; regardless; small,-1
8j3gxu,Melthengylf,affirmative; consent; kino; escalation,gradual; escalation; intimacy; physical; contact; checking; person; response,-1
8guza8,Electra_Cute,qforredpill; hypergamy; context; pill,hypergamy; used; context; pill; pill; definition; hypergamy; definition; pill,-1
8gt4mz,Supernumiphone,think; woman; leaving; showing; weakness,enjoyed; reading; post; reddit; purplepilldebate; comment; gbob; weakness; showed; like; explore; phenomenon; understand; bpers; summarize; common; claim; experienced; sometimes; repeatedly; rejection; woman; display; weakness; usually; situation; clear; sustained; attraction; time; attraction; significantly; dropped; disappeared; opened; emotionally; lost; displayed; weakness; failed; hold; frame; like; people; take; thought; really; including; limited; believe; happens; usually; attributed; cause; common; apply; woman; specific; type; respond; knowledge,-1
8gsz3z,Szymmy,male; hypergamy,whole; get; said; female; hypergamy; male; hypergamy; real; usually; male; polygamy; phrased; counter; part; hypergamy; described; term; woman; branch; swinging; vying; best; possible; male; exact; want; best; possible; mate; literally; reasonable; thing; anyone; want; hypergamous; trophy; wife; thing; want; hottest; youngest; girl; male; branch; swinging; common; place; life; crisis; ditching; wife; bimbo; secretary; half; stereotype; time; female; hypergamy; often; cited; cause; high; divorce; rate; ruined; relationship; statistic; tell; married; likely; cheat; wife; vice; versa,-1
8gs95f,ifelsedowhile,happier; tier; beta,homosexuality; becoming; increasingly; normalized; would; argue; better; tier; beta; since; longer; facing; social; stigma; associated; physical; intimacy; relationship; much; easily; tier; beta; expecially; often; either; incel; endure; long; dateless; spell; fullfil; request; obligation; woman; expect; relationship; arguably; le; stressful; demand; likely; couple; straight,-1
8gs526,Pretty_Please_C_My_V,player; chad; know; real; life; like; took; trps; advice,differently,-1
8gru2o,solorathain,entitled; woman; entitled,fill; blank,-1
8grmkn,Hottosmart,ugly; woman; work; harder; dating,observation; pretty; woman; easier; dating; seen; highly; successful; overlook; many; flaw; partner; happens; beautiful; example; know; beautiful; woman; high; school; degree; career; prospect; married; advanced; degree; actually; time; leaguer; acquaintance; child; outside; wedlock; married; successful; beautiful; recently; couple; regular; absolutely; gorgeous; stay; home; wife; hand; close; friend; average; face; formerly; obese; plenty; stretch; mark; cellulite; always; struggled; married; successful; pull; weight; salary; pay; full; mortgage; grocery; pay; insurance; payment; student; loan; husband; previously; married; woman; significantly; attractive; friend; footed; bill; almost; everything; told; attractive; overlook; flaw; beauty; really; much; incentive; overlook; aspect; professional; financial; prospect; wonder; leaguer; stem; field; find; common; high; school; graduate; trying; mean; someone; tell; maybe; woman; pleasant; know; cook; clean; plenty; attractive; obviously; gorgeous; career; woman; pleasant; cook; clean,-1
8gri72,SchemingInBathrobes,attraction; work; relationship,established; general; attracted; youth; beauty; everything; else; woman; crave; status; male; partner; however; interested; dynamic; work; relationship; still; uniformly; attracted; look; fertility; virility; else; looking; young; beautiful; lesbian; woman; prefer; woman; high; status; need; compromise; look; theory; experience,-1
8gqz4s,dearisabella,respectful; break; long; term; relationship,posted; relationship; reddit; purplepilldebate; comment; yyxev; advice; please; earlier; year; relationship; issue; post; addressed; problem; regressed; argument; boyfriend; blatantly; told; going; change; stopped; bringing; started; asking; willing; accept; possibly; rest; life; realized; planning; ending; relationship; sweet; much; truly; love; would; like; break; respectfully; live; together; family; owned; place; deal; rent; break; temporarily; moving; internship; summer; promised; attend; piano; recital; occurring; five; day; leave; thinking; conversation; day; arguing; trying; enjoy; last; day; caught; guard; unfair; string; along; next; month; first; relationship; first; break; really; unsure; idea,-1
8gqps4,LSTW1234,physical; turn; offs,imagine; meet; attractive; woman; wherever; physically; exactly; type; anything; could; would; make; le; sexually; attractive; mean; thing; make; le; attractive; option; relationship; mean; thing; decrease; desire; casual; fling; thing,-1
8gp1br,23dragonflies,toxic; feminity; female; female; incivility,always; thought; mean; girl; problem; talked; enough; thought; insight; shape; unspoken; politics; woman,-1
8gnr6o,Pooch231,unfair; expect; woman; invest; potential,actually; think; woman; invest; potential; point; post; pill; believe; attractive; woman; settle; young; le; attractive; nerdy; guy; idea; become; high; value; woman; great; deal; high; smv; love; post; wall; several; thing; wrong; never; becomes; high; value; knew; nerdy; guy; college; still; friend; many; became; fatter; bald; zero; unattractive; hard; working; guy; knew; became; attractive; became; le; successful; expected; supposedly; filled; former; nerd; turned; hotties; think; guy; would; work; landed; dream; girl; young; probably; girl; would; unattractive; dude; hated; fucking; think; unfair; want; punish; woman; investing; potential; many; attractive; popular; young; guy; would; date; girl; nice; eye; nice; smile; maybe; would; look; llike; model; lost; weight; many; groomed; guy; would; date; frumpy; girl; bone; structure; look; good; lost; twenty; pound; gave; makeover; pretty; much; none; woman; expect; know; attractive; order; like; think; girl; like; unattractive; potential; entitled; fuck,-1
8gmjdb,Atlas_B_Shruggin,immoral,woman; boyfriend; year; engaged; discus; marriage; month; crippling; bout; depression; come; home; announces; quit; promising; career; lawyer; finance; whatever; pursue; dream; artist; leaf; immoral; wrong; person; duty; continue; relationship,-1
8gluat,TheChemist158,stoicism; part; toxic; masculinity,view; topic; everyone; negative; emotion; human; people; feel; strongly; readily; different; situation; might; bother; different; people; individual; thing; negative; emotion; deal; violence; numb; alcohol; bottle; talk; therapy; toxic; masculinity; harming; others; attempt; male; gender; norm; expected; stoic; believe; lot; address; negative; emotion; detrimental; attempt; seem; stoic; example; would; getting; aggressive; feeling; insulted; insecure; harm; others; address; negative; feeling; significantly; likely; abuse; substance; substance; abuse; often; numbing; negative; feeling; dealing; negative; emotion; harmful; seen; several; argument; break; point; address; feminist; everything; awful; masculinity; toxic; saying; laid; definition; toxic; masculinity; think; encompasses; masculinity; someone; hold; belief; masculinity; toxic; argue; presenting; stance; want; discus; toxic; masculinity; substance; abuse; violence; whatever; part; masculinity; part; reclaiming; masculinity; think; great; strive; best; version; want; change; view; masculinity; exclude; detrimental; behavior; attitude; awesome; view; masculinity; everyone; view; masculinity; many; think; showing; negative; emotion; without; putting; level; thought; care; mean; masculine; likely; suffer; toxic; masculinity; unmasculine; feeling; feel; masculine; violence; alcohol; woman; hysterical; mess; toxic; feminity; think; like; take; emotion; seriously; enough; woman; take; seriously; true; woman; often; overly; emotional; hard; time; stepping; back; viewing; thing; objectively; call; toxic; feminity; like; everyone; happy; middle; ground; acknowledge; emotion; process; healthy; without; blindly; following; like; every; violent; junkie; every; woman; emotional; wreck; talking; pitfall; gender; fall; woman; usually; like; woman; shame; emotional; sure; woman; bitch; expect; emotional; rock; fact; would; example; toxic; feminity; woman; understand; human; emotion; need; dealt; blindly; follow; emotional; reaction; distaste; negative; emotion; easily; toxic; feminity; time; adult; charge; life; choose; either; rethink; idea; masculinity; engage; detrimental; behavior,-1
8gjw86,zenplus,older; babyfaced,young; looking; early; people; regularly; college; let; good; dating; murdered; online; dating; month; dating; apps; gone; date; general; matched; girl; looking; like; either; attractive; girl; think; using; year; photo; main; photon; photofeeler; site; people; rate; attribute; physical; attractiveness; trying; around; approaching; club; people; constantly; bring; older; thankful; something; effect; tbqh; really; seeing; think; better; chance; large; relationship; look; younger,-1
8gir62,Hydroeletric_,biological; father; biological; mother; increasing; time,share; childless; rose; percent; percent; share; woman; become; mother; increased; percent; percent; sciencenordic; quarter; norwegian; never; father; child; fewer; impregnating; woman; hypergamy; control; explanation; situation; worsen; future,-1
