post_id,author,title,body,image
hz1alu,BerniesAnalSlave,maybe; clothes; climate; invented; help; horny,last; weekend; went; camping; special; friend; last; weekend; really; pissed; clothes; felt; like; scam; made; capitalism; decided; spend; weekend; naked; seperate; society; expectation; sounded; really; thought; going; mushroom; chill; ended; getting; really; horny; really; easily; time; ended; fucking; whole; night; instead; actually; anything; made; think; like; really; turned; body; usually; like; example; naked; effect; thought; maybe; made; clothes; climate; begin; think,-1
hz0w6b,dumbo_the_slayer,mating; ritual; quite; natural; different,talk; principle; unfair; first; thing; first; take; hard; bruh; photo; nature; male; compete; female; female; selects; best; would; swipe; apps; different; upload; photo; person; best; photo; get; selected; quite; simple; process; really; take; hard; bruh; photo; like; said; mating; ritual; common; nature; different; human; example; illustrate; point; bird; paradise; famous; dance; move; male; bird; paradise; effort; attracting; female; dance; inherited; father; practised; refined; throughout; life; ready; mating; male; push; feather; form; sort; skirt; performing; dance; female; watch; bowerbird; bowerbird; like; show; skill; building; extravagant; structure; known; bower; twig; floor; covered; bone; shell; stone; leave; though; like; decorate; filling; bower; shiny; object; flower; petal; praying; mantis; mating; unfortunate; activity; male; praying; mantis; risk; eaten; female; lured; female; pheromone; male; mate; female; bite; head; male; unlikely; away; uninjured; male; make; around; female; diet; mating; season; female; male; appear; egg; giraffe; giraffe; important; find; whether; female; ready; mate; attempting; male; however; appealing; drink; urine; know; ready; need; fight; competition; swinging; long; neck; suitor; nature; male; competing; male; would; human; different; viewed; male; female; actually; male; male; please; explain; woman; reject; fault; dude; better; blame; another; dude; trying; take; personally; bruh; photo,-1
hyydbm,tossa445,shaming; logical; trap,,-1
hyxm8j,Il128,,,-1
hyxe2n,123me_anon,like; refer; awalt; think; reasoning; behind,awalt; mean; pill; male; behavior; referring; believe; think; ingrained; woman; biology; product; conditioning; society; seen; said; actually; mean; woman; like; really; said; mean; woman; potential; like; think; actual; meaning; awalt; think; refers; potential; really; make; saying; irrelevant; everyone; male; woman; potential; anything,-1
hyvyo2,southmob25,rule; applies; situation; like,,-1
hyv1nv,DaburuKiruDAYO,thought; makeup,start; saying; really; sure; stand; topic; personally; woman; enjoys; wearing; light; moderate; amount; makeup; semi; frequently; obviously; woman; tricking; people; using; makeup; instinctively; recoil; disagreement; seeing; outside; rational; perspective; sure; agree; whole; wear; makeup; never; ahead; sexist; narrative; personal; experience; wear; mostly; generally; improving; impression; general; public; friend; teacher; boss; whatever; would; lying; said; never; wore; impress; interested; though; small; percentage; reason; wear; makeup; mean; inherently; deceitful; anyone; see; public; wearing; makeup; mean; serious; question; rhetorical; date; situation; feel; taking; care; fancy; almost; etiquette; like; trim; beard; nice; face; accentuating; haircut; wear; suit; unfair; deceitful; woman; wear; amount; makeup; inherently; person; unfair; socially; unacceptable; wear; makeup; general; woman; mind; wanders; thing; like; perfume; deodorant; wearing; clothing; accentuates; body; type; natural; temporary; change; people; around; woman; open; look; like; without; makeup; okay; people; change; drastically; really; honestly; rare; quite; obvious; real; life; guy; talking; minimal; percentage; woman; wear; makeup; artist; level; face; morphing; makeup; case; think; would; frequent; topic; serious; advocate; normalizing; wearing; makeup; concealer; brow; pencil; long; makeup; normalized; would; le; woman; wear; makeup; mostly; referring; real; life; interaction; tinder; photoshop; rather; makeup; personal; preference; makeup; makeup; talking; morally; wrong; deceitful; woman; wear; makeup; wrong; drastically; change; line; ugly; woman; make; look; better; naturally; pretty; people; looking; forward; discussion,-1
hyuv5p,decoy88,woman; seem; really; really; judging; attractiveness; photo,woman; tend; really; really; judging; attractiveness; pic; argument; colleague; mine; think; like; said; fuck; told; picky; insisted; see; people; find; attractive; time; colleague; test; asked; colleague; name; looked; social; medium; like; photo; photo; swipe; several; photo; landing; saying; look; attractive; anecdotal; know; done; similar; test; female; friend; like; judgement; scale; broken; come; still; image,-1
hythmg,12afraid2ask,know; infamous; study; woman; rated; average; everyone; drew; different; conclusion; result; question; think; would; happened; woman; rated; woman; would; created; accurate; bell; curve; result,various; theory; curious; woman; underrating; everyone; woman; woman; underrating; compare; woman; stretch; make; sense; woman; underrating; compare; ideal; mind; theory,-1
hyqlp0,knowledgeseeker999,result; online; dating,,-1
hyp3rv,Markvan_throaway,many; official; discord,,-1
hyodah,geyejoe7,woman; likely; give; advice; avoid; imperfect; rather; helping; mold,strolling; seek; advice; flair; post; woman; come; looking; advice; often; turned; away; called; pick; ishas; told; dump; never; advice; help; individual; rather; instantly; leaving; hope; better; think; past; became; great; person; obviously; wife; wife; least; supportive; girlfriend; help; happily; married; prosper; reason; need; someone; support; emotionally; order; achieve; greatness; giving; advice; woman; instantly; dump; boyfriend; textbook; perfection; ridiculous; one; would; take; flag; woman; potential; partner; relationship; broke,-1
hymhvy,ha_na_bi,count; obsession; avoiding; infidelity; male; count; discussed,predictor; infidelity; count; brought; predictor; woman; history; never; literature; suggests; number; prior; partner; correlated; higher; chance; infidelity; fact; study; sciencedaily; release; suggest; high; number; short; term; partner; lead; higher; chance; infidelity; woman; person; history; predictor; infidelity; reported; short; term; sexual; partner; prior; marriage; likely; affair; opposite; true; woman; distorted; version; healthy; relationship; okay; cheat; woman; revenge; cheating; significant; predictor; infidelity; word; woman; likely; cheat; male; partner; unfaithful; question; male; count; discussed; much; think; reasonable; consistent; expect; count; partner; remaining; want; cake; woman; care; count; much; potential; partner; count; obsession; reflect; certain; insecurity; feeling; missing; predictor; strong; relationship,-1
hymgpv,ha_na_bi,count; obsession; mainly; avoiding; infidelity; maintain; monogamous; relationship; making; sure; keep; count,predictor; infidelity; count; brought; predictor; woman; history; never; literature; suggests; number; prior; partner; correlated; higher; chance; infidelity; fact; study; sciencedaily; release; suggest; high; number; short; term; partner; lead; higher; chance; infidelity; woman; person; history; predictor; infidelity; reported; short; term; sexual; partner; prior; marriage; likely; affair; opposite; true; woman; question; male; count; discussed; much; think; reasonable; consistent; expect; count; partner; remaining; woman; care; count; much; potential; partner; count; obsession; reflect; certain; insecurity; feeling; missing; predictor; strong; relationship,-1
hyk8am,NarniaFox,think; marrying; first; partner,interesting; thread; askwomen; marrying; first; partner; reddit; askwomen; comment; woman; ended; marrying; first; wonder; pill; community; think; topic; benefit; lower; risk; cheated; higher; chance; satisfied; relationship; feeling; exclusivity; uniqueness; meet; early; date; quite; long; time; chance; grow; together; take; part; forming; belief; moral; future; plan; many; people; benefit; outweigh; side; effect; mostly; experience; people; prefer; casual; fwbs; ltrs; would; chose; marrying; first; partner; think; compatible; love; year; decade; marrying; later; never,-1
hyeu1w,12afraid2ask,know; infamous; study; woman; rated; average; everyone; drew; different; conclusion; result; question; think; would; happened; woman; rated; woman; would; created; accurate; bell; curve; result,,-1
hyd1pp,blue_samus,dating; life; figured; involve; hobby; passion,common; dating; advice; people; hobby; passion; occupy; instead; dating; guy; agree; advice; come; good; place; think; people; without; support; system; work; first; pursuing; passion; course; somebody; already; involved; passion; change; somebody; problem; socially; think; focus; primarily; area; passion; people; already; comfortable; area; life; social; animal; friend; relationship; similar; eating; importance; starving; meditate; mountain; climbing; find; food,-1
hybkls,AutoModerator,weekly; community; chat; megathread; july,weekly; thread; designed; place; funny; discussion; feel; free; post; topic; question; information; point; view; thread; post; everything; think; warrant; thread; socialising; comment; automatically; sorted; post; throughout; week; people; comment; check; purplepilldebate; discord; discord; zkwvb,-1
hyapb7,lilastr,appropriate; body; count,question; folk; people; interested; long; term; commitment; marriage; please; reply; since; comment; contribute; anything; productive; question; interested; often; extreme; discussed; virgin; best; material; woman; count; lady; alone; appropriate; rational; number; fall; extreme; please; include; would; appropriate; count; around; count; reason; repulsed; high; count; woman; chance; infidelity; later; life; knew; matter; fact; high; count; woman; commit; never; cheat; extremely; loyal; make; believe; issue; pride; self; esteem; need; marry; woman; fucked; around; quality; partner; think; reasonable; woman; want; deal; someone; sexual; insecurity; question; woman; interested; often; claim; woman; look; count; personally; agree; appropriate; count; marriage; maximum; minimum; please; include; age; woman; count; around; acceptable; le; unacceptable; think; obsessed; woman; body; count; would; willing; insecure; count; ex; promised; loyalty; word; worth; take; opinion; seriously; motivation; nothing; insecurity; related; please; engage; send; statistic; deny; people; opinion; answer; perspective; within; frame; question; write; bitch; shit; virgin; loyal; data,-1
hy9zqq,_Neon_Shadow_,would; react; daughter; worker,unprecedented; time; noticed; young; woman; selling; considering; trend; likely; continue; future; undoubtedly; woman; found; daughter; worker; would; react; dont; mean; selling; foot; pic; either; selling; body; alternatively; would; feel; girlfriend; wife; worker; past,-1
hy9s2o,shininGbannette,damaged; good,recently; noticed; trend; pill; pink; pill; debate; group; seem; decided; anyone; opposite; gender; trauma; mental; disorder; damaged; good; giant; flag; opposite; gender; question; gender; mental; health; issue; time; stemming; toxic; relationship; everyone; mental; health; issue; considered; damage; good; left; thing; group; decided; people; opppsite; gender; struggle; need; different; catered; type; love; worth; people; mental; disorder; angel,-1
hy8zr3,Requiemforthemass,ironically; enough; main; reason; woman; might; partner; personality,,-1
hy83ei,PPD-Angel,update; poll; posting,moderation; team; discussed; allowing; user; post; poll; decision; currently; poll; posting; remain; disabled; time; poll; posting; enabled; next; purge; week; random; day; moderator; decide; purge; right; detail; still; discussed; concern; participation; circlejerking; quality; thank; come; check; discord; drgree; banned; discord; zkwvb,-1
hy7tub,LillthOfBabylon,bothered; woman; first; choice,people; anyone; first; choice; never; understood; many; guy; lament; super; unrealistic; perfect; get; woman; want; hypergamy; dictate; woman; want; best; everyone; unless; person; inferiority; self; hate; complex; want; best; anything; wanted; dumb; jock; high; school; want; good; yeah; called; maturity; like; girl; wanted; teen; want; especially; important; person; want; family; understand; bother; guy; much; woman; marry; loving; call; beta; buck; marry; perfect; woman; dream; either; married; strip; club; fucking; mistress,-1
hy7by4,RichUnderstanding1,fertility; reproductive; value,,-1
hy4iug,caudillosalvaje,helo; wanted; share; thought,many; post; start; behave; like; woman; behave; like; really; seem; result; thinking; based; little; experience; random; people; would; answer; people; like; guy; portraying; sorry; english; suck,-1
hy3xft,anonextra,done; mental; health; physically; unattractive; anything; done,talking; physically; unattractive; inflexible; trait; height; facial; structure; respond; poorly; lack; sexual; fulfilment; loneliness; independence; woman; reason; settle; ugly; assumption; mean; significant; portion; unable; find; relationship; woman; settle; equal; lower; physical; attractiveness; debatable; interested; discussing; done; mental; health; anything; done; escort; virtual; reality; robot; really; help,-1
hy3a9s,suicidelemonade,become; attractive,,-1
hy3a9o,DaburuKiruDAYO,make; think; traditional; woman; would; give; chance,complain; promiscuous; woman; went; back; attractive; traditional; hvw; value; woman; choose; back; woman; highly; favored; hvm; maybe; wanted; successful; rich; handsome; husband; reproduce; fact; traditional; woman; would; le; likely; give; chance; traditional; woman; still; shallow; care; deeply; outer; appearance; money; complaining; recent; unbalanced; unfair; smv; market; value; never; really; changed; woman; always; choose; want; traditional; chaste; virgin; simultaneously; goddess; treat; like; slave; master,-1
hy39h6,mountainofjoy,woman; custody; seen; caregiver; society,think; pretty; straightforward; advocate; woman; one; take; care; kid; saying; mom; take; care; kid; simply; equally; parent; responsibility; simultaneously; wonder; earth; woman; often; custody; battle; feminist; thing; think; opposite; mom; seen; one; responsible; child; care; naturally; usually; mom; awarded; custody; right; discus,-1
hy2wmj,ex_red_black_piller,america; promiscuous; popular; medium; redpill; would; tell,source; ifstudies; blog; promiscuous; america; smart; secular; somewhat; le; happy; ifstudies; blog; promiscuous; america; smart; secular; somewhat; le; happy; totalsororitymove; number; partner; normal; totalsororitymove; number; partner; normal; lehmiller; blog; question; friday; many; sexual; partner; people; lehmiller; blog; question; friday; many; sexual; partner; people; phys; news; lover; liar; partner; html; phys; news; lover; liar; partner; html; mode; common; number; reported; forget; average; skewed; people; sleeping; partner; number; sexual; partner; going; time; think; theredpill; suffers; sampling; bias,-1
hy0y4t,goneaway2thewind,find; hiding; dead; body,,-1
hy0t2o,YoureNotAGoodLiar,average; woman; objectively; better; life; average; period,,-1
hy0dow,MentleGentlemen098,mind; lover; smaller; weaker,,-1
hy0dnb,IcyHotRoad,question; conservative,,-1
hxynhe,PickleLine,woman; sleep; quickly; serious,quickly; defined; relation; slept; slept; first; date; slept; serious; first; date; usually; take; date; sleep; wait; date; sleep; serious; determines; quickly; woman; sleep; comfortable; feel; around; much; attracted; chad; sleep; faster; better; category; good; match; comfortable; around; think; attractive; dated,-1
hxymky,lilastr,body; count; questionnaire,body; count; gender; number; past; introvert; extravert; ambivert; answer; feel; like; ambivert; choose; likely; truth; level; satisfaction; history; elaborate; count; level; satisfaction; wish; le; higher; openness; disagreeableness; temperament; personality; wise; reason; question; noticed; unusual; pattern; life; colder; temperament; often; introvert; high; body; count; content; past; warm; temperament; people; opposite; black; white; thinking; hence; discussing,-1
hxy3oz,Rollie-Fingers,every; woman; many; think; take; form; medication; alleviate; anxiety; think,dated; fair; share; woman; noticed; common; trend; anxiety; take; form; medication; help; anxiety; question; woman; anxiety; anyone; friend; think; medication; long; term; solution; every; woman; many; think; anxiety,-1
hxxdhb,JohnDoe721,higher; education; real; life,,-1
hxwbzo,Nopillplease,woman; year,,-1
hxw3eu,empresa_josefina,believe; chad; fantasy,,-1
hxu0ah,12112019,woman; bitter; towards; modern,thinking; question; time; still; although; theory; happening; visit; sub; woman; share; problem; majority; issue; lv; value; code; attractive; enough; want; offer; commitment; enough; resource; decent; career; understand; year; sexual; revolution; still; inherently; clear; issue; entirely; cause; woman; choice; life; opening; sexual; market; woman; basically; incentivized; tier; play; field; much; possible; since; always; advantageous; without; sparing; resource; process; since; heard; market; failure; spanning; year; come; conclusion; happens; today; modern; majority; woman; prefer; since; woman; controller; sexual; market; majority; woman; prefer; current; bitter; resentful; towards; situation; really; complicated; read; average; post; made; woman; immediately; target; hvm; probably; much; le; willing; give; benefit; doubt; magic; either; woman; tighten; sexual; market; forcing; offer; commitment; mean; woman; pair; rest; woman; stay; single; without; sexual; today; woman; sexual; majority; pumped; dumped; simply; untapped; pool; tier; woman; desire; believe; happening; woman; oblivious; fact; really; practice; monogamous; life; style; marriage; give; simple; example; gave; distorted; average; woman; view; rmp; could; tier; woman; like; tinder; instance; swipe; right; woman; individual; woman; situation; look; great; tier; interested; woman; decide; become; monogamous; woman; discover; tier; pursue; fact; believe; reason; resentment; woman; believe; tier; lv; value; scum; behave; morally; everything; could; great; world; reality; would; behaved; morally; majority; woman; would; ever; come; actual; question; giving; realization; majority; woman; never; tier; would; behaved; morally; would; preferred; moral; version; today,-1
hxqf3y,peterrobins89,stop; watching; porn,,-1
hs5cq0,Hannubal,pill; philosophy; used; many; excuse; weakness,enjoy; pill; community; society; encouraged; keep; silent; real; problem; exist; dating; market; community; become; space; free; speech; however; discussing; manipulation; many; woman; think; problem; using; problem; excuse; ignore; weakness; thinking; woman; manipulative; form; emotional; defense; rather; working; taking; risk; find; good; woman; excuse; participating; game; woman; type; thinking; rationalize; sleeping; around; quality; woman; failure; adopting; attitude; becoming; developed; think; pill; philosophy; used; teach; danger; risk; inherent; dating; quality; woman; however; done; encourage; mgtow; philosophy; encourage; promiscuous; lifestyle; done; motivate; working; find; deserve; high; quality; woman; course; worked; resolved; trauma; would; still; partner; medium; quality; woman; high; quality; woman; would; already; taken; however; became; stronger; individual; could; make; woman; stronger; look; someone; like; patrice; neal; agree; philosophy; aware; behavioral; pattern; quality; woman; could; essentially; force; become; better; throwing; wall; sheer; logic; becomes; stronger; follow; suit; go; woman; become; developed; think; great; community; talk; thing; supposed; think; shame; idea; circulating; used; excuse; personal; growth; mean; side; woman; pill; many; stoop; level; kindergartner; shaming; count; guilty; many; problem; pillers; discus; often; sub; bring; issue; around; right; many; woman; lash; statement; rely; woman; take; care; issue; attitude; absolutely; abhorrent; woman; together; idea; woman; obligation; help; clearly; founded; misandry; understand; woman; think; like; attitude; towards; father; brother; son; sex; help; anyone; think; differently; filled; insecurity; regard; thought; weakness; pill; community; opposite; side; know; think,-1
hs3yk0,G77R23D,would; respond; situation,minute; since; discussion; like; bring; question; another; round; response; added; tweak; time; typical; sunday; enjoying; afternoon; home; significant; significant; politely; asks; make; sandwich; bring; drink; hungry; thirsty; respond; everyone; please; state; gender; along; thought; process; writing; response; doesnt; like; sandwich; would; never; sandwich; cant; bread; gluten; sensitivity; please; dont; post,-1
hs36jk,MerryVegetableGarden,would; effect; honest; society; beneficial; detrimental; society; large; honesty; regarding; intention; personal; history,zero; misrepresentation; front; history; early; relationship; regarding; info; partner; might; find; pertinent; question; honest; answer; deception; part; deception; part; woman; secure; commitment; utopian; make; believe; society; would; lack; prolonged; secret; affair; require; lie; maintain; woman; honest; physical; characteristic; want; ditto; woman; honest; wanting; high; muscular; funny; high; status; provider; le; likely; hide; desire; multiple; partner; would; repercussion; society; lie; prevent; descending; dystopian; nightmare; acknowledgement; certain; truth; would; much; bear,-1
hs2l5d,medstudentz,prefer; ugly; woman; marriage; pretty; woman,,-1
hs200a,ThisIsMyAccount135,worth; reading; advice; laid; askmen; similar; subreddits,whenever; thread; come; often; look; profile; guy; responding; creep; clue; place; life; almost; always; married; guy; early; older; back; laid; time; worse; advice; married; older; guy; seem; track; record; getting; laid; getting; married; dunno; seems; like; alot; advice; either; larp; intentioned; outdated; cognizant; rapid; change; society; faced; past; year; general; year; older; current; early; seem; aware; rampant; mental; illness; lack; career; opportunity; mostly; problem; average; guy; getting; girl; lack; social; skill; maybe; hang; misfit; struggle; seem; invisible; older; people,-1
hs1xhv,satori-in-life,acceptable; woman; trash; supposed; accept,,-1
hs1l4a,TheBookOfSeil,woman; really; want; good,week; started; rather; interesting; post; going; contribute; adding; fuel; dumpster; fire; trope; woman; wanting; good; etched; gut; society; long; remember; always; hear; woman; saying; want; good; whisk; away; untroubled; water; everything; perfect; never; worry; tell; line; thinking; exactly; fantasy; single; quite; awhile; teenage; year; developed; social; anxiety; trouble; breaking; talk; people; self; conscious; standoff; thing; never; stopped; observing; watched; others; throughout; teen; year; afterward; grew; self; consciousness; thing; always; stuck; people; relationship; constantly; fought; sometimes; pettiest; thing; sometimes; serious; shit; always; remained; constant; rare; seen; relationship; people; constantly; happy; problem; relationship; constant; issue; always; remained; constant; awhile; either; married; reached; tipping; point; couple; split; case; point; seems; like; woman; really; want; good; idea; good; almost; entirely; based; feel; accurate; depiction; reality; picture; good; imagine; someone; know; mentally; strong; honorable; virtuous; honest; always; trying; best; communicative; empathic; committed; value; fantasy; almost; every; encounter; heard; seen; woman; complain; type; perfect; heard; woman; dumping; reason; imagine; perfect; challenge; everything; right; controversy; make; woman; wonder; going; next; leave; nothing; open; interpretation; stone; left; unturned; come; conclusion; actual; good; boring; woman; want; someone; like; tired; dicked; believe; woman; actually; want; good; want; occasionally; good; good; occasionally; year; read; something; online; rollercoaster; effect; strictly; pua; stuff; person; wrote; said; rollercoaster; effect; basically; alternate; good; range; positive; emotion; quickly; going; negative; emotion; short; amount; time; back; positive; emotion; never; personally; overtly; manipulative; strike; chord; someone; would; need; manipulative; order; attract; woman; first; place; sort; revelation; woman; really; want; nice; guy; good; claim; want; confused; hearing; thing; past; overtly; blunt; woman; basically; slave; emotion; overt; manipulation; work; pua; risen; popularity; among; work; good; claim; want; still; fall; short; able; long; known; plenty; good; cheated; treated; poorly; partner; sure; similar; story; good; woman; woman; saying; want; good; based; fantasy; interpretation; good; push; button; make; feel; emotionally; captivated; positively; negatively; almost; need; constant; stream; emotion; order; feel; anything; otherwise; legitimately; good; good; enough,-1
hs0fye,HaterOfHypocrisy,blue; pill; belief; amazed,bluepillers; strongly; disagree; redpillers; many; thing; often; amazed; thing; bluepillers; believe; redpillers; often; look; viewpoint; held; bluepillers; wonder; could; possibly; believe; wanted; guy; blue; pill; belief; blow; mind; personally; belief; woman; good; people; belief; woman; one; oppressed; instead,-1
hs051q,123me_anon,seems; commonly; agreed; upon; woman; cheat; nature; hypergamy; cheat,seen; claim; woman; nature; cheat; biologically; hypergamous; extreme; continuously; swing; branch; branch; looking; highest; value; male; awalt; however; every; single; woman; ever; talked; cheated; seems; common; time; excused; society; curious; reason; cheating; deny; cheat; high; rate; believed; nature; cheat,-1
