post_id,author,title,body,image
o8ybay,4030114904,fuck; male; domestic; shelter,office; national; statistic; figure; show; every; year; three; victim; domestic; abuse; male; equating; woman; male; bed; domestic; abuse; le; total; horrible; narcissistic; abusive; boyfriend; escaping; anytime; wanted; would; move; house; excuse; know; live; would; back; time; wasting; many; council; resource; never; shelter; house; would; shelter; waiting; take; though; thing; male; kicked; narcissistic; mother; live; heroin; addict; coke; addict; girlfriend; stuck; council; give; fucking; house; shelter; abused; life; never; given; help; hate; fighting; always; assaulted; girl; multiple; occasion; either; nothing; happenned; blamed; incident; csnt; phone; police; mentally; torture; steal; actually; fought; police; show; arrest; either; male; destroyed; mental; health; pushed; close; suicide; murder; many; time; last; week; single; full; night; sleep; start; argument; time; night; scream; shout; hour; time; screaming; insulting; literal; hour; spent; insulting; trying; study; level; exam; aswell; adhd; depression; probably; anxiety; given; help; knew; girl; lied; depression; cosmetic; surgery; like; ear; pinned; back; tell; people; suicidal; refer; waiting; month; sort; support; mental; health; financial; support; work; everything; single; thing; food; move; stuck; deserving; help; school; girl; would; argue; would; always; punished; matter; wrong; world; fucking; sexist; towards; college; expected; listen; feminist; bullshit; argument; girl; college; said; infant; circumcision; illegal; said; prefers; like; plus; cleaner; said; boyfriend; clean; fucking; dick; right; autonomy; body; control; woman; right; fucking; mental; around; guess; happenned; pulled; aside; reprimanded; stating; opinion; though; literally; talking; girl; perpetrator; saying; love; look; better; girl; guarantee; would; outrage; constantly; told; woman; genuinely; close; abyss; noone; want; pull; back; problem; anyone; nobody; want; shoulder; issue; blame; everyone; help; woman; clearly; depressed; noone; want; help; depressed; actually; help; amazing; response; starved; affection; love; help; unbelievable; woman; worse; fucking; sick; justice; system; fucking; sexist; maybe; would; able; stay; house; stay; kill; someone; else; noc; care; actually; something; sent; jail; woman; something; wrong; though; people; make; sort; excuse; mean; fuck; sake; news; story; woman; showing; tit; copper; cock; police; officer; would; registered; offender; rest; life; sick; every; fucking; resource; going; help; woman; scholarship; stem; though; capable; woman; talk; look; child; anymore; gotten; older; people; consider; creepy; woman; freely; woman; drunk; grope; rapist; fuck; society; collapsing; anyway; cant; wait; sooner; fully; collapse; sooner; start; used; want; save; world; think; option; anymore; gone,-1
o8xsz0,Bara-enthusiast,feminist,,12010
o8xqym,wuutgenstein,matt; hancock; lost; personal; issue,,-1
o8xqck,Bara-enthusiast,hateful; one; feminist; homophobe,,12011
o8xojl,Bara-enthusiast,feminist; mras; violent; one; accept; support; feminist,,12012
o8xenn,Glittering-Gur-9487,question,think; current; moment; woman; given; position; ability; genitalia,-1
o8xbrw,Glittering-Gur-9487,question,think; current; moment; woman; given; position; ability; genitalia,-1
o8xash,Cool-Studio1841,casual; shaming,,12013
o8x82r,Glittering-Gur-9487,question,think; current; moment; woman; given; position; ability; genetelia,-1
o8x452,Electric_Logan,domestic; abuse; case; end; death,,-1
o8wx0y,DCG-Gaming,anyway,,12014
o8wvn0,DCG-Gaming,anyway,,12015
o8vmsq,truuuuuuuuuck,advice; raising; today; society,,-1
o8v5xc,mhandanna,example; feminsits; altering; basic; tenant; human; right,,-1
o8uzqi,callagkier,sued; child; support; part; child; life; biologically; related,,-1
o8uq66,ItsAdani,prank; show; brutal; sexual; harassment; apparently; people; find; funny; legit; imagine; gender; reversed,,-1
o8u6go,No_Preparation_1859,guy; think; woman; spoiled; choice; come; dating,,-1
o8twr6,Ceruleanknight1,share; ghis; really; stupid; something; uncommon; read,,-1
o8tbo9,LifeisDepressing555,would; better; born; female,finding; really; difficult; come; title; flair; narrow; wanted; go; honestly; nutshell; hate; human; male; seems; suck; female; vent; tldr; handle; pressure; society; especially; female; orentated; think; male; hard; western; world; problem; worse; male; sister; life; much; better; mine; point; suggest; atleast; female; sure; know; fated; loser; first; place; like; example; asocial; quiet; male; friend; rely; connection; adult; life; nothing; work; damaging; seem; easier; time; keeping; friend; depressed; loser; find; work; insufferable; would; rather; resist; deepens; demise; never; able; date; woman; ever; take; toll; extremely; frustrating; crippling; perhperial; sound; pain; never; go; away; really; away; unless; never; girl; attracted; really; talk; without; getting; laughed; whatever; emotional; either; depressed; male; weak; disposable; constant; reminder; powerless; life; society; feel; like; anything; think; anything; change; outcome; strength; supposed; apparently; rather; carry; weight; till; actually; person; woman; usually; seen; weak; margin; error; heard; validated; slim; valued; anything; provide; lonely; think; would; reperiocated; anyways; atleast; satisfies; approach; woman; good; enough; woman; either; literally; shot; based; faith; essentially; complete; personality; wise; course; woman; easy; regard; responsible; date; lead; protect; bullshit; want; regard; working; certain; job; catered; woman; including; thing; like; fan; uniquely; accessible; opposed; stuff; like; warehouse; job; find; male; would; willing; take; potentially; worst; possible; scernario; homeless; still; atleast; seems; better; male; feel; like; thing; unwanted; woman; many; unwanted; world; essentially; treated; human; many; option; really; anything; drone; want; understand; would; considered; maybe; questioning; whether; social; construct; first; place; gender; inherent; characteristic; create; role,-1
o8sojo,hatsan69,reading,feeling; soon; start; teaching; critical; gender; study; student,-1
o8sd90,Glittering-Gur-9487,question,think; feminism; especially; third; wave; feminism; playing; victim; card; want; especially; west,-1
o8s68y,Frag_Bearlm,read; comment; talk; right; boyfriend; completely; fault; pregnant,,-1
o8r1f2,Tanoki1,join; fight; right; join; reddit,,12016
o8qya2,Tanoki1,,look; right; protectorate; community,-1
o8qx0e,knowledge_seeker123,company; hiring; woman; gender; alright; hiring; specific; field; work,,12017
o8qj3j,GG1312,celebrating; freeing; woman; killed; mentally; abusive; husband,,12018
o8qhn5,stevhon23,,,-1
o8nkzc,RockmanXX,cent; feminist; issue,woman; seen; le; competent; taken; seriously; patriarchy; deemed; worthless; loser; prove; worth; considered; girl; considered; woman; reach; people; hold; higher; standard; performance; berate; fall; short; feminist; finished; task; proving; ignore; fact; plain; janes; regularly; marry; work; hard; become; marry; solution; either; stop; telling; need; prove; worth; start; telling; woman; prove; worth; hold; woman; different; standard; expect; everyone; respect; woman; respect; matter; hard; people; rationalize; know; back; mind; woman; held; standard; woman; face; many; sexually; aggressive; stalker; take; answer; arrive; situation; mainly; woman; issue; patriarchy; common; reason; woman; give; want; rejected; want; seen; desperate; realize; sending; society; message; one; emotionally; strong; enough; handle; rejection; solution; need; stop; telling; role; pursuer; stop; shaming; single; celibate; social; pressure; force; aggressively; pursue; woman; society; expects; woman; started; pursuing; large; enough; number; could; arrive; parity; woman; considered; weak; patriarchy; unlike; woman; allowed; weak; everyone; treat; capable; solving; problem; using; sheer; willpower; take; look; annoying; self; help; guru; manosphere; feminist; bluntly; tell; emotional; seek; help; overcoming; lifelong; psychological; conditioning; something; easy; flipping; switch; people; stop; emotionally; comforting; boy; certain; everyone; expects; worst; kind; mental; anguish; kind; flippant; attitude; towards; reinforces; idea; simplistic; automaton; emotionally; complex; being; course; woman; weak; compared; machine; feel; pain; need; help; expected; pull; confidence; charisma; success; look; dead; eye; wrong; real; user; manual; claim; perform; task; ease; woman; fall; short; something; hold; hand; okay; dear; understand; statistical; reality; likely; violently; assaulted; murdered; tell; woman; careful; outside; give; physically; stronger; excuse; built; equally; still; expected; fight; stronger; defend; woman; fight; nation; solution; need; stop; treating; like; machine; automatically; woman; weak; comparison; equally; vulnerable; human; society; need; stop; revoking; dignity; using; real; lack; social; recognition; vulnerable; human; make; appear; stronger; human; vulnerable; remain; strong,-1
o8md3j,i_dont_know_2000,suck; allowed; display; emotion; woman; start; questioning; sexuality,displaying; emotion; woman; anger; frustration; sadness; seem; take; advantage; question; sexuality; express; anger; towards; woman; violent; venting; fragile; masculinity; whatever; mean; seems; like; vent; issue; flaw; woman; without; attacked; sisterhood; called; sexist; hate; woman; movement; like; feminism; talk; shit; nobody; care; deserve; oppressing; woman,-1
o8m2c1,jorlynfame,looking; someone; want; talk; want; somefun; marianfame,,-1
o8m0w3,mashthemango,male; chaperone; please,,-1
o8lv5v,Shrek5Exposed,subreddit; joke,,-1
o8ksan,theretard45,convicted; child; molester,,12019
o8ks4o,BornAgainSpecial,meme; need; feminism,,-1
o8kpor,theretard45,hate; woman; smack,,12020
o8km4u,theretard45,hate; winning; sack,,12021
o8kl78,theretard45,like; shtriper,,12022
o8kivp,theretard45,people; hope; cancer; ugly; cock; sucker,,12023
o8kgqz,theretard45,need; fucking; life,,12024
o8kf7t,theretard45,inside; dad,,12025
o8kdwa,theretard45,every; right; rapist,,12026
o8k74q,theretard45,putin; trump,,12027
o8k5wc,theretard45,,,12028
o8k2rj,theretard45,whose; called; stick; dick; inside,,12029
o8jytu,theretard45,fitsid; wife; head,,12030
o8jw6w,theretard45,single; area,,12031
o8ju80,theretard45,really,,12032
o8jtf8,theretard45,gave,,12033
o8jrfh,theretard45,gabe,,12034
o8jma2,Glittering-Gur-9487,question,think; feminism; especially; third; wave; feminism; playing; victim; card; want; especially; west,-1
o8iy9l,ProtectIntegrity,pregnant; encourages; genital; mutilation; automatically; ban; intactivists,,12035
o8iah4,Agirlformensright,college; discriminate,,-1
o8hud6,MixedKid05,pregnancy; subreddit; banning; intactivists; forced; circumcision; minor; whatever; happened; body; choice,,12036
o8hssg,MixedKid05,pregnancy; banning; intactivists; forced; circumcision; minor; body; choice; matter; male; female,,12037
o8grjp,BackAlleyKittens,genital; mutilation,,12038
o8gdd1,Smashingmatriarchy,doller; month; dollar; dinner; hehe,,12039
o8g6zx,throwaway4mra,check; comment; proof; value; provider,,-1
o8fye3,Sir_Sux_Alot,something; nice; look; first; comment,,-1
o8fnpb,OwnPhilosopher9756,another; honestly; people; hurting,,-1
o8fbe5,SC2sam,misandry; full; display; thread; sexual; assault; user; believe; boy; responsible; sexual; assault; need; taught; sexually; assault; woman,,-1
o8f9cn,KLASHINOV,double; standard; finest,,-1
o8f1gx,mashthemango,male; chaperone; please,,12040
o8ey83,lalala477,teach; young; cause; worth; domestic; violence,,-1
o8e72x,No-Perspective5346,boy; boy; controversial; quote,,-1
o8dov5,lalala477,gaslit; time; reproductive; coercion,,-1
o8d6dr,SkaterOfDreams,attitude; feminist; toward; male; victim; gender; violence; woman; business,,12041
o8d5el,SkaterOfDreams,attitude; feminist; towards; male; victim; gender; violence; woman; business,,12042
o8d2q8,clicmoderno,,,-1
o8cz6u,DavidByron2,australia; second; rapist; mensrights; second; rapist,australia; famous; case; rape; back; called; second; rapist; mensrights; false; allegation; feminist; influence; court; diabolical; episode; second; rapist; convicted; rape; woman; said; told; stop; said; carried; second; pulling; basis; recent; change; pushed; feminist; made; irrelevant; consensual; initially; force; threat; used; faced; year; prison; time; mras; united; condemning; massive; expansion; definition; include; trivial; zero; example; considered; rape; many; pointed; including; feminist; law; lobbied; across; world; woman; waking; husband; blow; birth; rapist; law; often; came; minimum; sentencing; guideline; would; sentenced; considerable; time; prison; taken; granted; definition; rape; abusive; intended; attack; law; people; getting; drunk; making; never; woman; rapist; mocked; asking; drunk; lesbian; rapist; rape; day; seems; like; modern; mras; wholesale; adopted; draconian; definition; rape; want; idiocy; inflicted; woman; inflicted; upon; board; equivalent; second; rapist; woman; suppose; second; rapist; according; people; downvoted; reddit; mensrights; comment; raped; reply; started; saying; feminist; would; call; case; rape; said; think; think; rape; much; many; mras; obviously; taken; role; feminist; side; somehow; attack; suggesting; maybe; healthiest; response; situation; massively; expanding; definition; rape; include; stupid; shit; exactly; worked; woman; worked; great; feminist; woman; healthy; nurse; grudge; victim; life; healthy; around; calling; survivor; fixing; life; identity; around; dumb; event; life; fact; point; difference; woman; come; labelling; victim; event; purpose; pointing; male; victim; undercounted; relative; female; right; woman; wrong; woman; adopt; healthier; approach; male; denial; like; healthy; pump; event; past; victim; either; sort; situation; think; good; idea; turn; victim; meter; live; past; feminist; changed; law; decade; might; currently; waking; husband; blow; make; rapist; never; used; lost; sight; fact; current; state; affair; fucked; deliberately; fucked; decade; feminist; direct; goal; screwing; link; second; rapist; serving; time; ruined; committed; suicide; woman; acted; witness; later; proven; lied; convicted; much; shorter; period; noted; change; decided; could; change; falsely; convict; proven; right,-1
o8cchv,sspicysaladfingerss,french; woman; get; completely; scott; free; murder; husband; applauded; feminist,,-1
o8a53z,AdityaGutpa,watching; riverdale; seems; okish; noticed; example; woman; double; standard; borderline; psychoticness; woman; show; episode; spoiler; cause; stuff; like,biggest; thing; noticed; grundy; music; teacher; relation; year; high; school; statutory; rape; try; hiding; could; potentially; help; find; murderer; veronica; sticky; maple; chuck; right; posting; thing; social; medium; instead; complaining; police; example; ahead; turn; temperature; point; burning; basically; torture; confessing; chuck; get; busted; woman; stand; pride; torturing; someone; posted; something; wrong; thing; proud; nothing; happens; veronica; betty; torturing; person; although; shot,-1
o89i1u,PeterWrightMGTOW,andrew; exeter; existential; take; view; woman; child; male; chivalry,,-1
o89eiq,benderXX,hygiene; argument,,-1
o897pt,shitherewegoagain9,legendary; game; designer; chris; avellone; end; silence; accusation; say; suing; accuser,,-1
o88s06,darkpsycho_,fair,,12043
o88rtj,BoggertheNogger,downvoted; saying; female; friend; make; sexist; toughts; discussion,,-1
o88ibp,Weirdmaster0,entry; postmodernism; brought; extremely; high; standard; female; first; world; country; third; world; country,,-1
o87rbq,Godmode_damage,court; system; custody; still; sexist,,-1
o86pur,straitothegrave,true; classic,,12044
o86cv7,SokratisJ,seen; grocery; store,,12045
o85wuo,TheAndredal,good,,-1
o85q7y,rdanders9466,lost; father; trailer; youtube; channel; disparate; divorced; father,,-1
o30png,NotSkinney,wish; people; could; react; joke; believe; like,imgur; xdpmfy,-1
o30nbn,[deleted],believe; joke; like,,12046
o2ynws,SubzeroPrunusPersica,bumble; took; photo; goggles; racing; speedo; getting; ready; start; swimming; race; offensive,,-1
o2yhgm,DouglasWallace,global; garbage,june; oddly; enough; global; garbage; checkiday; global; garbage; notable; global; garbage; person; everywhere; around; world; acknowledges; male; half; society; almost; exclusively; vital; clearing; rubbish; keeping; clean; relatively; healthy; since; covid; pandemic; garbage; stayed; work; putting; greater; risk; option; work; team; sometimes; close; proximity; knowingly; entered; health; risk; area; health; service; cheered; nation; getting; nasty; dangerous; often; poorly; paid; job; collecting; rubbish; work; vital; nation; health; wellbeing; january; published; figure; letsrecycle; news; latest; news; clarifies; covid; mortality; rate; refuse; worker; showing; death; rate; covid; woman; overall; comparable; rate; refuse; salvage; occupation; think; read; claim; independent; life; style; woman; childcare; lockdown; woman; bulk; report; html; woman; majority; childcare; lockdown; woman; violent; child; abuser; gain; sole; child; result; secret; family; court; stayed; work; keeping; water; electricity; going; installing; massive; amount; phone; line; getting; garbage; away; died; covid; feminist; admitting; hsph; harvard; news; feature; woman; dying; covid; occupational; exposure; significant; factor; think; read; mother; publication; paying; particularly; heavy; price; covid; fact; coming; worse; never; mind; much; deprivation; suffered; continue; suffer; take; great; deal; beat; dead; news; story; dying; coronavirus; woman; despite; closing; summer,-1
o2ydqe,Andrew_stack23,post,,12047
o2xo4k,chucklesomeDordoise,reposting; clarification; child; circumcision; illegal; ceremony; bris; celebrated; eight; life; without; circumcision; important; celebration,made; post; yesterday; clarify; meant; think; circumcision; child; disgusting; practice; however; ceremony; bris; still; important; practice; without; circumcision; refered; brit; shalom; getting; circumcised; mohel; adult; instead; bris; frowned; opon; still; important; piece; male; jewry; choice; adult; although; le; jewish; circumcised; share; thought; sorry,-1
o2xjav,pro_male_revolver,nothing; laugh; real; danger; every; destroyed,,-1
o2xchq,pro_male_revolver,nothing; laugh; real; danger; every; destroyed,,12048
o2wskp,andejoh,kildare; senator; call; domestic; abuse; shelter,,-1
o2wrno,No-Perspective5346,father; would; girlfriend; approval,,-1
o2wpnb,KamadoJonathan,happy; father; single; mom; sarcasm,,12049
o2woyn,Bl1tz99,biden; woman,,-1
o2wo0j,KamadoJonathan,happy; father; mom; sarcasm,,12050
o2w4ql,Blarty97,movie; violence; towards,noticing; plot; woman; deliberately; cast; strong; role; seems; fairly; contrived; prefer; movie; woman; strong; rather; role; sake; thing; woman; role; noticed; around; face; violence; torture; death; pretty; rare; woman; plot; face; fate; anyone; else; noticed,-1
o2uaaa,OH-Kelly-DOH-Kelly,patricia; evans; published; work; evidence; interrelationship; verbal; abuse; evidence; financial; abuse,abuse; outdated; court; ruler; ship; grifts; societal; standard; shame; provider; enable; self; proclaimed; sugar; baby; acceptable; case; home; maker; give; life; time; salary; home; care; worker; separated; state; say; job; kept; held; leave; entrepreneur; work; stallion; vulnerable; onlooking; appetite; without; choice; physically; male; topic; financial; abuse; brought; right; page; work; establish; healthy; financial; construct; reflect; caloric; neurological; investment; important; facet; wing; society; government; business; intel; military; agency; construct; reflect; though; categorized; household; leaving; vulnerable; grifted; different; pack; livestock; leaving; hardest; worker; vulnerable; wolf; abusing; outdated; societal; legal; system; financial; grifting; interpersonal; sexual; relation; make; financial; abuse,-1
o2ua6l,PoolOfAlpacas,really; want; person; advocacy; community; dont; know; start,name; adora; female; mra; brick; wall; advocacy; mainly; advocate; father; right; parental; alienation; men; right; ptsd; triggered; men; issue; tend; stick; father; right; side; wellbeing; online; advocacy; great; getting; censored; isnt; helping; cause; associated; tag; attention; deserve; call; attention; something; person; public; course; start; community; dont; know; start; call; attention; call; think; form; peaceful; protest; probably; alone; maybe; paranoid; afraid; thats; safety; risk; moght; hurt; protesting; would; people; join; eventually; hell; organizing; something; like; would; love; idea; advice; really; care; something; passion; want; contribute,-1
o2u1r4,Living-Reference5329,watch; news; pfft,,-1
o2tlsc,furchfur,mother; three; boasted; fostering; jailed; three; year,,-1
o2tehj,OADivorced,divorce; breadwinning; wife; shown,,-1
o2s978,z770i1,remember; watched; video; person; calling; many; abuse; shelter; could; male; victim; response; woman; assumed; abuser; victim; forgot; called; find; anymore,tried; many; place; seem; find,-1
o2s85d,Randall_Actual,mgtow; right,,-1
o2rdgu,je97,pandemic; showed; could; better; pitiful; paternity; leave; make; easy,,-1
o2r4ja,BestGuessGuest,sum; nicely,,-1
o2qqrn,External-Status4020,tried,right; movement; going; quite; decade; actually; accomplished; mostly; feminism; bashing; think; rooted; fact; powerless; much; else; actually; affect; change; without; crossing; line; violent; action; thing; could; collective; male; foot; immediately; chose; need; lobby; protest; wage; battle; superior; need; together; would; stop; tomorrow; hoped; metoo; fiasco; might; turning; point; wherein; wealthy; elitist; realized; nothing; gain; supporting; feminism; immune; still; live; country; charge; calling; feminist; though; understand; frustration; doubt; anything; gained; bashing; feminism; majority; woman; identify; feminist; aside; minority; feminist; real; power; motif; hatred; toward; vast; majority; clueless; drone; drank; kool; reasoned; majority; woman; identify; feminist; either; ignorant; plight; reason; care; blowing; steam; come; engage; violence; fellow; regain; control; society; woman; really; believe; ever; accomplish; anything; ongoing; power; struggle; cycle; giving; power; wielded; sorry; sound; hopeless; believe; many; lifetime; age; come; woman; achieve; anything; resembling; social; legal; equality; many; inherent; biological; difference; longer; relevant; capability; within; society; right; activism; peeing; wind; accomplishing; nothing; slightly; inconveniencing; society; hate; great; personal; cost; risk,-1
o2q4u2,Cerricola,course; something; said; woman; necessarily; truth; need; proved; trial,,-1
o2q282,Usual-Organization19,found; misandry; subreddit,,-1
o2q22l,camknight15,reddit; always; misandristic,curious; reddit; became; openly; misandristic; hostile; towards; social; issue; related; gender; allowed; platform; subreddit; social; issue; related; evil; tried; posting; fairly; innocuous; post; doublestandard; standard; society; immediately; banned; funny; part; posted; response; similar; post; evil; reinforced; doublestandard; standard; really; care; feminist; think; reason; serve; purpose; apply; anything; unnecessary; hostility; actually; make; want; empathize; feminist; reddit; helping; boring; sexism,-1
o2pvza,jorlynfame,looking; someone; talk; someone; want; somefun; moriellafame,,-1
o2peja,2close2home,celebrate; birth; parent,,-1
o2pbgf,Hey_itsmeguys,rebuttal; feminist; comic; social; constructivist; view; gender; hurt,,12051
o2pafa,[deleted],rebuttal; feminist; comic; social; constructivist; view; gender; hurt,,12052
o2owj2,Mister_historious,abuseisnotgendered,,12053
o2oqfy,Main-throwAway-7823,post; transgender; female; male; transgenders; welcome,,-1
o2oeix,pride4eva93,made; marijuana; arrest; though; woman; smoke; marijuana; nearly; equal; rate,stumbled; article; discussing; marijuana; arrest; minority; looked; data; true; however; completely; ignored; fact; arrest; know; racial; issue; justice; system; sexist; issue; towards; medium; refuse; talk; actual; stats; race; gender; site; nypd; stats; report; analysis; marijuana; page; site; nypd; stats; report; analysis; marijuana; page; article; discus; racial; aspect; post; gender; data; amny; news; people; color; made; marijuana; arrest; nypd; data; legal; say; amny; news; people; color; made; marijuana; arrest; nypd; data; legal; say,-1
o2odm7,Mister_historious,abuseisnotgendered,,12054
o2o4a5,dirtyredsweater,deal; victim; sexual; abuse,seems; resourceful; group; wanted; something; trouble; sexually; assaulted; child; used; nightmare; gone; flashback; harsh; inner; critic; startle; easily; talk; victim; sexual; assault; mother; would; deny; call; liar; tried; rest; family; tell; want; supportive; fall; little; flat; really; able; understand; effected; therapy; working; think; year; looking; something; help; experience; telling; someone; share; anything; helped; limit; lastly; tried; group; therapy; destabilizing; everytime; group; anxious; irritable; moody; day; began; dread; month; attending; decided; going; group; talk; hear; others; talk; story; causing; relive; went; without; much; benefit; jogging; helping; exercising; consistently; month; question; society; denies; problem; pretty; incapable; talking; person; like; given; mental; health; care; serious; else; better; feel; tearful; overwhelmed; random; time; close; panicking; others; consistently; inferior; others; reality; based; thinking; joining; martial; art; feel; control; powerful; idea,-1
o2nllw,[deleted],signed; petition; right; come; domestic; abuse; response; solely; woman,,12055
