post_id,author,title,body,image
o14qk4,duhhhh,oxfam; father,politicsofpoverty; oxfamamerica; father; raise; question; much; care; fatherhood; powerful; expression; mean; society; crucial; source; power; enables; decide; get; resource; control; body; deemed; important; word; basis; various; manifestation; patriarchy; story; lineage; religion; founding; father; selection; last; name; notion; patriotism; system; built; daily; patience; routine; home; school; workplace; cook; clean; recognized; work; deserves; paid; provides; care; division; responsibility; fall; binary; construction; woman; accidental; system; sustains; power; go; father; offer; unique; opportunity; reflection; finding; regain; humanity; engaging; domestic; work; care; work; need; hold; thing; together; strong; enough; change; find; care; path; redemption; patriarchy; remember; real; find; redemption; patriarchy; live; woman; unpaid; labor; household; withhold; sperm; gain; power; letting; woman; make; baby,-1
o14f8j,bufedad,college; dislike; disappearing; collegiate; male,,-1
o11pyz,BrokeMacMountain,sailor; emily; penn; plastic; pollution; woman; issue,,-1
o11fe2,l3m0n3225,still; many; victim; silent; rant,people; think; movement; like; metoo; assault; victim; speaking; sharing; story; sadly; small; portion; people; making; thing; others; pity; movement; selective; small; cance; actually; help; abused; feel; need; venting; happened; today; victim; every; subreddit; really; seem; social; medium; hashtag; nothing; stop; crime; live; near; school; walk; past; quite; often; following; girl; saying; real; disgusting; shit; girl; kept; walking; thing; called; bastard; passerby; could; help; something; chance; could; something; alone; pretty; slim; somebody; called; police; talked; passerby; pointed; anything; apparently; used; people; calling; help; happens; thought; knew; family; relative; talked; girl; scared; people; believe; would; make; really; sickening; happens; amongst; dude; since; whenever; showing; emotion; called; weak; masculine; enough; friend; harassed; woman; people; laughed; please; people; walking; look; oddly; silent; uncomfortable; observe; clear; sign; something; wrong; really; difference; carrying; pepper; spray; place; legal; would; come; handy; take; able; anybody; ever; leave; alone; matter; call; help; nothing; ashamed; especially; dude; told; keep; emotion; speak; always; least; person; willing; help; listen; know; hard; regret; earlier,-1
o11eti,BrokeMacMountain,guy; stop; comparing; size; fiddle; leaf; fig,,-1
o118aj,BrokeMacMountain,boris; talk; talk; promoting; woman; coronavirus; crisis,,-1
o112gk,BrokeMacMountain,perk; marrying; older; soon; disappear; woman,,-1
o10ywz,BrokeMacMountain,bafta; bottle; noel; clarke; scandal,,-1
o10tzq,BrokeMacMountain,misandrist; favour; female; world,,-1
o10mmo,Syndercut,hello; everyone; question; would; guy; girlfriend; wife; want; workout; health; stay; motivated; would; still; stay; leave,,-1
o10fj0,AspiringPlumber,female; secretary; clerk,anyone; ever; experienced; secretary; clerk; complete; noticed; many; occasion; woman; tend; mischievous; believe; part; direct; connection; important; people; nothing; tims; gossip; aith; people; worked; many; school; mainly; referring; principle; secretary; however; hospital; waiting; room; overheard; female; clerk; female; patient; talking; male; doctor; clerk; said; doctor; nice; keep; tone; voice; really; insinuated; message; keep; though; power; determind; whether; get; keep; woman; work; gossip; ruin; person; reputation; happened; past; anyone; else; noticed; power; hungry; power; trip; behavior; secrataries; front; desk; clerk,-1
o10a5b,justthinkofacoolname,speaking; broad; daylight; getting; hate,,-1
o100o3,[deleted],claimed; equality,,12126
o0zhzo,Opening-Umpire2075,,,-1
o0yss9,Xexos22,systemic; nothing; ever; change; opinion,genuine; discussion; thought; feel; like; venting; somehow; absolutely; thing; better; matter; much; complain; face; overwhelming; majority; people; care; general; unless; high; status; system; hate; keeping; elite; keep; thriving; throughout; history; always; used; lead; every; single; revolution; movement; except; feminism; every; system; whether; dictatorship; democracy; whatever; fell; hand; moment; system; started; getting; line; back; obliterated; either; living; system; outsider; seeing; chance; conquer; nation; moment; weakness; elite; prevent; happening; keep; living; safe; mode; weakening; every; single; turn; turn; woman; widen; gender; break; spirit; causing; feel; much; negativity; possible; numb; using; thing; like; porn; deny; help; mess; testosterone; shame; expressing; masculinity; shame; everything; whether; physical; mental; destroy; confidence; self; esteem; holding; impossible; standard; twist; ideology; belief; make; believe; always; fault; system; always; right; good; never; victim; unlike; woman; accomplish; generation; weak; miserable; depressed; fight; resist; anymore; focus; important; know; mean; masculine; take; responsibility; always; want; easy; basically; generation; never; threat; power; whatever; want; since; stand; anymore; think; nothing; change; fighting; impossible; beat; enemy; random; know; care; already; beyond; broken; never; stand; fight; resist; anymore; simply; doomed; pray; help; absolute; madness; unfortunate; generation; deal,-1
o0yrw9,[deleted],apparently; personality; trait; personality; trait; okay,,-1
o0ypwf,Communist_bitch172,guy; need; fucking; life; reactionary; shit; feminist,,-1
o0xufn,fgyoysgaxt,horrific; thing; seen; anesthesia; burning,,-1
o0x0tx,benjaminjsanders,feminist; decide; continue; hating; called; woman,,-1
o0wbp5,Reaper12543,patriarchy; paradox,,-1
o0vux5,mattxmortigan,arguing; woman; calling; dickhead; carry; weight; calling; cunt,,-1
o0u3gk,[deleted],mmmmm; love; process,,12127
o0s1fd,Adorable-Peanut,need; research; masculinity; class,trying; gather; research; regarding; everyday; struggle; would; mind; answering; question; would; greatly; appreciated; think; medium; movie; television; radio; represents; masculinity; show; emotion; representation; masculinity; medium; make; self; conscious; showing; emotion; think; representation; masculinity; medium; harmful; development; young; edited; change; post; survey; open; discussion; post; thank; response,-1
o0rm38,makibii,blocked; rant; went; almost; everyone; comment; except; agreed; post,,12128
o0rlwz,alexzyczia,victim; sexual; assault; rape; speak; experience; often; brushed,curious; woman; know; plenty; guy; raped; abused; growing; tell; relative; tell; lucky; really; piss,-1
o0rhrj,[deleted],creates; onlyfans; post; twitter; real; name; people; responded,,-1
o0qw4x,Nice_cock_6900,wikipedia; mod; like,,12129
o0qtwx,SmallStepsFirst,cutting; wiener; comment; still; tolerated; day,break; heart; wiener; ball; people; mean; joking; literally; threat; fine; something; get; said; something; wrong; pretty; much; something; always; hear; meet; friend; guess; people; flag; take; away; fact; thing; first; place; saying; already; indicates; suspicion; every; fuckboy; want; goal; break; heart; think; necessary; bring; reverse; role; think; everyone; agrees; comment; like; actually; okay; gender,-1
o0qd4g,Nice_cock_6900,idiot; entered; comment; section,,12130
o0pyfe,Long_Cut_7015,kenya; domestic; violence; push; boy; street; report; say; unlike; girl; fewer; organisation; fighting; boy; kenya; street; people; seven; male,,-1
o0prze,andejoh,woman; get; le; year; false; rape; claim; enforcement; avoids; calling; victim; victim; instead; refer; alledged; perpetrator,,-1
nqas92,JohnKimble111,woman; abuse; channel; documentary; shown; last; night,,-1
nqarvo,JohnKimble111,injury; domestic; abuse; hell; woman; abuse; mcnicholl; feature; story; channel; tonight,,-1
nqaod3,benderXX,getting; harder; respect; woman; fall; lie; covid; sexist; patriarchy; used; pandemic; unleashed; woman,,-1
nqaifb,benderXX,hard; feel; like; financial; resource; thing; matter; consistently; reinforced; society,,-1
nq9x14,Additional-Ad7809,tranny; need; real; friend,,-1
nq90q1,thirtysguy,everybody; brazil; follow; profile; please,,12131
nq8yhx,thirtysguy,everybody; brazil; follow; profile; please,,12132
nq8ure,WeaknessTechnical654,important; message; take; note,,-1
nq7btj,Dramatic_Ad_7684,stop; unethical; circumcision; nonsense,,-1
nq769h,Ok-Egg-7508,jojo; siwa; say; trying; kissing; scene; upcoming; movie,,-1
nq6yi5,Orzel36,funny; story; sister,recently; argument; claiming; commit; le; domestic; violence; claiming; woman; le; looked; first; article; wikipedia; said; female; male; experience; domestic; violence; however; pointed; said; woman; committed; domestic; violence; claimed; wikipedia; trustworthy; went; feminist; website; argument,-1
nq5wdu,DQSkymagne,corroboration; victimism; relation; metoo,,12133
nq4ivp,Carrotgreenbean,post; downvote; spread; word,,12134
nq4bdf,Pickled_love,would; take; date,,-1
nq3mwv,ImTheTrueFireStarter,rule; misogyny; answered; debunked,reddit; today; across; post; rule; misogyny; really; rule; myth; strawman; argument; designed; paint; misogynist; going; respond; woman; responsible; woman; responsible; life; destroyed; power; hungry; woman; always; assumed; fault; think; never; heard; saying; hate; crime; strawman; woman; speak; want; speaking; fault; everything; wrong; world; selfish; belief; never; said; ever; known; someone; said; strawman; life; worth; everyone; unalienable; right; however; feminism; equality; painting; misogynist; rapist; equality; think; feminine; want; care; think; someone; would; specifically; saying; grateful; everything; specific; something; woman; grateful; thing; grateful; think; woman; grateful; everything; really; cause; feminist; like; misogynistic; sexual; harasser; nothing; terrorize; woman; saying; woman; action; contradict; argument; strawman; know; vast; majority; argument; base; vast; majority; evidence; anecdotal; call; like; little; child; call; misogynist; talking; violence; anyone; horrible; strawman; actually; going; woman; always; assumed; victim; every; situation; people; always; piss; never; seem; realize; abused; discriminated; worse; happens; people; realize; often; forget; victim; strawman; woman; stating; male; fault; everything; wrong; world; stating; anyone; feminist; misandrist; exactly; mean; angry; talking; karen; kevins; cause; equally; insane; kind; people; strawman; woman; typically; privilege; feeling; privilege; actually; real; privilege; greater; chance; getting; college; lenient; sentence; equivalent; crime; register; selective; service; child; support; alimony; someone; point; assume; must; misogynist; never; said; many; time; think; body; body; body; body; unborn; baby; body; unborn; baby; body; reading; laughing; ridiculous; rule; felt; like; make; post; could; tell; hatred; emotion; oozing; every; word; forum; want; take; post,-1
nq35rh,PeonSupreme,acquitted; rape; baby; match; accuser,,-1
nq2zzu,costyksimpatic,mra; normally; feminism; ended,right; mean; take; right; woman; gained; last; decade; someone; telling; feminism; encourages; everyone; talk; feeling; need; private; sphere; amongst; plan; meeting; protest; right; attempt; several; place; feminist; trashed; meeting; protest; ended; talking; feminism; official; male; organization; distinct; movement; march; right,-1
nq2gep,Suic00n3,male; suicide; misogynistic,,-1
nq1n00,DraganTehPro,someone; sent; wonder; much; true; seems; exaggerated,,-1
nq1e2c,ElegantDecline,english; cover; classic; french; men; right; song,,-1
nq15s9,Randomly_Josh,johnny; suffered; severely; career; wise; amber; heard; claim; fair; treatment; role; film; retracted; amber; movie; flop; office; amber; allowed; feature; role; movie; justice; johnny; depp,,12135
nq0htl,tb151,found; metacritic; check; small; text; bottom; look; like; like; forced; change; name; built; america; made; chuckle,,-1
npzlt2,felafelsmoke,viewer; channel; tonight; woman; abuse,seen; scrolling; channel; apology; posted; already; tuning; prime; slot; hopefully; people,-1
npzegz,power_forward87,check; conclusion; jumped; straight,,-1
npzbei,michaelscott1776,right; woman; broke; automatically; allowed; ride; life; free; charge; never; expected; anything,,-1
npz28g,ElegantDecline,middle; aged; committed; suicide; seeking; professional; help; problem; life; including; seeing; mental; health; specialist; idea; suicidal; hiding; smile; face; snap; myth; amount; victim; blaming,,-1
npyoc0,sarahbird2001,join; mental; health; experience; feeling; lonely; depression; anxiety; bipolar; trauma,,-1
npy63r,zvcix,counting,,12136
npwg90,Mgnbr,brad; pitt; score; huge; victory; legal; battle; angelina; jolie; win; joint; custody; kid,,-1
npvdtk,coochscooch,seriously; think,,12137
npv9jg,tb151,browsing; metacritic; upcoming; show; premier; date; attention; amusement; small; print; bottom,,12138
npuo2m,Rottensaltytomato,mansplaining; dumb; concept,,-1
nptvj3,MemeMasterBill,people; stereotype; mras; incels,,-1
npszks,R-human,stand,subreddit; femaledatingstratpros; woman; actively; stomping; calling; bunch; pists; mysoginistic; piece; shit; le; value; post; painful; read; make; wonder; went; wrong; humanity; everyone; read; come; stand; effort; combat; abuse; getting; woman,-1
npsreb,HUZNAIN,happy; pride; month; right; advocate; activist; making,,12139
nps87i,alwaysrightusually,unbelievable,,12140
nprs40,furchfur,male; teacher; turn; skirt; across; spain; support; expelled; made; visit; psychologist; wearing; class,,-1
npnri2,Forbidden_Chocolate_,obviously; enemy,,12141
npnfjn,chocokillu,wish; could; back; time,need; back; woman; could; vote; stayed; belonged; repeatedly; beat; oppressed; since; society; gave; woman; ability; vote; work; school; tired; saddened; woman; thinking; deserve; gender; might; take; work; think; really; worth; trying; lobby; change; law; demise,-1
npn73l,shinbet,issac; butterfield; wreck; misandrist; government; domestic; violence,,-1
npmy0f,tamish123,started; understanding; pier; morgan,okay; clarify; early; age; south; eastern; country; heard; pier; morgan; always; conservative; person; recently; started; watching; video; agree; believe; fairly; amount; thing; argues; say; agree; everything; majority; chunk; view; seems; good; know; group; question; tell; hated; many; people; one; seem; leftist,-1
nplr0f,andejoh,naomi; osaka; get; lot; love; withdraws; french; open; introvert; find; press; sonferences; uncomfortable; male; athlete; uncomfortable; female; reporter; lock; room; little; support,unsure; stand; mental; health; concern; press; conference; public; speaking; often; time; scary; people; unsure; though; could; handle; differently; upset; male; athlete; voiced; similar; discomfort; female; reporter; locker; room; undressed; little; support; read; article; female; reporter; tell; public; female; reporter; locker; room; never; sparked; conversation; always; willing; accomodate; modesty; concern; never; male; athlete; sufficient; would; like; happen; never; spark; conversation; saying; wnba; locker; room; rule; evem; wnba; team; ownership; team; wnba; locker; room; open; anoubt; time; believe; minute; close; locker; room; closed; anoubt; time; believe; minute; open; reporter; able; walk; locker; room; hour; game; lokcer; room; open; open; hour; close; story; male; female; athlete; annoying; every; excuse; demmand; locker; room; want; immediate; reaction; deadline; want; build; relationship; player; need; hang; time; seem; apply; female; athlete; rule; men; locker; room; dailymail; news; article; martina; navratilova; say; naomi; osaka; tried; make; situation; better; worse; html; dailymail; news; article; martina; navratilova; say; naomi; osaka; tried; make; situation; better; worse; html,-1
npl1w4,FourFsOfLife,anyone; else; tired; stop; groin; strike; medium,posted; gather; posting; reason; whereas; entirely; serious; like; part; formula; movie; point; much; often; coming; tell; scene; created; purpose; tail; wagging; like; watch; show; movie; without; presented; humorous; sort; girl; moment; every; genre; every; reason; reason; little; girl; adult; recent; disney; film; cruella; stop; speaks; volume; feel; normalized; people; whereas; every; time; watched; movie; stomped; woman; vulva; boyfriend; grabbed; twisted; girlfriend; breast; agreed; saying; would; mind; blowingly; obvious; really; gross; vile; say,-1
npkh4a,twinkletoestherman,society; grows; great; plant; tree; whose; shade; know; shall; never,,-1
npkcsr,ExcrementConsumer,discovered; iconic; haired; feminist; chanty; binx; canadian; disappointed,,-1
npjk6v,JohnKimble111,wife; loses; fight; superyacht; divorce,,-1
npjhqc,JohnKimble111,woman; spin; doctor; first; conservative; woman,,-1
npiusf,mhandanna,gathering; resistance; stigmatisation; masculinity; excellent; article; great; men; issue; going; mainstream,,-1
nphgb2,ZimbaZumba,survival; woman,,-1
nph4q2,PerspectiveFew9205,intactivist; meeting; hour; pacific,intactivist; meeting; hour; pacific; tonight; send; massive; number; campaign; change; world; talk; looking; serious; intactivists; come; tonight; watch; downfall; human; child; genital; cutting; time; zoom; cgnkwvbzzkkxnm; xbmh; meeting; passcode; dial; location; jose; tacoma; houston; washington; chicago; york,-1
npgond,PeterWrightMGTOW,vernon; meigs; still; male; disposability; matter; much; thanked,,-1
npg9yg,Vince620,think; emmet; till; death; race; believe; woman; issue,think; guy; think; view; poll; reddit; poll,-1
npfz6w,matheuswolters,billboard; regarding; male; victim; receives; lot; attention,,-1
npfnmu,ShaidarHaran2,paul; tinari; eight; year; church; residential; school; montreal; paul; forcefully; held; desk; circumcised; priest; reason; believe; paul; forbid; masturbated,,-1
npfilq,HorrorBuffNut,planned,,-1
o48xmz,[deleted],today; google; doodle; recognized; father,,-1
o48oih,shadowguyver,maryland; failed; father,billboard; person; hugging; supposed; mother; phrasing; hero; cared; something; affect; still; seen; anything; celebrating; father; month,-1
o48nd1,Kumarsratan,talk; parenting; child; life; think; mother; using; kid; matrimonial; dispute; term; custody; stand; custody; child,,-1
o48hfs,jorlynfame,looking; someone; talk; someone; want; somefun; moriellafame,,-1
o48atd,benderXX,took; expensive; convertible; sport; mean; want; attention; talk,heard; line; successful; home; builder; know; loved; took; exotic; sport; car; collection; early; woman; come; right; pulled; store; telling; turn; front; seat; said; said; left; third; meltdown; calling; loser,-1
o489nl,narayanchandrakar,year; committed; sucide; fake; rape; allegation,manav; singh; year; gurugram; india; committed; suicide; accused; sexual; harassment; classmate; bhavleen; kaur; instagram; story; father; still; struggling; justice; youtu; ecriol,-1
o487bq,bailey_k_collins,spitting; strait; fact,,-1
o47ymk,SkadaBoofer,happy; father,happy; father; unappreciated; dad,-1
o47onv,callmejesus385,suspended; defending; self; female; classic; example; woman; privilege; depicted; villian,,-1
o47bfv,Hour-Mission7829,woman; view; sexual; object,,-1
o46xlv,DirtyPartyMan,experienced; attest,,-1
o45ya2,mr-logician,sentenced; jail; registered; offender; though; girl; victim; said; innocent; jail,,-1
o45y7e,JayeshSethi,pathetic,,-1
o45ibb,KKeshavR13,suspended; school; fighting; back; girl; bully,,-1
o45gm4,KKeshavR13,suspended; school; fighting; back; girl; bully; kept; hitting,,-1
o45aya,OwlMantheHeckler,happy; father,might; post; femenism,-1
o4552z,Nice_cock_6900,happy; father,,-1
o453il,_Senjogahara_,sure; acceptable; kinda; remote; main; topic; usually; shit; sub,never; younger; woman; never; experienced; teen; love; youth; relationship; introvert; socially; awkward; really; popular; among; woman; casual; relationship; started; recently; dating; woman; want; settle; smart; caring; lovely; however; feel; like; missing; part; dating; sexual; experience; know; rude; really; sorry; around; peak; woman; thing; start; slowly; decline; year; lose; best; year; life; hand; usually; dating; someone; younger; least; year; would; make; deference; least; year; least; would; affect; decision; kid; missing; worth; sacrifice,-1
o451h1,Toy_Soldier_Ken,father,reminder; today; today; father; step; helping; mother; alienate; kid; father; single; mother; alienating; kid; father; adopted; parent; court; battle; terminating; father; parental; right; based; best; interest; father; chose; day; wonder; took; woman; acted; knew; father; course; straight; neglectful; father; observation; many; chose; drama; drama; many; need; start; blaming; mother; idgaf; get; point; father; celebration; biological; father; replacement,-1
o44jvc,Specialist_Twist6726,masculinity,,-1
o44awd,callagkier,count; slogan; like; believe,first; time; sexually; harassed; woman; talk; taxi; driver; like; talk; customer; tonight; delivered; attractive; woman; home; intoxicated; refused; leave; accepted; invitation; come; inside; bump; ugli; uncomfortable; first; little; funny; serious; said; know; give; attempt; persuade; several; time; reached; forward; touched; shoulder; rubbed; tried; many; way; leave; home; drunk; knew; without; filter; interior; desire; attitude; held; true; subconsciously; alcohol; known; merely; reduce; inhibition; existing; character; trait; think; uncomfortable; part; listening; describe; exactly; going; inside; sexist; assumption; time; merely; animal; ready; service; hungry; woman; dime; asked; feminist; proudly; stated; role; reversed; doubt; official; complaint; would; made; police; employer; integrity; would; never; accept; offer; told; behaviour; line; moment; sexually; harassing; scoffed; told; fuxk; must; think; ugly; worthless; woman; experience; behaviour; routinely; believe; woman; support; slogan; believing; accuser; outright; put; person; defense; claim; position; prove; innocence; accepted; offer; would; great; risk; rape; complaint; sobered; regretted; action; fired; facing; criminal; complaint; previous; occasion; life; experienced; type; behaviour; woman; another; taxi; serious; involved; partner; deciding; jump; asleep; thought; dream; woke; felt; massively; violated; short; raped; took; police; told; away; case; said; said; could; prove; count; slogan; like; believe,-1
o43q1g,benderXX,came; court; void; ruling; sperm; donor; must; child; support; needed,,-1
o4387w,TheAndredal,gary; sinise; show; love; build; home; another; texas; veteran,,-1
o4345m,BicRunga,another; woman; get; away; murder,theduran; black; life; dont; matter,-1
o4263a,xsaintg,,,12142
o425za,Not_Dielor,dude; get; spat; asked; wrong; retaliating,,-1
o421yg,earlyseven09,egg; health; benefit,,-1
o41gv7,earlyseven09,watermelon; health; benefit,,-1
o413h3,Brian-Goldwin,inequality; school; activity; programme,niece; year; secondary; school; told; yesterday; construction; experience; school; offering; interested; construction; asked; signed; responded; apparently; offer; equal; opportunity; girl; construction; experience; programme; made; available; girl; considering; niece; school; offered; boy; work; experience; day; within; right; programme; unfair; provide; opportunity; everyone; want; girl; want; sign; boy; want; sign,-1
o3zxvp,MysticCatGoyl,woman; world; reality,,-1
o3zk21,[deleted],moderation,view; poll; reddit; poll,-1
o3zab1,HappyDragonBoy,attacked; simply; responding; sexist; post,want; look; people; talk; fact; person; replied; post; logical; answer; answer; people; downvoted; show; much; loser; sitting; behind; screen; ranting; honestly; exists; worst; made; post; experience; depression; sadness; speak; scroll; check; notice; people; talk; agreed; reply; response; agreed; comment; valuable; hate; repeat; sexist; hate; people; sitting; behind; screen; nothing; better; life; know; honestly; hope; people; feel; good; abotu; state; sexism; way; please; respond; regarding; post; downvote; reply; instead; remember; sub; like; reddit; continue; exist; preview; redd; taitevfc; width; format; auto; webp; preview; redd; vmkqlc; width; format; auto; webp; edadcce; preview; redd; width; format; auto; webp; type; mental; search; pop; thousand; post; posted; everyday; preview; redd; bnqliumb; width; format; auto; webp; bdadcf,-1
o3ybps,my-blood,calling; virgin; different; slut; shaming; woman,somehow; whatever; happiness; make; virgin; playing; video; game; virgin; buying; customising; virgin; post; cringetopia; today; called; virgin; cool; decal; wallstreetbets; thing; collecting; figurine; comic; virgin; feminist; slut; shaming; woman; calling; virgin,-1
o3xgrh,JooRooTv,happy,,-1
o3vmc7,Psychonaut2163,doublestandard; standard,,-1
o3sm4w,Based_Hootless,appropriate; analyzing; thing; like; experience; mgtow; sub; care; woman; care; suffering; like; know; posting; counterproductive,,-1
o3sfg5,pride4eva93,culture; make; first; move; hurt; immsensely,,-1
o3sdzk,JooRooTv,happy; father,,-1
o3sbvk,earlyseven09,erectile; dysfunction,,-1
o3rsnm,PeonSupreme,business; owner; say; someone; falsely; accusing; pedophilia,,-1
o3rqyc,PeonSupreme,arrested; extortion; attempt,,-1
o3rp9p,PeonSupreme,actor; push; metoo; dialogue; crusade; reform; family,,-1
o3rbql,uraverageuserornah,looking; someone; skimpy; clothes; make; perv,,-1
o3qxw4,furchfur,labour; party; tell; buckland; convicted; rape; leave; labour; party; mainly; female; detests; male,,-1
o3qxf0,benderXX,actually; community; live; visit; reporting; crime; experience,,-1
o3qvwc,person_w_personality,response; mra; calling; discus; right; left; leaning; liberal; feminist; like; seder; host; majority; report; default; tradcon; like; appeal; biology; narrative; power; woman; deserve; give; birth; child,,-1
o3quax,[deleted],seder; host; majority; report; default; tradcon; like; appeal; biology; narrative; power; mra; try; discus; right; issue,,-1
