post_id,author,title,body,image
o0e9xb,Ok_Designer_Things,look,support; current; system; place; support; toxic; place; mental; health; moment; could; worse; know; real; problem; cause; change; guy; support; beyond; tired; feeling; like; talk; like; matter; responds; like; first; time; ever; happened; playing; popular; online; game; chat; space; people; server; read; literally; asking; support; message; mean; support; matter; matter; everything; wish; people; told; said; asking; help; good; minute; messaged; needed; someone; talk; wife; multiple; kid; hard; lately; damnit; adding; talk; family; without; appearing; weak; causing; worry; thing; nothing; phrase; another; life; little; rough; moment; everyone; around; made; pain; comment; relationship; gave; discord; gave; email; gave; battlenet; account; literally; message; call; anytime; need; fellow; lady; reading; maybe; consider; outside; force; influencing; emotion; sometimes; listening; enough; asking; talking; good; guy; beautiful; amazing; smart; loved; love; damn; much; deserve; hear; know; entire; better; fucking; love; dude; three; wait; sitting; amazing; look; back; silly; thing; grand; scheme; diminishing; trial; tribulation; case; wife; kid; sure; cause; form; pride; happiness; fulfillment; happiness; guy; know; okay; struggle; sometimes; know; someone; fucking; message; need; talk; dude; immediately; damn; sure; care; going; listen; need; tell; matter; good; luck,-1
o0e21k,LafontaineX,misandry; androphobia,term; think; best; represents; discrimination; know; misandry; common; term; many; people; meet; neither; know; mean; guess; asked; guess; something; anger; hatred; young; woman,-1
o0d97j,borgorop,common; sexually; harassed; drunk; woman,friend; went; last; week; covid; lockdown; ended; country; packed; first; enjoyed; atmosphere; whenever; went; stand; fetch; drink; woman; would; slap; escalated; drunk; woman; tongue; throat; woman; friend; including; male; one; laughed; imagine; gender; reversed; people; would; find; trivial,-1
o0cu8l,[deleted],name; greg,,-1
o0ca4h,TheCraftyCatBlogger,post; gender; stereotyping,,-1
o0c1bf,[deleted],make; sound; like; vietnam; veteran; asked; jesus; christ; pathetic; really; triggered; everything,,-1
o0b9x3,thejobash,askmen; subreddit,,-1
o0agep,BloodyUserOfNames,malaysian; singaporean; subreddit,want; start; group; malaysia; need; help; malaysian; singaporean; subreddit,-1
o09z2t,FinallyReborn,circumcision; fraud,circumcision; longer; widely; practiced; accepted; much; world; united; state; notable; exception; doctor; still; promote; circumcision; normal; medical; surgery; however; attitude; circumcision; quickly; changing; november; major; paper; published; prominent; legal; scholar; cornell; journal; public; policy; simple; title; circumcision; fraud; paper; lay; detail; circumcision; violation; medical; ethic; unlawful; fraudulent; current; scale; fraud; potentially; vast; possibly; ten; hundred; billion; dollar; enormous; implication; doctor; hospital; patient; american; society; five; take; note; paper; greater; paint; circumcision; epidemic; lawschool; cornell; research; jlpp; upload; adler; final; lawschool; cornell; research; jlpp; upload; adler; final; circumcision; impossible; justify; medical; ground; view; widely; accepted; within; international; medical; community; doctor; present; circumcision; normal; routine; procedure; reality; circumcision; harmful; unnecessary; irreversible; surgery; remove; important; healthy; tissue; never; replaced; international; medical; authority; spoken; circumcision; unethical; unlawful; violates; doctor; hippocratic; oath; harm; reason; circumcision; impossible; justify; normal; routine; circumcision; violates; child; right; bodily; integrity; cherished; american; ideal; citizen; right; life; liberty; pursuit; happiness; supreme; court; ruled; right; carefully; guarded; right; every; individual; free; safe; harm; parent; however; right; consent; unnecessary; surgery; example; baby; finger; want; doctor; conduct; unnecessary; surgery; hippocratic; oath; harm; therapeutic; circumcision; constitutes; criminal; assault; battery; simple; term; circumcision; violence; medicine; surgery; performed; child; without; informed; legal; consent; considered; assault; battery; child; abuse; internationally; circumcision; viewed; child; violence; medicine; united; nation; partner; council; violence; child; stated; circumcision; gross; violation; child; right; doctor; routinely; withhold; critical; information; regarding; circumcision; breach; trust; violation; medical; ethic; performing; surgery; doctor; must; always; obtain; informed; consent; patient; parent; obtain; consent; doctor; must; fully; inform; patient; parent; surgery; risk; complication; circumcision; list; least; possible; complication; routinely; withholding; critical; information; doctor; breach; duty; fully; inform; patient; tell; truth; illegal; unethical; american; academy; pediatrics; knowingly; misrepresented; risk; complication; circumcision; fraud; parent; deceived; routinely; performing; surgery; meaningful; childhood; benefit; carry; significant; risk; lifetime; harm; internationally; medical; rule; never; operate; unnecessarily; healthy; child; know; still; position; circumcision; normal; beneficial; procedure; doctor; reimbursed; procedure; insurance; company; taxpayer; medicaid; insurance; company; least; third; circumcision; circumcision; recognized; unnecessary; surgery; stakeholder; member; would; impacted; significant; decline; revenue; know; circumcision; harmful; unnecessary; continue; endorse; publicly; doctor; continue; profit; wrong; illegal,-1
o089lc,[deleted],committed; suicide; false; allegation; peer; pressure; accuser; ensured; freedom; consequence; action; justice; denied; person; forgotten,,-1
o06hfz,ChardMean8320,come; hello,,-1
o062ws,raw_bro,anyone; research; link; woman; getting; health; research; funding; worldwide; need; argument; thanks,,-1
o04pfe,Spylassy05,raise; child; disrespect; people; instead; attributing; trait; mail; gender,,-1
o041r0,Ashamed-Sandwich9166,hate; people; make; issue; like; domestic; violence; rape; assault; gender; issue,reality; perpetrator; everyone; else; issue; instead; woman,-1
o03rih,No-Inspector-829,joined; day; might; allowed; sub; post; comment,,-1
o03o5g,Egalitarianwhistle,teenage; elephant; need; father; figure; earth,,-1
o03b6m,sonja_hastings,woman; caught; video; hitting; frame; husband,woman; caught; video; repeatedly; punching; face; familylawexpress; family; express; medium; aiovg; video; woman; hit; frame; husband; domestic; violence; current; affair; australia; alleging; husband; bashed; caught; punching; face; alleging; husband; bashed; preview; redd; jjff; width; format; auto; webp,-1
o037pu,PeonSupreme,proposed; rape; law; botswana; criminalise; false; allegation,,-1
o018ra,RobertWargames,state; alot,,11965
o0152m,RobertWargames,screenshot; youtu; jqdwzyx,,11966
o00fe8,FerdinandvonAegir124,sister; make; deeply; uncomfortable,sister; sometimes; get; close; slap; matter; many; time; tell; stop; anyway; time; mother; told; inappropriate; really; care; sister; said; completely; untrue; make; really; uncomfortable; advice; deeply; appreciated,-1
nzzyjf,benderXX,dear; exhausted; reddit; great,,-1
nzz9i8,BenGFHC,really; hope; fake,,11967
nzz9g2,frednoname1,abused; year,,-1
nzyte6,[deleted],newstatesman; politics; feminism; four; mra; right; activist; myth; busted,,-1
nzxzu5,goodmod,went; hero; year; dy; saving; sister; sioux; river,,-1
nzxfoi,John-Walker-1186,actually; used; shame; tactic,,-1
nzx6ep,John-Walker-1186,pretty; much; prohibits; participation; anyone; resides; sphere,,-1
nzwl72,[deleted],education,,-1
nzwfno,[deleted],people; biased; hitting; girl; instead; thinking; complete; self; defense; society; live; today; gentleman; repost; maybe,,-1
nzvxpc,hunglikewatchbattery,hire; paralegal; handle; divorce; discovers; still; married,,-1
nzveci,beginningofheaven,cabergoline; premature; ejaculation; animalization,hate; premature; ejaculation; joke; source; shame; woman; mock; counterproductively; mock; cure; refractory; period; cure; make; problem; literally; cabergoline; patch; jersey; bloomfield; drug; improve; life; expensive; tailored; point; take; care; heart; problem; dosage; irresponsibly; recommeding; medicine; though; post; menslib; yeah; sure; defending; cause; benefit; shape; form; include; woman; solution; refined; people; care; though; could; improve; life; sex; make; le; nervous; hold; pleasure; please; girl; instead; society; prefers; accept; tacky; propaganda; gel; make; last; longer; force; endure; disciplinary; kegels; enforce; stupid; piss; competition; last; longer; feel; unlovable; pledge; crumble; civility; woman; catered; human; deserve; detach; nature; dehumanizing; cure; period; childbirth; sure; work; cure; refractory; period; actually; already; exists; actually; started; priority; world; government; enough; leverage; resource; invest; research; sex; equally; matter; worse; childbirth; equality; equity; priority; antitheical; concept; fucking; hate; shit; world; living; among; idiot; hell; living; among; people; idly; accept; atrocity; judgement; ignorance; hell; took; upon; develop; refined; version; cabergoline; tailored; lifetime,-1
nzv3rk,shit-zen-giggles,face; former; dean; student; rethink; sexual; assault; response,,-1
nzv2lf,Spylassy05,holy; entitlement,,11968
nzuj9h,Tokkeloss,isnt; confusing,,11969
nzu28q,[deleted],starting; give,,-1
nzthjb,TrumpTruther,dump; penny; wife; lawn; final; child; support; payment,ctvnews; video; clipid; jwsource; news; turned; attack; rather; liberation; still; applaud,-1
nzszno,Randall_Actual,rule,,-1
nzrml9,vzakharov,ape; face,,-1
nzrj9g,biscuitlord6969,girl; gamers; get; pissed,,-1
nzr6zh,[deleted],perm; banned; offmychest,,-1
nzqwgo,jorlynfame,looking; someone; talk; someone; want; somefun; moriellafame,,-1
nzqm0w,[deleted],female; victim; culture; finest; comment; exposing; fault; responded; shut; society; really; getting; dumber,,-1
nzpyip,person_redditting,feel; divert; attention; legal; issue; example,birth; control; already; discussion; people; using; deception; involving; birth; control; phys; class; discussion; birth; control; abortion; think; great; thing; except; warned; male; poking; hole; removing; condom; lying; vasectomy; thing; without; telling; partner; know; talk; woman; lying; pill; surprised; clip; people; encouraging; woman; trick; partner; want; child; woman; right; choose; like; wtaf; noc; care; woman; scream; bloody; rape; feminist; lurking; consent; consent; given; influence; therefore; legally; rape; charged; able; case; know; said; feminist; know; feminist; agree; wanted; acknowledge; post; meant; attack; argument; feminism; support; included; feminist; argued; often; disagree; turn; fight; gender; worse; punishment; want; social; discussion; brought; punishment; introduced; feel; free; drop; opinion; article; comment; check; article; insane; entitled; people; think; child; regardless; action; woman; reveal; shamelessly; lied; birth; control; whisper; whisper; story; bacd; woman; reveal; shamelessly; lied; birth; control,-1
nzpvlf,sokra3,testimonial; tend; heavily; towards; harassment,,-1
nzorlx,freedompact,aaaron; marino; youtube; alpha; confidence; charisma; happiness,,-1
nzogya,[deleted],retirement; topic; talk; enough; opinion,,11970
nzo1pa,[deleted],dose; everyday; misandry; ocean; upvotes,,11971
nznz6t,RekWriter,father; gorilla; steal; baby; gorilla; mother; play,,-1
nzni4q,Hour-Mission7829,study; show; domestic; violence; woman; condemned; illegal; back; hated; people; earth; whereas; domestic; violence; tolerated; back; idea; condemned; myth,columbia; site; default; file; microsites; culture; file; file; katz; workshop; paper; columbia; site; default; file; microsites; culture; file; file; katz; workshop; paper; scholarship; viewcontent; article; context; wmjowl; httpsredir; referer; scholarship; viewcontent; article; context; wmjowl; httpsredir; referer; many; people; including; historian; believe; myth; domestic; violence; tolerated; police; nothing; research; paper; debunk; myth; showing; overwhelmingly; large; amount; evidence; opposite; true; people; took; domestic; violence; seriously; nowadays; back; however; word; domestic; violence; commonly; used; instead; people; said; wife; beating; wife; beater; people; back; advocated; whipping; post; wife; beater; people; wanted; killed; beat; wife; imagine; chris; brown; beat; rihanna; back; couple; state; maryland; delware; oregon; whipping; post; public; opinion; approved; murder; vigilantism; whipping; post; wife; beater; vigilantism; happened; every; rare; nowadays; telling; someone; back; wifebeater; like; telling; someone; today; child; molester; guess; woman; beat; husband; relatively; tolerated; although; many; people; hated; woman; beat; husband; many; people; care; woman; beat; husband; used; popular; culture; humor; related; purpose; people; made; joke; judge; lenient; woman; beat; husband; judge; outright; praising; quote; striking; judge; condoned; wife; physical; punishment; found; husband; drunk; judge; declared; open; court; wife; official; permission; beat; husband; weapon; chooses; come; home; drunk; late; night; similar; type; case; young; pretty; wife; explained; judge; kansa; given; husband; severe; beating; broken; rule; must; home; night; good; woman; judge; told; wife; want; compliment; taking; hand; ought; woman; like; judge; discharged; immediately; agreed; discharge; husband; promised; return; home; wife; curfew; outside; courtroom; similar; understanding; seems; existed; news; brief; paper; summarized; indiana; woman; medal; beating; husband; admittedly; best; world; american; husband; evidently; need; toning; occasionally; legislator; debating; appropriate; punishment; band; beating; jersey; thought; would; splendid; thing; woman; willing; able; chastise; worthless; husband; properly; whose; husky; wife; sent; count; ambulance; surgeon; attacking; sleep; reported; acknowledging; appropriate; ness; wife; assault; told; police; guess; right; surprised; using; stove; lifter; male; victim; domestic; violence; never; taken; seriously; judge; harshly; condemned; male; perpetrator; sentencing; fine; prison; whipping; post; failing; conform; appropriate; husbandly; behavior; rewarding; wife; exhibited; traditional; female; trait; vulnerability; dependence; based; gendered; reasoning; judge; trivialized; ridiculed; victim; husband; beating; sought; protection; physically; abusive; wife; deemed; unmanly; undeserving; legal; remedy; afforded; woman; male; victim; often; seen; weak; unmanly; victimized; woman; mocked; ridiculed; stigmatized; overlooked; although; small; attacked; bigger; wife; still; received; ridicule; lack; sympathy; attacked; smaller; wife; ridiculed; many; newspaper; would; point; physical; disparity; emphasize; refusing; point; physical; disparity; husband; beat; wife; many; time; woman; beat; husband; crowd; would; amused; would; watch; observe; applaud; instead; intervening; people; knew; husband; beating; wife; either; reported; arrested; become; victim; vigilante; attacked; killed; although; battered; woman; shelter; exist; early; people; still; took; domestic; violence; woman; serious; century; nowadays; male; victim; domestic; violence; stigmatized; difficult; today; worse; back; judge; lenient; towards; woman; beat; husband; woman; beat; husband; never; whipping; post; attacked; vigilante; judge; could; beat; wife; without; severe; injury; people; back; already; wanted; dead; imagine; chris; brown; beat; rihanna; back,-1
nzn8z5,mhandanna,long; portrayed; father; bumbling; idiot; especially; sitcom; changing; little; need; called; creator; advert; know; social; medium; happening; mras; become; much; active; online,,-1
nzmnu4,StandardUsernam3,female; dating; strategy; troll; subreddit,,-1
nzlvee,Nice_cock_6900,strong; independent; woman; found,,-1
nzl8du,Kagedeah,taxi; driver; accused; saying; body; head; leg; boot; sexually; assaulting; passenger; cleared; jury,,-1
nzl5xi,JooRooTv,happy; father; message; wish; make; smile,,-1
nzkq6w,UltimaterializerX,good; link; wondering; full; laughably; bitter; woman; actually; dating; look; reddit; overlap; make; sense,,-1
nzkpdg,BaconCatBug,suicide; attempt; teen; girl; spiked; covid; pandemic; spike; successful; suicide; teen; boy; unimportant,,-1
nzjgs3,RelativeBirdz,critical; view; medium; attack,watch; match; sport; result; given; medium; major; world; event; every; time; hesitate; woman; better; woman; category; prize; course; opposite; never; said; irrelevant; woman; compete; woman; woman; level; systematically; lower; irrelevant; totally; wrong; real; medium; permanently; subject; whole; technique; language; used; advance; ideology; hate; subject; permanently; woman; presented; medium; superior; example; report; police; army; simply; interview; woman; extremely; large; share; speaking; time; exclusive; camera; follows; time; whereas; area; especially; army; represent; extreme; majority; wonder; invite; woman; purpose; appear; image; look; background; woman; monopolizes; speaking; time; camera; time; real; intention; manipulate; ideological; purpose; extremely; unhealthy; cause; bias; favor; woman; opinion; would; like; attention; language; technique; used; critical; time; important; notice; point; around; order; deconstruct; medium; propaganda; fundamental; necessary; aspect; fight,-1
nzjfvu,Long_Cut_7015,prison; heat; john; oliver; explains; failure; condition; prison; cause; physical; mental; health; issue; incarcerated; people,,-1
nzj9pq,Jarita75,girl; squeeze; guy; genitals,,-1
nzj0h2,mikesteane,trans; people; binary,,-1
nzivl2,FlatTire2005,impossible; want; protect; daughter; pedophile; point; committing; murder; stop,,11972
nzijmd,OrganizationNo3213,country; homocides; male; victim,,-1
nzi47t,MekelLane,lady; first,,-1
nzi2kq,MekelLane,lady; first,,11973
nzi13o,MekelLane,lady; first,,11974
nzi0rb,Sage010101,post; woman; paid; work,,-1
nzhu1f,Savinit,winning; move; play,forgive; seems; fully; appreciating; brushing; sexual; aspect; mra; year; quite; publicly; twitter; around; probably; seen; tweet; might; spoken; large; following; neither; confirm; deny; acknowledge; guess; come; time; time; people; posting; thing; like; convince; feminist; motivation; need; understand; people; interested; good; faith; dialouge; wasting; time; come; convincing; onlooker; people; already; picked; side; come; aspect; culture; time; better; spent; focused; happiness; probably; easier; loner; introvert; tendency; aside; mother; daughter; female; supporter; need; emotional; distance; woman; whole; general; care; value; neither; society; article; seeing; whining; marrying; engaging; society; otherwise; performing; spec; feminism; wrought; mass; live; life; satisfy; people; look; jumping; hoop; take; hvm; value; estimation; already; shown; hand; nothing; malice; anyway; play; game; today; woman; miserable; fruit; modern; feminism; despite; rhetoric; around; useless; feminist; movement; society; whole; could; destroyed; overnight; suddenly; stopped; working; critical; job; woman; unwilling; keep; modern; world; running; focus; practice; stoicism; leave; world; fall; apart; maybe; need; happen,-1
nzgni7,[deleted],,,11975
nzgcbx,Anoth3rDude,religion; helpful; harmful,worth; holding; left; behind; good,-1
nzfdgx,NotReallyFunny28,need; genuine; help; acquainted; scared,friend; year; good; friendship; since; relationship; mentally; supporting; talk; much; bond; much; still; friend; recently; messaging; venting; problem; turned; extremely; suicidal; tried; best; though; reply; chat; online; male; friend; considering; play; unusual; instance; messaged; inviting; play; since; borrow; roommate; game; heard; faint; female; voice; thought; audio; wack; apparently; receiving; friend; request; getting; message; figured; roommate; weird; instance; apparently; took; getting; kicked; house; call; unusual; since; told; couple; month; went; relationship; month; broke; want; question; generosity; since; know; someone; need; thing; told; hurt; physically; game; went; messaged; need; tend; wound; match; game; explained; situation; boyfriend; help; sent; picture; bleeding; apparently; hurt; knife; scratched; talked; friend; kinda; skeptical; telling; truth; everything; happened; last; night; early; today; came; back; message; threatened; thing; friend; insisted; mistress; flirt; stay; away; friend; tried; reasoning; case; case; friend; physically; assaulted; highly; concerned; saved; conversation; proof; evidence; suggesting; harm; threatened; clue; appropriate; thing; fear; death; fear; going; cop; telling; parent; personal; issue; discus; post; thing; inform; friend; hesitate; harm; kill; informed; proof; evidence; assaulted; knife; sent; death; threat; someone; please; help; reasonable; perspective; tldr; want; succumb; toxic; mindset; sound; delusional; assumption; friend; barely; talk; barely; hindrance; relationship; claim; living; together; friend; said; still; boyfriend; see; constantly; presence; threat; anyone; friend; fearful; life; friend; stand; right; know; want; protect; friend; anyone; dealt; crazy,-1
ob6z5c,QueenOfMetals,smallville; actress; allison; mack; sentenced; year; prison; nxivm; case; related; involvement; trafficking; ring,,-1
ob5ym1,blonko4309,society; need; stop; letting; little; boy; play; doll; negatively; impact; life; society; whole,someone; said; playing; doll; negatively; impact; useful; masculine; trait; allowed; like; like; forcing; differently; change; feel; quoting; lastrounder; excellent; arguement; statement; society; learn; childish; game; educational; activity; like; game; mammal; complex; hedgehog; play; learn; learn; adulthood; playing; doll; affect; masculine; trait; like; boy; supposed; play; doll; imperative; accepted; society; le; known; child; laugh; child; maintaining; strict; censorship; policy; behavior; sect; regime; would; ever; able; get; laight; shurely; affect; self; esteem; communication; skill; society; wich; life; changing; thing; allowed; like; like; forcing; differently; change; feel; yeap; allowed; play; matchstick; burn; change; feel; sorry; quite; drastically; child; mocking; sissy; play; doll; childish; mind; still; quite; probe; influenced; switch; boy; toy; still; want; play; doll; inner; spectrum; something; like; life; full; problem; case; unenvitable; anyway,-1
ob5y90,ElegantDecline,soft; white; underbelly; interview; jeremy; falsely; accused; adult; movie; legend; expect; fully; exonerated,,-1
ob5y4x,MRA-Sid,bill; cosby; free; pennsylvania; supreme; court; overturn; conviction,,-1
ob5xh3,blonko4309,society; need; stop; letting; boy; play; doll; negatively; impact; life; society,someone; said; playing; doll; negatively; impact; useful; masculine; trait; allowed; like; like; forcing; differently; change; feel; quoting; lastrounder; excellent; arguement; statement; childish; game; educational; activity; like; game; mammal; complex; hedgehog; play; learn; learn; adulthood; playing; doll; affect; masculine; trait; like; boy; supposed; play; doll; imperative; accepted; society; le; known; child; laugh; child; maintaining; strict; censorship; policy; behavior; sect; regime; would; ever; able; get; laight; shurely; affect; self; esteem; communication; skill; society; wich; life; changing; thing; allowed; like; like; forcing; differently; change; feel; yeap; allowed; play; matchstick; burn; change; feel; sorry; quite; drastically; child; mocking; sissy; play; doll; childish; mind; still; quite; probe; influenced; switch; boy; toy; still; want; play; doll; inner; spectrum; something; like; life; full; problem; case; unenvitable; anyway,-1
ob5qx7,coolpineapple8,frustrated; right; movement; protrayed; initiative; equality; systematically; ignoring; issue; discussion,,-1
ob4kt4,Xx24reminder,come; different; term; adress; different; type; feminist,getting; annoyed; lack; gatekeeping; feminist; need; separate; term; feminist; twitter; echo; chamber; degenerate,-1
ob4hl6,TigPlaze,bill; cosby; released; prison; conviction; thrown,screaming; fight; social; medium; commence; nbcnews; news; news; bill; cosby; released; sexual; assault; conviction; overturned; pennsylvania; nbcnews; news; news; bill; cosby; released; sexual; assault; conviction; overturned; pennsylvania; thing; find; disturbing; many; people; consider; possibility; might; innocent; clear; saying; know; fact; innocent; saying; people; consider; possibility; might; without; jumping; conclusion; throw; conviction; good; reason; trial; unfair; evidence; question; asked; people; guarantee; someone; label; misogynist; simply; question; possibility; conviction; improper; might; done; like; asking; proper; thing; saying; bill; cosby; raped; bunch; woman; good; thing; system; justice; safeguard; avoid; convicting; innocent; right; must; uncomfortable; question; people; simply; unwilling,-1
ob4e7h,3rdTab,date; simultaneously; podcast; topic; femaledatingstrategy,,-1
ob3wpa,Banake,rethinking; masculinity; right; wrong,,-1
