post_id,author,title,body,image
nw79go,No-Perspective5346,accuracy; make; sadder,,11884
nw67es,Pearl4202,people; audacity; rant,,-1
nw5ekt,spartan_bubble,called; true; ditching; done; something; like; might; probably; behind; bar; source; pinterest,,11885
nw50bc,WestwardAlien,article; trying; people; participate; pride; straight; white; male,,-1
nw3xn8,HorrorFan1191,anyone; interested; short; horror; fiction; story; right; written,leave; comment; send; chat; message; link; possible; dark; future; feminism; get; hand,-1
nw3mfp,Oncefa2,inherent; bias; positivity; message,graphic; posted; malementalhealth; back; comment; thinking; self; soothing; contains; idea; help; relax; reddit; malementalhealth; comment; nhcp; selfsoothing; idea; feminine; definitely; lack; quite; thing; might; little; appealing; towards; someone; added; list; example; building; puzzle; solving; gaming; fishing; hunting; exercise; shooting; brawling; trekking; grand; scheme; thing; think; issue; discrimination; anything; think; pattern; self; help; positivity; stuff; seems; geared; towards; woman; wonder; seem; alienated; involved; mental; health; consider; stuff; like; usually; miss; mark; tend; attack; victim; blame; seeking; help; going; therapy; example; calling; toxic; think; start; make; sense; fewer; interested; involved; mental; health; woman; said; think; seen; progress; acceptance; towards; masculine; interpretation; mental; health; recently; standalonemen; pretty; good; example; certain; point; need; celebrate; stoic; rough; tumble; nature; think; need; reappropriate; harmful; messaging; society; view; quality; negative,-1
nw3mam,JohnKimble111,student; cleared; investigated; saying; woman; vagina,,-1
nw2glb,John-Walker-1186,beat; virus; fast; beaten; patriarchy,,-1
nw2fee,Living-Reference5329,cursed; rape,,11886
nw2etb,Living-Reference5329,,,11887
nw1uxy,rebirth_of_PM,yikes; feminist; want; woman; right; rape; le; legal; protection; rape; would; enable; harass; woman; eye,,11888
nw0mkr,Adventurous-Comb7707,question,,-1
nw0b78,Adventurous-Comb7707,rape; joke,,-1
nw07ja,Adventurous-Comb7707,feminism; destroying; modern; society,,-1
nvyq3w,craftychap,baby; sexually; abused; golf; course,,-1
nvycdg,the_counselors_guild,youtu; pftm,,-1
nvwx9c,phantom_shitposter,domestic; violence; cool; done; woman; female; meme; subreddit,,-1
nvwpxm,Dede_Efendi,fair,,-1
nvwnpj,phantom_shitposter,domestic; violence; cool; done; woman,,11889
nvwmsv,Hey_itsmeguys,patriarchy; theory; demonstrably; false; inherently; anti; male; kind; personal; manifesto; hope; make; good; case; guy; think,,-1
nvvt6q,PeonSupreme,seven; month; terror; experience; falsely; accused; sexual; misconduct; statistic,,-1
nvvefc,chalusova,teacher; talked; sexual; harassment; internet; today; turned; sexist,today; basically; talk; teacher; kinda; sexist; make; clear; female; today; school; talked; sexual; harassment; happened; internet; sending; nude; famous; document; country; basically; three; actress; already; adult; younger; feature; made; fake; profile; social; medias; predator; starting; harassing; immediatly; blackmailed; jacked; video; call; thing; make; clear; director; wanted; include; male; actor; find; could; really; look; young; casting; teacher; showed; clip; talked; problem; said; thing; like; every; woman; gone; thing; small; percent; deal; woman; usually; feel; need; thing; every; woman; somehow; harrassed; thing; like; boy; talked; disrespectful; rude; literally; yelled; something; like; youre; interrupting; one; thing; something; like; almost; word; victim; said; girl; instead; talk; female; predator; someone; harassed; woman; made; post; reddit; mensrights; comment; hate; society; kinda; ignores; female; medium; android; source; share; made; really; upset; felt; really; sorry; male; friend; cause; really; respectful; treat; really; nicely; feel; comfortable; talking; female; problem; getting; basically; scolded; like; make; knowing; doublestandard; standard; exists; dunno; kinda; wanted; share; made; sorry; english,-1
nvur11,jorlynfame,looking; someone; talk; someone; want; somefun; moriellafame,,-1
nvtyx2,PeonSupreme,movement; hide; identity; accused; sexual; abuse; gain; powerful; support; someone; falsely; accused; hint; woman,,-1
nvrizt,lucidconch4459,roughousing; look; like; make; angle; attack; masculinity; create; problem; exists; attack; problem; make; masculinity; look; toxic,,11890
nvreu1,daytime22_13,gender; would; oppressed; today; society,view; poll; reddit; poll; nvreu,-1
nvr6nd,No-Perspective5346,question,male; know; ever; said; need; woman; reaction,-1
nvqg76,throwawayopinion238,male; rape; invisible; male; aliraza; javaid,,-1
nvqb1y,FinallyReborn,opinion; unpaid; reproductive; labour,feminist; said; gender; role; center; around; reproduction; force; woman; unpaid; reproductive; labor; allow; continue; economic; labor; sexualization; woman; started; center; culture; around; reproduction; would; retort,-1
nvq38k,Au_contraire_zippy,male; feminist; fall; four; category,male; feminist; fall; four; main; category; predator; subservient; white; knight; darling; uneducated; male; start; behaviour; work; feminist; narrative; better; support; woman; life; male; feminist; insincere; mean; uneducated; dynamic; play; article; seek; address,-1
nvpwh6,Dry-water781,kneel; woman; stand; video; explains; today; woke; feminist; shooting; foot; behavior,,-1
nvoshx,No_Pause_9656,falsely; accussed; reddit; suing,view; poll; reddit; poll; nvoshx,-1
nvoqns,throwawaytsom,supreme; court; reject; group; lawsuit; outdated; sexist; male; military; draft,,-1
nvojkf,AdityaGutpa,indian; school; trying; hide; contribution; indian; history,recently; school; vacation; project; supposed; based; indian; history; specifically; regarding; indian; freedom; struggle; wikipedia; wiki; indian; independence; movement; topic; title; contribution; woman; towards; indian; freedom; struggle; guideline; justify; following; statement; woman; always; lead; fight; india; freedom; torch; bearer; towards; equality; india; conveniently; ignoring; hundred; thousand; went; battle; sacrificed; life; woman; house; wrote; article; india; ignoring; fact; almost; change; brought; welfare; indian; wrong; hide; contribution; focussing; minor; thing; woman; truthful; show; real; history; india; mark; full; feminist; conveniently; ignore; contribution,-1
nvk9j6,PeonSupreme,rape; reform; ride; roughshod; justice,,-1
nvk6n4,shefuccedme,snitched,,-1
nvjxo0,Long_Cut_7015,growing; number; male; survivor; talk; trade; victim,,-1
nvj7eq,harriskeith29,people; male; female; allowed; hairless; without; judgment,believe; like; hairy; armpit; either; fact; like; hair; anywhere; body; people; athlete; tired; stereotype; regurgitated; every; enjoys; hair; chest; face; genitals; take; shave; armpit; daily; semi; regularly; maybe; week; anything; like; electric; trimming; razor; like; hair; itch; pit; get; beyond; light; fuzz; like; make; sweat; easily; sweat; like; easily; enough; trim; chest; hair; occasionally; like; chest; fuzzy; grows; itch; sometimes; wearing; shirt; austin; power; facial; hair; grow; sometimes; usually; laziness; generally; prefer; none; interest; growing; beard; mustache; done; like; look; itch; face; honestly; genetically; alter; longer; grow; hair; body; outside; arm; shin; head; course; male; hairless; often; made; never; woman; standard; attractiveness; imposed; culture; right; part; problem; much; people; maturity; based; appearance; opinion; especially; true; associating; masculinity; body; hair; woman; often; opposite; number; guy; praise; woman; look; young; unshaven; enough; mistaken; child; noticeable; pattern; porn; anime; hentai; honestly; guy; enjoy; feeling; smell; excess; hair; sound; annoying; frankly; rather; dumb; validity; influenced; something; superficial; count; many; guy; heard; something; effect; hair; chest; finally; growing; hair; ball; stubble; congrats; obviously; meant; taken; literally; nobody; congratulated; pulling; pant; examine; understand; kind; pride; point; family; member; father; proud; physical; maturity; parent; feeling; perfectly; natural; get; widespread; societal; level; going; eye; ideal; world; nobody; would; judged; choose; shave; long; hygienic; mostly; care; personally; find; woman; hairy; pit; attractive; admittedly; blunt; patriarchal; brainwashing; telling; find; attractive; woman; like; pit; hairy; either; girl; simply; appealing; nothing; sexuality; come; physical; stimulus; odor; le,-1
nviamh,nrkyrox,kiara; mack; obsessive; stalked; former; boyfriend; armadale; get; conviction,,-1
nvhzwh,Adept-Orchid1181,girl; completely; separate; feminist,,-1
nvhkdq,SamaelET,prison; made; mean,something; read; come; givr; privilege; woman; reddit; egalitarianism; comment; lyle; male; prisoner; required; medium; android; source; share; government; news; secretary; state; launch; dedicated; strategy; break; cycle; female; offending; theguardian; australia; news; mass; imprisonment; crisis; woman; time; fuck; mean; always; vague; thing; thrown; whenever; subject; prison; tamked; yeah; sure; need; special; service; related; gynecological; health; pregnancy; except; basis; female; prisoner; given; right; wear; whatever; want; given; mirrosand; given; privacy; anything; basis; make; policy; sent; jail; woman; spared,-1
nvhbge,Accomplished-Storm-5,alimony; scam; investigative; report,link; youtu; steve; hitner; featured; photo; changed; alimony; law; positive; generation; wealth; destroying; legislation; stole; payer; income; reissued; payee; life; steve; hitner; took; decade; long; david; goliath; campaign; change; alimony; great; cost; wealth; edition; investigative; report; interview; steve; turned; drive; save; finance; drive; help; divorcee; divorce; mediator; steve; currently; work; couple; considering; process; divorce; achieve; amicable; outcome; people; failed; marriage; need; successful; divorce; steve; interviewed; boston; globe; newspaper; news; news; news; news; preview; redd; obkkmtnui; width; format; pjpg; auto; webp,-1
nvha7c,ImTheTrueFireStarter,hate; feminism; done; society,hate; feminism; done; country; hate; called; misogynistic; conform; notion; rape; culture; hate; always; seen; aggressor; encounter; woman; hate; assumed; nice; girl; want; body; hate; woman; claim; crap; male; privilege; much; actual; privilege; hate; woman; parent; hate; woman; always; seen; victim; almost; every; situation; hate; actual; issue; almost; exclusively; affect; boy; higher; suicide; rate; higher; work; place; death; rate; higher; chance; developing; learning; disability; lower; chance; getting; college; graduate; school; false; rape; allegation; custody; dispute; child; support; alimony; many; thing; overlooked; anyone; brings; automatically; labeled; misogynist; hate; feminism; done; society,-1
nvggkr,Altruistic-Future-42,feminism; amazing; trying; make; gender; equal,,-1
nvgffn,Altruistic-Future-42,amazing; feminist,,11891
nvge9x,Altruistic-Future-42,feminism; amazing,,11892
nvft43,camknight15,reason; picked; engineering; last; remaining; field; worry; much; discrimination; false; sexual; harassment; case,despite; intelligence; equal; among; gender; woman; competing; education; society; preferential; treatment; education; woman; million; dollar; spent; specifically; educating; woman; leaving; young; suffer; fall; closer; clutch; male; disposability; however; dismal; seem; still; leader; stem; field; however; much; longer; left; pushed; menial; form; work; society; decides; gender; determines; success; instead; capability; stand; really; worry; much; woman; falsely; accusing; sexual; harassment; work; many; woman; field; still; leader; tech; industry; best; happy; ride; train; however; much; longer; left,-1
nvfrn1,NexLevelIntactivism,circumcision; researcher; apologizes; intactivists; admits; mistake; next; level; intactivism,,-1
nveypl,PeonSupreme,volusia; county; sheriff; office; show; support; deputy; falsely; accused; inappropriately; touching; resident,,-1
nveupi,NoahFromHR,false; sexual; assault; charge; teacher,,-1
nver1z,Lilkidyunginjr,story; emotional; abuse,,-1
nvdi1g,Grand_Bunch,female; selective; service,,-1
nvddj6,Legitimate-Ad-6267,knuckle; spitting; hard; fact,,-1
nvdc93,Surr3al_,louder; people; back,,11893
nvculm,RememberJamesters,anyone; recall; technical; term; sexist; domestic; violence; legal; policy; introduced; made; anti; male; assumption,,-1
nvcpd1,michaelscott1776,drug; rejected; month; glad; approved,,-1
nvc0if,andejoh,legal; gym; woman; workout; area; connecticut; supreme; court; hear; case; questioning; state; long; history; addressing; gender; privacy; discrimination,illegal; unless; space; open; would; membership; additional; segregated; space; courant; news; connecticut; news; supreme; court; gender; privacy; lcamjfvwefcv; beynvhs; oytpi; story; html; courant; news; connecticut; news; supreme; court; gender; privacy; lcamjfvwefcv; beynvhs; oytpi; story; html,-1
nvbwoq,andejoh,leeds; want; increase; vaccination; preventing; population; receiving; open; first; vaccination; center; woman,never; heard; exposing; huge; issue; religion; assuming; actually; thing; address; private; room; regular; doctor; office; gave; vaccine; private; room; patient; always; blood; test; hand; rather; pretty; sure; covid; could; delivered; city; hone; vaccination; people; always; mobile; yorkshireeveningpost; health; coronavirus; leeds; covid; vaccine; clinic; woman; planned; reginald; centre; chapeltown; yorkshireeveningpost; health; coronavirus; leeds; covid; vaccine; clinic; woman; planned; reginald; centre; chapeltown; want; vaccine; unless; certain; woman; around; male; practitioner; community; guess; could; sexist; racist; list; female; privilege,-1
nvbn8t,andejoh,peter; stetina; paydirt; gravel; race; prize; money; female; participant; hope; hope; male; colleague; inspired; support; female; counterpart; enjoy; course; boatload; beer,woman; blatant; discrimination; female; cyclist; demanding; equity; cyclingnews; news; peter; stetinas; paydirt; gravel; race; set; woman; prize; purse; cyclingnews; news; peter; stetinas; paydirt; gravel; race; set; woman; prize; purse,-1
nvbeu9,Krypticpro,rant; guy; stop; male; traditional; limitation,,-1
nvaqoy,Throwra_1989_,boyfriend; make; female; friend; everyone; suggests; break; boyfriend; apparently; happy; making; female; friend,,-1
nvaglg,mydocumentaryacc,documentary; book,,-1
nvadub,HPUnicorn,standing; woman; completely; silent,,-1
nv9x88,ChemicalLengthiness3,cover; mistake; another; mistake,,11894
nv9td1,ThereAreThings,first; trafficking; shelter; opening,,-1
nv9lq2,Pillery,consider; voting; justin; fairfax; virginia; today,governor; justin; fairfax; career; pretty; much; completely; destroyed; unsubstantiated; accusation; woman; accuse; sexually; assaulting; year; never; came; forward; governor; presented; evidence; fairfax; called; investigation; confident; evidence; however; career; still; destroyed; despite; evidence; still; running; governor; virginia; today; democratic; primary; unlikely; consider; voting; believe; better; hope; fighting; totally; unsubstantiated; claim; future,-1
nv8wrc,pride4eva93,sexually; harassed; time; never; realize; told; supposed; like,,-1
nv8oqb,Beautiful_Horror_241,woman; say; guy; date; cheap; turn,,-1
nv834n,unum_terram,experience; brainwashed,,-1
nv7szz,GG1312,first; time; seen; actual; dating; advice; mash; every; line; text,,-1
nv7pwq,Master_Resolution869,mother; clearly; custody; woman,,11895
nv69gp,jorlynfame,looking; someone; talk; someone; want; somefun; moriellafame,,-1
nv5ug7,TheAndredal,breaking; scotus; reject; challenge; male; military; draft,,-1
nv5gjj,GeriatricHitAndRun,watching; porn; main; issue; male; sexlessness; almost; always; strawman; brought,,-1
nv4ijn,Safe-Nerve5939,woman; make; uncomfortable,,-1
nv4b3k,Icy_Night2516,opinion; feminist; movement,year; canada; done; surfing; feminist; right; reddit; identify; either; feminist; mra; right; activist; considering; find; movement; flawed; would; like; understanding; side; right; activist; subreddit; opinion; feminist; movement; let; keep; civil; come; criticism; praise; movement; thought; opinion,-1
nv4474,Kiky93,seem; suffer; silence; much,psychologist; work; drug; alcohol; rehab; center; overwhelming; majority; patient; almost; every; major; problem; communicating; feeling; therefore; used; drug; alcohol; dampen; suppress; emotion; society; allowed; learn; express; cope; anxiety; grief; sadness; allowed; emotion; society; huge; problem; society; drive; alcohol; drug; long; drive; suicide; human; being; human; being; emotion; emotion; useful; emotion; helped; ancestor; still; help; today; signal; prepare; action; woman; ridicule; emotion; fuck; emotion; valid; matter; matter; woman; empathize; afraid; everyone; immediately; take; care; privilege; however; want; encourage; fight; right; express; emotion; alone; fight,-1
nv3w7m,Xxbloodhand100xX,idea; woman; jailed; paid; price; guess,,11896
nv372d,gbands3ds,hell; military; draft; still; thing,found; still; exists; many; nation; throughout; world; including; human; right; violation; century; willing; sacrifice; life; country; born; penis,-1
nv2vaj,[deleted],incels; misogynist,,-1
nv2dh5,Terminator128,poor,,11897
nv274f,MartyMc1888,facepalm; indeed; first; last,,11898
nv24eo,bolbol1231,mobility; scooter; trolling; back,,-1
nv1psi,BewitchedHare,take; moment; appreciate; everyone; forum; care,true; society; created; others; space; talk; people; care; anyone; need; hear; love; matter; world; would; worse; without,-1
nv1by8,person_w_personality,feminist; group; call; funding; allocated; give; woman; family; priority; shelter; housing; adequate; healthcare; food; supply; event; natural; disaster,archive; archive,-1
nv1axw,Krypticpro,female; exam; hypothesis,,-1
nv0s88,rishabhkumar1617,expected,,11899
nv0c1k,Keronisin,lady; gentleman; present; actual; news; article; based; whether; woman; eligible; military; draft; success; would; mean; first; area; true; gender; equality; article; say; woman; soon; achieve; level; equality; everyone; want,,-1
nuz888,callagkier,attempted; post; right; male; suicide; statistic; today; within; min; jail,tried; share; image; detail; male; suicide; rate; facebook; today; took; min; algorithm; post; hate; speech; sexist; content; facebook; jail; time; last; month; must; something; right,-1
nuy35v,mrm_s_pp_rt,false; accusation; canada,friend; brother; fifteen; year; falsely; accussed; arrested; simply; word; think; canadian; law; allow; happen; friend; family; much; money; asking; help; organization; canada; might; able; help,-1
nuxmyy,Llamato2,lost; thank; ncfm; hard; work; real; hero; legit; cry; right,,-1
nux30x,No-Perspective5346,majority; rape; perpetrator; sorry; agree,,-1
nux1es,No-Perspective5346,majority; rape; perpetrator; sorry; agree,,-1
nuw5g3,Icy_Calligrapher_840,making; friend; guy; difficult; older,,-1
nuv2ts,dezmyers,,slight; rant; binge; watching; alpha-male; male; manosphere; pill; video; light; bulb; moment; video; instagram; bitch; bunch; thirsty; dude; comment; knowing; hoop; jump; fact; video; exist; type; woman; kinda; fucking; part; like; make; girl; obsessed; make; girl; look; validation; like; really; trying; study; someone; severely; mentally; broken; someone; look; others; validation; really; know; fuck; want; action; completely; contradict; study; trick; mental; rollercoaster; person; fucking; like; shit; seem; worth; pussy; good; fine; know; want; lacking; self; love; cool; like; change; mentally; good; place; change; ohhhh; pussy; prize; forbid; hold; back; super; invested; slowly; fall; back; away; keep; interested; mentally; broken; usually; go; like; change; problem; want; pussy; become; toxicity; usually; fuck; pussy; porn; free; mentally; financially; long; addicted; joke; aside; view; prize; everybody; view; prize; make; urself; prize; worthy; view; prize; bend; bullshit; requirement; childish; fuck; change; become; better; person; thirst; validation; people; treat; like; shit; watching; video; like; type; woman; sound; fucking; terrible; trying; woman; cause; sexy; sacrifice; mental; sense; self; pussy; saying; simps; allowed; simps; cause; broken; willing; anything; keep; girl; want; around; wind; pushing; away; cause; shit; much; hoop; taught; jump; appease; need; trying; dumb; balancing; toxic; good; duuuumb; video; dude; said; android; want; fuck; bitch; lmfao; really; phone; child; lmao; woman; turn; cause; phone; deeper; issue; brewing; underneath; hope; ever; present; figure,-1
nutvl1,DougDante,busted; child; welfare; caught; stealing; social; security; check; disabled; orphaned; foster; kid; father; likely; paying; child; support; cover; stolen; fund,,-1
nutq1f,Toxics_rages,right; woman; right; complete; bullshit; people; need; stop; acting; like; baby,,-1
nutn68,sonja_hastings,covid; judge; denies; mother; motion; suspend; father; coronavirus,,-1
nutkpj,benderXX,little; angel; year; girl; given; year; unthinkable; carjacking; murder; uber; eats; driver,,-1
nutizn,Suspicious-Lynx-69,crazy,,11900
ntwhbd,Side_Swipe007,online; article; woman,first; bashing; woman; find; interesting; woman; write; whole; article; problem; perspective; world; problem; thing; woman; would; meet; complete; resistance,-1
ntw39c,Ambitious_Bread2606,definition; feminism; equality; woman; gender; thing; trouble; something; get; fine,,-1
ntw0ue,postmonstergirls,help; advocate; right,,-1
ntvjjq,Syndercut,hello; everyone; year; question; every; group; young; date; time; everything; going; world; think; best,,-1
ntvfzj,ttv_highvoltage,misandry; justifiable; response; misogyny; sarah; baker; writes; medium,,-1
ntumcm,princewhisky,paternity; return,look; return; work; parental; leave; every; result; discus; hard; must; maternity; leave; believe; however; post; recognised; returning; work; father; adore; family; face; every; change; embrace; every; challenge; together; society; say; back; work; like; normal; normal; scary; crazy; normal; week; lucky; expected; quickly; back; teaching; stream; support; father; online; allowed; hour; hospital; covid; number; could; stay; jaundice; baby; love; partner; beyond; incredible; already; learning; teaching; every; second; every; feel; like; le; credit; support; help; know; post; asking; really; trying; know; tired; love; family; know; ready; back; work; know; something; reallllly; change; best,-1
ntt4ww,ProtectIntegrity,mohamed; elawdy; performs; male; genital; mutilation,,-1
ntpg5w,Subject_Ad5093,completely; ruined; reputation,,-1
ntoppy,chocolover86,fear; world; grow,,-1
ntodw0,CooperKravitz,argument; friend; false; accusation,telling; people; need; talk; false; accusation; basically; shrugged; claim; said; barely; happens; ever; rape; victim; need; attention; told; since; people; like; think; worse; compared; rape; asked; empathy; upset; said; nothing; similar; rape; nowhere; point; getting; irritated; kept; diminishing; horror; false; accusation; told; many; way; false; accusation; worse; rape; definitively; pointed; entire; life; ruined; something; told; falsely; accused; mean; afford; rent; mean; screwed; often; time; arrested; police; record; something; lose; freedom; something; proven; innocent; anything; many; people; still; believe; reputation; still; ruined; still; able; good; asked; rape; automatically; worse; started; cry; apologize; sticking; men; issue; guess; insensitive; rape; countless; time; stressed; awful; guess; bring; struggle; apply; woman; expect; sympathetic; rape; victim; sympathetic; falsely; accused; life; ruined; still; support; rape; victim; get; annoying; woman; return; favor; especially; friend; mine,-1
ntnvv1,SouthernSteak8344,right; matter,right; matter; fucking; petty; people; talk; right; response; woman; right; vice; versa; think; give; energy; life; matter; straight; pride,-1
ntnpi2,MotorAggressive5115,high; court; asked; review; draft; registration,,-1
ntnir1,seii7,likely; murdered; partner,tried; looking; mostly; result; woman; often; murdered; partner; ex; exception; article; claiming; murder; male; victim; perpetrated; partner; reason; believe; woman; using; self; defense; yeah; seem; unbiased; reliable; article; study; guy; gal; link,-1
