post_id,author,title,body,image,image description
qkuq1c,ThrowRA_lantern,rescue; mission; needed; mother; want; sister; keep; engaging; abusive; pickme; friend; believe; block,please; help; live; younger; sister; early; parent; massive; issue; mother; believe; block; earlier; year; sister; started; going; therapy; panic; anxiety; extremely; caring; giving; generous; mother; figure; friend; started; taking; massive; toll; high; achiever; trying; master; degree; train; elite; athlete; took; burden; becoming; emergency; contact; whenever; friend; boyfriend; family; issue; would; drop; anything; morning; however; friend; massive; pickme; always; getting; relationship; toxic; abusive; nvm; treating; sister; horribly; birthday; party; bought; gift; complained; entire; night; away; boyfriend; took; photo; bought; cocktail; except; sister; birthday; girl; sister; came; saying; mental; health; declining; need; support; raised; request; understand; stop; getting; available; videogame; every; night; scoffed; request; said; stupid; nothing; compared; deal; acted; passive; aggressively; like; text; sorry; apparently; weird; mental; health; problem; something; eventually; fight; bare; minimum; friendship; basic; love; respect; support; sister; asked; kept; communicating; communicating; friend; hostility; humiliation; told; sister; block; move; understood; ruthless; mentality; stopped; talking; month; however; realise; blocked; phone; number; social; medias; current; problem; reached; yesterday; text; wanting; meet; talk; apology; kindness; saying; missed; long; essay; actually; communicating; gaslighting; manipulating; situation; month; severe; reaction; friendship; sister; clearly; issue; communicated; sister; levelled; much; happy; quality; message; newer; mature; friend; focus; ghosted; since; left; friend; read; hour; proceeded; send; toxic; abusive; essay; saying; sister; acting; like; bratty; child; head; claiming; sister; silence; prof; selfish; appreciative; great; want; talk; said; much; rubbish; bagging; body; lifestyle; life; choice; mother; want; invite; talk; sister; tear; siding; block; enough; thought; left; behind; month; mother; keep; insisting; mediation; drive; house; talk; adult; insisting; driving; friend; house; word; parent; say; blocking; stupid; immature; hurt; much; tear; writing; really; want; sister; abused; bully; day; back; hurt; much; mother; keep; insisting; right; rest; family; stupid; wanting; block; keep; thinking; girl; need; educated; mental; health; friend; anxiety; bipolar; sure; think; educate; need; communicate; open; space; ridiculous; clearly; friend; looking; fight; opportunity; yell; rubbish; gain; sort; control; like; treated; like; doormat; mother; proceeding; rant; father; incredibly; stupid; immature; wanting; sister; deal; claiming; closed; ranting; younger; generation; keep; running; away; problem; know; sister; every; time; raise; point; mother; screaming; noc; care; wrong; mother; going; listen; telling; shut; feel; stuck; mother; run; household; daughter; adult; levelling; pursuing; professional; career; obviously; different; mindset; life; friendship; relationship; want; help; sister; mother; head; household; completely; different; approach; life; starting; reflect; sister; grown; anxious; attachment; heavy; codependence; think; family; dynamic; edit; sure; right; subreddit; lu; subreddit; better; apologise; wrong; subreddit; please; know; rescue; mission; flair; immediately; figured; suitable,-1,
qkuive,[deleted],rescue; mission; needed; keep; encouraging; sister; engage; pickme; bully,,-1,
qkt763,Fun_Sherbet,polyamory; normalization; dissatisfaction,talk; polyamory; glamorization; put; magnifying; glass; society; relationship; trauma; whole; cultural; indoctrination; observation; experience; people; around; definitely; trying; hold; accountable; previous; behavior; observation; time; attempting; polyamorous; spurred; beginning; emotionally; unavailable; pornsick; opening; allowed; avoid; admitting; relationship; truly; foolish; passive; cleanly; break; instead; viewed; honesty; communication; mature; sidestepping; truth; trying; save; relationship; woman; trained; holding; guise; highly; evolved; open; relationship; desperately; sought; denied; course; year; relationship; affection; emotional; connection; sexual; attraction; ravenous; desperation; justified; progressive; encouragement; explore; every; option; came; poly; lens; gave; give; many; perspective; everyone; option; extent; feeling; hormone; valid; love; option; experimentation; swiftly; break; good; place; extreme; vulnerability; though; detached; emotionally; long; breakup; breakup; arm; someone; easy; target; someone; starved; emotionally; since; desperate; connection; really; sketchy; behavior; line; lover; much; emphasis; staying; cool; talking; away; jealousy; dealt; abusive; type; openly; discussed; jealousy; gave; ammo; traumatizing; later; took; gladly; note; poly; community; filled; jealousy; insecurity; level; high; everyone; desperate; love; patch; trauma; attest; personally; zero; break; toxic; relationship; next; overlapped; spent; good; month; year; minimum; process; breakup; since; emphasis; commitment; emphasized; little; need; discerning; repeated; message; polyamory; mindset; need; person; definitely; agrees; mindset; extent; best; happy; seek; people; make; primary; partner; shortcoming; allows; shitty; partner; accept; shortcoming; others; woman; need; excuse; dissatisfactory; behavior; polyamory; like; imagine; world; love; severely; unbalanced; gendered; socialization; point; always; return; since; infidelity; weaponized; woman; thousand; year; always; suspect; seek; multiple; partner; claiming; devotion; woman; polyamory; aligns; patriarchal; view; culturally; toxic; view; masculinity; norm; sexuality; quantity; partner; quality; emotional; detachment; constant; chasing; novelty; allows; reap; benefit; caring; woman; life; placing; sexual; freedom; priority; never; seen; polyamorous; woman; vying; primary; attention; particular; post; poly; reflection,-1,
qkt32i,whoiskait,looking; girl; profile,,-1,
qksopi,Jazzlike-Honey1095,scrote; equates; divorce; rape; actual; real; rape,,6580,going; nasty; divorce; woman; pretended; many; thing; including; monogamous; money; comforting; girl; coming; extremely; kinky; relationship; prosecuting; rape; point; mentioned; abuse; stopped; cold; attacked; raped; took; different; abuser; different; tool; girl; replied; different; dating; married; agreed; conversation; continued; expose; progressive; mindset; wife; robbed; woman; belong; giving; money; woman; reply; give; award; share; report; save; fucked; view; hope; better; meet; someone; belittle; pain; experience; reply; give; award; share; report; save
qkqmqs,CarNo5059,choose; relationship; notice; talk; others,,-1,
qkq3pp,cleverhumanbeing,boyfriend; insulted; nowhere,,-1,
qkpydb,sadeintyo,take; dish; lmao,,-1,
qkpybu,WestchesterWannabe,account; abusive; husband; found; another; poor; girl; prey; upon; shaking; thinking; could; fuck; life,,-1,
qkpsd1,mastermoonbear,lvm; friend,,-1,
qkprqd,bluevom,return; policy; always; come; back,,-1,
qkpdg4,sunflowergrazing,vetting; victim; wife,,-1,
qkonm6,naananon,starting; fresh; break; strong; thanks,,-1,
qkoniz,FallopianToobz,date; okay,,-1,
qkohzt,CatLocker,judging; woman; people; moral; based; sexual; life; shallow; idiotic; tired; normalized,,-1,
qkoeuh,[deleted],marriage; label; legal; contract,,-1,
qkntgl,throwawayastrogirl,turn; miss; going; away; week,,6581,city
qknnsu,velvettwilight,dealing; pick; sister; going; abroad; find; bride,,-1,
qkmtbb,Defiant_Marsupial123,sigma; male; contain; worst; personality; attribute; stupid; category,,-1,
qkmnjy,Pokegirloras,guy; house; wife; unpopular; opinion; post; front; page,holy; shit; someone; asked; exists; would; link; said; would; prefer; kid; work; outside; house; people; lost; fucking; mind; saying; house; wife; hard; lazy; wanting; bunch; people; straight; attacking; character; reason; comment; dead; saying; value; near; evil; could; come; obligatory; response; waoooow; toxic; ever; seen; never; mind; jailbait; true; evil; internet; form,-1,
qkm9it,Bekinditsfree,love; friend; act; like; pickmeisha,,-1,
qkm2h3,LaSoufriere,avoiding; contact; conversation,,-1,
qkm0m1,Puzzledchica,height; matter,,-1,
qkktvn,ecorado14,observation; first; post; pandemic; party,queen; hope; everyone; festive; safe; halloween; weekend; sharing; observation; halloween; party; attended; ethic; group; reason; tend; advanced; degree; highly; paid; job; region; skew; pretty; progressive; expected; meet; least; hvm; guy; attended; think; know; going; woman; dressed; costume; makeup; right; prop; third; guy; dress; wore; kind; jean; many; guy; approached; girlfriend; seem; grasp; socialize; kept; approaching; talk; asked; friend; marketing; create; advertisement; laundromat; another; asked; chose; costume; considering; political; climate; dressed; police; officer; good; opening; line; told; looking; becoming; next; career; help; woman; like; gabby; petito; told; guess; life; another; demanded; take; picture; followed; room; room; danced; turn; work; company; biggest; employer; several; campus; kept; asking; product; dept; dude; come; network; danced; another; talking; song; randomly; fullface; mask; kept; trying; talk; friend; decent; danced; bought; drink; told; night; together; later; danced; exchanged; number; generous; clingy; stalking; hundred,-1,
qkkqwb,Elnoxis,wrote; poem; remind; needed; leave,value; leave; rather; learn; live; life; without; deal; inconsistency; easier; relearning; suffer; agony; waiting; rather; forget; hope; crushed; suddenly; pull; away; love; clearly; love; leave; without; choice; driven; corner; must; leave; love; starve; survive; note; feeling; dating; experience; found; reminiscing; good; time; better; judgment; wrote; remind; need; leave; hope; resonates; lady,-1,
qkkowc,brylm92,porn; user; always; nvm,case; wondering; porn; terrible; obvious; limp; dick; energy; obsession; anal; daily; infidelity; thousand; woman; brief; list; research; copied; antiporn; activist; tumblr; newmasterpost; antiporn; activist; tumblr; newmasterpost; study; internet; porn; every; massively; exposed; violent; hardcore; pornography; throughout; often; look; porn; procrastinate; much; like; normal; person; check; social; medium; porn; user; always; undateable; never; give; chance; porn; psychological; effect; dolf; zillmann; jennings; bryant; conducted; experiment; male; female; college; participant; divided; three; subgroup; group; shown; hour; minute; medium; week; period; massive; exposure; group; shown; violent; pornographic; film; clip; intermediate; exposure; group; exposed; pornographic; film; clip; regular; film; exposure; control; group; shown; pornographic; film; clip; direct; correlation; noticed; amount; pornography; viewed; overall; sexual; satisfaction; participant; massive; exposure; group; reported; le; satisfaction; intimate; partner; partner; physical; appearance; affection; sexual; performance; researcher; concluded; consumer; eventually; compare; appearance; performance; pornographic; model; intimate; partner; comparison; rarely; favor; intimate; partner; exposed; pornography; attached; value; casual; without; emotional; involvement; asked; minor; protecting; seeing; pornography; exposure; group; intermediate; exposure; group; massive; exposure; group; said; porn; seemed; condition; participant; trivialize; rape; participant; asked; read; legal; case; raped; female; hitchhiker; recommend; length; rapist; prison; sentence; male; exposure; group; said; month; massive; exposure; group; said; month; nearly; half; exposure; group; participant; asked; rate; overall; support; woman; right; woman; massive; exposure; group; showed; significant; drop; support; compared; exposure; group; male; support; exposure; group; compared; massive; exposure; group; female; support; exposure; group; compared; massive; exposure; group; asked; common; popular; certain; sexual; activity; general; population; activity; like; anal; group; sadomasochism; bestiality; percentage; given; massive; exposure; group; three; time; higher; exposure; group; massive; exposure; group; likely; believe; woman; stereotype; woman; pornographic; film; socially; discriminating; hysterically; euphoric; response; sexual; pseudosexual; stimulation; eager; accommodate; seemingly; every; sexual; request; additionally; week; stopped; seeing; video; participant; given; assortment; pornographic; pornographic; film; watch; private; exposed; pornography; significantly; likely; want; watch; hardcore; porn; study; male; undergraduate; student; divided; group; group; watched; minute; video; segment; sexually; explicit; degrading; film; sexually; explicit; educational; film; sexual; film; later; placed; side; side; woman; seemingly; unrelated; social; experiment; viewer; sexually; explicit; film; displayed; dominance; anxiety; ignored; contribution; partner; often; touched; partner; longer; period; time; averted; partner; gaze; compared; viewer; sexual; film; viewer; sexually; explicit; degrading; film; spent; longer; period; time; averting; partner; touch; gazing; partner; face; interrupted; partner; advanced; touch; partner; made; sexual; reference; compared; viewer; sexually; explicit; film; study; youth; age; concluded; significant; relationship; frequent; porn; feeling; loneliness; major; depression; gary; brook; describes; observes; pervasive; disorder; linked; consumption; soft; core; pornography; like; playboy; mention; five; main; symptom; voyeurism; obsession; looking; woman; rather; interacting; apply; pornography; including; consumption; sexuality; culture; live; medium; glorifies; objectifies; woman; body; thus; promoting; unreal; image; woman; feeding; male; obsession; visual; stimulation; trivializing; mature; feature; healthy; sexual; relationship; objectification; attitude; woman; object; rated; size; shape; harmony; body; part; sexual; fantasy; lead; emotional; unavailability; dissatisfaction; validation; need; validate; masculinity; beautiful; woman; woman; meet; centerfold; standard; retain; power; long; maintain; perfect; body; lure; unavailability; common; fantasy; sexual; encounter; include; feeling; manly; validation; common; feel; invalidated; wife; trained; mind; body; respond; fantasy; advance; dream; girl; trophyism; idea; beautiful; woman; collectible; show; world; pornography; reinforces; woman; body; trophy; mentality; fear; true; intimacy; inability; relate; woman; honest; intimate; despite; deep; loneliness; pornography; exalts; sexual; need; need; sensuality; intimacy; develop; preoccupation; sexuality; powerfully; handicap; capacity; emotionally; intimate; relationship; prolonged; exposure; pornography; must; remembered; result; loss; respect; female; sexual; autonomy; disinhibition; expression; aggression; woman; james; weaver; porn; addiction; adult; admit; addiction; online; pornography; survey; wife; self; identified; addict; criterion; diagnosis; post; traumatic; stress; disorder; discovered; evidence; compulsive; addictive; sexual; behavior; opposed; planned; disclosure; part; husband; demonstrated; severe; level; functional; impairment; major; area; life; length; marriage; disclosure; number; prior; traumatic; event; exposure; best; predictor; increased; trauma; symptom; odern; science; allows; understand; underlying; nature; addiction; pornography; chemically; nearly; identical; heroin; addiction; jeffrey; satinovet; pornography; trigger; myriad; endogenous; internal; natural; drug; mimic; high; street; drug; addiction; pornography; addiction; erototoxins; mind; altering; drug; produced; viewer; brain; judith; reisman; porn; violence; rape; rated; porn; scene; contain; aggressive; act; principally; spanking; gagging; slapping; scene; contained; verbal; aggression; primarily; name; calling; occurrence; perpetrator; aggression; time; directed; towards; woman; selling; scene; analyzed; contained; behavior; kissing; laughing; caressing; verbal; compliment; open; hand; slapping; occurs; scene; depicted; porn; movie; generally; ocuses; sexual; pleasure; orgasm; rather; equally; woman; bridge; wosnitzer; porn; scene; sexist; racist; theme; website; often; contain; menu; user; select; genre; woman; ethnicity; body; type; age; choice; amateur; interracial; ever; popular; teen; category; woman; anything; white; represented; stereotypical; demeaning; way; study; show; viewing; pornography; likely; report; decreased; empathy; rape; victim; increasingly; aggressive; behavioral; tendency; report; believing; woman; dress; provocatively; deserves; raped; report; anger; woman; flirt; refuse; report; decreased; sexual; interest; girlfriend; wife; report; increased; interest; coercing; partner; unwanted; act; bridge; yang; gahyun; meta; analysis; study; published; comprising; total; sample; people; researcher; concluded; pornographic; material; put; increased; risk; developing; sexually; deviant; tendency; increase; risk; committing; sexual; offense; increase; risk; accepting; rape; myth; increase; risk; among; perpetrator; crime; adolescent; exposure; pornography; significant; predictor; elevated; violence; victim; humiliation; study; college; fraternity; member; small; liberal; art; campus; displayed; image; woman; poster; screensavers; calendar; advertisement; analyzed; frequency; degrading; nature; significant; association; average; degradation; rating; image; student; rape; supportive; attitude; scale; study; female; university; student; researcher; concluded; early; exposure; pornography; related; subsequent; rape; fantasy; attitude; supportive; sexual; violence; woman; researcher; believe; pornography; consumed; young; contributes; woman; socialized; accept; sexual; aggression; sexual; romantic; event; data; collected; interview; woman; participating; battered; woman; program; pornography; partner; significantly; increased; odds; woman; sexually; abused; abuser; abuser; used; alcohol; pornography; odds; sexual; abuse; increase; factor; arrested; prostitution; client; twice; likely; report; watched; pornographic; movie; past; year; national; sample; japanese; male; divided; three; group; exposed; different; type; home; video; pornography; positive; rape; film; female; expressed; pleasure; negative; rape; film; female; expressed; pain; consenting; film; hose; viewed; positive; rape; film; significantly; likely; state; woman; could; enjoy; rape; higher; percentage; rape; case; invented; victim; study; italian; adolescent; age; year; viewing; pornography; correlated; active; passive; sexual; violence; unwanted; woman; represented; passive; slavishly; dependent; upon; role; female; character; limited; provision; sexual; service; extent; woman; sexual; pleasure; represented; subordinated; never; sexual; pleasure; plea; woman; body; satisfy; male; desire; sexual; objectification; woman; common; pornography; woman; recipient; worse; treatment; violent; pornography; woman; character; killed; tortured; gang; raped; mutilated; bound; otherwise; abused; mean; providing; sexual; stimulation; pleasure; male; character; helen; longino; research; indicates; male; college; student; united; state; canada; admit; likelihood; would; rape; woman; could; away; briere; malamuth; study; high; school; male; interviewed; believed; acceptable; hold; girl; force; sexual; intercourse; instance; get; sexually; excited; say; going; change; mind; goodchilds; zellman; went; porno; bookstore; quarter; slot; porn; movie; coming; behind; girl; attacking; raping; started; rape; fantasy; movie; like; somebody; fuse; childhood; went; went; raped; rapist; interviewed; beneke; following; statement; made; woman; testifying; hearing; pornography; minneapolis; minnesota; russell; testified; agree; private; scenario; husband; read; depicted; bondage; different; sexual; act; found; humiliating; read; pornography; like; textbook; like; journal; finally; convinced; bound; read; magazine; knot; bind; escape; scene; dress; different; fantasy; exact; scene; read; magazine; described; case; brought; pornographic; magazine; book; paraphernalia; bedroom; told; perform; sexual; act; dirty; book; magazine; would; beat; kill; testified; experience; group; woman; prostitute; said; forced; constantly; enact; specific; scene; witnessed; pornography; would; scenario; usually; woman; copy; scene; seen; portrayed; magazine; book; example; quoted; woman; group; saying; held; porn; magazine; picture; beaten; woman; said; want; look; like; want; hurt; began; beating; fast; enough; cigarette; held; right; breast; long; time; burned; described; three; nude; woman; prostitute; tied; seated; chair; burned; cigarette; attached; nipple; clip; breast; many; magazine; showed; many; picture; woman; appearing; consent; enjoy; encourage; abuse; held; twelve; hour; continuously; raped; beaten; another; example; cited; several; john; forced; woman; simultaneously; movie; movie; point; group; urinating; naked; woman; room; able; perform; task; started; urinating; woman; naked; violent; heterosexual; porn; often; becomes; boring; lead; commonly; seek; interesting; exciting; type; pornography; often; including; abuse; rape; zillman; bryant; briere; malamuth; porn; relationship; gathering; nation; divorce; lawyer; attendee; revealed; divorce; result; spouse; looking; excessive; amount; pornography; online; according; journal; adolescent; health; prolonged; exposure; pornography; lead; exaggerated; perception; sexual; activity; society; diminished; trust; intimate; couple; abandonment; hope; sexual; monogamy; belief; promiscuity; natural; state; belief; abstinence; sexual; inactivity; unhealthy; cynicism; love; need; affection; sexual; partner; belief; marriage; sexually; confining; lack; attraction; family; child; raising; according; sociologist; jill; manning; research; indicates; pornography; consumption; associated; following; trend; among; others; increased; marital; distress; risk; separation; divorce; decreased; marital; intimacy; sexual; satisfaction; infidelity; increased; appetite; graphic; type; pornography; sexual; activity; associated; abusive; illegal; unsafe; practice; devaluation; monogamy; marriage; child; rearing; increasing; number; people; struggling; compulsive; addictive; sexual; behavior; survey; woman; experienced; serious; adverse; consequence; partner; cybersex; involvement; couple; lost; interest; relational; showed; decreased; interest; partner; partner; commonly; reported; feeling; hurt; betrayed; rejected; abandoned; lonely; isolated; humiliated; jealous; angry; partner; often; compared; unfavorably; online; image; partner; overwhelmingly; felt; cyber; affair; emotionally; painful; offline; affair,-1,
qkk59m,grimm84,,,6582,november
qkj6y1,Moira_Spice,sometimes; bitch,brendan; asked; plan; something; fixed; date; time; conversation; carry; date; nothing; really; sealed; cement; guess; wait; create; structure; date; nothing; come; conversation; carry; still; plan; rude; playing; around; brendan; kind; politeness; planning; curating; date; kind; improvise; last; minute; good; impression; first; encounter; first; encounter; occasion; shining; best; choosing; like; next; imagine; together; like; year; later; zero; effort; like; make; excited; date; planning; bitch; next; guy; make; plan; text; letter; correspondence; penships; whatever; pigeon; carrying; crap; like; hell; keep; mind; encounter; crappy; plan; poorly; corner; break; basic; boundary; lack; politeness; something; expected; tolerated; likely; problem; deserve; basic; respect; basic; attention; planning; asking; much; bitch; curate; experience; like; seek; enjoy; lick; boot; expect; ready; awaiting; call; fucking; happen; one; desperate; judging; court; jokester; ass; look; determine; whether; worth; keeping; push; mind; unavailable; plan; party; busy; respond; sometimes; bitch; quickly; learn; step; order; kept; around; attention; giving; every; attention; asking; work; hard; attention; come; running; like; golden; retriever; really; interesting; either,-1,
qkirpj,GabbaG0ul,rape; accept; action; rape; suspicious; question; rape; allegation; medium; criticizes; metoo; movement; letting; mask; slip,,-1,
qki4o8,[deleted],spot; avoid; abuser,,-1,
qkhctb,TheKarenFromHell,great; boyfriend; great; husband,,-1,
qkgvod,sleepysiri,dating; young; intending; marry,wondering; opinion; casually; dating; early; want; settle; almost; year; think; fully; versed; handbook; majority; principle; understand; woman; want; date; seeking; hvm; college; aged; dating; experience; much; else; give; already; give; love; companionship; friend; family; many; hobby; goal; free; time; rarely; abundant; feel; quite; fulfilled; aspect; think; really; romance; money; right; physical; safety; aspect; someone; manly; thing; need; romance; contracted; high; paying; brilliant; prospect; graduate; adopt; rottweiler; learn; sink; youtube; looking; marry; someone; sake; experience; romance; would; like; start; dating; would; follow; handbook; hvm; since; planning; marrying; wonder; waste; diluting; dating; pool; taking; away; hvm; woman; want; marry; casual; fully; know; benefit,-1,
