post_id,author,title,body,image,image description
que2ys,megabatswag,confession,,6426,standard; difficulty; rejecting; woman; spent; night; year; woman; year; loosened; little; another; woman; trying; avoid; another; year; really; sweetheart; suck; mean; dick; little; chubby; kinda; crazy; really; guess; carry; good; anyone; could; carry; amount; somewhat; attractive; cute; personality; attract; woman; easily; mostly; woman; want; take; care; cool; sexually; attracted; current; woman; around; think; sweet; way; indulge; bomb; talk; feel; conflicted; knowing; legitimately; attracted; want; ghost; want; hurt; feeling; nothing; wrong; want; stop; getting; want; feel; level; conflicting; feeling; trying; connect; swallowing; kid; asking; know; know; brain; heart; trying; fuck; know; patience; lose; weight; conventionally; attractive; woman; might; caas
qudenl,Trouserboy69,good; meet; single; woman,,-1,
quc4tb,kuodron,report; subreddit,,-1,
qubxr5,jthepisces,ghosted; thought; liked,,-1,
qubtt5,cicerii,brother; male; figure; understand; harassed; teen,wondering; lvm; life; really; acknowledge; much; daily; thing; harassment; told; walking; school; taking; public; transportation; brother; friend; trying; touch; older; inappropriate; online; creep,-1,
quao8h,IcyWater1672,hello,,-1,
quaibl,SyllabubQuiet2482,always; invest,,-1,
qu9e38,generally-shy,desperate; goal,,-1,
qu94p9,aluriaphin,place; first; date; city; voted; populace; free; public; space; walking; date,city; free; weekly; indie; paper; annual; people; choice; type; award; kind; thing; best; bartender; salon; realtor; asian; restaurant; place; dance; reader; vote; online; award; gold; silver; bronze; category; winner; best; place; first; date; city; waterfront; board; game; cafe; botanical; garden; free; public; space; walk; majority; daters; city; idea; best; place; take; first; date; somewhere; free; walk; around; imagine; tired,-1,
qu8ria,indieangel,scrote; asks; help; force; wife; pregnant,,-1,
qu8pr3,indieangel,scrote; asks; help; force; wife; pregnant,,-1,
qu86i0,Striking_Bag5795,lmao,,-1,
qu83lm,Sunshine_Daisies2525,everything,grocery; isle; yesterday; picked; copy; vanity; fair; excited; share; strategy; girl; plan; image; admire; strategically; placed; apartment; start; dating; soon; eventually; invite; knowing; would; good; friend; signal; sort; admire; attracted; already; obama; book; displayed; bookshelf; glad; gorgeous; muscly; face; dwayne; rock; johnson; cover; vanity; fair; wholesome; picked; coffee; table; love; interview; way; parent; show; love; intimidates; look; like; look; home; happy; great; idea; watch; recent; interview; wham; talking; pee; bottle; honestly; excuse; lie; play; talking; grimy; gym; bathroom; honey; live; wrong; funny; tragic; story,-1,
qu6z2p,ScrappleSandwiches,persistence; paid; many; flag; count; wedding; announcement,,-1,
qu6x0k,Bipity_Bopity_Butsex,height; requirement,,-1,
qu6wrx,norrskenshieldmaiden,woman; similar; experience; thinking; undateable; realizing; wrong; later,,-1,
qu6lyo,Abeanwithadream2,like; wine; prime; later; life; sexy; silver; fox,,-1,
qu620n,Reasonable-Fall1732,become; hvm; woman,,-1,
qu5pop,Bluemonroe26,know; pickme; swipe; right,,6427,airline; pilot; fulfill; conceived; roll; society; make; fall; inlove; throw; ring; married; cheat; flight; attendant; bearing; first; child; tell; look; beautiful; caught; divorce; become; alcoholic; repeat; lu
qu5ed2,idkwhat2putasmyuserr,show; personality; someone; know; still; private; time,,-1,
qu52o4,YouSilent9788,normal; thing; happen; especially; year; girl; educate; injury; occur; organ; rough,,6428,posted; vagina; fell; pushed; back; seems; fine; freaking; friend; little; rough; felt; great; finished; pulled; like; weird; heavy; feeling; chill; recovering; orgasm; acting; weird; like; said; something; happened; stood; looked; mirror; like; long; pink; donut; hanging; immediately; bathroom; managed; push; back; seems; fine; happened; worried; call; doctor; tell; nurse; update; went; hospital; said; weird; really; problem; serious; issue; probably; weak; pelvic; floor; exercise; kept; happening; might; need; little; surgery; share
qu4fzj,onions_r_evil,cleaning; vibrator,single; following; divorce; relief; vibrator; today; cleaning; putting; away; washing; thinking; washing; penis; giggle; giggle; said; wait; minute; many; bother; washing; late; really; call; experienced; serious; boyfriend; entire; life; remind; take; shower; would; husband; bathe; bother; without; shower; day; lord; nasty; father; brother; extremely; neat; never; knew; slob; poor; hygiene; college; aged; sheltered; guess; started; thinking; comment; previous; said; dick; said; shake; time; using; restroom; want; look; like; playing; washing; dick; must; fall; umbrella; watching; restroom; wrong; guy; thinking; smelling; like; need; stinky; vibrator; much; better; always; hard; make; every; time; viagara; necessary; happens; everyone; disappointed; lying; scrote; rambling; keep; toy; clean; back,-1,
qu4egy,chamomilepill,importance; lying; disfunctional; family,,-1,
qu495e,plomerst,chelsea; handler; say; boyfriend; renewed; faith; never; settle,,-1,
qu465c,leekykeeks,reason; marry; woman; others; warning; long; post,article; blew; mind; today; health; reason; marry; woman; others; tldr; market; researcher; study; marry; study; used; focus; group; interview; surveying; however; please; read; article; give; full; picture; study; going; bullet; point; favorite; excerpt; article; excerpt; really; enraged; offered; valuable; insight; love; hear; thought; graduate; high; school; start; thinking; marriage; real; possibility; graduate; college; start; considering; marriage; real; possibility; graduate; school; take; longer; working; world; ready; married; year; graduated; college; ready; next; step; age; likely; consider; marriage; window; opportunity; stay; open; four; five; year; chance; marry; start; decline; majority; college; graduate; high; commitment; year; likely; propose; period; educated; last; five; year; chance; commit; sightly; le; thirty; thirty; still; high; commitment; phase; remember; term; reach; chance; commit; start; diminish; slightly; reach; remain; good; prospect; chance; ever; marry; drop; dramatically; chance; marry; first; time; diminish; reach; point; many; become; confirmed; bachelor; reach; without; marrying; chance; marry; disappear; drop; dramatically; getting; school; many; look; time; spent; carefree; bachelor; rite; passage; first; year; primary; goal; translates; dating; without; serious; thought; marriage; graduate; school; doctor; lawyer; like; high; commitment; period; run; whose; friend; sibling; married; likely; marry; single; scene; full; kid; conducted; focus; group; proposed; woman; learned; likely; marry; tired; single; scene; many; reluctantly; admitted; year; felt; uncomfortable; single; world; hanging; past; five; year; three; admitted; questioning; started; hanging; single; place; teenyboppers; kid; simply; gotten; crowd; point; likely; ready; next; step; specific; depends; maturity; education; profession; notable; exception; guideline; balding; heavy; losing; hair; putting; weight; often; make; look; older; look; older; single; place; often; treated; woman; belong; stringer; favorite; part; article; please; read; article; dating; long; term; relationship; woman; marry; real; possibility; stringer; stringer; string; woman; along; like; woman; sleeping; woman; eating; woman; possibly; sharing; life; woman; without; ever; making; real; commitment; often; tell; woman; upfront; never; intends; marry; decides; want; reason; complain; think; involved; stringer; establish; deadline; commit; within; month; think; involved; stringer; establish; deadline; commit; within; month; attention; excuse; tell; coming; strong; complain; going; together; long; enough; know; made; mind; fact; likely; tell; anything; stick; around; without; needing; make; commitment; fall; chance; stringer; marry; slim; simply; marrying; kind; earlier; mentioned; went; woman; time; shortly; thereafter; went; married; another; pattern; meet; long; term; relationship; make; clear; date; certain; length; time; expect; ring; understand; done; think; affirmative; response; declaration; precursor; making; commitment; strung; many; woman; along; month; firm; commitment; leave; parent; marriage; another; factor; determines; whether; likely; married; success; lack; thereof; parent; marriage; found; many; single; woman; late; thirty; forty; product; divorce; divorced; home; marry; reluctant; often; woman; drag; altar; marital; status; parent; first; thing; want; find; completely; ignored; unpolished; jewel; section; responsible; marriage; still; woman; looking; marriage; looking; hard; enough; working; hard; enough; satisfy; woman; read; absolutely; nothing; lose; decide; stay; bachelor; wary; left; single; scene; could; settling; anyone; meanwhile; woman; marry; security; financial; otherwise; start; family; care; modern; feminist; made; easy; never; actually; commit,-1,
qu44lh,Curiousquest2,maybe; jack; writing; extreme; length; woman; feel; safe,,6429,newsweek; woman; stage; apartment; look; teoria; umea; jack; beresford; november; woman; asks; hinge; match; controversial; opinion; disappoint; aworan; showcased; extreme; length; need; order; feel; safe; know; visit; apartment; newsweex; news; video; posted; ktok; handle; ccvemrmeelere; arenes
qu3asb,Double-Exchange,tip; improving; appearance; hvw,autistic; trust; relevant; struggling; improving; self; esteem; becoming; high; value; working; social; skill; however; struggling; appearance; really; know; start; ton; article; online; sort; topic; really; woman; autistic; never; really; followed; social; cue; feel; like; never; really; learnt; dress; makeup; carry; bought; nice; clothes; tried; wearing; makeup; something; always; look; costume; like; essential; confidence; self; worth; learn; dress; find; hard; find; explicit; direction; tip; find; personal; style; type; tip; helpful; autistic; anyone; maybe; article; youtube; video; blog; detailed; instruction; dress; flattering; especially; enjoy; vintage; style; type; clothes; look; thanks,-1,
qu2a4l,Zeniite,extra; careful; shady; habit; road; linked; narcissism,reflecting; dated; year; would; refuse; windshield; wiper; raining; fine; refused; break; last; second; catching; another; highway; would; drive; without; using; hand; could; rather; help; could; keep; least; hand; steering; wheel; would; took; corner; parking; quickly; almost; collided; another; driving; knew; touch; ptsd; accident; past; want; emphasize; unsafe; driving; behavior; lack; regard; feeling; safety; rule; road; flag; definitely; covert; narcissist; really; hard; spot; broke; good; psychologicalscience; news; motr; narcissism; driving; hazard; research; suggests; html; psychologicalscience; news; motr; narcissism; driving; hazard; research; suggests; html,-1,
qu27m5,__Yah00,western; male; growing; le; useful; society; lashing; way; thought,,-1,
qu1us3,hexriot2001,color; triangulate; woman; color,note; white; woman; anything; turn; know; noticed; black; brown; aggressively; pursue; white; woman; give; bare; minimum; woman; look; like; white; woman; never; flattered; disparaging; woman; race; appeal; make; feel; special; black; want; black; woman; feel; like; prize; play; pornified; fantasy; taking; white; woman; play; care; person; represent; trying; create; illusion; black; dating; option; outside; race; black; woman; none; therefore; settle; struggle; love; ultimately; triangulation; meant; manipulate; black; woman,-1,
qu18q2,Background-Layer-,reason; never; build; never; work; telling,,-1,
qu0zwg,happydystopia1022,orgasm; hear,,-1,
qu0zsn,DagmarBerman,wedding; announcement,,-1,
qu0ber,BookwormJane,beware; fuckboys; pretend; hvm; mistake; made; dodged; bullet,recently; curious; experience; dating; ended; jerk; experience; useful; giving; many; lesson; lvm; evolved; behave; like; hvm; want; describe; tactic; date; progress; pretend; hvm; sign; paying; attention; order; dodge; bullet; waste; time; like; wasted; time; anyway; initial; contact; pretend; hvm; online; profile; written; attention; grabbing; shirtless; pic; look; dignified; like; could; proudly; introduce; parent; polite; attentive; make; grammar; mistake; clever; good; vocabulary; seemingly; respect; boundary; talking; tinder; asks; number; polite; careful; saying; number; understand; want; keep; talking; alright; sign; fuckboy; compatible; right; beginning; course; case; people; genuinely; compatible; feel; like; faking; compatibility; feel; good; true; always; like; everything; want; test; like; certain; band; movie; love; say; yeah; know; maybe; really; good; like; agrees; careful; flag; want; text; hour; beginning; force; intimacy; go; day; texting; maybe; hvm; want; make; sure; crazy; dignified; compatible; enough; love; bombing; yeah; begin; daily; good; morning; text; right; beginning; nothing; wrong; good; morning; text; try; talk; long; call; babe; pampers; beginning; eager; know; detail; schedule; careful; mistake; asked; day; started; talking; proposed; dinner; date; weekday; accepted; known; better; postpone; make; happen; weekend; could; know; better; perhaps; meeting; first; date; pretend; hvm; invite; dinner; date; nice; restaurant; effortless; bullshit; want; know; kind; food; like; go; willing; pick; place; recommend; accepting; really; know; tell; rather; restaurant; uber; freak; seems; cool; understanding; flake; get; time; punctual; talkative; seems; interested; know; talk; everything; polite; everyone; know; make; feel; comfortable; safe; sign; fuckboy; know; entire; staff; restaurant; beware; tricky; know; everybody; restaurant; sign; perhaps; brings; girl; knew; waiter; name; known; better; gave; benefit; doubt; never; give; benefit; doubt; attractive; know; many; attractive; hvm; dropping; beware; absurdly; felt; spark; moment; seems; absurdly; attracted; course; want; attracted; attracted; literally; dropped; moment; looked; incredibly; intense; romantic; moment; deny; felt; like; something; romantic; comedy; good; true; probably; narcissist; dangerous; specific; look; woman; make; feel; seduced; narcissistic; stare; careful; physical; fast; kiss; quickly; first; date; case; said; looked; much; beautiful; person; said; looked; much; handsome; person; said; mind; need; gave; light; kiss; lip; found; endearing; looking; retrospectively; flag; everywhere; good; kisser; good; kisser; physical; contact; feel; addictive; good; handle; beware; hvm; know; kiss; experienced; fuckboy; first; date; pretend; hvm; mention; drive; home; feel; safe; around; give; polite; goodnight; kiss; sexual; innuendo; involved; text; soon; get; home; telling; amazing; night; eager; meet; schedule; next; date; felt; like; finally; hvm; sign; fuckboy; love; bombing; continues; next; day; texting; time; send; video; picture; song; like; time; know; every; single; detail; schedule; activity; soon; feel; like; head; heel; mention; detail; first; date; saying; amazing; gorgeous; best; first; date; lifetime; go; hvm; want; scare; seeming; eager; desperate; make; sext; major; flag; happens; block; bastard; mistake; tried; make; sext; course; refused; never; sext; problem; said; want; talk; thing; soon; block; immediately; attracted; thought; many; hvm; quality; blocked; clear; sign; lvm; second; date; following; step; sign; fuckboy; date; movie; guy; make; dinner; involved; movie; perhaps; coffee; effort; second; date; smaller; first; date; dinner; date; movie; coffee; netflix; chill; still; pretending; boyfriend; material; flirtatious; pushy; sexually; speaking; make; talk; give; clear; sign; immaturity; perhaps; close; mother; give; sign; emotional; unavailability; show; manchild; need; constant; validation; asks; thing; like; look; good; find; attractive; beware; told; friend; said; looked; like; famous; actor; asked; think; look; like; found; absurdly; attention; grabbing; ridiculous; second; date; mention; perhaps; date; know; inevitably; happen; case; asked; weekend; trip; countryside; watch; movie; relax; told; ready; would; happen; really; trusted; make; clear; relationship; second; date; tried; make; countryside; told; would; happen; really; trusted; tried; subtle; want; scare; mentioning; need; relationship; soon; thought; clue; thought; build; enough; emotional; intimacy; eventually; want; become; exclusive; strategy; wrong; minute; said; wanted; felt; safe; trusted; started; fake; intimacy; like; wanted; facetime; every; evening; would; talk; hour; saying; loved; talking; adored; found; amazing; attracted; fell; thought; really; real; emotional; connection; based; experience; made; post; never; give; emotional; support; boyfriend; read; reddit; femaledatingstrategy; comment; qqukmx; dont; waste; time; giving; emotional; support; realize; manipulating; wanted; feel; safe; trust; enough; saying; want; exclusive; committed; relationship; always; weedout; player; lvw; case; third; date; happened; steamy; makeout; session; pleasant; asked; wanted; place; refused; since; pretending; hvm; freak; seemed; understanding; night; taken; home; texted; told; much; desired; much; wanted; realized; tell; real; boundary; called; told; want; committed; exclusive; relationship; told; agree; understand; pressure; relationship; fake; hvm; value; always; pretend; understand; boundary; said; okay; hurry; loving; know; better; want; right; fine; wait; tell; think; finally; found; bluffing; fake; hvm; never; clear; intention; used; looking; relationship; open; idea; truly; want; find; girlfriend; explicit; want; serious; relationship; anything; different; start; pulling; away; know; boundary; fuckboy; tell; committed; exclusive; relationship; start; pulling; away; fuckboy; matter; understanding; seemed; overthink; anything; wrong; sign; thing; thing; start; pull; away; slow; fade; remember; pretend; hvm; never; ghost; abruptly; slow; fade; le; affectionate; text; still; talk; keep; backburner; conversation; shorter; name; babe; clear; sign; stop; asking; suddenly; care; healthy; sick; dead; alive; asking; question; stop; sending; video; song; eventually; stop; texting; altogether; moment; pull; away; contact; circumstance; hvm; text; know; touch; beginning; knew; celebrate; dodged; bullet; strong; standard; principle; scared; away; fuckboy; want; fuckboy; repellent; overthink; pull; away; anything; said; pull; away; like; enough; trust; found; super; attractive; interesting; much; willing; play; fictional; character; order; pant; disappeared; realized; manipulate; leave; mediocre; worthless; left; realized; super; hvw; value; woman; played; block; fortunately,-1,
qu01wh,fairywakes,sister; publicly; actively; supporting; overturn; wade; would; sooner; back; kitchen; barefoot; pregnant; recognize; human; choice; protect; right,,6430,opinion; ixtreme; diys; overturned; federal; tion; opinion; hugh; hewitt
qu006d,Noogirl,anyone; else; find; shocked; sometimes; judgement; made; woman; thought; really; knew,lovely; woman; nail; someone; known; year; apart; covid; seen; every; week; time; lot; closest; friend; always; really; talk; anything; everything; dating; time; often; asks; advice; seeing; month; exclusive; going; completely; fine; different; country; culture; generally; revere; woman; commit; commit; happy; respect; consideration; different; guy; dated; chatting; said; told; woman; dating; said; accept; screamed; mentioned; notion; consent; horrified; said; really; rape; would; fuck; would; surprised; said; label; feminist; know; super; strong; shocked; beyond; word,-1,
qtzzz3,MissCandid,tiktok; universal; help; signal; good; intention; help; think; could; dangerous; girl; supposed; help,,6431,peco
qtzcrx,Reluctant-Hermit,dealbreakers; flag; profession,,-1,
qtz4i9,thepsychopathhunter,splitting; check; feminist; pickmes; think,,-1,
qtz1c9,Fluorescence,impressed; post; tragedy; heterosexuality; wanted; share; example; good; relationship,think; couple; john; lennon; yoko; guy; read; realized; seemed; posse; respect; moving; direction; hope; guy; enjoy; watching; video; youtube; reading; obviously; much; link,-1,
qtyz4j,puma_sun,thought; boudoir; photo; shoot,someone; flit; confident; insecure; next; come; physical; appearance; call; ugly; neither; drop; dead; gorgeous; think; average; hard; like; jewelry; nice; form; fitting; clothes; look; pretty; rather; unflattering; husband; think; beautiful; time; share; everything; except; occasional; insecurity; concerned; come; look; super; confident; like; keep; like; work; heard; boudoir; shoot; extreme; confidence; booster; many; woman; term; physical; appearance; heard; woman; photo; shoot; transformational; experience; differently; afterwards; thinking; venture; element; sexual; objectification; woman; give; album; boudoir; shoot; plan; gifting; husband; feel; better; thinking; asking; photographer; modify; shoot; classy; dress; sexy; suit; instead; given; extreme; aversion; sexual; objectification; rightly; stance; boudoir; shoot; hand; help; confidence; hand; sexually; objectifying; thought,-1,
qtyykt,cdorb,lv; value; angry; wife; year; shes; real; human; pornstar,,-1,
qtyxz7,serilda2020,update; needing; support; leave; boyfriend,moved; absolutely; heart; broken; know; though; know; probably; best; make; easier; want; feeling; away; feel; broken,-1,
qty7pe,LallieDoo,marriage; always; good; idea; woman; asset,inspired; another; thread; taylor; swift; married; think; marriage; smart; choice; woman; good; career; high; salary; good; financial; asset; investment; real; estate; seems; risky; financially; knowing; full; child; split; real; possibility; left; childcare; possibly; providing; child; financially; know; answer; carefully; heard; story; pretended; year; dropping; mask; never; sure; think,-1,
qtxxtr,Didyoumissmerecoil,future; hormone; therapy,,-1,
qtxh1x,voltairehair,curved; giving; second; chance,,-1,
qtxgkz,Shoddy-Try4,want; send; final; word,,-1,
qtxfc9,randomdazee,wish; easier; block; nvm; lvm; family,lady; currently; struggling; family; issue; caused; legitimate; nvm; related; wish; easier; tie; issue; blocking; deleting; love; interest; first; sign; flag; reason; family; make; many; excuse; think; thing; going; change; advice; making; easier; lvm; family; success; story,-1,
qtxdjw,Lilith_314,wording; tell; someone; want; exclusive,,-1,
qtwoz4,techschool_nightmare,protection; benevolent; sexism; vetting; strategy,situation; overcharged; checkout; counter; store; total; cost; item; male; companion; verbalizes; error; good; right; fast; noticed; error; right; away; decide; time; peace; important; holding; people; behind; potentially; ruining; cashier; work; shift; customer; complaint; decided; requested; male; companion; situation; want; call; manager; issue; fund; walk; away; irritated; desire; money; ignored; couple; layer; think; important; outline; vetting; partner; romantic; someone; exactly; benevolent; sexism; feel; like; someone; back; rooted; belief; unable; watch; back; specific; situation; could; exacerbated; feeling; money; owns; money; simply; incapable; handling; customer; complaint; situation; appropriately; cheap; none; good; ultimate; goal; partner; protective; interest; like; protects; respecting; ultimate; decider; life; large; small; thing; living; consequence; choice; instance; benevolent; sexism; combined; feel; romantic; partner; confuse; protective; behavior; making; suggestion; according; eating; considers; healthy; vetting; strategy; tell; open; anything; shop; cook; fit; diet; plan; side; seat; driving; know; direction; place; point; turn; reminds; speed; limit; blind; spot; vetting; strategy; gray; rock; continue; helpful; recognize; error; price; make; clothes; know; good; quality; cheaper; vetting; strategy; none; allowed; live; level; provided; without; guilt; justification; lady; example,-1,
