post_id,author,title,body,image,image description
qz6mt7,Thereismorethanthis,reached; point; life; advise; child; free; friend; procreate; exhibit,,6363,peco
qz6eep,Feministtiktok,make; account; rejoin,want; afraid; hard; back; screening; process; wanted; restart,-1,
qz69ug,manabouttownta,truly; love; subreddit; stand,,-1,
qz5yt3,aliquellier,really; know; charming,,6364,think; fucking; hoping; boring; actually; feel; dancing; maybe; karaoke; matter
qz5ykp,InfiniteAnteater7,make; literally; everything,,-1,
qz52fn,wolfshadow1995,lv; high; flirting; woman; outside; marriage,recently; went; highschool; followed; social; medium; spoken; probably; year; close; friend; back; thought; sure; accept; request; almost; immediately; heart; eye; selfie; posted; earlier; story; sends; fire; flame; emoji; ignored; hour; later; slide; asking; remember; take; look; profile; remember; quite; attractive; married; baby; month; felt; icky; though; engaged; back; wanted; respond; something; family; figured; point; dude; accepted; follow; back; request; clearly; knew; able; many; photo; wife; pregnancy; announcement; conclusion; likely; type; shit; often; assumes; point; trying; hide; marriage; family; probably; miss; single; get; sick; boost; flirting; woman; emotional; cheating; thing; never; physical; kind; fuckery; make; wonder; ever; able; trust; obviously; know; sure; would; willing; wife; idea; making; mistake; turning; blind; know; like; beginning; looked; photo; married; year; look; crazy; beautiful; wife; know; nothing; never; situation; feel; distrustful; ever,-1,
qz4ow5,confusedwithlife20,scrotes; come; back,,-1,
qz4oui,kelz27one,dated; year; communicated; since; woman; sent,,-1,
qz44sh,gecko3040,hate; waiting; around; want; fish; around; much; possible; take; want; thought,,-1,
qz3krg,woah_buddy46,jesus; displeased,,-1,
qz3jen,woah_buddy46,nice; cock,,6365,
qz3ib9,woah_buddy46,cant; stand,,-1,
qz3fqi,kinda-embarrasing,shawn; mendes; dumped; camilla; cabello; called; relationship; stale; complacent; happened; conveniently; gained; weight; publicly; spoke; cellulite; stretch; mark; coincidence,,-1,
qz3akd,PrincessPeachyKeen80,woman; trying; tear; telling; wrong,,6366,peco
qz3879,Vmchik,asking; coffee; date; care; safety; convenience,heard; excuse; woman; intent; going; coffee; date; want; able; leave; anytime; quick; casual; dinner; date; much; pressure; expect; pay; dinner; excuse; pure; simple; sentence; asking; coffee; want; cheap; easy; reason; cost; assuming; coffee; waste; minute; beautiful; woman; time; believe; right; intention; date; thinking; possibility; relationship; praying; either; home; glad; keep; offering; le; effort; cheap; date; either; ghost; scenario; lose; lose; never; accept; coffee; drink; date; imagine; getting; take; woman; price; short; drive; coffee; make; think; decide; step; start; asking; real; date; future; fact; audacity; date; mean; lukewarm; begin; stop; thinking; think; like; realize; need; inconvenient; possible; weedout; lukewarm; stop; cheap; easy; date,-1,
qz35db,GabbaG0ul,society; teach; woman; girl; idealize; romantic; situation,great; benefit; patriarchy; capitalism; woman; enter; remain; relationship; stated; many; time; marriage; benefit; woman; capitalism; relies; woman; unpaid; domestic; biological; labor; believe; taught; idealize; partner; romantic; situation; benefit; realized; realized; occurred; every; stage; life; remember; boy; boy; maybe; like; almost; every; piece; medium; targeted; girl; romance; girl; actively; socialized; crush; bizarre; adulthood; really; ramp; many; woman; know; gaslight; believing; nvm; cheating; husband; faithful; happen; vacuum; master; manipulator; arguing; saying; society; laid; groundwork; woman; jump; opportunity; explain; away; flag; relationship; people; criticize; suspecting; partner; cheating; moral; failing; woman; suspicious; partner; shady; behavior; come; cheap; le; effort; date; framed; quaint; quirky; romantic; framed; really; le; effort; attempt; getting; laid; come; many; woman; tell; brutal; breakup; story; follow; great; want; anyone; getting; wrong; impression; could; keep; going; would; book,-1,
qz2acq,Wise-Ad-2103,today; spirituality; drawing; destiny; soulemate; would; like; comment,,-1,
qz1mcw,arnezuara,lv; recruit; woman; nice; caring; friend; cover; degradation; cheating; behind; back,forget; vile; manipulative; tricky; utilize; exploit; anyone; serve; best; benefit; especially; pickme; girl; friend; acquaintance; dating; allegedly; female; friend; ensure; woman; social; circle; woman; friend; bring; around; pickme; woman; hate; gut; chosen; nice; face; anything; compromise; safety; post; breakup; realized; intuition; correct; almost; everyone; friend; group; including; friend; actively; played; jealousy; game; never; guard; matter; nice; good; anyone; seems,-1,
qz1jza,otter_bott,ready; interested,,-1,
qz17uf,arnezuara,never; reveal; belief; system; value; moral; early; stage; courtship,gracefully; avoid; response; regard; thought; infidelity; divorce; keep; moral; value; standard; lv; happens; find; mirror; deceive; play; decisive; good; character; everything; right; without; needing; know; thought; controversial; topic; save; time; unnecessary; stress,-1,
qz130e,arnezuara,spot; avoid; lv; wild,,-1,
qz11z2,arnezuara,spot; avoid; lv; wild,,-1,
qz0xh8,arnezuara,spot; handle; avoid; user; wild,,-1,
qz0lxf,FeministJones98,bottom; surgery; anything; happen,,-1,
qz0evw,Phoenix__Rising2018,clapping; back,kind; revolting; positive; attention; woman; negative; attention; substantiate; existence; female; attention; hurt; upset; look; zero; expression; turn; around; walk; away; like; nothing; happened; ignored; thing; anger; nothing; without; female; attention; desperate,-1,
qz0aov,chamomilepill,stance; dating; disabled,,-1,
qz03z1,DaisyCat2001,size; small; poll,view; poll; reddit; poll,-1,
qz01zf,iacint,friend; woman; bear; burden,,-1,
qyzkgy,No-Today-7595,poopoo,,-1,
qyz066,kolsen92,patience,,-1,
qyybv9,Danzanza,found; facebook; showing; stand; woman; deserve; equal; maybe; critical; thinking; skill,,-1,
qyxip1,The_Oracle_of_Delphi,negs; find; turn; back,elderly; male; neighbor; country; always; find; belittle; outright; bully; woman; started; spending; thanksgiving; alone; spend; holiday; alone; would; laughed; nervously; felt; compelled; explain; looked; turn; back; around; would; stammering; explaining; teach; lesson; stick; going; town; holiday; going; away; staying; staying; going; away; christmas; went; long; defensive; explanation; usually; come; visit; least; something; holiday; take; power; away; make; feel; small; please; smile; smooth; awkward; situation; confirm; belief; weak; superior; instead; step; right; engage; looking; gain; upper; hand; want; turn; simple; conversation; dominance; game; look; opportunity; dominant; submissive; since; started; feeling; better; able; deal; many; crappy; people; life; offer; find; usually; treat; respectfully; place; cycle; repeat,-1,
qyxi6z,baileyt1993,lv; friend,,-1,
qyxe4d,Lost_Kale90,anyone; else; become; disillusioned; male; friend,male; friend; many; realized; really; friend; still; belief; woman; different; open; minded; difference; though; think; male; friend; today; better; one; year; still; show; entitlement; lack; humanity; little; thing; total; turn; need; open; minded; definitely; since; finding; almost; year; little; effort; dating; endeavor; much; better; woman; whole; including; including; woman; pursue; feel; unlikely; ever; state; absolutely; friend; definitely; keeping; distance,-1,
qyxboe,katiekat0214,tragedy; heterosexuality; question,,-1,
qyx78x,jaycat420,first; time; poster; longtime; reader; feel; help; bare; minimum; love; like; reason; thing; romantic; crisp; convinced; showing; love; love; hear; thought,,-1,
qyx6u3,springlockman,dream; mask,,-1,
qyx6n0,springlockman,announcement; make,,-1,
qyx6je,springlockman,trolled,,-1,
qyx31r,jaycat420,reading; article; katherine; particularly; chosen; fact; help; relate; basic; crisp; form; complimentary; love; reading; page; realized; would; accepted; someone; like; best; could; thought,,-1,
qywzg1,coursesand,communicating; first; date; pickme,last; year; become; occasionally; faltered; matter; stray; learn; hard; matter; critic; adjusted; approach; dating; life; le; stressful; however; realized; something; sure; want; feedback; date; enjoyed; always; text; afterwards; thank; dinner; great; time; would; love; feel; extremely; rude; saying; anything; afterwards; everything; expect; feel; strongly; thanking; meal; honest; intention; another; date; point; feel; good; knowing; ball; court; anything; back; wait; continue; conversation; made; clear; give; day; make; plan; first; date; nothing; done; excuse; know; felt; went; date; friday; thing; first; time; questioned; right; move; said; nothing; would; feel; rude; maybe; better; need; initiating; contacting; maybe; texting; pickme; behavior; thought; good; politely; upfront; expectation; want; frequent; date; assertive; outspoken; life; reeling; dating; difficult; time; love; hear; handle; post; date; communication; better; thanks,-1,
qywyrp,pyrophospho,woman; ever; enjoy; like; peace,,-1,
qyww0f,Bikkie5233,importance; political; belief,important; political; stance; much; different; would; accept; think; differently; something; relatively; insignificant; many; people; would; probably; willing; accept; something; sensitive; like; abortion; vetting; couple; month; thing; bother; liberal; extremely; conservative; catholic; point; differing; view; dealbreaker,-1,
qywpvi,shaezamm,acrobatic; poor; wife; still; good; enough; hypocritical; idiot; reposting,,-1,
qywhvk,dogeatpawworld,amazing; response; woman; prepositioned; lvm; side; piece,,-1,
qywg9h,mrscuntiness,katherine; ryan; glitter; room; netflix,,-1,
qywdhb,ADDELS_CARES,free; presentation; discover; secret; obsession,,-1,
qyvyki,oi_oi_oink,objectification; suddenly; becomes; fine; paying,,6367,pokimane; blurring; foot; people; screenshot; blur; foot; share; award; best; comment; categorize; post; award; make; money; boy; point; letting; people; free; reply
qyvsfy,daisyjackxxx,opposite; rape; culture; nurturance; culture; nora; samaran; think; article,,-1,
qyvlr8,shaezamm,wife; literally; becomes; acrobat; pretending; enjoy; awful; husband; response,,-1,
qyv63i,stopfatshamingwomen,asshole; boyfriend; broke,,-1,
qyv11y,reddit_is_real_bad,best; example; celebrity,talk; lvm; celebs; famous; appreciate,-1,
qyuitn,Chezhire-Cat,online; dating; advice; tip,,-1,
qyuefh,Frogspocket,sickness; health; must; fine; print; clause; say; something; like; except; menopause; course; many; abandon; wife; middle; astounding,sexual; appetite; main; reason; hesitant; married; know; cancer; stats; substantial; amount; leave; sick; wife; look; past; abysmal; statistic; believe; type; would; stick; around; might; delusional; part; point; suspend; disbelief; enough; scared; completely; menopause; another; test; marriage; fail; stage; life; know; older; single; woman; going; menopause; fine; natural; scary; joke; answer; question; younger; woman; work; told; different; everyone; maybe; lucky; swears; reason; single; married; woman; one; seem; really; suffer; menopause; continue; suffer; divorced; exactly; fact; common; love; story; couple; get; married; late; early; good; marriage; best; friend; loving; couple; healthy; life; nosedive; menopause; affect; desire; start; hating; cheat; point; either; stick; side; forgives; become; percent; happy; marriage; survive; file; becomes; woman; initiate; statistic; mean; woman; paperwork; course; time; reason; divorce; husband; abandoned; affair; emotionally; abandoned; sickness; know; menopause; sickness; natural; eye; definitely; could; good; least; year; happiness; marriage; woman; time; stress; pain; chaos; seem; like; worthy; trade; especially; compare; single; woman; thriving; married; inevitable; hopeful; takeaway; maybe; intimacy; compatibility; important; sexual; compatibility,-1,
qyu7v6,fireforestfairy,much; talent; world; lost; sexism,historically; woman; denied; opportunity; pursue; higher; education; sexism; still; happens; part; world; think; much; talent; world; lost; sexism; woman; denied; chance; pursue; higher; education; could; become; brilliant; scientist; inventor; doctor; pilot; world; would; different; place; sexism; exist,-1,
qytvum,cicerii,respect; settle; know,,-1,
qytndj,_xyoungbellax_,stalker; constantly; copy; paste; comment; infiltrate; terrifying; notice; last; post,,6368,peco
qysjx6,JadedJadefromspace,testing; sexual; compatibility; bullshit; woman; response; always; great; idea; show; compatible; proving; reliably; least; dozen; time; without; dick; involved,,-1,
qysjwv,nodisappointMENtpls,little; respect; want; date; woman,,-1,
qysc0s,TitaniumSoulWarrior,found; folder; photo; thousand,,-1,
qyrrko,Niceiceniceice,female; incel,,-1,
qyrq3t,Helpimnotindanger,male; deprivation,,-1,
qyrozy,thrway01010,thought; taste; music; indicated; compatibility; always; flattered; proud; guy; impressed; genre; band; like; facepalm,,-1,
qyr6ym,nodisappointMENtpls,expect; woman; treat; woman,,-1,
qyr2cv,-Pollyanna-,relationship; issue,,-1,
qyr11p,JR122109,,view; poll; reddit; poll,-1,
qyqdlx,SupremeMemeBrowser,excuse; mind; telling; fuck,,-1,
qypqai,Annual-Ad-531,girlfriend; look; like; nightmare; inclined; trust; girl; friend; person; dating; wrong; would,,6369,girlfriend; friend; kissed; threatening; tell; something; else; anything; really; know; kissed; hallway; friend; house; drinking; last; night; girlfriend; barely; getting; work; freaked; said; tell; said; tell; pushed; kiss; grope; looked; completely; serious; tried; worse; believe; since; hallway; everyone; else; downstairs; feel; tell; anything; still; thinking; next; morning; want; honest; pest; friend; scared; going; blame
qyn6ge,Khentiamentiu42,posted; reddit; made; smile; hell,,6370,mademesmile; mightybowling; sweetest; thing; someone; femi; factor; iamfemifactor; sweetest; thing; someone; ever; done; chick; summerdchick; replying; iamfemifactor; chemo; treatment; neighbor; came; brought; dinner; husband; stayed; several; day; talk; made; sure; assist; sick; never; asked; could; help; expects; nothing; love; caas; tic
qyn4jf,_xyoungbellax_,seen; disgusting; serial; dater; like; pete; davidson,get; serious; go; extent; getting; engaged; immediately; dump; cycle; definition; pathetic; narcissistic; loser; lady; think; potential; love; interest; early; subtle; would; describe; ex; first; case; could; would; hardly; second; matter; pride; parade; list; romantic; sexual; partner; list; partner; much; time; nothing; scream; flag; sort; stability; life; relationship; stability; indicates; aspect; life; mean; deep; rooted; mental; health; issue,-1,
qymtwb,I_Boil_Dogs_Alive,check; cool; picture; wizard; found; online,,6371,peco
qymiqg,kansascityoctopus,audacity; would; almost; hurt; feeling; worth; remembering,,-1,
qymhe7,kansascityoctopus,audacity; would; hurt; feeling; could; remember,,-1,
qymccm,pheelQC,happy; men,,6372,international; november; suicide; homeless; homicide; victim; domestic; abuse; victim; majority; victim; viclent; crime; average; serve; longer; prison; average; likely; imprisoned; woman; committed; crime; eiexel; lego
qym7h1,FlyingHamster13,genuine; question,,-1,
qylxom,manlet-studentcel,,,6373,
qylqng,Big-Effective1016,lmao; femcel; subreddit,,-1,
qylgm6,mordexfan12345,dude; know; girl; ofcourse,,6374,
qyle8b,maddieinretrograde,unpopular; opinion; subgroup; toxic,,-1,
qykyje,Lost_Kale90,incredible; book; tragedy; heterosexuality; jane; ward,someone; recommended; book; flu; third; amazing; author; analyzes; straight; culture; harmful; straight; woman; note; read; author; talk; historically; white; power; woman; subordinate; woman; often; sold; raped; used; labor; point; someone; decided; would; better; white; power; woman; like; switch; woman; degraded; subordinate; woman; worthy; deep; love; rocky; author; start; woman; like; little; nothing; common; find; attractive; quite; contrary; repulsed; cared; getting; esteem; loving; woman; much; whole; propaganda; started; woman; together; early; pamphlet; given; help; woman; improve; attractiveness; hygiene; hope; like; quickly; switched; responsibility; heterosexuality; repair; woman; propaganda; book; show; movie; pushed; midcentury; representation; marriage; doubled; earlier; theme; opposite; disinterest; resentment; suggesting; woman; body; personality; needed; carefully; managed; order; produce; happy; heterosexuality; expert; elaborated; expectation; good; wife; woman; submission; self; sacrifice; became; central; ingredient; straight; culture; woman; warned; must; give; order; keep; job; interest; desire; adult; conversation; selfhood; straight; culture; marked; fragility; irritation; pervasive; sense; burden; loss; entrapment; advertiser; learned; capitalize; heterosexual; tragedy; creating; played; desire; freedom; power; woman; woman; desire; attractive; interesting; husband; author; recognized; million; woman; become; addicted; unstable; immature; angry; cold; abusive; woman; love; much; robin; norwood; became; best; seller; casual; managing; disappointment; heterosexuality; author; talk; actually; hate; woman; violence; coercion; perpetrated; towards; woman; struggle; woman; personhood; false; narrative; love; woman; propaganda; pushed; strive; much; quote; everything; highly; recommend,-1,
qykg66,hexriot2001,must,,-1,
qyk3x2,thyroidcrp,reread; handbook; refer; dating; work,,-1,
qyjruk,AdCalm6510,,,-1,
qyjfnt,edwardianemerald,tech; bos; venture; capitalist; michael; goguen; kept; spreadsheet; woman; slept,goguen; billionaire; venture; capitalist; tech; kept; woman; secret; house; throughout; nevada; california; according; recent; lawsuit; filed; montana; woman; stated; lawsuit; brought; goguen; would; make; strip; various; house; bought; security; staff; four; employee; goguen; provided; statement; lawsuit; including; business; basement; boom; boom; room; woman; sexually; assaulted; goguen; dabbled; tech; investment; background; electrical; engineering; first; wife; gave; first; child; followed; california; massachusetts; help; career; divorced; married; second; wife; woman; goguen; sleeping; exotic; dancer; waitress; amber; baptiste; filed; claim; goguen; claiming; given; received; million; restitution; goguen; worried; would; discus; many; affair; wife; business; associate; montana; california; baptiste; problematic; figure; made; entire; thing; goguen; give; std; however; goguen; nefarious; activity; work; beyond; merit; handed; employee; groping; giving; alcohol; cocaine; sign; afterwards; security; staff; claim; goguen; asked; purchase; residence; woman; could; stirp; goguen; without; others; knowing; security; enforcer; goguen; claim; goguen; asked; participate; paramilitary; expedition; mexico; related; drug; running; across; mexico; border; lady; important; remember; material; wealth; spiritual; emotional; wealth; goguen; billionaire; mean; female; attention; many; woman; object; keep; enumerated; excel; spreadsheet; goguen; aware; speak; helping; woman; line; baptiste; spoken; goguen; would; woman; courage; know; baptiste; made; stuff; inappropriate; activity; happen; anywhere; workplace; safe; inappropriate; activity; tech; bos; kept; list; woman; slept; spreadsheet; daily; star; dailystar; news; world; news; tech; bos; kept; list,-1,
qyj6it,ahgarf01,bitch; shoppin,,-1,
qyj133,NiceForWhat22,provider; mean; woman; high; powered; highly; paid; career; find; provider,,-1,
qyir1a,Secretsquirrelaccnt,boundary; standard,,6375,boundary; boundary; designed; keep; self; love; intact; prevent; manipulated; used; violated; last; minute; date; call; netflix; chill; cates; commntment; iwill; tolerate; vernal; abuse; iwill; date; anyore; sulin; relationship; someore; dell; play; tole; mother; relationship; iwill; date; someone; disrespect; iwill; chase; anyone; love; affection; attenton; iwill; pursue; anyone; emotionally; unavailable; standard; standard; quality; must; present; agree; entertain; someone; romantically; must; gasics; pace; aple; port; must; bein; cancer; trey; enjoy; catleesdrive; date; must; demunstote; integnty; sama; ecord; drug; eerotiorally; physica; snanrcieiy; vealthy; intraspectye; understands; manage; walling; work; towards; best; version; open; becaming; consc; working; ther; issue; shadow; work
qyifcq,Onironiab,friend; dating; nvm,,-1,
qyib8x,VWII,,,-1,
qyi8a3,techschool_nightmare,woman; achieves; society; make; movie; father,imdb; title; imdb; title; everyone; need; explore; people; made; versus; male; athlete; unquestioned; believed; done,-1,
qyhprm,NannuhBannan,underestimate; obsession; bruised,hermiticalykermit; wrote; great; post; reddit; femaledatingstrategy; comment; safety; tip; internet; internet; safety; want; magnify; thing; particular; said; underestimate; obsession; bruised; read; true; crime; trope; seen; several; time; almost; homicide; tied; three; motif; love; money; pride; probably; remember; recent; post; perk; wherein; orgasm; imagine; vitriol; thrown; around; would; notification; trying; comment; could; wrote; auto; filter; pulled; scrote; wrote; used; strategy; make; lot; woman; fall; love; dumping; back; college; terrible; linked; youtube; channel; reddit; profile; naturally; looked; like; blobfish; tempted; edit; post; could; laugh; kind; ugly; shithead; love; hate; woman; better; judgment; took; lashed; underestimate; obsession; bruised; fear; woman; laugh; woman; fear; kill; risk; stalked; harassed; physically; endangered; felt; need; place; worth; worth; risking; safety; block; effective; exist; know; simply; getting; message; rather; reading; ignoring; keep; safer; give; scrotes; power; engage; acknowledging; stupidity; clapping; back; give; weight; word; action; fuck; care; change; learn; spot; mile; away; avoid; floating; shit; cloud; much; easier; psychologically; safer; physically; please; smart; stay; safe; internet; truly; wild; west,-1,
qyh9kj,PinkestMango,gomez; addams,,6376,basic; banshee; moonwaningcrescent; would; gomez; addams; treat; answer; move; situation; natural; blue; morticia; would; ever; treat; answer; move; patchworkheart; addams; would; behave; best; make; sure; treatecl; fairly; love; sensicalabsurdities; except; maybe; sibling; relationship; wecinesday; like; guillotine; brother; ozzyozmcozman; sibling
qyh5dx,vucinal,dark; triad; woman,hello; year; group; called; dark; triad; woman; made; someone; wondering; group; similar; somewhere; seem; find; guessing; changed; name; hidden,-1,
qyh22d,baileyt1993,lv; friend; help,,-1,
qyfkzr,thiccoranges,civil; discussion; member; subreddit,,-1,
qyfdiu,europoor24,thank; support; regard; sexual; coercion; story,posted; couple; week; story; tricked; abusive; painful; consenting; thought; normal; used; stand; scrotes; foaming; mouth; take; responsability; another; subreddit; really; appreciate; support; received; tearing; much; support; life; feel; like; support; network; know; ever; lovely; thank; sure; flair; faced; struggle; life; form; support; network; nice,-1,
qyf03j,REcheSVP,keep; friend; safe,,6377,peco
qye963,Iresearchfun,seeking; advice; best; friend; wnats; marry; help,,-1,
qye8d7,_Cosmo0,trans; right,,-1,
qye6hx,ReachAdministrative1,seeking; advice; female; friend; date; want; marry; help,,-1,
qobc1a,pixie_idk,finally; putting; play,,-1,
qob0sv,cat_lio,think; intimidating; good; thing,drunk; told; find; intimidating; careful; around; thing; work; noticed; lvm; never; disrespected; work; colleague; told; give; intimidating; energy; noticed; colleague; careful; around; therefore; never; disrespected; thing; like; intimidating; always; take; compliment; would; like; thought; cause; feel; like; something; think; need; little; intimidated; behave; disrespect; apply; hvm,-1,
qoaeft,jennifer0210,finding; partner; whole; identity; love; order; love; others,,6378,peco
qoa1ha,GabbaG0ul,hide; daughter; fianc; entire; duration; relationship; either; trying; separate; family; trying; trap; supporting; daughter; something; malicious; play,,-1,
qo9sf2,helpeachotherout60,something; really; loud; closet; pickmeishas,,-1,
qo9o44,Apprehensive_Use4282,outta; friendzone,,-1,
qo9nt2,Public-Heat-57,goal; year; next; year,,-1,
qo8xgq,faultierin,vile,pedos; looking; babysitter; earn; money; study; posted; local; craigslist; long; time; woman; send; message; looking; babysitter; stay; overnight; daughter; going; business; trip; flag; young; naive; sends; message; daughter; need; help; taking; bath; said; eating; pedo; really; angry; say; going; help; bathing; like; say; vaginal; infection; would; cream; inside; vagina; year; went; still; sometimes; think; vile; disguisting; pas; everyday; street; know; internet,-1,
qo8ml3,edoth,needle; spiking; happened; best; friend; last; weekend; denmark; careful,,-1,
qo8kma,bagsofwine,love; language,,-1,
qo8kbu,jingks_,feel; like; reflective; people,,6379,know; fall; back; keep; quiet; le; feel; need; prove; le; choose; react; shade; keep; away; sort; drama; protect; energy; really
qo8h9i,saggy_lemons1,interesting; discussion; grooming; reinvented; repackaged; every; generation,,-1,
qo8e6x,birthdaybutt,sure; dumping; lvm,mutual; friend; though; interested; first; started; pursue; knew; seems; really; sweet; funny; educated; high; value; around; turned; wrong; course; pursued; courted; month; become; official; immediately; loses; interest; mask; slip; show; lv; value; actually; detail; ended; text; flag; pile; several; day; thing; music; festival; going; group; friend; week; little; worried; drink; want; rekindle; thing; know; drink; want; hear; festival; enjoy; time; friend; sell; ticket; avoid; awkward; spot,-1,
qo8873,Public-Heat-57,discussion; engineering; opportunity; another; post,,-1,
