post_id,author,title,body,image,image description
r58d04,outofkebabs,much; value; stay; home; wife,,6493,peco
r57yi6,Zestyclose-Round-959,need; advice,,-1,
r57xti,everythingandlove,think; ever; many; reminder; wanted; would,,-1,
r57rxv,Enigma7a,damn,,6494,peco
r57hbc,SnooMarzipans8001,please; safe; insane; literally,,-1,
r578f9,Specific-Composer300,assuming; first; time; meeting; always; flag; deal; breaker; pick; first; date,assuming; someone; matched; safety; concern; always; flag; unacceptable; able; pick; date; offer; recently; acqunatices; year; told; location; date; date; claimed; suprise; asked; picking; meeting; replied; going; school; meet; considering; cancelling; altogether; since; already; postponed; date; working; time; fetch; thing; unsure; would; taking; uber; since; moving; back; another; city; however; turn; drove; parent; tell; reason; pick; laziness; would; lady; handled; situation; cancel; tell; must; pick; offer; usually; prefer; order; test; context; date; story; postponed; relevant; whether; fetched; made; nice; beach; picnic; gave; bunch; rose; still; look; past; picking; especially; since; drive; tired; work; worked,-1,
r576hd,Specific-Composer300,assming; first; time; meeting; always; flag; pick; first; date,assuming; someone; matched; safety; concern; always; flag; unacceptable; able; pick; date; offer; recently; told; location; date; date; claimed; suprise; asked; picking; meeting; replied; going; school; meet; considering; cancelling; altogether; since; already; postponed; date; working; time; fetch; thing; unsure; would; taking; uber; since; moving; back; another; city; however; turn; drove; parent; tell; reason; pick; laziness; would; lady; handled; situation; cancel; tell; must; pick; offer; usually; prefer; order; test; context; date; story; postponed; relevant; whether; fetched; made; nice; beach; picnic; gave; bunch; rose; still; look; past; picking; especially; since; drive; tired; work; worked,-1,
r56eli,Frogspocket,woman; value; look; value; resource,wanted; unpack; another; dating; myth; woman; value; depreciating; look; resource; silly; reason; woman; highly; desired; course; beautiful; sought; handsome; sought; desperate; woman; age; body; type; chase; woman; nursing; home; spend; money; look; woman; chase; woman; running; mart; morning; wearing; sweatpants; hoodie; makeup; want; woman; kind; woman; woman; value; look; woman; second; resource; capital; anymore; definitely; used; clinging; system; served; long; time; option; financial; freedom; generation; woman; choice; seek; refuge; exchange; youth; beauty; provider; ensured; repulsive; able; lovely; wife; woman; really; ticking; clock; short; window; find; provider; day; gone; feel; fully; aware; gravity; change; third; point; response; slipping; value; unintentionally; collectively; come; form; capital; providing; validation; approval; praise; lack; praise; currency; work; pickmes; lvw; worthless; hvw; value; woman; ever; situation; practically; begging; foot; chance; upon; rejection; call; ugly; demonstration; phenomenon; desperate; attempt; grasp; power; dating; market; want; validation; mean; something; power; hold; obsessed; picking; apart; woman; scrutinizing; beautiful; banded; together; weak; attempt; power; realize; lv; value; dating; market; stuff; ultimately; silly; actual; value; dating; market; high; value; person; high; value; genderless; quality; human; power; holding; becoming; obsolete; anyway; woman; waking; tactic; like; negging; final; point; another; reminder; come; dating; partner; selection; relationship; woman; really; much; power; conditioned; believe,-1,
r55myw,Squeakendorf,sexual; issue; relationship,hoping; advice; since; general; internet; riddled; garbage; back; pick; day; shitty; sexual; experience; ranging; generally; unsatisfying; encounter; rape; finally; treated; like; trash; started; working; self; esteem; leveling; today; good; healthy; relationship; year; hvm; issue; leftover; trauma; need; help; feeling; surrounding; made; little; difficult; healthy; life; good; relationship; usually; initiate; already; thinking; immediately; feel; preyed; upon; defensive; though; never; pushed; super; respectful; noticed; sometimes; want; body; board; anywhere; near; orgasm; lead; feeling; used; though; whole; thing; idea; really; try; make; sure; sometimes; going; great; reach; orgasm; feel; dirty; sometimes; fine; sometimes; feel; gross; afterward; apparent; reason; tried; initiating; le; frequently; thinking; maybe; pushing; really; wanted; like; every; week; really; gotten; better; worth; noting; depression; flaring; lately; similar; experience; found; solution; would; love; hear; tired; feeling; weird; getting; discouraging; thank,-1,
r554kb,kassidyfrank93,initiate; follow,,-1,
r5495y,flutter17171,dating; mental; health; disorder,,-1,
r5473r,junotaylor,urgently; need; advice; deal; family; long; read,,-1,
r54224,FPPResearch,dating; covid,,-1,
qsn6go,[deleted],sexist; fuck,,-1,
qsmdq8,Lil_Boobiess,boyfriend; want; send; nude,,-1,
qslyve,Fun_Sherbet,biggest; lie; sold; woman; importance; upholding; relationship; cost,compile; info; way; myth; perpetuated; start; romanticization; grandparent; long; lasting; marriage; together; year; true; love; divorce; leaving; miserable; marriage; often; available; socially; acceptable; grandmother,-1,
qskdgu,waterbugsrcool,incredibly; lame; pathetic; pretend; know; remember,,-1,
qsk8s8,poppy03,wish; knew; younger,,-1,
qsjii9,Spittens,tired; seeing; demisexual; tossed; around; like; sort; aberrant; practice; really; healthy; want; trust; connection; intimate; partner,disclaimer; exasperated; please; forgive; liberal; italic; reality; warped; pornsick; demisexual; behavior; normal; healthy; baseline; hookup; culture; toxic; dangerous; part; consider; desire; trust; connection; becomes; possibility; entirely; reasonable; simple; self; preservation; preganancy; disease; abuse; injury; risk; nonsense; continually; would; sane; subject; blame; porn; blame; society; blame; allowing; become; fucking; warped; comprehend; scrotacity; offended; going; jump; sack; immediately; like; asking; genitals; respect; human; rant,-1,
qsjakl,chetaiswriting,promising; young; woman,,-1,
qsj91m,catastrophejr,tell; swallow; tell; swallow; period; blood,half; joking; imagine; woman; collective; went; around; fantasizing; ingesting; bodily; fluid; imagine; porn; video; million; view; titled; make; suck; used; tampon; barely; legal; choir; get; menstrual; blood; smeared; pretty; face; imagine; woman; pressured; boyfriend; drink; period; blood; directly; source; kink; kinkshame; completely; disgusting; exactly; disgusting; asked; ingest; semen; lady; worth,-1,
qsj2gn,Defiant_Marsupial123,escape; lvm,,-1,
qsiwpc,TheKindOfGirl,youtube; watch,,-1,
qsidyh,IndohyusNamedDoug,came; feed; nothing; funnier; hitting; woman; right,,-1,
qsicj3,IndohyusNamedDoug,nothing; funnier; hitting; woman; right,came; facebook; feed; yikes,-1,
qsibci,annrike1,truth,,6495,female; orgasm; elusive; unfortunately; clit; treated; like; dick; ecit; drect; ignocee
qshspt,CountingDownTheDays5,anyone; else; tired; pick; cause; sure,,-1,
qsgtq3,horeya33,found; month; outlook; dating,,-1,
qsgiug,WisteriaHysteria14,lost; attraction; normal,,-1,
qsggt1,Bekinditsfree,tired; emotional; labor; lady,queen; hope; safe; healthy; friday; dating; month; talking; stage; month; making; official; positive; negative; trait; frankly; decided; lvm; hvm; call; make; decision; recently; realized; emotional; labor; mental; health; struggle; make; effort; however; think; issue; requires; emotional; labor; really; upset; around; usually; rush; side; comfort; asks; make; feel; better; need; space; get; water; cover; blanket; already; sometimes; get; chocolate; cause; know; like; think; safe; try; best; hears; affirms; feeling; appreciate; need; almost; constant; reassuring; beat; verbally; talk; often; asks; almost; every; time; green; flag; tell; focus; occasional; panic; attack; take; deep; breath; along; prone; sudden; intense; bout; anger; sadness; never; directed; still; never; know; get; like; exhausting; tired; girl; diet; garbage; awake; thinking; night; parent; pretty; emotionally; volatile; feel; like; triggering; something; yeah; thinking; real; option; continue; somehow; stop; emotional; labor; sanity; dumphim; fuck; move,-1,
qsgds4,GlancingWillow,anyone; pickme; family; member; always; dilemma; handle,,6496,peco
qsg96s,Elitane,tired; polyamorous; folk; judgemental; towards; monogamy; need; help,,-1,
qsfxp8,Dry-Big-1914,flag,,-1,
qsfwwe,Eqvvi,yeah; want; brush; teeth; dated; brushed; teeth; kicked; puppy; breakfast,main; reason; get; much; hate; standard; dare; speak; people; standard; one; claim; lose; shit; woman; ever; dare; mention; basic; reasonable; standard; ever; people; still; attacked; dare; mention; date; people; brush; teeth; kind; feedback; going; space; outside; male; mental; health; ignored; depression; literally; satan; reason; want; unalive; ableist; condition; allow; brush; teeth; teeth; adhd; minor; thing; care; alone; cat; threaten; good; time; shallow; perfect; thing; make; imperfect; yeah; brush; teeth; serial; llers; therefore; would; dating; checkmate; atheist; last; possibly; common; think; existence; people; among; selected; group; somehow; argument; want; life; together; financially; suddenly; remind; horrible; people; wealthy; mentioning; standard; mean; stop; caring; anything; else,-1,
qsfqoa,LLP1234,cringe; topia,,-1,
qsfp8e,Dry-Big-1914,flag; reasonable; expectation,,-1,
qsep4d,PossibleCook,reminder; cool; girl; materialistic; nothing,maybe; come; culture; expected; provide; whiney; baby; money; something; always; bothered; gold; digger; bashing; widely; accepted; society; like; wrong; wanting; nice; thing; wrong; liking; money; society; literally; run; shit; apparently; nothing; wrong; expects; partner; hell; emotional; labor; house; labor; take; care; like; sort; incompetent; child; woman; expects; ring; worth; want; treated; finer; thing; life; somehow; asshole; interested; material; thing; deserves; alone; miserable; rest; day; thankfully; never; deal; type; would; whine; buying; anything; tolerate; refuse; apologize; materialistic; internet; amount; time; eventually; stumble; onto; post; poor; girl; make; clear; care; money; make; grand; declaration; materialistic; love; need; sometimes; seek; advice; people; around; understand; work; chore; proposed; year; together; kid; ring; walmart; find; ring; partner; proposed; cheap; thing; amazon; need; know; wrong; feeling; although; lord; forbid; admit; actually; hate; cheap; though; cheapness; show; clear; disrespect; go; beyond; ring; last; year; post; regarding; situation; writing; anyways; really; direction; post; aside; reminder; okay; want; nice; thing; stop; handicapping; want; fulfill; bare; minimum; trust; hvm; expect; good; thing; actually; want; give; pickme; attracts; lvm; expect; waste; money; stingy; hurl; insult; moment; anything; return; remember; lady; cool; girl; love; sign; probably; setting; underground; sorry; grammatical; error; perfectly; versed; english; language; good; spell; checking; rant,-1,
qsedax,plomerst,basis; going; date,reading; post; dating; attraction; spark; realize; spark; mostly; result; physical; attraction; fantasy; love; bombing; leaf; wondering; minimal; requirement; deciding; know; someone; thought; lady,-1,
qsdz58,seattlecharm,check; man; check; man,,-1,
qsdyqa,darkroombl0omed,robot,,-1,
qsdfni,[deleted],dating; apps,,-1,
qsd4jo,NoShift8882,talk; seinfeld,,-1,
qsd0xs,electroloop,lv; partner; specific; lingerie,something; mind; bother; anyone; else; sick; tired; partner; asking; specific; lingerie; seen; lingerie; whatever; porn; watching; earlier; whatever; instagram; model; jerking; lv; suggest; wear; lingerie; knowing; expensive; audacity; suggest; seeing; month; jerry; going; bordelle; lingerie; pander; fantasize; girl; porn; watched; earlier; forgetting; majority; woman; kind; disposable; income; engage; justify; frivolous; purchase; many; woman; buying; lingerie; set; surprise; spending; hundred; thousand; dollar; process; understand; value; lingerie; appreciate; lingerie; fact; amassed; quite; sizable; collection; year; purchased; eye; appreciate; beauty; intricacy; admire; fact; lingerie; hardest; garment; make; talked; previously; getting; lingerie; lv; gift; mainly; benefit; however; long; term; committed; relationship; getting; lingerie; addition; thoughtful; gift; acceptable; anyways; true; hvm; love; appreciate; turned; matter; wear; exclusively; wear; lingerie; usually; pornsick,-1,
qscr8m,MysteriousLife7,experienced; switcheroo; soft; ended; extorting; emotional; investment,seeing; vetting; seemed; promising; usual; lvm; trope; text; month; seeing; serious; intention; mask; slipped; blocked; armed; principle; switcheroo; still; ambushed; love; opinion; soft; get; fuck; ultimately; fake; sweetness; emotional; intelligence; month; mark; since; first; date; really; sweet; caring; attentive; since; first; date; offered; everything; actually; listened; know; love; bombed; another; felt; time; different; throughout; month; going; never; pressured; physically; never; felt; like; goal; lead; green; flag; paving; treated; felt; respected; comfortable; every; reason; believe; heading; somewhere; serious; regularly; checked; date; took; place; said; worth; eager; relationship; date; felt; assured; thought; word; action; consistent; main; bottleneck; seemed; constrained; time; date; progressed; discussed; dinner; expectation; making; time; week; keep; seeing; thing; still; looked; difficult; seemed; reluctant; saying; easy; alone; goal; difficult; someone; else; involved; seem; busy; military; schedule; go; sleep; get; could; feel; effort; waning; sensed; something; coming; intuition; right; busy; excuse; chose; life; chose; interact; hurt; process; tuesday; work; asked; confirm; plan; weekend; sent; text; saying; want; continue; busy; classic; excuse; inconsiderate; execution; wrecked; workday; altogether; actually; imply; different; people; goal; apart; great; person; focus; think; life; together; enough; relationship; pick; friend; chalked; must; reason; always; assume; best; intention; thought; fisted; excuse; benefit; doubt; benefit; doubt; sadly; often; hold; people; accountable; action; call; shitty; behavior; rampant; ending; thing; text; straight; disrespect; without; ball; tell; person; call; believe; treated; like; eventually; straight; insult; shocked; person; used; seeing; mask; slipped; coward; appeared; text; pick; choose; question; want; answer; ignore; open; confrontation; giving; actual; answer; said; would; liked; person; mean; would; liked; chose; flip; like; text; suddenly; became; obscure; vague; distant; ending; really; left; taste; mouth; tainted; memory; knew; prefer; communicate; heart; heart; mature; conversation; person; knew; discussed; thing; person; knew; want; definitely; lost; trust; blocked; right; away; style; proud; trained; could; drop; moment; always; prepared; vigilant; damn; still; taken; aback; hurt; switcheroo; lady; know; trust; anymore; learning; able; aggressively; lvm; waste; time; come; many; form; might; straight; fuck; way; case; acting; sweet; future; faking; betraying; trust; matter; genuine; tried; stay; vigilant; willing; drop; moment; show; want; make; priority; word; mean; nothing; compared; actual; effort; someone; action; story; endgame; matter; sweet; lovey; dovey; memory; ended; looking; fake; lv; male; female; friend; gaslight; thinking; asked; much; drop,-1,
qsbh1u,ta1929,trst,,-1,
qsbecr,ta1929,test,,-1,
qsaspd,awpmag,five; taylor; swift; song; shaped; youth,,-1,
qsarfi,chamomilepill,burnham; pornsick,,-1,
qsagyu,CarNo5059,lady; stop; letting; take; credit; idea; hardwork,,-1,
qsaanl,imtryingtotryhere,thump; fist; table; trying; emphasize; point,told; necessary; make; point; told; okay,-1,
qsa5uz,sendnudes1234567891,send; nude,,-1,
qs9l5u,Odd_Construction6742,hell,,6497,woman; glad; boyfriend; husband; main; hobby; videogames; never; understood; woman; complain; look; playing; videogames; completely; advantage; would; rather; practice; dangerous; hobby; like; motorcycle; spelunky; underwater; cave; diving; mountain; climbing; dirtbike; riding; skydiving; parachuting; racing; rock; fishing; greater; chance; leaving; widowed; child; fatherless; would; rather; club; bar; buddy; drink; snort; greater; chance; cheating; would; rather; videogame; console; appreciate; keep; planted; couch; danger; facing; hemorrhoid; think; share; best; comment; award; comment
qs9gjb,BasieSkanks,surefire; avoid; lvm; responsible; come; responsible; choose; entertain,difference; woman; lvm; woman; whether; boundary; standard; willingness; stick; way; increase; chance; approached; hvm; truth; matter; lvm; exist; every; social; class; lvm; shoot; shot; woman; woman; know; deserve; could; accomplished; still; broke; scrotes; nothing; going; trying; society; love; tell; woman; attracting; lvm; must; something; wrong; make; woman; responsible; shitty; behavior; reality; lvm; desperate; looking; unsuspecting; woman; leech; whilst; control; attract; control; whether; stick; around; woman; lvm; often; ignore; blazing; flag; poor; boundary; contrast; woman; avoid; lvm; maintain; boundary; standard; afraid; first; flag,-1,
qs98pq,Noemie_Mathilde,burlesque; thought,know; dating; discus; thing; body; hair; porn; female; friend; amateur; burlesque; watching; performing; went; show; audience; woman; probably; performance; originally; intended; titivate; embraced; reclaimed; woman; strip; club; atmosphere; woman; shape; size; colour; act; boardered; performance; lively; colorful; safe; space; theory; porn; become; hardcore; ubiquitous; zero; interest; burlesque; show; woman; tortured; degraded; free; phone; plus; woman; decide; want; present; cellulite; problem; saggy; boob; fine; trafficked; woman; gang; raped; camera; probably; feel; refreshing; rhinestone; prance; around; aerosmith; friend; definitely; worker,-1,
qs8shd,PinkestMango,emotional; manipulation; never; ever; think; necessary; make; feel; complete; variation; please; take; seriously; idealizes; easy; disappoint; hold; unreachable; standard; disappointed; dangerous,,6498,life; meaningless; without; life; truly
qs8pzk,Bbqchilifries,terrifying; scrote; thrift; store; try; lure; year; farm; talking; getting; injured; needing; help,,-1,
qs6fkl,ctrlcutie,song; crazy; girlfriend; wrap; thought; hypersexualization; young; woman; medium; tiktok; really; trying; pas; feminist; male; industry,,-1,
qs6aow,giadadelaurentiits,broke; learned; hard; always; block,,-1,
qs5w3g,asupernova91,taylor; swift,sure; taylor; fan; regardless; whether; listening; version; song; delight; horror; know; relationship; jake; gyllenhaal; dated; year; taylor; typical; nvm; broke; heart; show; birthday; party; overall; scrote; song; talk; relationship; releasing; album; version; longer; original; additional; lyric; stand; said; closer; maybe; would; fine; made; want; idea; never; needy; ever; loving; jewel; punchline; go; older; lover; stay; willingly; knowingly; pursuing; girl; breaking; heart; standing; birthday; party; putting; bunch; song; allegedly; talk; much; told; problem; young; needy; really; audacity; friendly; reminder; older; actively; pursuing; cause; mature; nlog; like; girl; whatever; crap; saying; nowadays; know; getaway; treating; badly; second; react; throw; face; immature; needy; emotional; feel; young; taylor; wide; eyed; naive; younger; girl; please; fooled,-1,
qs51he,dreadfulgray,facebook; group; still; believe; treat; family,,6499,greevomemba; budgeting; food; stockplig; litsahelp; pale; desperately; need; life; help; advice; regarding; partner; month; accepted; full; time; partner; agreement; prior; accepting; help; domestic; duty; lately; working; really; late; hour; always; finish; work; really; hard; really; tired; make; dinner; night; yesterday; asked; cook; night; week; hello; fresh; meal; really; easy; follow; biggest; mental; breakdown; tantrum; telling; rather; starve; cook; welcome; cook; expected; cook; week; crazy; today; still; wanting; agree; plan; giving; attitude; really; standing; ground; full; grown; adult; disability; healthy; grown; arse; adult; want; help; cooking; meal; week; chore; around; house; whole; subject; together; year; really; enough; looking; need; carer; please; help; advice; thank; advance
qs4ds5,Live-Werk-Pose,group; trip; barely; spoke; month; later,,-1,
qs4co7,jackrusselterror1,vetting; strategy; holiday; gathering,,-1,
qs4018,Agreeable-Turnip-244,weak,,-1,
qs3i60,Ok_Register9361,cute; nice; whatever; want; age; waiting; plotting; sexually; dump,,-1,
qs25nl,ned-flanderss,guy; thought; ownership; relationship,view; poll; reddit; poll,-1,
qs2504,Lilaciel,anyone; struggle; believe; hvm; exist; feel; must; build; tolerate; lv; behavior; order; never; alone,,-1,
qs11fo,alpinepunch2021,point; woman; complain; going; sheer; hilarity; ensue,,6500,group; friend; used; hang; basically; started; feud; another; friend; said; dealbreaker; want; first; date; angry; first; raising; voice; worked; started; cry; talking; understand; hard; woman; mean; sitting; waiting; done; tantrum; refused; talk; friend; started; gossiping; behind; back; eventually; ended; group; splitting; ridiculous; baby
qs0wtb,Ok-Blueberry6768,familial; relationship,,-1,
qs0l1w,MNameJeff,anything; instead; going; therapy,,-1,
qs0g7a,persistencenotp0wer,making; money; husband; high; earner,,-1,
qs09f0,Competitive_Bar8657,pickme; say; walk; park; date; better; calm; get; like; child; apparently; give; date; long; quality; date; getting,,6501,peco
qs08r2,persistencenotp0wer,making; money; boyfriend; husband; high; earner,,-1,
qrzqhm,Bleep_bloop5678,husband; suggests; stop; buying; formula; rather; cancel; month; subscription,,-1,
qrzgoz,so_i_reddit_creep,thank,,-1,
qrzcvu,TromanBallort,need; help,,6502,jerry; hoverfish; please; bring; jerry; subreddit; explore
qrz5st,whereiseastvirginia,lv; value; supreme,,6503,mobile; thursday; november; iphone; kiss; feat; listening; everywhere; arpan; pick; movie; pick; wine
qryxl0,_xyoungbellax_,innate; habit; dating; young,dating; younger; woman; something; always; normalised; throughout; history; back; ruler; king; landowner; used; marry; girl; child; something; older; poor; kid; case; grandfather; woman; girl; choice; abject; financial; crisis; present; still; modernized; subtle; number; clich; woman; certain; choice; day; still; decide; scrotes; woke; hashtag; love; matter; deep; rooted; issue; still; present; always; going; want; dominate; woman; going; instill; fear; within; regarding; physical; mental; emotional; sexual; educational; financial; wellness; always; lookout; opportunity; take; advantage; something; keep; mind; vetting; talk; vetting; ruthlessly; mean; leave; first; sign; flag; negotiable; start; defending; act; making; excuse; behalf; double; thinking; giving; another; opportunity; exploit; truth; always; going; stay; hundred; year; line; going; change; ever,-1,
qryr14,A_crotchety_coconut,therapy; hire; worker; instead,,6504,askreddtt; mejagger; stripper; reddit; whats; weirdest; story; working; scau; mele; amayax; escort; instead; stripper; would; take; restaurant; every; month; always; requested; would; nothing; else; involved; stripping; touching; sitting; hour; wanted; dress; like; would; normal; night; massive; stutter; much; single; sentence; could; take; minute; pronounce; normally; would; always; speak; writing; thing; people; never; patience; listen; wanted; someone; actually; talk; mentioned; seventh; escort; others; refused; multiple; time; left; kept; touch; still; every; almost; year; later; call; often; though; longer; someone; talk; stutter; massively; improved
qryb5l,mirmir900,spot; repel; pedophile,,-1,
qrxdup,iggypiggyfiggy,green; flag; seeing; stayed; help; study; night; cancelled; date; wanted; would,,-1,
qrws18,peacockstrutt,anyone; show; called; spreadsheet,,-1,
qrwfly,WitLibrary,subtle; flag,,-1,
qrv5n0,chamomilepill,learn; sabrina; dahri; walk; away; argument,,-1,
qrv1jw,Squirrel-Suspicious,first; date; boundary; casual; dating,apology; length; thank; advance; summer; reached; know; never; passing; year; college; knew; would; moving; month; school; found; pretty; attractive; yolo; high; ending; toxic; relationship; abstaining; month; prior; made; clear; would; moving; fine; super; casual; dinner; think; tequila; taco; ended; feeling; incredibly; comfortable; expect; night; best; life; definitely; planned; tension; palpable; felt; natural; month; continued; seeing; sleeping; checked; pet; package; away; grocery; vacation; thing; pretty; casual; expectation; moved; agreed; supportive; another; hook; town; though; want; distraction; moved; month; snap; notice; orbiting; hard; actually; real; conversation; substance; halfway; doctorate; degree; started; mine; feel; like; appreciate; level; self; centeredness; academic; rigor; town; week; expressed; seemingly; shallow; disappointment; know; since; starting; school; working; anxious; attachment; style; love; bombing; tendency; create; imaginary; ideal; version; romantic; interest; school; wellness; priority; capacity; desire; anything; serious; unforeseeable; future; help; miss; idea; truly; felt; seen; anyone; else; think; date; others; town; couple; week; want; interested; catching; explicit; understanding; boundary; worked; boundary; setting; identifying; leaving; lvm; better; communicating; need; think; meeting; provide; closure; growth; necessary; establish; healthy; meaningful; relationship; whether; someone; else; hand; could; ignoring; lvm; action; romanticizing; deserve; another; second; time; torn; want; make; impulsive; decision,-1,
qrueml,ChickenRemarkable840,taking; sometimes; rant,,-1,
