post_id,author,title,body,image
ezvyyu,Pz5,york; time; bastion; sexism,,-1
ezvw0h,Parma-Sam,father; reviewing; parental; right; mother; finland; link; article; comment,,7139
ezvl4l,saralhemnani,internalized; misandry,,7140
ezut6f,EricAllonde,great; quote; comedian; talking; circumcision,watching; video; circumcision; actually; pretty; good; youtube; watch; nsvmgcri; youtube; watch; nsvmgcri; people; featured; male; comedian; really; unhappy; fact; circumcised; baby; interview; touched; number; downside; circumcised; clearly; angry; done; decided; best; work; towards; ending; circumcision; raise; awareness; comedy; entire; show; circumcision; made; comment; really; home; girl; make; feel; better; show; come; like; know; actually; like; circumcised; dick; actually; like; like; alright; cool; make; feel; better; know; like; boxing; victim; domestic; abuse; console; fact,-1
ezu6eg,JohnKimble111,passenger; groped; front; drunken; mother; tried; perform; flight; turkey; claim; spared; jail; woman,,-1
ezu66j,PeonSupreme,woman; framed; second; husband; false; rape; case; teen; daughter,,-1
ezty2j,benderXX,police; recording; crime; hate; speech; england; targeting; right; activist,,-1
eztxl0,mgtowolf,weird; voting; glitch; toady,kinda; today; noticing; weird; behavior; upvoting; downvoting; upvoted; post; second; later; watched; unvote; went; thread; know; voted; earlier; morning; vote; reddit; glitching; like; anyone; else; today,-1
eztswx,NerdGuyLol,high; school; equality; week,yesterday; form; think; called; homeroom; america; watched; powerpoint; presentation; wage; woman; educated; outweighs; male; education; today; assembly; think; called; lecture; america; held; racial; equality; first; half; spent; watching; news; story; hate; crime; thought; assembly; going; alright; actual; equality; problem; however; latter; half; assembly; black; people; suffered; racism; going; people; make; joke; people; race; usually; black; know; like; suffer; racism; equality,-1
eztm7a,SuddenlyCoding,male; privilege; exist,,-1
eztkrm,bwatters323,live; feminism; essentially; part; normal; modern,however; today; health; class; freshman; talked; suicide; kid; class; teacher; asked; guy; think; kill; woman; woman; friend; teacher; say; actually; time; woman; thought; finally; someone; school; system; would; bring; awareness; say; told; stressful; situation; true; said; help; response; saying; much; mental; health; support; woman; entirely; wrong; still; somewhat; misogynistic,-1
eztklu,Oncefa2,feminist; ideology; fundamentally; flawed; help; need; right; movement,book; feminism; everybody; pinimg; original; bceca; author; describes; type; domestic; violence; male; violence; woman; violence; adult; violence; child; something; lacking; list; pretty; obvious; though; female; violence; pattern; denial; around; male; victimization; female; perpetration; broadly; female; agency; fundamental; flaw; feminist; ideology; caused; belief; patriarchy; framework; said; violence; woman; method; control; keep; line; idea; woman; might; violence; form; control; therefore; absent; idea; violence; might; anything; control; result; form; female; violence; framed; term; self; defense; occasionally; punching; male; violence; contrast; framed; term; abusing; power; given; patriarchy; includes; violence; self; defense; woman; however; understanding; domestic; violence; deeply; flawed; woman; assault; various; reason; including; control; behavior; happens; quite; frequently; often; feminist; theory; predicts; known; year; feminist; framework; domestic; violence; antiquated; regressive; line; modern; academic; scholarship; topic; csulb; mfiebert; assault; domestic; violence; researcher; called; question; validity; patriarchy; theory; feminist; bothered; throw; away; belief; patriarchy; least; modify; account; know; domestic; violence; fact; done; opposite; ignored; fact; evidence; topic; become; champion; anti; science; denialism; effort; rescue; precious; theory; criticism; deserves; case; engaged; violence; effort; sequester; researcher; dared; question; narrative; redpilluk; woman; batter; role; role; feminist; state; issue; face; society; ignored; feminist; include; thing; like; homelessness; incarceration; police; violence; life; expectancy; work; life; balance; suicide; divorce; child; custody; plethora; issue; excuse; ignoring; problem; lie; second; flaw; feminism; idea; issue; caused; negative; effect; patriarchy; feminist; give; service; issue; never; anything; instead; hide; behind; thing; like; toxic; masculinity; harming; patriarchy; harming; excuse; brush; issue; aside; case; like; come; child; custody; divorce; reform; fought; right; group; created; positive; social; change; around; issue; feminist; lobbying; group; therefore; active; socially; regressive; force; march; progress; right; advocate; made; area; idea; victim; general; reason; outside; patriarchy; simply; something; feminist; theory; allow; existence; male; victimization; pretty; much; anywhere; society; fundamental; threat; message; feminist; want; everyone; believe; male; victim; suffer; much; heard; receive; help; attention; suffering; ultimately; need; right; movement; silenced; problem; ignored; feminist; indeed; help; feminist; ideology; belief; gender; fundamentally; flawed; used; solve; problem; fact; would; argue; belief; longer; useful; modern; world; think; helping; anyone; woman; claim; support; view; socially; regressive; dangerous; sexist; unscientific; year; stubborn; denialism; view; need; thrown; away,-1
ezslv0,RT-AC66U,principle; suspended; glorifying; kobe; death,principal; kobe; facebook; trnd; index; html; latimes; opinion; story; kobe; bryant; sexual; assault,-1
ezsiy1,someguywhocomments,england; schoolboy; worse; exam; result; girl; year; little; national; focus; difference; result; measure; addressing; boy; behind,,-1
ezshpk,Fireflwr,feminism; advocating; everyones; right; abused; woman; like; misandrist,,7141
ezsbu7,yousearchingme,relevant; quarantined,,7142
ezrvei,PixelatedDoppelgangr,fact; statistic; prevalence; partner; abuse; rate; female; perpetrated; violence; higher; male; perpetrated,,-1
ezrosn,ArrestedDevelopments,pack; success; solitude; medium; modern; masculinity,,-1
ezror0,JakeryPaule,help; fellow; falsely; accused; rape,,-1
ezr3sb,JackFisherBooks,bloodstained; take; florida; street; protest; circumcision,,-1
ezqxs7,Dave1962,mcallister; hollywood; cultural; brainwashing; explained; denise; mcallister; see; world; insists; pushing; back; unfair; treatment,,-1
ezqsyn,accidental_me,student; organization; helsinki; declared; feminist; membership; mandatory; student; strong; anti; feminist; view; though; luck; still; membership; change; university,,-1
ezprpy,AmatorHidder,hoard; gold; coin; early; abbasid; period; found; israel; archaeology,,-1
ezpp91,JohnKimble111,fundraiser; ronald; goldman; historic; legal; challenge; medicaid; circumcision,,-1
ezp3d7,-WolfChop-,reminder; need; love; appreciate; everyone,,-1
ezoyui,-WolfChop-,pedophilia; pedo; woman,,7143
ezo30p,WarOfNoise,always; wondered; would; happen; factored; tip; stripper; made; tip; equation,,-1
ezn0vl,IntactBroadSword,firm; seek; male; survivor; scout; abuse; ashame; focusing; trend,,-1
ezmyj6,12345678910tom,ignore,,7144
ezmvdr,ligmakun,apparently; cosplay,,7145
ezml91,stentorian46,forget; amber; heard; johnny; depp,,-1
ezmine,mtcapri,pill; free; watch; youtube,,-1
ezkxfu,i-am-human-ish,thought; joke; fucking; stupid,,-1
ezklk4,happyunclehappylife,people; automatically; assume,,-1
ezk97n,Niceto666,matter,know; right; subreddit; know; take; anyways; podcast; school; need; feminism; exclusively; teacher; feminist; explaining; topic; asked; something; completely; stumped; asked; topic; matter; affect; prepared; question; made; think; affect; woman; assuming; believe; need; feminism; matter; affect,-1
ezjurj,AncientBodybuilder,thought; idea; circumcision; could; somehow; negatively; effect; romantic; relationship; woman,heard; many; source; uncircumcised; much; stronger; bond; girlfriend; wife; circumcised; quote; article; circumcision; male; circumcision; harm; woman; circumcision; male; circumcision; harm; woman; research; limited; speculate; potential; psychological; effect; circumcision; could; inhibit; relationship; woman; example; male; self; esteem; shame; fear; distrust; sexual; anxiety; adversely; affect; communication; limit; degree; intimacy; addition; sexual; intimacy; major; component; male; female; bonding; research; shown; male; sexual; activity; increase; self; esteem; higher; circumcision; lower; male; self; esteem; sexual; sensitivity; discussed; later; would; tend; reduce; male; sexual; activity; consequently; weaken; pair; bond; male; female; relationship; could; restricted; circumcised; feel; nagging; sense; passion; excitement; sexual; fulfillment; missing; belief; experience; missing; woman; withhold; commitment; continually; seek; woman; give; hope; addition; reduced; emotional; expression; circumcised; dampen; woman; feeling; result; woman; feel; something; missing; relationship; larger; perspective; would; surprising; circumcision; found; negative; effect; interpersonal; relationship; since; circumcision; trauma; trauma; commonly; impairs; person; relation; others; harvard; psychiatrist; professor; author; judith; herman; writes; traumatic; event; sense; alienation; disconnection; pervades; every; relationship; research; shown; lower; physiological; tolerance; emotional; stress; woman; emotional; numbing; response; trauma; would; tend; reduce; person; tolerance; emotional; stress; would; account; male; tendency; avoid; certain; situation; marital; conflict; method; control; exposure; emotional; stress; respond; rationally; rather; emotionally; another; tactic; withdraw; stonewall; conflict; behavior; weaken; marital; relationship; restricting; communication; leaving; conflict; unresolved; circumcision; increase; america; uniquely; high; divorce; rate; emotional; numbing; affect; sensitivity; others; pain; related; sensitivity; pain; infant; subjected; trauma; circumcision; nobody; responding; cry; experience; insensitivity; pain; empathy; infant; empathy; others; male; acquaintance; reading; circumcision; remarked; hurt; baby; scream; circumcision; early; experience; reduces; male; empathy; appears; reason; circumcision; could; contributing; factor; relationship; difficulty; woman; research; needed; understand; circumcision; impair; woman; sexual; relationship; need; learn; foreskin; christopher; cold; chairman; anatomical; pathology; marshfield; clinic; marshfield; wisconsin; studied; written; foreskin; important; function; foreskin; protects; head; penis; throughout; life; contamination; friction; drying; injury; integral; natural; part; penis; extra; average; adult; male; twelve; square; inch; circumcised; guess; le; square; inch; consists; movable; double; layered; sleeve; foreskin; enhances; sexual; pleasure; detailed; study; show; made; unique; zone; several; kind; specialized; nerve; important; natural; sexual; function; experiencing; full; range; sexual; sensation; loss; foreskin; result; thickening; progressive; desensitization; outer; layer; head; penis; particularly; older; circumcised; adult; report; significant; loss; sensitivity; regret; change; circumcision; unrecognized; factor; high; rate; erectile; dysfunction; american; would; involve; associated; psychological; effect; course; sexual; associated; psychological; effect; would; affect; woman; woman; circumcised; know; missing; according; survey; medical; literature; woman; reported; significantly; likely; vaginal; dryness; intercourse; circumcised; genitally; intact; medical; journal; survey; woman; comparative; sexual; experience; included; response; thing; equal; scale; rated; genitally; intact; circumcised; circumcised; partner; woman; le; likely; multiple; vaginal; orgasm; circumcised; partner; likely; premature; ejaculation; circumcision; connected; vaginal; discomfort; woman; le; likely; really; likely; want; partner; circumcised; result; explained; foreskin; previously; mentioned; movable; double; layered; sleeve; intercourse; glide; penile; shaft; reducing; friction; retaining; vaginal; secretion; without; foreskin; skin; penile; shaft; rub; vaginal; wall; resulting; friction; increasing; need; artificial; lubrication; circumcised; le; sensitivity; requires; deeper; harder; thrusting; compensate; increasing; friction; circumcised; partner; surveyed; woman; likely; feel; unappreciated; distanced; disinterested; frustrated; discontented; partner; circumcised; woman; likely; feel; intimate; partner; relaxed; warmth; mutual; satisfaction; complete; woman; greater; sexual; satisfaction; benefited; relationship; clear; mean; woman; satisfying; emotional; sexual; relationship; circumcised; thing; equal; mean; relationship; likely; satisfying; circumcised; quote; article; cirp; library; psych; immerman; cirp; library; psych; immerman; addition; human; foreskin; penis; proper; contains; tyson; gland; type; holocrine; gland; secrete; smegma; smegma; substance; volatile; pheromone; sleep; pheromone; would; systematically; released; vial; nocturnal; erection; quote; article; article; foreskinfunction; foreskinfunction; apocrine; gland; foreskin; foreskinfunction; release; pheromone; signal; chemical; help; encourage; sexual; arousal; partner; foreskin; prevents; discoloration; purple; pink; head; penis; preserving; sexual; signal; conveyed; natural; coloration; foreskin; supposedly; make; male; pheromone; foreskin; many; pheromone; produced,-1
ezjamn,1Qwerty1239,happens; travel; retirement; equalised,,-1
ezj54g,tenchineuro,place; woman; take; husband; name; married,surprised; come; across; perhaps; time; maiden; married; name; country; time; maiden; married; name; country; woman; increasingly; keeping; time; maiden; name; married; woman; report; maiden; name; nothing; across; border; quebec; woman; keeping; maiden; name; since; whether; want; provincial; quebec; forbids; woman; taking; husband; surname; marriage; rule; instated; soon; creation; quebec; charter; right; publicationsduquebec; gouv; dynamicsearch; telecharge; type; file; went; effect; intended; extend; charter; statement; gender; equality; name; quebec; place; greece; theguardian; commentisfree; woman; change; name; marriage; greece; similar; requiring; woman; keep; maiden; name; enacted; wave; feminist; legislation; tradition; go; back; france; vosdroits; service; public; particuliers; xhtml; book; since; requiring; people; name; besides; given; birth; certificate; today; woman; legally; change; vosdroits; service; public; particuliers; xhtml; surname; marriage; woman; accept; surname; social; colloquial; purpose; italian; woman; option; although; legally; change; altalex; content; italian; civil; code; translated; english; surname; true; since; book; google; book; tbtbgaaqbaj; italy; maiden; name; source; rald; kmocgbpawiqn; ciervcoie; nfsawy; cdiq; aewaw; onepage; italy; maiden; name; false; option; tacking; husband; surname; onto; surname,-1
ezj3e4,falloutfanboy111,took; long; woohoo; equality,,-1
ezj2yk,EqualMeansEqual,exposed; johnny; depp; physically; abused; amber; heard,,-1
ezi6kt,PeonSupreme,camas; principal; leave; following; kobe; bryant; post; student; call; walkout,,-1
ezhmsi,Ebin_Array,anyone; youtube; channel; mensrights; plus; politics,youtube; channel; activism; right; plus; political; topic; check; group; reasonrising; grow; channel; viewership; help; mensrights,-1
ezhkwc,MRMRising,woman; filmed; raping; made; sell; drug,,-1
ezgze0,MRMRising,domestic; issue; often; overlooked; blamed; prevalent; better; bachelor,,-1
ezgyij,Deja_Siku,woman; cheat; past; understand; partner; trust,looking; something; unrelated; snippet; post; google; result; result; curiosity; disappointing; shocking; bullshit; hypocrisy; onto; show; forum; post; board; weddingbee; topic; stop; questioning; done; nothing; wrong; quote; woman; say; belief; cheat; cheated; year; young; severely; depressed; suicidal; around; bundle; reason; stupid; bitch; understand; trust; cheat; course; look; woman; comment; saying; enemy; want; infidelity; past; looked; nothing; play; game; little; thought; experiment; gender; plug; reversed; say; belief; beat; shit; year; young; severely; depressed; suicidal; around; bundle; imagine; comment; seriously; imagine; woman; past; justified; depression; mental; instability; happened; year; young; crock; shit; seem; figure; trust; cheat; cheater; always; cheater; bitch; circumstance; past; excuse; happens; depressed; cheater; cheater; period; depression; poor; either; going; sign; stupid; site; point; whole; thing; post; year; locked; really; really; hope; brotha; firm; grip; back; nut; enough; self; respect; take; advice; woman; comment; le; away; psycho; see; willing; cheat; life; get; stressful; whatever; unbelievable; cheater; problem,-1
ezghfu,mimiczx,canadian; businessman; get; day; jail; claiming; million; fire; keep; wife,,-1
ezggc1,ThePigmanAgain,tell; world; johnny; tell; johnny; depp; victim; domestic; violence; many; people; believe; side,,-1
ezg773,Noobly387,young; dropping; society; abundantly; clear; nobody; give; shit,,-1
ezfq4o,PeonSupreme,mass; drug; rape; charge; dropped; surgeon; girlfriend,,-1
ezfklv,Kaylakat,right; policy; affect,first; want; woman; passionate; right; wondering; someone; would; help; project; school; conversation; people; hate; based; podcast; productive; person; conversation; someone; share; view; need; help; please; give; example; policy; affect; right; positive; negative; need; research; figure; affect; would; appreciate; much; tried; search; around; getting; anywhere; thought; best; place; look; would; reddit; really; excited; project; thank; advance,-1
ezfcow,hannahfortune,guy,,7146
ezeiyl,Atchoum150,paul; elam; janice; fiamengo; paul; golden; amber; heard; abuse; case,,-1
eze1dk,deathsythe,finland; offer; father; much; paid; leave; mother,,-1
ezdgqt,pcbfbas,story; abusive; relationship,apologize; length; ever; told; full; story; people; life; tired; sitting; back; head; though; life; perfect; seeing; recent; news; johnny; depp; severity; endure; think; time; actually; happened; using; account; though; know; abuser; reddit; recognize; account; started; talking; girl; went; different; high; school; city; midwest; person; period; month; encounter; talking; facebook; perfect; funny; listened; similar; interest; view; decided; finally; date; decided; take; bowling; university; lane; adamant; best; friend; girlfriend; came; along; since; already; pretty; anxiety; time; needed; safety; cushion; remember; punched; pretty; upset; young; assumed; playful; since; friend; joke; around; like; time; apologize; quite; finally; forgave; flag; night; hanging; suggested; taking; little; unofficial; break; could; figure; maintain; relationship; better; immediately; want; come; home; right; leaf; snapchat; cuddled; creepy; shoulder; party; response; hour; tell; know; happened; begs; back; saying; place; remember; anything; night; convenient; learned; breakup; cheated; alligator; tear; worked; wanted; take; care; promised; would; better; already; become; extremely; paranoid; mind; game; constantly; punching; hitting; thing; didnt; like; didnt; hard; protected; body; rarely; visible; bruise; pinched; shoulder; hard; still; scar; nail; jewel; many; time; lost; count; lie; would; never; find; anyone; else; love; like; believed; went; close; year; everything; year; pretty; rinse; repeat; started; telling; abuser; flipped; worried; mess; blame; continued; thing; believed; quite; long; time; pushed; started; hitting; immediately; grabbed; coat; left; house; next; school; called; office; visit; questioned; happened; told; truth; didnt; believe; word; said; loneliest; hour; life; told; could; potentially; spend; summer; jail; degree; effect; cry; still; answering; exact; every; single; time; finally; told; would; charge; pressed; relief; wrecked; longer; force; short; conversation; nice; police; chief; consolation; parent; didnt; believe; victim; year; spent; summer; friend; couch; every; night; went; therapy; time; week; lost; friend; developed; insomnia; anxiety; already; worse; felt; like; zombie; want; show; face; school; word; already; spread; around; area; sort; monster; lived; best; life; lost; victim; believed; took; year; date; alone; able; speak; female; without; fear; today; currently; engaged; sweetest; loving; girl; ever; first; month; bumpy; worried; little; much; jumped; worst; possible; conclusion; would; flinch; everytime; made; dumb; joke; moved; little; quickly; around; made; together; understood; gave; much; love; support; finally; conquered; fear; life; love; ended; beautiful; thing; annoys; though; still; trying; keep; power; contacted; police; within; last; year; allegation; harassment; online; occurred; current; relationship; became; apparent; fake; social; medium; account; harrasses; fiancee; lie; nothing; worrisome; relationship; though; discus; pop; gone; abused; almost; every; category; flipped; blame; trouble; protected; still; known; monster; town; spent; year; fear; meeting; fiancee; started; heal; wanted; regain; power; little; amount; time; life; great,-1
ezd8xk,accountancyisboring,wish; could,,-1
ezd639,Helmut66BLYAT,sign; petition; amber; heard; upcoming; movie; aquaman,,-1
ezcvpk,omegaphallic,finland; offer; father; much; paid; leave; mother,,-1
ezcji0,MRMRising,amber; tamblyn; male; ally; manifesto; please; come; back; james; maxwell,,-1
ezcbto,WhereTheFuckIsMyIron,finland; offer; father; much; paid; leave; mother,,-1
ezc8ac,TC1827,aita; asking; female; employee; follow; rule; aita; satire,,-1
ezaz96,Celebrate_Diversity,know; time,,7147
ezaz0f,bastardbeard666,short; article; finland; offering; father; amount; paternity; leave; mother; step; right; direction,,-1
ezaxnp,NakedValhallaBoy,reminder; perfectly; okay; purposely; provoked; insecurity; whether; woman; ever; responds; woman; something; insecure; toxic; wrong; insecure; woman; need; protected,,7148
ezavfi,CompleX999,finland; offer; father; much; paid; leave; mother,,-1
ezasa7,iamericevans,finland,,-1
ezaoax,SqueakyPoP,tweet; diane; abbott; left; wing; suggests; could; bullied; used; army,,-1
ezakgm,EqualMeansEqual,confession; equity; industry; propagandist,,-1
ezachj,omega_kush,lady; teach; woman; target; pretty; nasty,,-1
ezabee,blueorange22_,young; male; crisis; boy; education,,-1
eza7rg,MonsterDobbsREAL,subreddit,like; know; right; right; need,-1
ez93ls,Strikester101,think; debate; gender; violence,personal; question; violent; woman; capable; severe; form; variety; violence; type; violence; woman; commit; majority; cause; disparity; perpetration; violence; biological; cultural; something; complicated,-1
ez916p,excess_inquisitivity,woman; across; carried; midnight; attack; house; church; railway; station; post; office; armed; gun; bomb; belief; vote; woman; follow; violent; footstep,,-1
ez7i7h,White_Mlungu_Capital,california; fabricated; doctor; raped; woman; proof; say,say; couple; accused; drugging; raping; woman; thing; made; california; prosecutor; dropping; charge; doctor; girlfriend; alleging; predecessor; manufactured; allegation; couple; drugged; sexually; assaulted; woman; stunning; turn; event; come; year; half; case; grant; robicheaux; thedailybeast; grant; robicheaux; orange; county; eligible; bachelor; accused; drugging; raping; woman; orthopedic; surgeon; appeared; show; online; dating; ritual; american; male; substitute; teacher; cerissa; riley; thedailybeast; cerissa; riley; arrested; rape; grant; robicheaux; evangelical; missionary; exploded; headline; time; orange; county; district; attorney; tony; rackauckas; claimed; pair; lured; woman; newport; beach; home; knocked; unconscious; raped; press; conference; september; said; investigator; seized; hundred; incriminating; video; couple; phone; asked; whether; number; could; high; thousand; rackauckas; said; think; month; later; though; rackauckas; office; replaced; current; todd; spitzer; eventually; ordered; review; evidence; say; appalled; found; prior; district; attorney; chief; staff; manufactured; case; repeatedly; misstated; evidence; lead; public; vulnerable; woman; believe; individual; plied; woman; drug; alcohol; order; sexually; assault; videotape; assault; spitzer; said; blistering; statement; result; complete; case; review; ordered; beginning; july; know; single; video; photograph; depicting; unconscious; incapacitated; woman; sexually; assaulted; rackauckas; responded; former; rival; allegation; robicheaux; attorney; praised; reversal; story; continues; yahoo; news; say; couple; accused; drugging; html; yahoo; news; say; couple; accused; drugging; html; next; time; hear; bill; cosby; must; guilty; look; accuser; think; real; hard; could; literally; find; accuser; thin; determined; fake; every; single; suddenly; becomes; much; plausible; congo; line; fake; accuser; rolled; come; really; much; rape; think; would; inventing; one; exist,-1
ez6uzl,okwaitno,right; specifically; want,mensrights; right; specifically; legally; want; advocate; currently; lack; example; suffragette; fought; woman; vote; queer; community; fought; fighting; marriage,-1
ez6rgs,AquaManscape,say; couple; accused; drugging; raping; woman; thing; made,least; woman; accused; robicheaux; riley; maintain; assaulted; article; thedailybeast; clear; grant; robicheaux; cerissa; riley; couple; accused; drugging; raping; woman,-1
