post_id,author,title,body,image
8la211,Monky11,ground; breaking; research; refutes; feminist; lie; partner; violence; female; specific; aetiology,,-1
8l9v67,rbrockway,woman; always; regret; night; stand,,-1
8l9k6f,platesizedareola,video; showing; three; common; circumcision; method; plastibell; gomco; mogen; performed; three; different; male; infant,,-1
8l9j3c,your_adopted,headline; nearly; half; stray; bullet; victim; woman; study; show; saying; half; victim,,-1
8l9iii,Lranki709,found; feminism; think; biased; saying; wrong; think; something,,-1
8l9f8k,whatafoolishsquid,unbelievable; bill; maher; panel; say; socialized; entitled; sentence; later; said; make; worthy,,-1
8l9dww,certainbluelobster,unbelievable; bill; maher; panel; say; socialized; entitled; sentence; later; say; make; worthy,,-1
8l9951,Kenjosky,found; comment; promoted; post,,473
8l8vkb,headreplacement,sexist; saying,many; saying; direct; obvious; bias; cringiest; example; boy; away; talking; girl; thing; annoyingly; boy; boy,-1
8l8uce,furchfur,many; woman; using; dating; apps; confirm; attractiveness; rather; find; partner; reveals; study; probably; true; small; sample; size,,-1
8l8sn7,oscoot122,honestly; feel; thing,,-1
8l8mtu,a-Gangst,woman; workplace; jordan; peterson; vice; interviewer; think; woman; manipulate; sexually; advancement; workplace,,-1
8l8mq1,captainhowdy27,tweet; depressingly,,-1
8l8hxq,Stegasaurus_Wrecks,cruel; violent; unloving; mother; subjected; four; child; horrific; catalogue; abuse; walk; free,,-1
8l84o6,ChakaKhanly,everybody; ignoring; past; year; research; news; report; gender; bending; compound; soft; plastic; processed; drug; remove; desire; transvestitism; know,,-1
8l80d3,furchfur,another; rape; trial; disgrace; case; collapse; police; failed; investigate; facebook; message; linked; victim; time; accused; rape; five; count; girl; trial; collapsed; known; cameron; found; guilty,,-1
8l6thg,usulsleftnut,public; market,,474
8l6g57,NarwalObaizd,experience; today; shed; light; hypocrisy; society,hello; mensrights; high; school; student; currently; health; class; unit; sexual; harassment; class; today; given; scenario; determine; whether; sexual; harassment; scenario; went; something; like; gina; student; take; good; care; body; work; every; today; went; watch; sister; basketball; practice; school; gymnasium; warm; wore; tank; athletic; short; jamie; student; attracted; noticed; gina; approached; pretended; fall; rubbed; body; laughed; complimented; muscle; began; touching; gina; wanting; make; sure; knew; felt; pushed; hand; away; moved; away; jamie; said; trying; compliment; would; stop; however; half; class; different; scenario; jamie; student; take; good; care; body; work; every; today; went; watch; sister; basketball; practice; school; gymnasium; warm; wore; tank; athletic; short; gina; student; attracted; noticed; jamie; approached; pretended; fall; rubbed; body; laughed; complimented; muscle; began; touching; jamie; wanting; make; sure; knew; felt; pushed; hand; away; moved; away; gina; said; trying; compliment; would; stop; class; discussed; reaction; scenario; different; although; scenario; exact; interesting; exercise; discussing; female; male; assault; female; asked; surprising; question; asked; shirt; truly; shocking; part; rest; female; began; agree; kept; repeating; fault; hypocrisy; angered; people; complaining; dress; code; people; wearing; revealing; skimpy; clothing; planet; claiming; sexism; sent; office; keep; saying; guy; distracted; dress; whats; comfortable; guy; fault; putting; shirt; believe; say; mindset; female; society; problem; mentality; absolute; garbage,-1
8l63ri,medjin0372,huge; difference; modern; culture; eastern; western; europe,,-1
8l5k9b,Razorbladekandyfan,alexander; mgtow; incels,,-1
8l5djd,furchfur,feminist; propaganda; used; force; criminalise; buying,,-1
8l51a9,NinjaDingo,australian; liberal; politician; jane; hume; say; woman; work; harder; parliament,,-1
8l4u2t,GreasedLightning,truth; incels,,-1
8l4rpq,Swiss_Cheese9797,imgur; frontpage; redpilling; almost; daily; least; post; today; oldie; goodie,,-1
8l4l50,Williamsville,female; waste; education; career; goal; industry; desperately; need; time; segregate; sex; school; ensure; boy; best; distraction; free; education; possible,imgur; hxay; theatlantic; sex; archive; woman; child; leave; job; back; girl; sexy; order; learn; boy; need; distraction; free; order; learn; school; place; express; sexual; identity; neither; work; place; separate; sex; untill; female; learn; control; around; boy,-1
8l4hrt,Mens-Advocate,hypocrite; support; woman; club,,-1
8l4gey,DavidByron2,republican; appointed; judge; sentence; female; defendant; fewer; month; similar; male; compared; democratic; appointed; judge,,-1
8l468r,Minoxidil,sandra; bullock; fire; controversial; beauty; treatment; involving; baby; foreskin; xpost; inactivists,,-1
8l40j5,Vwar,anyone; hear; watching; handmaid; tale,curious; know; whether; give; series; look; anti; male; propaganda,-1
8l3yg9,JustAcceptThisUser,friend; fighting; shared; custody,fair; amount; drama; involved; surprising; trying; lose; daughter; false; accusation; mother; primary; caretaker; child; entire; life; risk; mother; gofundme; afford; lawyer; plaintiff; lawyer; free; defendant; probably; place; post; going; link; unless; granted; permission; ahead; time; anyone; would; interested; helping; know; better; place; post; would; sure; would; sincerely; appreciate; help; goal; modest; know; posting; think; high; probability; reaching; goal; please; feel; free; thanks,-1
8l3wdj,Rethgil,woman; still; appear; le; often; le; film; screenplay; software; automatically; tell; whether; script; equitable; national; newspaper; independent; crazy; victim; feminism,,-1
8l3ngh,IronProdigyOfficial,get; assaulted; treated; like; second; class; citizen; abusive; walk; free,,-1
8l36gq,Williamsville,female; contribute; half; male; contribute; coffer; reduce; funding; female; service; half; invest; fund; repairing; crisis; today,,-1
8l2x9d,BlazerFS231,look; like; crazy; taken; control; feminism; banned; suggesting; side; cast; extremist; find; common; ground; happen; remain; vocal; supporter; woman; right,,475
8l2rjq,KOMRADE_DIMITRI,want; marrige; anymore,,476
8l2lrd,SN2014dt,young; left; leaning; woman; shift; perspective; right; mras,,-1
8l28cz,theedgeofthelord,good; paranoid; religion,good; religion,-1
8l10nd,narcolepticd,apparently; misogyny; blame; mass; shooting,,-1
8l0y3s,EricAllonde,comic; ravage; kill; kickstarter; launching; soon; comic; find; entertaining; enjoy,,-1
8l0g9c,giacattiva,heya; female; australia; wrote; pill; culture; thought; might; laugh; enjoy; burning; real; boyz; little; pill; cattiva; riff; raff; prod; ravioli; ryan,,-1
8l0co5,Ted8367,diana; davison; untold; story; wrongful; conviction,,-1
8l081n,KyloRenNoMore,drama; teacher; think; conservative; racist; homophobic; bigot,,477
8l06nr,sebastienne,roger; daltrey; metoo,,-1
8l02jd,AngelsPassion,stay; single; date; online,,-1
8kzyyg,ThePigmanAgain,football; star; sister; charged; manslaughter; partner,,-1
8kzwe1,WhiteMenCanDance,female; waste; education; career; goal; industry; desperately; need; time; segregate; sex; school; ensure; boy; best; distraction; free; education; possible,,-1
8kztei,DonJuan49,,,478
8kz0ih,Spraden,banned; feminism; reason,post; history; anything; hour; commenting; real; stuff,-1
8kysbt,InBaggingArea,male; display; female; choose,marriage; institution; place; artificial; limit; woman; choice; nature; dictate; male; display; female; choose; monogamy; artificially; strengthens; male; position; insisting; female; must; choose; different; male; female; must; stick; choice; monogamy; entail; highly; attractive; mating; pool; early; usually; attractive; woman; next; woman; compelled; choose; le; attractive; mate; wish; mate; last; least; female; however; find; mate; every; girl; abolishing; marriage; strengthens; naturally; stronger; strengthens; female; expense; male; attractive; expense; unattractive; discus; behave,-1
8kyjgs,fob911,subreddit; twoxchromosomes; support; generalizing; male; ban; otherwise,honestly; think; ever; post; rash; understand; would; never; woman; right; like; seeing; piece; work; called; male; stereotype; decided; something; user; commented; along; line; going; something; leave; alone; prick; sorry; didnt; screenshot; responded; banned; subreddit; left; mod; message; response; mod; community; twoxchromosomes; support; generalizing; male; despicable; imgur; pdcze,-1
8kyfas,AditKhan90,professor; say; woman; prison; deserve; punishment,,-1
8kye0f,EsterFeinberg,female; waste; education; career; goal; industry; desperately; need; time; segregate; sex; school; ensure; boy; best; distraction; free; education; possible,imgur; hxay; theatlantic; sex; archive; woman; child; leave; job; back; girl; sexy; order; learn; boy; need; distraction; free; order; learn; school; place; express; sexual; identity; neither; work; place; separate; sex; untill; female; learn; control; around; boy,-1
8kyc0k,baconinstitute,would; woman; drug; date; extremely; digusting; doublestandard; standard,,-1
8ky3me,benjaminikuta,happens; decides; pregnant; without; consent,,-1
8kxu0v,AndrewLevin,feminist; kick; punch; get; slapped; unconscious; feminist; went; back,,-1
8kx4dm,BernieSandersgirl101,found; feminist; reverse; gender; role; thing; give; comment; movement; mras; reversed; start; reversed; gender; scenario,,-1
8kx475,fasehed,left; neutral; comment; feminism; downvoted; hell; crazy; blind; person; said; woman; sexually; harass,,-1
8kww99,Kingofpop01,sure; posted; thought; interesting; least,,479
8kwvzj,Mallago,french; director; besson; accused; rape; denies; story; go,,-1
8kwort,kanara,higher; education; gender; favor; woman; feminization; everything; fails; boy,,-1
8kwhrn,DreamingInRlyeh,real; look; like,,480
8kw781,reducemychildsupport,reduce; child; support; legally; le; child; support,,-1
8kw6v0,iamnotfromtexas90,lifelong; family; girl; scout; explains; evolved; feminist; organization,,-1
8kvytm,ckirk91,imagine; woman; would; receive; like; table; turned,,481
8kvnnq,4e351d81-7956-461a,indian; court; imposes; fine; indian; crime; investigation; arresting; woman; sunset,,-1
8kvmri,Ted8367,johntheother; preventing; vigilante; killing,,-1
8kvl5r,colubrinus1,rape; guess; right; raped,,482
8kvfsd,JaceLightning,law; woman; different; punishment; committing; exact; crime,thought; read; somewhere; law; book; punished; woman; crime,-1
8kva0f,loganblade14,misogynist; period; fetish,,483
8kv9rz,Fuckoff555,young; woman; beaten; sheared; raped; three; female; friend; feria; blame; toxic; femininity; like; feminist; toxic; masculinity,,-1
8kv6dw,andejoh,woman; rape; multiple; time; prostitute; post; nude; photo; provides; drug; seems; prosecutor; trying; hard; charge; crime; soon; receive; pussy; pas,endangering; welfare; child; corruption; minor; instead; rape; criminal; communication; facility; instead; child; pornography; get; discount; sentencing; woman; archive; ehewu; archive; ehewu,-1
8kv3lw,klaxz1,double; standard,,484
8kuxnk,GriegEdvard,leftist; say; anti; feminism; anti; zionism,,-1
8kuwkb,Pooper-5c00p3r,store; male; restroom,,-1
8kuje6,carmane,social; experiment; domestic; violence; public,,-1
8kujc4,kwsdn29,movie; rundskop; bullhead; highlight; insensitivity; people; male; suffering; believe; good,,-1
8kuglj,jasonfunk,poll; woman; much; le; likely; woman; required; register; selective; service; turn,,-1
8ku7si,TruthEqualsBan,turned; opposite; motivation; mass; shooter; comment; disgusting,,-1
8ku3eg,furchfur,multitask; myth; birmingham; city; council; warn; staff; repeat; sexist; claim,,-1
8ktn52,nahmate34,pill; cult,,-1
8kt0zf,Pooper-5c00p3r,found; news; fella; france,,-1
8kspja,rodvanmechelen,sexual; harassment; prevention; trainer; ignore; male; experience,yesterday; tribe; health; board; sponsored; workshop; paul; spindel; tribal; employee; member; board; committee; paulspindel; workshop; topic; passing; mentioned; workshop; sexual; harassment; prevention; break; approached; note; legal; aspect; everybody; ignores; pervasive; harassment; woman; defined; case; ellison; brady; kept; arguing; point; fact; precedent; case; establishment; specifically; female; male; reasonable; person; standard; reasonable; woman; standard; reasonable; standard; legal; precedent; argue; existence; kept; arguing; reasonable; person; standard; course; female; perspective; male; sexuality; white; knight; progressive; neolib; work; every; year; required; take; harassment; prevention; training; always; ignore; ellison; brady; example; harassment; focus; female; perspective; victim; subjected; conduct; woman; primarily; would; find; offensive; past; time; take; training; pointed; ignores; complaint; goal; understandable; minimize; avoid; complaint; train; everybody; male; perspective; constitutes; female; conduct; sexual; nature; employer; driven; business; rash; complaint; find; instructive; people; providing; training; ignorant; bigot; promote; misandry,-1
8ksmf0,rodvanmechelen,skewed; view; harassment; prevention,,-1
8kskf1,DougDante,deployed; soldier; wife; give; away; baby; birth; lie; husband; saying; died,,-1
8ksepg,Greatpeopleskills,video; talk; girl; step; starting; conversation; girl; must; watch,,-1
8ksc4v,TreatMeLikeDisease,strawman; argument; dress; code; propganda; thought,,485
8ks5vj,NecessaryDiscipline0,girl; interrupted; feminism,,-1
8krwxn,EricAllonde,jordan; peterson; york; time; enforced; monogamy; james; damore; google; memo; feminist; misunderstand; scientific; term; perhaps; deliberately; freak; reason,,-1
8krvnu,vsirianni0195,would; police; take; seriously,punched; called; every; name; book; front; friend; guest; house; bringing; home; abused; pitbull; ultimately; attacked; innocent; person; asking; time; legal; immigrant; longer; feel; safe; apartment; want; file; police; report; telling; gone; month; paid; rent; want; leave; afraid; take; seriously; final; straw; demanded; respect; said; want; house; screenshots; family; say; guess; respect; common; courtesy; anymore,-1
8krrth,phiomni,facing; ipossibilities; brave; attitude; overcome,,-1
8krmu2,Slam123456,true,,486
8kri5k,msleeduon,list; feminist; resource; tackling; issue,,-1
8krgze,Cuttlefish444,spread; male; body; positivity,woman; told; beautiful; matter; body; treatment; expected; particular; body; size; considered; real; rude; reject; woman; overweight; woman; reject; short; leftist; feminist; seem; fair; guy; struggle; social; expectation; self; esteem; implying; woman; issue; harmful; google; anything; body; positivity; stuff; geared; towards; woman; woman; issue; important; saying; issue,-1
8krfu6,the_dummy,figured; post; quotesporn; really; relevant; careful; newspaper; hating; people; oppressed; loving; people; oppressing; malcolm,,-1
8krfd9,a-Gangst,bill; burr; first; lady; need; shut; stand; comedy,,-1
8kr9kg,beingjac,talk; male; circumcision; west,advance; society; earth; westerner; think; advance; technology; thinking; question; alone; male; circumcision; normal; removing; body; part; someone; concent; human; right; give; damn; riligious; female; cicumcision; someone; would; face; pretty; much; time; prision; example; cruelty; humanity; know; else; westerner; love; blame; middle; east; backward; cruel; nation; break; human; right; worthy; enough; blame; nation; human; right,-1
8kr7vk,XLDOMTOPing,world; leading; male; comedian; join; strong; waiting; list; fake; comedy; lip; made; discarded; labium; ricky; gervais; claim; finally; blow; decent; raspberry,,-1
8kqu1e,iamnotfromtexas90,another; example; gender; reversed; hypocrisy; modern; corporate; feminism,,487
8kqr5z,Real_Tai_Lopez,show; reason; heavy; influence; teenager; season; end; painting; sole; aggressor; violence; deal; issue,post; contain; spoiler; show; keen; watch; suggest; reading; watched; last; episode; show; given; description; publicizes; mental; health; awareness; support; crime; victim; however; power; paint; reality; sensationalized; comfortably; within; current; society; view; firstly; might; address; absolutely; factor; show; show; suicide; reason; suicide; rape; wealthy; male; figure; show; revealed; committed; multiple; rape; publicize; reality; fine; supported; people; away; crime; need; strong; influence; teen; oriented; medium; support; ousting; criminal; mean; accepted; main; problem; show; season; directly; amassed; last; episode; female; character; show; testify; court; revealing; crime; victim; story; crime; committed; motivated; crime; woman; victim; left; intense; fear; capability; boy; around; know; properly; respond; instills; set; back; societal; view; crime; woman; ever; victim; assaulter; bother; sexually; assaulted; teenage; girl; span; minute; friend; accompanied; threatened; stab; violated; left; alone; situation; seared; mind; given; scar; still; visible; today; view; like; instilled; show; reason; never; able; tell; anyone; come; term; mental; confinement; want; risk; portrayed; victim; ridiculed; trauma; telling; someone; believe; trust; tell; parent; society; solely; speak; consented; sexual; situation; victim; risk; response; like; wanted; dude; bitch; laid; give; fuck; want; strength; stop; belittlement; crime; victim; abhorrent; ridicule; crime; woman; aggressor; shoved; path; relevancy; medium; influence; like; show; speak; opposite; situation; watching; first; minute; final; episode; leave; adept; issue; frustrated; situation; left; hurt; demoralized; took; break; watching; minute; came; back; today; redeemed; later; episode; male; character; shown; weak; vengeful; tendency; portrayed; getting; beaten; school; bathroom; male; jock; character; force; head; toilet; pull; pant; sodomize; wooden; blood; shown; handle; short; character; previously; seen; shooting; gun; wood; committing; defacement; crime; around; school; act; character; sent; away; rehabilitated; turned; moral; citizen; sexual; assault; scene; droplet; hope; prior; character; transformation; would; make; character; example; handle; crime; going; proper; procedure; testifying; police; course; writer; room; decide; character; react; crime; shooting; fucking; school; character; transformation; nothing; instilled; disgusting; view; show; give; aggression; seriously; show; power; gendered; trait; human; trait; human; aggressor; human; victim; gender; need; factor; knowing; stay; silent; sensationalizing; gendered; stereotyping; crime; generally; accepted; society; shown; type; flashback; female; lead; hannah; baker; grab; genitals; jean; threaten; portrayed; moment; strength; courage; character; instead; shown; sexual; assault; overt; activist; right; overt; activist; woman; right; victim; female; male; sexual; assault; feel; seriousness; trauma; buried; deeper; medium; influence; society; need; stop; type; sensationalized; medium; likely; back; male; victim; another; generation; recognized; people; victim; victim; laid; side; note; prove; show; objective; portraying; proper; spotlight; health; mental; sexual; male; protagonist; clay; ptsd; induced; hallucination; girl; committed; suicide; hannah; baker; hallucinates; many; time; come; point; try; shoot; someone; try; stop; hallucination; talking; shown; final; episode; upon; speaking; funeral; hallucination; go; away; promoting; view; face; fear; mental; health; boom; like; good; promotes; unhealthy; view; dealing; ptsd; hallucination; show; absolutely; zero; rooting; proper; education; portrayal; grounding; sensationalized; medium; extorting; lie; half; truth; society; order; increase; popularity; needed; mind,-1
8kq5s7,AirplaneNote,,,488
8kkifm,ThePigmanAgain,lifeline; clementine; ford; debacle; happens; next,,-1
8kjs1e,93re2,article; foreskin; face; cream; beauty; product; future,,-1
8kjobe,furchfur,musical; student; accused; raping; fellow; undergraduate; cleared; juror; le; three; hour,,-1
8kjmuv,BoozeBumAddict,woman; cut; penis; kill; get; charged; manslaughter,,-1
8kjj4z,ASetBack,army; taking; stand; sexual; assault,,-1
8kj4bn,JohnKimble111,jordan; peterson; calmly; dismantles; feminism; infront; feminist,,-1
8kiop8,marsmgtow,single; mother; destroying; america,,-1
8kilbq,vanillatootsierolls,playboy; model; kill; self; jumping; skyscraper; custody; battle; husband,former; playboy; model; jump; building; year; within; custody; battle; nypost; playboy; playmate; took; young; fatal; leap; building; source; zergnet; medium; referral; campaign; zergnet; tragic; action; story; say; court; divorce; feminism; child,-1
8kigjk,Jacobrts,,,489
8kig2k,Mens-Advocate,hedy; lamarr; invent; spread; spectrum; frequency; hopping; cellphone; wifi,modern; society; feminist; myth; making; machine; say; documentary; touted; bombshell; hedy; lamarr; story; alexandra; dean; wnet; americanmasters; bombshell; hedy; lamarr; story; film; wnet; americanmasters; bombshell; hedy; lamarr; story; film; host; publication; invention; spread; spectrum; technology; woman; inventor; hedy; lammar; woman; inventor; hedy; lammar; actress; hedy; lamarr; became; mother; story; actress; hedy; lamarr; became; mother; story; actress; hedy; lamarr; became; mother; spreading; word; mother; sciencefriday; segment; hedy; lamarr; sciencefriday; segment; hedy; lamarr; actress; hedy; lamarr; inventor; cellphone; digitaljournal; article; digitaljournal; article; skeptic; judgybitch; hedy; lamarr; really; invent; frequency; hopping; communication; technology; judgybitch; hedy; lamarr; really; invent; frequency; hopping; communication; technology,-1
8kifmz,Absintheuphoric,going; walk; aisle; alone; feminism,,490
8ki4po,Mooner99267,another; school; shooting; america; going; realize; failing; young; boy,boy; always; committing; act; domestic; terrorism; obvious; natural; result; society; unequal; treatment; young; boy; girl; need; stand; really; understand; way; america; failing; young; boy; point; feel; need; shoot; school; feminist; like; girl; le; confident; academic; spend; meanwhile; boy; shooting; school; treated; society; feminist; like; boy; evil,-1
8khwqz,Sinner12180,start; talking; toxic; femininity,committing; violence; toxic; masculinity; playmate; killed; father; custody; plethora; similar; case; toxic; femininity,-1
8khpzf,TheAndredal,going,,-1
8khjbo,Jex117,sandra; bullock; ellen; joke; foreskin; facial,,-1
8kheu7,disney04,please; sign; important; petition; education; network,change; newsela; newsela; make; article; gender; friendly; recruiter; source; share; petition; medium; copylink; campaign; share; petition; site; known; woman; report; sexual; trauma; change,-1
8khbt1,J_A_R_Y_A_I_M_E,piggy; lady; remember; raised; illusion; equality,,491
8khb4q,theothermod,sadness; living; without,,-1
8kh904,J_A_R_Y_A_I_M_E,piggy; lady; remember; raised; illusion; equality; right,,-1
8kgyuk,JohnChrissy,yale; probed; accused; toxic; environment,,-1
8kgyfm,ColorMeCrippled,feminist; read; true; fact; feminist; statistic; accept,,-1
8kgv1s,ALTSuzzxingcoh,ignore; deserves; immense; medium; backlash,,-1
8kgri2,Ezreal3,veggie; grill; bathroom; available,,-1
8kgqfc,Corneba,either,,-1
8kgqcb,Rethgil,national; paper; us; photo; nazi; tshirt; represent; men; right; describes; jordan; pieterson; white; male; maggot; victim; nazi; cry; toxic; whiny; incels; terrorist; failure; rotting; body; recall; yesterday; poster; claimed; one; angry; bitter,,-1
8kgoe5,Rethgil,national; paper; us; photo; nazi; tshirt; represent; men; right; describes; jordan; pieterson; white; male; maggot; victim; nazi; cry; toxic; whiny; incels; terrorist; failure; rotting; body; recall; yesterday; poster; claimed; one; angry; bitter,,-1
8kglhr,Dinkle_,regarding; jordan; peterson; article,,492
8kgae4,IsItTheFrankOrBeans,playboy; playmate; took; young; fatal; leap; building,,-1
8kg2pd,AlexIsKingly,world; famous; male; comic; join; waiting; list; waiting; latest; craze; fake; lip; actually; made; discarded; labium; proceedures; rickles; proclaims; finally; throw; decent; raspberry,,-1
8kfue6,Fuckoff555,woman; whose; acid; attack; lover; left; pain; took; life; cleared; murder; manslaughter,,-1
8kfu2h,LostAtSea666,penis; facial; female; beauty; treatment; us; foreskin; newborn,,-1
8kftvm,borga,york; time; run; comprehensive; piece; jordan; peterson; dishonest; malicious; crap,,-1
8kfnxy,Fuckoff555,woman; whose; acid; attack; lover; left; pain; took; life; cleared; murder,,-1
8kfdha,GreasedLightning,honest; gold; digger; hilarious; make; wonder; stay; kinda; lady; intimidates; manipulates; money; role; reversed; line; around; fuckin; block; kick; abusive; guy; marry; woman; cater; every; whim,,-1
8kf8s7,deedoedee,former; playmate; joint; custody; attempt; keep; europe; entire; summer; kill; judge; revoke; passport; father; custody; right,,-1
8kf3a9,voltaire_had_a_point,raped; deny; rape,,493
8kf1mc,Revenant221,former; playboy; centerfold; apparently; jump; death,,-1
8kevdu,AndrewLevin,mother; murder; custody; dispute; news; paint; victim; playboy; playmate; stephanie; adam; life; plagued; personal; woe; death; plunge,,-1
8kelq9,Jacobrts,nother,,494
