post_id,author,title,body,image
8iji78,lolzerker,detroit; lion; head; coach; matt; patricia; address; false; accusation; sexual; assault,,-1
8ijg3h,smfuel87,found; single; profile,,585
8ijc5y,Blutarg,witch; hunt; real; time,want; ground; floor; witch; hunt; rev; gear; detroitlions; right; allegation; surfaced; matt; patricia; brand; head; coach; detroit; lion; committed; rape; year; college; student; accused; indicted; accuser; decided; would; much; trouble; trial; declined; testify; people; apparently; much; practice; thinking; legal; matter; contend; possibility; false; rape; accusation; rare; blue; moon; believe; victim; remember; innocent; proven; guilty; somehow; right; learned; belief; woman; always; make; false; allegation; rape; never; trusted; news; flash,-1
8ijazk,Professor_Blumpkin,whatever; happened; michael; date; rape; case; santa; monica,,-1
8ij4b2,ThePigmanAgain,toxic; masculinity; next; generation; boy; australia; know; expect,,-1
8ij0pg,DougDante,drowned; mississippi; river; cloud; veteran; left; hospital,,-1
8ij02x,DougDante,want; make; feel; inferior; open; door,,-1
8iiynl,DougDante,female; student; accused; sexual; misconduct; sue; university; cincinnati,,-1
8iivp0,HeForeverBleeds,york; time; response; increased; awareness; female; child; rapist; female; rapist; rare; derailing; metoo,,-1
8iii9r,MRATemp1,laid; feminist; actually; woman; general; seem; believe; would; woman; laid,,-1
8iifb9,MRATemp1,blue; piller; think; laid,,-1
8iicat,Urzah74,single; father; exist; apprantly,,586
8ihu7t,swiet,feminist; probably; never; understand,,-1
8ihhv5,Professor_Blumpkin,whatever; happened; michael; rape; case; santa; monica,jezebel; gal; stopped; rape; last; night; three; badass; woman; stopped; would; drug; facilitated; rape,-1
8igkjt,Absent4u,please; suitable; wanted; people; know; developed; help; reunite; kid; failed; relationship; kid; action; left; relationship; kid; ruined; want; learn; truth; hope; help; someone,,-1
8iggfa,emoprairiedog,institutionalized; domestic; violence; double; standard; harry; crouch; rprf,youtube; watch; ijqwqpgwleo; youtube; watch; ijqwqpgwleo,-1
8ig8jz,SignificantOpposite,drafted; military; woman; drafted; duty; incels,inspiration; youtube; watch; ashnw,-1
8ig7mt,sonar_avalon,mention; rape; teacher; female,,-1
8ifrlm,cs_al_coda,family; restroom,,587
8ifr61,TheAndredal,surprising; woman; openly; talk; female; privilege,,-1
8ifn4n,CrispyMiner,need; help; fact; male; discrimination; school; project,school; project; male; discrimination; chose; need; help; example; evidence; male; discrimination; happening; google; helping; much; prove; classmate; wrong; male; discrimination; exist,-1
8ifai6,Icyx,mra; right; activist; year; david; bowie,,-1
8if6rg,Daredevilpwn,think; objectification,looking; reading; sexual; objectification; refers; using; sexuality; woman; order; entice; whatever; product; sold; deny; happens; general; sentiment; somehow; dehumanizes; woman; make; woman; seen; nothing; object; male; desire; skeptical; understand; people; annoyed; constant; sell; product; know; idea; woman; dehumanized; seen; lesser; people; something; skeptical; wondering; think; portraying; someone; sexy; desirable; dehumanizes; somehow; objectified; much; woman,-1
8if520,rbrockway,amra; podcast; amra,,-1
8if2f0,MRATemp1,mras; write; boy; coalition; demand; ally; foog; kicked; right,,-1
8if0u0,rick7475,religious; issue; need; support,believing; catholic; mormon; muslim; buddhist; hindu; others; need; support; getting; really; sick; tired; anti; name; religion; tirade; religious; commit; suicide; homeless; veteran; ptsd; mental; health; issue; need; support; abused; spouse; others; treated; unfairly; divorce; falsely; accused; crime; like; religion; bash; sub; need; support; religious; need; advice; issue,-1
8if0ly,swiet,multiple; oscar; winning; director; call; metoo; collective; hysteria,,-1
8iewxy,everydayadrawing,question; know; work; warren; farrell,full; disclosure; tried; posting; question; jordan; peterson; subreddit; single; quality; response; hoping; user; better; informed; help; question; interview; jordan; peterson; first; thing; cited; came; benefit; father; around; outcome; child; idea; child; father; much; better; delaying; gratification; know; associated; long; term; positive; life; outcome; anybody; know; literature; argument; depth; know; whether; claim; ever; shown; result; father; present; child; life; could; plausibly; result; following; ability; defer; gratification; least; partly; genetic; trait; people; better; defering; gratification; better; maintaining; long; term; relationship; marriage; getting; divorced; therefore; child; born; world; stable; parent; likely; genetic; disposition; deferred; gratification; like; parent; another; point; farrell; brought; child; rasied; father; le; likely; exhibit; adhd; question; applies; surely; father; childcare; random; sample; population; likely; quite; responsible; probably; lower; average; exhibition; adhd; adhd; partly; genetic; expect; child; father; stay; home; raise; kid; le; likely; adhd; mother; stay; home; default; society; accepted; default; role; hope; question; make; sense; would; like; learn; thing; factored; finding; finding; shown; hold; genetic; factor; taken; account; example; child; stable; family; father; dy; accident; leaving; widowed; mother; likely; develop; adhd; become; worse; delaying; gratification; might; intuition; would; would; like; proved; wrong,-1
8ievtr,Lsarah,basic; component; college; application,,-1
8ieu64,wfkp,woman; outnumbered; higher; education; worldwide; since; gender; disparity; continues; grow; year; imbalance; highlight; boy; educational; underachievement; pretty; much; every; stage; education,,-1
8ieqzs,a-Gangst,better; creature; woman; patrice; neal,,-1
8iekk5,shadowguyver,feminism; book; million; yesterday,,-1
8ieayl,Mode1961,rant; woman; fantasy; another; woman; rape,last; couple; year; seen; several; known; people; accused; kind; horrible; thing; choked; till; passed; hard; busted; couple; day; went; looking; internet; reddit; fetish; stuff; role; play; rape; role; play; beating; choking; came; away; feeling; woman; like; thing; decided; talk; wife; expressed; fantasy; getting; rape; tearing; clothes; forcing; expressed; slight; fantasy; choking; near; passing; tell; couple; female; friend; regular; basis; thinking; tell; difference; come; year; later; woman; saying; want; told; imho; could; essence; metoo,-1
8ie9be,bored_imp,post; feminist; feminist; agree; gender; equality,,-1
8ie8ry,furchfur,cambridge; student; demand; assault; rule; make; easier; prove; disciplinary; case; amid; claim; predator; university; getting; away; crime,,-1
8ie25m,Noah4224,anyone; else; following; happening; overwatch,thought; really; understand; point; someone; going; toxic; going; toxic; insult; based; anything; know; example; know; homophobic; know; female; sexist; thing; race; really; understand; think; trying; make; gender; issue; really; toxicity; issue,-1
8ie19n,Leister4521,deal; metoo; allegation; accuser; prove; happened; accused; official; capacity; deny; asault; allegation; demand; proof; poorhouse,,-1
8idl25,RedPill01,pill; nation; hangout,,-1
8iddwu,andejoh,college; athlete; arrested; rape; accuser; trouble; police,another; story; woman; falsely; reported; raped; male; student; punished; school; prior; investigation; archive; archive; something; little; different; story; though; prompted; question; pearson; longer; listed; glen; campbell; detention; center; record; word; given; bond; situation; usually; prison; time; story; made; public; whether; remain; student; moot; case; seems; question; imgur; imgur; direct; title; coordinator; coker; doubt; response; point; sometimes; simply; place; notice; establish; paper; trail; event; student; student; falsely; accused; case; need; file; title; complaint,-1
8id82t,joker20201988,canadian; woman; brown,,-1
8id6fw,Fitzimo,girlfriend; brought; point; future; female,feminist; watched; pill; feel; egalitarian; cover; broad; spectrum; gender; issue; understanding; mras; hope; gender; issue; eliminated; everyone; unconsciously; naturally; egalitarian; balance; force; point; future; female; transphobic; seeing; transexual; died; presented; identity; world; female; right; claim; specific; spectrum; gender; dominate; structure; society; coming; year; basically; paris; burning; great; documentary; gender; role; reversed; enjoy; informing; next; feminist; representing; oppressive; slogan,-1
8id1uq,Ellis1960,sleather; bracelet; shirl; ellie; ebay,,-1
8icqmp,lostapwbm,ippr; earnings; caused; working; woman; employer; govt; force; work; le,,-1
8k4hbb,TheAndredal,,,-1
8k4fdg,BlindNowhereMan,teen; accused; lying; raped; change; story,,-1
8k4aic,NynjaWerewulf,crisis; sobering; look; state; boy; warren; farrell; tedx; talk,,-1
8k3xms,metinb83,need; minute; survey; personality; time; perception,guy; hard; time; making; voice; heard; survey; like; many; academic; project; study; mainly; woman; communicated; opinion; feeling; course; happy; intention; report; female; perspective; hope; reaching; hear; male; side; take; minute; complete; survey; aytm; appropriate; sincere; apology; know; else; turn,-1
8k3tu6,ColorMeCrippled,jury; order; blogger; million; army; colonel; accused; rape,,-1
8k3ror,DeepStateSucks,feminist; group; demand; spotify; hate; content; policy; applied; chili; pepper; eminem; funny; feminist; vile; hypocrite; boot; fine; hate; long; term,,-1
8k3lpg,Lranki709,banned; feminism,welp; start; posted; reddit; post; previously; woman; abused; child; year; title; think; nice; sleep; wake; banned; like; ignoring; denying; stuff; like; work; sorry; bout; grater; spelling,-1
8k3jdl,mvijay92,recently; concluded; election; indian; state; mra; vote; feminist; candidate; hope; national; election; feminist; trumped; like; happened,,-1
8k3ik1,93re2,anthony; lempert; discus; think; circumcision; banned,,-1
8k3gj1,bhavv,must; help; poor; woman,,588
8k38zb,rbrockway,female; rideshare; service; allows; boy; high; school; service; female; guardian,,-1
8k2xdx,InBaggingArea,diseased; animal; kill; street; gendercritical,,-1
8k2lc0,fodaychurch,woman; using; kid; weapon,youtube; watch; xpzw; youtube; watch; xpzw; society; woman; would; kid; emotional; tool; destruction; reason; satan; could; explain,-1
8k2j8p,perplexedm,india; dead; get; justice; rape; murder; case; bizarre; turn; event; ruling,,-1
8k2cz9,furchfur,whitney; houston; family; reveal; late; singer; sexually; abused; child; female; cousin; never; told; mother; ashamed,,-1
8k2bh2,furchfur,woman; look; ahead; incendiary; view; academic; argues; metoo; brigade; robbing; woman; vital; weapon; erotic; capital,,-1
8k2acv,Paris-Burned-Again,female; look; ahead; career; male; shook; allowed; trust; consensual; female; without; repercussion; woman; give; right; using; look; advantage; start,,-1
8k28wn,furchfur,advert; portray; gender; stereotype; boy; daring; girl; caring; face; banned; crackdown; watchdog,,-1
8k1wuc,SmallFlyingPolarBear,mansplaining; femsplaining,thing; different; make; sure; correctly; mansplaining; talking; topic; knowledgable; assuming; others; ignorant; femsplaining; talking; topic; know; nothing; assuming; feeling; make; expert,-1
8k1w6q,ThereAreThings,gain; right; movement,proud; mra; right; activist; friend; movement; tell; something; anomaly; happy; part; movement; rightly; point; probably; never; worry; false; accusation; child; custody; nightmare; furthermore; never; subjected; genital; mutilation; circulate; freely; among; woman; without; fear; perceived; predator; bank; book; great; question; entirely; sure; answer; except; movement; speaks; something; deep; within; grew; without; father; father; figure; healthy; male; peer; group; recent; year; come; realize; badly; needed; platonic; male; companionship; never; know; love; father; forge; healthy; meaningful; relationship; thanks; large; part; movement; given; space; honestly; discus; issue; guess; curious; know; guy; think; relation; movement; role; play; role; play; movement; appreciate; reply; worry; offending,-1
8k1bop,loganblade14,modesty; poncho; great; idea; help; girl; stop; distracting; boy; naked; school; distracting; boy,,589
8k1a48,JohnKimble111,jordan; peterson; repeatedly; clash; leader; woman; equality; party,,-1
8k1675,anhbaocga,health; news; white; bump; penis,,-1
8k157r,TibortheChechen,state; west; today; focus,,-1
8k155b,JohnKimble111,advert; portray; gender; stereotype; boy; daring; girl; caring; face; banned; crackdown; watchdog,,-1
8k10cy,I_AM_ALWAYS_ANGRY,okay; towards; guy,,590
8k0mf1,JohnKimble111,bride; stabbed; brother; face; wedding; cake; knife; vicious; brawl; groom; avoids; jail,,-1
8k085i,lostapwbm,corinth; woman; accused; making; false; rape; claim,,-1
8k05ta,Jacobrts,wage; summarized; meme,,591
8k048w,dandan_56,woman; live,kill,-1
8k045i,IsItTheFrankOrBeans,newton; woman; claim; lied; domestic; assault; past; weekend,,-1
8k00x8,iRyan23,year; probation; instead; year; prison; character; rape; year,,-1
8jzyhf,BernieSandersgirl101,argument; made; angry; men; right; activist; privileged; whining; reality; would; plain; cake; woman; would; want; cherry; cake,,-1
8jzm96,ParrotSex,face; cleared; year; long; false; conviction; murder,,-1
8jz4v8,WarOfNoise,teacher; student; offender,,-1
8jyz57,wiseprogressivethink,campus; kangaroo; court; finally; used; woman,,-1
8jyx6r,cireorelum1,short; centering; around; redpill; made; guy; think,therookies; film; year; animation; fatal; rror; typical; sucker; trying; take; walk; wild; side; therookies; film; year; animation; fatal; rror; typical; sucker; trying; take; walk; wild; side,-1
8jytif,com-com-company,totally; screwed; view; right,,-1
8jyqws,iRyan23,paedophile; sister; abused; decade; jail; time; sure; story; would; little; different; brother,,-1
8jyn8q,AnotherDAM,neonatal; trauma; related; brain; plasticity; possible; link; circumcision; autism,,-1
8jxywl,humanrights_Account,take; human; right,writing; throwaway; account; middle; custody; trial; equal; custody; wanted; little; anonymity; subscribed; subreddits; dealing; sort; gender; issue; learned; gender; right; mean; different; group; noticed; every; group; asshole; people; looking; fight; little; opinion; gender; issue; think; gender; better; broad; stroke; view; strength; weakness; granted; universal; statement; fully; support; equal; opportunity; everyone; chance; person; next; struggle; changing; criterion; achieve; outcome; compare; apple; apple; humble; opinion; different; criterion; based; leg; step; backward; human; equality; support; equal; opportunity; artificially; creating; equal; outcome; topic; compliment; work; primarily; woman; business; owner; majority; client; female; developed; relationship; client; learned; perversion; gender; blind; barrier; acquaintance; friendship; lowered; pretty; good; view; side; think; heard; woman; talk; need; laid; much; friend; talked; like; heard; woman; dating; free; meal; must; admit; know; male; friend; done; accused; dramatic; express; dislike; accused; want; someone; boob; write; sure; many; wondering; work; honestly; fully; explain; without; blowing; cover; vague; answer; woman; company; money; ready; boudoir; photo; shoot; back; topic; compliment; sorry; went; course; compliment; awesome; know; comfort; zone; wear; something; different; feel; great; someone; make; positive; remark; gender; someone; deserves; compliment; give; remember; high; school; called; creepy; comfortable; complimenting; woman; remember; time; frustrated; commented; perhaps; creepy; fact; comfortable; taking; compliment; year; later; admitted; liked; little; thing; noticed; fact; comfortable; telling; instead; answered; negative; comment; understand; ranting; actually; helpful; vent; middle; feel; infringement; human; right; parent; anyone; good; person; anyone; asshole; matter; innie; outie,-1
8jxm4t,RedditIsMyCity,middle; school; woman; make; false; rape; accusation,year; grade; female; grader; oral; grader; locker; room; spread; story; friend; eventually; teacher; heard; story; order; evade; trouble; girl; claimed; forced; oral; grader; school; course; belief; without; looking; evidence; including; camera; footage; took; grader; father; grade; teacher; make; school; actually; look; evidence; mainly; camera; footage; risk; labeled; offender; investigate; week; find; eventually; camera; footage; proof; consensual; girl; punished; besides; point; year; child; would; labeled; offender; based; word; grader; nothing; else; look; evidence; trying; send; juvy; based; word; little; girl,-1
8jx565,icemanthrowaway123,alimony; slavery; getting; better; worse,around; reddit; hear; people; saying; lifetime; alimony; dead; poster; virginia; lifetime; alimony; exceeded; take; home; income; five; year; marriage; jersey; recently; went; jail; lifetime; alimony; exceeded; take; home; income; four; year; marriage; prior; cohabitation; alzheimers; florida; either; jail; dead; court; refused; cancel; alimony; short; marriage; decade; prior; refused; adjust; payment; given; condition; retired; court; reinstated; alimony; based; highest; income; ever; claiming; voluntary; reduction; income; since; relatively; short; marriage; shill; account; saying; lifetime; alimony; dead; movement; kill; think; something; funky,-1
8jwbax,mvijay92,bill; cleared; bangladesh; filing; false; case; dowry; invite; punishment,,-1
8jw882,mvijay92,understanding; systematic; ignorance; towards; indian; boy; issue,,-1
8jvusm,Paris658975,think; thing; white; feminist; forgotten; need; strong; white; protect; oppressed; feminist; colour; thier; vanity; downfall; white; feminsm,,-1
8jvtnw,Finna_seethe,complete; noob; guy; clarify; somethings; supposed; health; benefit; specific; research; surrounding; like; american; pediatric; association,reddit; drama; comment; rmenslib; discus; male; genital; mutilation; ground; qxqh; like; stuff; comment; read; american; recommends; circumcision; legit; research,-1
8jvp8d,TRP_me,get,,592
8jvi5u,cagolebouquet,study; link; men; right; activist; neckbeardism,,-1
8jvhv2,The-beat-man,bronx; tale; door; test; full; version,youtube; watch; hajdqzrm,-1
8jvc62,dognose,privacy; office; imagine; happening; woman,,-1
8juzdh,IamPatbrick,suspended; teacher,,-1
8juwwq,IamPatbrick,suspended; teacher,,-1
8juog5,GreyTortoise,google; feminism; stop; typing; little; funny; suggestion; feminism; logic,thought; might; enjoy; laugh; help; keep; silenced; little; telling; searched; among; feminism; thing; seems; people; understanding; zealous; ideology; movement,-1
8junl4,hermopietrobon,daily; reminder; occurred; hide; away; drafted; sent; fight,country; capital; offense; would; killed; succeed; hiding; away; wild; alone; year; finished; still; face; capital; offense; recorded; name; woman; stayed; around; council; essentially; come; back; would; literally; deserter; killed; name; fallen; hero; betraying; everybody; hate; think; next; time; hear; woman; pushing; civil; bullshit; vote; party; inviting; horde; alien; essentially; fulfilling; recipe,-1
8jujz8,jostler57,tiny; house; built; seattle; homeless; catch; though; site; woman; full; disclosure; site; gender; specific,,-1
8jujvv,orcwordlaugh,female; crash; ambulance; assault; steal; necklace; zero; jail; time,,-1
8jugcq,lovemyusername,post; relationship; dump; husband; life; life; housewife,husband; married; year; together; known; longer; feel; like; rely; partner; rest; life; first; started; dating; working; hard; make; enough; money; college; without; loan; motivated; driven; picked; major; based; would; large; market; turn; hate; every; post; graduation; made; miserable; sure; work; culture; husband; always; trouble; authority; like; told; especially; disagrees; whatever; asked; corporate; world; people; thing; meet; certain; expectation; tends; speak; mind; disagrees; cause; conflict; work; opinion; important; know; hold; tongue; say; sheep; problem; sleeping; missing; work; fired; last; though; laughed; told; think; told; think; could; improved; fired; misconduct; work; month; financially; okay; starting; feel; told; need; show; motivated; care; work; say; unreasonable; expectation; never; like; lost; told; looking; work; start; looking; month; later; break; lying; order; find; decided; needed; break; planned; start; looking; month; whenever; would; bring; would; angry; tell; looking; need; nagged; told; white; lie; time; think; away; back; bright; side; looking; think; sleep; surf; internet; play; game; though; disagree; month; told; expect; clean; house; cook; dinner; cooked; handful; time; clean; friend; come; every; weekend; say; need; cook; much; much; working; trouble; communicating; like; think; talk; feeling; believe; saying; sorry; mean; nothing; temper; improving; every; month; angry; video; game; scream; throw; thing; never; still; scary; aware; everyone; flaw; come; long; term; relationship; trying; supportive; encouraged; look; different; type; work; might; make; happier; think; anything; viable; running; emotional; support; longer; respect; feel; like; rely; anything; say; depressed; though; threatened; divorce; asked; book; counseling; appointment; work; sure; getting; anymore; okay; enough; rely; husband; hold; take; care; house; provide; emotional; support; tell; truth; small; thing; wit; feel; like; supposed; supportive; thing; better,-1
8judrq,joeyupstate,wonder; long,,-1
8juc3o,AndrewLevin,golfer; miss; shot; wife; go; ballistic; golfer; lucas; glover; wife; krista; arrested; allegedly; attacking; mother,,-1
8ju4un,swiet,according; feminist; learning; foreign; language; misogynistic; racism,,593
8ju1k0,elgreco390,want; date; modern; woman,,-1
8jty9h,PM_ME_UR_PC_SPECS,parallel; history,imgur; imgur; historyanswers; content; uploads; suffragette; plain; thing; historyanswers; content; uploads; suffragette; plain; thing,-1
8jtrzi,furchfur,bank; england; deputy; apologises; offence; caused; describing; economy; menopausal; mark; carney; described; unreliable; boyfrined,,-1
8n1bcl,robertlo9,ocean; ocean,usually; figure; wage; peddler; claim; woman; make; compared; work; though; comparing; woman; wait; hear; story; actress; made; le; role; male; counterpart; film,-1
8n14in,boringcarpets,brendan; neill; attack; masculine; value,,-1
8n142k,boringcarpets,brendan; neill; modern; sexual; politics,,-1
8n0u9a,ThePoliticalHat,prof; creates; guide; challenging; anti; male; discrimination,,-1
