post_id,author,title,body,image
8iovos,wfkp,single; woman; buying; home; twice; rate; single; paying; average; trend; accelerating; home; builder; picked; designing; home; appeal; woman; preference,,-1
8iojhc,RingosTurdFace,jealous; person; stab; partner; face; time; whilst; saying; going; kill; walk; free; court; guess; gender,,-1
8ioj1h,pokemon_fetish,hidden; crisis; fuelling; incel; rebellion,,-1
8ioewh,TheAndredal,female; student; reaction; uoft; event; calling; centre; sarah; rprf,,-1
8io704,boringcarpets,feminist; frequency; privilege; propaganda,,-1
8inwph,Lion_amongst_gods,advice; woman; could; easily; avoided; male; vilification,,521
8inqbg,januarypizza,story; consent; campus; confirm; read; woman; mind,,-1
8inbbt,rbrockway,careful; consenting,,-1
8in8yh,ionstorm20,legal; system; biased; thought,,-1
8in46j,AndrewLevin,mexico; woman; kidnapped; molested; oklahoma; authority; female; perpetrator; used; threat; violence; guess; word; missing; story,,-1
8in12l,aprilmariko,facebook; study; feminist; discovered; regularly; visit; website; promote; racial; superiority,,-1
8imzyz,whatafoolishsquid,female; privilege; finest; college; student; expose; presenting; thesis; somehow; professor; apologize,,-1
8imjn2,EricAllonde,fired; debunking; feminist; dogma; fact; relationship; australia; sacked; experienced; male; counsellor; posting; truthful; article; domestic; violence; personal; facebook; page,,-1
8imjkb,shit-zen-giggles,drag; queen; banned; performing; free; pride; glasgow; event; fear; act; offend; trans; people,,-1
8imjfz,furchfur,guy; stopped; whistling; finished; joan; collins; lookalike; blast; metoo; movement; making; scared; flirt; insists; trump; le; sexist; woman,,-1
8imfoy,JackFisherBooks,okay; exchange; favor,,-1
8ilak6,PeterWrightMGTOW,dismissal; bettina; arndt,,-1
8il4fm,Mooner99267,probably; slap; wrist,,-1
8ikyi6,SteelerSuperFan,world; largest; orgy; planned; next; month; ban; single; single; woman; allowed,,-1
8ikn91,vanillatootsierolls,woman; raping; woman,,-1
8ikk4r,Auto8,gender; attraction; differential; fundamental; difference; evaluation; self; potential; mate,,-1
8ikhbo,Honztastic,woman; raped; stat; came; everything; heated,talking; friend; repeated; stat; came; said; doubted; accurate; obviously; thing; heated; listening; effort; educate; either; change; affirm; opinion; trying; find; actual; dissection; source; claim; reddit; search; helpful; google; go; gawker; buzzfeed; article; reiterating; figure; anyone; point; right; direction; saved; cache; discussion; source,-1
8ik8bm,andejoh,confirm; whether; victim; male; female; need; know; outraged; supposed,reading; violence; broke; soccer; match; medium; really; playing; victim; female; tun; victim; male; archive; mthzl; selection; archive; mthzl; selection; editor; note; earlier; reported; victim; attack; supporter; caught; camera; female; security; guard; official; clarified; person; fact; male; guard; course; caused; paragon; journalistic; integrity; huffpost; blow; outrage; gasket; disclaimer; according; report; timeslive; sport; soccer; security; guard; fighting; life; kaizer; chief; fan; riot; security; guard; male; security; guard; confirmed; archive; psagx; archive; psagx; instead; running; tweet; referred; guard; woman; fake; news; long; serf; agenda; report; seen; make; mention; guard; lost; importance; found; male,-1
8ik4th,MasterGosu007,actor; cold; read; fact; feminism; teleprompter,,-1
8ik14s,beers-and-bratwurst,woman; income; drop; divorced; divorce; started; woman,,-1
8m2o72,Le_Omlette,woman; better; prove; wrong,,-1
8m2jiw,rbrockway,last; year; zimbabwe; government; indicated; would; introducing; mandatory; paternity; testing; putting; name; birth; certificate,,-1
8m2jbb,rbrockway,last; year; zimbabwe; government; indicated; would; introducing; mandatory; paternity; testing; putting; name; birth; certificate,,-1
8m26pz,NBLSS,james; caan; say; strange; place; woman,,-1
8m1gvj,antprince,beloved; actor; morgan; freeman; accused; sexual; assault; metoo; vancouver; ferry; halt; freeman; voice; exit; gift; shop; burger,,-1
8m1bqz,CertainItem,trooper; name; officer; falsely; accused; sexual; assault; fight; shaun; king; post,,-1
8m1ang,HierEncore,harvey; weinstein; arrested; rape; charge; based; hearsay,,-1
8m16i3,nerddevil,civil; court; decision; creates; billion; dollar; precedent; rape; victimhood; status,washingtonpost; news; post; nation; rape; victim; awarded; billion; juror; told; youre; worth; something; term; washingtonpost; news; post; nation; rape; victim; awarded; billion; juror; told; youre; worth; something; term,-1
8m14cs,a-Gangst,like; winner; woman; hate; charge; patrice; neal; woman; moment; honesty; place; expectation,,-1
8m0x49,Imchildfree,paternity; testing; standard,hello; woman; opinion; regarding; paternity; fraud; honestly; think; every; paternity; test; child; matter; married; child; look; like; finally; technology; eliminate; practice; reason; anymore; paternity; ever; question; become; standard; feel; need,-1
8m0cyd,furchfur,sweden; change; make; without; consent; rape; silence; longer; interpreted,,-1
8m0clu,furchfur,probably; hating; country; world; sweden; change; make; without; consent; rape; silence; longer; interpreted,,-1
8m02vb,swiet,celebrity; left; falsely; accused; least; woman,,522
8lzkuc,WarOfNoise,hopefully; glitch; review; pill; documentary; cassie; jaye; gone; amazon,,-1
8lzd53,nerddevil,probably; mean; false; rape; allegation; future,washingtonpost; news; post; nation; rape; victim; awarded; billion; juror; told; youre; worth; something; term; washingtonpost; news; post; nation; rape; victim; awarded; billion; juror; told; youre; worth; something; term,-1
8lytpz,raffu280,allstate; insurance; commercial; portrays; wistfully; incompetent; needing; reined; condescending; girlfriend; wife,,-1
8lytmy,dazed111,morgan; freeman; wrong; sexually; suggestive; comment,clip; today; youtube; watch; bbyysocsyaq; bother; finding; original; idea; clip; newswoman; outraged; morgan; freeman; made; sexually; suggestive; comment; fighting; hard; usually; people; trying; censor; sexual; comment; excuse; inappropriate; workplace; environment; case; costars; working; movie; together; interviewing; never; specify; make; sexually; suggestive; comment; seems; make; anywhere; except; girlfriend; wife; private; like; think; point; sexual; behavior; common; point; start; censoring; impetus; sick; censoring; beautiful; woman; think; head; damn; filter; brain; mouth; hate; untrue; saying; anything; people; seen; away; sexually; suggestive; comment; russell; brand; patrice; neal; ofcourse; charming; planet; think; make; comment; anymore; patrice; dead; russell; finding; feminism; whatever; talked; podcast; wrong; past; behavior; think; anymore; thought; start; censoring; feminism; blame; theorist,-1
8lylsc,No1sBeeyotch,jason; mastur; bateman; fucking; pussy,matt; damon; say; something; reasonable; sjws; complain; apologizes; like; spineless; little; bitch; afraid; might; lose; little; money; really; start; treating; shouting; match; like; rape; case,-1
8lyh3g,voiceofpersonality,know; feminist; mean,,523
8lygyd,-Awobabobbob-,know; woman; given; small; section; local; newspaper; deserves; wider; audience,,-1
8lygkc,HauntingUse,scumbag; savage; say; feel; entitled; woman; body,,-1
8lyf9t,AVoiceOfReason,statistic; bachelor; degree; requirement; discriminates,anybody; tried; suing; discrimination; light; indisputable; fact; substantially; fewer; percentage; bachelor; degree; organization; lawyer; would; want; case; obvious; statistic; stats; stackexchange; question; significance; relationship; bachelor; degree; higher,-1
8lyejb,pikachani,said; sexually; assaulted; state; trooper; camera; footage; show; otherwise,,-1
8lycms,mwobuddy,morgan; freeman; apparently; guilty; inappropriate; behavior; harassment,,-1
8ly9o1,LostAtSea666,harvey; weinstein; hypocricy; insider; take,,-1
8ly271,DougDante,oklahoma; accused; firing; employee; voicing; concern; would; would; worry; kid; anymore,,-1
8ly1uo,DougDante,registered; offender; keep; custody; daughter; came; forward; adult; custody; hearing; oklahoma; help; back; claim; never; happened,,-1
8ly16i,Consilio_et_Animis,leading; understand; woman; would; make; false; sexual; abuse; allegation; mystery; baffling; bizarre; illogical; make; sense,,-1
8lxyo9,seacookie89,santa; clara; county; charge; elissa; ennis; reuben; foster; girlfriend; charge; domestic; violence; victim; falsely; recant; empathize; support; advocate,,-1
8lxpur,JohnKimble111,chief; win; hounded; sexist; female; bos; trying; abolish; macho; culture,,-1
8lxk38,93re2,justice; failed; say; initiate; father; news; national,,-1
8lxif1,wiseprogressivethink,fayetteville; woman; charged; sexually; assaulting; male; cable; worker,,-1
8lxese,lostapwbm,woman; convicted; directing; girl; rape,,-1
8lxa1g,Umpato,young; girl; already; know; defend; girl,,524
8lx8qh,GreasedLightning,would; agree; person; deal; numerous; instance; assault; obligated; make; clean; evidenced; case; recording; audio; phone; instead; article; article; random; celebrity; rather; taking; court,,-1
8lx7h5,nkflsk42,male; harassed; work,episode; unbelievably; painful; endure; firm; firm; saying; protected; class; take; case; anything,-1
8lx1bd,furchfur,waiting; bring; back; campaign; slaughtered; report; say; rohingya; militant; killed; hindu,,-1
8lwxpf,antprince,jordan; peterson; gender; patriarchy; slide; towards; tyranny,recorded; special; episode; intelligence; squared; podcast; london; jordan; peterson; author; rule; life; antidote; chaos; joined; anne; mcelvoy; senior; editor; economist; head; economist; radio; discus; identity; politics; liberalism; metoo; video; youtube; watch; qrqjrsfnr; host; fair; usual; pretty; constantly; interrupt; quickly; change; subject; make; strong; point; instead; conceding; right; still; worth; listen,-1
8lwtg7,nkflsk42,seeking; lawyer; california,seeking; lawyer; employment; matter; related; issue; tip; finding; gone; though; knew; better; stigmatized; issue; floor; response; general; lack; sympathy; recourse,-1
8lwqyx,peskysquirms,moderator; mensrights; post; moderator; confession; removing; post; getting; raped; woman,,-1
8lwiep,Siguy94,thanks,,-1
8lwfzu,trevorsandler2016,woman; get; year; probation; falsely; accusing; attacking,,-1
8lwfje,TronaldDumped,molested; asleep; period; month,used; inpatient; psych; ward; said; psych; ward; girl; really; liked; physical; happened; keep; trying; time; drunk; kissed; immediately; made; obvious; time; thing; except; like; answer; instead; decided; occasionally; come; room; locked; fondle; woke; sitting; next; looking; time; feeling; cover; another; turn; actively; masturbating; woke; take; sleep; med; know; make; difference; case; report,-1
8lwew5,LasherDeviance,case; give; help,,-1
8lwci3,Blooziestite,recently; video; jordan; peterson; taking; female; using; sexuality; advancement; career; protocol; acceptable; behaviour; dress; female; work; place,,-1
8lwccq,furchfur,feminist; male; hating; economist; billion; woman; denied; choice; employment; however; reason; country; protect; woman; harmful; chemical; job; high; mortality; rate; bring; equality,,-1
8lw46r,antprince,orwell; dark; prophecy,orwell; prophetic; political; analyst; claimed; half; jokingly; government; using; instruction; manual; orwell; read; book; essay; surprised; learn; made; another; dystopian; prediction; year; prior; publication; contained; letter; friend; brenda; salkeld; cited; feminist; ivett; csaszar; essay; orwell; woman; issue; shadow; champion; decency; dark; vision; future; depicted; letter; brenda; salkeld; orwell; considered; fearful; tribe; feminist; threat; civilisation; reflected; direction; toward; world; could; move; complete; overthrow; present; order; mean; revolution; continuing; consummate; hegemony; business; accompanied; feminist; coming; power; famous; orwell; quote; year; thought; rather; reflect; civilisation; doomed; fill; else; boredom; think; horror; happening; within; year; either; appalling; calamity; revolution; famine; else; round; trustification; fordification; entire; population; reduced; docile; wageslaves; life; utterly; hand; banker; fearful; tribe; lady; astor; lady; rhonddas; genus; riding; like; succubus; name; progress; author; go; note; lady; question; prominent; first; wave; feminist; britain; astor; first; female; member; parliament; take; seat; great; accomplishment; sure; csaszar; neglect; mention; astor; elitist; snob; right; winger; economics; prohibitionist; racist; bigot; catholic; anti; semite; supporter; male; conscription; nazi; sympathizer; fascism; would; solve; problem; communist; jew; view; gender; expert; suspect; similar; first; wave; feminist; completely; hypocritical; astor; went; attack; british; soldier; fighting; italian; campaign; dodger; real; france; needle; volunteer; life; line; defeat; movement; supported; orwell; predicted; future; would; consist; corporate; capitalism; trustification; rule; banker; whereby; wage; slave; would; rendered; docile; subject; fordism; henry; ford; characterized; boring; soul; crushing; repetitive; work; assembly; line; supplemented; rule; feminist; social; progressive; name; progress; fact; exactly; happened; orwell; prediction; accurate; anything; contained,-1
8lw1xs,Lumberingfeather,bangladesh; sewer; cleaner; dive; filth; claw; blockage,,-1
8lvwjz,lola_kutty,india; year; woman; teacher; public; school; arrested; sexually; abusing; year,,-1
8lvg0w,PowerToAnnihilate,need; stay; strong,might; becoming; accepting; random; meme; post; seems; accepting; circumcision; influx; feminist; troll; something; mean; leave; spite; post; wary; change; order; accepted; society; subreddits; argument; sound; stand; merit; argument; legal; right; male; problem; need; change; argument; scream; back; feminist; downvote; reply; politely; move; contact; troll; bored; eventually; starve; attention; react; way; twist; hate; woman,-1
8lvao2,JoeParrish,maajid; nawaz; interview; jordan; peterson; highlight,,-1
8lvajz,MrComicBook,friend; mine; black,helping; someone; know; move; really; nice; girl; know; work; like; dude; truck; helping; move; pulling; box; shelf; closet; came; long; story; short; look; absolutely; horrific; said; hurt; anything; blood; rushed; super; huge; black; mark; around; pretty; rough; looking; day; point; story; boyfriend; absolutely; terrified; anywhere; accusation; regular; browser; occur; people; would; naturally; assume; teddy; bear; know; guy; aggro; bone; body; anyways; came; work; literal; first; question; asked; redacted; girl; right; natural; assumption; beat; hell; work; know; boyfriend; conversation; nice; girl; asked; know; obviously; context; question; wrong,-1
8lv4gd,pederparker,woman; file; false; domestic; violence; accusation; extort; money; player; boyfriend; went; jail; take; guess; falsely; accusing; another; boyfriend; domestic; violence,,-1
8luk8y,jagershotzz,tell; woman; stronger,,-1
8luhf9,Blutarg,janice; fiamengo; book; month,,-1
8ludr0,DavidByron2,trump; pardon; famous; victim; feminist; mann; made; crime; consensual; woman,,-1
8ltwu4,CaptainChappster,pitt; stand; weinstein; hit; paltrow; fame; power; ermmmm; daughter; blythe; danner; bruce; paltrow; time; rich; white; woman; told; shut,,-1
8ltjoq,raffu280,prof; bump; female; student; stem; grade; woman,,-1
8lth64,maxcorrice,smell; like; bullshit; anyone; else,,-1
8lt7ia,kevinderharman,banned; feminism; made; thread; porn; confuses; young; adult; basically; said; porn; reason; rape; number; still; high,,525
8lt1cz,alrun,suicide; study; looking; male; participant,,-1
8lsyqt,EricAllonde,woman; like; large; peer; reviewed; study; confirms; significant; physical; difference; male; female; brain,,-1
8ls9q9,EricAllonde,corey; white; roadmap; paradise; domestic; violence; amazing; shocking; documentary; strongly; criticises; duluth; model; feminism; australia; left; progressive; government; owned; broadcaster,,-1
8ls7lk,PietroGori,repost,,-1
8lrt80,tttulio,pewdiepie; current; drama; twitch; streamer; alinity; highlight; woman; appeal; sort; gain; financial; post,,-1
8lrk33,CaptainChappster,pitt; stand; weinstein; hit; paltrow; fame; power; ermmmm; daughter; blythe; danner; bruce; paltrow; time; rich; white; woman; told; shut,,-1
8lr2uv,Rognin,debate; wage; need; material; stats,find; comprehensive; stats; material; peer; reviewed,-1
8lr12e,nerddevil,feminist; argues; imprisonment; woman; abolished; face; inequality,,-1
8lqzew,nerddevil,hurt; brain,,-1
8lqphv,furchfur,father; spent; torturous; eight; month; jail; false; rape; claim; police; withheld; vital; phone; message,,-1
8lqon9,IsItTheFrankOrBeans,fayetteville; woman; accused; unwanted; sexual; advance; cable,,-1
8lql6t,Minoxidil,georgia; jury; award; billion; guard; rape; teen; xpost; news,,-1
8lq6ih,StarTrekReference,awesome; reminder; fewer; outlet; woman,,526
8lq4dt,lostapwbm,father; spent; torturous; eight; month; jail; false; rape; claim,,-1
8lpxiv,CanadianAsshole1,made; foolproof; argument; circumcision,,-1
8lpi2z,CanadianAsshole1,anon; explains; woman; oppressed,,527
8lp63u,ThePigmanAgain,monarchy; feminism; perfect; marriage,,-1
8lozt2,Kaiserkegaard,people; know; issue,,-1
8loxzi,wiseprogressivethink,exonerating; body; dash; footage; texas; life; would; completely; destroyed; false; rape; charge; story; wont; national; attention; course; people; make; false; accusation; police; officer,,-1
8loxdp,Ahmad1214,mensrights; post; show; reddit; home; page,sure; algorithm; seems; like; post; never; make; reddit; home; upvotes; scroll; bottom; home; page; different; sub; content; much; le; upvotes; nothing; guy,-1
8loso2,Lranki709,find; greentext; say; quite; true; woman; bonus; woman,,528
8lojcg,Vwar,hugh; grant; female; empowerment,forgive; little; tired; female; empowerment; youtube; watch; legal; disclaimer; reddit; clip; movie; seen; confused; actual; political; opinion; actor; hugh; grant; whose; opinion; unknown; would; cool; said; real; life,-1
8lohwd,NibblyPig,battlefield; trailer; pander; equality; inserting; disabled; female; protagonist; latest; game; average; violently; killed; every; second; trailer; total; around; death; death; male,,-1
8logrp,DougDante,american; woman; trillion; burden; male; female; student; debt; nearly; doubled; four; year,,-1
8logpa,Frank_N_Berry,taking; woman; child; first; effort; underway; evacuate; remote; community; threatened; wildfire,,-1
8logi7,DougDante,woman; shoot; boyfriend; catching; cheating; say; give; permission; catch,,-1
8lofmn,wiseprogressivethink,feminist; warns; conservative; appropriation,,-1
8loeer,DougDante,adhd; fake; disease; invented; pharma; drug; child; profit; adhd; kid; boy,,-1
8lodyz,DougDante,memory; rape; father; false; memory,,-1
8loanc,Sinner12180,news; article; trooper; cleared; assault; body,,-1
8lo3oq,badgerfish51,video; say,,-1
8lnze1,hipstertuna22,dear; sexist; stop; talking; favorite; stuff; date; right; reserved; woman,,-1
8lnpxn,kanara,federal; investigation; anti; male; discrimination; university; southern; california; excludes; male; student; certain; educational; opportunity,,-1
8lnlem,flushwithsanity,acid; attack; woman; jailed; life; least; year,,-1
8lnl5p,GreasedLightning,way; woman; hook; deserve,think; give; rather; fight; easier; emasculation; first; coworker; blasting; country; music; loudly; speak; customer; turned; female; coworker; mine; walked; quickly; gave; palm; strike; solar; plexus; walked; away; like; nothing; male; obviously; guilty; unfortunately; guilt; aware; saying; something; christianity; within; earshot; clearly; offended; cherry; shit; sundae; found; facebook; year; later; humanist; atheist,-1
8lni98,smashley951,drugging; without; knowledge; wrong; thing; charged,,-1
8lnd1q,TheSelfishGenie,help,really; feel; husband; saddled; insane; alimony; child; support; decade; never; situation; terrified; help; need; possibility; educating; risk; marriage; cohabitation; finding; friend; ignorant; helping; prenuptial; agreement; providing; emotional; legal; support; divorce; raped; wife; creating; counter; narrative; deadbeat; medium; game; malicious; ideally; build; charity; ground; although; question; instead; join; existing; unfortunately; really; able; find; thing; institute; kind; pursues; objective; like; thanks,-1
8lmuhy,phoenixgoldfire,satire; suffragette; booklet; like; closely; resembles; radical; feminist; argument; nowadays,,-1
8lme9s,Singlebother,moses; farrow; claim; abusive; defends; woody; allen,,-1
8lmdb1,BlueOrange22,dozen; homeless; people; vast; majority; fined; imprisoned; homeless; judge; said; sending; homeless; prison; hungry; asking; food; sentenced; month,,-1
8msj3g,q31,important; distinction,,-1
8ms89a,roonacam,woman; become; hyper; sensitive; hillary; defeat,hear; term; like; misogyny; rape; harassment; thrown; around; half; jokingly; loosely; woman; like; super; pissed; masculine; behavior; trait; hypothesis; trump; like; would; african; american; felt; barack; lost; know; kind; dominant; male; seems; like; woman; take; much; negative; approach; like; love; respect; feel; behavior; woman; used; appreciate; encourage; sudden; extremely; frowned; upon; woman; obsessed; masculinity; shaming; similar; woman; slut; shame; friend; promiscuous; need; help; parsing; hearing; guy; feel; like; address; topic; male; friend; without; garnering; gasp; negative; commentary; experience; piss; woman; doomed; pansy,-1
8ms7n0,lostapwbm,girl; made; false; accusation; rape; boyfriend; rejected,,-1
8ms3om,lostapwbm,metoo; worsening; divide; woman,,-1
8ms31b,equalitycanada,justin; trottier; canadian; association; equality; national; conference; honeybadgerradio,please; join; canadian; center; family; executive; director; talk; brian; national; conference; june; link; youtube; watch; iwmdfntzc,-1
8ms0mj,HatingMasters,play; boy; would; need; ensure; play; boy; sign; waver; accepting; accident; injury; consequence; insisting; wrestling; male; four; time; strength,,-1
8mrtng,furchfur,humour; mother; trolled; complaining; work; sign; outside; morrison; sexist,,-1
8mr5gy,starlink123,rotten; apple; trump; put; straight; james; comey,,-1
8mr4cc,DaneWhitman,update; ncfm; lawsuit; selective; service; system,know; federal; judge; hearing; ncfm; case; selective; service; system; denied; government; motion; dismiss; last; month; checking; pacer; earlier; update; found; scheduling; order; case; follows; plaintiff; ncfm; expert; report; defendant; government; expert; report; discovery; dispositive; motion; filing; dispositibe; motion; filing; mediation; joint; pretrial; order; objection; docket; call; case; going; finally; appear; moving; forward; hoping; periodically; post; update; proceeding; happen,-1
8mr32e,KanataCitizen,danielle; smith; crisis; talk,,-1
8mqyl5,ComprehensiveSoup,transgender; win; girl; state; wrestling; title; second; time,,-1
8mqfig,New7Era,tucker; carlson; secret; mexico,,-1
8mq7my,-blackoutusername-,shout; help; woman; woman; appreciate,sorry; appropriate; single; mother; neighborhood; help; little; task; example; replaced; outdoor; spigot; free; much; money; repair; around; house; know; world; helping; woman; someone; take; care; thing; think; really; grind; gear; wife; scream; nearly; every; sure; problem; unaware; either; still; asks; around; house; know; talking; get; nothing; return; know; married; somebody; long; period; time; hard; couple; argue; blown; away; number; still; care; provide; protect; help; woman; anyway; honestly; neighbor; ulterior; motive; still; completely; respectful; around; unfortunate; woman; appreciative; contribute; thing; know; certain; much; appreciation; thank,-1
8mq1vx,HauntingUse,jordan; peterson; denies; historical; oppression; woman; good,youtube; watch; imbft; xbhu; youtube; watch; imbft; xbhu,-1
8mpya2,Ted8367,diana; davison; defence; morgan; freeman,,-1
8mpw19,dlbk03,post; time; feminism,,529
8mpt5i,Lranki709,apparently; common; know; thing; opinion; story; happened,another; story; stupid; family; read; first; might; help; family; discussion; shaming; female; male; family; sister; taking; people; able; wear; ever; want; mater; size; one; quite; others; average; think; people; make; people; uncomfortable; agree; soon; anything; tell; shut; away; voice; opinion; offends; happening; along; problem; constantly; brought; subreddit; male; voice; shut; single; word; something; important; hope; great; like; world,-1
