post_id,author,title,body,image
8gs89e,Mode1961,anyone; university; mind; reading; course; think; need; soon; order; keep; job,weir; failed; read; verbal; cue; social; situation; behaviour; resulted; significant; negative; impact; complainant; statement; said; report; found; weir; told; advance; unwanted; stopped; caucus; canada; result; investigation; folk; must; learn; read; mind; order; keep,-1
8gs4pk,mgtowpower,exquisitely; precise; teardown; social; medium; driven; feminist; entryism,,545
8gs4jw,pdonson123,insane; request; white; woman; think; imposition,,-1
8gs0qa,reddituser257,german; child; support; wife; forge; signature,,-1
8grsd8,ThomYorkeSucks,getting; torn; shred; using; word; female; maybe; help; supportive; comment,,-1
8grqyx,o1ekingcole,filming; origin; wolverine; hugh; jackman; hallway; naked; prop; claw; attached; fist; turned; corner; faced; every; woman; production; staff; waving; dollar; bill; imagine; role; reversed,,-1
8grphw,ThomYorkeSucks,getting; downvoted; oblivion; using; word; female; thought; could; help; upvotes,,-1
8grm2s,furchfur,school; put; group; boy; detention; turned; fancy; dress; event; dressed; girl; would; happened; girl; worn; trouser; dressed; boy,,-1
8grh72,SleepingSheeple,trump; legal; team; literally; say; disposable; woman; fine; touched,,-1
8gr6as,HeForeverBleeds,issue; objectified; harmful; woman; objectify,might; covered; recent; article; archive; written; subject; voted; comment; agreeing; like; closed; case; argument; basically; different; patriarchy; supposed; power; imbalance; make; okay; impossible; woman; objectify; problem; argument; threefold; firstly; claim; woman; le; power; make; impossible; okay; treat; object; erroneous; like; saying; le; power; make; impossible; woman; sexist; le; physical; strength; make; impossible; woman; abuse; anyone; perceives; another; person; object; used; tool; definition; objectifying; person; supposed; power; imbalance; nothing; objectifying; people; thing; accepting; woman; address; problem; objectification; discourages; objectification; woman; encouraging; objectification; secondly; claim; objectified; already; inherently; perceived; human; being; woman; therefore; reduced; mere; object; sexualized; wrong; often; perceived; tool; rather; human; being; inherent; worth; one; social; duty; risk; life; protect; woman; expected; sometimes; forced; dangerous; life; threatening; job; order; keep; woman; safe; taken; care; climate; abnormal; people; objectify; cannon; fodder; tool; purpose; protect; woman; tool; purpose; provide; woman; woman; object; like; woman; free; meal; free; gift; value; useful; tool; much; thirdly; claim; power; therefore; affected; negatively; impacted; sexual; objectification; false; power; woman; every; area; especially; area; sexual; mistreatment; objectification; harassment; assault; sexually; victimized; woman; woman; victimized; woman; treat; object; sexually; harass; touch; without; consent; coerce; difference; socially; female; male; sexual; mistreatment; typically; get; le; consideration; society; perceive; serious; crime; male; female; sexual; mistreatment; male; victim; told; society; male; grateful; female; attention; speak; discomfort; cause; silenced; shamed; complaining; course; told; important; supposedly; privileged; empowered; therefore; truly; victimized; considering; kind; social; environment; routinely; marginalizes; female; male; sexual; mistreatment; indicate; male; power; female; come; society; treat; victim; sexual; objectification; harassment; area; seems; male; le; power; female,-1
8gr5i3,svenskbitch,woman; faked; signature; inseminate; successfully; sued; child; support,,-1
8gqvz3,toseawaybinghamton,actually; thing; boyssuck,,546
8gqth9,Hirudin,first; kind; joint; custody; default,,-1
8gqow3,ForgetfulWoman45,millennials; openly; illegally; discriminate; paid; work; moonchildtheatre,,547
8gqgef,Monsignor_Gilgamesh,german; ordered; child; support; wife; forge; signature; pregnancy,,-1
8gpvzz,PeterWrightMGTOW,letter; editor; reynolds; newspaper; female; prison; converted; agreeable; boudoir; pleasant; lounge,,-1
8gpv4z,PeterWrightMGTOW,dean; head; school; deakin; university; mirko; bagaric; think; woman; prison,,-1
8gprf5,JohnjSmithsJnr,canada; sexual; assault; catastrophic; attack; right; accused,,-1
8gp1pw,MisterDamage,silicon; valley; police; misconduct; retaliation; harassment; family; court; protester; illegal; arrest,,-1
8gousm,Ted8367,diana; davison; patrick; brown; million; dollar,,-1
8gote6,CropseyG,treating; woman; badly; important; mgtow,,-1
8goffk,furchfur,lifeboatman; year; service; sacked; jokey; mug; showing; naked; woman; branded; safeguarding; risk; case; visiting; school; child,,-1
8god1y,wadsworthsucks,joke; year; actually; happening; girl; allowed; join; scout,,-1
8gobte,aesopstortoise,debate; scout; drop; allow; girl; join; lionel; take; kate; smurthwaite; min,,-1
8go1hf,shit-zen-giggles,jury; rejected; charge; still; register; offender; life,,-1
8gnybf,JohnKimble111,separating; parent; joint; custody; child; default; bill; signed; matt; bevin; last; week,,-1
8gnbck,BallsOfRam,thought; parody; realized; buzzfeed,,548
8gn2ko,powersgoblue,article; snapchat; full; hypocritical; hateful; ignorant; misandrist; felt; urge; share; sorry; advance; quality,,-1
8gmz42,jp_mra,anti; feminism,,549
8gmy7s,jp_mra,tedx; warren; farrell; crisis; myth; male; privilege,,-1
8gmy6o,JackFisherBooks,counter; argument; analysis; inherent; flaw; listen; believe,,-1
8gmtxf,UnshapedGadfly,scout; dead; feminism; destroying; young,,-1
8gmsfq,Vwar,toxic; masculinity; boy; fueling; epidemic; loneliness,youtube; watch; bother; watching; another; illustration; radical; feminist; hate; propaganda; become; norm; mainstream; medium; upside; comment; mostly; negative; downvotes; outweigh; upvotes; would; thing; evidence; support; feminist; claim; make; sense; traditional; toxic; masculinity; harmful; boy; epidemic; loneliness; back; thing; getting; progressively; worse; feminism; boy; need; father; positive; message; need; masculinity; le,-1
8gmb4j,andejoh,woman; get; rape; conviction; overturned; woman; drink; consent; severely; disabled; communicate; apparently,,-1
8gma7t,TheAndredal,express; feeling; golden; rprf,,-1
8gm8mn,ThereAreThings,blame; toxic; masculinity; toronto; attack,,-1
8gm5gx,skeptical_caveman,woman; play; men; football; league,soccer; league; refuse; canadian; goaltender; woman; news; canada; calgary; female; soccer; player; barred; men; league; shared; news; android,-1
8gm3n4,TibortheChechen,scout; latest; casualty; masculinity,,-1
8glznd,Big_Ape,scout; discussion; conclusion; self; proclaimed; progressive,,550
8glxbt,Big_Ape,scout; discussion; conclusion; self; proclaimed; progressive,,551
8gluu7,Small_Monkey,twitter; discussion; concluded; masculinity; valueless,,552
8glpds,keithd3333,internet; article; ruining; comedy; career,,-1
8glp8d,LostAtSea666,criticism; dead,,-1
8gllro,phuser,westminster; mayor; local; modular; housing; project; cent; city; homeless; population; woman; definitely; target; population; project; mention; woman,,-1
8gllnc,girlwriteswhat,help; finding; source; change; decade; masculinity; inventory; used; social; scientist,recall; reading; paper; blog; post; looked; typical; masculinity; inventory; beginning; recall; correctly; developed; used; social; science; research; time; inventory; seem; quietly; dropped; might; considered; masculine; virtue; leadership; competence; ambition; confidence; list; trait; tied; masculinity; almost; completely; violence; aggression; sexual; conquest; irresponsibility; control; woman; evolved; mixed; positive; negative; norm; something; almost; completely; negative; anyone; remembers; saved; particular; item; please; post; link; various; radio; show; coming; week; discussing; topic; university; treating; masculinity; mental; health; problem; would; give; good; ammunition,-1
8gkck1,jpenner55,local; support; group,folk; find; middle; custody; battle; equal; time; feel; legal; system; quick; background; mother; month; emotionally; abusive; withholding; affection; making; feel; inadequate; split; still; pregnant; completely; pregnancy; afford; continue; bill; paid; together; month; born; find; day; visit; without; supervision; home; case; became; aggressive; history; violence; fact; many; time; praised; patience; ability; remain; calm; distress; went; contested; trial; made; claim; emotionally; physically; abusive; towards; give; would; physically; abusive; disproved; court; suggest; everyone; keep; text; message; email; made; claim; emotionally; physically; abusive; towards; child; said; without; evidence; trial; interim; order; laid; every; hour; accommodate; need; breastmilk; point; month; fast; forward; month; informal; meeting; judge; firmly; encouraged; express; breast; milk; feed; time; prior; forbid; feed; month; since; last; time; court; progress; hour; every; mother; entertain; time; never; able; give; reason; preparing; back; court; right; feel; right; get; equal; time; parent; looking; support; group; winnipeg; canada; fight; since; tank; empty; great; group; friend; feel; fully; understand; amount; stress; come; something; like; hoping; find; group; gone; similar; trauma; kind; regard,-1
8gkbq7,pitstatic,university; mandatory; sexual; consent; training; state; woman; revoke; consent,,-1
8gka1j,AndTheTruthISpeak,islam,clarify; make; sure; read; carefully; responding; saying; woman; opressed; area; saying; insult; opressed; area; woman; face; opression,-1
8gjwn9,WarOfNoise,scout,,-1
8gjv3m,furchfur,need; male; role; model; child; early; year; education; school; leader; union; naht; say; teacher; field,,-1
8gjtng,libbylibertarian,mother; stabbed; boyfriend; telling; used; human; sacrifice,,-1
8gijgd,Pz5,news; article; claim; power; damage; male; brain,,-1
8gidmu,ThePoliticalHat,scout; changing; name; gender; neutral,,-1
8gid9j,Vidinfox,feminist; attacking; masculinity; university; texas,,-1
8gi8xj,QueanLaQueafa,scounts; officially; allowing; woman; renaming; scout,girl; scout; changed; allow; boy; still; though,-1
8gi211,The_Bird_King,think; turned; woman,professor; school; needed; next; semester; recommendation; current; need; already; picked; said; want; work; said; consider; proceeded; almost; every; girl; class; next; week; could; class; finally; found; girl; told; need; anymore; proof; discrimination; private; college; know; receive; government; money; anything,-1
8gi0e8,kartu3,truth; behind; legal; dominance; feminism; percent; false; rape; claim; figure,,-1
8ghwz0,InsertJokeHere115,googled; thing; never; googl; list; found,,553
8ghwcy,pbirbarah,change; start,want; stress; awareness; spread; around; change; start; small; step; violence; joke; hurting; private; form; double; standard; speak; simple; watching; movie; someone; holywood; full; thing; something; speak; start; correct; atrocity; society; shame; harrasses; anyone; try; defend,-1
8ghsr6,Smacktardius,near; lost; everything; sask; trying; pick; piece; clear; sexual; assault; news,,-1
8ggqd9,boringcarpets,stella; creasy; feminism; woman; power,,-1
8ggik7,EricAllonde,shared; parenting; result; best; kid; parent,,-1
8ggf40,AndrewLevin,fair; treatment; last; right; fire,,-1
8ggdno,swiet,feminist; post; hate; facebook; profile,,554
8ggco2,RamblingBrambler,work; child; maintenance; service,,-1
8gfpxz,swiet,game; teach; million; young; girl; answer; proposal; second; making; love; session; domestic; violence,,-1
8gfn70,shit-zen-giggles,india; right; movement; thriving,,-1
8gfkea,swiet,apparently; heterosexual; source; evil,,555
8gffvi,JohnKimble111,retired; accused; serial; fantastist; part; paedophile; ring; told; yesterday; would; reimbursed; legal; cost; incurred; case; collapsed,,-1
8gffgl,JohnKimble111,shauna; cleary; prison; officer; relationship; violent; male; prisoner; suspended; sentence; prisoner; jailed; month,,-1
8gez4m,bluethunder1985,paygap; real,,-1
8ger5k,Eraser-Head,bill; cosby; never; offered; pudding; pop; imagine; outrage; woman; never; offered; pudding,,556
8geqnm,Eraser-Head,,,-1
8geo0x,redfanglicker,really; insane; still; virgin,really; insane; still; virgin; hobby; like; normal; people; told; make; meme; getting; good; took; several; shower; today; haircut; watched; movie; strong; female; protagonist; still; drowning; pussy; going; unravel; mystery,-1
8ge7id,YoLoMcSwAgGaTrOn420,hate; stereotype; apparently; turn; helpless; child; hurt; sick,logic; woman; turn; emotional; unstable; cunt; time; month; amirite; guy,-1
8ge4qo,Quazaro,please; imagine; commercial; aired; gender; reversed,,-1
8gdx1q,JohnKimble111,ontario; tory; leader; patrick; brown; file; defamation; lawsuit; news; alleges; network; journalist; involved; acted; maliciously; irresponsibly; publishing; accusation; brought; forward; woman,,-1
8gdoox,untildeath,video; woman; slap; boyfriend; time; station,,-1
8gdln6,SarcasticTech,considered; acceptable; cheered; feed; depicting; female; genitalia,,-1
8gdkp8,andejoh,expose; double; standard; reaction; reid; homophobic; slur; main; stream; medium; susoect; black; woman; probably; helped,,-1
8gdjie,Jex117,avicii; tragic; died; cutting; report; say; young; successful; driven; suicide; maybe; talk,,-1
8gdifo,SarcasticTech,considered; acceptable; cheered; feed; depicting; female; genitalia,,-1
8h05ud,heist420,saving; life; rape,,-1
8h05hp,Chaz_Castodik,jazeera; news; hilary; clinton; candidate; victim; misogyny; rofl,,-1
8h051z,Consilio_et_Animis,evil; rabbi; admits; circumcision; violent; painful; nasty; barbaric; need; done,,-1
8gzv4j,ThePoliticalHat,advice; incel; loser,,-1
8gzavo,EricAllonde,company; director; appointment; must; based; merit; australian; banking; industry; scandal; show; woman; board; mean; better; corporate; behaviour,,-1
8gzaiv,AladeenAlWadiya,parent; call; police; young; native; american; campus; tour,,-1
8gz2ff,Chaz_Castodik,rofl,,-1
8gyjuf,Brownbacked,kansa; state; offer; salary; woman; study; chair,,-1
8gyf9z,Blu3Skies,interesting; picture; found; funny; guess; messaging; allegedly; kid; spelling; test,,557
8gxy4p,Donut5030,school; sensitive; runned; sjws,friend; jake; suspended; school; making; joke; joke; lesbian; nice; sure; girl; really; offended; told; making; place; unsafe; many; safe; space; forget; count; kinda; friend; dismiss; guy; rape; assembly; talk; rape; problem; yeah; thing; definitely; denying; fact; completely; dismiss; fact; guy; raped; like; problem; woman; raped; raped; wrong; love; school; much,-1
8gxk16,Forgetaboutthelonely,radicalizing; romanceless; resurgence; conversation; incel; community; feel; like; relevant; ever,,-1
8gxjsp,EricAllonde,feminist; think; masculinity; toxic; data; suggests,,558
8gxhhz,trevorsandler2016,female; college; student; charged; making; false; rape; accusation; male; college; athlete,,-1
8gx2fs,DignifiedAlpaca,woman; store; donates; profit; woman; charity; perhaps; store; donate; money; movember; foundation; similar; half; sarcastic; half; serious; suggestion,,-1
8gwlo0,lostapwbm,woman; charged; filing; false; report; coker; college; sexual; assault; case,,-1
8gwcqv,nascarracer99316,german; child; support; wife; forge; signature,,-1
8gw5xa,JohnKimble111,elizabeth; hobson; appointed; director; medium; relation,,-1
8gw3ue,Blutarg,filming; origin; wolverine; hugh; jackman; hallway; naked; prop; claw; attached; fist; turned; corner; faced; every; woman; production; staff; waving; dollar; bill; instinctively; shielded; groin; wolverine; claw,,-1
8gvh2y,shi1t,reddit; ellen; message; tech; company; incels,,559
8gv5p5,MaramHitchens,cafe; conference; need; support; calgary,,-1
8kq1d9,vrblpolushin,angry,lurker; poster; year; issue; regarding; inequality; sucicdes; himelessness; custody; childsupport; circumcision; disposablity; quota; anyone; come; frequently; pretty; versed; issue; face; question; keep; talking; shit; nothing; ever; change; reading; article; sandra; bullock; using; mutilated; baby; penis; cream; discus; hypocritical; diagustung; discus; anyone; else; think; little; late; game; posturing; discussion; point; woman; look; decide; nothing; discussion; time; quite; somtime; want; discussion; feminist; want; understand; care; want; keep; playing; game; created; rule; saying; answer; fight; fighting; stupid; arena; game; home; field; advantage; working; nothing; change; unless; action; real; honest; action; discussion; change; mind; line; sand; drawn; time; time; stop; pretending; like; something,-1
8kpsyq,PeterWrightMGTOW,penelope; faithful; ulysses; afraid; return; home; poor,,-1
8kpn9a,Mallago,suspicious; feeling; royal; wedding; meghan; markle; look; politics; harry; speed; engagement,,-1
8kpfy5,XLDOMTOPing,father; beat; daughter; death; hammer; could; longer; cope; called; useless; judge; agrees; probably; pushed; give; year; suspended; sentence,,-1
8kosvw,atheist4thecause,gina; drosos; signet; jeweler; pushing; misandrist; policy; going; signet; jeweler,came; across; tweet; gina; drosos; link; avoid; spam; tweeting; inclusive; tweet; said; employee; woman; field; leadership; woman; suite; woman; interview; yahoo; finance; reporter; julia; roche; creating; inclusive; workplace; link; article; finance; yahoo; news; virginia; drosos; plan; transform; signet; jeweler; culture; html; interestingly; enough; twitter; user; posted; link; signet; jeweler; stock; let; performed; time; stock; market; grown; signet; jeweler; year; stock; performance; twimg; medium; ddlglaav; aiwzmb; large; consider; good; thing; right; movement; company; hold; sexist; policy; fail; company; failure; hold; fairer; policy,-1
8koqym,confusedude1234,join; feminist; group; like; feminist; insist,,560
8koo7q,TheAndredal,right; taken; seriously,,-1
8konsa,DavidByron2,dine; dash; dater; california; facing; charge; running; expensive; meal; first; date,,-1
8kokyw,Fuckoff555,post,thousand; subscriber; default; subreddit; automatically; subsribed; every; subscriber; thousand; small; number; mean; third; would; upvote; every; post; always; post; hit; case; since; usually; post; thousand; hundred; saying; upvote; every; post; exists; objective; raise; awarness; post; highlight; good; example; discrimination; face; contains; activism; right; hit; follower; symphatizers; help; future; another; thing; sometimes; post; thousand; upvotes; post; thousand; upvotes; decide; post; cause; sometimes; post; mansplaining; manspreading; hit; others; important; like; one; talk; homelesness; suicide; father; right; honestly; leaf; confused; need; right; visible; world; happens; ready; brigading; troll,-1
8kodqz,heist420,true,,561
8knery,patriotsfan4life,think; article,,-1
8kn8hd,93re2,tried; sandra; bullock; penis; facial; people,,-1
8kmrod,Jacobrts,speak; majorly; faxuals,,562
8kmr5m,RappelAnt,jordan; peterson; understands; male; disposability; fine,,-1
8kmgun,TibortheChechen,turning; boy; girl; annie; lennox,,-1
8kmbw5,raffu280,yale; probed; accused; toxic; environment,,-1
8nm9xz,furchfur,physically; demanding; job; shorten; life; despite; much; evidence; getting; lot; physical; activity; bodes; long; term; health; physical; labor; opposite; might; true; feminist; going; demand; equal; gender; representation; job,,-1
8nm25c,WorkProfile365,menslib; mod; removing; comment; support; view; feminism,think; reply; question; unreasonable; certainly; break; rule; behold; anyway; along; comment; answered; guess; menslib; wave; feminist; redd; sm,-1
8nlzka,WarOfNoise,imgurian; tell; mother; told; write; diary; child; could; later; used; evidence; father,,-1
8nl3a9,DaneWhitman,year; illinois; ratifies,,-1
8nkohg,NCFM_reddit,moving; video; showing; reality; know; easily; sexual; abuse; victim,,-1
8nkn3e,danzibara,student; suing; board; regent; sexual; misconduct; expulsion,,-1
8nki4b,wiseprogressivethink,germaine; greer; tell; literary; festival; rape,,-1
8nk86t,chrisisnotcheese,mancans,,563
8njfdh,New7Era,lemon; others; slammed; trump; roseanne; racism,,-1
8nj0a8,mudda1,child; support; thing; cover,separated; divorced; mediation; child; support; calculated; listed; separation; agreement; decided; longer; going; send; child; clothes; state; reason; need; clothes; care; purchase; anyways; addition; reason; include; paid; thing; like; medical; dental; school; activity; supply; stated; child; support; calculated; include; thing; loss; able,-1
8nhp5m,ThePigmanAgain,metoo; witch; hunt; target; veteran; actor; morgan; freeman,,-1
8nhnvr,HeForeverBleeds,woman; previously; spent; day; jail; assault; news; stabbing; year; multiple; time,,-1
8nhdir,New7Era,jordan; peterson; countdown,,-1
8nh702,sadness-enjoyer,wage; exists; victim; study; show; salary; young; woman; higher; peer; group,,-1
8nh61s,SpectrumSSS,seriously; piss,,-1
8ngzl8,MistySeas,school; bias,school; would; girl; regularly; hook; much; boy; given; smaller; punishment; definitely; case; school; wondering; example; tell; minute; late; lesson; shouted; detention; girl; come; minute; late; valid; excuse; given; get; clean; teacher; say; happen; late; every; lesson; rarely; late; thanks; great,-1
8ngppa,Alkalaliza,throwaway; cause; friend; sick; attitude; already; people; need; realize; horndogs; want,,-1
8ngmmg,furchfur,rape; spectacularly; violent; crime; feminist; germaine; greer; say; rapist; jailed; admits; feel; anger; towards; sexually; assaulted,,-1
8ng3rb,boringcarpets,brendan; neill; modern; sexual; politics,,-1
8nfim9,hrforall,news; win; right,,-1
8nepu2,wiseprogressivethink,child; lemonade; stand; shut; lack; permit,,-1
8nenbw,ThePigmanAgain,australia; health; minister; greg; hunt; accused; misogyny; swearing; katherine; mayor; miller,,-1
8nemjf,jondavidbrooks,fight; make; misogyny; hate; crime; british; vogue,,-1
8ndygl,js4856,organization,researching; looking; organization; could; invest; resource; found; couple; niche; organization; questionable; one; anyone; know; good; right; empowerment; organization,-1
8ndvuz,Xyon_Peculiar,woman; sexual; assault; registered; offender; sign; petition,,-1
8ndl2r,DougDante,australia; chief; army; admits; female; recruited; infantry; bernard; gaynor,,-1
8ndi53,Leiscter-gate,read; female; sexually; harassed; want; know; right; teaching; course,,-1
8nd94m,93re2,teenager; sue; circumcision; gone; wrong,,-1
8nd84t,HauntingUse,mensrights; hanging; fruit,give; damn; stupid; feminazi; said; twitter; huffpo; twox; remember; mras; twitter; tweeting; incessantly; year; feminist; academic; said; slope; sexist; dumb; shit; like; sure; make; honestly; give; damn; important; deconstruct; moderate; therefore; mainstream; influential; feminist; claim; feminism; nytimes; economist; magazine; important; feminism; twox; feminist; kill; feminist; pink; hair; feminist; hate; western; civilization; love; islam; something; everyone; reason; ob; guess; feminist; still; full; shit; although; obvious; shit; twitter; harpy; dash; subtle; shit; requires; attention; subtle; feminism; rapidly; invading; male; space; feminist; claim; want; help; numerous; radfems; tweet; killallmen; make; subtle; feminism; le; dangerous; forget; dumb; idiot; twitter; huffpo; journalist; fewer; twitter; follower; grandma; focus; feminism; gynocentrism; matter,-1
8nczp4,Mr_Fancywaters,infuriating; legaladvice; post; female; lying; harassment; someone; along,,-1
8ncs21,Hockey_Sweater,woman; cause; homophobia; racism,,-1
8ncjvw,throwaway20181112233,support; men; right,,-1
8ncjn2,BarefootUnicorn,female; teacher; rape; year; classroom; get; year; jail; despite; emotional; plea; victim; parent,,-1
8ncf09,furchfur,twitter; banning; woman; speak; trans; ideology; feminist; claim,,-1
8ncbmq,furchfur,tell; stay; home; give; afterwards; true; accurate; witnessed; situation; many; time,,-1
8ncais,Fuckoff555,petition; change; president; france; emmanuel; macron; give; father; refused; child; mother; paternity; right; kid; without; needing; authorization; judge,manifesto; paternity; right; change; emmanuel; macron; ramener; le; leurs; enfants; le; enfants; leurs; source; location; petition; footer; algorithm; promoted; original; footer; petition; grid; position; avbldgl; aw; uakklyaaaaaaaww; yymdhodi; zhnq,-1
8ncaaq,headingtoshore,enclosed; please; find; lecture; gresham; college; secrecy; family; court; important; content,would; love; sargon; randomercam; styxwhatshisnamehammer; shoeonhead; oodfella; tealdear; usual; suspect; cover; major; right; issue; content; issue; know; freakin; secret; court; recent; reporting; blackout; convo; think; topic; accessible; youtube; watch; wuxbuzq,-1
8nc9jy,Squarelester,society; need; accept; fact; known; killer; female; male; female; good; concealing; crime; woman; favourite; method; killing; slowly; time; poison; look; natural,,-1
8nc6ur,januarypizza,hour; program; teach; college; woman; avoid; raped; result; fewer; rape; program; evidence; like; feminist; continue; insist; teaching; rape; possible; approach,,-1
8nc2ca,Phuxxi,men; line; many; people; working; dysfunctional; fuck,,-1
8nbx6q,Sinner12180,addition; rule; thumb; myth; term; never; meet; beat; wife; sexist; term; latin; pusillanimous; mean; cowardly; history; term; chauvinist,chauvinist; used; today; synonym; sexist; suggests; target; superior; modern; usage; antifeminist; mean; nicolas; chauvin; likely; turning; grave; word; would; mean; loyal; soldier; chauvin; soldier; fought; fiercely; ruler; napoleon; return; nothing; chauvin; went; thick; fighting; getting; seriously; wounded; nearly; occasion; napoleon; darkest; day; chauvin; stood; side; ready; emperor; vision; france; could; napoleon; butt; handed; british; blind; devotion; fell; fashion; chauvin; came; seen; relic; name; acquired; negative; connotation; eventually; metamorphosing; modern; insult,-1
