post_id,author,title,body,image
f6zrnt,YourNightOwl,question; school; system; made; female,live; mentioning; refer; school; system; talking; american; getting; dumbass; tend; forget; every; redditor; america; sorry; anyway; whatever; notice; elementary; school; always; girl; would; quietly; straight; bos; around; boy; misbehaving; call; anecdotal; friend; place; agree; mostly; boy; getting; trouble; boy; diagnosed; adhd; rather; live; world; listen; boring; teacher; must; adhd; statistic; back; know; fact; boy; diagnosed; bullshit; mental; disorder; almost; make; want; believe; school; system; made; female; thought; recently; remembering; youth; driver; would; always; girl; first; driver; always; said; girl; quiet; could; first; make; sense; hear; outside; vehicle; girl; quieter; boy; naturally; louder; active; girl; first; girl; hundred; story; school; bus; sexism; could; share; relevant; want; story; shit; whatever; reason; feel; like; girl; praised; girl; point; said; adhd; think; boy; held; captive; desk; listening; teacher; barely; alive; coffee; drink; take; note; psychological; evidence; sort; feel; like; school; system; made; woman; often; comply; taking; note; sitting; quietly; teacher; named; skeen; method; teaching; mixed; play; game; take; note; watch; movie; listen; document; story; kind; method; mixed; class; friend; thane; brought; interesting; point; said; like; class; instead; learning; female; brain; supposed; learn; differently; method; made; male; brain; found; interesting; fuck; smarter; maybe; know; psychological; statistical; shit; whatever; maybe; obvious; maybe; guy; opinion; anything; said; refuted; statistic; know; honestly; though; post; kind; jumbled; thought,-1
f6z6tq,TerraceWindsor,shadow; banned; immediately; femenist; strong; woman; witchesvspatriarchy; sure; love; thought; bubble,,7298
f6z4ta,Hoarder-of-Knowledge,small; example; sexism; rubbed; wrong,trainwreck; making; priority; last; year; keep; family; together; wednesday; conversation; people; healthcare; professional; supposed; work; family; mainly; work; moved; present; conversation; behaved; really; unacceptable; recently; involved; excessive; consumption; alcohol; relationship; literal; angel; prioritizing; kid; general; wife; force; choose; instead; applauding; reliability; support; love; always; given; kid; female; health; care; professional; legit; called; prioritizing; wife; make; angry; hear; stuff; like; mother; actively; encouraged; choose; child; husband; parent; different; rule; apparently,-1
f6ygor,kv2408,kicked; show; imagine; would; reverse; scenario,,-1
f6xyst,Daedalus2311,friend; falsely; accused; rape; took; picture; minute; arrested; freeduffy,,7299
f6xk75,AzharSolicitor,family; court; distribute; asset; income; divorce; guide; explains; court; approach; splitting; asset; divorce; helpful,,-1
f6xgwk,Oncefa2,early; mra; right; activist; socialist; ernest; belfort,sure; received; figured; people; radar; earliest; right; activist; socialist; prof; activism; strongly; tied; political; ideology; another; ignore; political; leaning; still; good; resource; history; gender; norm; many; thing; wrote; still; going; today; mirror; discussion; around; show; right; movement; predated; men; liberation; movement; earliest; writing; movement; date; back; advent; feminism; england; long; wider; woman; movement; started; wrote; book; philosophy; socialism; history; right; woman; movement; various; social; issue; time; period; work; featured; several; prominent; left; wing; magazine; periodical; including; social; democrat; according; woman; living; england; already; privileged; needed; special; consideration; came; gender; equality; discussed; depth; gendered; law; social; standard; surrounding; marriage; treatment; woman; civil; court; criminal; court; family; court; claimed; medium; bias; newspaper; especially; regard; domestic; violence; woman; believed; default; without; evidence; victim; female; violence; laughed; ridiculed; example; legal; subjection; archive; detail; legalsubjection; baxgoog; page; mode; writes; first; place; woman; complain; tribunal; already; convinced; justice; claim; tribunal; impartial; complaint; woman; another; next; place; adequate; repression; crime; injury; woman; attempted; tendency; tribunal; confirmed; rendered; irresistibly; action; press; public; opinion; injury; woman; chronicled; flaring; headline; injury; woman; laughed; worse; still; passed; silence; believed; could; equal; woman; adopted; socialist; principle; society; according; woman; using; capitalism; exploit; male; labor; socialist; economic; system; would; force; woman; work; much; socialism; everyone; treated; regardless; race; gender; book; original; emphasis; certain; socialist; writer; fond; describing; social; democratic; state; future; implying; emancipation; proletarian; woman; regard; latter; point; however; emancipation; taken; include; domination; wait; long; highest; development; modern; capitalism; exemplified; english; speaking; country; placed; intent; purpose; legally; heel; woman; relation; sex; concerned; would; task; socialism; emancipate; position; equality; goal; aimed; first; step; road; towards; equality; would; necessarily; consist; abolition; modern; female; privilege; year; since; wrote; fabled; social; democratic; state; future; still; still; treated; unfairly; according; likely; true; time; throughout; europe; history; postulated; female; bias; present; among; public; medium; always; existed; bias; made; worse; woman; activist; despite; modern; feminist; mythology; want; believe; likely; never; history; treated; fairly; origin; bias; subject; deep; interest; capable; discussed; within; brief; limit; course; found; history; england; century; past; practically; since; reformation; difference; intensity; sentiment; differentiates; england; european; people; found; history; europe; race; many; century; period; great; european; upheaval; century; enough; present; note; feminist; prejudice; exists; transmuted; positive; rule; legal; administration; action; public; opinion; press; parliament; judge; jury; crystallized; statutory; enactment; active; feminist; propaganda; conscious; woman; righters; interested; wikipedia; list; book; available; read; online; free; wikipedia; wiki; ernest; belfort; legal; subjection; fraud; feminism; would; recommend,-1
f6xc6f,JaromeDome,straight; bromances; harm; lgbtq; community,,-1
f6x7fq,hotandreadylove,woman; banned; rape; community; supported,banned; imgur; gallery; zbdxisw,-1
f6x47m,craigdillydilly,fact; accepted; celebrated; piss; talk; double; standard,,7300
f6x0ws,GlennQuagmireEsq,raising; sensitive; bois,,-1
f6wzi1,Shitworldwelivein,incase; missed; teacher; said; entitled; deviant; sport; star; schoolboy; claimed; unconstitutional; charged; sexual; act,,-1
f6vts0,hellomynameiswtfno,obsessed; porn; woman,,-1
f6vqv4,TheAndredal,mindset; actually; anger,,7301
f6vk5d,DutchNobody,dutch; female; driver; service; say; everyone; safe; imagine; total; chaos; would; male; service,,7302
f6uync,MRMRising,marriage; used; expectation; much; safer; financially; avoid; completely; better; bachelor,,-1
f6ulzk,titmouse_420,discord; sever,soon; answer,-1
f6sax5,John238,radical; feminist; group; wolf; acrimonious; battle; transgender; female; community; trans; nothing; personal; feeling; announcement; qualify; part; definable; class; people; inherently; marginalized; subjected; discrimination,,-1
f6pwaq,some1thing1,beginning; pattern,,7303
f6plhn,JohnKimble111,caroline; flack; unlikely; super; fan; reflecting; three; labour; love; island; loving; contrasting; approach; acknowledging; tragic; death; public; figure,,-1
f6pkfs,JohnKimble111,help; helpline; radio; documentary; follows; amis; organisation; helpline; abused; scotland; face; prospect; closure; lack; funding,,-1
f6pk96,sigmar_ernir,keep; crown; king,,7304
f6pk8o,tommygun641,woman; seem; amount; money,,7305
f6p7ba,Philletto,notallmen; enrages; feminist; much,,7306
f6o666,Aussiemate2,school; library; like; left,,7307
f6nr86,608th,wrote; againtsmensrgiht; wonder,,7308
f6l608,awakenedclass,heart; murdered; stefan; molyneux,,-1
f6ks8b,Im_Not_Trash,refused; return; late; aunt; memorabilia; month; called; police; sudden; threatened; police; forgot; call; sent; evidence; took; false; protective; order; nothing,sure; else; turn; really; feel; like; le; human; treated; like; woman; absolutely; awful; relationship; considered; bending; backward; hard; time; aunt; died; broke; know; awful; treatment; unfortunately; still; possession; late; aunt; sweater; soon; refused; send; back; unless; spoke; refused; vehemently; went; mutual; friend; jeer; called; petty; pathetic; emotional; messaged; mother; asking; sweater; apologizing; explaining; sending; evidence; messaging; calling; police; emailing; personally; month; later; police; door; telling; drive; hour; court; still; grieving; time; right; mind; fight; charge; still; went; trial; police; told; accused; brought; evidence; full; hearing; allowed; show; unless; take; trial; lawyer; present; continually; asked; continuance; forcing; come; back; stupidity; grief; accepted; protective; order; thought; would; force; police; help; gotten; many; message; random; telling; watched; hated; called; said; affect; nothing; accepted; many; call; attempt; received; police; report; telling; received; harassing; text; message; charged; judge; woman; obviously; biassed; trial; present; evidence; wary; fellow; shit; rigged; unfair; hypocritical; cruel; ever; charged; something; hour; drive; way; fight; fight; hard; speaking; great; many; lawyer; obvious; nothing; record; life; treat; abusive; narcissist; tried; extort; accused; sued; please; please; safe,-1
f6kjd0,awakenedclass,sexist; ironic; funny,,7309
f6kj9r,hiiiii134566,femaledatingstrategy; goldmine; misandrist; post; like,,7310
f6k325,some1thing1,damn; metoo; shuffle; card; white; supremacy; protection; racket,,7311
f6k0as,OhMyGodItsGandalf,mensrights; space; within; gaming; scene,wondering; mensrights; presence; within; gaming; scene; would; make; sense,-1
f6j99h,sf_randOOm,doublestandart,,7312
f6ixgy,AdviceThrewaway1,aginstmensrights; shadow; censores; comment,,7313
f6isef,sickraw,amber; heard; face; charge; violence; johnny; depp,,-1
f6ijmo,TheAndredal,judge; sends; strong; message; sending; teacher; prison,,-1
f6ifgo,DiegoRizal,boy; sexually; abused,,-1
f6i3u7,radicalindividualism,,,-1
f6hv41,TheAndredal,bronx; teacher; performed; oral; year; get; year; probation; avoids; jail; keep; teaching; certificate,,-1
f6hahw,fracttallz-,consent; form; question,figured; would; perfect; question; never; careful; ever; bullshit; false; rape; accusation; accused; girl; drunk; regretted; back; something; decided; seriously; carry; page; consent; form; everywhere; matter; much; kill; mood; always; anyways; question; girl; shot; would; make; consent; form; le; viable; super; drunk; girl; okay; drink; claim; drug; alcohol; time; probably; sound; like; crazy; person; taking; chance; many; insane; female; safe,-1
f6h3sc,BornFreeWE,support; male; victim; ireland; anyman,anyman; formerly; known; amen; dedicated; national; service; supporting; experiencing; domestic; violence; ireland; donation; possible,-1
f6h313,Garrison_road2,study; circumcised; adult; found; much; greater; likelihood; reduced; sensitivity; satisfaction; improved,,-1
f6gstm,lolicon2046,university; host; educational; discussion; session; aimed; preventing; sexual; domestic; violence; targeted,,-1
f6gr7m,MilkmanDevlin,people; watch; get; beat; help; woman,,-1
f6gm71,SaintRonin,reverse; gender; fella,,-1
f6g735,BobBobster228,hope; rule; felt; need; share,,-1
f6fqlq,JohnKimble111,body; forced; vasectomy,,-1
f6fkik,Daedalus2311,friend; falsely; accused; rape; took; picture; minute; arrested; freegranger,,7314
f6fd9p,EmyG28,stop; calling; cold; approaching; woman; cold; approach; pickup,,-1
f6e5ql,Attk_Torb_Main,stop; lying; son,medium; egsanzi; stop; lying; son; medium; egsanzi; stop; lying; son,-1
f6dtmj,artsandopinion,vision; rhapsody; hope,,-1
f6ds3m,MRMRising,time; time; society; keep; telling; disposable; better; bachelor,,-1
f6drkj,OmegaChew,woman; assault; force; therapy,canada; assaulted; ordered; therapy; girlfriend; mother; child; argument; wanted; part; trying; leave; blocking; door; letting; leave; recorded; entire; argument; start; part; calmy; asking; leave; entire; time; want; listen; made; recording; took; swing; right; hooked; side; head; simultaneously; knocking; phone; hand; pick; back; however; still; recording; window; open; told; people; police; ended; coming; coming; siren; pleaded; show; video; nothing; happened; argument; would; police; brought; hall; talked; told; told; nothing; happened; asked; told; happened; said; showed; video; assault; would; take; jail; decided; nice; show; told; thing; leave; saucy; told; need; stop; taking; jail; right; assault; young; next; showed; told; allowed; around; child; anymore; went; anger; management; might; understandable; child; argument; child; time; never; argued; around; ever; never; would; know; would; fact; argument; ever; involve; child; involved; kicker; called; little; much; told; need; intrusive; direction; attend; therapy; class; said; crazy; nothing; assaulted; entire; thing; video; police; backed; happened; report; called; possibly; making; sudden; make; anger; management; anything; angry; making; sure; child; around; argument; thank,-1
f6de19,GSpot89,public; enemy; white,,-1
f6d5o3,McFeely_Smackup,amber; heard; defense; shit,,-1
f6crv9,MRRamming,gamer; friend; hate; feminist; much,,-1
f6clm1,MRMRising,body; forced; vasectomy; brighton,,-1
f6cir9,MRRamming,basically; anyone; functional; brain; understands,,-1
f6c44b,____stupid_meme____,movie; hustler; drugging; wealthy; woman; stealing; allowed; screen,,-1
f6bdqt,awakenedclass,feminist; making; le; woman,,-1
f6b6jh,dart071,men; shed; open,,-1
f6azs6,NecroHexr,woman; jailed; day; lying; police; molested; landlord,,-1
f6and5,MilManShow,museum,small; facility; picture; bsck; room; spinster; scammed; home; know; smell; urine; breath; male; museum; realize; would; need; entire; state; worth; land; celebrate; done; still; news; house; vote; establish; national; woman; history; museum; ocid; spartanntp; news; house; vote; establish; national; woman; history; museum; ocid; spartanntp,-1
f6a8ws,perplexedm,staff; refuse; treat; racist; sexist; patient; rule,,-1
f69zrf,Xpredata,fighting; tyranny; niceness; need; difficult; woman; name; inspiring; little; girl; living; male; dominated; world; rebel; girl,,-1
f68ggp,fuzbik,evidence; needed; right,,7315
f2qvyh,kittycatdude,whole; metoo; movement; bunch; bull,replied; post; last; night; metoo; people; amber; side; damn; disgusting; word; fuck; people; look; mirror; every; person; would; evidence; fake; gender; switched; angry; right; like; said; actual; female; victim; abuse; support; fact; people; still; siding; despite; actual; evidence; confession; done; something; need; done; people; need; fight; metoo; bring; make; admit; monster,-1
f2qrkn,av3R4GE-CSGO,domestic; violence,,7316
f2qjqo,Statisticsanddata,nation; world; death; terrorism; timeline; since,,-1
f2qfzg,MarcusAurileus70,radical; feminist; turn; funny; need; perpetually; angry,,-1
f2phql,Skillex99,another; double; standart,,7317
f2pbkf,tamiyoxxx,post; unpopular; opinion; classed; post; feminism; bullshit,,7318
f2pbix,tamiyoxxx,post; unpopular; opinion; classed; post; feminism; bullshit,,7319
f2pah2,throwawaysabitch,circumcised; child,,-1
f2p9au,InvincibleV,leaving,,7320
f2p8c6,DignifiedAlpaca,bernie; sander; take; lead; democratic; primary; despite; female; supremacist; anti; semite; linda; sarsour; campaign; team,newshour; politics; sander; win; close; hampshire; primary; nypost; pressure; growing; bernie; sander; dump; linda; sarsour; nypost; jewish; voter; turning; bernie; sander,-1
f2p2yj,MakeTotalDestr0i,title,,7321
f2nwq8,EricAllonde,antonio; brown; accuses; alleged; sexual; assault; victim; making; false; criminal; accusation; attempt; settle,,-1
f2nqyw,MRA-Sid,nearly; nine; year; murdering; husband; woman; lover; life; imprisonment,,-1
f2niix,JohnKimble111,speech; liam; allan; falsely; accused; multiple; rape; faced; year; prison; life; offender; register,,-1
f2n0aj,N19864,reliability; witness; memory; false; memory; contamination,,-1
f2mx2g,PAWG_Muncher,australian; plan; introduce; systemic; sexism; allowing; employer; higher; superannuation; rate; female; employee,,-1
f2mwzr,lostbeyondpluto,lawyer; perspective; police; part; problem; right; movement,first; female; lurker; happens; junior; lawyer; make; quick; part; injustice; suffered; painfully; regular; basis; come; case; victimized; woman; currently; involved; case; male; victim; young; close; sexually; assaulted; stalked; harassed; physically; emotionally; psychologically; abused; crazed; woman; leave; alone; unless; reciprocates; feeling; never; interest; going; year; third; life; finally; attacked; last; february; went; police; reported; attack; entire; story; including; sexual; assault; happened; numerous; occasion; police; attitude; unfortunately; short; stick; serious; refused; investigate; allegation; charge; laid; make; matter; worse; woman; want; teacher; judge; presiding; restraining; order; hearing; shocked; allegation; investigated; devastation; seen; young; firsthand; isolating; home; keep; showing; wherever; think; chronic; stress; anxiety; anger; disappointment; directed; police; pretty; much; become; crusader; male; victim; female; abuser; self; promoting; financial; gain; whatsoever; made; short; video; spread; awareness; yesterday; scoured; subreddit; rule; unless; missed; rule; sharing; relevant; video; please; watch; share; nobody; youtuber; really; need; traction; hope; bringing; awareness; major; problem; enforcement; protection; right; youtube; watch; zifsmts; youtube; watch; zifsmts,-1
f2mwr3,HonestAsk2,full; alert; student; stare,,7322
f2mowe,EricAllonde,oscar; natalie; portman; labelled; hypocrite; female; director; dress; feminist; complains; female; director; nominated; production; company; hired; female; director; male; director,,-1
f2mex1,Granuloma-man,incels,,-1
f2m192,Blutarg,outrage; elizabeth; warren; treated; would; coming; fourth,,-1
f2ldu8,DonCartegena,please; help; broken,,-1
f2l9qh,Burner12000,girlfriend; kpop; idol; claim; harassed,,-1
f2l91i,Strikester101,significant; biogical; difference; woman,,-1
f2kvsc,mimiczx,horrible; another; case; financial; abuse,,7323
f2kpm1,Burner12000,girlfriend; kpop; idol; accuses; harassment,,-1
f2ko54,maudeib,baby; left; mommy; liquor; store,,-1
f2kmxh,andejoh,girl; power; stunt; went; terribly; wrong; feminist; equality; reversing; course; relaunches; female; tank; crew; trial; program,know; many; feminist; like; pretend; woman; actually; equal; responsibility; whole; wage; thing; dependent; ignore; fact; hour; dangerous; job; israel; different; woman; serve; military; mandatory; service; le; serve; support; position; free; actual; combat; though; officially; deemed; success; chief; staff; aviv; kohavi; froze; initiative; would; think; success; would; brainer; equality; goal; light; statement; army; spokesman; stressed; unlike; rest; military; armored; brigade; female; team; considered; maneuvering; unit; could; operate; within; enemy; territory; wonder; finding; trial; predetermined; political; decision; could; another; manifestation; want; pretend; woman; much; using; free; actual; fighting; female; soldier; risk; checkpoint; attacked; expected; engage; enemy; said; significantly; le; risky; actual; front; line; combat; entire; purpose; engage; enemy; look; proportion; male; female; soldier; killed; remember; correctly; woman; made; combat; death; iraqi; theater; comprised; armed; force; applaud; move; toward; equality; hope; true; equality; rather; give; girl; power; pretend; woman; sacrifice; much; give; honor; without; asking; make; sacrifice; tagging; discrimination; sure; actual; progress; archive; kmawf; selection; archive; kmawf; selection,-1
f2kfb9,loQo20,femininity,work; conducting; forum; titled; toxic; femininity; someone; told; history; behind; term; pro; con; sorry; english,-1
f2k91f,JohnKimble111,woman; attacked; carving; knife; handle; ended; relationship,,-1
f2jcvn,mrgirl,thing; feminist; would; woman; penis,,-1
f2ixnp,LisaMck041,find; report; article; study; prof; suicide; rate; worldwide,,-1
f2idl6,hillmacd,amber; heard; disgraced; discredited; actual; survivor; domestic; abuse; gender; mean; nothing; come; abuse; victim; position; leadership; campaign; sign; petition,,-1
f2hff2,-WolfChop-,initial; novelty; wore; woman; would; hate; would; hate; woman,,-1
f2h5wp,808picklejuice,tell; world; johnny; tell; johnny; depp; victim; domestic; violence; many; people; believe; side; say,,-1
f2gcdw,jrdj1902,like; hear; guy; think,,-1
f2g9gn,badstarstuff,project; help,hello; everyone; currently; college; project; relates; feminism; particularity; would; call; fake; feminist; agree; attention; directed; side; issue; instead; viewed; equal; possible; complying; list; difficulty; struggle; oppression; gender; face; find; research; additional; information; gather; wide; range; view; opinion; response; would; greatly; appreciated; factual; information; used; link; source; included; possible; thank,-1
f2fwxr,IcyHotRoad,question; conservative,something; directed; towards; conservative; never; sort; real; direct; answer; believe; woman; traditional; gender; role; flexible; enforced; male; gender; role; absolutely; inherently; enforced; either; legally; socially; conscription; protecting; providing; think; conscripted; woman; right; vote; politics; something; traditionally; done; feminism; demanding; woman; freed; traditional; gender; role; decade; largely; successfully; gone; along; still; supposed; follow; male; gender; role; think; follow; every; single; gender; expectation; sure; hell; expect; woman; fact; assbackwards; seem; think; woman; following; role; fault,-1
f2fahr,ConnorGracie,feminist; bury; sonic; boost; bird; prey; ticket; sale,,-1
f2eyun,VPLumbergh,disabled; upstate; father; asking; legal; help; prevent; daughter; mother; taking; country,,-1
f2epsp,IcyChillMikes,woman; particularly; feminist; default; comment; bodily; function,whenever; hear; woman; talking; article; woman; stronger; woman; better; woman; worse; superior; victim; hero; nearly; always; come; autonomic; bodily; function; woman; obsessed; make; cosmetic; pussy; wearer; screeching; protest; hell; nearly; woman; comedian; like; thing; know; woman; simplified; version; list; period; vagina; boob; pregnancy; birth; control; vagina; random; medical; issue; related; vagina; vagina; random; medical; issue; related; boobage; slut; problem; many; woman; interested; politics; sole; interest; issue; pertaining; abortion; birth; control,-1
f2e4k3,yoitsericc,jordan; peterson; mend,,-1
