post_id,author,title,body,image
fb1xzr,Crsmit8,state; woman; making; money; bloke; cant; spend; dollar; self; fag; role; reveressed,,-1
fb1oz7,21yeeet,savage; response,,7207
fb1jld,zebbojojo,know; right; place; angered; much,week; daily; newspaper; article; said; shocking; rape; girl; disgusting; schoolteacher; awful; thing; happen; someone; contrasted; something; week; said; alleges; tutor; disgusting; act; show; sexual; assault; portrayed; differently; sexual; assault; woman; word; rape; another; word; alleged; title; woman; raped; show; different; attitude; woman; assaulted,-1
fb1g74,5tarrealm5,police; winnipeg; female; teacher; charged; sexual; assault; gave; student; alcohol,,-1
fb19uc,Litigious_Energy_,anyone; willing; mra; focused; news; website,goal; would; keep; men; right; possible; stay; away; heavy; bias; anything; positive; toxic; possible; want; fall; trap; feminist; website; demonizing; news; website; would; generate; revenue; celebrate,-1
fb145z,DuctapeCat,wrote; poem,,7208
fb13nw,panoscrab,femanist; comparing; father; wanting; wife; abortion; slavery,,7209
fb0sjz,JAdoreLaFrance,story,last; night; usual; stupid; exchange; young; brainwashed; seriously; believed; woman; equal; explained; physically; stronger; equal; half; toasted; friend; actually; believed; looked; like; crappy; waste; time; convo; thought; others; obstacle; opportunity; know; said; cool; former; bodybuilder; look; like; strength; still; said; whiniest; simp; like; voice; talk; talk; stop; arguing; pulled; tenner; wallet; table; elbow; table; know; coming; little; miss; put; hand; mine; friend; cheer; without; honouring; side; deposit; immediately; fair; fair; money; table; hand; enter; purse; reluctantly; little; thing; maybe; greta; frickken; thunberg; still; like; look; touch; tennis; elbow; could; start; pull; little; stronger; look; half; inch; never; thought; admit; public; pretend; like; struggling; hand; duly; wobble; exquisite; pain; bring; hand; onto; cool; wood; left; hand; grab; money; fast; sweet; part; story; drunk; girlfriend; bought; wanted; revenge; sisterhood; walked; minute; establishment,-1
fb0pdt,OmegaChew,check; store; camera,people; ordered; stay; away; front; child; child; child; people; spying; seen; store; time; together; walmart; mother; reported; estimated; time; would; worker; usually; accompanied; policeman; check; mart; camera; together,-1
fb0kre,potatohouse4545,right; woman; right,post; reddit; completely; miss; mark; completely; miss; fact; struggle; mean; woman; struggle; different; support; equality; like; woman; massively; privileged; true; gender; struggle; dismissing; others; mean; struggle; exist; work; together; cooperate; create; society; based; equality; gender; understand; struggle,-1
fb0acs,perplexedm,chief; antonio; guterres; go; white; knight; mode; us; word; manplaining; call; stupid; gender; inequality,,-1
fayz4p,TPCz5w11,kind,,7210
fayw59,raffu280,teen; drama; bold; type; disney; freeform; cable; channel; blame; patriarchy; everything; woman; wanting; discus; private; part; feeling; comfortable; dating; woman,,-1
fayvjg,jessica_pin,woman; accuses; harassing; sending; message; respond; marker; toy; calling; straight; shitty,,7211
fayrqc,jessica_pin,check; page; instagram; easily; woman; feel; harassed; woman,right; twitter; instagram; smear; campaign; launched; accused; harassment; stalking; making; rape; threat; made; another; account; nothing; none; woman; publicly; shaming; ever; attempted; establish; boundary; directly; accusing; harassment; online; already; kicked; twitter; trying; kicked; instagram; thing; getting; vilified; saying; soft; woman; want; understood; saying; need; give; clear; hard; labeled; victim; blaming; woman; behind; account; comment; made; send; message; explaining; offensive; blocked; left; comment; contacted; asking; take; want; offending; people; refused; saying; reaching; harassment; leaving; comment; make; clear; goal; actually; protect; victim; feeling; triggered; victim; blaming; bizarre,-1
fayj2d,furchfur,female; lawyer; sacrificed; career; look; child; awarded; compensation; half; family; asset; never; ever; married; law; applied; equally,,-1
fayek0,wldwailord,small; knew; never; knew,,-1
fay82d,hmsigy538,someone; recommend; good; right; site; forum,,-1
fay20v,r33d0t,believe; picture; posted; news; piece; proud,,-1
faxiyg,TheAndredal,offender; victim; felt; like; believed; victim; sport; therapist; matthew; priest; fight; story; heard; court,,-1
faxhfa,GSpot89,cringe; worthy; woke; compilation,,-1
faxelp,stentorian46,mra; misogyny; part; second,mra; misogyny; part; first; post; topic; elicited; quite; post; felt; unnecessarily; nasty; posted; woman; imagine; like; lose; everything; family; court; replied; fact; losing; malicious; custody; dispute; mother; mentioned; several; others; especially; painful; thing; mother; lose; everyone; seems; assume; must; guilty; terrible; child; abuse; sure; enough; said; probably; lost; custody; abusive; mother; doubtless; best; fact; woman; murder; child; often; court; awarding; custody; abusive; mother; upsetting; open; custody; battle; toid; probably; abusive; mother; potentially; child; murderer; anyway; began; wonder; assumption; woman; likely; child; murderer; assumption; bought; fact; know; assumption; really; based; upon; looked; statistic; trend; concerning; child; murder; surprisingly; seems; fact; likely; murder; child; including; link; sciencedirect; science; article; sciencedaily; release; usatoday; story; news; nation; parent; kill; child; data; think; important; everyone; correct; information; question; hence; shared; finding; disappointing; hurtful; rather; trying; common; ground; expressed; view; unlike; probably; deserved; lose; custody; going; fact; case; labyrinthine; family; dispute; falsely; accused; many; outrageous; thing; daughter; content; affidavit; became; almost; amusing; read; thing; though; call; proxy; violence; violence; make; helpless; different; malicious; family; court; action; certainly; ruin; life; level; dead; still; game; choice; total; pauper; right; relationship; daughter; great; strange; sideways; sort; probably; daughter; suspect; thank; several; nice; message; felt; differently; expressed; sympathy; whole; family; court,-1
fax1s4,Oncefa2,important; mras; understand; feminist; theory,feminist; equal; right; feminism; driving; force; behind; gender; inequality; society; including; gender; inequality; woman; best; argument; feminism; come; feminist; simply; restating; feminist; argument; explaining; feminist; theory; people; show; ideology; flawed; problematic; come; gender; equality; real; world; example; buffer; argument; reddit; mensrights; comment; list; feminism; misandry; anyone; reddit; mensrights; comment; karen; straughans; response; arent; real; couple; list; feminist; hold; tremendous; amount; institutional; power; society; used; power; way; harm; woman; example; problematic; feminist; belief; patriarchy; theory; male; oppression; dulth; model; domestic; violence; concept; patriarchal; violence; reddit; mensrights; comment; eztklu; feminist; ideology; fundamentally; flawed; idea; responsible; violence; society; including; violence; committed; woman; feminist; view; rape; including; notion; rape; inherent; power; dynamic; woman; ever; humiliate; woman; place; tender; year; doctrine; idea; woman; better; parent; clearly; regressive; idea; come; gender; equality; victorian; gender; norm; view; woman; weak; helpless; position; fixing; toxic; masculinity; chivalry; fixing; society; help; woman; basically; woman; viewed; damsel; distress; need; rescued; righteous; honorable; malagency; really; part; feminist; thought; feminist; thing; seen; culpable; action; circumstance; whereas; woman; seen; victim; circumstance; thing; woman; thing; done; downplaying; woman; accomplishment; history; marxist; archive; beard; woman; force; index; contribution; modern; society; often; buffer; argument; patriarchy; theory; others; sure; think; head; feminist; agree; point; find; idea; inside; mainstream; feminist; thought; thing; know; counterargument; feminism; something; else; entirely; look; like; firsthand; imagine; quite; feminist; would; give; ideology; actually; research,-1
fawlw2,boyfriendsweatergirl,view; woman; right; effect; right,,-1
fawdnt,confused_biromantic,girl; bullied; guy,female; currently; year; reguler; panic; attack; worst; time; middle; class; walking; home,-1
favwp3,booyah2,get; aborted; lack; empathy; deafening,,-1
favkvy,biggy_sauce,tell; appreciate; late,front; hospital; heartbreaking; thing; ever; seriously; struggled; hold; tear; girl; must; like; maybe; year; getting; sobbing; silently; trying; hold; together; grand; mother; moment; past; door; started; cry; saying; want; like; little; girl; town; weekend; never; returning; whole; world; shattered; thing; never; going; back; normal; ever; heartbreaking; thing; seen; long; time; thinking; often; asshole; teen; still; sometines; talking; love; death; never; express; show; dad; seriously; undervalued; unappreciated; wait; late; give; make; time; tell; appreciate; know; make; smile; year; come,-1
favk4q,biggy_sauce,tell; appreciate; late,,-1
fave01,Miykael13,rant; made; cooky; team; morning; ridiculed; made,sorry; wrong; know; elise; post; needed; rant; love; bake; hobby; bread; cooky; cake; anything; really; last; night; great; mood; took; walk; went; store; pick; went; grocery; store; next; door; grabbed; everything; needed; cookie; recipe; figured; make; double; batch; friend; work; work; team; made; cookie; dough; last; night; woke; early; morning; bake; fresh; warm; melty; morning; left; note; table; help; sitting; desk; people; start; streaming; grab; cookie; great; stacy; coworker; make; miykael; think; look; betty; crocker; actually; taste; decent; great; thought; stacey; made; people; come; miykael; nothing; better; home; girlfriend; actually; make; store; guess; last; time; something; nice; make; extra; loaf; marble; weekend; guess; give; neighbor; something,-1
fav2o5,awakenedclass,objectified,always; hear; woman; objectified; body; never; hear; anyone; talk; objectified; success; mention; attacked,-1
fav03a,actsquid,know; prageru; still; wanted,,7212
faunk5,InvincibleV,found; facebook; woman; cheated; cried; rape; cheating; would; discovered; resulted; death; innocent; article; source; comment; comment; spam; filter,,7213
fauftv,compellinglymediocre,lmao; thing; massive; exclusion,,-1
fatowx,Biggsy77,interesting; story; happen,,-1
fatk1y,Elias_freecss,treated; like; joke; woman; say; yes; queen,,7214
fatbyb,TheAndredal,metoo; trial; century; fiamengo; file; episode,,-1
faslj6,Danialdlc,love,,7215
fas2oz,perplexedm,india; case; woman; falsely; accusing; estranged; husband; friend; sexual; assault; daughter,,-1
farla9,zombiesidechivk,custody; case,fellow; wondering; website; besides; wikipedia; inequality; male; writes; custody; case; need; school; assignment; trouble; looking; website,-1
faripj,Garrison_road2,aita; thread; show; societal; doublestandard; standard; equal; chore; argument; go,posted; thread; reddit; amitheasshole; comment; aita; dropping; everything; second; aita; crucified; called; asshole; selfish; sole; earner; fianc; school; full; time; attacked; equal; chore; contributing; equally; banned; aita; trying; make; post; must; unpopular; posted; unpopularopinion; whatever; anyone; say; stand; believe; thread; example; societal; bias; whole; equal; chore; thing; go; regarding; aita; thread; believe; sole; earner; equal; chore; housework; equal; paying; literally; everything; pay; food; clothes; bill; life; free; home; pay; think; vast; majority; chore; going; school; full; tine; argument; favor; around; able; school; full; time; first; place; work; allowing; comment; saying; lot; chore; housework; make; make; supporting; entire; life; allowing; school; full; time; without; worry; food; working; paying; rent; purely; gender; bias; gender; reversed; answer; would; opposite; woman; sole; earner; supporting; boyfriend; could; school; full; time; people; would; chore,-1
fargsr,accidental_me,guy; avoided; female; dominated; field; reason; change; could; rethink; decision,tried; google; reason; happened; stumble; article; theconversation; unemployment; push; take; female; dominated; job; reason; give; wage; social; stigma; pretty; sure; better; reason; article; found; tend; kind; feminist; approach; pretty; useless; example; told; cautiously; think; twice; starting; study; childcare; certain; risk; social; stigma; wage; anything; advice,-1
eydagx,DM_ME_YOUR_PASSWORD,result; front; page; woman; getting; shot; killed,,7216
eyd9n3,TheAndredal,porn; star; jesse; jane; arrested; punching; biting; boyfriend,,-1
eyd2fh,FalconFGX,feminist; defending; amber; heard; imagine; shock,,-1
eycyuf,supermarioplush220,world; live,,7217
eyc9e7,TheAndredal,district; attorney; maine; want; start; prosecuting; people; based; accusation; nothing; else,,-1
eyb178,MRMRising,millennial; gender; study; student; demand; college; tampon; male; restroom; voltaire,,-1
eyar3z,JohnKimble111,deepfake; audio; used; custody; battle; portray; father; threatening; family; lawyer; revealed; warned; doctored; evidence; submitted; court,,-1
eyai2u,JohnKimble111,johnny; depp; need; hetoo; movement,,-1
eya3ow,INTELDracula,right; come; child,high; chance; girlfriend; pregnant; officially; find; upcoming; friday; week; absolutely; position; raise; child; right; neither; told; pregnant; joining; army; provide; girlfriend; told; join; military; breaking; girlfriend; saying; wild; thing; talking; smoke; weed; pregnant; give; baby; halfway; house; wild; shit; right; come; possible; child; benefit; provide; baby; military; process; getting; full; custody; fucked; make; matter; worse; year,-1
eya0wo,mecharoy,awww; right; feel,,-1
eya02w,TheFartingWallendas,year; girl; parent,,-1
ey9fcf,Vinegar_Vice,many; ignore; excuse; joke; downplay; severity; blame; partner; attack; time; woman; anything; people; still; want; believe; woman; violent; deadly; medium; taking; serious; thought; around,,7218
ey9e52,Advanced-Average,petition; amber; heard; aquaman; reached; signature,,-1
ey922k,AntKaren,stop; amazon; selling; shirt,,-1
ey8c88,benderXX,know; motion; hand; fine; hitting; year; taunt; depp; baby; grow; amber; heard; ambassador; woman; right; american; civil; liberty; union,,-1
ey835p,RT-AC66U,article; another; false; metoo,nypost; wrongly; metood; ruined; life; referrer; fwww; google,-1
ey77uj,HotMomentumStocks,mentoo; gain; support; ontario; male; sexual; abuse; survivor; speaking,,-1
ey7775,Belzebuthian,woman; hit; hammer; frame; abuse; luckily; filmed; work,,-1
ey6x6s,RT-AC66U,superbowl; glorifies; domestic; violence,mengtow; freeforums,-1
ey6x4v,serpentineeyelash,democratic; primary; candidate; better; worse,researching; democratic; party; primary; candidate; particularly; better; worse; male; issue; opinion; first; thought; might; democratic; party; candidate; party; allow; genuine; candidate; necessarily; disagree; either; point; still; voting; begin; like; idea; better; worse; particularly; interested; whether; dividing; line; left; wing; candidate; negative; medium; coverage; gabbard; sander; yang; centrist; establishment; candidate; positive; medium; coverage; biden; bloomberg; buttigieg; klobuchar; steyer; warren; think; either; camp; identifiably; better; worse; vary; depending; candidate; equally; searched; subreddit; could; find; point; biden; reddit; mensrights; comment; biden; currently; leading; democratic; polling; discussed; candidate; reddit; leftwingmaleadvocates; comment; excsij; democratic; presidential; candidate; recently; leftwingmaleadvocates; consensus; roughly; yang; sander; gabbard; seem; le; biden; klobuchar; warren; buttigieg; seem; worse; people; think,-1
ey5rkl,Dunkolunko,australia; funding; body; film; us; affirmative; action; fund; assign; role; based; gender; rather; merit,,-1
ey5fz5,aoijvzoqfonso,book; opener,,7219
ey5536,Belzebuthian,abused; jail; abuser; life; destroyed,,7220
ey4zm2,Sky29102003,right; activist; need,currently; school; writing; persuasive; piece; social; issue; chose; toxic; nature; modern; third; wave; feminism; controversial; write; since; everyone; study; thing; internet; cesspool; politically; biased; article; hoping; could; study; fact; anything; could; provide; quote; could; throw; main; point; belittlement; real; male; issue; teach; young; woman; need; extra; stuff; equal; boy; fear; monger; propagate; conspiracy; theory; basically; control; mass; medium; outlet; nothing; controversial; day; thanks; advance; anything; would; helpful,-1
ey4zii,astauwearestrong,incredible; display; misandry; reddit; feminist; response; amber; heard; situation; difference; woman; hitting; askfeminist; going; accusing; depp; darvo; backpedalling; denying; hypocrisy,,-1
ey4yqe,thenorthernhouse,show; much; sham; radical; academia; academic; wrote; fake; paper; arguing; fact; dog; hump; prof; patriarchy; exists; train; human; like; train; dog; fake; paper; prize; left; wing; journal; video,,-1
ey4hx8,filmpromunich,education,,-1
ey4hbs,throwaway77744411100,audio; tape; amber; heard; admitting; abuse; johnny; depp,,-1
ey41kl,JohnKimble111,district; attorney; maine; want; start; prosecuting; people; based; accusation; nothing; else,,-1
ey3is2,Strikester101,statistic; human; trafficking,particular; unique; issue; woman; face,-1
ey3ax1,picsnapr,except; shark; human; mean; headline,,-1
ey38k9,Lil-Rupees,poor; falsely; accused; physical; assault; cross; post; case; anyone; might; able; help,,-1
ey2p6p,istira_balegina,updated,,7221
ey1nvj,Infinitejest12,right,guy; mother; father; year; currently; separated; intends; marry; collect; half; retirement; plan; marry; foreign; boyfriend; numerous; foreign; domestic; suitor; divorce; father; receives; money; usually; would; wrong; however; considering; father; cheated; verbally; abusive; financially; supportive; make; right; note; mra; wanted; perspective,-1
ey1g97,Out_With_Amber,sign; petition; aclu; revoke; title; ambassador; woman; right; amber; heard,,-1
ey1fa1,lowsodiummonkey,redditor; explains; bias; enforcement; domestic; abuse,,-1
ey17mf,Kierran169,,,7222
ey14lt,Vinegar_Vice,many; ignore; excuse; downplay; severity; blame; partner; attack; time; woman; anything; people; still; want; believe; woman; abusive; deadly; medium; taking; serious; thought; around,,7223
ey0uro,alittlemore,cure; auto; superbowl; commercial; show; woman; slapping,,-1
exzs36,Rolaid-Tommassi,double; standard,policeman; would; attend; many; call; domestic; violence; abuse; often; shift; especially; night; shift; thing; noticed; overwhelming; majority; case; female; would; would; instigate; violent; behaviour; usually; throwing; thing; would; respond; inflict; greater; injury; would; arrested; went; brawl; first; question; would; threw; first; punch; thats; would; arrested; always; wondered; different; situation; result; course; feminist; quote; statistic; like; arrest; paint; true; picture; situation; simply; make; appear; responsible,-1
exzqep,RT-AC66U,australian; domestic; violence; website,oneinthree; news; another; study; find; equal; level; abuse; html; source; dlvr; medium; facebook,-1
exz6m4,cheesyween,know; quite; people; disgusting,,7224
exz2kj,SOR5,kind; annoying; night; baftas; making; headline; male; white; super; bowl; half; time; show; close; woman; see; double; standard,,-1
exytmv,n0tqu1tesane,tomorrow; start; week; jury; duty,know; jury; duty; considered; many; burden; avoided; speaking; mra; tool; need; ignoring; jury; nullification; jury; united; state; ultimate; finder; fact; jury; say; happened; happened; jury; sometimes; recommend; punishment; last; time; served; guilty; pedo; rape; recommended; time; serve; jury; convict; woman; rape; crime; right; juror; advocate; punishment; equal; remember; four; box; freedom; soap; ballot; jury; cartridge; important; exhaust; first; three; consider; considering; last,-1
exyqzq,SkywalkerHsu,imagine; female; athlete; instead; male,,-1
exyp6v,thefudmaster,fantastic; analysis; depp; heard; situation,,7225
exyme8,dav0011,celebrity; woketivists; trusted; terry; crew; gabrielle; union,,-1
exyc3v,Shitworldwelivein,investigator; third; person; arrested; dennis; perkins; case,,-1
exybas,Matthewisunoriginal,tiktok; thought; belonged,,-1
exy9dk,benderXX,washington; post; going; retract; amber; heard,,-1
exy8hg,Ignacio_17,need; photo; social; experiment,,-1
exxl3v,dlkakq,straight; white; american; struggle,easy; anything; life; compared; immigrant; pakistan; whose; second; language; english; speak; fellow; white; male; dude; happens; accent; qualification; skill; white; chance; getting; white; next; none; repeat; zero; chance; getting; white; happened; interview; privilege; time; white; acknowledge; stop; whining; little; inconvenience; life; know; dying; shit; feel; sorry; majority; people; making; talking; point; white; struggle; face; oppression; sorry; sound; hilarious; pick; stats; category; neighborhood; state; north; america; people; highest; income; earner; category; white; period; fact; ceo; company; america; white; sure; supposed; take; cry; oppression; seriously; people; literally; screwing; minority; make; sure; point; left; make,-1
exxkb4,will2fight,damn; amber; heard; bully; couple; year; stop; reason; right; taken; seriously,,-1
exxg1j,MuchHorse,madonna; never; small; penis,metro; madonna; never; small; penis; tell; audience; size; matter; inside; article; state; size; matter; beside; fact; true; wondering; similar; declaration; would; like; something; like; overweight; girl; woman; still; improve; want; equity,-1
exwdnn,MidiSymphony,mras; feel; honey; badger; le; woman,journalist; working; story; honey; badger; woman; right; movement; magazine; interested; crowd; sourcing; opinion; like; part; movement; mostly; woman; specifically; honey; badger; karen; straughan; alison; tieman; hannah; wallen; spoke; karen; alison; piece; received; permission; mod; post; rando; coming; gawk; genuinely; interested; thought; wondering; anyone; would; able; answer; following; either; comment; section; like; detailed; conversation; handle; already; make; response; anonymous; reader; would; willing; share; name; first; name; fine; required; mras; feel; right; largely; helmed; woman; woman; place; right; movement; think; honey; badger; honey; badger; radio; woman; affected; thanks; much; looking; forward,-1
exwd01,bhatch245,absolutely; disgusted; petition; united; nation; right; commission,preview; redd; le; width; format; pjpg; auto; webp; chng; tggdcpt; chng; tggdcpt,-1
exw2z3,blueorange22_,woman; kill; husband; get; year; sentence; appealing; saying; sentence; excessive,,-1
exvs9m,MRMRising,right; torpedoed; maine; allegation; prosecuted; evidence; required; james; maxwell,,-1
exuyug,zerominuszeroiszero,hundred; million; woman; done; worse; amber; heard; time; make; example,,-1
exuvgd,zerominuszeroiszero,death; amber; herd,,-1
extoqo,Strikester101,ordinary; subreddit; video; einstein; wife; remotely; true,,-1
ext27j,gratis_eekhoorn,brutally; mudered; woman; nobody; talk,happened; couple; day; turkey; woman; brutally; kill; year; setting; fire; argument; literally; talking; nothing; nothing; mainstram; medium; nothing; paragraph; article; internet; reason; know; bumped; random; link; woman; killed; stay; national; medium; week; twitter; would; full; hating; hashtags; would; march; saying; femicides; shouldnt; much; attention; work; way; another; example; double; standard; hurriyet; gundem; mersinde; donduran; cinayet; canli; canli; yaktilar; hurriyet; gundem; mersinde; donduran; cinayet; canli; canli; yaktilar; link; article; turkish; tried; best; translate; incident; happened; skele; neighborhood; mersin; house; owner; still; unkown; victim; woman; started; arguing; unkown; reason; argument; escalated; woman; allegedly; poured; gasoline; victim; fire; neighbor; heard; noise; noticed; flame; called; emergency; police; firefighter; ambulance; send; victim; found; dead; autophsy; victim; buried; today; police; took; woman; custody,-1
ext0wq,kahvekola,special,,7226
exsky6,ElBarro69,time; somebody; said,,-1
exsa52,JohnKimble111,county; court; restrains; esther; baker; racist; stalking; high; court; make; strike; order,,-1
exs599,DougDante,australia; broome; father; lost; daughter; murder; suicide; speaking; frustration; family; court; system; actually; wanted; believe; could; stick; neck; might; right; tweet,tweet; seek; justice; father; murdered; girl; actually; wanted; believe; could; stick; neck; might; right; protect; kid; dad; highcourtofaus; austbarassoc; scottmorrisonmp; fathersrights; radio; perth; program; breakfast; harley; cuzens; fbclid; iwar; nidkn; lzskikdphkijryckmml; suyhny; kjhb; bahahnt; reply; eliminate; possible; discrimination; person; ground; marital; relationship; status; administration; commonwealth; law; program; discrimination; mensrights; genderequity; legislation; detail; reply; person; conspires; another; person; commit; offence; punishable; imprisonment; commits; offence; conspiracy; commit; offence; criminal; code; investigate; possible; conspiracy; dad; right; report; abuse; ausfedpolice; legislation; detail,-1
exr9al,NNfnmm,game; neil; strauss; book; video,,-1
exq65x,WeAreFoolsTogether,truth; come; falsely; accused; abuse; projection; still; listed; wikipedia; page; activist; domestic; abuse; awareness; comical; incredibly,,7227
expu4b,OmegaChew,child; partner; support,child; support; current; child; child; partner; child; support; another; mouth; feed; barely; feed; split; partner; child; support; paying; child; support; different; current; child; support; double; based; income; multiplying; feasible,-1
expszz,tacofrog2,first; male; claim; queen; title; michigan; technological; university,,-1
