post_id,author,title,body,image
f5wqyi,JAdoreLaFrance,ignorant; young; woman; today; male; physical; strength,spoken; last; fortnight; otherwise; intelligent; something; woman; woman; strong; expressed; surprise; rather; weedy; boyfriend; able; subdue; playfight; outright; challenged; wrestle; stone; genuinely; expected; sporting; chance; victory; clear; twice; weight; plus; change; former; somewhat; shape; bodybuilder; still; retains; peak; strength; would; find; fact; quite; painful; face; changed; expression; withdrew; challenge; remember; last; fortnight; many; conversation; seen; girl; altercation; guy; instigate; violence; ended; shock; horror; girl; losing; exchange; physically; begs; question; young; woman; today; stupid; believe; social; study; school; lesson; pupil; taught; woman; equal; override; biology; school; lesson; pupil; taught; woman; different; physical; structure,-1
f5wqi9,Alohasnackbar420,know; know; deserved,,7377
f5wgvw,andejoh,actress; meital; dohan; break; pacino; politely; like; spend; money; bought; flower; said,,-1
f5w4fe,ToBeContinuedYes,feminist; mras; mostly; want; thing,,-1
f5vw2e,justAcuriousDalek,word; followed; account; giving; dirty; instagram; took; screenshot; posted; truly; evil; human,,7378
f5vpcb,iamericevans,ignorance; incredible,,-1
f5v9ed,Nochi420,discus; feminist; argument; believe; discriminatory,male; consider; agnostic; believe; gender; equality; human; right; recently; talking; gender; equality; feminism; used; consider; feminist; ever; since; gotten; relationship; feminist; woman; learn; read; modern; feminist; long; story; short; liking; modern; feminist; made; feminism; currently; consider; feminist; still; believe; gender; equality; sort; form; research; believe; modern; feminism; dividing; rather; uniting; humanity; back; topic; hand; since; discussing; feminism; come; several; time; argument; white; male; understand; feminist; woman; woman; general; living; feminism; political; social; movement; created; make; woman; equal; call; feminist; allowed; called; ally; feminist; add; compared; racism; sense; white; male; understand; struggle; black; people; nature; point; view; discrimination; sense; ability; understand; suffer; similar; way; subreddit; really; want; educate; would; counter; argument; thought; recommendation; right; gender; equality; feminism,-1
f5v6zu,JohnKimble111,police; still; deemed; caroline; flack; risk; boyfriend; lewis; burton; mental; health; assessment; bail; ruling; barred; seeing,,-1
f5ugcv,TheFartingWallendas,world; white; woman; woke,,-1
f5sm18,stentorian46,survey; extract; made; jess; hill,almost; study; prove; woman; violent; data; instrument; known; conflict; tactic; scale; survey; instrument; gelles; straus; used; first; study; back; still; wide; today; asks; respondent; answer; series; question; violence; occur; relationship; frequently; occur; look; like; exactly; survey; measure; measure; come; statistic; show; equal; level; domestic; violence; woman; experiment; sitting; home; knock; door; open; stranger; step; trying; sell; something; convert; jehovah; instead; want; come; house; incredibly; intimate; question; relationship; name; research; course; researcher; take; seat; living; room; brings; clipboard; using; boilerplate; survey; devised; gelles; straus; start; like; matter; couple; get; along; time; disagree; annoyed; person; want; different; thing; spat; fight; mood; tired; reason; couple; many; different; way; trying; settle; difference; list; thing; might; happen; difference; stop; right; critic; michael; kimmel; world; leading; expert; masculinity; domestic; violence; argues; pattern; behaviour; abuser; manufacture; conflict; using; dizzying; array; method; confuse; dominate; partner; tally; incident; slap; shove; threat; capture; subtle; pattern; cruelty; common; coercive; control; among; le; controlling; abuser; insecure; reactor; conflict; still; something; largely; manufacture; researcher; want; know; past; twelve; month; either; used; force; settle; difference; kind; force; used; rank; forceful; act; scale; severity; least; severe; saying; something; spite; partner; scale; slapping; higher; still; kicking; biting; hitting; fist; hitting; trying; partner; something; severe; act; involve; threat; attack; knife; something; confess; couple; month; partner; surveyor; nod; note; violent; survey; explain; go; still; interested; record; rank; incident; according; severity; context; irrelevant; many; scholar; statistician; problem; come; domestic; abuse; argue; context; another; data; point; include; violent; incident; happened; impact; role; violence; play; abusive; dynamic; overall; picture; missing; without; context; example; give; equal; weight; kick; barely; leaf; bruise; kick; cause; traumatic; brain; injury; kick; whose; intended; meaning; leave; alone; registered; equal; kick; mean; leave; house; break; rib; false; equivalence; caution; university; southern; california; psychology; professor; gayla; margolin; mean; woman; hardest; punch; might; laughed; husband; would; count; husband; abuse; based; action; alone; husband; struck; broke; punch; would; receive; equal; ranking; another; related; distortion; perpetrated; several; violent; act; matter; serious; reported; committing; single; matter; trivial; defined; violent; write; scholar; russell; rebecca; dobash; woman; try; fails; partner; recorded; violent; beat; unconscious; according; relationship; consists; violent; woman; violent; situation; mutual; combat; easy; method; produce; misleading; result; family; conflict; researcher; worried; sloppy; research; focus; couple; resolve; argument; calmly; violently; family; conflict; viewpoint; woman; chose; violence; greater; impact; culpable; used; violence; michael; kimmel; abstract; academic; perspective; utterly; disconnected; human; experience; initiate; violence; writes; relative; size; strength; people; involved; nature; relationship; surely; shape; experience; violence; score; fatal; flaw; family; conflict; research; family; conflict; researcher; concede; point; early; important; know; whether; partner; acting; self; defence; second; national; survey; family; violence; gelles; straus; steinmetz; added; question; initiated; physical; conflict; produced; another; result; shocked; many; expert; woman; initiated; violence; virtually; equal; rate; data; contradicted; long; list; established; study; showing; woman; mostly; violence; self; defense; another; statistic; need; unpacking; cast; mind; back; case; jasmine; nelson; chapter; nelson; dominance; jasmine; established; many; year; forcing; jasmine; sleep; would; register; violence; fact; nelson; used; violence; past; twelve; month; would; show; violent; however; jasmine; finally; snapped; threatened; knife; tried; banish; would; recorded; initiated; violence; following; rule; incident; based; survey; would; violence; committed; perpetrator; jasmine; threatened; nelson; knife; jasmine; would; committed; severe; violence; despite; enduring; year; physical; psychological; abuse; would; classified; violent; woman; perpetrator; domestic; violence; nelson; victim; enormously; successful; alerting; society; high; frequency; violence; occurs; conflict; lover; spouse; kimmel; say; incident; based; survey; like; paint; accurate; picture; domestic; violence; imagine; simply; observing; death; rate; soared; age; nineteen; thirty; period; year; without; explaining; country; declared; say; kimmel; context; matter; message; plain; data; alone; accurately; portray; complex; nature; woman; violence; fact; remains; however; large; number; woman; survey; admit; using; violence; relationship; explain; penn; state; sociologist; michael; johnson; world; leading; thinker; domestic; violence; early; johnson; puzzling; contradictory; position; family; conflict; researcher; scholar; wrote; come; group; renowned; scholar; presenting; ostensibly; credible; evidence; obviously; contradictory; position; regarding; simplest; possible; question; partner; violence; johnson; experiment; took; every; empirical; study; domestic; violence; used; showing; equal; near; equal; perpetration; woman; compared; statistic; police; hospital; woman; shelter; showing; predominantly; male; perpetration; difference; datasets; said; johnson; dramatic; compared; agency; statistic; showed; male; violence; frequent; severe; escalated; time; rarely; equal; violence; used; female; partner; johnson; lightbulb; moment; side; right; wrong; datasets; legitimate; group; researcher; simply; looking; fundamentally; different; kind; violence; family; conflict; researcher; survey; identifying; johnson; called; situational; couple; violence; common; type; domestic; violence; kind; erupts; frustration; need; stop; argument; commonly; violence; mild; either; isolated; sporadic; however; situational; violence; warrant; call; police; others; become; dangerous; escalating; pattern; lead; homicide; relationship; violence; dangerous; distressing; generally; partner; totally; dominating; instead; type; reactive; violence; really; stem; emotional; intelligence; poor; anger; management; absence; severe; power; imbalance; generally; speaking; situation; situational; violence; life; threatening; leave; relationship; situational; violence; usually; end; relationship; though; johnson; accepted; woman; likely; aggressor; situational; couple; violence; emphasised; impact; violence; still; distinctly; gendered; serious; damage; explained; violence; likely; introduce; fear; relationship; authority; involved; family; conflict; researcher; agree; especially; since; show; data; survey; cent; female; sustained; injury; needed; medical; attention; compared; cent; male; victim; kind; domestic; violence; kind; dominates; statistic; collected; police; hospital; shelter; johnson; call; intimate; terrorism; commonly; referred; coercive; control; chapter; kind; domestic; violence; woman; exhausted; terrified; described; started; fleeing; first; woman; refuge; today; domestic; violence; sector; say; domestic; violence; usually; thinking; situational; couple; violence; deal; primarily; coercive; control; abuse; woman; child; need; ongoing; protection; long; left; coercive; control; dominates; police; hospital; data; precisely; inspires; kind; violence; fear; lead; victim; turn; agency; help; writes; johnson; thus; researcher; work; agency; data; violence; primarily; male; perpetration; seen; coercive; control; product; frustration; poor; anger; management; skill; systematic; campaign; either; strategic; instinctive; person; dominate; control; partner; enforced; threat; physical; often; sexual; violence; intimate; terrorist; almost; exclusively; johnson; acknowledges; rare; exception; like; whose; account; read; earlier; worked; terrorised; partner; say; johnson; pattern; look; much; like; pattern; perpetrated; female; partner; worked; married; police; officer; terrorised; way; male; intimate; terrorist; terrorise; female; partner; used; weapon; beat; threatened; police; police; buddy; child; escape; without; leaving; child; intimate; terrorist; struggling; dilemma; female; victim; intimate; terrorism; struggle; add; want; emphasise; vast; majority; happens; hetero; relationship; woman; stressed; strongly; enough; coercive; control; particular; kind; violence; almost; always; perpetrated; woman; distinguishing; intimate; terrorism; coercive; control; situational; violence; something; else; occurred; johnson; woman; living; intimate; terrorist; would; agree; answer; stranger; detailed; list; question; violence; relationship; sure; enough; checked; number; respondent; refused; answer; national; family; violence; survey; percentage; high; cent; similar; rate; response; applied; australia; personal; safety; survey; around; cent; within; group; responder; johnson; concluded; vast; majority; victim; intimate; terrorism; johnson; figured; research; group; could; right; wrong; time; researcher; using; agency; data; cite; statistic; violent; one; intimate; relationship; family; conflict; researcher; using; survey; data; show; woman; violent; fact; talking; completely; different; phenomenon; intimate; terrorism; situational; couple; violence; using; term; domestic; violence; describe; study; another; researcher; clinical; psychologist; neil; frude; belongs; neither; camp; describes; difference; male; female; violence; like; husband; wife; said; aggressive; many; husband; violent; agree; significant; percentage; woman; using; violence; relationship; self; defence; hear; domestic; violence; sector; say; mangan; spent; many; year; helm; queensland; statewide; helpline; dvconnect; dysfunctionality; within; family; gradient; say; mangan; lead; mutual; combat; difference; slamming; slapping; walk; room; know; going; king; dvconnect; answer; almost; call; year; many; woman; need; immediate; protection; seriously; threatened; attempted; kill; mangan; adamant; woman; violence; cause; distress; abusive; relationship; almost; never; danger; killed; difference; say; sector; overflowing; woman; facing; real; threat; homicide; tortured; nearly; death; living; traumatic; brain; injury; made; homeless; result; violence; advocate; like; mangan; domestic; violence; involves; imposition; system; power; control; held; place; violence; threat; violence; anything; else; something; else,-1
f5sh6p,Loban8990,secretary; stole; nearly; property; tycoon; boss; used; splash; fleet; luxury; car; said; thank; much; judge; spared; jail,,-1
f5sbfr,forenpsyche,male; participant; needed; psychological; study,processing; vbwoh; questionnaire; form; hsysht; ktrh; thanks; advance,-1
f5s2na,MilManShow,weinstein; case,tune; today; seeing; explain; going; walk; victim; busted; admitting; concentuals; camera; predicted; would; happen; like; everyone; else,-1
f5rlmf,EricAllonde,retweeted; woman; prominent; twitter; feminist; currently; whining; fact; retweeted; often; woman; shown; article; understand; point; make,,-1
f5r77e,benderXX,three; suicide; associated; love; island; including; violent; host; bludgeoned; boyfriend; slept; right; group; problem,,-1
f5r68j,EricAllonde,amber; heard; desperate; depp; harvey; weinstein,,-1
f5r44v,stentorian46,feminism; always; wrong; point,prompted; pose; question; fellow; australian; descried; seems; okay; poster; promoting; respect; girl; australian; school; genuine; problem; woman; face; cross; culturally; think; mras; fixate; feminism; extent; actually; think; mras; could; constructively; embrace; feminist; insight; perhaps; challenge; example; still; extant; valorisation; violence; among; young; cause; many; young; instead; blaming; everything; massive; feminist; conspiracy,-1
f5qdv8,Cloroform231,hitting; woman; self; defense,post; justifying; hitting; woman; self; defense; debunking; argument; encountered; oppose; mine; stronger; woman; reason; woman; reason; woman; self; defense; mike; tyson; punch; face; expect; back; stronger; person; pick; fight; someone; know; much; stronger; fault; hurt; white; knight; response; logic; okay; child; attacking; unarmed; child; hurt; unarmed; adult; unarmed; adult; woman; cause; serious; physical; injury; death; attack; white; knight; response; could; subdue; grabbing; hand; arm; someone; physically; assault; responsibility; fine; tune; self; defense; someone; put; hand; whether; woman; crossed; point; return; pushed; slapped; someone; warrant; least; twice; much; aggression; response; assailant; understands; messed; physically; assault; others,-1
f5qd8i,perplexedm,mystery; woman; vegan; feminist; find; way; stymie; irrational; decision; woman,,-1
f5q472,Bucket_head,taken; baby; making; homeless; legitimate; reason,first; want; idea; long; time; packed; work; could; easily; council; flat; benefit; baby; together; live; made; clear; think; would; ever; work; applied; universal; credit; month; couple; denied; income; next; disappeared; baby; away; work; extremely; minor; argument; money; relating; claim; denied; refusing; contact; seeing; texted; sister; couple; hour; left; gone; deep; going; custody; still; normal; routine; gone; sofa; surfing; baby; best; interest; told; need; court; visitation; order; beyond; feel; unjust; fabricating; kind; reason; leaving; ensure; get; benefit; advance; government; never; aggressive; ever; tried; defuse; escalation; aggression; towards; sake; baby; responsible; happened; anyone; else; want; leave; stop; trying; aggression; towards; baby; escalating; since; month; staying; single; friend; worry; feeding; incorrect; toxic; information; best; thing; make; sure; get; benefit; talked; notification; claim; amended; left; changing; single; applicant; removing; made; contact; letting; supposed; want; protect; want; deprive; best; interest; exactly; around; qualify; legal; financial; though; claiming; homeless; baby; made; homeless; safe; secure; home; right; tried; stop; coming; home; wanted; wanted; leave; know; would; affect; claim; homeless; needing; emergency; housing; tenancy; agreement; concerned; mental; state; regardless; social; service; police; telling; mediation; court; going; cost; hour; qualify; legal; financial; cost; diddly; squat; please; help; court; cost; rich; know; website; letting; arrange; baby; source; customer; medium; copy; link; campaign; share; sheet,-1
f5q1b2,Bucket_head,really; need; help; fiance; taken; baby; gone; sofa; surfing,,-1
f5pjd9,Atchoum150,lesson; caroline; flack; affair; gynocentrism; invincible,caroline; flack; abuser; extreme; kind; abuser; nearly; killed; partner; since; suicide; day; people; signed; petition; change; make; illegal; medium; expose; female; abuser; twice; many; number; people; signed; petition; cancel; amber; heard; shaming; female; perpetrator; extreme; abuse; deemed; greater; evil; public; abuse; gynocentrism; invincible,-1
f5ox05,cld8,scout; america; file; bankruptcy; amid; hundred; sexual; abuse; lawsuit,,-1
f5ov93,thatguy_96,desperate; single; reason; woman; benefit; translation; bottom; line; made; girl; defeated; arguement; fact; logic,,7379
f5ov1t,thatguy_96,desperate; single; reason; woman; benefit; translation; bottom; line; made; girl; defeated; arguement; fact; logic,,7380
f5osce,foreskin_trumpet,school; started; year; tertiary; education; institution; melbourne; australia; feminist; propaganda; poster; wall; covering; usual; false; feminist; narrative; gender; wage; domestic; violence; happens; woman; believe; woman,,-1
f7m744,aAvocado62846,imagine; delusional,,-1
f7lteh,HamiltonMarvel,cave,,-1
f7leu0,HurricaneDorian321,murder; case; brings; fresh; call; rough; defense,,-1
f7l8cb,_Randy_C,open; letter; woman; something; written; look; forward; comment,,-1
f7l86x,furchfur,sweden; poll; young; woman; support; former; communist; party; meanwhile; vote; considerably; right; wing,,-1
f7kwvq,ChucklesMalone,social; justice; college; directly; correlate; majority; female; student; body,,-1
f7ktsr,ChucklesMalone,woke; feminist; outraged; date; chivalrous; thought; wanted; equality,,-1
f7ko1d,1gbh,article; state; woman; likely; killed; partner; completely; gloss; statistic; showing; twice; many; male; victim; female; male,,-1
f7kcvz,PeterWrightMGTOW,mark; dent; four; surprising; minute,,-1
f7j6yz,mgtowolf,country; music; gynocentric; fuck,something; noticed; work; guy; playing; country; station; response; cheating; wreck; vehicle; response; cheating; woman; like; bitch; drunk; response; dude; slap; around; woman; murder; getting; knocked; around; never; heard; song; heard; song; friendzoned; dude; trying; girl; dump; asshole; boyfriend; instead; calling; cry,-1
f7icno,TheAndredal,taught; medical; friend; mine; course,,7381
f7hx63,ElijyahTheSexyPotato,blatant; transphobia,,7382
f7hgii,supermarioplush220,able; woman; vise; versa,saying; woman; basically; say; abusive; wife; legal; good; example; amber; herd; amber; abused; husband; johnny; depp; framed; crime; severd; finger; amber; charged; aquman; amber; herd; said; johnny; abusing; evidence; medium; quickly; attacked; johnny; said; abuser; taken; pirate; caribbean; franchise; agree; comment,-1
f7h8f8,perplexedm,india; madhya; pradesh; state; govt; friday; scrapped; controversial; circular; sterilisation; target; male; multi; purpose; health; worker; mphws; warned; salary; loss; meeting; goal,,-1
f7gzrm,TheAndredal,married; teacher; performed; oral; year; allowed; back; classroom,,-1
f7gyd4,farhan9835,people; world; showing; support; year; video; saying; wanted; kill; went; viral,,-1
f7fyr3,kazoomajo,tweet; saying; hate; ex; misogyny; understand; people,,7383
f7fqbr,ElijyahTheSexyPotato,avoiding; male; content; done; wonder; life,,-1
f7fgn4,WarOfNoise,mod; unpopularopinion; male; post; le; character; pretty; obvious; case,,-1
f7f79e,Darthoftor,warner; bros; considering; removing; amber; heard; aquaman; leaked; audio,video; situation; youtu; htzywp; look; like; better; mera; heard; wegotthiscovered; article; google; wegotthiscovered; movie; warner; bros; reportedly; replacing; amber; heard; aquaman,-1
f7f5iz,Darthoftor,warner; bros; considering; removing; amber; heard; aquaman; johnny; depp; audio; release,,-1
f7f3n6,FragmentedFireGaming,againstmensrights; seems; claim; echochamber; mysogony; seen; mysogony; downvoted; hell,,-1
f7f2b4,KabyBlue,sentenced; jail; rape; victim,woldcnews; albert; wilson; rape; case; woldcnews; albert; wilson; rape; case; september; albert; wilson; young; white; girl; visiting; family; member; attended; underage; club; wilson; year; reportedly; unbeknownst; young; woman; seen; kissing; club; wilson; allegedly; pulled; skirt; leave; wilson; place; story; turn; victim; claim; wilson; raped; wilson; denies; sexual; intercourse; rape; found; seminal; fluid; found; victim; vagina; month; later; victim; contacted; police; wilson; arrested; rape; charge; trial; wilson; maintained; innocence; eventually; found; guilty; given; year; prison; lifetime; probation; mandatory; offender,-1
f7efg0,BaconCatBug,news; tarana; burke; metoo; movement; take; blatent; lie; alex,,-1
f7dxs0,trot-trot,russian; soldier; proposes; tank; shape; heart; valentine,,-1
f7dl2i,ajofalante,would; exposing; feminist; revisionist; history; woman,,-1
f7cwsk,IcyHotRoad,thought; sacrifice,always; heard; repeatedly; female; partner; sacrifice; career; becomes; full; time; time; sacrifice; freedom; work; support; least; others; never; really; considered; sacrificing; happen,-1
f7cuu4,porvax,bullied; family,guy; literally; bullied; family; half; sister; aunty; cousin; granny; girl; pick; especially; gran; halfsister; tired; know; hate; husband; half; sister; left; another; woman; abusive; hitting; moved; back; italy; seen; since; baby; see; every; trash; constantly; make; male; sticker; fridge; magnet; everywhere; hating; saying; thing; like; want; speak; charge; woman; know; happening; shit; like; constantly; talk; girl; smarter; boy; boy; shit; school; agressive; full; testosterone; argument; stupid; outnumbered; gran; horrible; person; used; punish; punishment; like; know; much; soap; mouth; making; wash; mouth; said; something; like; dislocated; shoulder; toddler; dragging; across; floor; love; half; sister; treat; nicely; always; get; jewlery; giving; dy; getting; nothing; course; half; sister; literal; pyscho; self; harm; bipolar; meanest; evil; person; know; biggest; bully; ever; physically; sexual; think; attack; year; slap; spit; time; went; straight; hide; stuff; school; book; trouble; bring; lesson; grabbed; ball; used; make; kiss; younger; disgusting; phase; telling; going; kill; told; wanted; lock; door; charge; room; allowed; reacting; apparently; spent; age; saving; xbox; bought; money; soon; share; half; sister; though; mine; made; schedule; come; paid; couple; month; playing; wanted; come; told; need; finish; match; grab; controller; smashed; head; could; star; left; minute; straight; run; giving; attention; care; still; star; every; want; hate; none; care; want; happy; really; want; brother; relate; guy; look; friend; school; understand; like; living; family; wish; could; adopted; someone; else; starting; feel; depressed,-1
f7bzod,p3ngwin,kill; wife; kid; detective; inspector; community; come; forward; information; maybe; reason; pushed; inspector; forced; step; sexist; comment,investigator; keep; completely; open; mind; need; look; every; piece; information; bluntly; probably; people; community; deciding; side; speak; take; investigation; issue; woman; suffering; significant; domestic; violence; child; perishing; hand; husband; instance; husband; driven; issue; suffered; certain; circumstance; committing; act; form; want; people; come; speak; detective; inspector; suggest; people; come; forward; information; police; make; informed; investigation; find; maybe; made; kill; wife; child; made; step; suggesting; woman; part; problem; whenever; woman; commit; domestic; violence; always; case; make,-1
f7bpw9,redrebel121,absolute; trash; woman,,7384
f7bh3n,accountancyisboring,article; state; woman; likely; killed; partner; completely; gloss; statistic; showing; twice; many; male; victim; female; male,,-1
f7azej,LadySaye,apologises; binary; shopper; born; female; stopped; using; changing; room,,-1
f7ar9s,mimiczx,sexual; female; understands; male; dating; struggle,another; amazing; video; preach; girl; date; girl; girl; girl; thing; girl; realizes; guy; tough; simple; video; show; male; struggle; female; twist; enjoy; sexual; female; understands; male; dating; struggle; youtube; watch; faiq,-1
f7apqw,R3laxEst,think,,-1
