post_id,author,title,body,image
ngfw67,LetsDelveIntoIt,think; socioeconomic; background; class; matter; woman; today; dating; scene,recently; read; article; vogue; art; lifestyle; article; dating; someone; different; class; regarding; class; much; impact; global; egalitarian; world; according; article; cent; upper; class; participant; survey; said; would; consider; entering; long; term; relationship; across; class; divide; many; would; date; across; class; divide; would; date; across; divide; would; likely; date; class; higher; open; dating; higher; lower; class,-1
ngfbdi,RatedAforAwesome,locker; room; talk; thing,think; harm; talking; candidly; greatly; exaggerated; often; hear; woman; saying; must; held; accountable; locker; room; woman; sort; safe; space; talk; openly; want; without; fear; policed; nobody; free; judgment; often; time; something; deemed; voice; stifled; usually; apprehensive; adding; woman; male; dominated; area; know; talk; like; really; want,-1
ngexb3,DireLiger,woman; alike; posit,want; order; importance; pretty; much; face; first; body; size; breast; woman; want; face; first; body; size; penis; face; first; mean; look; like; pleasing; body; second; mean; pleasing; proportional; breast; many; many; care; like; boob; period; full; stop; large; small; matter; face; pleasing; first; body; proportional; second; breast; size; penis; size; unfortunately; size; matter; affect; woman; ability; orgasm; length; girth; matter; size; fit; depends; woman,-1
ngeheh,Exciting-Response-19,thought; translation; please,,-1
nge6tt,pisssssssssssxyz,trope; jealous; vibrator; come; lack; masculinity; woman; porn; caused; lack; femininity; inability; compete,,-1
ngdd8g,Danielcraigboston1,city; best; dating; market; opinion,,-1
ngb0o5,CharlesElliotFiddler,good; taste; harder; find; good; taste; woman,conviction; came; across; earlier; week; woman; taste; often; disappoints; taste; woman; disappoints; frustrated; relationship; age; concession; make; hence; many; woman; going; ugly; rarely; unmanly; ugliness; something; sluggish; indecisive; alcoholic; frugal; much; taste; woman; different; however; grows; older; able; meet; woman; youth; whereas; young; woman; order; good; deal; must; find; right; still; young; beautiful; word; reproductive; system; capable; producing; healthy; offspring; flexibility; reproductive; system; essentially; time; make; good; taste; woman; much; common; good; taste; time; choose; whereas; woman; find; best; option; limited; number; year; woman; tend; choose; older; young; tend; sexually; frustrated; likewise; reason; woman; often; seek; mold; change; partner; like; wish; ideal; word; better; find; defect; help; defect; continue; searching; prince; charming; mean; demand; require; understandable; probably; seen; among; friend; society; relationship; woman; many; destitute; lonely; woman; nursing; home; child; demand; fall; responsible; honorable; weak; relationship; break; woman; left; fend; world; come; across; young; woman; party; cafe; tell; breakup; past; boyfriend; sympathize; pity; taste; ultimately; conclusion; really; help; pity; hand; easier; take; time; much; youth; frustrated; often; urge; self; stimulation; worker; relation; uglier; thicker; girl; young; might; share; apartment; repels; young; woman; would; much; rather; spend; time; rather; join; force; young; loose; unpredictable; young; persistent; know; take; care; find; future; advantage,-1
ngau2e,Spread-Em-Plz,way; would; differentiate; someone; liking; someone; truly; attracted,talking; behavior; toward; talking; simple; pattern; subtlety; exhibit; display; true; attraction; arousal; example; biggest; laughter; especially; noticeable; instance; something; would; otherwise; annoy; bother; people; funny; small; mistake; stumble; make; considered; funny; winning; literally; everything; funny; behavior; normally; condemn; people; become; funny; noticed; often; applies; giggle; laugh; least; girl; really; attracted; nothing; mentioned; aove; believe; idea; funny; guy; attractive; attractive; guy; found; funnier; halo; effect; truth; course; make; woman; laugh; attracted; likely; made; laugh; attractive; guy; pattern; thing; either; gender; without; realizing; really; attracted; someone; realized,-1
ng9j9r,OddAlternatives,spend; money; girl; slept; minimal; exception,iwhy; spend; toward; outcome; sleeping; girl; current; year; odds; slept; know; point; nothing; going; slept; girl; worried; missing; might; hooker; least; guaranteed; hotter; girl; hand; matter; principle; first; round; beer; seems; approach; might; argue; difference; difference; make; gesture; exist; hotter; opinion; least; arousal; dating; looking; relationship; want; know; break; want; egalitarian; relationship; obviously; person; especially; slept; want; traditional; relationship; current; year; good; luck; buddy; choice; concluded; exist; mean; think; exist; certainly; going; find; going; dutch; accept; might; play; without; paying; going; make; peace; every; step; guy; might; play; without; committing; tradition; indeed,-1
ng95jx,OddAlternatives,much; spend; girl; slept,spend; toward; outcome; sleeping; girl; current; year; odds; slept; know; point; nothing; going; slept; girl; worried; missing; might; hooker; least; guaranteed; hotter; girl; hand; matter; principle; first; round; beer; seems; approach; might; argue; difference; difference; make; gesture; exist; hotter; opinion; least; arousal; dating; looking; want; know; break; want; egalitarian; relationship; obviously; person; especially; slept; want; traditional; relationship; current; year; good; luck; buddy; choice; concluded; exist; mean; think; exist; certainly; going; find; going; dutch; accept; might; play; without; paying; going; make; peace; every; step; guy; might; play; without; committing; tradition; indeed,-1
ng8lgc,critical_of_dating,thing; like; height; matter; entire; community; around; thing,lot; attached; earlobe; opposed; unattached; earlobe; necessarily; number; short; tall; characteristic; common; enough; among; human; find; single; community; complaining; attached; earlobe; preventing; attracting; woman; needle; plenty; community; around; characteristic; height; canthal; tilt; shape; wrist; thickness; thing; like; height; actually; matter; community; theory; focus; equally; invalid; characteristic; like; earlobe; always; characteristic,-1
ng7zef,catfishchapter,look; personality; charm; matter; whether; want; relationship; without; succeed,,-1
ng6d98,ToesyToeNails,bigoted; reason; woman; turned; bisexual,woman; consider; dating; know; bisexual; heard; reason; every; reason; heard; seems; bigoted; illogical; understand; want; competing; woman; understand; would; competing; anybody; healthy; relationship; like; thought; boyfriend; done; anal; another; bisexual; like; anal; straight; like; anal; female; buttholes; count; fine; boyfriend; dick; another; woman; another; man; matter; importantly; people; wash; dick; logical; erasing; idea; like; bisexuality; exist; remotely; like; could; fuck; woman; make; bigotry; idea; bisexual; feminine; come; hear; feminine; think; metrosexual; exists; sexual; orientation; woman; believe; bisexual; twinks; disgusted; idea; would; thinking; straight; relationship; would; thinking; partner; past; life; unhealthy; reason; reason; homophobic; drenched; bigotry,-1
ng594z,poppy_blu,talk; arranged; marriage,always; curious; topic; concept; seems; unimaginable; born; bred; american; think; fair; divorce; rate; might; exactly; winning; either; friend; childhood; arranged; marriage; indian; married; family; friend; kind; grew; together; understanding; wanted; marry; opposed; situation; stranger; seen; much; outside; facebook; since; childhood; understand; still; together; still; happy; arranged; marriage; come; culture; common; love; hear; perspective; work; marry; think; practice; benefit; drawback; compare; view; western; view; marriage; love; others; answer; question; really; interested; hearing; people; experienced,-1
ng4scu,HighValueMoidxD,make; deal; casual,,-1
nb9q90,Amazing_Consequence,percentage; population; truly; want; couple; many; maintain; happy; marriage; plus; year,envision; ever; truly; coupling; love; child; freedom; love; alone; happiest; life; percentage; population; want; alone; really; think; woman; many; stay; relationship; would; truly; happier; alone; think; le; population; maintain; truly; happy; marriage; year; maybe; natural; state; human; alone; unhappy; trying; happily; coupled; natural; state; people; unicorn; maintain,-1
nb7da8,latinxnosirve,rpw; good; point; preserve; overall; femininity; rest; message; work; everyone; advertised; truthful,,-1
nb6rjl,AdditionalEconomist1,chronic; singleness; millenial; generation,,-1
nb6ebz,old_wise_man_,best; place; approach; woman; know,,-1
nb4w88,AFOQTNewbie,world; phenomenon; consequence,often; discussed; online; general; generally; harder; time; finding; sexual; partner; compared; woman; people; extremely; high; level; analysis; uncover; struggle; immensely; dating; think; found; answer; world; phenomenon; many; year; struggled; intimacy; early; lost; virginity; prostitute; shortly; next; year; different; girlfriend; handful; shorter; term; relationship; know; discovered; exists; mutual; level; attraction; dating; get; significantly; easier; remember; used; spend; literal; hour; looking; pill; blue; pill; whatever; pill; content; approach; woman; cliche; confidence; humor; going; necessarily; wrong; ignores; fundamental; important; question; mutual; attraction; matter; good; looking; think; funny; confident; smart; athletic; woman; find; attractive; relationship; experience; rage; self; pity; think; alot; mean; alot; learn; fundamental; advice; getting; intimate; partner; necessarily; skill; like; learning; play; soccer; playing; chess; gradually; better; learn; better; communicator; mutual; attraction; always; triumph; take; care; confident; goal; oriented; woman; fancy; rejected; understand; simply; attracted; fault; rather; simple; result; biology; assume; failed; assume; work; hard; best; clich; comical; think; sound; reading; truth; help; psychologically; avoid; negative; emotion,-1
nb4eg4,mrpropane,follow; actual; kissless; virgin; unaware; smv; something,story; go; like; made; post; reddit; dating; advice; comment; hope; lost; guy; year; kissless; week; detailing; relative; success; year; loneful; life; somehow; ended; picking; steam; someone; kind; enough; ride; story; make; post; reddit; purplepilldebate; comment; kissless; virgin; try; online; dating; thanks; whoever; know; first; idea; sheer; size; shitstorm; going; cause; versed; specific; magnitude; type; problem; guy; faced; online; dating; stupid; enough; post; photo; imgur; mdaovsk; height; point; onwards; become; debate; whether; ugly; attractive; consensus; crazy; unbelieavable; reading; comment; discussing; face; jeez; guy; offended; success; give; voice; private; message; kind; word; imgur; mdaovsk; woman; giving; relationship; advice; sure; imgur; owtcww; mostly; desperate; hopeless; real; bros; imgur; xgjox; want; apologize; anyone; might; felt; negatively; post; never; meant; bragging; lack; experience; something; could; share; anyone; answer; debating; whether; autistic; whatever; gist; story; basically; social; anxiety; degree; ever; since; little; think; powered; mostly; tiring; meet; people; show; actual; self; others; anxiety; adhd; recently; diagnosed; slowly; drop; elite; student; status; dropping; different; university; course; anxious; basically; zero; self; esteem; degree; completed; nothing; supposed; jump; easily; woman; never; shown; interest; handful; time; remember; formative; year; classmate; came; idea; relationship; definitely; mind; simply; something; felt; capable; never; truly; flirted; girl; count; hand; number; time; club; girl; around; face; started; look; le; like; little; started; working; lost; weight; filled; massive; frame; actual; meat; definitely; helped; mentioned; original; post; putting; motivated; meeting; girl; work; fancied; approach; partly; true; wedding; went; around; teenager; girl; decided; take; virginity; night; basically; offered; couple; drink; flirted; shamelessly; literally; virgin; point; surely; tell; much; take; offer; plus; questionable; legal; live; come; night; feeljng; actually; attract; woman; boost; needed; install; tinder; yeah; major; issue; life; never; truly; tried; white; nothing; live; country; white; people,-1
nb3p2v,audis1e2,black; woman; built; hypersexual,,-1
nb2bvv,hesipullupjimbo445,feminizing; going; hurt; feminized; woman,past; year; push; break; society; gender; role; becoming; feminine; started; millennials; taken; height; growing; obsession; boy; femboys; guy; aesthetic; would; fine; done; truly; unselfish; good; faith; actual; benefit; society; unfortunately; selfish; consider; potential; consequence; hear; woman; talk; feminine; never; relationship; sense; usually; make; life; easier; woman; basis; thought; easier; reject; make; better; friend; line; politically; witnessed; take; rejection; better; masculine; worse; time; make; good; friend; revert; back; masculine; role; platonic; friendship; political; aspect; true; bipartisan; many; choice; many; view; purely; friend; problem; masculine; stepping; marrying; would; perfectly; fine; negative; societal; standpoint; however; case; cost; living; rising; marriage; rate; dropping; woman; getting; married; make; enough; live; comfortably; retirement; despite; many; modern; woman; problem; masculine; providing; allows; sahm; realistic; people; worst; thing; could; society; sending; mixed; signal; young; impressionable; true; especially; people; pushing; message; interest; marrying; think; feminizing; good; thing; think; feminized; affect; think; society; coming; year,-1
nb29uj,Prestigious698,lady; would; okay; dating; year; since; hottest; stability,,-1
nb1xd6,annabeelongx,lady; would; okay; dating; year; since; hottest; stability,like; reach; peak; since; earnings; potential; highest; want; know; many; girl; would; interested; settling; stability; never; worry; bill; twenty; somethings; marrying; since; seems; like; could; waking; seem; interested; settling; partner,-1
nazyg1,yareyaredespacito3,mgtow; without; woman; hate,,-1
nazfr3,Unteryn,subject; masculine; feminine; polarity,thread; polarity; strong; dominant; woman; smile; submissive; cook; think; people; life; job; biological; component; hello; testosterone; time; real; world; divided; powerful; yang; smiling; giggling; classically; feminine; profession; still; require; strength; physicality; nurse; care; assistant; need; strength; lift; people; help; bed; help; perform; rehab; exercise; often; lift; assist; overweight; obese; patient; obviously; requires; strength; mothering; requires; strength; weak; unfit; going; handle; lifting; small; child; around; pushing; around; pram; conversely; father; really; feminine; give; comfort; give; advice,-1
naz49z,PrisonedMuffin,pettiest; reason; someone; refused; date,,-1
nayhsc,PrisonedMuffin,prettiest; reason; someone; refused; date,,-1
nay7xh,annabeelongx,radical; vehemently; mannered; toward; woman,notice; radical; please; come; comment; saying; generalizing; know; anyway; broadcasting; redpill; channel; recently; always; curious; person; nature; matter; relate; issue; seeing; discriminatory; behavior; pill; especially; young; toward; woman; anything; lean; favor; heck; married; care; date; woman; thinking; post; wall; calling; year; old; youtube; channel; grandma; really; going; help; anything; live; stream; woman; try; talking; asking; simple; question; comment; quick; deflate; talking; point; saying; wall; date; woman; rather; addressing; talking; point; direction; manosphere; going; going; inflate; ego; dismiss; anything; woman; nearing; wall,-1
naxl3u,lowstatusangrymale,people; experience; good; thing; relationship; progress; always; come; loss; attraction,,-1
nawt4b,redback-spider,thought; prageru; podcast,youtube; watch; iwji; youtube; watch; iwji; seem; pretty; geniuine; would; question; somebody; getting; paid; right; wing; millionares; would; neutral; sure; format; left; clearly; horrible; compared; seems; pretty; open; chilled; notice; naivity; ignorant; viewpoint; start; thing; imposter; symptom; hard; understand; twitch; streamer; seem; people; much; success; night; told; child; maybe; drama; learned; good; enough; suddenly; super; succesful; people; love; much; believe; maybe; except; maybe; believe; school; easy; somebody; missed; suck; something; self; picture; along; response; give; problem; anything; patriarchy; matriarchy; whatever; system; think; would; change; anything; seems; patriarchy; argument; opressed; woman; made; feel; unworthy; something; would; cause; imposter; symptom; would; many; make; sense; woke; garbage; positive; statement; great; live; amerika; true; ignore; willfullingling; foreign; policy; sure; trump; said; negative; thing; irak; bombed; american; including; republican; want; le; war; republican; politicans; make; happen; either; believe; republican; politics; better; look; identity; politics; would; argue; correct; politics; identity; politics; beeing; slightly; better; party; horrible; party; make; good; many; american; live; good; live; live; expectency; west; unique; suicide; rate; belive; identity; stuff; look; western; country; healthcare; system; metric; better; like; nobody; doctor; fear; bill; europe; normal; sure; dems; fixed; saying; party; suck; excuse; trans; issue; group; people; first; trans; people; belive; binary; feel; belong; reality; seen; brainscan; data; seem; intersex; people; conservative; issue; aknoladging; fact; intersex; people; exist; case; often; female; brain; male; body; perfectly; explainable; biology; believe; construct; opposite; believe; strongly; understand; rare; poor; person; screwed; nature; baby; born; deadly; illness; still; pretty; ruff; situation; many; people; still; call; transphob; truescum; thing; like; position; hate; people; might; otherwise; political; alias; classical; transsexual; would; problem; title; queen; king; would; want; change; become; queen; born; male; maybe; rare; case; become; king; born; female; would; huge; exception; people; gender; dysphoria; rare; trans; people; includes; binary; people; transtrenders; woman; would; probably; bulemic; themself; past; breast; like; scared; puberty; like; positive; feedback; social; medium; trans,-1
navm1w,MisterJose,made; pill; allowed; experience; like; mood; mindset; high; testosterone,,-1
nauot0,PrisonedMuffin,reach; still; inexperienced; virgin; chance; opportunity; woman; honest; inexperience,often; guy; situation; told; inexperience; woman; really; utterly; inexperienced; certain; think; lower; risk; bolting; honest; inexperience; point; would; feel; dating; told; point; kissless; virgin; literally; first; girlfriend; told; info; hand; would; gotten; relationship; question; looking; relationship; rather; looking; something; casual; lose,-1
nau897,Fluid_state420,huge; influx; energy; vamp; reddit; community,,-1
nat2yy,woxmei,often; woman; feel; pain,read; many; time; online; woman; experience; pain; sometimes; next; true; never; girlfriend; tell; however; possible; nice; trying; hurt; feeling; discourage; usually; gentle; slow; motion; make; impact,-1
nass38,Apprehensive_Boat_70,woman; dont; respect; easy; guy; neither,,-1
nari76,mightfloat,woman; ever; successfully; found; kept; strategy,,-1
narhll,JoeExplainsBadly,girl; different; paying; prostitute,,-1
nar0fm,AnimeCiety,ratio; young; woman; increasing; census,preliminary; result; census; released; term; national; population; count; although; fully; state; state; breakdown; know; male; female; headcount; ratio; changing; nation; following; full; table; break; trend; seeing; impact; dating; market; woman; specific; datasets; provided; census; please; source; census; program; survey; popest; technical; documentation; research; evaluation; estimate; evaluation; estimate; national; detail; html; female; male; female; male; diff; diff; grand; total; age; within; year; population; woman; age; grown; thousand; million; increase; roughly; look; age; population; grown; almost; double; realistically; age; competing; woman; range; mean; million; competing; million; woman; competing; woman; particularly; true; western; online; dating; older; indeed; direct; communication; younger; woman; vice; versa; concerning; unhealthy; trend; seen; census; continued; exist; young; young; woman; although; reason; fully; clear; possibility; include; favoritism; son; parent; stop; trying; child; particularly; family; son; however; parent; push; continue; trying; first; daughter; born; certainly; bias; exists; asian; hemisphere; largest; growing; minority; united; state; asian; immigrant; pewresearch; fact; tank; asian; american; fastest; growing; racial; ethnic; group; illegal; immigration; demographic; whether; south; central; america; asia; immigrant; show; willingness; relocate; male; child; quite; common; smuggler; border; patrol; agent; alike; sexually; assault; female; migrant; nytimes; border; rape; migrant; woman; html; according; study; done; roughly; central; american; female; migrant; raped; route; huffpost; entry; central; america; migrant; rape; wait; later; year; find; racial; breakout; trend; regardless; specific; reason; racial; socioeconomic; split; think; agree; unhealthy; ratio; group; problematic; society; know; china; india; many; result; trafficking; violence; woman; world; report; country; chapter; global; thing; look; like; going; forward; covid; pandemic; homelessness; rise; endhomelessness; report; show; rise; homelessness; advance; covid; crisis; obviously; increase; crime; crime; rate; rise; index; html; hypothesis; covid; lock; down; fully; dismantled; across; nation; crime; rate; drop; slightly; previous; low; idle; without; female; companion; indicator; would; perhaps; watch; sexual; assault; rate; work; usage; within; next; year; main; takeaway; straight; continue; compete; much; harder; woman; recently; coming; year; thought,-1
naqosf,Artistic_Guest4386,chance; somebody; higher; smv,,-1
naqluv,LillthOfBabylon,people; marry; wall; idea; marry; young; prime,,-1
napp2k,Bleatoflambs,care; woman; beta; buxxing; getting; dick; sucked; everyday,,-1
nap1k5,MainFinal,place; pointless,,-1
nao6v7,LillthOfBabylon,bother; people; western; woman; settle; prime; married,,-1
nal2ci,NeedShakespeareHelp,count; remotely; relevant; high; value; woman; seems; insane; since; issue; attractive; woman; many; people; happens; slept; past,,-1
najdto,brilliant22,current; dating; problem,problem; encountering; dating; life; talking; specific; problem; specific; relationship; specific; person; rather; generally; within; entire; dating; life; problem; compare; typical; problem; discussed; regarding; gender; whole; example; quality; partner; poor; communication; either; side; lack; time; relationship; feeling; unhappy; relationship,-1
nahoys,wardude125,thing; vagina; envy,lurking; mostly; self; aware; action; male; sure; curb; behaviour; could; harmful; woman; might; interested; future; help; understand; better; anyway; reading; reddit; post; reddit; femaledatingstrategy; comment; declaring; right; woman; specific; share; source; embed; content; body; medium; post; embed; name; source; embedly; term; discus; woman; oppressed; society; never; talk; sexual; preference; time; open; saying; proverb; size; matter; harmful; woman; like; dare; woman; free; express; opinion; bwahhhhh; epiphany; last; time; woman; measured; vagina; ruler; like; penis; like; inward; instead; outward; woman; ever; looked; person; changing; behind; locker; next; went; damn; stacey; inch; crevice; sarcasm; seriously; though; interesting; think; guess; could; argue; boob; hip; equivalent; penis; size; woman; post; say; hip; breast; impact; male; ability; penis; woman; equivalent; logic; would; genitalia; dunno; think; thought; know; post; month; website; work; front; page; sorry; someone; brought,-1
nahcz2,PrisonedMuffin,matter; never; find; love; accept,follow; thread; reddit; purplepilldebate; comment; nadf; late; guy; never; attractive; woman; maybe; short; deformity; subpar; look; maybe; spectrum; able; make; single; friend; matter; hard; maybe; submissive; feminine; capable; becoming; manly; dominant; kind; personality; woman; like; people; look; face; guy; probably; alone; never; single; girlfriend; never; experiencing; first; kiss; never; falling; love; dying; virgin; unless; paying; hooker; many; guy; effort; bettering; whether; career; social; life; every; time; come; woman; matter; gargoyle; severe; case; friend; rather; fret; look; way; enrich; life; outside; romance; people; really; someone; everyone; especially; ring; true; matter; many; tear; shed; nothing; change; save; give; enough; shit,-1
nag96j,PrisonedMuffin,woman; planet; actually; like; overweight; dude; dude; relationship; another; woman; settled; killed; bedroom; getting,woman; reddit; claiming; love; chubby; guy; bod; whatever; know; bullshit; woman; actually; prefer; surprise; lean; muscular; washingtonpost; news; speaking; science; woman; rate; strongest; attractive; study; find; reason; male; symbol; tall; lean; washboard; reason; henry; cavill; symbol; jonah; hill; james; corden; reason; many; protagonist; medium; lean; ripped; dude; girlfriend; wife; either; settled; later; killed; attraction; towards; killed; bedroom; cash; gold; digger; either; virgin; none; woman; find; attractive; actually; love; includes; woman; male; partner; woman; planet; find; people; attracted; guy; bear; woman; still; attractive; enough; sizable; amount; never; option; going; nowhere; life; girl,-1
