post_id,author,title,body,image
n8aoau,questionasker012,manosphere; ignore; existence; childfree; people; demonize; woman; want; kid,regarding; first; point; manosphere; ignore; existence; childfree; woman; talk; need; settle; still; fertile; ignore; existence; childfree; paint; adult; wanting; child; course; nothing; wrong; wanting; child; perhaps; woman; many; still; want; settle; life; partner; regarding; second; point; start; stipulating; nothing; inherently; wrong; wanting; biological; child; wanting; pregnant; wanting; experience; partner; getting; pregnant; however; manosphere; seems; beyond; reminding; woman; want; child; mind; fertility; window; often; demonizes; woman; kid; never; mind; fact; woman; might; childfree; perfectly; happy; life; unfolding; without; baby; making; manosphere; seems; vendetta; childfree; woman; mystified; seems; doublestandard; standard; vendetta; childfree; think; pill; affiliated; religion; attitude; reminiscent; certain; denomination; idea; purpose; procreation; purpose; woman; listened; certain; pill; creator; outright; woman; lose; look; probably; completely; significant; extent; borne; child; course; losing; look; definitely; worst; could; happen; result; pregnancy; childbirth; risk; death; litany; temporary; permanent; health; complication; manosphere; blatant; disregard; impact; reproduction; female; body; reason; regard; community; toxic; sociopathic; discourse; surrounding; reproduction; role; woman; play; reveals; manosphere; woman; doll; mere; vessel; baby; make; matter; worse; manosphere; value; beauty; highly; woman; push; undergo; something; explicitly; state; make; le; attractive; would; feel; partner; pressuring; something; would; take; thing; liked; thing; desire; seek; partner; journey; biological; kid; another; woman; whole; good; incubating; baby; know; particular; woman; want; woman; might; want; birth; five; baby; lifetime; woman; might; want; adopt; foster; child; know; enough; human; planet; already; another; might; happily; childfree; perhaps; pill; content; specifically; geared; toward; woman; want; breed; take; issue; fact; creator; front; honestly; think; project; lifestyle; onto; everyone; observation; absolutely; seem; think; woman; want; make; baby; childfree; people; want; settle; long; term; partner; point; relationship; baby; making; wanting; make; baby; mean; value; committed; relationship; pillers; aside; incompatible; qualify; moral; failing; want; procreate; something; wrong; woman; childfree; adopting; child; otherwise; procreating,-1
n8afrl,maybeathrowaway85,post; like; boohoo; economic; crash; relationship; fall; apart; hold; little; truth; woman; still; date; based; look,attractive; hvm; cashier; easily; date; ugly; office; owner; little; truth; economy; dating; post; though; woman; look; financial; stability; long; term; relationship; easily; number; actual; long; term; relationship; whose; objective; create; family; fall; much; casual; attractive; still; casual; unattractive; little; money; change; anything,-1
n8aerg,maybeathrowaway85,post; like; boohoo; economic; crash; relationship; fall; apart; hold; little; truth; woman; still; date; based; look,attractive; hvm; cashier; easily; date; ugly; office; owner; little; truth; economy; dating; post; though; woman; look; financial; stability; long; term; relationship; easily; number; actual; long; term; relationship; whose; objective; create; family; fall; much; casual; attractive; still; casual; unattractive; little; money; change; anything,-1
n8aed5,maybeathrowaway85,post; like; boohoo; economic; crash; relationship; fall; apart; hold; little; truth; woman; still; date; based; look,attractive; hvm; cashier; easily; date; ugly; office; owner; little; truth; economy; dating; post; though; woman; look; financial; stability; long; term; relationship; easily; number; actual; long; term; relationship; whose; objective; create; family; fall; much; casual; attractive; still; casual; unattractive; little; money; change; anything,-1
n8acli,maybeathrowaway85,post; like; boohoo; economic; crash; relationship; fall; apart; stupid; woman; still; date; based; look,,-1
n8aaxe,maybeathrowaway85,woman; still; choose; partner; based; look; boohoo; economic; crash; people; going; stay; alone; post; stupid,,-1
n87osn,friendlyfun147,number; single; older; going; increase; implication,noticed; change; term; attractive; guy; older; staying; single; hvm; definitely; thing; past; decade; single; childless; hvm; around; bachelor; longer; loser; cheeto; stain; shirt; going; cause; increase; woman; baby; trapping; hvm; commit,-1
n82gwh,TheOffice_Account,woman; realize; cautious; potential; future; disloyalty,,-1
n825xi,doggogirl20009,attractive; enough; attract; hvm,,-1
n80v53,rapidSpinningTurtle,serious; right; comment; reply; tool; help; seek; understanding,disclaimer; pill; theory; dating; strategy; matter; related; underlying; grievance; expressed; felt; uncomfortable; reading; post; read; similar; perspective; think; important; limited; topic; alone; replace; post; generally; shocking; think; still; apply; varying; degree; male; first; time; browsed; content; felt; overly; harsh; high; lv; value; saying; divorce; anyone; stop; like; second; dismissing; reaction; misogyny; flipside; seen; post; talk; abuse; boundary; settling; emotional; unavailability; genuinely; useful; advice; woman; often; taken; advantage; caring; resource; posted; help; establish; confidence; need; stay; away; treat; like; lowest; priority; tool; help; anyone; want; understand; empathy; answer; easy; empathy; guarantee; answer; present; chance; mentally; explore; life; outside; empathy; take; time; removal; ego; consider; background; feel; way; look; desired; need; behind; message; woman; described; feeling; betrayal; failed; male; friendship; guy; revealed; nothing; potential; sexual; prize; came; time; friend; zoned; mentioned; awful; felt; compared; food; used; car; free; object; belonging; street; instead; regarded; complex; individual; varying; sexual; history; told; tolerate; excuse; neglectful; behavior; partner; girl; lamented; raised; rigid; expectation; conditioned; accept; unfulfillment; need; left; emotionally; abused; begging; mere; crumb; love; manipulator; remembering; social; cruelty; targeted; weight; told; happen; effortlessly; want; controversial; thread; hundred; debate; within; whether; experience; legitimate; worth; consideration; preemptively; addressing; potential; misinterpretation; seem; eager; argue; misunderstand; listen; recovering; people; pleaser; quote; content; related; appreciated; sure; content; many; would; feel; similarly; used; discarded; cheated; female; dating; strategy; surface; really; human; experience; underneath; layer; sure; case; initially; shocking; group; sub; though; encouraging; endure; abuse; excuse; toxic; behavior; follow; thing; brought; need; anything; post; defense; anything; purpose; persuade; argue; answer; applies; thing; beyond; like; empathize; want; understand; someone; think; absorb; thought; experience; relay; curious; understand; shock; value; feel; good; read; mean; generalization; identity; personally; toxic; comment; post; made; reaffirm; dislike; gender; constructive; recommend; approaching; question; differently; used; instead; asking; user; like; person; seem; strong; opinion; upset; post; rhetoric; read; view; asking; toxic; tends; attract; answer; level; depth; tooafraidtoask; poster; wanted; understand; genuine; empathetically; exploring; help; seek; answer; equation; block; chance; obtaining; clarity; human; experience,-1
n803xv,Correct_Leek_1875,truth; must; told; lady,,-1
n7zy7q,rich_man_88,would; okay; government; took; measure; male; sexlessness,,-1
n7xliy,12inchbamboo,woman; want; something; serious; want; nothing; serious,going; redpillwomen; askwomenabove; tinder; sub; noticed; woman; tend; want; serious; relationship; leading; marriage; seek; nothing; serious; short; fling; reasoning; shit; together; girl; dating; older; shit; together; time; go; education; purchase; house; become; financially; stable; generally; shit; together; start; attracting; woman; getting; laid; confidence; come; back; need; commitment; since; getting; laid; thus; short; fling; woman; side; start; higher; smv; time; becomes; enemy; rush; limited; reproduction; time; seeking; commitment; somebody; shit; together; mate; short; fling; think,-1
n7wog4,Tavarshio,people; tell; woman; smile,legitimately; serious; question; young; many; people; including; adult; woman; would; needed; smile; mean; pretty; face; need; smile; neutral; look; fine; everybody; gory; detail; bizarre; social; custom,-1
n7whya,Fluid_state420,woman; understood; going; asleep; sexiest; feeling; planet; feel; like; would; different,best; world; woken; girl; whether; hookup; dating; wife; wake; inside; feel; awesome; said; guy; understood; importance; using; massage; type; foreplay; partial; rant; absurd; many; woman; realize; guy; loovee; make; feel; desired; really; stroke; ego; people; understand; important; make; woman; physically; comfortable; warm; whole; body; prior; woman; understand; starting; desire; work; like; magic,-1
n7w8la,PeskyHijinks,many; complaining; woman; pretty; makeup; society; much; emphasis; beauty; need; maintain,,-1
n7syt6,rich_man_88,think; wear; pajama,,-1
n7pv8f,NeedShakespeareHelp,term; pillospherian; perspective; made; trend; older; people; getting; divorced,,-1
n7ouq0,annabeelongx,manosphere; inflating; young; future; capability,,-1
n7msla,DatingVX,better; going; back; traditional; role; already; nail,,-1
n7lfhy,RocketToTheMoonlight,would; incel; treat; woman; respect,,-1
n7h2h2,russill,relationship; religiousness; identity; conflict,,-1
n7ejq5,KurkTheMagnificent,woman; want; equal; prefer; date; make,washingtonexaminer; opinion; woman; earning; bigger; problem; think; washingtonexaminer; opinion; woman; earning; bigger; problem; think; think; moral; story; guy; want; competitive; stay; salaried; employee; longer; necessary; entrepreneur; self; employed; comparable; stand; best; chance; earning; woman; given; unique; position; beta; longer; competitive; sm; marketplace; least; competing; younger; choosier; woman; earn; woman; done; workplace; anymore; mostly,-1
n7dssz,yayayubsea,hello; perhaps; alike; tattoo; bother; bother; make; woman; le; undesirable,,-1
n7d2io,LandonDonavan,question; prejudice; fine; dating,subreddit; seen; time; time; people; said; white; automatic; advantage; dating; market; true; white; massive; advantage; come; dating; ethic; woman; black; woman; much; could; said; white; woman; dark; skinned; friend; mine; would; date; white; light; skinned; woman; think; widly; knone; fact; racial; prejudice; come; dating; question; society; change; remain; personally; think; fine; thought; mentioned; pointed; white; people; advantage; dating; market; fall; category; preference; general; woman; like; tall; blue; eye; white; muscular; preference; dating; unlike; seeking; court; someone; find; skin; tone; unfavorable; could; might; perfectly; qualified; worst; prison; dating; apart; feeling; hurt; thinking; bitch; racist; much; could; change; mind; people; like; complain; mostly; black; dark; skinned; dating; market; inherently; unfair; black; male; personally; attest; discovered; complaining; like; screaming; abyss; completely; meaningless; people; world; unearned; advantage; skin; color,-1
n7cvvh,LandonDonavan,racial; prejudice; fine; dating,subreddit; seen; time; time; people; said; white; automatic; advantage; dating; market; true; white; massive; advantage; come; dating; ethic; woman; black; woman; much; could; said; white; woman; dark; skinned; friend; mine; would; date; white; light; skinned; woman; think; widly; knone; fact; racial; prejudice; come; dating; question; society; change; remain; personally; think; fine; thought; mentioned; pointed; white; people; advantage; dating; market; fall; category; preference; general; woman; like; tall; blue; eye; white; muscular; preference; dating; unlike; seeking; court; someone; find; skin; tone; unfavorable; could; might; perfectly; qualified; worst; prison; dating; apart; feeling; hurt; thinking; bitch; racist; much; could; change; mind; people; like; complain; mostly; black; dark; skinned; dating; market; inherently; unfair; black; male; personally; attest; discovered; complaining; like; screaming; abyss; completely; meaningless; people; world; unearned; advantage; skin; color,-1
n7clqj,bruhovich8908,harder; attractive; woman; attractive; thus; make; dating; challenging,,-1
n7bf87,umnothnxbye,woman; offer,okay; keep; seeing; thread; asking; woman; marry; bring; table; since; think; safe; assume; seeking; marriage; would; prefer; casual; figured; sleep; stand; gain; upping; count; getting; pumped; dumped,-1
n7b6jj,questionasker012,relationship; business; transaction,judging; post; happen; written; primarily; seems; people; regard; relationship; transaction; purchase; looking; partner; whether; fling; akin; shopping; think; phrase; smv; market; value; exemplifies; much; many; view; relationship; transaction; flack; strategy; explicitly; designed; weedout; view; relationship; transaction; thereby; increase; chance; finding; partner; love; special; unique; irreplaceable; connection; share; seems; misunderstanding; twist; arm; paying; date; providing; way; monolith; thought; someone; spends; time; safely; want; anything; convinced; nice; thing; healthy; relationship; want; begrudgingly; pleasing; want; eager; willing; demonstration; affection; care; nothing; record; straight; rather; stay; single; facilitate; desire; contrast; never; think; term; smv; regarding; automatically; higher; value; good; money; look; moreover; like; product; shelf; people; unique; connect; unexpected; way; various; quirk; unique; personality; trait,-1
n7airq,5HT2AC,maybe; good; test; whether; beta; insist; butt,,-1
n7a6i8,Sudden-Double,girl; block; button; often,girl; want; send; rejection; text; maybe; went; couple; date; send; rejection; text; block; number; done; noticed; guy; prefer; ghost; ghosting; easier; le; effort; sometimes; wonder; keep; option; girl; done; block; number; block; social; medium; thing; guy; ghost; gladly; keep; girl; social; medium; watch; instagram; story; guy; ghost; eventually; block; social; medium; find; strange; rather; look; instagram; story; actually; text; honest; blocked; girl; number; social; medium; block; done; always; block; want; back; life; blocking; still; keep; door; open,-1
n79anj,SPHJOI,female; nature,,-1
n78ddy,Abject_Illustrator_3,many; want; child; marriage; marriage; kid,,-1
n771xe,Aldabruzzo,offer; like; dating; offer; marriage; suit; prepares; marriage,different; bring; table; question; dating; like; think; like; offer; particular; think; make; want; marry; pick; marriage; broader; question; trait; characteristic; skill; skill; set; suit; general; marriage; thing; experience; done; cultivated; given; prepare; marriage; general; please; give; direct; straightforward; good; faith; responsive; answer; please; thing; like; sheesh; another; sell; marriage; post; woman; sleeping; around; dont; marry; care; marry; want; asking; anyone; sell; marriage; suggesting; woman; prove; marriageworthiness; asking; woman; tell; married; married; simple; straightforward; question; woman; want; know; specifically; think; offer; like; love; marriage; want; know; specifically; characteristic; skill; suit; prepare; marriage,-1
n75sig,fire_man14,woman; would; rather; share; cheating; alpha; loyal; beta; thought; quote,,-1
n75d4x,jawnzoo,girl; brag; simps,think; weird; many; girl; fan; post; simps; much; sending; couple; hundred; dollar; saying; fave; sent; money; something; along; line; money; girl; basically; nothing; besides; attractive; feel; like; accomplishment; good; someone; explain; normalized; maybe; fetish; thing,-1
n74ria,Marino4K,financial; stability; become; biggest; obstacle; already; chaotic; dating; market; particularly; young; adult,seen; thread; thread; gender; important; financial; stability; tend; believe; valued; slightly; woman; affirmatively; make; claim; cost; living; relative; everything; continues; skyrocket; housing; rent; cost; continue; rise; childcare; cost; astronomical; continue; many; late; millennials; younger; live; parent; longer; forced; move; back; following; financial; crisis; kind; meanwhile; wage; stagnant; employer; everything; continue; making; record; profit; giving; ceo; ridiculous; bonus; college; debt; trillion; getting; degree; guarantee; good; paying; anymore; keeping; mind; lead; crisis; dating; market; majority; single; today; want; relationship; marriage; could; know; people; value; status; financial; situation; good; standard; dating; compatibility; modern; dating; scene; western; world; general; deeply; judge; solid; financial; footing; whether; fault; matter; whose; fault; relationship; dating; supposed; form; connection; physical; emotional; mean; bank; account; often; dating; someone; financial; vetting; question; plenty; people; become; career; oriented; chase; dollar; sign; people; absorb; mentality; chad; stacys; variety; financial; gender; line; income; based; one; although; line; could; blur; drastically; affect; relationship; world; economy; continues; favor; wealthy; effectively; kill; dating; scene; le; fortunate; especially; financial; stability; continues; priority; among; potential; suitor; tldr; people; increasingly; growing; want; partner; sufficient; financial; stability; world; cost; living; growing; exponentially; drastically; hurt; dating; market; bottom; wage; earner,-1
n74p1s,JohnDoe721,woman; feel; referred; birthing; person,,-1
n72l4i,Aubrey_D_Graham,earn; commitment,,-1
n6zjba,redback-spider,freshandfit; audience; tribalistic; simping; hvm; value,youtube; watch; buuiqxcbcby; youtube; watch; buuiqxcbcby; first; find; strange; dude; say; shit; like; need; love; good; woman; matter; cheater; blue; pilled; course; high; status; millionaere; clout; success; woman; might; find; woman; pretents; wave; length; year; till; cheat; dump; might; want; feeling; love; shit; matter; want; want; maybe; lion; best; friend; bambi; matter; much; want; tiger; kill; bambi; maybe; case; world; exist; billion; people; search; woman; world; absurd; practical; matter; exists; said; guy; garbage; woman; maybe; much; luck; woman; panel; dude; likely; none; make; ridiculous; statement; small; minority; people; podcast; smv; viewer; future; viewer; become; hvm; million; income; super; buffed; super; famous; clout; ideally; watching; podcast; slightly; better; aspect; suddenly; every; single; world; would; millionare; would; normal; looser; base; line; billionaeres; would; considered; high; status; high; status; never; change; binary; thing; gradual; thing; maybe; fucked; modells; already; maybe; care; much; anymore; abundance; known; economical; principle; diminishing; marginal; utility; noticed; beautiful; people; tend; little; seem; invest; time; exercise; make; sure; look; good; much; training; hard; anymore; constantly; tired; whatever; clout; alone; average; course; matter; raised; search; love; think; hole; point; podcast; pill; horrible; mindset; sure; double; speak; always; woman; married; marry; woman; least; want; personaly; everybody; else; knife; still; searching; woman; love; better; unconditional; stupid; blue; pill; talk; recognize; woman; liberal; divorce; law; every; opportunity; feed; hypergamy; tribalistic; everybody; simps; literally; say; nearly; opposite; podcasts; message; grill; allowed; stupidest; shit; without; people; calling; simp; hvm; value; sure; make; putting; blue; pill; pill; podcast,-1
n6zdtm,SherdyRavers,ever; lost; attraction; woman; kept,first; ever; attracted; girl; physically; relationship; found; annoying; boring; around; lost; interest; kept; around; noticed; alot; guy; tend; behave; like; around; wife; friend; tend; joke; middle; aged; work; overtime; hate; around; wife; london; joke; middle; aged; hate; wife; work; overtime; curse; wife; behind; back; obviously; condone; behaviour; yeah; like; know; people,-1
n6z8vs,Marino4K,near; future; people; today; financially; stable; driving; wedge; dating; scene,,-1
n6z7vc,redback-spider,freshandfit; audience; tribalistic; simping; hvm; value,youtube; watch; buuiqxcbcby; youtube; watch; buuiqxcbcby; first; find; strange; dude; say; shit; like; need; love; good; woman; matter; cheater; blue; pilled; course; high; status; millionaere; clout; success; woman; might; find; woman; pretents; wave; length; year; till; cheat; dump; might; want; feeling; love; shit; matter; want; want; maybe; lion; best; friend; bambi; matter; much; want; tiger; kill; bambi; maybe; case; world; exist; billion; people; search; woman; world; absurd; practical; matter; exists; said; guy; garbage; woman; maybe; much; luck; woman; panel; dude; likely; none; make; ridiculous; statement; small; minority; people; podcast; smv; viewer; future; viewer; become; hvm; million; income; super; buffed; super; famous; clout; people; ideally; watching; podcast; slightly; better; aspect; suddenly; every; single; world; would; millionare; would; normal; looser; base; line; billionaeres; would; considered; high; status; high; status; never; change; binary; thing; gradual; thing; maybe; fucked; modells; already; maybe; care; much; anymore; noticed; beautiful; people; tend; little; seem; invest; time; train; make; sure; look; good; much; training; hard; anymore; whatever; clout; alone; average; course; matter; raised; search; love; think; hole; point; podcast; pill; horrible; mindset; sure; double; speak; always; woman; married; marry; woman; least; want; personaly; everybody; else; knife; still; searching; woman; love; better; unconditional; stupid; blue; pill; talk; recognize; woman; liberal; divorce; law; every; opportunity; feed; hypergamy; tribalistic; everybody; simps; literally; say; nearly; opposite; podcasts; message; grill; allowed; stupidest; shit; without; people; calling; simp; hvm; value; sure; make; putting; blue; pill; pill; podcast,-1
n6z1or,MasterTeacher123,woman; often; think; average; get; hint,lady; kinda; spinoff; thread; addressed; guy; often; think; average; woman; approached; simply; often; think; average; get; hint; woman; interested; romantically; get; directed; whatever; believe; average; whatever; look; like; mind; talking; whatever; used; indicate; interest; hint; given; guy; time; dude; basing; compare; handsome; guy; guy; flat; ugly,-1
n6xdv2,keeleios,kissless; virgin; try; online; dating; instant; success; common; unaware; smv,,-1
n6x8m1,Playboycel,looking; young; terrible; ordeal,used; girl; till; left; college; appeal; plummeted; night; first; thing; noticed; getting; le; le; attention; peer; suddenly; started; gravitating; toward; traditionally; masculine; looking; guy; stuck; teenage; face; still; buying; alcohol; though; although; pudgy; baby; face; facial; proportion; young; person; high; cheekbone; narrow; tapered; jawline; grow; beard; neckbeard; college; twinks; finished; last; chubby; balding; dude; fared; better; woman; long; traditionally; masculine; proportion; contrast; high; school; broad; shoulder; topped; nice; hair; strong; chin; vastly; important; feature; like; nice; skin; aesthetic; smile; eyelash; dude; woman; drawn; bone; tall; broad; strong; chin,-1
n6spfi,Jevan_70567,woman; complain; much; pocket,understand; woman; clothes; small; pocket; useful; clothes; wear; clothes; want; make; girl; clothes; pocket; girl; clothes; sure; many; woman; gotten; clothing; business; brand; cater; towards; pocket; stuffing; need; maybe; sound; like; dumb; complaint,-1
n6ql6a,just_a_place,question; woman; want; bring; table; long; term; relationship; possibly; life; commitment; negotiable; weird; question; wish; bring,read; previous; post; asking; woman; bring; table; relationship; thinking; wish; desire; attracted; woman; naturally; want; attract; retain; woman; interest; benevolent; curious; hear; different; woman; expect; bring; negotiation; table; conversation; commitment; would; willing; work; forming; deeper; intimate; bond; interested; kind; trait; woman; would; interested; short; term; fling; long; term; commitment; think; consider; education; income; look; style; property; charisma; maturity; communication; skill; fall; short; standard; would; willing; give; chance; work; living; expectation; assuming; really; want; life; interested; dashing; range; prefer; older; younger; matter; assuming; pay; enough; live; career; working; simple; blue; collar; manual; labor; would; prefer; prefer; teachable; want; already; good; prefer; bring; material; wealth; service; affection; attention; social; higher; rank; combination; one; take; priority; lastly; trait; find; wish; would; want; value,-1
n6pq2n,ThatIntention1,dealbreaker; come; pursuing; relationship; opposite,,-1
ng3eqw,TheCuriousArthropod,concept; masculinity; femininity; reason; woman; life; messed,ignore; basic; biology; like; example; penis; woman; vagina; gender; role; exist; nature; want; cultural; notion; masculinity; femininity; forcing; woman; inside; box; considered; ability; interested; cute; creature; cooking; bright; color; woman; considered; woman; think; logically; interested; science; sport; want; know; happens; woman; ffollow; expectation; lower; life; span; suicidal; developing; anti; social; behavior; health; issue; yeah; healthy; pussy; woman; become; spoiled; harm; themself; anorexia; plastic; surgery; making; irrational; decision; notion; society; would; pragmatic; behave; woman; acquire; true; potential; example; woman; would; become; boudica; hypathia; mary; curie; society; conditionated; shallow; idea; beauty; womanhood; could; develop; healthy; mental; stability; society; taught; meaningful,-1
