post_id,author,title,body,image
n491tk,Infinite_Cycle_7030,long; standing; practice; monogamy; form; sexual; socialism; check; female; hypergamy,,-1
n477cg,Mosagun,often; think; woman; varying; level; attractiveness; approached,clarify; talking; physical; attractiveness; simplicity; sake; group; woman; three; camp; average; average; average; detailed; breakdown; much; appreciated; though; heard; mixed; opinion; specifically; average; looking; woman; particularly; interested; response; concerning; people; average; one; hardly; approached; unappealing; actually; decent; amount; attention; assume; desperate; insecure; turn; people; average; woman; actually; approached; often; assume; rejected; excuse; ugly; woman; trying; justify; lack; attention; average; woman; really; constant; barrage,-1
n46e41,skywater101,woman; biggest; body; shamers; woman,seems; like; every; time; issue; body; shaming; woman; come; always; relation; demonizing; weirdest; thing; throughout; life; seems; woman; harsh; woman; look; think; ever; position; picky; think; really; care; boob; small; boob; like; boob; slim; chubby; concede; outright; obesity; might; le; acceptable; subreddits; body; type; extremely; popular; anything; imagine; would; still; interested; anecdotally; remember; confessing; female; friend; mine; attention; woman; pear; shaped; thick; leg; immediately; pointed; cellulite; leg; cellulite; something; care; le; fashion; model; magazine; many; woman; starve; look; like; always; look; like; aimed; woman; find; classy; tasteful; praise; kendall; jenner; trashing; curvy; sister,-1
n45xog,DamnCoolCow,,sorry,-1
n45qyb,AutoModerator,weekly; community; chat; megathread,weekly; thread; designed; place; funny; discussion; feel; free; post; topic; question; information; point; view; thread; post; everything; think; warrant; thread; socialising; comment; automatically; sorted; post; throughout; week; people; comment; please; join; discord; discord,-1
n43q4e,LukeMoonwalker101,bill; burr; freed; guilt; caring; woman; issue,remember; listening; episode; bill; burr; podcast; recommend; enough; highlighting; clip; show; talk; dick; actually; mutillated; wife; absolutely; horrific; disgusting; story; remember; story; reaction; woman; panel; absolute; raucous; laughter; absolutely; loved; would; absolutely; drive; suicide; never; heard; anything; funnier; much; knew; considered; disposable; watching; clip; really; made; crystal; clear; woman; think; glad; freed; guilt; really; caring; thing; woman; complain; regard; care; close; story; calling; shaming; really; think; clip; remember; happened; woman; would; probably; thrown; head; back; laughed,-1
n43nts,KickKathleeenKennedy,think; decision; fatigue; part; reason; people; struggle; relationship,,-1
n4370b,inprecisewords,modern; relationship; work; lack; violence,,-1
n432x2,Dexo32,stop; viewed; hookup,,-1
n426q8,yungthrowaway97,become; supporter; pill,seems; like; place; angry; insecure; therapy; good; therapist; could; help; resolve; extreme; black; white; thinking; basically; place; look; life; pure; survival; fittest; aspect; lot; theory; seem; kinda; obvious; need; fulfill; checklist; girl; seems; like; would; constantly; lead; insecurity; resentment,-1
n41g9n,ChadThundagaCock,true; woman; know; within; second; whether; would; sleep,,-1
n40o22,CraftyAppearance1551,short; undateable,,-1
n3yhl7,youarockandnothing,sympathy; woman; wish; would; approach; real; life,,-1
n3y3zo,noletterstoday,woman; stranger; danger; fear; unknown; completely; overblown; counterproductive,,-1
n3y13j,noletterstoday,woman; stranger; danger; fear; violence; unknown; completely; overblown,,-1
n3ws7f,flying-gogoplata,superior; generating; wealth; woman; crypto; market; prof,know; business; owned; guidantfinancial; small; business; trend; woman; business; invested; stock; market; fool; research; woman; investing; research; text; survey; global; compared; crypto; finextra; blogposting; woman; reason; crypto; ascension; text; first; quarter; time; grew; crypto; barrier; entry; gender; could; thrown; year; made; bank; could; thrown; month; various; coin; money; retirement; money; lot; great; transfer; wealth; generation; money; born; sucked; guard; woman; install; took; min; throw; little; cash; woman; mining; crypto; like; bunch; college; buddy; killer; woman; like; cathie; wood; lisa; certainly; woman; theoretical; daughter; paying; attention; inspiration; complaining; gender; wage; maybe; woman; look; internally; getters; like; lady; want; better; perhaps; writing; give; wake; call; make; power; move; gunna; make,-1
n3wqqx,xxxtentacioncel,father; objectified; female; forced; call; coach; whipped; beta; early,saying; title; happen; girl; either; long; term; effect; type; parenting; trying; compare; good; fake; niceguys; zero; boundary; double; text; people; hear; people; female; parent; make; whipped; beta; basically; thing; stood; instead; happy; would; rather; proud; like; wanted; beta; made; look; staff; started; social; anxiety; school; caused; extra; whipping; school; bully; unathletic; weak; mindset; like; woman; man; body; trying; impress; prove; shit; whole; time; whipping; raising; burnout; submits; people; pushy; boundary; young; masculine; borderline; looking; back; maxxed; small; physique; mean; natural; primal; presence; always; fair; people; woman; never; come; around; liking; standard; others; treat; early; male; beaten; talented; thing; made; participate; mostly; real; life; reddit; shaming; bull; shit; stop; blaming; parent; grown; adult; independent; mindset; molded; since; diaper; impress; impress; impress; almost; beta; real; life; build; want; answer; want; someone; relates,-1
n3wovw,xxxtentacioncel,father; objectified; female; forced; call; coach; whipped; beta; early,saying; title; happen; girl; either; long; term; effect; type; parenting; trying; compare; good; fake; niceguys; zero; boundary; double; text; people; hear; people; female; parent; make; whipped; beta; basically; thing; stood; instead; happy; would; rather; proud; like; wanted; beta; made; look; staff; started; social; anxiety; school; caused; extra; whipping; school; bully; unathletic; weak; mindset; like; woman; man; body; trying; impress; prove; shit; whole; time; whipping; raising; burnout; submits; people; pushy; boundary; young; masculine; borderline; looking; back; maxxed; small; physique; mean; natural; primal; presence; always; fair; people; woman; never; come; around; liking; standard; others; treat; early; male; beaten; talented; thing; made; participate; mostly; real; life; reddit; shaming; bull; shit; stop; blaming; parent; grown; adult; independent; mindset; molded; since; diaper; impress; impress; impress; almost; beta; real; life; build; want; answer; want; someone; relates,-1
n3vm6q,OrangePilledMan,willing; trade; place; complain; gender; demographic,,-1
n3proq,SPHJOI,female; nature,,-1
n3o6vz,brilliant22,hate; attracted,think; attracted; woman; made; life; difficult; attraction; strong; make; undesirable; change; life; accommodate; attraction; hurt; still; attracted; innate; wish; could; alter; sexuality; enjoy; attracted; either; found; easy; accommodate; attraction; successful; dating; like; thrill; give; life; extra; sole; purpose,-1
n3myad,ohheyhi99,balding; bald; average; height; average; face; approach; dating; practically; philosophically,follow; reddit; purplepilldebate; comment; much; disadvantage; male; pattern; source; share; medium; name; iossmf; size; fit; answer; noticed; thread; balding; bald; populated; answer; know; boyfriend; bald; tall; good; looking; neither; average; answer; linked; include; brutal; honesty; doomer; take; recommendation; added; range; conversation; follow; focused; question; balding; bald; fall; back; tall; good; looking; approach; dating; practically; philosophically,-1
n3lpid,Sufficient-Ad-3586,people; life,happened; girl; three; month; super; nice; girl; crushed; knew; work; cause; moving; state; three; month; flirt; calling; handsome; play; punching; anyways; another; know; always; hanging; joked; asking; putting; ring; finger; girl; flustered; insisted; nothing; going; kind; girl; fast; forward; weekend; going; throw; something; found; condom; trash; found; married; confirmed; sleeping; together; time; avoiding; like; plague; ever; since; anything; curious; people; life; ever; happened,-1
n3lfqk,BananaAlgorithm,childfree; woman; mgtow; female; gender,,-1
n3lcrf,iwannabeastonedhippy,many; people; delusional; looksmatches; come; selecting; mate; marriage,,-1
n3ins7,GunnzzNRoses,revelation; online; dating,smoking; herb; yesterday; colossal; realization; know; woman; laid; whenever; guy; turn; least; know; woman; online; date; obviously; pool; lady; seek; naturally; lady; somehow; nonfunctional; real; life; forced; literally; femcels; obviously; celibate; could; mentality; diagnosis; result; epiphany; alright; alright; least; come; struggle; woman; fucking; weird; worst; lowdown; femcellish; meat; find; weird; explains; woman; ridiculously; nonfunctional; woman; able; find; mate; stay; away,-1
n3img4,SowClips,study; find; likely; rebound; termination; relationship,abstract; serious; romantic; relationship; terminated; partner; faced; convoluted; complex; challenge; detachment; previous; partner; negative; feeling; overall; situation; need; move; forward; life; faced; relational; upheaval; individual; employ; find; relief; superficial; noncommittal; rebound; relationship; mean; coping; loss; previous; relationship; severed; emotional; attachment; partner; studied; empirical; researcher; study; participant; predicted; found; likely; enter; rebound; relationship; aftermath; relational; termination; based; lower; level; social; support; emotional; attachment; partner; displaying; ludus; game; playing; love; style; addition; measure; variable; gender; socialization; parental; investment; theory; provide; support; study; claim; rebound; relationship; employed; distraction; feeling; emotional; attachment; partner; source; support; inherent; ludic; characteristic; mdpi; attachment; socsci; socsci; article; deploy; socsci; study; page; long; interesting; read; find; study; interesting; precisely; seems; contradict; general; notion; woman; likely; enter; relationship; faster; breakup; appears; according; study; case; however; know; study; topic; curious; know; everyone; experience; ever; rebounded; ever; someone; rebound; woman; likely; rebound; experience,-1
n3ia4y,CraftyAppearance1551,career; attractive; woman,,-1
n3hnm3,Cold-Recipe,branch; swinging; likely; intentional; unintentional,intentional; meaning; thought; process; decides; stay; reason; financial; comfort; status; move; onto; next; unintentional; meaning; suddenly; heavily; seduced; swayed; dumping; believe; case; would; within; grey; area; curious; side; closer; intentional; unintentional; depending; experience; observation; asking; noticed; people; portray; make; seem; like; branchswinging; intentional,-1
n3gjda,crossupdp,chubby; proud; hide; body; positivity; let,angle; photo; year; face; selfies; many; woman; online; seem; hide; fact; overweight; time; pushing; narrative; body; positivity; accept; body; positivity; could; gain; extra; inch; height; mjolnir; would; find; worthy; look; like; thor; woman; video; youtu; jkpo; basically; sum; literally; went; woman; day; lighter; stop,-1
n3g0l9,PM-ME-YOUR-STOMACH,disrespectful; expect; jump; hoop; impress; prove,mean; basically; find; disrespectful; expect; whatever; guess; make; distinction; hard; expectation; soft; expectation; hard; expectation; disrespectful; super; traditional; gender; role; nowadays; play; game; spin; plate; successful; would; much; easy; everyone; viewed; person; goal; interest; talking; instead; worrying; saying; text; trying; read; mind; answer; stupid; indirect; question; clown; performing; seal; game; soft; expectation; really; manner; pleasant; okay; difference; wanting; first; date; wanting; first; date; possibility; perfectly; acceptable; someone; prefer; relationship; spontaneous; passion; soft; expectation; allow; much; wiggle; room; make; everyone; relaxed; hard; expectation; feel; rigid; feel; like; like; business; transaction; something; want; pussy; mood; come; pussy; giving; head; already; making; thing; feel; transnational; taking; time; approach; super; line; feel; like; come; pleasant; energy; push; pull; rather; convinced; manipulated; liking; worse; respectful; someone; partner; would; thing; purely; sexual; proposition; average; shot; shot; flirtatiously; looking; performing; monkey; applicant,-1
n3fxt2,parahacker,need; cook; woman; trope,trope; traditionalist; trope; usually; identify; case; wanting; woman; cook; better; cook; enjoy; love; feeding; group; woman; hell; kitchen; working; week; cooking; relaxation; time; love; cook; woman; want; back; food; cleaning; embrace; cook; clean; everybody; happy; question; first; thing; woman; able; aside; pretty; cook; dude; hard; good; meal; ingredient; come; place; show; done; cooking; feminine; something; everyone; love; random; probably; taken; hell; dunno; purge; week; chest,-1
n3ekxl,AutoModerator,covid; vaccine; mega; thread,sticky; semi; relevant; topic; change; week; week; personal; advice; asked; reddit; toughloveadvice; reddit; toughloveadvice; please; join; discord; discord,-1
n3dip9,BlindMaestro,past; promiscuity; dealbreaker; relationship,,-1
n3d3nc,DistinctCharacter725,according; numerous; study; published; woman; find; participating; sport; extreme; activity; general; significantly; attractive; make; masculine; woman,,-1
n3ccey,newzalrt883,woman; especially; young; woman; want; casual; covertly; chase,,-1
n3c6tq,lunafromafar,gentleman,,-1
n3aw5o,WantedHHHJJJ,hiring; quota,hiring; quota; discriminatory; thing; modern; work; hospital; recently; told; looking; minority; management; position; removing; opportunity; people; solely; based; race; gender; belittling; hire; minority; bring; colour; work; place; understand; come; good; intention; feel; higher; believing; minority; incapable; getting; job; compared; white; people; gender; people; severely; racist; sexist; mindset,-1
n3ap4v,pilot333,high; smv; plan; marry; plan; marry; higher; family; class; better; life,pill; increasing; value; multiple; area; life; better; physique; better; money; understanding; pillers; marry; blue; pill; physique; game; point; enough; score; female; attention; goal; accomplishment; really; dating; volume; find; woman; come; wealthy; family; generational; wealth; assuming; self; sufficient; make; decent; money; would; ever; marry; girl; make; money; could; really; handle; rich; girl; would; feel; shame; marrying; private; lifestyle; tempting; great; physique; spoiled; girl; know; high; demand; smv; chart,-1
n377dp,Theserbiangirl,study; child; older; father; le; attractive; maternal; effect; attractiveness,researchgate; publication; advanced; paternal; associated; lower; facial; attractiveness; abstract; view; disease; risk; kong; demonstrated; mutation; explained; father; conception; accordingly; paternal; effect; found; variety; offspring; trait; physical; mental; health; intelligence; investigated; whether; facial; attractiveness; significantly; associated; paternal; used; wisconsin; longitudinal; study; male; female; high; school; graduate; analyze; association; individual; father; birth; individual; facial; attractiveness; estimated; rating; high; school; yearbook; photograph; controlling; mother; find; subject; facial; attractiveness; decreased; advancing; paternal; maternal; suggesting; facial; attractiveness; might; individual; mutation; load,-1
n373n8,5HT2AC,much; disadvantage; male; pattern; balding; young,biologically; full; head; hair; associated; virility; youth; many; assume; thinning; hair; male; pattern; balding; receding; hair; line; le; luck; lady; according; national; library; medicine; percent; affected; male; pattern; balding; extent; going; bald; young; want; direct; conversation; towards; young; balding; every; woman; young; point; life; question; still; teen; tweens; look; upon; balding; young; teen; tweens; bracket; would; considered; mating; material; huge; nogo; opinion; much; hair; loss; impact; young; attractiveness; much; turn; balding; young; guy,-1
n35sof,whyamistilllonline,find; concise; version; theory,looking; brief; comprehensive; article; learn; exactly; offer; someone; recommended; ocean; resource; starting; rian; stone; robert; greene; subreddits; time; read; book; article; something; spend; hour; learn; maybe; something; like; blog; post; bullet; point; cover; philosophy; care; detail; interested; picture; view,-1
n355vr,Luna99NB,woman; really; like; boyband; member,recently; post; poster; asked; rate; partner; want; commenters; gave; much; importance; dick; size; simultaneously; east; asian; boybands; korea; much; le; extent; japan; popular; west; selling; stadium; tour; arena; merchandise; much; larger; manner; older; white; boybands; teen; idol; ever; kdramas; jdramas; actor; popular; coveted; among; girl; around; world; content; actor; think; good; looking; average; realise; seen; objectively; attractive; case; white; boybands; teen; idol; none; male; teen; idol; seen; objectively; borderline; ugly; never; girl; went; crazy; attracted; given; rotational; harem; anyways; asshole; fuck; jungkook; harry; style; easily; fuck; david; gandy; ideal; situation; racist; towards; anybody; reposting; earlier; post; perceived; racism,-1
n352oe,SherdyRavers,wrong; sleep; lot; woman; prefer; great; woman,sleep; around; lot; woman; friend; context; slept; girl; since; start; friend; probably; slept; girl; year; chat; yesterday; girl; come; around; house; mentioned; sleeping; around; woman; fulfilling; falling; love; woman; surprise; agreed; conversation; went; realised; reason; commit; girl; sleep; around; lack; character; interesting; personality; girl; sleep; pretty; nothing; interesting; alot; hurt; alot; guy; sound; behave; bitter; find; unattractive; potential; partner; realised; friend; sleep; lot; girl; tend; relationship; woman; arent; good; looking; interesting; around; strong; character; quite; feminine; contrary; friend; would; prefer; meet; great; woman; nice; personality; interesting; talk; fuck; lot; pretty; woman; isnt; immersive; fulfilling; feel; natural; deep; emotion; woman; fucking; tested; world; sleep; around; alot; find; idea; fucking; alot; woman; enticing; fucking; alot; woman; scarce; like; thirsty; desert; find; thought; drinking; gallon; water; alluring; normal; person; would; prefer; drink; glass; water,-1
n33h5z,Yolobidroie,jordan; peterson; advocate; pill,read; rule; life; great; book; help; notice; rule; basically; expose; main; point; pill; like; simply; show; incoherence; threat; masculinization; feminization; without; becoming; resentful; offensive; unlike; many; redpillers; someone; could; read; word; still; question; going; make; much; sense; guy; think,-1
n31e19,IcyChillMikes,adult; woman; listen; young; teen; girl; music; reverse,,-1
n2yn5i,[deleted],vent; emotion,,-1
n2y8gu,whatwasthatdamnword,know; pill; blue; pill; mean; guess; people; avid; user; testosterone; viagra; anyway; neither; high; testosterone; libido; remain; objective; neutral,,-1
n2vk22,OddAlternatives,atlantic; bored,woman; tend; feel; stultified; long; term; exclusivity; despite; taught; designed; indeed; true; implication; woman; like; exclusivity; long; term; like; fuck; around; people; torturing; subjecting; suffocation; boredom; people; choose; marry; appear; financial; necessity; anymore; farm; harvest; pure; choice; although; people; sexual; partnership; facing; conundrum; biologist; call; habituation; stimulus; time; growing; body; research; suggests; heterosexual; woman; aggregate; likely; face; problem; earlier; relationship; disparity; tends; time; general; manage; wanting; already; woman; struggle; suggest; right; say; perhaps; tongue; cheek; nevertheless; betabuxing; amount; nonconsensual,-1
n2v7uu,sdwdqw65,dating; become; luxury; future; robot,,-1
n2sv51,pfquestionthanksyall,millennials; never; married; found; looking,based; research; study; linked; time; report; millennials; marriage; time; report; millennials; marriage; saying; record; high; single; adult; millennials; today; young; adult; reach; record; high; share; roughly; likely; never; married; imagine; gotten; much; worse; since; country; gotten; divided; isolated; seems; fine; people; find; good; relationship; like; married; long; make; change; community; single; people; place; friendship; others; community; reason; default; focus; socialization; community; currently; family; common; pointless; keep; spending; money; allocated; community; without; thinking; ability; meet; initial; goal; changed; goal; park; community; health; stuff; people; need; involved; community; health; keep; crime; figure; single; involved; would; help; single; mom; dad; kind; community; involvement; single; childless; adult; background; checked; help; childcare; order; relationship; kid; healthy; thing; without; parent; would; free; childcare; kid; would; another; adult; trust; life; okay; going; direction; nothing; think; proactively; community; changing; need; already; seeing; insane; mental; health; crisis; opiod; addiction; suicide; mass; ssri; mass; numbing; drug; user,-1
n2sftx,SuspiciousLeopard662,perfect; example; abusive; manipulative; behavior,yesterday; twitter; trending; topic; meltdown; famous; trans; actress; janet; mock; award; ceremony; bothered; people; calling; behavior; especially; since; allegedly; said; janet; mock; transwoman; executive; producer; director; drama; pose; left; star; network; boss; reporter; stunned; show; premiere; party; thursday; night; libbing; wide; ranging; flabbergastingly; fiery; speech; minute; long; speech; complained; much; network; paying; demanded; better; treatment; trans; community; shouted; hollywood; revealed; slept; someone; show; crew; asked; pose; actor; boyfriendnot; leave; infidelity; decried; quality; writing; show; brief; conversation; creator; hollywood; mogul; ryan; murphy; stage; early; talk; mock; wondered; aloud; making; episode; angry; said; demanding; money; perk; equal; executive; room; jazz; lincoln; center; fell; completely; silent; mock; shouted; hollywood; make; uncomfortable; make; king; shake; motherf; king; boot; speaking; truth; pose; said; mock; next; complained; quality; material; male; writer; show; first; episode; addressed; murphy; saying; brought; girl; help; brought; girl; asked; murphy; replied; wanted; girl; speech; took; personal; turn; mock; demanded; boyfriend; angel; bismark; curiel; stand; right; bismark; curiel; nervously; stood; mock; said; crowd; tell; something; love; today; angel; said; right; someone; crew; right; revelation; show; guest; star; could; heard; gasping; asked; hell; happening; angel; angel; losing; hear; king; important; mock; continued; want; live; house; alone; want; motherf; right; want; getting; mine; mock; apologized; composer; lady; producer; writer; pose; said; tried; diminish; make; bigger; forgot; want; come; pretend; said; need; hollywood; honey; know; king; free; mock; provided; inspirational; word; cast; member; including; dominique; jackson; indya; moore; show; lead; rodriguez; turning; attention; back; industry; large; show; mean; much; everyone; ensure; enable; black; brown; trans; woman; make; sound; good; said; sarcastically; make; comfortable; talk; like; scare; facing; king; truth; stomped; insider; worked; mock; told; page; seemed; emotionally; unhinged; suggested; revelation; relationship; cause; seemed; almost; immediately; remorseful; aired; publicly; said; visibly; shaken; mock; admitted; afraid; forthright; speech; might; ruined; career; though; room; back; jackson; shouted; audience; thank; speaking; mock; scheduled; promote; show; good; morning; america; friday; insider; told; appearance; canceled; gave; speech; mock; back; rep; comment; textbook; emotional; abuse; first; humiliates; admitting; cheating; front; hundred; people; flat; tell; leave; relationship; pushback; curious; guy; think; abusive; relationship; abuser; used; similar; tactic; like; mock,-1
n2ri9r,AbnormalBias,amount; body; positivity; ever; change; anything; traditionally; attractive; guy; make; woman; le; comfortable; admitting; actual; preference,post; every; mainstream; subreddits; like; trueoffmychest; espousing; body; positivity; shorter; without; muscle; pack; small; dick; course; nicely; written; intentioned; seem; assume; current; male; attractiveness; standard; based; cultural; norm; ignore; deliberately; avoid; discussing; fact; standard; evolve; biological; preference; amount; anti; shaming; rhetoric; ever; lead; woman; find; shorter; comparably; attractive; taller; average; taken; desired; end; call; make; woman; reluctant; admit; actually; find; attractive; fear; social; shaming; hurting; feeling; cultural; norm; shift; away; body; shaming; shift; fundamental; makeup; libido; criticism; woman; lying; find; attractive; think; many; woman; deliberately; mislead; many; want; inspire; impotent; rage; among; le; blessed; male; friend; refrain; honest; physical; feature; turn,-1
n2rbbc,Baelinator,anyone; help; rebuttal; argument; made; twitch; stream; chat; whether; raped,,-1
n2r5nm,sexy420slutwhore,like,,-1
n2quhm,maybeathrowaway85,dear; woman; would; opinion; took; surgery; become; taller,,-1
n2qjl1,machaterra,role; family,,-1
