post_id,author,title,body,image
rckm4i,Gari_305,advancement; egalitarianism; society; lead; collapse; society,advancement; automation; causing; masculinity; crisis; stated; article; seen; bloomberg; opinion; article; industrial; robot; boon; creating; crisis; masculinity; theory; marriage; published; introduced; notion; shrinking; male; female; wage; reduces; value; wedlock; woman; back; lad; made; killing; lass; made; pittance; made; sense; economically; least; specialize; within; household; consisting; working; husband; wife; maybe; child; woman; earn; better; wage; however; longer; gain; much; tying; least; thus; contributing; issue; lack; luster; marriage; young; seen; article; lifestyle; wedding; marriage; lost; luster; among; young; people; aardnog; ocid; msedgntp; answer; vary; slightly; woman; interestingly; nearly; half; partnered; unmarried; age; lack; faith; ifstudies; blog; young; adult; canada; embrace; marriageor; reject; institution; woman; felt; government; taking; concern; issue; seen; washingtonpost; world; asia; pacific; china; birth; control; vasectomy; story; html; effort; arrest; trend; including; loosening; family; planning; rule; washingtonpost; world; asia; pacific; china; three; child; policy; demographic; story; html; itid; inline; manual; former; child; policy; offering; cash; subsidy; longer; parental; leave; weixin; ltcfhr; csotnaulq; qtlig; encourage; larger; family; failed; chinese; couple; choose; child; civilization; like; seemed; primed; woman; right; abortion; news; world; canada; question; raised; subsequent; purple; pill; debate; fall; marriage; birth; rate; prompt; government; hand; world; uplift; fertility; number; dating; issue; cause; collapse; society; world,-1
rckgxf,Exciting-Necessary-5,hypocritical; count; virgin; woman; prefer; demand; high; count; commitment; marriage,lady; based; response; seen; thread; would; safe; state; many; woman; agree; hypocritical; high; count; want; count; woman; commitment; marriage; many; woman; straight; called; insecure; pathetic; wondering; reverse; true; hypocritical; count; virgin; woman; prefer; high; count; marriage; assume; rationale; maybe; want; high; count; would; rather; taught; would; feel; comfortable; inexperience; maybe; virgin; guy; turn; reason; would; woman; considered; insecure; pathetic,-1
rcjft7,PerceptionTasty1495,trafficking; main; reason; woman; prostitution,posed; hypothetical; safe; legal; regulated; prostitution; woman; claim; commodification; dealbreaker; however; pretty; clear; give; actually; give; damn; whether; people; like; service; hypocricy; reacted; woman; talking; experience; hiring; male; escort; really; feeling; like; partner; settling; like; hired; male; datingoverthirty; reddit; reddit; datingoverthirty; comment; gakv; hired; male; would; react; partner; told; prostitute; past; askwomen; reddit; reddit; askwomen; comment; would; react; partner; told; woman; want; able; giga; stacy; whenever; want; woman; want; stable; choice; spent; sleeping; woman; league; would; never; date; know; could; cheat; moment; notice; sound; familiar,-1
rch66a,AutoModerator,daily; community; chat; megathread,daily; thread; designed; place; funny; discussion; feel; free; post; topic; question; information; point; view; thread; post; everything; think; warrant; thread; socialising; comment; automatically; sorted; post; throughout; people; comment; like; previous; daily; thread; click; reddit; purplepilldebate; search; subreddit; apurplepilldebate; author; aautomoderator; daily; community; chat; megathread; restrict; sort; please; join; discord; discord; ztcwgjchef; include; reddit; username; pill; color; relationship; status; gender; introduce; find; instagram; instagram; drgree; twitter; twitter; mrsdrgree,-1
rcgtiz,Artistic_Guest4386,somebody; explain; looksmatch; possible,,-1
rce0yv,Responsible-Shake509,like; music; used; raise; awareness; gender; issue; thought,,-1
rcdbsa,SciFiFanatic101,successful; eliminating; sexual; desire,,-1
rcc84l,Cookiecuttermaxy,sequel; thread; made; male; social; behavior; onto; sequel; woman; much; better; attaining; initiating; social; romantic; affair; woman; expressive; verbal; socialized; compared,like; said; action; oriented; instrumental; performance; oriented; tactile; socially; hierarchial; meaning; earn; eachother; respect; opposite; true; woman; social; behavior; woman; expressive; woman; verbal; woman; open; personal; dialogue; usually; mindful; mindful; context; mean; internalize; careful; open; woman; much; quicker; flow; promptly; think; reason; alone; woman; iniutive; trust; instinct; better; social; situation; woman; group; gravivated; towards; certain; individual; individual; want; relate; woman; brought; socially; agreeable; brought; socially; tactical; cautious; make; sense; since; tribal; society; keep; looking; rape; murder; woman; child; still; heavily; engrained; agree; male; male; hostility; tribe; make; sure; lynch; anybody; stepping; territorial; bound; matter; beta; alpha; last; least; understand; woman; think; prove; worth; others; much; long; good; social; skill; ratchet; annoying; pretty; much; already; sweet; social; spot; landed; anywhere; hand; handicapped; socially; slight; flaw; including; talkative; loyal; enough; peer; meaning; falling; peer; pressure; socially; akward; someone; lack; passion; enthusiasm; anything; someone; stand; someone; afraid; tell; like; forth; taking; apperance; account; since; primarily; social; mannerism; dating; market; fails; understand; certain; social; cue; chance; falll; prone; manipulation; tactic; important; rejected; much; person; friend; crush; let; know; work; social; game,-1
rcbbk9,wowweeewhoknows,chad; chad; brad; brody,,-1
rc9tng,Cupcakelover1985,become; prostitute; porn; star,title; kind; explains; geared; specifically; think; profession; great; female; privilege; downplay; risk; associated; work; enter; field; common; claim; profession; hold; true; easy; privileged; lot; stopping,-1
rc6zrh,[deleted],know; shamed; wanting; younger; woman; slept; around,,-1
rc6xf3,houstongradengineer,roleplay,,-1
rc6w8y,houstongradengineer,gave; ever; pulled; fake; date; joke; girl; familiar; trend; seek; happened; woman; based; thread; earlier,pretty; much; title; happen; twice; thrice; back; middle; school; thought; actual; boyfriend; playing; called; asked; wondering; make; familiar; always; thought; plain; cruel; seem; common; would; figure; understand; woman; come; shit; like,-1
rc6kci,Educational-Ad6210,unreasonable; woman; honest; current; dating; market,back; day; people; would; marry; young; virgin; would; support; broadly; speaking; nothing; honest; currently; saved; falling; face; partner; handed; like; past; nice; folk; touch; reality; chat; many; update; view; dating; market; helpful; nice; sleep; around; longer; work; traditional; somewhat; player; gentleman; used; betaorbiter; orbiter; traditional; woman; somewhat; slut; traded; somebody; sometimes; people; lucky; meet; church; probably; like; church; want; freedom; good; stuff; fuck; learn; opposite; gender; judge; woman; might; happen; soon; multiple; time; realize; strategy; commitment; soon; parent; gentle; explain; unfortunate; aspect; dating; dynamic; pushy; girl; teenage; year; barrier; sex; virgin; used; white; knight; longer; want; want; laid; someone; getting; cuffed; sitting; comfortable; armchair; theorizing; person; sitting; chair; next; restaurant; table; understanding; promise; whatever; absolutely; honest; partner; date; thing; result; either; contempt; raised; eyebrow; hurt; feeling; woman; never; closest; people; another; spouse; historically; quite; detached; formal; compared; today; want; casual; shit; dump; shit; innocent; stranger; expect; sympathy; wonder; work; sweet; telling; truth; fucker; dumped; everybody; right; mind; dump; sophisticated; need; instead; wide; eyed; stupid; honesty; diplomacy; walking; tightrope; defecating; mistake; since; grade; mouthes; outrageous; sociopathic; lie; make; relationship; doomed; lady; gentleman; wanted; freedom; casualty; eating; shit; tablespoon,-1
rc5hln,Elver86,number; partner,question; anyone; would; like; answer; many; body; many; would; comfortable; potential; serious; partner; possible; interested; know; response; woman,-1
rc2ova,ogsimpology,woman; sexual; act; done; previous; partner; indicator; attracted; enough,dispell; wrong; notion; seeing; latest; post; woman; longer; perform; act; done; previous; partner; could; mean; thing; grew; liking; unhealthy; relationship; practically; bargain; partner; approval; love; attention; despite; hating; thought; normal; thing; relationship; question; would; want; perform; sexual; act; partner; want; looking; long; term; commitment; comfort; priority; sexual; pleasure; getting; sexual; find; another; woman; clearly; love; enough; look; past; simple; disagreement; find; sexually; attractive; enough; leave; staying,-1
rc28qg,DurnjinMaster,feminist; defends; men; right,,-1
rc2761,TheFearlessBoi,hook; culture; woman; equivalent; prostitution; culture,woman; hate; idea; future; husband; giving; another; woman; money; hate; idea; future; wife; giving; another; free; plain; becky; hooking; chad; beta; billy; working; future; unfair; billy; married; plain; becky; hooking; chad; beta; billy; spending; resource; hook; stacy; fair; billy; married; like; beta; billy; gave; thousand; stacy; like; gave; youth; chad; equal; legalize; encourage; prostitution,-1
rc234o,[deleted],callously; vetting; every; little; thing; chad; want; guarantee; hopping; roommate; agreement; instead; marriage,,-1
rc217r,wowweeewhoknows,callously; vetting; every; little; thing; chad; want; privilege; dead; bedroom; alimony; situation,,-1
rc1qvc,Artistic_Guest4386,watching; disney; young; anyway,secondly; disney; isnt; medium; primarily; pushing; blue; pill; narrative; mostly; long; running; teen; serial; movie; nerd; argue; quite; opposite; true; disney; guy; character; princess; always; masculine; brave; literally; fucking; simba; hercules; aladdin; total; chad; chadsmiths; always; quote; disney; young; watching; disney; playing; sport; outside; others; kid; getting; knocked; choose; spend; eating; serial; masturbating; playing; halo; suppose; point; post; aint; disney; feeding; young; male; grow; nice; clean; wearing; caring; beta; male; youll; girl; question; cause; young; beta; believe; thing,-1
rc1byt,DisciplineSilent2347,dream,,-1
rc13a5,[deleted],beating; dead; horse; explain; level; headed; man; perspective,,-1
rc0wb6,mbrseb,seeing; woman; baby; making; machine,,-1
rbzcf8,Glarkin42,society; welcoming; female; sought; kink,,-1
rbz5v0,FabulousFuchsbau,bitter; pill; everyone; chance; finding; fairytale; perfect; princess; prince; next; nonexistent,take; pill; chaser; water; juice; nada; need; absorb; every; single; molecule; need; take; butter; taste; mouth; open; eye; society; certain; reddit; like; preach; perfectly; flawless; woman; waiting; right; moment; sweep; foot; smile; laugh; somebody; like; everyone; look; find; person; false; considered; perfectly; flawless; perfect; flawless; notion; fantasy; waiting; need; dispelled; perfect; partner; shit; piss; fart; spit; break; stuff; always; look; best; sweat; sick; clean; nose; morning; breathe; might; scar; self; conscious; awful; childhood; still; carry; fear; communication; struggle; communicating; much; picky; going; allergy; going; along; friend; family; want; kid; want; pet; want; city; living; want; rural; lifestyle; list; march; bottom; line; perfect; flawless; yes; queen; strong; alpha; pillers; continue; like,-1
rbym7k,gfcheatedwithchad,open; relationship; fair; view; matter,open; relationship; common; dating; marketplace; nowadays; basis; open; relationship; setting; boundary; rule; parnerts; flirt; sleep; another; person; long; stay; truthful; commitment; main; partner; given; fact; harder; sleep; around; seems; like; unfair; deal; matter; said; hard; average; male; woman; interested; alone; wanting; sleep; string; attached; girl; generally; touch; relationship; single; choose; throught; complication; dating; taken; ponder; lying; open; relationship; another; girl; hurt; would; sorority; principle; word; trouble; open; relationship; heck; girl; contact; girlfriend; right; trend; boyfriend; flirt; please; screenshot; tell; people; assume; cheating; date; know; cheating; people; know; automatically; assume; cheating; lower; perceived; value; society; woman; like; oxygen; always; flooded; able; least; active; time; likely; going; attractive; partner; care; girl; boyfriend; bang; disregarding; anything; stop; consider; boyfriend; feeling; girl; lying; open; relationship; debate; think; woman; open; relationship; know; partner; woulnd; able; feel; safe; seen; woman; open; relationship; flip; find; partner; actually; trying; interested; another; woman; reationalize; jelousy; something; person; control; partner; considerate; seen; countless; post; story; specially; woman; claim; open; relationship; sleep; around; without; consecuences; like; actuallly; think; open; relationship; card; laid; fuckboys; fuckboys; fuckboys; open; relationship; moment; sure; woman; internet; claiming; opened; relationship; boyfriend; took; advantage; dating; stone; cold; head; think; instance; open; relationship; unfair; edit; please; mind; talking; open; relationship; heterosexual; people,-1
rby07j,[deleted],state; open; relationship; fair,,-1
rbwgrv,Think_gawd,issue; minimal; resolution,,-1
rbw5dm,Educational-Cut4177,state; mandated; girlfriend,,-1
rbv9tk,TrueStorms,would; feel; woman; sexual; thing; chad; past; enthusiastically; willing; thing; know; acquired; taste; activity; influence; chad,hear; woman; apparently; open; tried; anal; threesome; vanilla; possibly; uncomfortable; activity; chad; learned; like; thing; longer; current; partner; feel; case; gave; chad; vanilla; activity; actually; fine; willing; happen; know; willingness; past; experience; chad; assume; know; fact; particular; chad; catalyst; open; anal; personally; never; bedroom; story; swap; anyone; life; market; keep; telling; pretty; normal; tried; thing; say; tried; hypothetical; know; exact; name; asked; randomly; volunteered; info; okay; cool; want; anal; say; would; love; prep; lube; know; really; enjoy; chad; liked; best; prepped; first; thing; le; make; explicitly; clear; like; sexual; part; chad; taught; inclined; acquire; taste; remember; assume; asked; learned; apparently; normal; answering; question; would; feel; knew; chad; gotten; anal; hate; actually; cool; liked; willing; much; know; learned; like; insert; atypical; sexual; past; lover,-1
rbv04k,DesperateTraffic3164,woman; high; standard; financial; success; want; money,seen; woman; peddle; idea; woman; date; making; would; date; earner; want; money; untrue; attractive; good; natured; woman; date; almost; anyone; want; thing; equal; course; would; want; someone; money; le; attractive; woman; threshold; financial; success; looking; beyond; interested; primarily; quality; like; chemistry; good; look; romance; attractive; woman; higher; minimum; threshold; financial; success; attribute; want; without; compromising; quality; life; woman; almost; always; much; richer; partner; choose; sacrifice; money; good; relationship,-1
rbuens,reginafan,woman; would; date; someone; voted; opposing; candidate; compared; think; affect; relationship; majority; republican; majority; woman; democrat,democrat; date; someone; opposing; view; versus; republican; democratic; woman; dating; republican; source; axios; poll; political; polarization; student; html; would; woman; date; instead; masculine; alpha; prove; redpill; wrong,-1
rbtrzg,pro-frog,category; beyond; alpha; beta,every; time; alpha; beta; dichotomy; discussed; seems; category; fall; either; simp; self; respect; asshole; respect; woman; really; uncommon; treat; woman; respect; category; type; fall; alpha; category; trying; manipulate; woman,-1
rbsxzd,OneAngryBlutbad,topic; view; opinion; sans; pill,everyone; disagrees; girl; girl; easy; disagree; many; thing; relationship; people; merely; date; interact; opposite; asking; agree; related; pill; blue; pill; least; agree; someone; measure,-1
rbqxxv,Mikosu04,sexual; abuse,,-1
rbpsua,AutoModerator,daily; community; chat; megathread,daily; thread; designed; place; funny; discussion; feel; free; post; topic; question; information; point; view; thread; post; everything; think; warrant; thread; socialising; comment; automatically; sorted; post; throughout; people; comment; like; previous; daily; thread; click; reddit; purplepilldebate; search; subreddit; apurplepilldebate; author; aautomoderator; daily; community; chat; megathread; restrict; sort; please; join; discord; discord; ztcwgjchef; include; reddit; username; pill; color; relationship; status; gender; introduce; find; instagram; instagram; drgree; twitter; twitter; mrsdrgree,-1
rbprqw,AnonRb6,push; feminism; beta; backfired,beta; male; pushed; feminism; hope; woman; would; liberated; easier; time; sleeping; thought; know; guy; stick; figured; overweight; weak; appearance; annoying; mindset; high; horse; time; whiteknights; term; often; used; online; recently; simps; space; lvm; result; made; woman; sleep; tier; guy; readily; easier; alpha; tier; guy; one; reaping; time; feminist; getting; banged; friday; night; club; guy; guy; section; feminism; destroyed; chivalry; marriage; gave; beta; male; harder; time; find; commitment; would; girl; smash; weakling; sleep; tier; dude; thanks; feminism; like; social; medium; drill; head; comparing; virginity; rate; woman; past; year; alone; woman; sleeping; around; held; accountable; compared; one; complain; finding; good; committed; appearance; start; fade,-1
rboad3,N0_name83726,keep; hearing; girl; date; resource; wasted; make; sure; played; ghosted,,-1
rblmg4,vytautas_rimaitis,girl; boyfriend; still; flirt; coworkers,,-1
rblf9v,victorhugogime,really; think; might; craving; much; every; possible; reason; making; insane,,-1
rbl8nd,forthetinderelllas,calibration; separate; boy,response; many; post; addressing; woman; give; others; uncomfortable; truth; hard; time; accepting; push; boundary; respected; potential; partner; parameter; boundary; vary; girl; girl; sexual; preference; shamelessly; confident; master; calibration; able; supercede; boundary; course; unconventially; attractive; confidence; social; status; wealth; fine; tune; shit; tested; still; shamelessly; confident; secure; woman; attracted; security; period; edit; elaborate; upon; reason; uncomfortable; truth; fact; conventionally; push; thing; platonic; sexual; everyone; naturally; born; charisma; mistake; inevitable; anyone; decides; proactive; dating; life,-1
rbkld8,[deleted],holy; fuck,,-1
rbhukm,YtBlue,spontaneous; drive; reactive; drive; reason; misunderstanding; woman,spontaneous; drive; ready; sight; someone; reactive; primarily; mental; someone; acting; first; turned; allows; little; restraint; add; many; opportunity; disqualification; restraint; opposite; another; woman; face; mostly; spontaneous; woman; mostly; reactive; think; male; girl; would; type; drive; case; get; upset; woman; allow; right; seeing; see; sexuality; woman; think; choose; great; quality; first; decide; meet; qualified; special; labeled; thirsty; grossed; operates; sexually; testosterone; labeled; aggressive; hormone; impulsive; reason; estrogen; labeled; caution; hormone; reason; outlier; everything; general; trend,-1
rbhp95,[deleted],spontaneous; reactive; sexual; desire; reason; misunderstanding; sex,,-1
rbhfcl,livs4drpepper,everybody; value; appearance; partner; want; believe,much; rhetoric; around; attractiveness; important; relationship; daily; life; think; much; matter; hear; woman; care; look; body; course; general; always; spew; woman; want; chad; play; bitter; woman; admit; strongly; value; look; fairly; sex; though; ever; want; admit; fear; shallow; think; agree; sex; want; admit; much; value; attractivness; partner; important; everybody; possibly; think; higher; list; admit; many; thing; partner; away; speak; attractive; subconscious; feel; like; attractiveness; seeps; aspect; life; nicer; accepting; understanding; people; attractive; piece; anecdotal; evidence; used; profile; almost; point; tough; criticism; people; thing; bitter; ugly; harsh; toward; profile; people; average; please; delusion; attractive; need; reality; check; seems; like; people; understanding; saying; praise; thing; like; honesty; disagree; guy; fight; point; slide; never; happened; maybe; feel; personal; putting; face; name; think; interesting; think; impossible; really; understand; much; value; attractiveness; seems; layered; encased; different; bias,-1
rbekh1,Even-Kiwi-9164,people; settled; settled; partner,pretty; straight; forward; question; people; claim; settle; advocate; interested; hear; people; personal; story; gone; draw; conclusion; result; thing; lady; make; figure; need; nice; handful; domestic; duty; take; couple; hour; play; many; video; game; spare; time; feel; free; slide,-1
rbdw8h,[deleted],american; find; currently; unsatisfactory; dating; marriage,,-1
rbdl7p,OnlyVirgins,restrict; male; sexual; archetype; discussion; beta; alpha,,-1
rbd8ot,[deleted],husband; help; weekend; housework; watch; answer; think; mindset; change; woman; regarding; question; society; today,,-1
rbcwvl,Mrs_Drgree,woman; sexual; act; used; ex; hook; regularly; current; partner,current; partner,-1
rbbp34,TheHeroReditDeserves,prior; ex; act; done; done; dating; people; autistic; stuff,,-1
rba81p,majani,libido; mere; excuse; attraction,common; sense; simply; trait; libido; present; human; population; significant; number; would; spell; doom; human; race; within; several; generation; libido; trait; spread; present; human; people; libido; trouble; reproducing; personality; trait; extinguish; natural; selection; therefore; libido; trait; present; human; population; common; sense; tell; best; would; vanishingly; small; number; random; mutation; libido; get; cited; menopausal; woman; cause; relationship; stress; impossible; standpoint; natural; selection; plausible; libido; used; excuse; lack; attraction; woman; either; concealing; real; preference; lying; jamanetwork; journal; jamainternalmedicine; fullarticle,-1
rb9lkx,xQueen-Bx,prior; act; asshole; youre; asshole; fault,conventional; wisdom; say; woman; act; attracted; couldnt; wouldnt; freely; aggressively; offered; butthole; sheer; lust; generated; attractiveness; truth; asshole; jerk; pushed; boundary; bossed; around; demanded; wanted; sometimes; taking; tried; compliance; shittest; test; saying; laughed; left; pressured; youre; different; youre; respectful; boundary; first; time; tried; consoling; agreeable; tried; anal; respectfully; asking; said; tried; didnt; like; cried; compliant; felt; compliant; every; test; failed; every; boundary; refused; push; showed; could; sexual; pace; bought; frame; frame; frame; bos,-1
rb985i,Aldabruzzo,prior; ex; act; done; done; attitude; toward; current,week; stuff; prior; ex; stuff; everyone; missing; point; want; tell; used; thing; really; enjoyed; current; attracted; make; story; decided; grown; matured; thing; anymore; whether; want; thing; point; want; thing; want; thing; would; someone; else; want; thing; growth; maturity; changed; preference; lack; attraction; wanting; certain; thing; prior; bullying; thing; want; happening; would; called; rape; according; denizen; happen; woman; thing; want; anal; prior; guy; liked; anal; guy; woman; sexual; thing; want; like; learned; woman; bullied; sexual; thing; want; rape; illegal; prior; guy; serving; long; prison; term; woman; wanted; care; tried; like; care; something; like; point; current; beta; really; attracted; point; anything; picking; want; certain; thing; pressure; growth; maturity; changing; preference; deciding; someone; want; certain; thing; automod; edit; amazed; hard; many; miss; point; woman; giga; anal; hate; never; ever; woman; used; poor; boundary; year; better; one; back; read; post; respond; please,-1
rb66lp,autistictheory,much; alternative; lifestyle; choice; detriment; attraction,,-1
rb5jee,[deleted],feminist,,-1
rb1z3t,[deleted],individual; need; urge,,-1
rb1yo8,heybraham,society; tell; want; life,,-1
rb1d48,[deleted],nice; girl; nice; guy,,-1
raygjs,MasterTeacher123,often; think; talk; getting; laid,interested; everyone; opinion; apparently; according; something; happens; frequently; like; guy; position; laid; time; something; stupid; ruin; watching; podcast; year; girl; said; guy; know; stfu; sometimes; dude; podcast; said; going; home; woman; either; uber; shit; want; ruin; chance; getting; laid; dying; basically; idea; premise; woman; sexuality; streaky; take; much; woman; fuck; shit; gross; first; second; date; context; committed; relationship; woman; would; want; home; bang; husband; get; piss; vagina; dry; faster; desert; sahara; seen; different; husband; angry; wife; still; fuck; shit; basically; prevalent; think; idea; talking; getting; laid; guy; think; ever; done; ever; seen; happen; another; lady; ever; time; wanted; bang; dude; screwed,-1
rawn2m,AutoModerator,daily; community; chat; megathread,daily; thread; designed; place; funny; discussion; feel; free; post; topic; question; information; point; view; thread; post; everything; think; warrant; thread; socialising; comment; automatically; sorted; post; throughout; people; comment; like; previous; daily; thread; click; reddit; purplepilldebate; search; subreddit; apurplepilldebate; author; aautomoderator; daily; community; chat; megathread; restrict; sort; please; join; discord; discord; ztcwgjchef; include; reddit; username; pill; color; relationship; status; gender; introduce; find; instagram; instagram; drgree; twitter; twitter; mrsdrgree,-1
ravglc,captainquestionasker,hypothetical; dating; role; reversed; tomorrow; would; bother,,-1
