post_id,author,title,body,image
rf8ky0,SubstantialQuit4114,need; woman; wash; dish; cook; sandwich,,-1
rf8iv1,WeeklyAtmosphere,joined; redpillwoman; automatically; banned; offmychest; posting; bluepills; like,,-1
rf7od2,sart555,redpill; myth; asshole,married; year; dating; tinder; bumble; hinge; exclusively; year; first; date; woman; ranging; many; lady; attractive; book; slept; many; wanted; serious; relationship; read; lot; redpill; material; claim; woman; like; jerk; friendzone; niceguys; naturally; kindhearted; person; jerk; beneficial; genuine; core; never; found; woman; receptive; kindness; idea; woman; prefer; jerk; seems; like; urban; legend; maybe; charming; nice; woman; could; reveal; true; nature; asshole; later; relationship; woman; already; fallen; case; leave; love; people; outside; appears; like; jerk; realize; live; isolated; bubble; much; exposure; relationship; anyone; want; debate; topic; consider; attractive; wealthy; certain; impact; personal; experience,-1
rf72zy,SnooSprouts1580,continues; dodge; quarantine,reddit; femaledatingstrategy; comment; rcdeg; date; lu; dont; date; level; scrote; claim; time; hate; gold; digger; materialistic; woman; spit; face; scrote; dare; open; filthy; mouth; much; despises; gold; digger; hate; materialistic; fucking; punch; post; vote; multiple; award; encouraging; woman; spit; face; literally; punch; face; legitimate; call; violence; type; content; heavily; approved; indicates; primarily; attracts; venomous; sexist; woman; fantastic; radicalizing; woman; blatant; hateful; discourse; business; existing; dating; strategy; defending; strong; woman; healthy; mindset; healthy; relationship; behave; like; encourage; woman; behave; like; outright; sexism; encouraging; violence; enough; quarantined; take,-1
rf6c5k,RandomRedditGuy322,guy; woman; fighting; hard; right; woman; right; would; view; much; better; person; attractive; mate; standard; woman; concerned; woman; issue,,-1
rf5s9j,FabulousFuchsbau,yeah; sexbot; empty; threat; like; yeah; fuck; quarterback,yeah; weird; people; especially; people; might; problem; term; success; opposite; seem; think; threatening; robot; screw; athlete; threat; someone; going; heartbroken; person; decided; masturbate; someone; else; reaction; people; hoping; exactly; telling; someone; intimate; quote; grandstanding; like; saying; fire; quit; sound; petulant; like; someone; frustrated; world; currently; doubt; second; woman; decide; check; dating; game; really; blame; narcissistic; people; threat; woman; threaten; fuck; athlete; decide; stick; toy; want; narcissist; missed; dating; pool; narcissistic; threaten; realdoll; missed; woman; special; order; malignant; declaration; cause; collective; sigh; relief; people; shrug; move; said; people; like; threat,-1
rf5l1r,Educational-Cut4177,woman; know; sexist; toxic; conversation,,-1
rf5btx,CoconutNo6921,realization,woman; want; man; love; woman; unconditionally; love; woman; love; usually; based; conditons; societal; standing; resource; good; looking; successful; show; aware; physical; attraction; come; picture; personally; date; woman; find; visually; attractive; think; obvious; gender; average; looking; white; male; decent; physical; shape; make; money; care; money; main; focus; inner; peace; self; improvement; looking; reality; proper; context; make; money; point; time; sure; thing; want; financial; freedom; trusting; process; building; life; right; building; solid; inner; foundation; invisible; woman; level; look; maybe; couple; point; lower; look; unless; single; mother; basically; would; become; finacially; sucessful; muscualar; attract; woman; would; attracted; actually; turned; good; thing; atttractive; woman; attracted; done; self; improvement; increased; inner; peace; confidence; process; realized; woman; worth; dealing; anyways; maybe; stay; single; rest; life; though; make; money; probably; remain; single; woman; would; disturb; inner; peace; anyways,-1
rf5aqf,just_a_place,expect; happen; emotionally; vulnerable; available; mean,self; contained; grew; deal; emotion; woman; ever; told; emotionally; unavailable; hear; woman; concerning; boyfriend; especially; medium; many; article; wondering; hell; mean; especially; friend; tell; feel; like; truly; opened; girl; became; immediately; disgusted; go; downhill; going; wrong; since; woman; dated; never; told; closed; unemotional; know; going; woman; break; fell; macho; enough; whatever; mean; girl; friend; tell; easy; talk; girl; like; type; prefer; completely; unemotional; instead; question; woman; mean; want; emotionally; available; mean; show; emotion; mean; always; show; emotion; make; sense; please; explain,-1
rf4ra0,lostindahlia,woman; expected; work; career,,-1
rf3rm5,SectorPatient2745,afraid,,-1
rf2bsd,LingonberryMental,part; getting; little; controversial,hello; first; post; seem; like; rant; saying; okay; give; really; feel; like; world; moving; direction; bothered; probably; better; part; feel; like; woman; world; better; honestly; cruel; part; always; loved; woman; cripple; inside; quick; either; kill; broken; life; could; walk; woman; male; prison; watch; crazy; watch; hoot; holler; like; monkey; nature; beneath; nature; revolved; life; around; finding; connection; finding; woman; build; life; around; useful; aggression; function; utility; one; drafted; used; shield; seen; collateral; damage; want; woman; commenting; truly; feel; dude; actually; agree; know; nature; disgusting; thought; never; tasted; power; really; love; long; time; single; beaten; slowly; becoming; ready; serve; give; life; value,-1
rf1yur,LingonberryMental,little; controversial,hello; everyone; first; time; posting; go; thing; come; realize; especially; come; place; world; young; important; mention; post; pill; anger; within; thought; frustration; modern; world; towards; someone; like; problem; feeding; flame; clarity; really; lower; society; something; fight; cover; certainly; true; drive; attain; control; inherent; value; duty; work; contribute; something; life; might; life; never; peaceful; utopia; primal; urge; within; always; exactly; lower; percentage; actively; draining; resource; without; return; best; commit; single; putting; finger; belong; speak; first; life; lived; hopeless; looked; outside; perfectly; necessary; everyone; part; play; refuse; know; mean; sound; stupid; first; feel; need; push; look; place; complain,-1
rf1h6o,computerstuffs,woman; widow; care; le; look,,-1
rf1ghr,throwRA1g50,sick; gender; loathe; every; iteration; social; view,,-1
rf1axp,sex_is_dirty,request; definition; fuque; niceguy,common; term; probably; residing; many; post; made; niceguy; appears; infrequently; many; dating; related; post; site; across; internet; supposedly; many; feel; grasp; term; pretty; sure; obviously; grammarian; come; educate,-1
rezwhh,lizrdbrain,people; busy; keeping; score; forgetting; enjoy; life,post; give; take; going; date; someone; much; invest; money; time; beginning; think; people; fixated; whether; date; relationship; worth; time; forgetting; enjoy; value; nice; evening; someone; everything; turn; relationship; everything; transactional; experience; think; people; would; enjoy; dating; relationship; others; stopped; expecting; much; rather; nice; conversation; meal; date,-1
reyvvt,Artistic_Guest4386,many; potentially; amazing; healthy; relationship; ruined; another; hotter; meet; day; later,scenario; girl; meet; couple; date; maybe; first; grab; drink; really; good; chemistry; lot; common; make; eachother; laugh; similar; value; date; take; favourite; local; hike; chemistry; remains; great; kiss; walk; away; thinking; feeling; really; good; couple; night; later; single; dating; chatting; guy; agrees; meet; really; good; looking; drink; near; place; start; chatting; maybe; chat; doesnt; really; seem; present; driving; conversation; night; hotter; girl; kinda; treating; back; whatever; absolutely; captivated; look; cant; stop; staring; line; muscle; showing; shirt; drink; think; doesnt; seem; bothered; really; attracted; really; want; back; great; load; experience; behind; leaf; doesnt; text; day; best; shes; ever; feel; outta; league; cant; help; think; day; meanwhile; originally; sens; weird; distance; shes; texting; thinking; start; maybe; text; would; done; trying; date; three; shes; reluctant; available; couple; night; later; text; something; short; direct; know; distance; grows; becomes; downright; disappointing; text; instead; tell; shes; really; interested; insert; vague; reason; proceeds; week; bored; move; often; possible; scenario; especially; smartphones; many; potential; amazing; relationship; based; chemistry; shared; value; goal; essentially; killed; began,-1
reyozf,lostindahlia,woman; expected; work; career,,-1
reyltx,Artistic_Guest4386,realistically; often; think; chad; taken; girl; ruined; could; amazing; healthy; relationship,,-1
rey339,Ok_Warthog6767,curiosity; redpill; would; bisexual,,-1
rexrch,ItIsLikeMyOpinionMan,unsuccessful; young; treated; best,,-1
rex40w,StarchRunner,rewarded; chivalry; today; society; woman,,-1
rex2pr,toxicboyzrule,woman; cheating,,-1
rewk73,toxicboyzrule,milfs; muscular,,-1
rew4vv,StarchRunner,chivalry; within,chivalry; dead; within; back; high; school; party; dude; girlfriend; started; flirting; making; someone; else; came; minute; later; friend; must; told; dragged; back; pretty; loud; shrill; scream; smashing; noise; started; went; investigate; friend; tried; break; acting; peacemaker; ended; hitting; punch; next; thing; know; jumped; friend; biting; scalp; drag; shit; heated; left; ended; needed; several; stitch; week; afterwards; joking; worst; hickey; ever; serious; encounter; nuclear; immediate; family; member; thing; perps; seemingly; distributed; amongst; gender; line; feeling; much; heavier; awkward; especially; luckily; never; invited; drama; personal; life; know; friend; arguing; fighting; partner; heavy; later; someone; try; give; boot; permanently; anyway; shit; seen; bar; pretty; much; reinforced; bystander; effect; battling; couple; heard; neighbor; fight; like; silent; woman; probably; prostitute; getting; beaten; train; back; street; used; shrug; laugh; probably; wrong; hard; care; point; rarely; ever; seen; interloper; treated; either; party; seen; resulting; stabbing; anyway; weird; quirk; biology; naturally; inclined; want; help; subsequently; trained; stay; fuck; away; nothing; ever; good; come,-1
rew28p,gorilla_blanco,could; society; effectively; flip; daughter; responsible; carry; bloodline,never; would; thought; possible; seems; le; fetched; every; single; woman; choose; reproduce; woman; graduating; higher; rate; college; outside; feeling; like; failure; able; successfully; pas; family; bloodline; woman; responsible; task; think; last; hang; realistically; suited; mgtow; free; agent; lifestyle; rolling; dice; relationship; would; likely; divorce; child; support; without; parent; home; education; system; marriage; law; family; court; law; make; sense; family; concentrate; daughter; handle; responsibility; son; hook; tell; enjoy; life; find; way; contribute; note; would; told; college; teammate; fraternity; brother; would; married; ever; believed; would; guessed; would; married; bachelor; reality; gotten; married,-1
revy0b,throwawaylessons103,chad; often; relationship; material; woman; base; entire; selection; process; look; sexual; attraction; settling,,-1
revuxe,autistictheory,would; react; someone; offered; girlfriend; experience,,-1
reuyvv,Freddsreddit,theory; woman; attraction,theory; started; working; since; read; post; woman; claimed; werent; attracted; partner; start; theory; woman; experience; many; difference; kind; attraction; sexual; emotional; emotional; aspect; brought; thing; like; feeling; supported; feeling; safe; partner; trust; point; post; version; attraction; manifest; different; way; guy; often; complain; woman; chad; current; wont; thats; sexual; attraction; towards; chad; want; current; boyfriend; feel; attraction; safe; loving; sexual; matter; connecting; experiencing; thats; bedroom; dead; situation; although; woman; love; boyfriend; different; sort; attraction,-1
reuv6o,autistictheory,would; reaction; escort; someone; asked; girlfriend; experience,,-1
reusd9,autistictheory,would; reaction; escort; someone; offered; girlfriend; experience,,-1
reunw3,throwawaylessons103,chad; often; relationship; material; woman; base; entire; self; selection; process; look; sexual; attraction; settling,,-1
reulz4,SectorPatient2745,true; purpose,binge; watching; redpill; video; reading; story; study; show; woman; actually; incapable; loving; fact; considered; alpha; would; desire; need; longer; time; would; never; actually; love; nicest; possible; true; brutally; honest; please; want; know; actually; staring; date; want; truth; understand; whole; hypergamy; thing; tough; accept; finding; feel; purpose; anymore; meet; standard; alpha-male; male,-1
reuix0,throwawaylessons103,chad; often; relationship; material; woman; base; entire; selection; process; look; sexual; attraction; settling,,-1
retn1j,putabirdonit12,proof; mostly; pillers; truly; purple; pill; debate,association; subredditstats; asktrp; mgtow; femaledatingstrategy; seduction; mensrights; dating; datingoverthirty; menslib; datingoverforty; trueunpopularopinion; found; interesting; seems; probably; least; ratio; woman; truly; purple; pill; debate; feel; like; act; like; true; neutral; space; pill; idea; touted; truth; think,-1
rethn7,autumncolors816,woman; want; challenge,,-1
rervxe,SUS_pended,think; society; problem; rising; loneliness; like; japan,loneliness; rise; number; people; unable; find; partner; whatever; reason; rising; argue; endlessly; whether; woman; fault; high; expectation; fault; able; live; expectation; real; problem; addressing; problem; effectively; quickly; require; violation; human; right; either; woman; force; woman; date; someone; attracted; time; lonely; undesirable; planet; pretend; exist; want; favor; woman; would; erase; male; threat; would; either; mean; imprison; unattractive; prevent; rape; terrorist; attack; would; want; benefit; would; force; woman; date; unattractive; course; none; would; ever; applied; horrible; solution; seems; viable; option; moment; forcing; woman; lower; standard; forcing; accept; undesirable; cruel; solution; problem; slowly; growing; right; ignore; pretend; exist; point; future; impact; life; people; like; japan; think; would; best; solution; could; work; stop; problem; time; harm; woman,-1
rervn5,AutoModerator,daily; community; chat; megathread,daily; thread; designed; place; funny; discussion; feel; free; post; topic; question; information; point; view; thread; post; everything; think; warrant; thread; socialising; comment; automatically; sorted; post; throughout; people; comment; like; previous; daily; thread; click; reddit; purplepilldebate; search; subreddit; apurplepilldebate; author; aautomoderator; daily; community; chat; megathread; restrict; sort; please; join; discord; discord; ztcwgjchef; include; reddit; username; pill; color; relationship; status; gender; introduce; find; instagram; instagram; drgree; twitter; twitter; mrsdrgree,-1
rer4hs,Artistic_Guest4386,woman; shamed; judged; pressured; allow; touch; genitals; really; simple,come; relationship; dating; inequality; argument; standard; fairness; men; sexlessness; lonelyness; whether; intimacy; love; human; right; come; thing; woman; pressured; guilted; judged; anybody; control; allow; touch; vagina; every; argument; come; girl; regardless; attractive; nice; regardless; lonely; areor; depressed; regardless; impact; society; full; control; judgement; put; penis; inside; anything; contrary; immoral,-1
reqqcm,PerceptionTasty1495,woman; sleep; around; really; settle; chad; bust,,-1
repvq2,RandomRedditGuy322,prostitution; must; legalized; order; achieve; right,fact; woman; essentially; always; using; gain; advantage; legalizing; prostitution; essentially; setting; market; rate; woman; power; allowing; trade; resource; rate; want; effectively; end; woman; power; always; local; brothel; instead; slaving; away; wife; think; goal; rather; hard; achieve; constitutional; amendment; likely; needed; securing; right; able; bust; nut; would; make; infringing; right; bust; unconstitutional; closer; full; right,-1
reovd3,dbz19,thought; quote; john; green,,-1
ren7k7,toxicboyzrule,cheating; woman; cheating,,-1
rem872,socialskillszodiac,woman,,-1
reltoq,sciencekidlol,woman; passive; aggressive; resentful; mean; towards,,-1
reh7l5,planetbutts69,woman; kind; want; spend; rest; life,,-1
refet8,ToughAnswers,woman; think; parent; invest; money; future; child; likely; prefer; masculine; face,woman; preference; psypost; woman; think; parent; invest; money; future; child; likely; prefer; masculine; face; facial; masculinity; influenced; degree; investment; expects; future; child; grandfather; according; study; published; evolutionary; psychological; science; researcher; behind; study; suggest; masculine; face; perceived; le; likely; invest; child; higher; anticipated; investment; child; grandfather; offset; risk; selecting; masculine; partner; effect; mostly; woman; anticipated; father; would; invest; future; offspring; researcher; offered; alternative; explanation; masculine; tend; make; money; thus; woman; prefer; mate; look; like; father,-1
ree67j,The_LSD_Fairy,highly; polarized; relationship; sub; like; femaledatingstrategy; banned; mgtow; shown; stupid; problem; universal,,-1
rebx5d,rufinishedrudone,travel; find; partner,,-1
rebqpb,GenerationZ3RO,woman; standalone; change; mind,,-1
reauev,yoooooooooooodaddy,pornsick; actual; thing; alpha; widowed; real; considering; basically; thing,,-1
real3d,toxicboyzrule,woman; enemy,,-1
re90ue,petburiraja,victim,,-1
re8puh,AutoModerator,recipe; mega; thread,season; family; food; share; secret; family; recipe; holiday; favorite; please; join; discord; discord; ztcwgjchef; include; reddit; username; pill; color; gender; arrive; welcome; introduce; help; people; know; find; drgree; instagram; instagram; drgree; twitter; twitter; mrsdrgree; notification; good; thread; posted,-1
re89gu,Habits97,rotation,,-1
re7n9z,the-4th-survivor,question; incels; woman; want; tall; handsome; chad; explain; success; like; pete; davidson,,-1
re7ezw,throwaway9998785,offensive; call; someone; ugly,ugly; insult; word; descriptive; seems; like; people; woman; especially; love; beat; around; bush; come; calling; spade; spade; stuff; like; beauty; beholder; physical; appearance; make; someone; beautiful; call; people; ugly; wall; chair; ugly; okay; call; someone; ugly; hell; break; loose; saying; mean; spirited; honest; know; someone; ugly; know,-1
re757r,autistictheory,someone; dismissive; make; interested,specifically; someone; attracted; dismissive; dating; make; interested; wanting; meet; know; heard; people; always; people; nice; wonder; person; something; along; line; sort; reverse; psychology; whatever; personally; dismissive; think; like; decide; bother; simple; answer; question; please; know; thought; go; mind,-1
re74ed,realalexjean,telling; greatest; gift; give,effeminate; danger; society; rapist; school; shooter; attacker; woman; basement; dweller; telling; best; thing; help; endless; complaint; certain; type; unfair; life; woman; often; time; complaint; assume; right; woman; body; guarantee; either; really; shape; super; awkward; really; putting; woman; find; desirable; undesirable; woman; complain; nature; normal; natural; woman; complain; thing; thing; perfectly; normal; anyway; coddle; tell; fugg; something; positive; impact; life; effeminacy; worst; thing; modern; culture; respect; effeminate,-1
re6uyl,suar_z,male; baby; circumcised; without; consent,,-1
re6e47,skunkbear444,would; realistic; girl; bot; distributed; troubled; teen; boy; school; mass; shooting,,-1
re54ma,SciFiFanatic101,ugly; male; sometimes; flabbergasted; woman; take; interest,,-1
re3qe4,GridReXX,value; sexual; intimacy; form; intimacy,woman; close; female; friend; family; member; common; hear; especially; young; woman; comprehend; whole; need; outlook; literally; need; woman; average; woman; physiological; response; lack; tend; dopamine; serotonin; hit; general; level; satisfaction; mental; fulfillment; many; aspect; sexual; intimacy; emotional; intimacy; platonic; physical; affection; general; comfort; closeness; others; sense; bolded; would; still; feel; physiologically; dissatisfied; lack; sexual; intimacy; least; demonstrably; woman; woman; could; subsist; sexual; intimacy; longer; outside; physiological; aspect; seems; extreme; psychological; component; self; worth; associated; whatever; experience; entering; woman; vagina; orifice; post; inspired; comment; reddit; purplepilldebate; comment; follow; angry; truth; post; source; share; medium; name; iossmf; context; woman; understand; simply; experience; lack; sexual; intimacy; biology; body; drive; biological; imperative; woman; solipsism; allow; comprehend; going; sexless; different; ramification; individual; society; woman; going; sexless; anything; forced; given; woman; stfu; legalizing; prostitution; going; country; find; partner; woman; still; shame; precisely; like; telling; woman; postpartum; depression; deal; experience; child; born,-1
re1lhq,SeekerGreat20,angry,misunderstand; something; blame; someone; something; else; angry; getting; defensive; angry; rejected; mean; come; theory; everything; ultimately; grow; meet; better; people; stop; head; focus; tune; emotion; subreddit; people; getting; angry; failed; expectation; people,-1
re1hwr,AutoModerator,daily; community; chat; megathread,daily; thread; designed; place; funny; discussion; feel; free; post; topic; question; information; point; view; thread; post; everything; think; warrant; thread; socialising; comment; automatically; sorted; post; throughout; people; comment; like; previous; daily; thread; click; reddit; purplepilldebate; search; subreddit; apurplepilldebate; author; aautomoderator; daily; community; chat; megathread; restrict; sort; please; join; discord; discord; ztcwgjchef; include; reddit; username; pill; color; relationship; status; gender; introduce; find; instagram; instagram; drgree; twitter; twitter; mrsdrgree,-1
re17fn,Square_Inflation_534,mean; fragile; ego,fragile; comparative; word; steel; fragile; compared; superman; world; superman; steel; exists; steel; fragile; ego; called; fragile; comparative; understand; human; fragile; thing; manifest; differently; gender; ego; saying; woman; ego; thats; untrue; experience; woman; likely; feel; insecure; genitalia; much; likely; feel; insecure; body; saying; manifest; defence; much; higher; rate; woman; mean; guess; anger; defence; available; anger; woman; complain; judgement; either; thing; think; obviously; related; like; grew; always; learnt; rude; woman; yeah; maybe; someone; better; explain; thinking,-1
re0u34,joey-k7,inpleswithouthate; hate; suhreddit,remember; visiting; couple; time; looked; like; circlejerk; suicide; joke; inpcel; slang; lamentation; woman; throwing; hate; temper; tantrum; every; mean; could; wrong; cause; like; week; banned; seemed; like; inpcel; suhs; hateful; hateful; missed; mildly; dyslexic; sorry; messed; orthography,-1
rdz60s,Artistic_Guest4386,follow; angry; truth; post; virtue; signal; greater; good; actually; sexual; frustration,last; post; replying; something; along; line; angry; woman; speak; truth; right; woman; standard; high; alone; unhappy; woman; sexual; preference; perpetuate; toxic; society; dating; inequality; whatever; hell; mean; eill; lead; birth; rate; point; example; last; post; sexually; frustrated; undesired; woman; using; altruistic; reason; back; anger; never; angry; body; others; woman; allow; touch; allow; touch; therefore; angry; society; woman; future; generation; sexually; frustrated; attempting; justify; anger; faux; altruism; virtue; signalling,-1
rdxpux,DiabloTheDreamer,redemption,believe; order; thing; back; normal; baseline; especially; dating; concerned; dating; apps; shutdown; pill; flushed; system; exception; basically; every; website; dating; related; pill; related; shutdown; people; need; outside; learn; human; being; shutdown; last; atleast; year; everyone; always; worthy; intrinsic; value; settling; settiling; exist; concept; invented; bitterness; people; everyone; beautiful; ugly; everyone; deserves; need; regardless; mental; health; extreme; violent; case; need; removal; treatment; income; race; gender; skin; color; religious; belief; political; view; height; body; type; everyone; need; friend; deserves; friend; society; corporation; divived; selective; empathy; certain; people; everyone; deserve; fair; paycheck; month; regardless; education; experience; always; truth; better; someone; else; rich; playboy; bobby; walmart; people; eye,-1
rdx910,ogsimpology,woman; talking; male; friend; trying; trying; murder,woman; especially; woman; damn; surprised; male; friend; single; trying; sleep; usually; much; especially; single; desire; really; good; term; attractive; woman; happen; single; year; friend; shoot; shot; relationship; come; friendship; weird; tried; chance; anything; evil; stab; tried; take; relationship; notch; flop; least; tried; surprise; lady; attractive; friend; trying; fuck; fall; relationship; make; clear; attracted; fair; game,-1
rdwxpz,Wobblewobblegobble,woman; really; scout; option; ending; relationship,common; belief; among; every; woman; usually; couple; backup; suitor; available; decides; leaf; belief; woman; leave; relationship; know; sure; another; willing; commit; belief; truly; base; right; nose,-1
