post_id,author,title,body,image
nmhjzq,aquamanouttawater,continue; suffer; silence; long; woman; prioritize; confidence; emotional; openness,seen; article; toxic; masculinity; taking; blame; male; insecurity; suicide; rate; body; denying; expecting; constantly; masculine; toxic; nobody; want; address; elephant; room; main; reason; straight; open; woman; woman; turned; male; insecurity; seen; time; time; woman; want; open; loses; respect; dump; since; straight; want; maintain; ability; relationship; stuck; true; self; fitting; small; masculinity; thats; expected,-1
nmg3nj,lunafox999,expect; woman; attracted; aspiration; nothing; going; life,want; mean; want; truthful; honest; personal; experience; life; ever; attracted; guy; something; going; life; aspiration; personality; fell; head; heel; high; school; loved; animal; mean; would; post; constantly; wood; find; snake; wanted; future; career; involve; animal; literally; thought; attractive; thing; ever; depth; goal; dream; spiritualism; learning; universe; literally; fell; want; shame; nothing; going; life; dream; goal; twitter; night; everyone; like; frankly; find; pathetic; like; expect; healthy; relationship; shit; together; saying; look; dont; matter; never; ever; date; someone; find; attractive; expect; either; telling; guy; personal; experience; without; depth; dream; goal; unattractive,-1
nmf7xz,castlebasetone,imagine; slept; woman; rejected; rest,,-1
nme3ov,virtualprotest,precipice; drastic; change; society; could; done; make; thing; better,genuenly; think; pivotal; point; society; previous; behaviour; role; responsibility; many; thing; drastically; shift; towards; neutral; perspective; allowing; individual; freedom; find; healthier; support; rather; role; created; long; time; idea; control; manipulate; punish; anyone; anything; rather; writing; book; teach; thing; think; need; change; regardless; gender; effect; next; generation; would; grow; physically; emotionally; mentally; healthier; generation,-1
nmdnfj,EffectiveBlackCat,female; porn; actress; unrealistic; beauty; standard; woman; true,,-1
nmcftv,WeAreTheAggies,standard; side,standard; frequent; topic; discussion; wanted; flip; script; normally; user; talk; standard; opposite; reasonable; standard; considered; desirable; side; example; standard; financially; stable; holding; support; little; extra; track; record; violence; criminality; reasonably; attractive; slob; practice; good; hygiene; proper; grooming; coherent; style; instead; shirt; jean; life; brain; something; interesting; useful; enjoying; video; game; fine; throwing; time; nothing; show; least; reasonable; conversation; skill; probably; going; hold; back; including; defense; though; medical; condition; known; engineering; degree; cause; seizure; exposed; small; talk,-1
nmb2f3,FuuraKafu,woman; wonderful; effect; largely; maintained; woman,wikipedia; article; woman; wonderful; effect; phenomenon; found; psychological; sociological; research; suggests; people; associate; positive; attribute; woman; compared; positive; general; evaluation; woman; might; derive; association; woman; nurturing; characteristic; bias; suggested; form; misandry; benevolent; misogyny; come; discussion; modern; gender; role; existence; woman; present; society; clear; straightforward; list; general; toxicity; regard; include; inceldom; simping; niceguys; manipulative; pickup; artist; bully; catcalling; rape; misogyny; color; writing; woman; toxic; porn; question; come; woman; existing; society; general; list; toxicity; made; thats; actually; comparable; significance; list; associated; male; toxicity; people; tried; making; list; experience; reception; woman; bail; something; like; thats; either; true; insignificant; heck; woman; quick; come; womenhood; discussion; experience; conclusion; role; toxic; femininity; quite; downplayed; simple; thats; case; mean; woman; collectively; le; likely; admit; part; woman; actually; factually; decent; people; generally; speaking; dont; possible; woman; decent; morally; better; next; nothing; negative; attributed; societal; level; actually; worth; discussing; reframing; woman; normal; doesnt; really; mean; anything; since; woman; relative; woman; compared; woman; le; toxic; decent; essentially; context; case; woman; wonderful; effect; form; sexism; literally; truth; woman; actually; better; woman; quite; literally; wonderful; woman; downplaying; toxic; femininity; either; case; existence; woman; wonderful; effect; largely; attributed; woman; weird; cause; mostly; woman; complaining; rolling; manner,-1
nma2z9,infps,chose; live; depressed; drunk; generally; pita; flat; happy; easy,living; regular; emotional; wreck; get; drunk; every; outing; start; argument; generally; kinda; shitty; deal; great; body; slightly; skinny; truly; pretty; face; without; makeup; great; hair; friend; jealous; sometimes; give; head; tingle; warm; smile; wonderful; around; treat; friend; nicely; choice; remember; definition; quite; average; woman; bonus; believe; guy; really; want,-1
nm9qjc,Kontynt,question; woman; believe; expect; woman; long; term; dating; life; partner; bring; table,,-1
nm95os,AFOQTNewbie,take; second; think; crazy; sexual; attraction,isnt; interesting; someone; look; someone; feeling; attraction; someone; else; feel; nothing; looking; person; know; seems; obvious; straight; think; woman; attractive; cant; appeal; however; woman; clearly; woman; find; appealing; conversation; male; friend; mine; drunk; asked; would; woman; said; stunned; since; find; woman; beautiful; ever; think; woman; think; woman; beautiful; thought; process; could; find; woman; attractive; sure; made; sense; hope; point,-1
nm8xnq,Upstairs_Activity399,trauma; rape; caused; society; extent,,-1
nm8psf,JustFactsBitches,lack; feeling; like; genetic; defect; depresses,claim; depressed; getting; enough; deeper; issue; feeling; like; genetic; dead; beyond; shameless; virtue; signalling; woman; actually; kind; pretending; personality; play; large; part; sexual; selection; process; typically; emotional; feel; hopelessness; many; situation; feel; offer; strategy; retain; hope; although; easy; completely; change; personality; woman; find; attractive; would; argue; impossible; strong; introvert; autistic; adjusting; behaviour; still; something; attempt; small; bite; every; holding; onto; hope; better; future; could; argue; false; hope; cruel; feed; fantasy; false; hope; help; avoid; offing; think; best; physical; deal; breaker; woman; apply; hand; largely; encoded; birth; short; unless; parent; pump; full; young; probably; going; struggle; ugly; overweight; sure; plastic; surgery; expensive; always; successful; weak; supplicating; subject; surgery; appease; shallow; standard; woman; really; respect; however; entitled; standard; woman; plus; diet; exercise; help; lose; weight; people; seem; full; normal; portion; failing; neurological; switch; brain; appear; congenitally; lazy; pathological; degree; basic; genetic; drive; straight; reproduce; woman; find; attractive; woman; find; attractive; find; physically; repulsive; sense; hopelessness; despair; creep; difficult; suppress; feeling; drive; depression; believe; similar; passing; depression; phase; stage; grief; experiencing; phase; hold; acceptance; next; although; cosmic; unfairness; always; remain; true; learn; care; much; focus; part; life; effort; appreciated; rewarded; forget; manage; wildly; successful; endeavour; beyond; woman; surely; couple; show; finish; line; looking; cash,-1
nm7pnf,rivetcitymayor,terrible; personality; woman; talk,sure; everyone; heard; phrase; like; personality; personality; turning; work; personality; list; go; thing; guy; horrendous; personality; honestly; meet; time; maybe; people; would; insufferable; sort; personality; issue; guy; meet; decent; normal; cool; dude; hold; convo; perfectly; fine; guy; cause; rarely; meet,-1
nm614g,czerdec,think; cell; need; divide; reproduction; division; desire; cell; need,think; cell; need; divide; something; need; make; sense; think; multicellular; specie; maintain; existence; susan; need; gene; fact; continued; existence; susan; gene; highly; dependent; essentially; impossible; susan; gene; make; year; unless; sexual; activity; happens; sexual; activity; happen; susan; gene; make; unlikely; human; race; would; maintain; susan; bloodline; generation; artificial; insemination; susan; gene; want; perpetuate; need; happen; divorcing; individual; specie; minimize; eliminate; fact; member; specie; reproduces; sexually; utterly; dependent; people; sexual; reproduction; must; happen; else; disaster; likely; least; entire; population; lost; culture; around; world; regard; complete; disappearance; whole; people; event; wish; avoid; tragedy; people; dying; sexual; reproduction; efficient; prevent; disaster,-1
nm6084,LillthOfBabylon,people; complain; unequal; income; gender; take; account; unequal; childcare,sjws; manosphere; complaining; wage; face; value; sjws; belief; patriarchy; oppressing; western; woman; mgtow; pilled; type; belief; woman; hypergamous; leech; overtaxed; neither; group; realize; woman; still; main; caretaker; child; americanprogress; issue; woman; report; unequal; division; labor; another; thing; notice; manosphere; sjws; seem; deeply; hate; child; best; ignore; existence; child; seems; alot; married; couple; prefer; division; labor; psypost; study; suggests; woman; actually; prefer; split; household; childcare; task; equally; participant; asked; indicate; along; scale; whether; would; prefer; breadwinner; within; partnership; homemaker; share; role; equally; across; sample; although; woman; chose; egalitarian; option; woman; chose; response; closer; toward; homemaker; chose; response; closer; toward; breadwinner,-1
nm4hag,SowClips,confused; make; woman; standard; unreasonable,thought; exchange; narniafox; genzeded; post; reddit; purplepilldebate; comment; comment; woman; bring; table; regarding; relationship; want; bring; table; narniafox; wrote; wanted; partner; similar; value; homophobe; misogynist; lifer; racist; deeply; religious; care; environment; clean; criminal; record; similar; plan; inspiration; least; similar; hobby; interest; interest; least; kind; like; pet; want; plan; future; work; fulfilling; financially; stable; support; lifestyle; find; sexually; attractive; similar; kink; value; pleasure; good; communication; make; compromise; emotionally; stable; touch; feeling; show; vulnerability; vulnerable; good; mood; often; opposite; supportive; honest; caring; attentive; act; according; moral; patient; quirk; irritated; easily; okayish; family; parent; would; preferable; necessarily; list; seem; reasonable; enough; poster; like; genzeded; disagreed; writing; right; gentleman; close; majority; woman; generation; alone; assuming; find; encompassing; quality; think; option; available; said; hypothetical; settle; attractive; submissive; feminine; woman; open; dating; bring; table; settle; woman; ultimately; unless; commenter; woman; physical; attractiveness; chance; slim; hvm; ignore; dozen; settle; eventually; unless; significantly; better; looking; woman; disney; perfect; build; delusion; fade; either; single; grave; settle; nice; whole; need; meet; standard; schtick; crazy; woman; list; majority; still; raggedy; single; mom; divorcee; woman; broad; whip; point; checklist; deserve; couple; minute; point; offer; half; offended; thought; making; sandwich; paying; dinner; talking; much; one; business; relationship; others; wrote; find; list; unreasonable; anyways; thought; going; crazy; reading; reply; nothing; list; struck; unreasonable; obvious; disagree; mean; woman; unreasonable; standard,-1
nm4gs6,jhon30re,legalized; prostitution,,-1
nm3qse,Noone_else_is_honest,objectively; beautiful; dating; rule; apply; differently,,-1
nm351r,majani,hypergamy; polygamy; fantasy; assortative; mating; reality,vast; majority; would; polygamous; woman; type; throwing; without; playing; mind; game; vast; majority; woman; would; hardcore; hypergamous; monkey; branchers; type; offering; genuine; commitment; left; right; however; life; happens; get; people; actualizing; ideal; fantasy; therefore; vast; majority; people; including; woman; claim; superior; game; knowledge; opposite; eventually; partner; equal; match; kindness; politeness; partner; people; rationalize; situation; optimal; genie; bottle; gave; chance; people; would; mentioned; fantasy; true; purple; pill,-1
nm2lqs,Noone_else_is_honest,fairly; unpopular; unpopularopinion; thought,,-1
nm1mao,sniper1905,opinion; couple; therapy; true; phony,couple; therapy; option; people; take; quick; google; search; many; study; showing; effectiveness; rate; couple; therapy; however; believe; many; argue; couple; therapy; mean; refer; back; iron; rule; tomassi; always; time; effort; better; spent; developing; fresh; prospective; woman; ever; attempting; reconstruct; failed; relationship; guy; gal; take; something; couple; whether; relationship; relationship; salvageable; point,-1
nlz681,Inevitable_Gain_7456,incel; older; woman; meet; priority,,-1
nlylyu,EffectiveBlackCat,slim; woman; average; face; considered; good; looking; slim; buff; average; face,,-1
nlyjjb,ChibsFilipTelfordd,discussion; threshold; failure; either; gender,curious; think; dating; fails; possible; like; scientific; evidence; beyond; personal; anecdote; interested; option; either; point; ugly; woman; find; attractive; attracted; point; woman; ugly; find; attractive; commit; point; ugly; woman; regardless; attraction; vice; versa; woman; specific; characteristic; define; point; gender; physical; include; behavior; inclined; think; blackpillers; behaving; chance; ruined; begin; characteristic; important; improveable; one; like; weight; improveable; one; like; height; curious; people; think; standard; inclined; believe; gender; high; standard; compared; attractiveness; level; think; woman; become; objective,-1
nlwlvb,jfjgjjgjgkgkkgkhlhl,sometimes; social; medium; whole; seems; really; wack; real; life,,-1
nlw4iv,Laytheblameonluck,would; happen; society; everyone; wear; knee; dress,government; launch; decree; bunch; child; going; treat; like; child; returning; school; uniform; style; uniform; unisex; uniform; required; uniform; conservative; dress; knee; dress; hide; figure; body; dress; cover; arm; sock; cover; skin; knee; dress; code; designed; tell; gender; another; without; great; difficulty; decree; made; increased; report; woman; feeling; unsafe; society; enforce; equity; outcome; regarding; look; beauty; dress; code; able; single; woman; harrass; woman; equal; footing; regarding; look; beauty; woman; treated; like; treated; like; woman; however; dress; code; policed; spot; fine; enforced; street; instagram; would; reply; various; segment; society; regarding,-1
nltxma,Danielcraigboston1,people; racial; ethnic; preference; dating; habit,,-1
nlt86b,kundalinxi,agree; matter; favored; pill; gender; theory; lying; dishonesty; simply; okay,post; dating; fair; okay; woman; want; string; along; like; point; fair; enough; decent; human; others; intention; want; norm; standard; everyone; like; matter; context; unless; protecting; somehow; actually; controversial; mess; people; emotion; livelihood; like; go; wanting; real; relationship; cheater; gold; digger; upfront; trick; believing; love; woman; string; along; people; catfish; like; honest; upfront; want; dating; would; much; better; everyone; straightforward; desire; woman; le; likely; sleep; care; le; likely; want; mostly; entirely; money; fucking; twat; obviously; people; regardless; agree,-1
nlr0p5,SuspiciousLeopard662,woman; file; majority; divorce; regardless; country; culture; think,known; west; woman; initiate; divorce; curious; uniquely; western; phenomenon; digging; came; across; interesting; article; divorce; china; stat; around; percent; first; hearing; divorce; case; filed; woman; according; report; china; supreme; people; court; nbcnews; news; ncna; digging; found; stats; country; showing; similar; number; divorce; filed; woman; stat; poland; europa; eurostat; statistic; explained; index; title; archive; marriage; birth; poland; constantly; case; woman; filed; divorce; singapore; jstor; stable; divorce; case; initiated; woman; filing; iran; justice; eoir; page; file; download; divorce; take; place; first; year; marriage; initiated; woman; brazil; plataformamedia; divorce; increased; pandemic; brazil; request; made; woman; famp; lawyer; say; divorce; application; initiated; woman; frequent; complaint; work; overload; indonesia; book; google; book; wlodwaaqbaj; divorce; initiated; newbks; newbks; redir; source; mobile; search; ahukewi; ztwgmejwahwiqc; khqy; cpqq; aewaxoecaqqaw; currently; divorce; case; decided; indonesia; islamic; court; initiated; wife; think; guy; point; every; country; point; interesting; trend; majority; divorce; across; different; culture; filed; woman; seem; western; phenomenon; research; looked; country; listed; able; find; country; one; file; majority; divorce; think; theory; woman; regardless; likely; relationship; marriage,-1
nlpotx,rivertorain-,emotional; tampon; inherent; true; friendship,significant; amount; think; woman; emotional; tampon; urban; dictionary; defines; emotional; tampon; multiple; way; simplest; listens; woman; problem; never; get; yeah; people; call; friend; friend; someone; listens; problem; without; underlying; agenda; like; expecting; woman; telling; relationship; trouble; emotional; tampon; friend; hoping; reciprocate; share; ultimately; trying; connect; another; human,-1
nloxlm,RDelbson,addendum; cooking; cleaning; fucking; post; original; part; posted; exactly; looking; part,,-1
nloxiy,RDelbson,feel; loved; wife; cooking; cleaning; sexist; misogynist; rapist; furthermore; entitled; view; apologize; anyone; part; continuation; last; week; post,last; week; posted; thread; reddit; purplepilldebate; comment; ngjpxb; woman; allowed; define; loving; opinion; nerve; topic; mind; long; time; felt; frustrated; wronged; many; people; elsewhere; effort; voice; heard; wrote; post; whim; spending; le; minute; total; writing; without; caring; revise; admittedly; caused; issue; would; like; assure; reader; spent; significantly; time; post; revised; heavily; posting; written; third; thread; explaining; detail; meant; different; thing; brought; last; week; thread; encourage; people; take; look; since; help; better; understand; full; scope; argument; received; many; response; many; woman; engaged; debate; good; faith; maybe; insightful; comment; appreciate; think; deeply; issue; however; expected; many; woman; responded; consistently; called; name; insulted; downvoted; comment; response; quite; ironic; given; downvoting; allowed; subreddit; many; response; implicit; assumption; reason; wrong; wife; cook; clean; fuck; topic; previous; post; sexist; example; comment; accuse; lying; called; sexist; reddit; purplepilldebate; comment; ngjpxb; woman; allowed; define; loving; gyrbsd; imgur; gbxar; wanted; punish; woman; reddit; purplepilldebate; comment; ngjpxb; woman; allowed; define; loving; gyrkbxt; imgur; rsrxwx; misogynist; reddit; purplepilldebate; comment; ngjpxb; woman; allowed; define; loving; imgur; jgqfr; wanted; enslave; woman; reddit; purplepilldebate; comment; ngjpxb; woman; allowed; define; loving; imgur; kduqa; wanted; hooker; maid; reddit; purplepilldebate; comment; ngjpxb; woman; allowed; define; loving; gyre; rapist; reddit; purplepilldebate; comment; ngjpxb; woman; allowed; define; loving; gysa; imgur; fegp; twice; second; time; mod; sanitized; thread; mod; willing; admit; called; rapist; reddit; purplepilldebate; comment; ngjpxb; woman; allowed; define; loving; finally; told; need; disgusting; unclean; act; performed; link; comment; thread; reddit; purplepilldebate; comment; ngjpxb; woman; allowed; define; loving; gyrxmkn; imgur; ffnt; imgur; tdqv; given; majority; comment; vein; small; handful; decided; showcase; community; fail; change; view; pushed; right; entrenched; belief; maintain; allowed; define; relationship; term; want; define; feeling; loved; wife; cooking; cleaning; fucking; allowed; lastly; tactic; calling; name; insult; ineffective; believe; warranted; post; explicates; statement; expounds; upon; original; post; first; statement; following; feel; loved; wife; cooking; cleaning; sexist; misogynist; rapist; furthermore; forced; endure; humiliating; act; wife; name; equality; therefore; believe; majority; comment; received; previous; thread; invalid; since; predicated; assumption; sexist; misogynist; rapist; wanting; wife; cook; clean; fuck; addition; based; response; posit; following; statement; unless; relationship; preference; line; woman; relationship; preference; feminine; imperative; broadly; woman; sexist; misandrist; toward; refuse; acknowledge; entitled; preference; aligned; feminine; imperative; furthermore; woman; shame; define; purpose; post; feminine; imperative; finding; multiple; acquire; sperm; child; resource; stable; life; caveman; day; would; literally; food; shelter; usually; money; enriching; happiness; thing; toxic; relationship; woman; right; want; thing; whenever; others; make; mention; want; thing; like; youth; chastity; least; sexual; fidelity; support; wish; fulfill; male; imperative; woman; roll; eye; angry; like; refuse; acknowledge; want; thing; different; woman; want,-1
nlobon,OddAlternatives,south; wale; australia; adopts; affirmative; consent; law,affirmative; consent; theconversation; ampproject; theconversation; adopts; affirmative; consent; sexual; assault; law; mean; usqp; aqhkafqarabia; referrer; fwww; google; ampshare; ftheconversation; fnsw; adopts; affirmative; consent; sexual; assault; law; mean; mean; consent; actively; sought; actively; communicated; approach; shift; mean; standard; mean; individual; seeking; another; person; must; obtain; clear; expressed; consent; engaging; sexual; seems; become; norm; college; campus; guideline; knowledge; first; time; thing; made; bill; requires; person; seeking; raise; defence; reasonable; belief; consent; must; demonstrate; action; took; word; spoke; ensure; consent; failure; something; take; step; ascertain; consent; mean; belief; consent; reasonable; sound; said; said; asked; might; impact; people; date; place; similar; law; enacted; linked; article; take; position; positive; development; might; pro; con; would; hypothetical; next; step; legislating; matter; final; frontier,-1
nlnief,ZealousidealEbb860,attraction; wealth; status; depend; location; based,,-1
nlmit1,usedtimecapsule,black; pill; right; wrong,,-1
nlm5mh,Danielcraigboston1,female; celebrity; find; absolutely; stunning,,-1
nlm1w6,OldSimpsonsisbetter,incentive; kind; respectful; gentleman; modern; western; society,,-1
nllycv,Good-Strong,important; relationship; actually,something; wondering; seems; like; perfect; place; understand; question; pretty; vague; elaborate; important; sexual; compatibility; good; bedroom; skill; relative; quality; look; personality; family; background; finance; future; plan; potential; long; term; partner; important; regular; important; sexually; open; adventurous; related; slightly; different; note; important; body; count; likelihood; feeling; like; ending; relationship; cheating; factor; compared; others; interested; hear; guy,-1
nljdo9,LetsDelveIntoIt,woman; feel; pay; date; relationship; phase; decision; impact,woman; strategy; lack; better; word; first; date; would; always; offer; least; split; check; knew; second; date; interested; almost; always; insist; picking; whole; least; split; knew; wanted; second; date; strongly; offer; either; pick; whole; least; split; check; insists; paying; confidently; tell; next; proceed; second; date; experience; first; date; guy; insisted; picking; whole; first; date; ended; second; date; would; pick; would; super; appreciative; across; board; guy; scenario; seemed; walk; away; good; impression; offer; split; feel; emasculated; think; scenario,-1
nlijj6,Captslackbladder,asking; right; important; asking; right; question,,-1
nlheip,Luciansleep,woman; purple; pill; debate; thing; agree; pill; perspective; thing; agree,,-1
nlgpz6,infps,default; woman; attractive; want; bang; probably; applies; thirty,title; basically; hormone; drive; sense; need; still; quite; active; interested; healthy; year; peer; looking; anything; booby; thing; least; ltrs; girlfriend; along; many; married; twice; know; down; romance; live; people; woman; experienced; default; perhaps; true; point; still; healthy; still; like; woman; interesting; exciting; worth; time; willing; prostitute; popular; past; certain; largely; juice; worth; squeeze; woman; sure; female; perspective; another; noticing; sometimes; business; associate; around; atlanta; load; woman; lot; summer; skin; attempt; attention; one; feel; actual; pull; interest; spark; rare,-1
nlfgus,Correct_Leek_1875,woman; view; messed,upfront; sexuality; thing; treating; something; empowering; another; thing; especially; sexual; need; point; sexual; looking; pleasure; like; every; woman; know; think; sexual; mindset; worker; meet; somebody; else; need; woman; conditioned; long; asset; object; internet; understand; body; woman; still; think; feel; horny; experience; sexual; gratification; conditioned; long; longer; excuse; furthermore; mindset; sexual; harassed; victim; anyone; else; anything; understand; mindset; last; thing; would; want; assaulted; would; disgust; want; seek; sexual; pleasure; expense; mine,-1
nlerl5,StrangeMemory600,temprance; society; moderate; ramble,,-1
nlbbsq,DarioTheCabanaBoy,woman; absolutely; nothing; offer,,-1
