post_id,author,title,body,image
rij9rb,ForMyAngstyNonsense,understanding,reading; recent; post; link; part; handbook; reddit; femaledatingstrategy; comment; fayax; high; maintenance; ultimate; selfdefense; source; share; medium; name; iossmf; nature; kind; crystalized; post; basically; try; high; maintenance; actually; good; thing; woman; high; maintenance; mean; demanding; worth; kind; go; rail; place; gist; calling; someone; high; maintenance; criticism; mean; think; require; much; work; demanding; however; consider; source; someone; call; someone; high; maintenance; could; unwilling; much; work; thinking; really; clarify; whole; repetition; message; demand; backed; repeated; example; terrible; biased; article; essentially; real; dating; strategy; good; advice; maybe; dating; lazy; inconsiderate; want; demeaning; clearly; demanding; call; high; maintenance; would; right; calling; asshole; woman; going; relationship; breakup; receive; validation; valid; demand; real; value; woman; treated; poorly; hand; many; woman; unrealistic; expectation; partnership; woman; expect; work; earn; romance; listen; ever; would; believing; ineffable; queen; blessed; presence; tell; somehow; worth; look; definition; hvm; value; reddit; femaledatingstrategy; comment; paying; date; example; hvw; value; woman; reddit; femaledatingstrategy; comment; rcqu; trait; desirable; woman; clear; trait; different; hvm; value; helpful; service; hvw; value; woman; inexorable; ruler; naturally; demand; high; maintenance; advice; poisonous; woman; second; grouping; rare; might; sign; live; life; slavish; devotion; vast; majority; initial; dating; biased; towards; woman; often; impress; time; becomes; clear; entering; partnership; equal; bounce; woman; unreasonable; expectation; likely; find; lonely; long; called; high; maintenance; expecting; boyfriend; remember; birthday; asshole; called; high; maintenance; people; excepting; similar; female; friend; probably; woman; negative; experience; first; group; negative; experience; dealing; second; group; hence; different; reaction; anywho; crazy; comment; discussion; welcome; particularly; woman; polarized; reaction; coda; find; revealing; much; manosphere; anti; hate; porn; worker; casual; anything; manosphere; people; judge; woman; body; count; good; wonderful; requires; intimacy; something; group; seem; incapable,-1
rij0oa,ForMyAngstyNonsense,understanding,reading; recent; post; link; part; handbook; reddit; femaledatingstrategy; comment; fayax; high; maintenance; ultimate; selfdefense; source; share; medium; name; iossmf; nature; kind; crystalized; post; basically; try; high; maintenance; actually; good; thing; woman; high; maintenance; mean; demanding; worth; kind; go; rail; place; gist; calling; someone; high; maintenance; criticism; mean; think; require; much; work; demanding; however; consider; source; someone; call; someone; high; maintenance; could; unwilling; much; work; thinking; really; clarify; whole; repetition; message; demand; backed; repeated; example; terrible; biased; article; good; advice; maybe; dating; lazy; inconsiderate; want; demeaning; clearly; demanding; call; high; maintenance; would; right; calling; asshole; woman; going; relationship; breakup; receive; validation; valid; demand; real; value; woman; treated; poorly; hand; many; woman; unrealistic; expectation; partnership; woman; expect; work; earn; romance; listen; ever; would; believing; ineffable; queen; blessed; presence; tell; somehow; worth; look; definition; hvm; value; reddit; femaledatingstrategy; comment; paying; date; example; hvw; value; woman; reddit; femaledatingstrategy; comment; rcqu; trait; desirable; woman; clear; trait; different; hvm; value; helpful; service; hvw; value; woman; inexorable; ruler; naturally; demand; high; maintenance; advice; poisonous; woman; second; grouping; rare; might; sign; live; life; slavish; devotion; exactly; common; vast; majority; interested; initial; dating; biased; towards; woman; often; impress; time; becomes; clear; entering; partnership; equal; bounce; woman; expectation; likely; find; lonely; long; called; high; maintenance; expecting; boyfriend; remember; birthday; asshole; called; high; maintenance; people; excepting; similar; female; friend; probably; woman; negative; experience; first; group; negative; experience; dealing; second; group; hence; different; reaction; anywho; crazy; comment; discussion; welcome; particularly; woman; polarized; reaction; coda; find; revealing; much; manosphere; anti; hate; porn; worker; casual; anything; manosphere; people; judge; woman; body; count; good; wonderful; requires; intimacy; something; group; seem; incapable,-1
rihifu,mbrseb,chad; give; orgasm,,-1
riafgc,Divine_Chariot,feminist; never; anything; issue,,-1
ri93ey,Glarkin42,best; place; live; single,,-1
ri91d2,analina21,name; camila,,-1
ri8obx,emiiinlu,body; count,,-1
ri7jko,Big_Hearing6536,envy; white,,-1
ri6o0h,ErenYeagerwasright,extreme; censorship,,-1
ri6nzq,MyLife142,deepest; desire; want; woman; know,,-1
ri6fca,Spread-Em-Plz,common; think; actual; game,mainly; question; people; think; important; perspective; everyone; general; bullshit; semantics; prefer; word; flirting; banter; game; insert; whichever; word; point; know; mean; felt; need; clarify; type; people; would; nitpick; question; simple; get; based; observation; people; hear; good; think; game; guy; question; within; woman; would; game; tried; flirt; specifically; story; particularly; shitty; particularly; good; flirting; game; tell; good; think; game; much; difference; think; demographic; make; would; game; need; work; zone; better; average; dude; game; zone; downright; terrible; nonexistent; personally; guess; little; game; exactly; nonexistent; average; flirt; barely; enough; luck; relationship; nonexistent; game; seem; becoming; common; thing; furthermore; better; game; lower; socioeconomic; circle; middle; class; circle; anyone; worked; kitchen; tell; guy; opinion,-1
ri6139,ErenYeagerwasright,creating; normal; return; traditionalism,,-1
ri4kf3,RandomRedditGuy322,society; fooled; convincing; somehow; winner; ultimately; settled; aging; woman,think; heard; something; like; life; care; whether; ignored; young; marriage; kid; winner; mod; former; post; clarifying; exactly; getting; idea; inserting; explanation; mainly; lady; inform; know; told; time; society; especially; unattractive; young; instead; removing; post; explaining; speak; validate; experience; worry; woman; ready; time; come; sentiment; common; male; experience; society; attempt; brainwash; culture; washed; aging; woman; prize; honor; marrying; child; pursue; feel; like; winner; ending; complete; utter; nonsense; definition; described; winning; want; know; winning; winning; buying; lucky; lotto; ticket; getting; winning; going; gameshow; winning; want; know; winning; getting; marry; girl; already; plowed; dude; realizes; beginning; literally; settling; realized; prime; ended; window; child; rapidly; closing; word; looking; meal; ticket; case; single; male; winning; anything; receiving; leftover; alpha; fact; aging; woman; winning; receiving; free; insurance; policy; form; marriage; legally; protects; financially; giving; child; protect; retirement; get; nothing; get; settled; aging; woman; option; fertility; look; window; close; would; better; dedicating; resource; wanted; child; simply; surrogate; keep; resource; within; family; need; complete; loser; taking; leftover; gynocentric; society; think; cultural; level; would; disastrous; woman; looking; settle; equation; focus; real; winning; look; like,-1
ri4553,jayval90,lost; voice; modern; gadget,mean; literally; figuratively; growing; millennial; noticed; seemed; widening; disconnect; power; woman; create; desire; verse; power; woman; create; desire; especially; true; generation; beyond; generation; group; first; communicate; primarily; textual; communication; wondering; correlation; generation; struggle; cultivate; mutual; attraction; example; young; generation; especially; one; likely; sexually; frustrated; later; normally; girl; strike; home; start; texting; conversation; rarely; go; guy; causing; amount; discouragement; feeling; powerlessness; think; primarily; cultivate; attraction; woman; text; messaging; leave; greatest; asset; table; audible; voice; obviously; everyone; drop; dead; attractive; voice; would; distribution; woman; positively; responding; average; voice; closely; mirror; average; woman; physique; plus; guy; practice; else; fails; whispering; curious; people; think; woman; anyone; experience; back; contradict; figuring; good; voice; tone; inflection; roughly; equivalent; woman; putting; flattering; outfit; term; attraction; could; guy; land; girl; like; making; effort; speak; audibly; often; rather; solely; text,-1
ri3puv,Square_Inflation_534,assume; relationship; said; rather; casual,thread; earlier; linked; another; thread; dating; advice; talking; fwbs; take; date; act; chivalrous; towards; went; pussy; eating; comment; sub; saying; leading; saying; want; situation; would; holding; hand; going; date; change; mind; genuinely; thing; slightly; incompatible; situation; maybe; plate; put; literally; word; friend; much; sure; bring; stop; realistically; fault; hate; give; cause; think; bitter; femcels; seems; understand; entitled; relationship; sold; dream; dishonest; yeah; fault; fuckboi; totally; honest; smoking,-1
ri2kq9,jayval90,lost; voice; modern; gadget,mean; literally; figuratively; growing; millennial; noticed; seemed; widening; disconnect; power; woman; create; desire; verse; power; woman; create; desire; especially; true; generation; beyond; generation; group; first; communicate; primarily; textual; communication; wondering; correlation; generation; struggle; cultivate; mutual; attraction; example; young; generation; especially; one; likely; turn; incel; later; normally; girl; strike; home; start; texting; conversation; rarely; go; guy; causing; amount; discouragement; feeling; powerlessness; think; primarily; cultivate; attraction; woman; text; messaging; leave; greatest; asset; table; audible; voice; obviously; everyone; drop; dead; attractive; voice; would; distribution; woman; positively; responding; average; voice; closely; mirror; average; woman; physique; plus; guy; practice; else; fails; whispering; curious; people; think; woman; anyone; experience; back; contradict; figuring; good; voice; tone; inflection; roughly; equivalent; woman; putting; flattering; outfit; term; attraction; could; guy; land; girl; like; making; effort; speak; audibly; often; rather; solely; text,-1
ri2jv9,throwawaylessons103,would; choose; option; chad; youth; wall; similar; woman,,-1
ri1m10,FabulousFuchsbau,le; self; improvement; knowing; worth; getting; back; every; every; woman; existence,alright; play; hardball; many; joined; learn; better; avoid; fuckboys; player; abuser; many; actual; became; pill; wanted; improve; live; better; life; avoid; digger; baby; mama; many; fdsers; really; human; being; many; pillers; really; woman; human; being; many; emulate; behavior; people; deem; toxic; frame; something; positive; know; mean; cheat; make; partner; crazy; show; affection; ideology; said; make; woman; weak; never; help; partner; gift; woman; feel; honored; presence; getting; genuine; love; affection; getting; desperation; someone; see; something; wrong; trying; save; salvage; relationship; think; failing; often; know; relationship; wife; husband; girlfriend; boyfriend; immature; actually; communicate; hence; dread; game; tactic; pill; preaches; fdsers; practice; torment; someone; claim; love; empowered; woman; alpha-male; male; another; mill; asshole; bitch; primary; motive; wanting; change; emulate; abuser; person; broke; heart; exact; thing; people; really; different; person; hurt; truth; faith,-1
ri1fta,thoshettjt,woman; find; boyfriend; treated; better,disclose; boyfriend; relationship; fine; snoop; social; medium; find; picture; vacation; paris; sappiest; romantic; caption; imagine; tell; expensive; boring; stupid; trip; much; regret; time; money; spent; tell; used; live; house; rent; free; helped; student; loan; gift; made; interesting; date; went; flower; bought; poem; wrote; dime; cheated; abused; badly; broke; tell; different; time; life; stupid; grown; anymore; tell; love; see; potential; want; equal; partner; none; thing; stated; considerably; le; damn; paying; anyone; tuition; anytime; soon; sappy; facebook; post; gone; past; past; entitled; boyfriend; effort; edit; like,-1
ri0s2t,mods-here-suck,folk; like; complain,,-1
ri055j,idrinkapplejuice42,woman; expects; meal; paid; first; date; expect; cook; meal; second; date,,-1
rhzvmh,Y615,city; writer; say; dating; apps; killed; casual; much; easier; could; meet; supermarket; right,,-1
rhysjh,AutoModerator,daily; community; chat; megathread,daily; thread; designed; place; funny; discussion; feel; free; post; topic; question; information; point; view; thread; post; everything; think; warrant; thread; socialising; comment; automatically; sorted; post; throughout; people; comment; like; previous; daily; thread; click; reddit; purplepilldebate; search; subreddit; apurplepilldebate; author; aautomoderator; daily; community; chat; megathread; restrict; sort; please; join; discord; discord; ztcwgjchef; include; reddit; username; pill; color; relationship; status; gender; introduce; find; instagram; instagram; drgree; twitter; twitter; mrsdrgree,-1
rhy8od,DaMilan,totally; different; reaction; towards; dual; mating; strategy,,-1
rhxr2m,RetardiranaVeverica,thought,,-1
rhxpp0,creekcrystall,feel; upgrade; better; girlfriend; become; successful; leave,celebrity; athlete; know; steve; harvey; come; mind; would; like; know; look; previous; woman; prior; success; average; couple; pound; heavier; stayed; thick; thin; problem; feel; like; match; amount; surgery; really; make; want; would; leave,-1
rhx26e,Dusty-king,something; automatically; make; woman; attractive,,-1
rhvycd,RandomRedditGuy322,society; fooled; convincing; somehow; winner; ultimately; settled; aging; woman,think; heard; something; like; life; care; whether; ignored; young; marriage; kid; winner; complete; utter; nonsense; definition; described; winning; want; know; winning; winning; buying; lucky; lotto; ticket; getting; winning; going; gameshow; winning; want; know; winning; getting; marry; girl; already; plowed; dude; realizes; beginning; literally; settling; realized; prime; ended; window; child; rapidly; closing; word; looking; meal; ticket; case; single; male; winning; anything; receiving; leftover; alpha; fact; aging; woman; winning; receiving; free; insurance; policy; form; marriage; legally; protects; financially; giving; child; protect; retirement; get; nothing; get; settled; aging; woman; option; fertility; look; window; close; would; better; dedicating; resource; wanted; child; simply; surrogate; keep; resource; within; family; need; complete; loser; taking; leftover; equation; focus; real; winning; look; like,-1
rhvmnb,Significant-Wait-121,woman; physically; attractive; woman; find; woman; better; looking; le; likely; find; good; looking,true; woman; conventionally; attractive; psychologytoday; blog; scientific; fundamentalist; woman; beautiful; news; evolution; make; woman; attractive; discovermagazine; health; woman; getting; better; looking; according; discover; article; study; found; attractive; parent; likely; daughter; le; likely; son; attractive; parent; likely; give; birth; child; grow; attractive; adult; mean; woman; getting; hotter; hotter; study; found; people; rated; woman; physically; attractive; according; psychology; today; article; prior; study; showed; woman; average; physically; attractive; japan; united; state; study; called; effect; aging; facial; attractiveness; uptodate; woman; rated; woman; face; attractive; face; rated; face; attractive; woman; rated; face; woman; rated; older; woman; middle; aged; woman; face; attractive; although; slight; difference; older; woman; average; year; additionally; research; shown; many; woman; totally; straight; news; health; woman; usually; mostly; aroused; gender; compared; minority; straight; woman; woman; likely; identify; bisexual; information; proof; woman; likely; attractive; likely; ugly; survey; sample; selected; placed; unattractive; group; normal; group; attractive; group; case; woman; placed; unattractive; group; normal; group; attractive; group; survey; proportion; similar; placed; unattractive; group; normal; group; attractive; group; case; woman; placed; unattractive; group; normal; group; attractive; group; real; real; real; english,-1
rhv8eq,sottera777,everyone; talk; make; lv; value; exactly; make; woman; lv; value,,-1
rhugfv,autistictheory,woman; gurls; game,,-1
rhtvg9,nvkr_,creep; almost; always,basically; title; experience; encounter; creep; chance; extremely; high; creepy; pickup; line; hilarious; statement; woman; anatomy; woman; general; creepy; unsolicited; nude; whatever; underlying; reason; creepy; behavior; imagine; probably; education; come; dating; biology; affect; much; higher; degree; woman; interested; explanation,-1
rhskue,OldSimpsonsisbetter,trend; among; pillers; guy; manosphere; give; dating; woman,seems; trend; lately; people; pill; manosphere; space; give; stop; trying; dating; woman; among; pill; youtube; channel; rich; cooper; donovan; sharpe; alexander; grace; better; bachelor; darius; taylor; fiend; message; giving; seems; juice; worth; squeeze; dating; worth; better; forgetting; woman; altogether; content; churn; either; stats; rage; clickbait; story; confirm; belief; seems; like; pillers; mgtows; le; kind; strange; guy; seek; content; usually; fail; woman; want; improve; aspect; overriding; message; pill; content; creator; give; woman; think; many; pillers; guy; manosphere; giving; woman; dating,-1
rhr7gp,Neptune-Jr,would; woman; willing; date; worker,,-1
rt5dju,LackOf_Empathy,wake; reality,wake; reality; nothing; ever; go; planned; accursed; world; longer; live; realize; thing; truly; exist; reality; merely; pain; suffering; futility; listen; everywhere; look; world; wherever; light; always; shadow; found; long; concept; victor; vanquished; exist; selfish; intent; wanting; preserve; peace; initiate; hatred; born; order; protect; love; nexus; causal; relationship; separated,-1
rt59hd,TheBookOfSeil,believe; life; love,,-1
rt56kl,ahandtoyourdarknessx,pilled; since; subreddit,,-1
rt521l,FlakyImpact5838,obviously; called; insanely; pilled,actual; debate; blue; pilled; people; anymore; anyone; wanting; open; discussion; dating; ideal; pilled; people; agreeing; almost; everything; debate; everyone; agreeing; learning; anything; anyone; leave; aware; wanted; intended; good; older; post; link; would; great; thank,-1
rt4ytp,alfen-dave,street; talk; woman; know; please,thinking; often; shame; selfish; male; lover; guy; make; effort; please; partner; agree; shaming; right; context; think; mutual; sexual; pleasure; involves; good; communication; patience; understanding; body; thinking; back; brief; vivid; interaction; worker; year; undoubtlessly; enouncters; pleasing; warm; unsatisfactory; sense; feel; like; actual; connection; built; spose; night; stand; however; remember; thing; woman; know; unlike; casual; hook; past; partner; really; anything; received; best; oral; riding; life; sensation; skill; wise; anyway; often; shame; rapport; involves; pleasure; male; however; always; hear; guy; know; please; woman; want; skill; want; know; never; really; opposite; woman; guy; enough; experience; realize; massive; actual; sloppy; confident; oral; fiersome; riding; cheese; grating; starfish,-1
rt4ui2,yungthrowaway97,woman; foot; picture; thread,,-1
rt4tsz,no-regrets1999,chad; chance; becoming; chad; surgery; would; fare; better; castrate,,-1
rt4nf6,Chuckles131,redpillers; keep; rambling; lied; like; fault; naive,,424
rt4gec,TheHeroReditDeserves,shitbull; genocide; supporter; mega; thread,,-1
rt4cjq,ExtraBurdensomeCount,forbidden; topic; woman; massive; racial; preference; dating; large,study; fisman; iyengar; looked; racial; preference; speed; dating; columbia; mygsb; faculty; research; pubfiles; racialpreferences; abstract; bolding; mine; examine; racial; preference; dating; using; data; speed; dating; experiment; contrast; previous; study; methodology; allows; directly; observe; individual; decision; thus; easily; infer; whose; preference; lead; racial; segregation; romantic; relationship; moreover; richness; data; allows; identify; many; determinant; race; preference; find; female; exhibit; stronger; racial; preference; male; demonstrate; gender; difference; different; dating; goal; woman; exogenously; bringing; attention; possible; shared; interest; increase; willingness; date; people; race; subject; background; including; racial; composition; code; subject; grew; prevailing; racial; attitude; subject; state; origin; strongly; influence; desire; partner; race; older; subject; physically; attractive; subject; exhibit; weaker; race; preference; time; tinder; anything; solidified; preference; furthermore; experiment; conducted; self; selected; columbia; university; graduate; student; highly; progressive; group; individual; would; expect; much; higher; openness; experience; thus; willingness; date; race; general; public; author; actually; noticed; surprised; magnitude; effect; mentioned; multiple; time; paper; main; takeaway; standard; woman; least; likely; want; asian; relative; race; woman; choosy; general; however; preference; people; race; among; woman; preference; stronger; among; woman; interestingly; preference; attractiveness; author; wondered; whether; woman; found; certain; race; le; attractive; decided; control; result; asian; seen; least; attractive; black; white; hispanic; similar; attractiveness; rating; controlling; attractiveness; woman; still; exhibited; strong; racial; preference; meaning; white; woman; presented; white; asian; rated; would; likely; white; rather; asian; considering; result; highly; progressive; subsample; population; back; woman; preference; reasonable; dating; real; life; method; chance; present; person; conversation; made; decision; competing; guy; present; event; imagine; day; tinder; single; swipe; favour; area; convey; beyond; look; make; decision; short; probably; read; dating; apps; absolute; hellhole; unless; specific; type; woman; find; desirable,-1
rt48l2,Scrimmy_Bingus2,male; mostly; blackpilled,used; tinder; understand; type; match; vast; majority; watch; tiktoks; woman; praise; gigachads; shit; unattractive; anytime; someone; giving; bluepilled; advice; dating; always; nerdy; millennial; wife; college; back; something,-1
rt46wq,ahandtoyourdarknessx,woman; capable; love; experience; lust; therefore; perceived; mistreatment; justified; absolutely; essential,,-1
rt434c,E-2-butene,really; knowing; woman; sleep; around; accept; woman; past; complete; mystery,,-1
rt3zaj,King8Kaista,significantly; superficial; woman,woman; getting; le; aesthetic; hvm; getting; convince; range; quality; romantic; partner; woman; concerned; significantly; larger; concerned; applies; public; figure; look; past; present; relationship; remarkably; superficial; woman; implying; look; important; woman; look; subjective; many; people; think; think; trying; refute; post,-1
rt3qe7,xX_KatyM_xX,focused; manufacturing; doll; focused; biologically; engineering; alpha; chad; make; woman; happy,,-1
rt3pfg,ToughAnswers,woman; would; agree; often; better; couching; opinion; polite; womanese,,-1
rt3owf,termyterner,virgin; think; situation; regret; anyone; else; situation,female; kissed; life; taken; gotten; share; offer; year; never; taken; anyone; self; esteem; planned; virgin; till; marriage; want; atleast; committed; relationship; religious; reason; personal; month; sexually; active; child; long; distance; thing; worry; till; planning; meet; worried; brought; joking; given; answer; relationship; like; would; liked; feel; weird; bringing; feel; like; maybe; interested; relationship; hesitant; bringing; distance; know; would; work; sure; would; sure; give; interested; nervous; back; maybe; would; cause; lose; interest; question; really; think; clearly; would; like; hear; thought,-1
rt3ngv,nessaea-blue,picture; thread,post; anonymously; people; guess; main; post; main; fuck; left; give,-1
rt3g6l,ToughAnswers,woman; want; full; life; criminality; le; handicap; dickwetting; inhibition,,-1
rt3ceb,ahandtoyourdarknessx,tell; height; experience; tinder,disprove; gaslighting; woman; shorter; tell; experience; taller; tell; experience; maybe; match; bot; talked; nude; anything; like; conversation; quickly; fizzled; friend; separated; wife; rotation; girl; seeing,-1
rt38ro,TheHeroReditDeserves,inceldom; really; fault; supporting; selective; abortion; deal; incels; smash; patriarchy,,-1
rt32v8,TotalTravesty,blaming; mommy; woman; pathetic,enough; purge; week; everything; wrong; redpillcels; come; really; blaming; mom; especially; single; grown; able; dick; expect; tell; make; woman; start; example; mother; trying; blue; pill; trying; face; stupid; awkward; question; hope; figure; friend; know; like; everyone; else; little; know; would; grow; something; worse; something; lack; basic; responsibility; self; reliance; would; find; average; high; schooler,-1
rt2w2y,ToughAnswers,condomsex; really,,-1
rt2toy,Square_Inflation_534,rape; culture; encouraged; woman; pretend; want,basically; title; matter; scenario; stupidslutsclub; reddit; stupidslutsclub; made; maybe; maybe; besides; point; point; fact; woman; exist; knowing; source; rape; culture; really; mean; maybe; come; majority; woman; admitted; rape; fantasy; stupid; slut; club; fiction; doubt; research; exists; want; solve; rape; culture; stop; woman,-1
rt2s8d,superincongruent,chad; need; dumpster; dive,,-1
