post_id,author,title,body,image
r9l8c9,poppy_blu,would; fill; masculinity; void,going; make; like; hear; woman; perspective; appreciate; would; include; gender; response; perspective; basic; thesis; perspective; cultural; dismantling; traditional; masculinity; left; unfortunate; void; never; filled; concrete; alone; better; alternative; three; generation; chicken; come; home; roost; outlook; young; today; good; terrible; going; socioeconomic; hierarchy; would; recommendation; fill; void; think; extremist; among; agree; good; positive; element; traditional; masculinity; laid; rest; promotion; self; sacrifice; interest; expendable; tool; expand; power; privilege; foundation; honor; integrity; mean; expectation; rigid; conformity; intense; pressure; police; conformity; among; called; bashing; example; disrespect; unequal; treatment; woman; larger; paradigm; lower; social; hierarchy; rush; right; wrong; past; perhaps; enough; people; saying; supposed; replace; supposed; accept; past; teach; future; good; think; easy; accept; idea; figure; adjust; sexist; holding; past; want; continue; oppress; woman; benefit; think; sure; today; raise; son; actively; life; another; issue; anyway; much; could; cause; effect; feel; free; include; response; would; fill; void; could,-1
r9l67d,ToughAnswers,people; overall; know; gender; nature; sexuality; used,seems; used; kept; wrap; would; maybe; bubble; surface; occasion; swept; compelled; marriage; prior; generation; sexual; revolution; naive; gender; true; nature; sexuality; standard; youngin; hubris,-1
r9ju16,0_kohan,something; wrong; modern; western; face; much; sexlessness,western; facing; much; sexlessness; american; woman; going; must; something; wrong; developmental; characteristic; nature; outlook; temperament; modern; western; woman; perspective; make; sense; either; shrinking; dating; pool; much; maybe; something; wrong; either; woman; think; race; facing; issue; elsewhere; world; history; face; issue,-1
r9jr1e,comoeltiempo,make; fall; love; woman; besides; beauty,,-1
r9iivq,Protomize,simps; ruined; dating; market,tolerate; ounce; truly; desire; standing; ground; hoard; simps; willing; grant; wish; thanks; social; medium; online; dating; easy; simps; gain; reason; amazon; dominant; retailer; settle; higher; price; longer; ship; wait; time; smaller; retailer; amazon; likely; item; want; le; money; shipping,-1
r9bq3h,AutoModerator,daily; community; chat; megathread,daily; thread; designed; place; funny; discussion; feel; free; post; topic; question; information; point; view; thread; post; everything; think; warrant; thread; socialising; comment; automatically; sorted; post; throughout; people; comment; like; previous; daily; thread; click; reddit; purplepilldebate; search; subreddit; apurplepilldebate; author; aautomoderator; daily; community; chat; megathread; restrict; sort; please; join; discord; discord; mswdczfbfq; include; reddit; username; pill; color; relationship; status; gender; introduce; find; instagram; instagram; drgree; twitter; twitter; mrsdrgree,-1
r99or4,Sintience,faithful; neutered,,-1
r995s9,hamishgavin,long; distance; girlfriend; broke; still; miss; travel; friend,travel; would; like; uprooting; life; traveling; side; world; previously; guess; maybe; allow; though; boyfriend; hate; life; life; wanted; reason; travel; traveling; friend; zoned; shot; person; think,-1
r96xi3,FabulousFuchsbau,bodycount; still; wait,really; straight; answer; come; debate; pillers; think; damn; near; abuse; wait; complaint; woman; making; someone; wait; waited; considered; abusive; strictly; pill; teaching,-1
r95r7v,baresquad,deserve; type; girl; want,take; ideal; dating; prospect; check; box; everything; want; girlfriend; wife; partner; deserve; strict; want; need; dude; traditionalism; dude; cool; open; relationship; pill; prefer; commit; modest; woman; others; care; obviously; expect; want; answer; afraid; commitment; curious; everybody; else,-1
r94ea3,JimBeamAndCoke2016,news; report; outlawing; pestering; woman; street; bar; effect; daygame; cold; approaching,make; difference; make; harder; tier; turn; farce; metoo; became; agree; woman; need; protecting; predator; shitty; rejected; many; grey; area; knowing; easy; target,-1
r8z0c6,AutoModerator,evolutionary; psychology; mega; thread,read; good; research; paper; lately; academic; follow; field; theory; please; join; discord; discord; jjjwyynfmr; include; reddit; username; pill; color; gender; arrive; welcome; introduce; help; people; know; find; drgree; instagram; instagram; drgree; twitter; twitter; mrsdrgree; notification; good; thread; posted,-1
r8ys7a,ogsimpology,detaching; love; biggest; reason; high; count; woman; usually; avoided; serious; relationship,soon; woman; cut; connection; heart; loses; potential; wife; card; woman; best; connection; consider; part; loving; relationship; partner; connection; devolves; anything; becomes; possible; cheating; valid; option; someone; else; breaking; relationship; mind; willing; hide; continue; deceiving; husband; really; loved; connected; love; resort; cheating; ending; relationship,-1
r8ygz2,wonderinaloudya,find; woman; strong; value,,-1
r8xwjf,BlindMaestro,history; matter; infidelity; tag; count; body; count; sexual; past; sexual; history; promiscuous; promiscuity,haselton; wrote; truism; psychology; best; predictor; future; behavior; past; behavior; le; true; realm; sexual; behavior; indeed; strongest; predictor; marital; infidelity; number; prior; partner; excerpt; archive; oguoz; bus; schmitt; annurev; psych; would; later; affirm; apparently; ass; evaluate; level; sexual; activity; woman; prior; long; term; commitment; behavior; would; observable; known; social; reputation; small; group; lifestyle; ancestor; past; behavior; good; predictor; future; behavior; large; number; partner; prior; marriage; statistical; predictor; infidelity; marriage; excerpt; archive; kinsey; psycnet; record; determined; woman; premarital; experience; likelier; engage; marital; infidelity; excerpt; archive; borne; several; study; since; greater; number; partner; corresponding; higher; chance; infidelity; essock; vitale; mcguire; found; woman; reported; married; significantly; sexual; partner; woman; reported; extramarital; affair; excerpt; archive; whisman; snyder; surveyed; nearly; five; thousand; married; woman; determined; probability; sexual; infidelity; increase; number; lifetime; sexual; partner; high; increase; annual; prevalence; infidelity; additional; lifetime; sexual; partner; excerpt; archive; lsrip; however; treas; giesen; estimated; increase; odds; infidelity; additional; partner; age; first; marital; union; excerpt; archive; lsrip; study; premarital; sexual; behavior; affect; post; marital; adjustment; athanasiou; sarkin; found; respondent; reported; extensive; premarital; sexual; experience; generally; reported; extensive; extramarital; activity; number; premarital; partner; showing; positive; association; number; extramarital; partner; desire; engage; mate; swapping; activity; lower; marital; satisfaction; excerpt; archive; forste; tanfer; examined; sexual; exclusivity; among; dating; cohabiting; married; woman; found; unmarried; woman; partner; time; likely; secondary; partner; woman; previous; partner; married; woman; partner; likely; secondary; partner; excerpt; archive; deqyv; noted; category; wildly; skewed; woman; double; digit; number; partner; significantly; likely; stray; regnerus; book; google; book; cheap; html; jpexaqaacaaj; found; partner; likelier; cheat; married; partner; excerpt; archive; nibk; number; lifetime; sexual; partner; highly; correlated; marital; infidelity; relational; infidelity; feldman; cauffman; found; study; adolescent; sexual; permissiveness; promotes; sexual; activity; larger; number; partner; turn; increase; chance; sexual; betrayal; occur; excerpt; archive; buuue; study; infidelity; heterosexual; dating; couple; barta; kiene; found; individual; reporting; past; history; infidelity; tended; greater; number; sexual; partner; without; history; infidelity; excerpt; archive; gmpa; maddox; shaw; affirmed; number; prior; partner; predicted; future; extradyadic; sexual; activity; others; relationship; unmarried; heterosexual; couple; excerpt; archive; hughes; gallup; found; promiscuity; measured; number; sexual; partner; good; predictor; infidelity; woman; promiscuity; among; female; accounting; almost; twice; much; variance; infidelity; male; excerpt; archive; pinto; arantes; ajss; found; sexual; promiscuity; high; correlation; sexual; infidelity; high; correlation; emotional; infidelity; excerpt; archive; xliqs; study; female; twin; pair; cherkas; twin; affirmed; high; correlation; woman; promiscuity; infidelity; discovered; genetic; correlation; trait; nearly; half; gene; impacting; infidelity; affect; number; sexual; partner; excerpt; archive; fincham; copsyc; listed; greater; number; sexual; partner; list; demographic; factor; found; facilitate; infidelity; writing; permissive; attitude; toward; greater; willingness; casual; engage; without; closeness; commitment; love; unrestricted; sociosexual; orientation; reliably; related; infidelity; excerpt; archive; bailey; wrote; approximately; half; woman; scored; sociosexuality; wikipedia; wiki; sociosexuality; reported; cheated; steady; partner; fold; increase; woman; scored; bottom; excerpt; archive; uhgkf; though; likely; underestimate; woman; tend; underreport; sexual; indiscretion; running; value; general; social; survey; mcquivey; ifstudies; blog; road; infidelity; pass; multiple; sexual; partner; found; people; reported; four; fewer; lifetime; sexual; partner; rate; infidelity; current; marriage; dropped; five; sexual; partner; number; nearly; double; screenshot; archive; ldfal; relationship; consultant; author; licensed; marriage; family; therapist; athena; staik; archive; bprpy; placed; history; promiscuity; number; list; predictor; infidelity; gender; difference; psych; central; wikipedia; wiki; psych; central; popular; news; site; mental; health; professional; writing; contrary; myth; partner; many; partner; harder; easier; time; remaining; monogamous; significantly; risk; straying; little; prior; sexual; experience; excerpt; archive; buupy; taylor; kubota; archive; woao; journal; touch; researcher; zhana; vrangalova; archive; mhgj; learn; expert; consensus; article; number; sexual; partner; say; according; many; expert; matter; fair; amount; sexual; need; help; researcher; adjunct; professor; human; sexuality; zhana; vrangalova; examination; expert; found; number; mean; woman; relates; sexual; history; later; life; promiscuity; linked; higher; likelihood; cheating; long; term; serious; relationship; vrangalova; think; reason; many; promiscuous; people; really; built; monogamy; excerpt; archive; single; study; archive; relatively; smaller; sample; size; found; effect; significant; woman; evaluating; bias; detractor; seize; upon; ignore; dozen; study; demonstrating; extensive; sexual; history; strong; predictor; woman; infidelity,-1
r8xl2l,Glarkin42,irreligious; conservative; woman; exist,find; rather; unfortunate; dichotomy; western; woman; fall; broadly; group; either; liberal; religious; conservative; western; woman; psycho; bunch; jesus; shit; everywhere; many; western; conservative; maybe; service; religion; seem; ob; conservative; woman; make; important; pillar; life,-1
r8xeny,blurringvoid,power,,-1
r8whg0,BMTEJ,woman; always; held; high; standard,share; woman; past; high; average; always; resourceful; male; bred; woman; resource; case; could; resourcefulness; networking; hunting; farming; leading; thing; acquired; seen; valuable; evident; majority; advance; maintain; civilization; grow; optimist; look; born; good; thing; thing; going; change; physical; appearance; easier; ever; using; gym; plastic; surgery; knowledge; fact; switched; hunting; farming; individual; level; least; bartering; money; economics; easier; acquire; accumulate; note; physical; appearance; money; thing; door; least; open; keep; hygiene; dress; networking; social; status; personality; voice; inflection; based; type; woman; want; attract; hand; woman; internet; knowledge; dating; apps; faster; travel; optimize; strategy; finding; better; partner; downside; analysis; paralysis; choice; however; pessimist; could; simply; accept; maybe; majority; never; reproduce; bitter; despite; given; maximum; concentration; effort; mixed; frugalness; could; literally; increase; status; within; year; whereas; thousand; year; take; decade; looking; negative; woman; stance; could; accept; defeat; based; competition; larger; proportion; woman; smaller; supply; however; alter; physical; appearance; average; going; value; physical; appearance; anything; initially; holding; back; playing; higher; level; plastic; surgery; makeup; form; fitting; clothing; diet; wherever; need; meet; want; course; work; personality; hygiene; theguardian; science; woman; human; gene; pool; theguardian; science; woman; human; gene; pool; psmag; environment; reproductive; success; psmag; environment; reproductive; success; ncbi; article; ncbi; article; tierneylab; blog; nytimes; anything; good; tricky; question; tierneylab; blog; nytimes; anything; good; tricky; question,-1
r8v18j,rufinishedrudone,serious; black; love; white; woman; reverse; true,every; black; ever; seems; adore; white; woman; always; find; attractive; extremely; hard; find; black; find; attractive; reverse; true; white; hate; black; woman; grossed; idea; dating; explains; white; woman; naturally; better,-1
r8v0ym,Artistic_Guest4386,percent,think; percent; mean; literally; living; human; male; course; case; exclusive; human; male; datable; talking; percent; maybe; le; saying; every; woman; see; walking; around; find; viscerally; attractive; case; lady; much; rarer; like; guy; le; every; tenth; college; store; really; inspire; high; level; attraction; question; boiled; percent; actually; like,-1
r8uhte,ToughAnswers,many; modern; complaint; regard; lack; direction; unmarriageability; large; caused; disintegration; prop; provided; patriarchy,,-1
r8szz9,PerceptionTasty1495,woman; really; chasing; guy; league,admit; definitely; prone; thinking; logic; since; online; dating; site; woman; woman; choose; le; attractive; filter; common; value; personality; trait; therefore; woman; fails; find; relationship; unreasonable; standard; physical; appearance; terrible; personality; option; dating; apps; want; date,-1
r8sruj,rivetcitymayor,norm; talk; lack; charm; around,norm; mean; time; experience; observation; main; occurrence; thing; turn; woman; already; time; turn; woman; already; attracted; saying; right; thing; minority; although; believe; game; think; lack; game; detrimental; abundance; game; beneficial; mainly; half; game; wether; naturally; attracted,-1
r8s2hi,controversyonly,probably; worst; place; woman; type; message; girl; actually; meet; dating; apps,pretty; good; success; rate; meeting; girl; dating; apps; getting; meet; first; place; feel; extremely; hard; general; advice; get; thrown; around; find; something; profile; comment; girl; nothing; noteworthy; comment; profile; dead; conversation; like; nice; copy; paste; line; cute; enough; away; saying; stuff; like; sexually; charged; message; point; success; apps; message; girl; come; woman; said; matched; convince; meet; match,-1
r8r4p3,f1vepointoh,stopped; asking; woman,taken; break; dating; partying; however; life; kinda; feel; woman; trying; overly; nice; body; launguage; suggests; arent; nice; found; type; occurences; fill; craving; validation; would; previously; sleeping; around; woman; consequence; totally; woman; validation; dating; apps; make; feel; like; better; flirting; know; maybe; nice; life; never; woman; overly; nice; reason; woman; nice; reason; life; lean; drive; window; person; busy; morning; rush; behind; break; rule; male; customer; like; industry; like; dentistry; blindly; smile; hope; notice; dont; believe; people; care; enough; hospitality; overly; nice; especially; day; covid,-1
r8q5rf,Artistic_Guest4386,easily; girl; found; attractive,colleague; recently; gushed; come; work; talking; attractive; look; soon; posted; real; simple; innocent; clip; instagram; jokingly; singing; along; something; colleague; said; dont; think; good; looking; obviously; meants; lost; attraction; interesting; easily; noticed; girl; lose; attraction; almost; nothing; minefield; delicate; think; female; attraction; towards; male,-1
r8l5ly,Easteuroblondie,lion; mating; habit; worst; nightmare,many; people; think; lion; think; male; get; ton; female; woman; work; true; male; lion; hard; shitty; thing; female; lion; completely; self; sufficient; need; protection; formidable; opponent; male; lion; female; considered; better; hunter; often; hunt; collaboratively; female; male; lion; fight; female; many; keep; fighting; past; prime; female; lion; basically; indifferent; male; uncommon; female; lion; kill; male; feel; weak; sire; pride; female; lion; care; thing; thing; really; care; offspring; care; procreating; strongest; male; period; young; lion; male; challenge; win; pride; female; lion; must; approve; male; kill; cub; previous; male; make; batch; raise; like; nothing; ever; happened; unless; course; stronger; male; come; around,-1
r8kxd5,blurringvoid,read; comment; saying; woman; entitled; wonder; actually; entitled,,-1
r8ktq8,AutoModerator,daily; community; chat; megathread,daily; thread; designed; place; funny; discussion; feel; free; post; topic; question; information; point; view; thread; post; everything; think; warrant; thread; socialising; comment; automatically; sorted; post; throughout; people; comment; like; previous; daily; thread; click; reddit; purplepilldebate; search; subreddit; apurplepilldebate; author; aautomoderator; daily; community; chat; megathread; restrict; sort; please; join; discord; discord; mswdczfbfq; include; reddit; username; pill; color; relationship; status; gender; introduce; find; instagram; instagram; drgree; twitter; twitter; mrsdrgree,-1
r8ki4h,Cookiecuttermaxy,pilled; come; starting; become; indifferent; towards; slut; shaming,,-1
r8gllf,Kimberlythehoe,looking; good; time,,-1
r8gjex,RandomRedditGuy322,woman; demand; traditional; nothing; traditional; woman; source; dating; woe,,-1
r8gbye,generalbrix,different; communicating; forced; change,bunch; post; menslib; mainstream; culture; keep; shoving; throat; learn; communicate; better; share; feeling; whatnot; normal; human; able; express; feeling; sex; differently; case; biologically; psychologically; historically; culture; heading; towards; breeding; express; feeling; like; woman; woman; whole; internet; specie; grown; thought; express; dialogue; communication; empathy; dialogue; emotional; purpose; absolutely; used; slippery; slope; lead; confused; face; potentially; face; survive; thrive; flying; color; used; emotional; reciprocity; dialogue; work; feeling; feeling; entirely; natural; believe; different; process; wake; call; strengthen; body; soul; mind; self; improvement; alone; without; corruption; societal; emotional; baggage; entirely; different; woman; generally; thrive; emotional; reciprocity; communicate; bending; reality; create; smaller; simulation; activate; similar; realistic; situation; narratively; mind; individual; space; using; stop; trying; change; help; shit; present; argument; happy; debate,-1
r8ewoi,Ok-Talk-4303,starting; friend; dating,confused; matter; read; numerous; time; apparently; shitty; thing; friend; girl; make; move; feel; deceived; pretending; friend; meanwhile; hear; woman; prefer; start; friend; move; relationship; always; done; dealing; set; disjoint; woman; judge; thing; differently; said; process; done; another; result; strongly; different; result,-1
rm7qyq,Responsible_File_529,,came; across; model; area; woman; relationship; crimson; cure; youtube; channel; uccj; dffwfruqfq; seen; example; relationship; looking; back; failed; relationship; area; deciding; factor; ending; relationship; challenging,-1
rm7pud,Responsible_File_529,,came; across; model; area; woman; relationship; crimson; cure; youtube; channel; uccj; dffwfruqfq; seen; example; relationship; looking; back; failed; relationship; area; deciding; factor; ending; relationship; challenging,-1
rm4un3,Visible-Doughnut-782,important; status; partner,,-1
rm4qj2,SnooCats37,floor; thinking,want; marry; virgin; want; able; sleep; around; look; woman; virgin; floor; thought; process; woman; saved; marriage; would; multiple; sexual; partner; genuinely; way; shame; woman; virgin; want; able; sleep; around,-1
rm30hr,SpicyHotTake,feel; people; fulfill; typical; gender; role,watching; jordan; peterson; conversation; shapiro; mentioned; born; feminine; temperament; vice; versa; woman; born; male; temperament; said; nothing; wrong; agree; feminine; temperament; wondering; different; pill; think; alright; feminine; fill; provider; role; masculine; woman; fill,-1
rm2t06,CimZim,would; alter; dating; advice; woman,yesterday; undersupervixen; created; asking; edit; relatively; famous; controversial; dating; advice; woman; comment; talking; thing; agreed; disagreed; thought; cool; male; member; would; alter; advice; looking; life; partner; advice; woman; date; boy; cool; boy; commitment; phobic; boy; crazy; boy; marry; thing; make; boy; sexy; make; good; husband; come; time; settle; find; someone; want; equal; partner; someone; think; woman; smart; opinionated; ambitious; someone; value; fairness; expects; better; want; share; home; exist; trust; time; nothing; sexier; think; guy; anything; would; change; quote; flair; already; state; pill; follow,-1
